rank,Article title,url,title_with_link
1,‘We got him’: Utah governor confirms arrest of suspect in Charlie Kirk killing,https://www.ctvnews.ca/video/2025/09/12/we-got-him-utah-governor-confirms-arrest-of-suspect-in-charlie-kirk-killing/,"<a href=""https://www.ctvnews.ca/video/2025/09/12/we-got-him-utah-governor-confirms-arrest-of-suspect-in-charlie-kirk-killing/"">‘We got him’: Utah governor confirms arrest of suspect in Charlie Kirk killing</a>"
2,"Windsor, Michigan police working together on sexual assault and kidnapping case",https://www.ctvnews.ca/video/2025/09/12/windsor-michigan-police-working-together-on-sexual-assault-and-kidnapping-case/,"<a href=""https://www.ctvnews.ca/video/2025/09/12/windsor-michigan-police-working-together-on-sexual-assault-and-kidnapping-case/"">Windsor, Michigan police working together on sexual assault and kidnapping case</a>"
3,‘No way!’: Townsend reacts to Trump’s claims Russian drones invading Poland was an accident,https://www.ctvnews.ca/video/2025/09/12/no-way-townsend-reacts-to-trumps-claims-russian-drones-invading-poland-was-an-accident/,"<a href=""https://www.ctvnews.ca/video/2025/09/12/no-way-townsend-reacts-to-trumps-claims-russian-drones-invading-poland-was-an-accident/"">‘No way!’: Townsend reacts to Trump’s claims Russian drones invading Poland was an accident</a>"
4,"‘He’s got a knife, he’s in the garage’: Chilling 911 call and video in Bowmanville, Ont. home invasion",https://www.ctvnews.ca/toronto/video/2025/09/12/hes-got-a-knife-hes-in-the-garage-chilling-911-call-and-video-in-bowmanville-home-invasion/,"<a href=""https://www.ctvnews.ca/toronto/video/2025/09/12/hes-got-a-knife-hes-in-the-garage-chilling-911-call-and-video-in-bowmanville-home-invasion/"">‘He’s got a knife, he’s in the garage’: Chilling 911 call and video in Bowmanville, Ont. home invasion</a>"
5,"Student, teacher get in physical altercation over cell phone in the classroom",https://www.ctvnews.ca/video/2025/09/12/student-teacher-get-in-physical-altercation-over-cell-phone-in-the-classroom/,"<a href=""https://www.ctvnews.ca/video/2025/09/12/student-teacher-get-in-physical-altercation-over-cell-phone-in-the-classroom/"">Student, teacher get in physical altercation over cell phone in the classroom</a>"
6,Investigation turns to finding suspect’s motive in the Charlie Kirk shooting,https://www.ctvnews.ca/video/2025/09/12/investigation-turns-to-finding-suspects-motive-in-the-charlie-kirk-shooting/,"<a href=""https://www.ctvnews.ca/video/2025/09/12/investigation-turns-to-finding-suspects-motive-in-the-charlie-kirk-shooting/"">Investigation turns to finding suspect’s motive in the Charlie Kirk shooting</a>"
7,More Canadian seniors finding themselves unhoused: study,https://www.ctvnews.ca/video/2025/09/12/more-canadian-seniors-finding-themselves-unhoused-study/,"<a href=""https://www.ctvnews.ca/video/2025/09/12/more-canadian-seniors-finding-themselves-unhoused-study/"">More Canadian seniors finding themselves unhoused: study</a>"
8,Family of suspect turning him in an ‘interesting twist’ in the investigation: former FBI analyst,https://www.ctvnews.ca/video/2025/09/12/family-of-suspect-turning-him-in-an-interesting-twist-in-the-investigation-former-fbi-analyst/,"<a href=""https://www.ctvnews.ca/video/2025/09/12/family-of-suspect-turning-him-in-an-interesting-twist-in-the-investigation-former-fbi-analyst/"">Family of suspect turning him in an ‘interesting twist’ in the investigation: former FBI analyst</a>"
