rank,Article title,url,title_with_link
1,Canadian swimmer Penny Oleksiak given two-year ban for violating doping rules,https://www.ctvnews.ca/video/2025/11/25/ctv-national-news-canadian-swimmer-penny-oleksiak-given-two-year-ban-for-violating-doping-rules/,"<a href=""https://www.ctvnews.ca/video/2025/11/25/ctv-national-news-canadian-swimmer-penny-oleksiak-given-two-year-ban-for-violating-doping-rules/"">Canadian swimmer Penny Oleksiak given two-year ban for violating doping rules</a>"
2,"Alberta might finally get its pipeline, but B.C. stands in its way",https://www.ctvnews.ca/video/2025/11/25/ctv-national-news-alberta-might-finally-get-its-pipeline-but-bc-stands-in-its-way/,"<a href=""https://www.ctvnews.ca/video/2025/11/25/ctv-national-news-alberta-might-finally-get-its-pipeline-but-bc-stands-in-its-way/"">Alberta might finally get its pipeline, but B.C. stands in its way</a>"
3,Does B.C. have any authority to potentially block an Alberta pipeline?,https://www.ctvnews.ca/video/2025/11/25/ctv-national-news-does-bc-have-any-authority-to-potentially-block-an-alberta-pipeline/,"<a href=""https://www.ctvnews.ca/video/2025/11/25/ctv-national-news-does-bc-have-any-authority-to-potentially-block-an-alberta-pipeline/"">Does B.C. have any authority to potentially block an Alberta pipeline?</a>"
4,More Americans seeking Canadian citizenship after a new bill makes it easier,https://www.ctvnews.ca/video/2025/11/25/ctv-national-news-more-americans-seeking-canadian-citizenship-after-a-new-bill-makes-it-easier/,"<a href=""https://www.ctvnews.ca/video/2025/11/25/ctv-national-news-more-americans-seeking-canadian-citizenship-after-a-new-bill-makes-it-easier/"">More Americans seeking Canadian citizenship after a new bill makes it easier</a>"
5,Curling legend and broadcaster Colleen Jones dead at 65,https://www.ctvnews.ca/video/2025/11/25/ctv-national-news-curling-legend-and-broadcaster-colleen-jones-dead-at-65/,"<a href=""https://www.ctvnews.ca/video/2025/11/25/ctv-national-news-curling-legend-and-broadcaster-colleen-jones-dead-at-65/"">Curling legend and broadcaster Colleen Jones dead at 65</a>"
6,14 UCP MLAs now facing recall petitions in Alberta,https://www.ctvnews.ca/edmonton/video/2025/11/26/14-ucp-mlas-now-facing-recall-petitions/,"<a href=""https://www.ctvnews.ca/edmonton/video/2025/11/26/14-ucp-mlas-now-facing-recall-petitions/"">14 UCP MLAs now facing recall petitions in Alberta</a>"
7,Ontario woman scammed out of $28K from contractor after walkout apartment is left incomplete,https://www.ctvnews.ca/toronto/video/2025/11/25/ontario-woman-scammed-out-of-28k-from-contractor-after-walkout-apartment-is-left-incomplete/,"<a href=""https://www.ctvnews.ca/toronto/video/2025/11/25/ontario-woman-scammed-out-of-28k-from-contractor-after-walkout-apartment-is-left-incomplete/"">Ontario woman scammed out of $28K from contractor after walkout apartment is left incomplete</a>"
8,Lotto winner faces charges after not splitting winnings with a group,https://www.ctvnews.ca/video/2025/11/25/ctv-national-news-lotto-winner-faces-charges-after-not-splitting-winnings-with-a-group/,"<a href=""https://www.ctvnews.ca/video/2025/11/25/ctv-national-news-lotto-winner-faces-charges-after-not-splitting-winnings-with-a-group/"">Lotto winner faces charges after not splitting winnings with a group</a>"
