rank,Article title,url,title_with_link
1,"LIVE: Battle River-Crowfoot byelection debate in Camrose, Alta.",https://www.ctvnews.ca/video/live/2025/07/29/live-battle-river-crowfoot-byelection-debate-in-camrose-alta/,"<a href=""https://www.ctvnews.ca/video/live/2025/07/29/live-battle-river-crowfoot-byelection-debate-in-camrose-alta/"">LIVE: Battle River-Crowfoot byelection debate in Camrose, Alta.</a>"
2,Katy Perry set to take stage in Ottawa as fans react to dinner date with Justin Trudeau,https://www.ctvnews.ca/video/2025/07/29/katy-perry-set-to-take-stage-in-ottawa-as-fans-react-to-dinner-date-with-justin-trudeau/,"<a href=""https://www.ctvnews.ca/video/2025/07/29/katy-perry-set-to-take-stage-in-ottawa-as-fans-react-to-dinner-date-with-justin-trudeau/"">Katy Perry set to take stage in Ottawa as fans react to dinner date with Justin Trudeau</a>"
3,U.K. says it will recognize Palestinian state unless Israel ends war and addresses starvation in Gaza,https://www.ctvnews.ca/video/2025/07/29/ctv-national-news-the-uks-ultimatum-to-israel-over-war-in-gaza/,"<a href=""https://www.ctvnews.ca/video/2025/07/29/ctv-national-news-the-uks-ultimatum-to-israel-over-war-in-gaza/"">U.K. says it will recognize Palestinian state unless Israel ends war and addresses starvation in Gaza</a>"
4,‘You’re rewarding Hamas if you do that’: Trump on U.K. recognizing Palestinian statehood,https://www.ctvnews.ca/video/2025/07/29/youre-rewarding-hamas-if-you-do-that-trump-on-uk-recognizing-palestinian-statehood/,"<a href=""https://www.ctvnews.ca/video/2025/07/29/youre-rewarding-hamas-if-you-do-that-trump-on-uk-recognizing-palestinian-statehood/"">‘You’re rewarding Hamas if you do that’: Trump on U.K. recognizing Palestinian statehood</a>"
5,U.K. recognizing Palestinian statehood would ‘change the paradigm’: Sir Vincent Fean,https://www.ctvnews.ca/video/2025/07/29/uk-recognizing-palestinian-statehood-would-change-the-paradigm-sir-vincent-fean/,"<a href=""https://www.ctvnews.ca/video/2025/07/29/uk-recognizing-palestinian-statehood-would-change-the-paradigm-sir-vincent-fean/"">U.K. recognizing Palestinian statehood would ‘change the paradigm’: Sir Vincent Fean</a>"
6,What the gunman's note revealed about a possible motive for a mass shooting in NYC,https://www.ctvnews.ca/video/2025/07/29/ctv-national-news-what-the-nyc-gunmans-note-reveals-about-his-motives/,"<a href=""https://www.ctvnews.ca/video/2025/07/29/ctv-national-news-what-the-nyc-gunmans-note-reveals-about-his-motives/"">What the gunman's note revealed about a possible motive for a mass shooting in NYC</a>"
7,Here's why former PM Stephen Harper says tariffs weakens the 'free world' and the U.S.,https://www.ctvnews.ca/video/2025/07/29/ctv-national-news-messages-of-optimism-ahead-of-deadline-for-us-canada-trade-deal/,"<a href=""https://www.ctvnews.ca/video/2025/07/29/ctv-national-news-messages-of-optimism-ahead-of-deadline-for-us-canada-trade-deal/"">Here's why former PM Stephen Harper says tariffs weakens the 'free world' and the U.S.</a>"
8,"Dramatic video shows car plowing into London, Ont. grocery store",https://www.ctvnews.ca/london/video/2025/07/29/dramatic-video-shows-car-drive-grocery-store/,"<a href=""https://www.ctvnews.ca/london/video/2025/07/29/dramatic-video-shows-car-drive-grocery-store/"">Dramatic video shows car plowing into London, Ont. grocery store</a>"
