rank,Article title,url,title_with_link
1,Liberals gain majority government with Toronto riding win,https://www.ctvnews.ca/video/2026/04/14/liberals-gain-majority-government-with-toronto-riding-win/,"<a href=""https://www.ctvnews.ca/video/2026/04/14/liberals-gain-majority-government-with-toronto-riding-win/"">Liberals gain majority government with Toronto riding win</a>"
2,New Brunswick woman e-transfers more than $3.5K to wrong person,https://www.ctvnews.ca/atlantic/video/2026/04/13/nb-woman-accidentally-sends-thousands-to-wrong-email/,"<a href=""https://www.ctvnews.ca/atlantic/video/2026/04/13/nb-woman-accidentally-sends-thousands-to-wrong-email/"">New Brunswick woman e-transfers more than $3.5K to wrong person</a>"
3,Liberals hold University–Rosedale as Danielle Martin wins easily,https://www.ctvnews.ca/video/2026/04/13/ctv-national-news-liberals-hold-universityrosedale-as-danielle-martin-wins-easily/,"<a href=""https://www.ctvnews.ca/video/2026/04/13/ctv-national-news-liberals-hold-universityrosedale-as-danielle-martin-wins-easily/"">Liberals hold University–Rosedale as Danielle Martin wins easily</a>"
4,Doly Begum win highlights Liberals’ reach under Carney and secures majority,https://www.ctvnews.ca/video/2026/04/13/ctv-national-news-doly-begum-win-highlights-liberals-reach-under-carney-and-secures-majority/,"<a href=""https://www.ctvnews.ca/video/2026/04/13/ctv-national-news-doly-begum-win-highlights-liberals-reach-under-carney-and-secures-majority/"">Doly Begum win highlights Liberals’ reach under Carney and secures majority</a>"
5,A short history of Canadian floor-crossers,https://www.ctvnews.ca/video/2026/04/13/a-short-history-of-canadian-floor-crossers/,"<a href=""https://www.ctvnews.ca/video/2026/04/13/a-short-history-of-canadian-floor-crossers/"">A short history of Canadian floor-crossers</a>"
6,Katy Perry and Justin Trudeau share a moment at Coachella,https://www.ctvnews.ca/video/2026/04/13/katy-perry-and-justin-trudeau-share-a-moment-at-coachella/,"<a href=""https://www.ctvnews.ca/video/2026/04/13/katy-perry-and-justin-trudeau-share-a-moment-at-coachella/"">Katy Perry and Justin Trudeau share a moment at Coachella</a>"
7,"U.S. launches sweeping blockade of Iranian ports, raising global concerns",https://www.ctvnews.ca/video/2026/04/13/ctv-national-news-us-launches-sweeping-blockade-of-iranian-ports-raising-global-concerns/,"<a href=""https://www.ctvnews.ca/video/2026/04/13/ctv-national-news-us-launches-sweeping-blockade-of-iranian-ports-raising-global-concerns/"">U.S. launches sweeping blockade of Iranian ports, raising global concerns</a>"
8,Masters issues first-ever conduct warning after Sergio Garcia breaks his driver on the tee box,https://www.ctvnews.ca/video/2026/04/13/watch-sergio-garcia-slams-his-driver-in-frustration-on-the-tee-box-at-the-masters/,"<a href=""https://www.ctvnews.ca/video/2026/04/13/watch-sergio-garcia-slams-his-driver-in-frustration-on-the-tee-box-at-the-masters/"">Masters issues first-ever conduct warning after Sergio Garcia breaks his driver on the tee box</a>"
