rank,Article title,url,title_with_link
1,Watch an L.A. mom slam her SUV into burglars’ getaway car after they targeted her home,https://www.ctvnews.ca/video/2025/12/23/watch-an-la-mom-slam-her-suv-into-burglars-getaway-car-after-they-targeted-her-home/,"<a href=""https://www.ctvnews.ca/video/2025/12/23/watch-an-la-mom-slam-her-suv-into-burglars-getaway-car-after-they-targeted-her-home/"">Watch an L.A. mom slam her SUV into burglars’ getaway car after they targeted her home</a>"
2,Regina family trying to recover $5K lost through etransfer notification scam,https://www.ctvnews.ca/regina/video/2025/12/23/regina-family-trying-to-recover-5k-lost-through-etransfer-scam/,"<a href=""https://www.ctvnews.ca/regina/video/2025/12/23/regina-family-trying-to-recover-5k-lost-through-etransfer-scam/"">Regina family trying to recover $5K lost through etransfer notification scam</a>"
3,These are the new carbon monoxide detector laws coming to Ontario in 2026,https://www.ctvnews.ca/windsor/video/2025/12/22/new-carbon-monoxide-detector-laws-coming-in-2026/,"<a href=""https://www.ctvnews.ca/windsor/video/2025/12/22/new-carbon-monoxide-detector-laws-coming-in-2026/"">These are the new carbon monoxide detector laws coming to Ontario in 2026</a>"
4,Here are changes coming to some popular rewards programs in Canada,https://www.ctvnews.ca/montreal/video/2025/12/23/changes-coming-to-rewards-programs/,"<a href=""https://www.ctvnews.ca/montreal/video/2025/12/23/changes-coming-to-rewards-programs/"">Here are changes coming to some popular rewards programs in Canada</a>"
5,$70 million lottery winner hands out grocery gift cards to shoppers in Ottawa,https://www.ctvnews.ca/ottawa/video/2025/12/22/ottawa-lottery-winner-making-sure-neighbours-dont-go-hungry/,"<a href=""https://www.ctvnews.ca/ottawa/video/2025/12/22/ottawa-lottery-winner-making-sure-neighbours-dont-go-hungry/"">$70 million lottery winner hands out grocery gift cards to shoppers in Ottawa</a>"
6,"Luxury home in Vaughan, Ont. goes up in flames",https://www.ctvnews.ca/toronto/video/2025/12/23/luxury-home-in-vaughan-goes-up-in-flames/,"<a href=""https://www.ctvnews.ca/toronto/video/2025/12/23/luxury-home-in-vaughan-goes-up-in-flames/"">Luxury home in Vaughan, Ont. goes up in flames</a>"
7,AI generated images raise concerns as reality becomes harder to trust,https://www.ctvnews.ca/video/2025/12/22/ctv-national-news-ai-generated-images-raise-concerns-as-reality-becomes-harder-to-trust/,"<a href=""https://www.ctvnews.ca/video/2025/12/22/ctv-national-news-ai-generated-images-raise-concerns-as-reality-becomes-harder-to-trust/"">AI generated images raise concerns as reality becomes harder to trust</a>"
8,Search for answers after 11-year-old boy dies from carbon monoxide leak at Regina apartment,https://www.ctvnews.ca/regina/video/2025/12/23/one-dead-after-carbon-monoxide-leak-at-regina-apartment/,"<a href=""https://www.ctvnews.ca/regina/video/2025/12/23/one-dead-after-carbon-monoxide-leak-at-regina-apartment/"">Search for answers after 11-year-old boy dies from carbon monoxide leak at Regina apartment</a>"
