rank,Article title,url,title_with_link
1,Plane clips light pole and truck on New Jersey Turnpike while landing,https://www.ctvnews.ca/video/2026/05/04/plane-clips-light-pole-and-truck-on-new-jersey-turnpike-while-landing/,"<a href=""https://www.ctvnews.ca/video/2026/05/04/plane-clips-light-pole-and-truck-on-new-jersey-turnpike-while-landing/"">Plane clips light pole and truck on New Jersey Turnpike while landing</a>"
2,Some celebrities are boycotting the Met Gala over Jeff Bezos’s involvement,https://www.ctvnews.ca/video/2026/05/04/some-celebrities-are-boycotting-the-met-gala-over-jeff-bezoss-involvement/,"<a href=""https://www.ctvnews.ca/video/2026/05/04/some-celebrities-are-boycotting-the-met-gala-over-jeff-bezoss-involvement/"">Some celebrities are boycotting the Met Gala over Jeff Bezos’s involvement</a>"
3,"2026 Canadian Census forms are out, and here’s why Canadians are being encouraged to complete it",https://www.ctvnews.ca/video/2026/05/04/2026-canadian-census-forms-are-out-and-heres-why-canadians-should-complete-it/,"<a href=""https://www.ctvnews.ca/video/2026/05/04/2026-canadian-census-forms-are-out-and-heres-why-canadians-should-complete-it/"">2026 Canadian Census forms are out, and here’s why Canadians are being encouraged to complete it</a>"
4,Big icebergs bring big business to Newfoundland’s tourism industry,https://www.ctvnews.ca/video/2026/05/04/ctv-national-news-big-icebergs-bring-big-business-to-newfoundlands-tourism-industry/,"<a href=""https://www.ctvnews.ca/video/2026/05/04/ctv-national-news-big-icebergs-bring-big-business-to-newfoundlands-tourism-industry/"">Big icebergs bring big business to Newfoundland’s tourism industry</a>"
5,Concerns about robotaxis coming to Ontario as technology still catches up,https://www.ctvnews.ca/video/2026/05/04/concerns-about-robotaxis-coming-to-ontario-as-technology-still-catches-up/,"<a href=""https://www.ctvnews.ca/video/2026/05/04/concerns-about-robotaxis-coming-to-ontario-as-technology-still-catches-up/"">Concerns about robotaxis coming to Ontario as technology still catches up</a>"
6,Multiple people injured after shooting at a campground party in Oklahoma,https://www.ctvnews.ca/video/2026/05/04/multiple-people-injured-after-shooting-at-a-campground-party-in-oklahoma/,"<a href=""https://www.ctvnews.ca/video/2026/05/04/multiple-people-injured-after-shooting-at-a-campground-party-in-oklahoma/"">Multiple people injured after shooting at a campground party in Oklahoma</a>"
7,Why hantavirus carries a higher mortality rate and how it’s treated,https://www.ctvnews.ca/video/2026/05/04/why-hantavirus-carries-a-higher-mortality-rate-and-how-its-treated/,"<a href=""https://www.ctvnews.ca/video/2026/05/04/why-hantavirus-carries-a-higher-mortality-rate-and-how-its-treated/"">Why hantavirus carries a higher mortality rate and how it’s treated</a>"
8,What leverage does Canada have in CUSMA renegotiation?,https://www.ctvnews.ca/video/2026/05/04/ctv-national-news-what-leverage-does-canada-have-in-cusma-renegotiation/,"<a href=""https://www.ctvnews.ca/video/2026/05/04/ctv-national-news-what-leverage-does-canada-have-in-cusma-renegotiation/"">What leverage does Canada have in CUSMA renegotiation?</a>"
