rank,Article title,url,title_with_link
1,LIVE SOON: Air Canada press conference on looming flight attendant strike,https://www.ctvnews.ca/video/live/2025/07/16/live-soon-air-canada-press-conference-on-looming-flight-attendant-strike/,"<a href=""https://www.ctvnews.ca/video/live/2025/07/16/live-soon-air-canada-press-conference-on-looming-flight-attendant-strike/"">LIVE SOON: Air Canada press conference on looming flight attendant strike</a>"
2,No charges against Florida deputy who punched Black driver in the face during traffic stop,https://www.ctvnews.ca/video/2025/08/14/no-charges-against-florida-deputy-who-punched-black-driver-in-the-face-during-traffic-stop/,"<a href=""https://www.ctvnews.ca/video/2025/08/14/no-charges-against-florida-deputy-who-punched-black-driver-in-the-face-during-traffic-stop/"">No charges against Florida deputy who punched Black driver in the face during traffic stop</a>"
3,LIVE SOON: Poilievre delivers remarks in Saskatchewan,https://www.ctvnews.ca/video/live/2025/08/13/live-soon-poilievre-delivers-remarks-in-saskatchewan/,"<a href=""https://www.ctvnews.ca/video/live/2025/08/13/live-soon-poilievre-delivers-remarks-in-saskatchewan/"">LIVE SOON: Poilievre delivers remarks in Saskatchewan</a>"
4,"Dumped, uneaten Happy Meals litter Japanese streets after McDonald’s collaboration with Pokémon",https://www.ctvnews.ca/video/2025/08/14/dumped-uneaten-happy-meals-litter-japanese-streets-after-mcdonalds-collaboration-with-pokemon/,"<a href=""https://www.ctvnews.ca/video/2025/08/14/dumped-uneaten-happy-meals-litter-japanese-streets-after-mcdonalds-collaboration-with-pokemon/"">Dumped, uneaten Happy Meals litter Japanese streets after McDonald’s collaboration with Pokémon</a>"
5,L.A. man says he’s been blaring a train horn for weeks because ‘his life is on the line’,https://www.ctvnews.ca/video/2025/08/14/la-man-says-hes-been-blaring-a-train-horn-for-weeks-because-his-life-is-on-the-line/,"<a href=""https://www.ctvnews.ca/video/2025/08/14/la-man-says-hes-been-blaring-a-train-horn-for-weeks-because-his-life-is-on-the-line/"">L.A. man says he’s been blaring a train horn for weeks because ‘his life is on the line’</a>"
6,Couple restores 1840s log cabin they bought off a ‘weird section of eBay’,https://www.ctvnews.ca/video/2025/08/14/its-been-a-labour-of-love-couple-restores-1840s-log-cabin-they-bought-off-ebay/,"<a href=""https://www.ctvnews.ca/video/2025/08/14/its-been-a-labour-of-love-couple-restores-1840s-log-cabin-they-bought-off-ebay/"">Couple restores 1840s log cabin they bought off a ‘weird section of eBay’</a>"
7,Man with multiple DUIs allegedly crashes work truck through the front of Texas family’s home,https://www.ctvnews.ca/video/2025/08/14/this-cant-be-real-truck-crashes-through-the-front-of-texas-home/,"<a href=""https://www.ctvnews.ca/video/2025/08/14/this-cant-be-real-truck-crashes-through-the-front-of-texas-home/"">Man with multiple DUIs allegedly crashes work truck through the front of Texas family’s home</a>"
8,"Parents warned about new violent, extremist network targeting young teens",https://www.ctvnews.ca/video/2025/08/14/ctv-national-news-parents-warned-about-new-violent-extremist-network-targeting-young-teens/,"<a href=""https://www.ctvnews.ca/video/2025/08/14/ctv-national-news-parents-warned-about-new-violent-extremist-network-targeting-young-teens/"">Parents warned about new violent, extremist network targeting young teens</a>"
