rank,Article title,url,title_with_link
1,Charlie Kirk investigation: What is known about the suspect arrested?,https://www.ctvnews.ca/video/2025/09/12/ctv-national-news-what-is-known-about-the-suspect-arrested/,"<a href=""https://www.ctvnews.ca/video/2025/09/12/ctv-national-news-what-is-known-about-the-suspect-arrested/"">Charlie Kirk investigation: What is known about the suspect arrested?</a>"
2,‘We got him’: Utah governor confirms arrest of suspect in Charlie Kirk killing,https://www.ctvnews.ca/video/2025/09/12/we-got-him-utah-governor-confirms-arrest-of-suspect-in-charlie-kirk-killing/,"<a href=""https://www.ctvnews.ca/video/2025/09/12/we-got-him-utah-governor-confirms-arrest-of-suspect-in-charlie-kirk-killing/"">‘We got him’: Utah governor confirms arrest of suspect in Charlie Kirk killing</a>"
3,Counter-protesters and ‘Canada First’ rally clash in Toronto,https://www.ctvnews.ca/video/2025/09/14/ctv-national-news-counter-protesters-and-canada-first-rally-clash-in-toronto/,"<a href=""https://www.ctvnews.ca/video/2025/09/14/ctv-national-news-counter-protesters-and-canada-first-rally-clash-in-toronto/"">Counter-protesters and ‘Canada First’ rally clash in Toronto</a>"
4,PM Carney expected to table a new bill to tackle hate-related crime in Canada,https://www.ctvnews.ca/video/2025/09/14/ctv-national-news-pm-carney-expected-to-table-a-new-bill-to-tackle-hate-related-crime-in-canada/,"<a href=""https://www.ctvnews.ca/video/2025/09/14/ctv-national-news-pm-carney-expected-to-table-a-new-bill-to-tackle-hate-related-crime-in-canada/"">PM Carney expected to table a new bill to tackle hate-related crime in Canada</a>"
5,Graphic video of Charlie Kirk’s death sparks debates on content moderation,https://www.ctvnews.ca/video/2025/09/14/ctv-national-news-graphic-video-of-charlie-kirks-death-sparks-debates-on-content-moderation/,"<a href=""https://www.ctvnews.ca/video/2025/09/14/ctv-national-news-graphic-video-of-charlie-kirks-death-sparks-debates-on-content-moderation/"">Graphic video of Charlie Kirk’s death sparks debates on content moderation</a>"
6,Ottawa in a tough spot after Trump calls on NATO countries to sanction China,https://www.ctvnews.ca/video/2025/09/14/ctv-national-news-ottawa-in-a-tough-spot-after-trump-calls-on-nato-countries-to-sanction-china/,"<a href=""https://www.ctvnews.ca/video/2025/09/14/ctv-national-news-ottawa-in-a-tough-spot-after-trump-calls-on-nato-countries-to-sanction-china/"">Ottawa in a tough spot after Trump calls on NATO countries to sanction China</a>"
7,Mixed emotions as an artist no-shows for 'Sommo Festival' in P.E.I.,https://www.ctvnews.ca/video/2025/09/14/ctv-national-news-mixed-emotions-as-an-artist-no-shows-for-sommo-festival-in-pei/,"<a href=""https://www.ctvnews.ca/video/2025/09/14/ctv-national-news-mixed-emotions-as-an-artist-no-shows-for-sommo-festival-in-pei/"">Mixed emotions as an artist no-shows for 'Sommo Festival' in P.E.I.</a>"
8,Manitoba healthcare workers sound the alarm on rising violence in hospitals,https://www.ctvnews.ca/video/2025/09/14/ctv-national-news-manitoba-healthcare-workers-sound-the-alarm-on-rising-violence-in-hospitals/,"<a href=""https://www.ctvnews.ca/video/2025/09/14/ctv-national-news-manitoba-healthcare-workers-sound-the-alarm-on-rising-violence-in-hospitals/"">Manitoba healthcare workers sound the alarm on rising violence in hospitals</a>"
