rank,Article title,url,title_with_link
1,Energy expert warns Alberta-Ottawa pipeline plan faces tough road ahead,https://www.ctvnews.ca/video/2025/11/27/energy-expert-warns-alberta-ottawa-pipeline-plan-faces-tough-road-ahead/,"<a href=""https://www.ctvnews.ca/video/2025/11/27/energy-expert-warns-alberta-ottawa-pipeline-plan-faces-tough-road-ahead/"">Energy expert warns Alberta-Ottawa pipeline plan faces tough road ahead</a>"
2,Ottawa and Alberta strike landmark deal to fast-track new pipeline projects.,https://www.ctvnews.ca/video/2025/11/27/ottawa-and-alberta-strike-landmark-deal-to-fast-track-new-pipeline-projects/,"<a href=""https://www.ctvnews.ca/video/2025/11/27/ottawa-and-alberta-strike-landmark-deal-to-fast-track-new-pipeline-projects/"">Ottawa and Alberta strike landmark deal to fast-track new pipeline projects.</a>"
3,Canada's healthcare costs are set to surge to nearly $400 billion in 2025.,https://www.ctvnews.ca/video/2025/11/27/canadas-healthcare-costs-are-set-to-surge-to-nearly-400-billion-in-2025/,"<a href=""https://www.ctvnews.ca/video/2025/11/27/canadas-healthcare-costs-are-set-to-surge-to-nearly-400-billion-in-2025/"">Canada's healthcare costs are set to surge to nearly $400 billion in 2025.</a>"
4,‘Going to be significant opposition’: Strategists on political implications of Ottawa-Alberta deal,https://www.ctvnews.ca/video/2025/11/27/going-to-be-significant-opposition-strategists-on-political-implications-of-ottawa-alberta-deal/,"<a href=""https://www.ctvnews.ca/video/2025/11/27/going-to-be-significant-opposition-strategists-on-political-implications-of-ottawa-alberta-deal/"">‘Going to be significant opposition’: Strategists on political implications of Ottawa-Alberta deal</a>"
5,PM Carney and Premier Smith sign memorandum of understanding on energy. Here’s what that means,https://www.ctvnews.ca/video/2025/11/27/carney-and-smith-sign-memorandum-of-understanding-on-energy-heres-what-that-means/,"<a href=""https://www.ctvnews.ca/video/2025/11/27/carney-and-smith-sign-memorandum-of-understanding-on-energy-heres-what-that-means/"">PM Carney and Premier Smith sign memorandum of understanding on energy. Here’s what that means</a>"
6,Woman and son help rescue bald eagle found injured on rural property in Ontario,https://www.ctvnews.ca/ottawa/video/2025/11/26/injured-bald-eagle-rescued/,"<a href=""https://www.ctvnews.ca/ottawa/video/2025/11/26/injured-bald-eagle-rescued/"">Woman and son help rescue bald eagle found injured on rural property in Ontario</a>"
7,Firefighter has near miss with sliding truck while responding to pileup on snowy interstate,https://www.ctvnews.ca/video/2025/11/27/firefighter-has-near-miss-with-sliding-truck-while-responding-to-pileup-on-snowy-interstate/,"<a href=""https://www.ctvnews.ca/video/2025/11/27/firefighter-has-near-miss-with-sliding-truck-while-responding-to-pileup-on-snowy-interstate/"">Firefighter has near miss with sliding truck while responding to pileup on snowy interstate</a>"
8,Coyote stranded on building ledge in Florida draws a crowd,https://www.ctvnews.ca/video/2025/11/27/coyote-stranded-on-building-ledge-in-florida-draws-a-crowd/,"<a href=""https://www.ctvnews.ca/video/2025/11/27/coyote-stranded-on-building-ledge-in-florida-draws-a-crowd/"">Coyote stranded on building ledge in Florida draws a crowd</a>"
