rank,Article title,url,title_with_link
1,Canada's effort to build trade relations outside the U.S.,https://www.ctvnews.ca/video/2026/05/03/canadas-effort-to-build-trade-relations-outside-the-us/,"<a href=""https://www.ctvnews.ca/video/2026/05/03/canadas-effort-to-build-trade-relations-outside-the-us/"">Canada's effort to build trade relations outside the U.S.</a>"
2,Poilievre says PM Mark Carney is 'just another Liberal',https://www.ctvnews.ca/video/2026/05/03/poilievre-says-pm-mark-carney-is-just-another-liberal/,"<a href=""https://www.ctvnews.ca/video/2026/05/03/poilievre-says-pm-mark-carney-is-just-another-liberal/"">Poilievre says PM Mark Carney is 'just another Liberal'</a>"
3,What should Canadians know about the economic update?,https://www.ctvnews.ca/video/2026/05/03/ctv-qp-what-should-canadians-know-about-the-economic-update/,"<a href=""https://www.ctvnews.ca/video/2026/05/03/ctv-qp-what-should-canadians-know-about-the-economic-update/"">What should Canadians know about the economic update?</a>"
4,Examining the economic update and the benefits to Canadians,https://www.ctvnews.ca/video/2026/05/03/ctv-qp-examining-the-economic-update-and-the-benefits-to-canadians/,"<a href=""https://www.ctvnews.ca/video/2026/05/03/ctv-qp-examining-the-economic-update-and-the-benefits-to-canadians/"">Examining the economic update and the benefits to Canadians</a>"
5,Colorado governor on the costly effects of tariffs,https://www.ctvnews.ca/video/2026/05/03/ctv-qp-colorado-governor-on-the-costly-effects-of-tariffs/,"<a href=""https://www.ctvnews.ca/video/2026/05/03/ctv-qp-colorado-governor-on-the-costly-effects-of-tariffs/"">Colorado governor on the costly effects of tariffs</a>"
6,Frank McKenna reflects on his history with St. Francis Xavier University,https://www.ctvnews.ca/video/2026/05/03/ctv-qp-frank-mckenna-reflects-on-his-history-with-st-francis-xavier-university/,"<a href=""https://www.ctvnews.ca/video/2026/05/03/ctv-qp-frank-mckenna-reflects-on-his-history-with-st-francis-xavier-university/"">Frank McKenna reflects on his history with St. Francis Xavier University</a>"
7,CSIS says more youth and teens are becoming involved with terrorism,https://www.ctvnews.ca/video/2026/05/03/ctv-national-news-csis-says-more-youth-and-teens-are-becoming-involved-with-terrorism/,"<a href=""https://www.ctvnews.ca/video/2026/05/03/ctv-national-news-csis-says-more-youth-and-teens-are-becoming-involved-with-terrorism/"">CSIS says more youth and teens are becoming involved with terrorism</a>"
8,Several communities under wildfire alerts in the Edmonton area,https://www.ctvnews.ca/video/2026/05/04/several-communities-under-wildfire-alerts-in-the-edmonton-area/,"<a href=""https://www.ctvnews.ca/video/2026/05/04/several-communities-under-wildfire-alerts-in-the-edmonton-area/"">Several communities under wildfire alerts in the Edmonton area</a>"
