rank,Article title,url,title_with_link
1,"CTV National News: Carney poaches another Conservative MP, edging closer to a majority",https://www.ctvnews.ca/video/2025/12/12/ctv-national-news-carney-poaches-another-conservative-mp-edging-closer-to-a-majority/,"<a href=""https://www.ctvnews.ca/video/2025/12/12/ctv-national-news-carney-poaches-another-conservative-mp-edging-closer-to-a-majority/"">CTV National News: Carney poaches another Conservative MP, edging closer to a majority</a>"
2,PM Carney welcomes MP Michael Ma to the Liberals at party's caucus holiday party,https://www.ctvnews.ca/video/2025/12/12/pm-carney-welcomes-mp-michael-ma-to-the-liberals-at-partys-caucus-holiday-party/,"<a href=""https://www.ctvnews.ca/video/2025/12/12/pm-carney-welcomes-mp-michael-ma-to-the-liberals-at-partys-caucus-holiday-party/"">PM Carney welcomes MP Michael Ma to the Liberals at party's caucus holiday party</a>"
3,B.C. flooding brings increased landslide risk: Fraser Valley Regional District Chair,https://www.ctvnews.ca/video/2025/12/11/bc-flooding-brings-increased-landslide-risk-fraser-valley-regional-district-chair/,"<a href=""https://www.ctvnews.ca/video/2025/12/11/bc-flooding-brings-increased-landslide-risk-fraser-valley-regional-district-chair/"">B.C. flooding brings increased landslide risk: Fraser Valley Regional District Chair</a>"
4,Floodwaters sweep into Abbotsford after torrential rains cut off B.C. highways,https://www.ctvnews.ca/video/2025/12/11/ctv-national-news-floodwaters-sweep-into-abbotsford-after-torrential-rains-cut-off-bc-highways/,"<a href=""https://www.ctvnews.ca/video/2025/12/11/ctv-national-news-floodwaters-sweep-into-abbotsford-after-torrential-rains-cut-off-bc-highways/"">Floodwaters sweep into Abbotsford after torrential rains cut off B.C. highways</a>"
5,CRA faces service strain ahead of tax season as cuts deepen,https://www.ctvnews.ca/video/2025/12/12/cra-faces-service-strain-ahead-of-tax-season-as-cuts-deepen/,"<a href=""https://www.ctvnews.ca/video/2025/12/12/cra-faces-service-strain-ahead-of-tax-season-as-cuts-deepen/"">CRA faces service strain ahead of tax season as cuts deepen</a>"
6,Second Conservative MP defects as Liberals move to within one seat of majority,https://www.ctvnews.ca/video/2025/12/12/second-conservative-mp-defects-as-liberals-move-to-within-one-seat-of-majority/,"<a href=""https://www.ctvnews.ca/video/2025/12/12/second-conservative-mp-defects-as-liberals-move-to-within-one-seat-of-majority/"">Second Conservative MP defects as Liberals move to within one seat of majority</a>"
7,Those calling CRA hoping to speak to an agent may not get results until busy season: accountant,https://www.ctvnews.ca/video/2025/12/11/those-calling-cra-hoping-to-speak-to-an-agent-may-not-get-results-until-busy-season-accountant/,"<a href=""https://www.ctvnews.ca/video/2025/12/11/those-calling-cra-hoping-to-speak-to-an-agent-may-not-get-results-until-busy-season-accountant/"">Those calling CRA hoping to speak to an agent may not get results until busy season: accountant</a>"
8,Federal court rules Canada legally responsible for First Nations housing,https://www.ctvnews.ca/video/2025/12/11/ctv-national-news-federal-court-rules-canada-legally-responsible-for-first-nations-housing/,"<a href=""https://www.ctvnews.ca/video/2025/12/11/ctv-national-news-federal-court-rules-canada-legally-responsible-for-first-nations-housing/"">Federal court rules Canada legally responsible for First Nations housing</a>"
