rank,Article title,url,title_with_link
1,Person of interest in deadly Brown University shooting to be released,https://www.ctvnews.ca/video/2025/12/15/person-of-interest-in-deadly-brown-university-shooting-to-be-released/,"<a href=""https://www.ctvnews.ca/video/2025/12/15/person-of-interest-in-deadly-brown-university-shooting-to-be-released/"">Person of interest in deadly Brown University shooting to be released</a>"
2,"Latest details in shocking deaths of director Rob Reiner and his wife, Michelle",https://www.ctvnews.ca/video/2025/12/15/latest-details-in-shocking-deaths-of-director-rob-reiner-and-his-wife-michelle/,"<a href=""https://www.ctvnews.ca/video/2025/12/15/latest-details-in-shocking-deaths-of-director-rob-reiner-and-his-wife-michelle/"">Latest details in shocking deaths of director Rob Reiner and his wife, Michelle</a>"
3,Limited treatment options available for Manitoba woman living with rare medical conditions,https://www.ctvnews.ca/video/2025/12/15/ctv-national-news-limited-treatment-options-available-for-woman-living-with-rare-medical-conditions/,"<a href=""https://www.ctvnews.ca/video/2025/12/15/ctv-national-news-limited-treatment-options-available-for-woman-living-with-rare-medical-conditions/"">Limited treatment options available for Manitoba woman living with rare medical conditions</a>"
4,Will Canada Post increase rates for shipping library books?,https://www.ctvnews.ca/video/2025/12/15/ctv-national-news-will-canada-post-increase-rates-for-shipping-library-books/,"<a href=""https://www.ctvnews.ca/video/2025/12/15/ctv-national-news-will-canada-post-increase-rates-for-shipping-library-books/"">Will Canada Post increase rates for shipping library books?</a>"
5,First day of Hannukah marred by Australian tragedy,https://www.ctvnews.ca/video/2025/12/15/ctv-national-news-first-day-of-hannukah-marred-by-australian-tragedy/,"<a href=""https://www.ctvnews.ca/video/2025/12/15/ctv-national-news-first-day-of-hannukah-marred-by-australian-tragedy/"">First day of Hannukah marred by Australian tragedy</a>"
6,Jewish community targeted in deadly mass shooting in Australia,https://www.ctvnews.ca/video/2025/12/15/ctv-national-news-jewish-community-targeted-in-deadly-mass-shooting-in-australia/,"<a href=""https://www.ctvnews.ca/video/2025/12/15/ctv-national-news-jewish-community-targeted-in-deadly-mass-shooting-in-australia/"">Jewish community targeted in deadly mass shooting in Australia</a>"
7,Examining intimate partner violence in Atlantic Canada,https://www.ctvnews.ca/video/2025/12/15/ctv-national-news-examining-intimate-partner-violence-in-atlantic-canada/,"<a href=""https://www.ctvnews.ca/video/2025/12/15/ctv-national-news-examining-intimate-partner-violence-in-atlantic-canada/"">Examining intimate partner violence in Atlantic Canada</a>"
8,Calls to improve cell service in P.E.I.,https://www.ctvnews.ca/video/2025/12/15/ctv-national-news-calls-to-improve-cell-service-in-pei/,"<a href=""https://www.ctvnews.ca/video/2025/12/15/ctv-national-news-calls-to-improve-cell-service-in-pei/"">Calls to improve cell service in P.E.I.</a>"
