rank,Article title,url,title_with_link
1,Reid: Trump’s E.U. deal shows Canada isn’t a priority in trade talks,https://www.ctvnews.ca/video/2025/07/28/reid-trumps-eu-deal-shows-canada-isnt-a-priority-in-trade-talks-2/,"<a href=""https://www.ctvnews.ca/video/2025/07/28/reid-trumps-eu-deal-shows-canada-isnt-a-priority-in-trade-talks-2/"">Reid: Trump’s E.U. deal shows Canada isn’t a priority in trade talks</a>"
2,‘They become monsters’: Woman recounts moment she was attacked by raccoon,https://www.ctvnews.ca/video/2025/07/28/they-become-monsters-woman-recounts-moment-she-was-attacked-by-raccoon/,"<a href=""https://www.ctvnews.ca/video/2025/07/28/they-become-monsters-woman-recounts-moment-she-was-attacked-by-raccoon/"">‘They become monsters’: Woman recounts moment she was attacked by raccoon</a>"
3,Manhunt for suspect accused of killing couple hiking with two young daughters in Arkansas,https://www.ctvnews.ca/video/2025/07/28/manhunt-for-suspect-accused-of-killing-couple-hiking-with-two-young-daughters-in-arkansas/,"<a href=""https://www.ctvnews.ca/video/2025/07/28/manhunt-for-suspect-accused-of-killing-couple-hiking-with-two-young-daughters-in-arkansas/"">Manhunt for suspect accused of killing couple hiking with two young daughters in Arkansas</a>"
4,Trump ‘feeling a lot of frustration’ with Russia as ceasefire deadline reduced,https://www.ctvnews.ca/video/2025/07/28/trump-feeling-a-lot-of-frustration-with-russia-as-ceasefire-deadline-reduced/,"<a href=""https://www.ctvnews.ca/video/2025/07/28/trump-feeling-a-lot-of-frustration-with-russia-as-ceasefire-deadline-reduced/"">Trump ‘feeling a lot of frustration’ with Russia as ceasefire deadline reduced</a>"
5,‘I don’t know how they sleep at night’: Moving company holding U.S. senior’s belongings hostage,https://www.ctvnews.ca/video/2025/07/28/i-dont-know-how-they-sleep-at-night-moving-company-holding-us-seniors-belongings-hostage/,"<a href=""https://www.ctvnews.ca/video/2025/07/28/i-dont-know-how-they-sleep-at-night-moving-company-holding-us-seniors-belongings-hostage/"">‘I don’t know how they sleep at night’: Moving company holding U.S. senior’s belongings hostage</a>"
6,Canada left in a ‘vulnerable position’ after U.S. and EU reach trade deal,https://www.ctvnews.ca/video/2025/07/28/canada-left-in-a-vulnerable-position-after-us-and-eu-reach-trade-deal/,"<a href=""https://www.ctvnews.ca/video/2025/07/28/canada-left-in-a-vulnerable-position-after-us-and-eu-reach-trade-deal/"">Canada left in a ‘vulnerable position’ after U.S. and EU reach trade deal</a>"
7,How will U.S.-Canada political tension impact the 2026 World Cup?,https://www.ctvnews.ca/video/2025/07/28/how-will-us-canada-political-tension-impact-the-2026-world-cup/,"<a href=""https://www.ctvnews.ca/video/2025/07/28/how-will-us-canada-political-tension-impact-the-2026-world-cup/"">How will U.S.-Canada political tension impact the 2026 World Cup?</a>"
8,"PM Carney announces cuts to tolls on Confederation Bridge, interprovincial ferry fares",https://www.ctvnews.ca/video/2025/07/28/pm-carney-announces-cuts-to-tolls-on-confederation-bridge-interprovincial-ferry-fares/,"<a href=""https://www.ctvnews.ca/video/2025/07/28/pm-carney-announces-cuts-to-tolls-on-confederation-bridge-interprovincial-ferry-fares/"">PM Carney announces cuts to tolls on Confederation Bridge, interprovincial ferry fares</a>"
