rank,Article title,url,title_with_link
1,"Trump hits Canada with new 50 per cent tariff over U.S. booze, dairy",https://www.ctvnews.ca/video/2026/07/20/ctv-national-news-trump-hits-canada-with-new-50-per-cent-tariff-over-us-booze-dairy/,"<a href=""https://www.ctvnews.ca/video/2026/07/20/ctv-national-news-trump-hits-canada-with-new-50-per-cent-tariff-over-us-booze-dairy/"">Trump hits Canada with new 50 per cent tariff over U.S. booze, dairy</a>"
2,'The administration definitely wants to hit us hard': Trade expert on new U.S. retaliatory tariffs,https://www.ctvnews.ca/video/2026/07/20/the-administration-definitely-wants-to-hit-us-hard-trade-expert-on-new-us-retaliatory-tariffs/,"<a href=""https://www.ctvnews.ca/video/2026/07/20/the-administration-definitely-wants-to-hit-us-hard-trade-expert-on-new-us-retaliatory-tariffs/"">'The administration definitely wants to hit us hard': Trade expert on new U.S. retaliatory tariffs</a>"
3,Teenage twins become pig-showing prodigies with their intense stares,https://www.ctvnews.ca/video/2026/07/20/teenage-twins-become-pig-showing-prodigies-with-their-intense-stares/,"<a href=""https://www.ctvnews.ca/video/2026/07/20/teenage-twins-become-pig-showing-prodigies-with-their-intense-stares/"">Teenage twins become pig-showing prodigies with their intense stares</a>"
4,Police provide Day 5 update about missing Calgary boy,https://www.ctvnews.ca/calgary/video/2026/07/20/extended-police-provide-day-5-update-about-missing-calgary-boy/,"<a href=""https://www.ctvnews.ca/calgary/video/2026/07/20/extended-police-provide-day-5-update-about-missing-calgary-boy/"">Police provide Day 5 update about missing Calgary boy</a>"
5,'Jimothy' an unusually round raccoon takes the world by storm,https://www.ctvnews.ca/video/2026/07/20/jimothy-an-unusually-round-raccoon-takes-the-world-by-storm/,"<a href=""https://www.ctvnews.ca/video/2026/07/20/jimothy-an-unusually-round-raccoon-takes-the-world-by-storm/"">'Jimothy' an unusually round raccoon takes the world by storm</a>"
6,"Kimberley, B.C. mayor says wildfire 'burning in a very inaccessible place'",https://www.ctvnews.ca/video/2026/07/20/kimberley-bc-mayor-says-wildfire-burning-in-a-very-inaccessible-place/,"<a href=""https://www.ctvnews.ca/video/2026/07/20/kimberley-bc-mayor-says-wildfire-burning-in-a-very-inaccessible-place/"">Kimberley, B.C. mayor says wildfire 'burning in a very inaccessible place'</a>"
7,Manitoba loggers fear fires will devastate timber supply,https://www.ctvnews.ca/video/2026/07/20/ctv-national-news-manitoba-loggers-fear-fires-will-devastate-timber-supply/,"<a href=""https://www.ctvnews.ca/video/2026/07/20/ctv-national-news-manitoba-loggers-fear-fires-will-devastate-timber-supply/"">Manitoba loggers fear fires will devastate timber supply</a>"
8,Sask. RCMP received call on driver of silver SUV prior to crash that killed CFL player,https://www.ctvnews.ca/video/2026/07/20/sask-rcmp-received-call-on-driver-of-silver-suv-prior-to-crash-that-killed-cfl-player/,"<a href=""https://www.ctvnews.ca/video/2026/07/20/sask-rcmp-received-call-on-driver-of-silver-suv-prior-to-crash-that-killed-cfl-player/"">Sask. RCMP received call on driver of silver SUV prior to crash that killed CFL player</a>"
