rank,Article title,url,title_with_link
1,PM Carney says IRGC members are prohibited and ‘will not enter’ Canada,https://www.ctvnews.ca/video/2026/04/30/pm-carney-says-irgc-members-are-prohibited-and-will-not-enter-canada/,"<a href=""https://www.ctvnews.ca/video/2026/04/30/pm-carney-says-irgc-members-are-prohibited-and-will-not-enter-canada/"">PM Carney says IRGC members are prohibited and ‘will not enter’ Canada</a>"
2,Couple says they were brutally attacked while walking home in Vancouver,https://www.ctvnews.ca/vancouver/video/2026/04/30/couple-speaks-out-after-brutal-attack-in-vancouver/,"<a href=""https://www.ctvnews.ca/vancouver/video/2026/04/30/couple-speaks-out-after-brutal-attack-in-vancouver/"">Couple says they were brutally attacked while walking home in Vancouver</a>"
3,Wilkinson’s new role leads to byelections that could be ‘tipping the balance’ in Parliament: Reid,https://www.ctvnews.ca/video/2026/04/30/wilkinsons-new-role-leads-to-byelections-that-could-be-tipping-the-balance-in-parliament-reid/,"<a href=""https://www.ctvnews.ca/video/2026/04/30/wilkinsons-new-role-leads-to-byelections-that-could-be-tipping-the-balance-in-parliament-reid/"">Wilkinson’s new role leads to byelections that could be ‘tipping the balance’ in Parliament: Reid</a>"
4,Iranian soccer officials denied entry to Canada,https://www.ctvnews.ca/video/2026/04/30/ctv-national-news-iranian-soccer-officials-denied-entry-to-canada/,"<a href=""https://www.ctvnews.ca/video/2026/04/30/ctv-national-news-iranian-soccer-officials-denied-entry-to-canada/"">Iranian soccer officials denied entry to Canada</a>"
5,How some car mods could void your insurance coverage,https://www.ctvnews.ca/video/2026/04/30/ctv-national-news-rcmp-warn-some-car-mods-can-void-insurance-coverage/,"<a href=""https://www.ctvnews.ca/video/2026/04/30/ctv-national-news-rcmp-warn-some-car-mods-can-void-insurance-coverage/"">How some car mods could void your insurance coverage</a>"
6,Flooring installers say Ontario business owes them thousands for unpaid work,https://www.ctvnews.ca/kitchener/video/2026/04/30/subcontractors-say-cambridge-business-owes-them-thousands/,"<a href=""https://www.ctvnews.ca/kitchener/video/2026/04/30/subcontractors-say-cambridge-business-owes-them-thousands/"">Flooring installers say Ontario business owes them thousands for unpaid work</a>"
7,U.S. President Trumps bids farewell to King Charles and Queen Camilla,https://www.ctvnews.ca/video/2026/04/30/us-president-trumps-bids-farewell-to-king-charles-and-queen-camilla/,"<a href=""https://www.ctvnews.ca/video/2026/04/30/us-president-trumps-bids-farewell-to-king-charles-and-queen-camilla/"">U.S. President Trumps bids farewell to King Charles and Queen Camilla</a>"
8,What to expect from the new defence bank coming to Canada,https://www.ctvnews.ca/video/2026/05/01/what-to-expect-from-the-new-defence-bank-coming-to-canada/,"<a href=""https://www.ctvnews.ca/video/2026/05/01/what-to-expect-from-the-new-defence-bank-coming-to-canada/"">What to expect from the new defence bank coming to Canada</a>"
