rank,Article title,url,title_with_link
1,"Air Transat pilots reach tentative deal, averting holiday strike",https://www.ctvnews.ca/video/2025/12/10/ctv-national-news-air-transat-pilots-reach-tentative-deal-averting-holiday-strike/,"<a href=""https://www.ctvnews.ca/video/2025/12/10/ctv-national-news-air-transat-pilots-reach-tentative-deal-averting-holiday-strike/"">Air Transat pilots reach tentative deal, averting holiday strike</a>"
2,Canada’s ambassador to U.S. Kirsten Hillman steps down ahead of crucial trade tal,https://www.ctvnews.ca/video/2025/12/10/ctv-national-news-canadas-ambassador-to-us-kirsten-hillman-steps-down-ahead-of-crucial-trade-tal/,"<a href=""https://www.ctvnews.ca/video/2025/12/10/ctv-national-news-canadas-ambassador-to-us-kirsten-hillman-steps-down-ahead-of-crucial-trade-tal/"">Canada’s ambassador to U.S. Kirsten Hillman steps down ahead of crucial trade tal</a>"
3,Conservative pipeline motion fails,https://www.ctvnews.ca/video/2025/12/10/ctv-national-news-conservative-pipeline-motion-fails/,"<a href=""https://www.ctvnews.ca/video/2025/12/10/ctv-national-news-conservative-pipeline-motion-fails/"">Conservative pipeline motion fails</a>"
4,What does Hillman's exit mean for Canada–U.S. trade talks? The Front Bench weighs in,https://www.ctvnews.ca/video/2025/12/09/what-does-hillmans-exit-mean-for-canadaus-trade-talks-the-front-bench-weighs-in/,"<a href=""https://www.ctvnews.ca/video/2025/12/09/what-does-hillmans-exit-mean-for-canadaus-trade-talks-the-front-bench-weighs-in/"">What does Hillman's exit mean for Canada–U.S. trade talks? The Front Bench weighs in</a>"
5,House of Commons defeats Conservative pipeline motion in vote of 139 to 196,https://www.ctvnews.ca/video/2025/12/10/house-of-commons-defeats-conservative-pipeline-motion-in-vote-of-139-to-196/,"<a href=""https://www.ctvnews.ca/video/2025/12/10/house-of-commons-defeats-conservative-pipeline-motion-in-vote-of-139-to-196/"">House of Commons defeats Conservative pipeline motion in vote of 139 to 196</a>"
6,Quebec family files $2.2M suit in police shooting of 15-year-old,https://www.ctvnews.ca/video/2025/12/09/ctv-national-news-quebec-family-files-22m-suit-in-police-shooting-of-15-year-old/,"<a href=""https://www.ctvnews.ca/video/2025/12/09/ctv-national-news-quebec-family-files-22m-suit-in-police-shooting-of-15-year-old/"">Quebec family files $2.2M suit in police shooting of 15-year-old</a>"
7,"New justice bill targets femicide, coercive control and deepfake abuse",https://www.ctvnews.ca/video/2025/12/09/ctv-national-news-new-justice-bill-targets-femicide-coercive-control-and-deepfake-abuse/,"<a href=""https://www.ctvnews.ca/video/2025/12/09/ctv-national-news-new-justice-bill-targets-femicide-coercive-control-and-deepfake-abuse/"">New justice bill targets femicide, coercive control and deepfake abuse</a>"
8,U.S. security strategy sparks concern among allies over ‘hostile’ trade approach,https://www.ctvnews.ca/video/2025/12/09/ctv-national-news-us-security-strategy-sparks-concern-among-allies-over-hostile-trade-approach/,"<a href=""https://www.ctvnews.ca/video/2025/12/09/ctv-national-news-us-security-strategy-sparks-concern-among-allies-over-hostile-trade-approach/"">U.S. security strategy sparks concern among allies over ‘hostile’ trade approach</a>"
