rank,Article title,url,title_with_link
1,Moments before and after alleged drug boat shot down by U.S. forces in the southern Caribbean,https://www.ctvnews.ca/video/2025/09/03/moments-before-and-after-alleged-drug-boat-shot-down-by-us-forces-in-the-southern-caribbean/,"<a href=""https://www.ctvnews.ca/video/2025/09/03/moments-before-and-after-alleged-drug-boat-shot-down-by-us-forces-in-the-southern-caribbean/"">Moments before and after alleged drug boat shot down by U.S. forces in the southern Caribbean</a>"
2,'He swung at me twice and missed': B.C. town on edge after axe attack,https://www.ctvnews.ca/vancouver/video/2025/09/03/bc-town-on-edge-after-axe-attack/,"<a href=""https://www.ctvnews.ca/vancouver/video/2025/09/03/bc-town-on-edge-after-axe-attack/"">'He swung at me twice and missed': B.C. town on edge after axe attack</a>"
3,Little boy wanders away from home to get breakfast at Chick-fil-A,https://www.ctvnews.ca/video/2025/09/03/little-boy-wanders-away-from-home-to-get-breakfast-at-chick-fil-a/,"<a href=""https://www.ctvnews.ca/video/2025/09/03/little-boy-wanders-away-from-home-to-get-breakfast-at-chick-fil-a/"">Little boy wanders away from home to get breakfast at Chick-fil-A</a>"
4,"14 years for man who shot daughter’s boyfriend, killed Toronto police dog Bingo",https://www.ctvnews.ca/toronto/video/2025/09/02/14-years-for-man-who-shot-daughters-boyfriend-killed-toronto-police-dog-bingo/,"<a href=""https://www.ctvnews.ca/toronto/video/2025/09/02/14-years-for-man-who-shot-daughters-boyfriend-killed-toronto-police-dog-bingo/"">14 years for man who shot daughter’s boyfriend, killed Toronto police dog Bingo</a>"
5,This key ingredient in many types of gel nail polish has been banned in the EU,https://www.ctvnews.ca/video/2025/09/03/this-key-ingredient-in-many-types-of-gel-nail-polish-has-been-banned-in-the-eu/,"<a href=""https://www.ctvnews.ca/video/2025/09/03/this-key-ingredient-in-many-types-of-gel-nail-polish-has-been-banned-in-the-eu/"">This key ingredient in many types of gel nail polish has been banned in the EU</a>"
6,‘We’re going in’: Trump planning to send armed military guards to Chicago,https://www.ctvnews.ca/video/2025/09/03/were-going-in-trump-planning-to-send-armed-military-guards-to-chicago/,"<a href=""https://www.ctvnews.ca/video/2025/09/03/were-going-in-trump-planning-to-send-armed-military-guards-to-chicago/"">‘We’re going in’: Trump planning to send armed military guards to Chicago</a>"
7,83 snakes among animals seized from Edmonton home,https://www.ctvnews.ca/edmonton/video/2025/09/03/83-snakes-among-animals-seized-from-edmonton-home/,"<a href=""https://www.ctvnews.ca/edmonton/video/2025/09/03/83-snakes-among-animals-seized-from-edmonton-home/"">83 snakes among animals seized from Edmonton home</a>"
8,"33,000 pages of Epstein documents released, with growing calls to reveal full files",https://www.ctvnews.ca/video/2025/09/03/33000-pages-of-epstein-documents-released-with-growing-calls-to-reveal-full-files/,"<a href=""https://www.ctvnews.ca/video/2025/09/03/33000-pages-of-epstein-documents-released-with-growing-calls-to-reveal-full-files/"">33,000 pages of Epstein documents released, with growing calls to reveal full files</a>"
