rank,Article title,url,title_with_link
1,‘A real firefight coast-to-coast’: Wildfires remain out of control across the country,https://www.ctvnews.ca/video/2025/08/11/a-real-firefight-coast-to-coast-wildfires-remain-out-of-control-across-the-country-2/,"<a href=""https://www.ctvnews.ca/video/2025/08/11/a-real-firefight-coast-to-coast-wildfires-remain-out-of-control-across-the-country-2/"">‘A real firefight coast-to-coast’: Wildfires remain out of control across the country</a>"
2,‘We are getting rid of the slums’: U.S. President Trump places D.C. police under federal control,https://www.ctvnews.ca/video/2025/08/11/we-are-getting-rid-of-the-slums-us-president-trump-places-dc-police-under-federal-control/,"<a href=""https://www.ctvnews.ca/video/2025/08/11/we-are-getting-rid-of-the-slums-us-president-trump-places-dc-police-under-federal-control/"">‘We are getting rid of the slums’: U.S. President Trump places D.C. police under federal control</a>"
3,"MUST WATCH: Video of house explosion in Barrie, Ont.",https://www.ctvnews.ca/video/2025/08/10/must-watch-video-of-house-explosion-in-barrie-2/,"<a href=""https://www.ctvnews.ca/video/2025/08/10/must-watch-video-of-house-explosion-in-barrie-2/"">MUST WATCH: Video of house explosion in Barrie, Ont.</a>"
4,"‘Without us, flights don’t take off’: Strike Committee Chair on Air Canada flight attendants",https://www.ctvnews.ca/video/2025/08/11/without-us-flights-dont-take-off-strike-committee-chair-on-air-canada-flight-attendants/,"<a href=""https://www.ctvnews.ca/video/2025/08/11/without-us-flights-dont-take-off-strike-committee-chair-on-air-canada-flight-attendants/"">‘Without us, flights don’t take off’: Strike Committee Chair on Air Canada flight attendants</a>"
5,New York City police officer chokes teen boy after verbal altercation,https://www.ctvnews.ca/video/2025/08/11/new-york-city-police-sergeant-caught-on-camera-choking-teen/,"<a href=""https://www.ctvnews.ca/video/2025/08/11/new-york-city-police-sergeant-caught-on-camera-choking-teen/"">New York City police officer chokes teen boy after verbal altercation</a>"
6,Air Canada flight attendants say current wages are ‘near poverty-level’,https://www.ctvnews.ca/video/2025/08/11/air-canada-flight-attendants-say-current-wages-are-near-poverty-level/,"<a href=""https://www.ctvnews.ca/video/2025/08/11/air-canada-flight-attendants-say-current-wages-are-near-poverty-level/"">Air Canada flight attendants say current wages are ‘near poverty-level’</a>"
7,‘A lot of politics' driving Netanyahu’s desire for Gaza takeover,https://www.ctvnews.ca/video/2025/08/11/a-lot-of-politics-driving-netanyahus-desire-for-gaza-takeover/,"<a href=""https://www.ctvnews.ca/video/2025/08/11/a-lot-of-politics-driving-netanyahus-desire-for-gaza-takeover/"">‘A lot of politics' driving Netanyahu’s desire for Gaza takeover</a>"
8,N.L. poutinerie owner prepares meals for those impacted by wildfires,https://www.ctvnews.ca/video/2025/08/11/nl-poutinerie-owner-prepares-meals-for-those-impacted-by-wildfires/,"<a href=""https://www.ctvnews.ca/video/2025/08/11/nl-poutinerie-owner-prepares-meals-for-those-impacted-by-wildfires/"">N.L. poutinerie owner prepares meals for those impacted by wildfires</a>"
