rank,Article title,url,title_with_link
1,"U.S. needs to ‘get their act together’ with allies, Freeland tells Bill Maher",https://www.ctvnews.ca/video/2026/02/09/ctv-national-news-will-us-president-trump-keep-cusma/,"<a href=""https://www.ctvnews.ca/video/2026/02/09/ctv-national-news-will-us-president-trump-keep-cusma/"">U.S. needs to ‘get their act together’ with allies, Freeland tells Bill Maher</a>"
2,Royals finally discussing Epstein files is 'significant': royal commentator,https://www.ctvnews.ca/video/2026/02/10/royals-finally-discussing-epstein-files-is-significant-royal-commentator/,"<a href=""https://www.ctvnews.ca/video/2026/02/10/royals-finally-discussing-epstein-files-is-significant-royal-commentator/"">Royals finally discussing Epstein files is 'significant': royal commentator</a>"
3,WARNING: Terrifying video captures person’s escape from deadly Winnipeg house fire,https://www.ctvnews.ca/winnipeg/video/2026/02/10/warning-escape-from-deadly-fire-caught-on-camera/,"<a href=""https://www.ctvnews.ca/winnipeg/video/2026/02/10/warning-escape-from-deadly-fire-caught-on-camera/"">WARNING: Terrifying video captures person’s escape from deadly Winnipeg house fire</a>"
4,'It looks almost inevitable': David Frum on whether the Republicans could lose the House and Senate,https://www.ctvnews.ca/video/2026/02/09/it-looks-almost-inevitable-david-frum-on-whether-the-republicans-could-lose-the-house-and-senate/,"<a href=""https://www.ctvnews.ca/video/2026/02/09/it-looks-almost-inevitable-david-frum-on-whether-the-republicans-could-lose-the-house-and-senate/"">'It looks almost inevitable': David Frum on whether the Republicans could lose the House and Senate</a>"
5,Trump continues to ‘ratchet up attacks’ because he sees Canada ‘as a threat’: Ham,https://www.ctvnews.ca/video/2026/02/10/trump-continues-to-ratchet-up-attacks-because-he-sees-canada-as-a-threat-ham/,"<a href=""https://www.ctvnews.ca/video/2026/02/10/trump-continues-to-ratchet-up-attacks-because-he-sees-canada-as-a-threat-ham/"">Trump continues to ‘ratchet up attacks’ because he sees Canada ‘as a threat’: Ham</a>"
6,New survey on Alberta separation finds significant number of people leaning towards independence,https://www.ctvnews.ca/video/2026/02/09/new-survey-on-alberta-separation-finds-significant-number-of-people-leaning-towards-independence/,"<a href=""https://www.ctvnews.ca/video/2026/02/09/new-survey-on-alberta-separation-finds-significant-number-of-people-leaning-towards-independence/"">New survey on Alberta separation finds significant number of people leaning towards independence</a>"
7,Canadians attempting to leave Cuba after Air Canada suspends flights still have options: expert,https://www.ctvnews.ca/video/2026/02/10/canadians-attempting-to-leave-cuba-after-air-canada-suspends-flights-still-have-options-expert/,"<a href=""https://www.ctvnews.ca/video/2026/02/10/canadians-attempting-to-leave-cuba-after-air-canada-suspends-flights-still-have-options-expert/"">Canadians attempting to leave Cuba after Air Canada suspends flights still have options: expert</a>"
8,Canada captures its second bronze medal at the Winter Olympics,https://www.ctvnews.ca/video/2026/02/09/ctv-national-news-canada-captures-its-second-bronze-medal-at-the-winter-olympics/,"<a href=""https://www.ctvnews.ca/video/2026/02/09/ctv-national-news-canada-captures-its-second-bronze-medal-at-the-winter-olympics/"">Canada captures its second bronze medal at the Winter Olympics</a>"
