rank,Article title,url,title_with_link
1,Mother in custody after 9-year-old found dead two months after disappearance,https://www.ctvnews.ca/video/2025/12/24/mother-in-custody-after-9-year-old-found-dead-two-months-after-disappearance/,"<a href=""https://www.ctvnews.ca/video/2025/12/24/mother-in-custody-after-9-year-old-found-dead-two-months-after-disappearance/"">Mother in custody after 9-year-old found dead two months after disappearance</a>"
2,Video shows on-ice brawl at B.C. minor hockey game,https://www.ctvnews.ca/vancouver/video/2025/12/24/brawl-at-bc-minor-league-hockey-game-caught-on-camera/,"<a href=""https://www.ctvnews.ca/vancouver/video/2025/12/24/brawl-at-bc-minor-league-hockey-game-caught-on-camera/"">Video shows on-ice brawl at B.C. minor hockey game</a>"
3,Ontario family rebuilding after vehicle crashes into the front of their home,https://www.ctvnews.ca/kitchener/video/2025/12/24/cambridge-family-rebuilding-after-car-crashes-into-home/,"<a href=""https://www.ctvnews.ca/kitchener/video/2025/12/24/cambridge-family-rebuilding-after-car-crashes-into-home/"">Ontario family rebuilding after vehicle crashes into the front of their home</a>"
4,This Edmonton woman is bringing vintage skiing fashion back to the slopes,https://www.ctvnews.ca/edmonton/video/2025/12/24/edmonton-woman-bringing-vintage-fashion-to-the-ski-hills/,"<a href=""https://www.ctvnews.ca/edmonton/video/2025/12/24/edmonton-woman-bringing-vintage-fashion-to-the-ski-hills/"">This Edmonton woman is bringing vintage skiing fashion back to the slopes</a>"
5,LIVE NOW: Where in the world is Santa? Watch the NORAD tracker on Christmas Eve,https://www.ctvnews.ca/video/live/2025/12/19/live-now-where-in-the-world-is-santa-watch-the-norad-tracker-on-christmas-eve/,"<a href=""https://www.ctvnews.ca/video/live/2025/12/19/live-now-where-in-the-world-is-santa-watch-the-norad-tracker-on-christmas-eve/"">LIVE NOW: Where in the world is Santa? Watch the NORAD tracker on Christmas Eve</a>"
6,"$100,000 for information in the disappearance of Autumn Shaganash from Barrie, Ont.",https://www.ctvnews.ca/barrie/video/2025/12/23/large-monetary-reward-for-information-on-missing-woman/,"<a href=""https://www.ctvnews.ca/barrie/video/2025/12/23/large-monetary-reward-for-information-on-missing-woman/"">$100,000 for information in the disappearance of Autumn Shaganash from Barrie, Ont.</a>"
7,One-third of Canadians are optimistic about the new year after a turbulent 2025,https://www.ctvnews.ca/video/2025/12/24/one-third-of-canadians-are-optimistic-about-the-new-year-after-a-turbulent-2025/,"<a href=""https://www.ctvnews.ca/video/2025/12/24/one-third-of-canadians-are-optimistic-about-the-new-year-after-a-turbulent-2025/"">One-third of Canadians are optimistic about the new year after a turbulent 2025</a>"
8,Canadian woman with a rare cancer forced to seek care abroad,https://www.ctvnews.ca/video/2025/12/24/ctv-national-news-canadian-woman-with-a-rare-cancer-forced-to-seek-care-abroad/,"<a href=""https://www.ctvnews.ca/video/2025/12/24/ctv-national-news-canadian-woman-with-a-rare-cancer-forced-to-seek-care-abroad/"">Canadian woman with a rare cancer forced to seek care abroad</a>"
