rank,Article title,url,title_with_link
1,Home Depot announces tariffs may soon impact Canadian stores,https://www.ctvnews.ca/video/2025/08/20/home-depot-announces-tariffs-may-soon-impact-canadian-stores/,"<a href=""https://www.ctvnews.ca/video/2025/08/20/home-depot-announces-tariffs-may-soon-impact-canadian-stores/"">Home Depot announces tariffs may soon impact Canadian stores</a>"
2,Man finds wife's lost wedding rings after sifting through tonnes of garbage at a dump in B.C.,https://www.ctvnews.ca/vancouver/video/2025/08/20/lost-wedding-rings-found-at-a-dump/,"<a href=""https://www.ctvnews.ca/vancouver/video/2025/08/20/lost-wedding-rings-found-at-a-dump/"">Man finds wife's lost wedding rings after sifting through tonnes of garbage at a dump in B.C.</a>"
3,"‘Well, that’s embarrassing’: Officer responding to call has his car stolen by the suspect",https://www.ctvnews.ca/video/2025/08/20/well-thats-embarrassing-officer-responding-to-call-has-his-car-stolen-by-the-suspect/,"<a href=""https://www.ctvnews.ca/video/2025/08/20/well-thats-embarrassing-officer-responding-to-call-has-his-car-stolen-by-the-suspect/"">‘Well, that’s embarrassing’: Officer responding to call has his car stolen by the suspect</a>"
4,"Disturbing: New details emerge in double murder case in Barrie, Ontario",https://www.ctvnews.ca/barrie/video/2025/08/19/new-details-emerge-in-barries-double-murder-case/,"<a href=""https://www.ctvnews.ca/barrie/video/2025/08/19/new-details-emerge-in-barries-double-murder-case/"">Disturbing: New details emerge in double murder case in Barrie, Ontario</a>"
5,B.C. family sues health authority and school district following teenage daughter’s suicide,https://www.ctvnews.ca/vancouver/video/2025/08/20/parents-of-bc-teen-who-died-by-suicide-take-legal-action/,"<a href=""https://www.ctvnews.ca/vancouver/video/2025/08/20/parents-of-bc-teen-who-died-by-suicide-take-legal-action/"">B.C. family sues health authority and school district following teenage daughter’s suicide</a>"
6,"‘Buddy, you’re going to regret this’: U.S. assistant attorney general’s arrest caught on bodycam",https://www.ctvnews.ca/video/2025/08/20/buddy-youre-going-to-regret-this-us-assistant-attorney-generals-arrest-caught-on-bodycam/,"<a href=""https://www.ctvnews.ca/video/2025/08/20/buddy-youre-going-to-regret-this-us-assistant-attorney-generals-arrest-caught-on-bodycam/"">‘Buddy, you’re going to regret this’: U.S. assistant attorney general’s arrest caught on bodycam</a>"
7,‘They were having a party’: Raccoons caught on camera causing chaos at Florida home,https://www.ctvnews.ca/video/2025/08/20/they-were-having-a-party-raccoons-caught-on-camera-causing-chaos-at-florida-home/,"<a href=""https://www.ctvnews.ca/video/2025/08/20/they-were-having-a-party-raccoons-caught-on-camera-causing-chaos-at-florida-home/"">‘They were having a party’: Raccoons caught on camera causing chaos at Florida home</a>"
8,"Warning: Moment car crashes into two influencers, who were not seriously injured",https://www.ctvnews.ca/video/2025/08/19/warning-moment-car-crashes-into-two-influencers-who-were-not-seriously-injured/,"<a href=""https://www.ctvnews.ca/video/2025/08/19/warning-moment-car-crashes-into-two-influencers-who-were-not-seriously-injured/"">Warning: Moment car crashes into two influencers, who were not seriously injured</a>"
