rank,Article title,url,title_with_link
1,RCMP pleading for caution on highways after deadly crashes in Manitoba,https://www.ctvnews.ca/winnipeg/video/2026/06/03/safety-urged-after-fatal-crashes/,"<a href=""https://www.ctvnews.ca/winnipeg/video/2026/06/03/safety-urged-after-fatal-crashes/"">RCMP pleading for caution on highways after deadly crashes in Manitoba</a>"
2,Dozens of tourists mainly from Romania and India linked to criminal network in Canada,https://www.ctvnews.ca/toronto/video/shows/ctv-news-at-noon/2026/06/05/dozens-of-tourists-mainly-from-romania-and-india-linked-to-criminal-network/,"<a href=""https://www.ctvnews.ca/toronto/video/shows/ctv-news-at-noon/2026/06/05/dozens-of-tourists-mainly-from-romania-and-india-linked-to-criminal-network/"">Dozens of tourists mainly from Romania and India linked to criminal network in Canada</a>"
3,Canadian expedition reveals hidden life in the depths of the Great Lakes,https://www.ctvnews.ca/video/2026/06/05/ctv-national-news-canadian-expedition-reveals-hidden-life-in-the-depths-of-the-great-lakes/,"<a href=""https://www.ctvnews.ca/video/2026/06/05/ctv-national-news-canadian-expedition-reveals-hidden-life-in-the-depths-of-the-great-lakes/"">Canadian expedition reveals hidden life in the depths of the Great Lakes</a>"
4,Millions of Canadians receive one-time GST top-up for groceries and essentials,https://www.ctvnews.ca/video/2026/06/05/ctv-national-news-millions-of-canadians-receive-one-time-gst-top-up-for-groceries-and-essentials/,"<a href=""https://www.ctvnews.ca/video/2026/06/05/ctv-national-news-millions-of-canadians-receive-one-time-gst-top-up-for-groceries-and-essentials/"">Millions of Canadians receive one-time GST top-up for groceries and essentials</a>"
5,"Gas prices fall, but diesel costs keep climbing",https://www.ctvnews.ca/video/2026/06/05/ctv-national-news-gas-prices-fall-but-diesel-costs-keep-climbing/,"<a href=""https://www.ctvnews.ca/video/2026/06/05/ctv-national-news-gas-prices-fall-but-diesel-costs-keep-climbing/"">Gas prices fall, but diesel costs keep climbing</a>"
6,"Canada adds 88,000 jobs as unemployment rate falls to 6.6%",https://www.ctvnews.ca/video/2026/06/05/ctv-national-news-canada-adds-88000-jobs-as-unemployment-rate-falls-to-66/,"<a href=""https://www.ctvnews.ca/video/2026/06/05/ctv-national-news-canada-adds-88000-jobs-as-unemployment-rate-falls-to-66/"">Canada adds 88,000 jobs as unemployment rate falls to 6.6%</a>"
7,Student tackles phosphorus pollution threatening Lake Winnipeg,https://www.ctvnews.ca/video/2026/06/05/ctv-national-news-student-tackles-phosphorus-pollution-threatening-lake-winnipeg/,"<a href=""https://www.ctvnews.ca/video/2026/06/05/ctv-national-news-student-tackles-phosphorus-pollution-threatening-lake-winnipeg/"">Student tackles phosphorus pollution threatening Lake Winnipeg</a>"
8,Canada faces Ireland in final tune-up before FIFA World Cup,https://www.ctvnews.ca/video/2026/06/05/ctv-national-news-canada-faces-ireland-in-final-tune-up-before-fifa-world-cup/,"<a href=""https://www.ctvnews.ca/video/2026/06/05/ctv-national-news-canada-faces-ireland-in-final-tune-up-before-fifa-world-cup/"">Canada faces Ireland in final tune-up before FIFA World Cup</a>"
