rank,Article title,url,title_with_link
1,‘The whole city is buzzing’: Fans anticipate Canada’s opening match in the World Cup,https://www.ctvnews.ca/toronto/video/2026/06/12/the-whole-city-is-buzzing-fans-anticipate-canadas-opening-match-in-the-world-cup/,"<a href=""https://www.ctvnews.ca/toronto/video/2026/06/12/the-whole-city-is-buzzing-fans-anticipate-canadas-opening-match-in-the-world-cup/"">‘The whole city is buzzing’: Fans anticipate Canada’s opening match in the World Cup</a>"
2,What to look for in Canada's first World Cup game,https://www.ctvnews.ca/video/2026/06/12/ctv-national-news-what-to-look-for-in-canadas-first-world-cup-game/,"<a href=""https://www.ctvnews.ca/video/2026/06/12/ctv-national-news-what-to-look-for-in-canadas-first-world-cup-game/"">What to look for in Canada's first World Cup game</a>"
3,‘There’s not great drama here’: PM says Gordie Howe bridge opening delay is at request of the U.S.,https://www.ctvnews.ca/video/2026/06/11/theres-not-great-drama-here-pm-says-gordie-howe-bridge-opening-delay-is-at-request-of-the-us/,"<a href=""https://www.ctvnews.ca/video/2026/06/11/theres-not-great-drama-here-pm-says-gordie-howe-bridge-opening-delay-is-at-request-of-the-us/"">‘There’s not great drama here’: PM says Gordie Howe bridge opening delay is at request of the U.S.</a>"
4,Toronto officer dies in hospital after shooting during ‘high-risk takedown',https://www.ctvnews.ca/video/2026/06/11/toronto-officer-dies-in-hospital-after-shooting-during-high-risk-takedown/,"<a href=""https://www.ctvnews.ca/video/2026/06/11/toronto-officer-dies-in-hospital-after-shooting-during-high-risk-takedown/"">Toronto officer dies in hospital after shooting during ‘high-risk takedown'</a>"
5,"Ontario man shocked his son's $147K claim was denied, despite having travel insurance",https://www.ctvnews.ca/toronto/video/2026/06/10/man-shocked-his-sons-147000-claim-was-denied-despite-having-travel-insurance/,"<a href=""https://www.ctvnews.ca/toronto/video/2026/06/10/man-shocked-his-sons-147000-claim-was-denied-despite-having-travel-insurance/"">Ontario man shocked his son's $147K claim was denied, despite having travel insurance</a>"
6,"Trump claims Iran’s leader approves ceasefire, but analyst says it's just another ‘Groundhog Day'",https://www.ctvnews.ca/video/2026/06/11/trump-claims-irans-leader-approves-ceasefire-but-analyst-says-its-just-another-groundhog-day/,"<a href=""https://www.ctvnews.ca/video/2026/06/11/trump-claims-irans-leader-approves-ceasefire-but-analyst-says-its-just-another-groundhog-day/"">Trump claims Iran’s leader approves ceasefire, but analyst says it's just another ‘Groundhog Day'</a>"
7,'We don’t really have any business hosting this’: Economist on hotel vacancies ahead of World Cup,https://www.ctvnews.ca/video/2026/06/11/we-dont-really-have-any-business-hosting-this-economist-on-hotel-vacancies-ahead-of-world-cup/,"<a href=""https://www.ctvnews.ca/video/2026/06/11/we-dont-really-have-any-business-hosting-this-economist-on-hotel-vacancies-ahead-of-world-cup/"">'We don’t really have any business hosting this’: Economist on hotel vacancies ahead of World Cup</a>"
8,Quebec French-language watchdog flags use of 'nosh' at popular breakfast spot,https://www.ctvnews.ca/montreal/video/2026/06/11/quebec-french-language-watchdog-flags-use-of-nosh-at-popular-breakfast-spot/,"<a href=""https://www.ctvnews.ca/montreal/video/2026/06/11/quebec-french-language-watchdog-flags-use-of-nosh-at-popular-breakfast-spot/"">Quebec French-language watchdog flags use of 'nosh' at popular breakfast spot</a>"
