rank,Article title,url,title_with_link
1,"Terrifying moment a plane rams into paraglider’s canopy, sending her plunging to Earth",https://www.ctvnews.ca/video/2026/05/25/terrifying-moment-a-plane-rams-into-paragliders-canopy-sending-her-plunging-to-earth/,"<a href=""https://www.ctvnews.ca/video/2026/05/25/terrifying-moment-a-plane-rams-into-paragliders-canopy-sending-her-plunging-to-earth/"">Terrifying moment a plane rams into paraglider’s canopy, sending her plunging to Earth</a>"
2,Driver moves ‘road closed’ sign gets truck stuck in wet concrete,https://www.ctvnews.ca/video/2026/05/25/driver-moves-road-closed-sign-gets-truck-stuck-in-wet-concrete/,"<a href=""https://www.ctvnews.ca/video/2026/05/25/driver-moves-road-closed-sign-gets-truck-stuck-in-wet-concrete/"">Driver moves ‘road closed’ sign gets truck stuck in wet concrete</a>"
3,‘You should be deported yesterday:’ Brampton mayor on non-Canadian residents committing crimes,https://www.ctvnews.ca/toronto/video/shows/ctv-news-at-noon/2026/05/25/you-should-be-deported-yesterday-brampton-mayor-on-non-canadian-residents-committing-crimes/,"<a href=""https://www.ctvnews.ca/toronto/video/shows/ctv-news-at-noon/2026/05/25/you-should-be-deported-yesterday-brampton-mayor-on-non-canadian-residents-committing-crimes/"">‘You should be deported yesterday:’ Brampton mayor on non-Canadian residents committing crimes</a>"
4,Terrifying moment of impact as teenager hit by vehicle while boarding school bus,https://www.ctvnews.ca/video/2026/05/24/terrifying-moment-of-impact-as-teenager-hit-by-vehicle-while-boarding-school-bus/,"<a href=""https://www.ctvnews.ca/video/2026/05/24/terrifying-moment-of-impact-as-teenager-hit-by-vehicle-while-boarding-school-bus/"">Terrifying moment of impact as teenager hit by vehicle while boarding school bus</a>"
5,"Companies likely to cut back on TFWs amid ‘pushback’ from consumers, elected officials: economist",https://www.ctvnews.ca/video/2026/05/25/companies-likely-to-cut-back-on-tfws-amid-pushback-from-consumers-elected-officials-economist/,"<a href=""https://www.ctvnews.ca/video/2026/05/25/companies-likely-to-cut-back-on-tfws-amid-pushback-from-consumers-elected-officials-economist/"">Companies likely to cut back on TFWs amid ‘pushback’ from consumers, elected officials: economist</a>"
6,Watch the moment a reporter takes cover after shots fired at White House,https://www.ctvnews.ca/video/2026/05/24/abc-reporter-takes-cover-after-gunshots-ring-out-at-the-white-house/,"<a href=""https://www.ctvnews.ca/video/2026/05/24/abc-reporter-takes-cover-after-gunshots-ring-out-at-the-white-house/"">Watch the moment a reporter takes cover after shots fired at White House</a>"
7,Woman gives birth on the Trans-Canada highway due to hospital staff shortage,https://www.ctvnews.ca/video/2026/05/25/ctv-national-news-woman-gives-birth-on-the-trans-canada-highway-due-to-hospital-staff-shortage/,"<a href=""https://www.ctvnews.ca/video/2026/05/25/ctv-national-news-woman-gives-birth-on-the-trans-canada-highway-due-to-hospital-staff-shortage/"">Woman gives birth on the Trans-Canada highway due to hospital staff shortage</a>"
8,Shootings related to international extortion investigation in Ontario captured on video,https://www.ctvnews.ca/toronto/video/2026/05/25/police-release-video-of-shootings-related-to-extortion-investigation/,"<a href=""https://www.ctvnews.ca/toronto/video/2026/05/25/police-release-video-of-shootings-related-to-extortion-investigation/"">Shootings related to international extortion investigation in Ontario captured on video</a>"
