rank,Article title,url,title_with_link
1,"Inflation eases in July, but experts warn BOC might need more convincing",https://www.ctvnews.ca/video/2025/08/19/inflation-eases-in-july-but-experts-warn-boc-might-need-more-convincing/,"<a href=""https://www.ctvnews.ca/video/2025/08/19/inflation-eases-in-july-but-experts-warn-boc-might-need-more-convincing/"">Inflation eases in July, but experts warn BOC might need more convincing</a>"
2,Air Canada tentative agreement ‘good for the industry’: labour lawyer,https://www.ctvnews.ca/video/2025/08/19/air-canada-tentative-agreement-good-for-the-industry-labour-lawyer/,"<a href=""https://www.ctvnews.ca/video/2025/08/19/air-canada-tentative-agreement-good-for-the-industry-labour-lawyer/"">Air Canada tentative agreement ‘good for the industry’: labour lawyer</a>"
3,"'I think the government, Air Canada misread the situation': Peggy Nash on pushback from the union",https://www.ctvnews.ca/video/2025/08/19/i-think-the-government-air-canada-misread-the-situation-peggy-nash-on-pushback-from-the-union/,"<a href=""https://www.ctvnews.ca/video/2025/08/19/i-think-the-government-air-canada-misread-the-situation-peggy-nash-on-pushback-from-the-union/"">'I think the government, Air Canada misread the situation': Peggy Nash on pushback from the union</a>"
4,"‘You’re a monster, and I can’t believe you’re my dad’: U.S. parents sentenced in assault on daughter",https://www.ctvnews.ca/video/2025/08/19/youre-a-monster-and-i-cant-believe-youre-my-dad-us-parents-sentenced-in-assault-on-daughter/,"<a href=""https://www.ctvnews.ca/video/2025/08/19/youre-a-monster-and-i-cant-believe-youre-my-dad-us-parents-sentenced-in-assault-on-daughter/"">‘You’re a monster, and I can’t believe you’re my dad’: U.S. parents sentenced in assault on daughter</a>"
5,"Warning: Moment a vehicle crashes through window of restaurant into two food reviewers, who escaped serious injuries",https://www.ctvnews.ca/video/2025/08/19/warning-moment-car-crashes-into-two-influencers-who-were-not-seriously-injured/,"<a href=""https://www.ctvnews.ca/video/2025/08/19/warning-moment-car-crashes-into-two-influencers-who-were-not-seriously-injured/"">Warning: Moment a vehicle crashes through window of restaurant into two food reviewers, who escaped serious injuries</a>"
6,"Popular splash pad in Dartmouth, N.S. littered with needles, other drug paraphernalia",https://www.ctvnews.ca/atlantic/video/2025/08/19/dartmouth-ns-splash-pad-littered-with-needles/,"<a href=""https://www.ctvnews.ca/atlantic/video/2025/08/19/dartmouth-ns-splash-pad-littered-with-needles/"">Popular splash pad in Dartmouth, N.S. littered with needles, other drug paraphernalia</a>"
7,Why could security guarantees be a ‘slippery slope’ in a potential Ukraine-Russia ceasefire deal?,https://www.ctvnews.ca/video/2025/08/19/why-could-security-guarantees-be-a-slippery-slope-in-a-potential-ukraine-russia-ceasefire-deal/,"<a href=""https://www.ctvnews.ca/video/2025/08/19/why-could-security-guarantees-be-a-slippery-slope-in-a-potential-ukraine-russia-ceasefire-deal/"">Why could security guarantees be a ‘slippery slope’ in a potential Ukraine-Russia ceasefire deal?</a>"
8,"Warning: Car crashes into restaurant, injuring patrons including an infant",https://www.ctvnews.ca/video/2025/08/19/warning-car-crashes-into-restaurant-injuring-patrons-including-an-infant/,"<a href=""https://www.ctvnews.ca/video/2025/08/19/warning-car-crashes-into-restaurant-injuring-patrons-including-an-infant/"">Warning: Car crashes into restaurant, injuring patrons including an infant</a>"
