rank,Article title,url,title_with_link
1,WATCH LIVE: PM Carney makes Arctic defence announcement in Yellowknife,https://www.ctvnews.ca/video/live/2026/03/12/watch-live-pm-carney-makes-arctic-defence-announcement-in-yellowknife/,"<a href=""https://www.ctvnews.ca/video/live/2026/03/12/watch-live-pm-carney-makes-arctic-defence-announcement-in-yellowknife/"">WATCH LIVE: PM Carney makes Arctic defence announcement in Yellowknife</a>"
2,Why Iranian Supreme Leader Mojtaba Khamenei hasn’t been seen in public since taking office,https://www.ctvnews.ca/video/2026/03/12/why-iranian-supreme-leader-mojtaba-khamenei-hasnt-been-seen-in-public-since-taking-office/,"<a href=""https://www.ctvnews.ca/video/2026/03/12/why-iranian-supreme-leader-mojtaba-khamenei-hasnt-been-seen-in-public-since-taking-office/"">Why Iranian Supreme Leader Mojtaba Khamenei hasn’t been seen in public since taking office</a>"
3,"Michigan synagogue shooting suspect killed, but officials don’t confirm cause of death",https://www.ctvnews.ca/video/2026/03/12/michigan-synagogue-shooting-suspect-killed-but-officials-dont-confirm-cause-of-death/,"<a href=""https://www.ctvnews.ca/video/2026/03/12/michigan-synagogue-shooting-suspect-killed-but-officials-dont-confirm-cause-of-death/"">Michigan synagogue shooting suspect killed, but officials don’t confirm cause of death</a>"
4,Michigan synagogue 'appears to have been well-protected': security expert,https://www.ctvnews.ca/video/2026/03/12/michigan-synagogue-appears-to-have-been-well-protected-security-expert/,"<a href=""https://www.ctvnews.ca/video/2026/03/12/michigan-synagogue-appears-to-have-been-well-protected-security-expert/"">Michigan synagogue 'appears to have been well-protected': security expert</a>"
5,'Jeremy Hansen is going to have some stories to tell': Chris Hadfield on Artemis II launch date,https://www.ctvnews.ca/video/2026/03/12/jeremy-hansen-is-going-to-have-some-stories-to-tell-chris-hadfield-on-artemis-ii-launch-date/,"<a href=""https://www.ctvnews.ca/video/2026/03/12/jeremy-hansen-is-going-to-have-some-stories-to-tell-chris-hadfield-on-artemis-ii-launch-date/"">'Jeremy Hansen is going to have some stories to tell': Chris Hadfield on Artemis II launch date</a>"
6,‘This is such a bonding experience’: Video shows arrested teens laughing about gruesome murder plot,https://www.ctvnews.ca/video/2026/03/12/this-is-such-a-bonding-experience-video-shows-arrested-teens-laughing-about-gruesome-murder-plot/,"<a href=""https://www.ctvnews.ca/video/2026/03/12/this-is-such-a-bonding-experience-video-shows-arrested-teens-laughing-about-gruesome-murder-plot/"">‘This is such a bonding experience’: Video shows arrested teens laughing about gruesome murder plot</a>"
7,New regulations limiting non-sufficient bank fees add protections for consumers: financial planner,https://www.ctvnews.ca/video/2026/03/12/new-regulations-limiting-non-sufficient-bank-fees-add-protections-for-consumers-financial-planner/,"<a href=""https://www.ctvnews.ca/video/2026/03/12/new-regulations-limiting-non-sufficient-bank-fees-add-protections-for-consumers-financial-planner/"">New regulations limiting non-sufficient bank fees add protections for consumers: financial planner</a>"
8,Family booted from Winnipeg hotel they were staying at after surgery,https://www.ctvnews.ca/winnipeg/video/2026/03/11/hsc-hotel-incident-caught-on-video/,"<a href=""https://www.ctvnews.ca/winnipeg/video/2026/03/11/hsc-hotel-incident-caught-on-video/"">Family booted from Winnipeg hotel they were staying at after surgery</a>"
