rank,Article title,url,title_with_link
1,"‘You asked for it, we promised it, now we are delivering’: Carney on new Alberta pipeline deal",https://www.ctvnews.ca/video/2026/07/03/you-asked-for-it-we-promised-it-now-we-are-delivering-carney-on-new-alberta-pipeline-deal/,"<a href=""https://www.ctvnews.ca/video/2026/07/03/you-asked-for-it-we-promised-it-now-we-are-delivering-carney-on-new-alberta-pipeline-deal/"">‘You asked for it, we promised it, now we are delivering’: Carney on new Alberta pipeline deal</a>"
2,‘Pure evil’: 16 children rescued from deplorable conditions at Ohio home,https://www.ctvnews.ca/video/2026/07/02/pure-evil-16-children-rescued-from-deplorable-conditions-at-ohio-home/,"<a href=""https://www.ctvnews.ca/video/2026/07/02/pure-evil-16-children-rescued-from-deplorable-conditions-at-ohio-home/"">‘Pure evil’: 16 children rescued from deplorable conditions at Ohio home</a>"
3,Woman attacked with a large piece of wood on B.C. beach speaks out,https://www.ctvnews.ca/vancouver/video/2026/07/03/victim-of-unprovoked-attack-speaks-out/,"<a href=""https://www.ctvnews.ca/vancouver/video/2026/07/03/victim-of-unprovoked-attack-speaks-out/"">Woman attacked with a large piece of wood on B.C. beach speaks out</a>"
4,Teen who was driving 191 km/h in 50 km/h area charged in fatal Ontario crash,https://www.ctvnews.ca/kitchener/video/2026/07/03/16-year-old-charged-in-fatal-north-dumfries-collision/,"<a href=""https://www.ctvnews.ca/kitchener/video/2026/07/03/16-year-old-charged-in-fatal-north-dumfries-collision/"">Teen who was driving 191 km/h in 50 km/h area charged in fatal Ontario crash</a>"
5,White House defending Trump’s US$2.2B windfall earned during first year back in office,https://www.ctvnews.ca/video/2026/07/02/white-house-defending-trumps-us22b-windfall-earned-during-first-year-back-in-office/,"<a href=""https://www.ctvnews.ca/video/2026/07/02/white-house-defending-trumps-us22b-windfall-earned-during-first-year-back-in-office/"">White House defending Trump’s US$2.2B windfall earned during first year back in office</a>"
6,World Cup fans sue StubHub over cancelled tickets,https://www.ctvnews.ca/toronto/video/2026/07/02/world-cup-fans-sue-stubhub-over-cancelled-tickets/,"<a href=""https://www.ctvnews.ca/toronto/video/2026/07/02/world-cup-fans-sue-stubhub-over-cancelled-tickets/"">World Cup fans sue StubHub over cancelled tickets</a>"
7,Bald eagle found nearly drowned in a river recovers in Ontario animal shelter,https://www.ctvnews.ca/windsor/video/2026/07/02/bald-eagle-rescued/,"<a href=""https://www.ctvnews.ca/windsor/video/2026/07/02/bald-eagle-rescued/"">Bald eagle found nearly drowned in a river recovers in Ontario animal shelter</a>"
8,Ottawa residents left with questions following severe rainstorm,https://www.ctvnews.ca/ottawa/video/2026/07/02/ottawa-residents-left-with-questions-following-severe-rainstorm/,"<a href=""https://www.ctvnews.ca/ottawa/video/2026/07/02/ottawa-residents-left-with-questions-following-severe-rainstorm/"">Ottawa residents left with questions following severe rainstorm</a>"
