rank,Article title,url,title_with_link
1,LIVE: Aftermath of Air Canada plane crash at LaGuardia airport in New York City,https://www.ctvnews.ca/video/live/2026/03/19/live-aftermath-of-air-canada-plane-crash-at-laguardia-airport-in-new-york-city/,"<a href=""https://www.ctvnews.ca/video/live/2026/03/19/live-aftermath-of-air-canada-plane-crash-at-laguardia-airport-in-new-york-city/"">LIVE: Aftermath of Air Canada plane crash at LaGuardia airport in New York City</a>"
2,"‘Stop, truck one’: Air traffic control audio before Air Canada plane crash",https://www.ctvnews.ca/video/2026/03/23/stop-truck-one-air-traffic-control-audio-before-air-canada-plane-crash/,"<a href=""https://www.ctvnews.ca/video/2026/03/23/stop-truck-one-air-traffic-control-audio-before-air-canada-plane-crash/"">‘Stop, truck one’: Air traffic control audio before Air Canada plane crash</a>"
3,'We immediately hit something and it was just chaos from there': Air Canada passenger recounts crash,https://www.ctvnews.ca/video/2026/03/23/we-immediately-hit-something-and-it-was-just-chaos-from-there-air-canada-passenger-recounts-crash/,"<a href=""https://www.ctvnews.ca/video/2026/03/23/we-immediately-hit-something-and-it-was-just-chaos-from-there-air-canada-passenger-recounts-crash/"">'We immediately hit something and it was just chaos from there': Air Canada passenger recounts crash</a>"
4,Iran makes new threats in response to Trump’s missile promise,https://www.ctvnews.ca/video/2026/03/23/ctv-national-news-iran-makes-new-threats-in-response-to-trumps-missile-promise/,"<a href=""https://www.ctvnews.ca/video/2026/03/23/ctv-national-news-iran-makes-new-threats-in-response-to-trumps-missile-promise/"">Iran makes new threats in response to Trump’s missile promise</a>"
5,Toronto music lovers mourn loss of Steve’s Music Store,https://www.ctvnews.ca/video/2026/03/23/ctv-national-news-toronto-music-lovers-mourn-loss-of-steves-music-store/,"<a href=""https://www.ctvnews.ca/video/2026/03/23/ctv-national-news-toronto-music-lovers-mourn-loss-of-steves-music-store/"">Toronto music lovers mourn loss of Steve’s Music Store</a>"
6,Canadian Space Agency cuts plan to send rover to Moon,https://www.ctvnews.ca/video/2026/03/23/ctv-national-news-canadian-space-agency-cuts-plan-to-send-rover-to-moon/,"<a href=""https://www.ctvnews.ca/video/2026/03/23/ctv-national-news-canadian-space-agency-cuts-plan-to-send-rover-to-moon/"">Canadian Space Agency cuts plan to send rover to Moon</a>"
7,"Thieves across Canada target hobby shops for valuable cards, collectibles",https://www.ctvnews.ca/video/2026/03/23/ctv-national-news-thieves-across-canada-target-hobby-shops-for-valuable-cards-collectibles/,"<a href=""https://www.ctvnews.ca/video/2026/03/23/ctv-national-news-thieves-across-canada-target-hobby-shops-for-valuable-cards-collectibles/"">Thieves across Canada target hobby shops for valuable cards, collectibles</a>"
8,New Brunswick farmers worried about cuts to provincial veterinary program,https://www.ctvnews.ca/video/2026/03/23/ctv-national-news-new-brunswick-farmers-worried-about-cuts-to-provincial-veterinary-program/,"<a href=""https://www.ctvnews.ca/video/2026/03/23/ctv-national-news-new-brunswick-farmers-worried-about-cuts-to-provincial-veterinary-program/"">New Brunswick farmers worried about cuts to provincial veterinary program</a>"
