rank,Article title,url,title_with_link
1,Prime Minister Mark Carney heads to Europe with strategic trade push,https://www.ctvnews.ca/video/2025/08/25/ctv-national-news-pm-carney-heads-to-europe-with-strategic-trade-push/,"<a href=""https://www.ctvnews.ca/video/2025/08/25/ctv-national-news-pm-carney-heads-to-europe-with-strategic-trade-push/"">Prime Minister Mark Carney heads to Europe with strategic trade push</a>"
2,Inquest begins for boy who died at Saskatoon group home,https://www.ctvnews.ca/saskatoon/video/2025/08/26/inquest-begins-for-boy-who-died-at-saskatoon-group-home/,"<a href=""https://www.ctvnews.ca/saskatoon/video/2025/08/26/inquest-begins-for-boy-who-died-at-saskatoon-group-home/"">Inquest begins for boy who died at Saskatoon group home</a>"
3,'A little bit heartbreaking': Fallout from Capital Pride Parade cancellation in Ottawa,https://www.ctvnews.ca/ottawa/video/2025/08/25/fallout-from-capital-pride-parade-cancellation/,"<a href=""https://www.ctvnews.ca/ottawa/video/2025/08/25/fallout-from-capital-pride-parade-cancellation/"">'A little bit heartbreaking': Fallout from Capital Pride Parade cancellation in Ottawa</a>"
4,Photographer showcases 49 years of the CNE,https://www.ctvnews.ca/video/2025/08/26/photographer-showcases-49-years-of-the-cne/,"<a href=""https://www.ctvnews.ca/video/2025/08/26/photographer-showcases-49-years-of-the-cne/"">Photographer showcases 49 years of the CNE</a>"
5,Scathing report slams closed-door meetings at Vancouver City Hall,https://www.ctvnews.ca/vancouver/video/2025/08/26/scathing-report-slams-closed-door-meetings-at-vancouver-city-hall/,"<a href=""https://www.ctvnews.ca/vancouver/video/2025/08/26/scathing-report-slams-closed-door-meetings-at-vancouver-city-hall/"">Scathing report slams closed-door meetings at Vancouver City Hall</a>"
6,Dry weather across the Prairies is taking a toll on crops and leaving farmers concerned,https://www.ctvnews.ca/video/2025/08/26/dry-weather-across-the-prairies-is-taking-a-toll-on-crops-and-leaving-farmers-concerned/,"<a href=""https://www.ctvnews.ca/video/2025/08/26/dry-weather-across-the-prairies-is-taking-a-toll-on-crops-and-leaving-farmers-concerned/"">Dry weather across the Prairies is taking a toll on crops and leaving farmers concerned</a>"
7,Dr. Oz joins U.S. billionaire in fight to stop B.C. ostrich cull,https://www.ctvnews.ca/video/2025/08/25/ctv-national-news-dr-oz-fights-to-save-bc-ostriches/,"<a href=""https://www.ctvnews.ca/video/2025/08/25/ctv-national-news-dr-oz-fights-to-save-bc-ostriches/"">Dr. Oz joins U.S. billionaire in fight to stop B.C. ostrich cull</a>"
8,Potential teacher strike or lockout looming in Alberta as start of school year approaches,https://www.ctvnews.ca/calgary/video/2025/08/26/potential-strike-or-lockout/,"<a href=""https://www.ctvnews.ca/calgary/video/2025/08/26/potential-strike-or-lockout/"">Potential teacher strike or lockout looming in Alberta as start of school year approaches</a>"
