rank,Article title,url,title_with_link
1,"Pierre Poilievre’s speech was ‘coldly logical,’ but still effective: David McLaughlin",https://www.ctvnews.ca/video/2026/02/27/pierre-poilievres-speech-was-coldly-logical-but-still-effective-david-mclaughlin/,"<a href=""https://www.ctvnews.ca/video/2026/02/27/pierre-poilievres-speech-was-coldly-logical-but-still-effective-david-mclaughlin/"">Pierre Poilievre’s speech was ‘coldly logical,’ but still effective: David McLaughlin</a>"
2,Conservative Leader Pierre Poilievre’s new proposed tariff-free auto pact is ‘bang on’: CVMA CEO,https://www.ctvnews.ca/video/2026/02/27/conservative-leader-pierre-poilievres-new-proposed-tariff-free-auto-pact-is-bang-on-cvma-ceo/,"<a href=""https://www.ctvnews.ca/video/2026/02/27/conservative-leader-pierre-poilievres-new-proposed-tariff-free-auto-pact-is-bang-on-cvma-ceo/"">Conservative Leader Pierre Poilievre’s new proposed tariff-free auto pact is ‘bang on’: CVMA CEO</a>"
3,CTV News in Mexico: Calm in Mexico appears to hold after deadly cartel violence,https://www.ctvnews.ca/video/2026/02/26/ctv-news-in-mexico-calm-in-mexico-appears-to-hold-after-deadly-cartel-violence/,"<a href=""https://www.ctvnews.ca/video/2026/02/26/ctv-news-in-mexico-calm-in-mexico-appears-to-hold-after-deadly-cartel-violence/"">CTV News in Mexico: Calm in Mexico appears to hold after deadly cartel violence</a>"
4,Victims recount horror after student lit another teen on fire at Saskatchewan high school,https://www.ctvnews.ca/saskatoon/video/2026/02/27/victims-recount-horror-of-fiery-attack-at-sask-high-school/,"<a href=""https://www.ctvnews.ca/saskatoon/video/2026/02/27/victims-recount-horror-of-fiery-attack-at-sask-high-school/"">Victims recount horror after student lit another teen on fire at Saskatchewan high school</a>"
5,‘Trailer Park Boys’ star Mike Smith pleads not guilty to sexual assault charge,https://www.ctvnews.ca/atlantic/video/2026/02/26/trailer-park-boys-actor-pleads-not-guilty-to-sexual-assault-charge/,"<a href=""https://www.ctvnews.ca/atlantic/video/2026/02/26/trailer-park-boys-actor-pleads-not-guilty-to-sexual-assault-charge/"">‘Trailer Park Boys’ star Mike Smith pleads not guilty to sexual assault charge</a>"
6,Carney embarks on nine-day trade mission to India and other nations,https://www.ctvnews.ca/video/2026/02/26/ctv-national-news-carney-embarks-on-nine-day-trade-mission-to-india-and-other-nations/,"<a href=""https://www.ctvnews.ca/video/2026/02/26/ctv-national-news-carney-embarks-on-nine-day-trade-mission-to-india-and-other-nations/"">Carney embarks on nine-day trade mission to India and other nations</a>"
7,Father and daughter mistakenly caught up in human trafficking investigation,https://www.ctvnews.ca/kitchener/video/2026/02/26/father-and-daughter-mistakenly-caught-up-in-human-trafficking-investigation/,"<a href=""https://www.ctvnews.ca/kitchener/video/2026/02/26/father-and-daughter-mistakenly-caught-up-in-human-trafficking-investigation/"">Father and daughter mistakenly caught up in human trafficking investigation</a>"
8,Canadian man detained in ICE processing centre reveals grim realities,https://www.ctvnews.ca/video/2026/02/26/ctv-national-news-canadian-man-detained-in-ice-processing-centre-reveals-grim-realities/,"<a href=""https://www.ctvnews.ca/video/2026/02/26/ctv-national-news-canadian-man-detained-in-ice-processing-centre-reveals-grim-realities/"">Canadian man detained in ICE processing centre reveals grim realities</a>"
