rank,Article title,url,title_with_link
1,Woman chases young child riding a bike with her vehicle,https://www.ctvnews.ca/video/2026/05/06/woman-chases-young-child-riding-a-bike-with-her-vehicle/,"<a href=""https://www.ctvnews.ca/video/2026/05/06/woman-chases-young-child-riding-a-bike-with-her-vehicle/"">Woman chases young child riding a bike with her vehicle</a>"
2,Trial for Ontario man accused of killing best friend and dumping his remains begins,https://www.ctvnews.ca/barrie/video/2026/05/05/ont-man-accused-of-dumping-his-best-friends-remains/,"<a href=""https://www.ctvnews.ca/barrie/video/2026/05/05/ont-man-accused-of-dumping-his-best-friends-remains/"">Trial for Ontario man accused of killing best friend and dumping his remains begins</a>"
3,Media pioneer and philanthropist Ted Turner dead at 87,https://www.ctvnews.ca/video/2026/05/06/media-pioneer-and-philanthropist-ted-turner-dead-at-87/,"<a href=""https://www.ctvnews.ca/video/2026/05/06/media-pioneer-and-philanthropist-ted-turner-dead-at-87/"">Media pioneer and philanthropist Ted Turner dead at 87</a>"
4,‘He is passed out behind the wheel’: Out-of-control boater crashes into embarkment,https://www.ctvnews.ca/video/2026/05/06/he-is-passed-out-behind-the-wheel-out-of-control-boater-crashes-into-embarkment/,"<a href=""https://www.ctvnews.ca/video/2026/05/06/he-is-passed-out-behind-the-wheel-out-of-control-boater-crashes-into-embarkment/"">‘He is passed out behind the wheel’: Out-of-control boater crashes into embarkment</a>"
5,Canadian who criticized Trump sues U.S. DOJ for requesting personal data from Google,https://www.ctvnews.ca/video/2026/05/06/canadian-who-criticized-trump-sues-us-doj-for-requesting-personal-data-from-google/,"<a href=""https://www.ctvnews.ca/video/2026/05/06/canadian-who-criticized-trump-sues-us-doj-for-requesting-personal-data-from-google/"">Canadian who criticized Trump sues U.S. DOJ for requesting personal data from Google</a>"
6,Thief steals $15K worth of underwear from Montreal business,https://www.ctvnews.ca/montreal/video/2026/05/05/15k-worth-of-underwear-stolen-in-montreal-suspect-caught-on-camera/,"<a href=""https://www.ctvnews.ca/montreal/video/2026/05/05/15k-worth-of-underwear-stolen-in-montreal-suspect-caught-on-camera/"">Thief steals $15K worth of underwear from Montreal business</a>"
7,E-scooters are mostly to blame for a surge in injured children at emergency departments,https://www.ctvnews.ca/vancouver/video/2026/05/06/surge-in-e-scooter-injuries-in-kids/,"<a href=""https://www.ctvnews.ca/vancouver/video/2026/05/06/surge-in-e-scooter-injuries-in-kids/"">E-scooters are mostly to blame for a surge in injured children at emergency departments</a>"
8,"‘This is typical of this administration, chaos’: Fraser on U.S. threats as talks gain ‘traction’",https://www.ctvnews.ca/video/2026/05/06/this-is-typical-of-this-administration-chaos-fraser-on-us-threats-as-talks-gain-traction/,"<a href=""https://www.ctvnews.ca/video/2026/05/06/this-is-typical-of-this-administration-chaos-fraser-on-us-threats-as-talks-gain-traction/"">‘This is typical of this administration, chaos’: Fraser on U.S. threats as talks gain ‘traction’</a>"
