rank,Article title,url,title_with_link
1,"China deal on EVs and canola: Ford against, Moe supports as battle lines drawn",https://www.ctvnews.ca/video/2026/01/16/china-deal-on-evs-and-canola-ford-against-moe-supports-as-battle-lines-drawn/,"<a href=""https://www.ctvnews.ca/video/2026/01/16/china-deal-on-evs-and-canola-ford-against-moe-supports-as-battle-lines-drawn/"">China deal on EVs and canola: Ford against, Moe supports as battle lines drawn</a>"
2,Teen dies after falling from chairlift at B.C.'s Cypress Mountain,https://www.ctvnews.ca/video/2026/01/16/teen-dies-after-falling-from-chairlift-at-bcs-cypress-mountain/,"<a href=""https://www.ctvnews.ca/video/2026/01/16/teen-dies-after-falling-from-chairlift-at-bcs-cypress-mountain/"">Teen dies after falling from chairlift at B.C.'s Cypress Mountain</a>"
3,PM Mark Carney’s objective in China deal is diversifying trade: John Manley,https://www.ctvnews.ca/video/2026/01/16/pm-mark-carneys-objective-in-china-deal-is-diversifying-trade-john-manley/,"<a href=""https://www.ctvnews.ca/video/2026/01/16/pm-mark-carneys-objective-in-china-deal-is-diversifying-trade-john-manley/"">PM Mark Carney’s objective in China deal is diversifying trade: John Manley</a>"
4,"Passengers want better options, cheaper fares, not reduced legroom: aviation specialist",https://www.ctvnews.ca/video/2026/01/16/passengers-want-better-options-cheaper-fares-not-reduced-legroom-aviation-specialist/,"<a href=""https://www.ctvnews.ca/video/2026/01/16/passengers-want-better-options-cheaper-fares-not-reduced-legroom-aviation-specialist/"">Passengers want better options, cheaper fares, not reduced legroom: aviation specialist</a>"
5,Not surprising that appeal court rules against 2022 Emergency Act for convoy protest: criminologist,https://www.ctvnews.ca/video/2026/01/16/not-surprising-that-appeal-court-rules-against-2022-emergency-act-for-convoy-protest-criminologist/,"<a href=""https://www.ctvnews.ca/video/2026/01/16/not-surprising-that-appeal-court-rules-against-2022-emergency-act-for-convoy-protest-criminologist/"">Not surprising that appeal court rules against 2022 Emergency Act for convoy protest: criminologist</a>"
6,Analyst reacts to Canada-China EV deal: ‘This is not a free-for-all for China’,https://www.ctvnews.ca/video/2026/01/16/analyst-reacts-to-canada-china-ev-deal-this-is-not-a-free-for-all-for-china/,"<a href=""https://www.ctvnews.ca/video/2026/01/16/analyst-reacts-to-canada-china-ev-deal-this-is-not-a-free-for-all-for-china/"">Analyst reacts to Canada-China EV deal: ‘This is not a free-for-all for China’</a>"
7,Canola Growers Association president reacts to China cutting duties to 15 per cent,https://www.ctvnews.ca/video/2026/01/16/canola-growers-association-president-reacts-to-china-cutting-duties-to-15-per-cent/,"<a href=""https://www.ctvnews.ca/video/2026/01/16/canola-growers-association-president-reacts-to-china-cutting-duties-to-15-per-cent/"">Canola Growers Association president reacts to China cutting duties to 15 per cent</a>"
8,EV tariff deal is ‘modest’ but offers possibility of ‘new investment relationships’: diplomat,https://www.ctvnews.ca/video/2026/01/16/ev-tariff-deal-is-modest-but-offers-possibility-of-new-investment-relationships-diplomat/,"<a href=""https://www.ctvnews.ca/video/2026/01/16/ev-tariff-deal-is-modest-but-offers-possibility-of-new-investment-relationships-diplomat/"">EV tariff deal is ‘modest’ but offers possibility of ‘new investment relationships’: diplomat</a>"
