rank,Article title,url,title_with_link
1,Former Olympian Ryan Wedding captured in FBI manhunt,https://www.ctvnews.ca/video/2026/01/23/ctv-national-news-former-olympian-ryan-wedding-captured-in-fbi-manhunt/,"<a href=""https://www.ctvnews.ca/video/2026/01/23/ctv-national-news-former-olympian-ryan-wedding-captured-in-fbi-manhunt/"">Former Olympian Ryan Wedding captured in FBI manhunt</a>"
2,Breaking development in the case of a Canadian woman’s death in Mexico,https://www.ctvnews.ca/video/2026/01/23/ctv-national-news-breaking-development-in-the-case-of-a-canadian-womans-death-in-mexico/,"<a href=""https://www.ctvnews.ca/video/2026/01/23/ctv-national-news-breaking-development-in-the-case-of-a-canadian-womans-death-in-mexico/"">Breaking development in the case of a Canadian woman’s death in Mexico</a>"
3,Carney wraps Quebec cabinet retreat amid escalating tensions with Trump,https://www.ctvnews.ca/video/2026/01/23/ctv-national-news-carney-wraps-quebec-cabinet-retreat-amid-escalating-tensions-with-trump/,"<a href=""https://www.ctvnews.ca/video/2026/01/23/ctv-national-news-carney-wraps-quebec-cabinet-retreat-amid-escalating-tensions-with-trump/"">Carney wraps Quebec cabinet retreat amid escalating tensions with Trump</a>"
4,"10,000 notices issued to public servants this week",https://www.ctvnews.ca/ottawa/video/2026/01/23/10000-notices-issued-to-public-servants/,"<a href=""https://www.ctvnews.ca/ottawa/video/2026/01/23/10000-notices-issued-to-public-servants/"">10,000 notices issued to public servants this week</a>"
5,"Montreal man awarded $2,000 after bus driver didn’t stop to pick him up",https://www.ctvnews.ca/montreal/video/2026/01/23/montreal-man-awarded-2000-after-bus-driver-didnt-stop-to-pick-him-up/,"<a href=""https://www.ctvnews.ca/montreal/video/2026/01/23/montreal-man-awarded-2000-after-bus-driver-didnt-stop-to-pick-him-up/"">Montreal man awarded $2,000 after bus driver didn’t stop to pick him up</a>"
6,Carney takes tougher stance on Trump as tensions rise,https://www.ctvnews.ca/video/2026/01/23/ctv-national-news-carney-takes-tougher-stance-on-trump-as-tensions-rise/,"<a href=""https://www.ctvnews.ca/video/2026/01/23/ctv-national-news-carney-takes-tougher-stance-on-trump-as-tensions-rise/"">Carney takes tougher stance on Trump as tensions rise</a>"
7,Canadian Forces boost Arctic presence amid rising security focus,https://www.ctvnews.ca/video/2026/01/23/ctv-national-news-canadian-forces-boost-arctic-presence-amid-rising-security-focus/,"<a href=""https://www.ctvnews.ca/video/2026/01/23/ctv-national-news-canadian-forces-boost-arctic-presence-amid-rising-security-focus/"">Canadian Forces boost Arctic presence amid rising security focus</a>"
8,Deep freeze drives up heating costs across Canada,https://www.ctvnews.ca/video/2026/01/23/ctv-national-news-deep-freeze-drives-up-heating-costs-across-canada/,"<a href=""https://www.ctvnews.ca/video/2026/01/23/ctv-national-news-deep-freeze-drives-up-heating-costs-across-canada/"">Deep freeze drives up heating costs across Canada</a>"
