rank,Article title,url,title_with_link
1,Review: New Taylor Swift album combines sound of ‘Evermore’ and ‘Midnights’,https://www.ctvnews.ca/video/2025/10/03/review-new-taylor-swift-album-combines-sound-of-evermore-and-midnights/,"<a href=""https://www.ctvnews.ca/video/2025/10/03/review-new-taylor-swift-album-combines-sound-of-evermore-and-midnights/"">Review: New Taylor Swift album combines sound of ‘Evermore’ and ‘Midnights’</a>"
2,Lack of victim impact statements ‘says a lot’ in Sean ‘Diddy’ Combs trial: lawyer,https://www.ctvnews.ca/video/2025/10/03/lack-of-victim-impact-statements-says-a-lot-in-sean-diddy-combs-trial-lawyer/,"<a href=""https://www.ctvnews.ca/video/2025/10/03/lack-of-victim-impact-statements-says-a-lot-in-sean-diddy-combs-trial-lawyer/"">Lack of victim impact statements ‘says a lot’ in Sean ‘Diddy’ Combs trial: lawyer</a>"
3,Teachers’ association says more funding needed for Alberta schools,https://www.ctvnews.ca/video/2025/10/03/teachers-association-says-more-funding-needed-for-alberta-schools/,"<a href=""https://www.ctvnews.ca/video/2025/10/03/teachers-association-says-more-funding-needed-for-alberta-schools/"">Teachers’ association says more funding needed for Alberta schools</a>"
4,PM Carney’s meeting with Trump next week could come with some ‘dangers’: Mulcair,https://www.ctvnews.ca/video/2025/10/03/pm-carneys-meeting-with-trump-next-week-could-come-with-some-dangers-mulcair/,"<a href=""https://www.ctvnews.ca/video/2025/10/03/pm-carneys-meeting-with-trump-next-week-could-come-with-some-dangers-mulcair/"">PM Carney’s meeting with Trump next week could come with some ‘dangers’: Mulcair</a>"
5,Pitcher Kevin Gausman reflects on four years with the Blue Jays,https://www.ctvnews.ca/video/2025/10/03/pitcher-kevin-gausman-reflects-on-four-years-with-the-blue-jays/,"<a href=""https://www.ctvnews.ca/video/2025/10/03/pitcher-kevin-gausman-reflects-on-four-years-with-the-blue-jays/"">Pitcher Kevin Gausman reflects on four years with the Blue Jays</a>"
6,Is there an ‘off-ramp’ for Canada-U.S. trade tensions?,https://www.ctvnews.ca/video/2025/10/03/is-there-an-off-ramp-for-canada-us-trade-tensions/,"<a href=""https://www.ctvnews.ca/video/2025/10/03/is-there-an-off-ramp-for-canada-us-trade-tensions/"">Is there an ‘off-ramp’ for Canada-U.S. trade tensions?</a>"
7,Ottawa announces plans to make big defence purchases,https://www.ctvnews.ca/video/2025/10/02/ctv-national-news-ottawa-announces-plans-to-make-big-defence-purchases/,"<a href=""https://www.ctvnews.ca/video/2025/10/02/ctv-national-news-ottawa-announces-plans-to-make-big-defence-purchases/"">Ottawa announces plans to make big defence purchases</a>"
8,Ostrich cull decision may not ‘meet the criteria’ for Supreme Court to hear: lawyer,https://www.ctvnews.ca/video/2025/10/03/ostrich-cull-decision-may-not-meet-the-criteria-for-supreme-court-to-hear-lawyer/,"<a href=""https://www.ctvnews.ca/video/2025/10/03/ostrich-cull-decision-may-not-meet-the-criteria-for-supreme-court-to-hear-lawyer/"">Ostrich cull decision may not ‘meet the criteria’ for Supreme Court to hear: lawyer</a>"
