rank,Article title,url,title_with_link
1,Artemis II crew returns home today. Watch LIVE NASA coverage ahead of splashdown,https://www.ctvnews.ca/video/live/2026/04/09/artemis-ii-crew-returns-home-today-watch-live-nasa-coverage-ahead-of-splashdown/,"<a href=""https://www.ctvnews.ca/video/live/2026/04/09/artemis-ii-crew-returns-home-today-watch-live-nasa-coverage-ahead-of-splashdown/"">Artemis II crew returns home today. Watch LIVE NASA coverage ahead of splashdown</a>"
2,Astronaut Jeremy Hansen’s hometown high school hosting Artemis II return party,https://www.ctvnews.ca/video/2026/04/10/astronaut-jeremy-hansens-hometown-high-school-hosting-artemis-ii-return-party/,"<a href=""https://www.ctvnews.ca/video/2026/04/10/astronaut-jeremy-hansens-hometown-high-school-hosting-artemis-ii-return-party/"">Astronaut Jeremy Hansen’s hometown high school hosting Artemis II return party</a>"
3,"MP Gladu ‘clearing the record’ at Liberal convention over stances prior to defection, analyst says",https://www.ctvnews.ca/video/2026/04/10/mp-gladu-clearing-the-record-at-liberal-convention-over-stances-prior-to-defection-analyst-says/,"<a href=""https://www.ctvnews.ca/video/2026/04/10/mp-gladu-clearing-the-record-at-liberal-convention-over-stances-prior-to-defection-analyst-says/"">MP Gladu ‘clearing the record’ at Liberal convention over stances prior to defection, analyst says</a>"
4,How the high cost of diesel is having a 'trickle down effect' on food prices,https://www.ctvnews.ca/video/2026/04/10/how-the-high-cost-of-diesel-is-having-a-trickle-down-effect-on-food-prices/,"<a href=""https://www.ctvnews.ca/video/2026/04/10/how-the-high-cost-of-diesel-is-having-a-trickle-down-effect-on-food-prices/"">How the high cost of diesel is having a 'trickle down effect' on food prices</a>"
5,"‘Persistent indications’ in Parliament that there are more floor crossings ahead, Tom Mulcair says",https://www.ctvnews.ca/video/2026/04/10/persistent-indications-in-parliament-that-there-are-more-floor-crossings-ahead-tom-mulcair-says/,"<a href=""https://www.ctvnews.ca/video/2026/04/10/persistent-indications-in-parliament-that-there-are-more-floor-crossings-ahead-tom-mulcair-says/"">‘Persistent indications’ in Parliament that there are more floor crossings ahead, Tom Mulcair says</a>"
6,Animated simulation shows what the Artemis II crew’s journey back to Earth will look like,https://www.ctvnews.ca/video/2026/04/10/animated-simulation-shows-what-the-artemis-ii-crews-journey-back-to-earth-will-look-like/,"<a href=""https://www.ctvnews.ca/video/2026/04/10/animated-simulation-shows-what-the-artemis-ii-crews-journey-back-to-earth-will-look-like/"">Animated simulation shows what the Artemis II crew’s journey back to Earth will look like</a>"
7,Artemis II to endure ‘most dangerous part’ of mission ahead of splashdown: Here's what to expect,https://www.ctvnews.ca/video/2026/04/10/artemis-ii-to-endure-most-dangerous-part-of-mission-ahead-of-splashdown-heres-what-to-expect/,"<a href=""https://www.ctvnews.ca/video/2026/04/10/artemis-ii-to-endure-most-dangerous-part-of-mission-ahead-of-splashdown-heres-what-to-expect/"">Artemis II to endure ‘most dangerous part’ of mission ahead of splashdown: Here's what to expect</a>"
8,U.S. is not in a ‘very strong position’ heading into negotiations with Iran: Military expert,https://www.ctvnews.ca/video/2026/04/10/us-is-not-in-a-very-strong-position-heading-into-negotiations-with-iran-military-expert/,"<a href=""https://www.ctvnews.ca/video/2026/04/10/us-is-not-in-a-very-strong-position-heading-into-negotiations-with-iran-military-expert/"">U.S. is not in a ‘very strong position’ heading into negotiations with Iran: Military expert</a>"
