rank,Article title,url,title_with_link
1,First look: Navy divers crack open Orion capsule to greet Artemis II crew after splashdown,https://www.ctvnews.ca/video/2026/04/14/navy-divers-open-orion-hatch-to-welcome-artemis-ii-crew-in-newly-released-nasa-video/,"<a href=""https://www.ctvnews.ca/video/2026/04/14/navy-divers-open-orion-hatch-to-welcome-artemis-ii-crew-in-newly-released-nasa-video/"">First look: Navy divers crack open Orion capsule to greet Artemis II crew after splashdown</a>"
2,Watch the moment an earthquake shakes the House of Commons,https://www.ctvnews.ca/ottawa/video/2026/04/14/watch-the-moment-earthquake-rattles-house-of-commons/,"<a href=""https://www.ctvnews.ca/ottawa/video/2026/04/14/watch-the-moment-earthquake-rattles-house-of-commons/"">Watch the moment an earthquake shakes the House of Commons</a>"
3,'Manufactured' and 'costly': Poilievre takes aim at Carney's majority,https://www.ctvnews.ca/video/2026/04/14/manufactured-and-costly-poilievre-takes-aim-at-carneys-majority/,"<a href=""https://www.ctvnews.ca/video/2026/04/14/manufactured-and-costly-poilievre-takes-aim-at-carneys-majority/"">'Manufactured' and 'costly': Poilievre takes aim at Carney's majority</a>"
4,‘If you were Mr. Poilievre would you quit?’: reporter asks PM Carney about Opposition leader,https://www.ctvnews.ca/video/2026/04/14/if-you-were-mr-poilievre-would-you-quit-reporter-asks-pm-carney-about-opposition-leader/,"<a href=""https://www.ctvnews.ca/video/2026/04/14/if-you-were-mr-poilievre-would-you-quit-reporter-asks-pm-carney-about-opposition-leader/"">‘If you were Mr. Poilievre would you quit?’: reporter asks PM Carney about Opposition leader</a>"
5,Naked burglary suspect busted after string of break-ins in Virginia,https://www.ctvnews.ca/video/2026/04/14/naked-burglary-suspect-busted-after-string-of-break-ins-in-virginia/,"<a href=""https://www.ctvnews.ca/video/2026/04/14/naked-burglary-suspect-busted-after-string-of-break-ins-in-virginia/"">Naked burglary suspect busted after string of break-ins in Virginia</a>"
6,Body camera footage shows Georgia police catching kids jumping from burning home,https://www.ctvnews.ca/video/2026/04/14/body-camera-footage-shows-georgia-police-catching-kids-jumping-from-burning-home/,"<a href=""https://www.ctvnews.ca/video/2026/04/14/body-camera-footage-shows-georgia-police-catching-kids-jumping-from-burning-home/"">Body camera footage shows Georgia police catching kids jumping from burning home</a>"
7,'The whole back window was underwater': Two men rescue driver from sinking vehicle in Ontario,https://www.ctvnews.ca/london/video/2026/04/13/the-whole-back-window-was-underwater/,"<a href=""https://www.ctvnews.ca/london/video/2026/04/13/the-whole-back-window-was-underwater/"">'The whole back window was underwater': Two men rescue driver from sinking vehicle in Ontario</a>"
8,New Brunswick woman e-transfers more than $3.5K to wrong person,https://www.ctvnews.ca/atlantic/video/2026/04/14/new-brunswick-woman-e-transfers-more-than-35k-to-wrong-person/,"<a href=""https://www.ctvnews.ca/atlantic/video/2026/04/14/new-brunswick-woman-e-transfers-more-than-35k-to-wrong-person/"">New Brunswick woman e-transfers more than $3.5K to wrong person</a>"
