rank,Article title,url,title_with_link
1,"Fugitive murderer remains at large, alleged B.C. jailbreak accomplices arrested",https://www.ctvnews.ca/vancouver/video/2025/09/09/fugitive-murderer-remains-at-large-alleged-bc-jailbreak-accomplices-arrested/,"<a href=""https://www.ctvnews.ca/vancouver/video/2025/09/09/fugitive-murderer-remains-at-large-alleged-bc-jailbreak-accomplices-arrested/"">Fugitive murderer remains at large, alleged B.C. jailbreak accomplices arrested</a>"
2,Ontario official claims AI clone of her was used to threaten a potential mayoral candidate,https://www.ctvnews.ca/video/2025/09/08/ctv-national-news-ontario-official-claims-to-be-a-victim-of-ai-cloning/,"<a href=""https://www.ctvnews.ca/video/2025/09/08/ctv-national-news-ontario-official-claims-to-be-a-victim-of-ai-cloning/"">Ontario official claims AI clone of her was used to threaten a potential mayoral candidate</a>"
3,Researchers warn of possible public health emergency due to falling standards,https://www.ctvnews.ca/video/2025/09/08/ctv-national-news-researchers-warn-of-possible-public-health-emergency-due-to-falling-standards/,"<a href=""https://www.ctvnews.ca/video/2025/09/08/ctv-national-news-researchers-warn-of-possible-public-health-emergency-due-to-falling-standards/"">Researchers warn of possible public health emergency due to falling standards</a>"
4,What caused a WestJet flight to make a hard landing St. Maarten?,https://www.ctvnews.ca/video/2025/09/08/ctv-national-news-what-caused-a-westjet-flight-to-make-a-hard-landing-st-maarten/,"<a href=""https://www.ctvnews.ca/video/2025/09/08/ctv-national-news-what-caused-a-westjet-flight-to-make-a-hard-landing-st-maarten/"">What caused a WestJet flight to make a hard landing St. Maarten?</a>"
5,Is Ottawa’s $80M pledge for Atlantic Canada enough to combat U.S. tariffs?,https://www.ctvnews.ca/video/2025/09/08/ctv-national-news-is-ottawas-80m-pledge-for-atlantic-canada-enough/,"<a href=""https://www.ctvnews.ca/video/2025/09/08/ctv-national-news-is-ottawas-80m-pledge-for-atlantic-canada-enough/"">Is Ottawa’s $80M pledge for Atlantic Canada enough to combat U.S. tariffs?</a>"
6,Alberta amends book ban after mounting criticism,https://www.ctvnews.ca/video/2025/09/09/ctv-national-news-alberta-amends-book-ban-after-mounting-criticism/,"<a href=""https://www.ctvnews.ca/video/2025/09/09/ctv-national-news-alberta-amends-book-ban-after-mounting-criticism/"">Alberta amends book ban after mounting criticism</a>"
7,U.S. removal of de minimis exemption continues to impact Canadian businesses,https://www.ctvnews.ca/video/2025/09/08/ctv-national-news-us-removal-of-de-minimis-exemption-continues-to-impact-canadian-businesses/,"<a href=""https://www.ctvnews.ca/video/2025/09/08/ctv-national-news-us-removal-of-de-minimis-exemption-continues-to-impact-canadian-businesses/"">U.S. removal of de minimis exemption continues to impact Canadian businesses</a>"
8,"Aspiring Paralympian lives out his dream, sparring with MMA legend George St-Pierre",https://www.ctvnews.ca/video/2025/09/09/ctv-national-news-aspiring-paralympian-gets-a-chance-to-spar-with-an-mma-legend/,"<a href=""https://www.ctvnews.ca/video/2025/09/09/ctv-national-news-aspiring-paralympian-gets-a-chance-to-spar-with-an-mma-legend/"">Aspiring Paralympian lives out his dream, sparring with MMA legend George St-Pierre</a>"
