rank,Article title,url,title_with_link
1,Waterloo senior off the hook for $6K in skincare products,https://www.ctvnews.ca/kitchener/video/2025/11/13/waterloo-senior-off-the-hook-for-6k-in-skincare-products/,"<a href=""https://www.ctvnews.ca/kitchener/video/2025/11/13/waterloo-senior-off-the-hook-for-6k-in-skincare-products/"">Waterloo senior off the hook for $6K in skincare products</a>"
2,Sour Puss owner says the company had ‘no choice’ but to move production to Canada,https://www.ctvnews.ca/video/2025/11/13/sour-puss-owner-says-the-company-had-no-choice-but-to-move-production-to-canada/,"<a href=""https://www.ctvnews.ca/video/2025/11/13/sour-puss-owner-says-the-company-had-no-choice-but-to-move-production-to-canada/"">Sour Puss owner says the company had ‘no choice’ but to move production to Canada</a>"
3,Still many years before Prime Minister Carney’s major projects come to fruition: McLaughlin,https://www.ctvnews.ca/video/2025/11/13/still-many-years-before-prime-minister-carneys-major-projects-come-to-fruition-mclaughlin/,"<a href=""https://www.ctvnews.ca/video/2025/11/13/still-many-years-before-prime-minister-carneys-major-projects-come-to-fruition-mclaughlin/"">Still many years before Prime Minister Carney’s major projects come to fruition: McLaughlin</a>"
4,New sanctions aimed at Russia after G7 meeting,https://www.ctvnews.ca/video/2025/11/13/new-sanctions-aimed-at-russia-after-g7-meeting/,"<a href=""https://www.ctvnews.ca/video/2025/11/13/new-sanctions-aimed-at-russia-after-g7-meeting/"">New sanctions aimed at Russia after G7 meeting</a>"
5,Passenger video helps in Ontario judge’s ruling against Air Transit,https://www.ctvnews.ca/video/2025/11/12/ctv-national-news-passenger-video-helps-in-ontario-judges-ruling-against-air-transat/,"<a href=""https://www.ctvnews.ca/video/2025/11/12/ctv-national-news-passenger-video-helps-in-ontario-judges-ruling-against-air-transat/"">Passenger video helps in Ontario judge’s ruling against Air Transit</a>"
6,"Quebec in throes of health-care crisis, doctor exodus over Bill 2",https://www.ctvnews.ca/video/2025/11/12/ctv-national-news-quebec-in-throes-of-health-care-crisis-doctor-exodus-over-bill-2/,"<a href=""https://www.ctvnews.ca/video/2025/11/12/ctv-national-news-quebec-in-throes-of-health-care-crisis-doctor-exodus-over-bill-2/"">Quebec in throes of health-care crisis, doctor exodus over Bill 2</a>"
7,U.S. President Trump mentioned multiple times in Epstein emails,https://www.ctvnews.ca/video/2025/11/12/ctv-national-news-us-president-trump-mentioned-multiple-times-in-epstein-emails/,"<a href=""https://www.ctvnews.ca/video/2025/11/12/ctv-national-news-us-president-trump-mentioned-multiple-times-in-epstein-emails/"">U.S. President Trump mentioned multiple times in Epstein emails</a>"
8,"New mining, energy developments expected in second phase of major projects",https://www.ctvnews.ca/video/2025/11/12/ctv-national-news-new-mining-energy-developments-expected-in-second-phase-of-major-projects/,"<a href=""https://www.ctvnews.ca/video/2025/11/12/ctv-national-news-new-mining-energy-developments-expected-in-second-phase-of-major-projects/"">New mining, energy developments expected in second phase of major projects</a>"
