rank,Article title,url,title_with_link
1,"Federal government to limit tariff-free auto imports as Stellantis, GM, move to U.S.",https://www.ctvnews.ca/video/2025/10/24/federal-government-to-limit-tariff-free-auto-imports-as-stellantis-gm-move-to-us/,"<a href=""https://www.ctvnews.ca/video/2025/10/24/federal-government-to-limit-tariff-free-auto-imports-as-stellantis-gm-move-to-us/"">Federal government to limit tariff-free auto imports as Stellantis, GM, move to U.S.</a>"
2,"Liberal bail reform legislation ‘makes intuitive sense,’ but issues remain in jail system",https://www.ctvnews.ca/video/2025/10/23/liberal-bail-reform-legislation-makes-intuitive-sense-but-issues-remain-in-jail-system/,"<a href=""https://www.ctvnews.ca/video/2025/10/23/liberal-bail-reform-legislation-makes-intuitive-sense-but-issues-remain-in-jail-system/"">Liberal bail reform legislation ‘makes intuitive sense,’ but issues remain in jail system</a>"
3,"‘This was the NBA’s biggest fear’: FBI arrests NBA coaches, players in illegal gambling scandal",https://www.ctvnews.ca/video/2025/10/23/this-was-the-nbas-biggest-fear-fbi-arrests-nba-coaches-players-in-illegal-gambling-scandal/,"<a href=""https://www.ctvnews.ca/video/2025/10/23/this-was-the-nbas-biggest-fear-fbi-arrests-nba-coaches-players-in-illegal-gambling-scandal/"">‘This was the NBA’s biggest fear’: FBI arrests NBA coaches, players in illegal gambling scandal</a>"
4,FBI’s illegal gambling takedown shows ‘soft spot’ in sports betting: industry expert,https://www.ctvnews.ca/video/2025/10/23/fbis-illegal-gambling-takedown-shows-soft-spot-in-sports-betting-industry-expert/,"<a href=""https://www.ctvnews.ca/video/2025/10/23/fbis-illegal-gambling-takedown-shows-soft-spot-in-sports-betting-industry-expert/"">FBI’s illegal gambling takedown shows ‘soft spot’ in sports betting: industry expert</a>"
5,What PM Carney’s call to prepare for ‘sacrifices’ means before budget release,https://www.ctvnews.ca/video/2025/10/23/ctv-national-news-what-pm-carneys-call-to-prepare-for-sacrifices-means-before-budget-release/,"<a href=""https://www.ctvnews.ca/video/2025/10/23/ctv-national-news-what-pm-carneys-call-to-prepare-for-sacrifices-means-before-budget-release/"">What PM Carney’s call to prepare for ‘sacrifices’ means before budget release</a>"
6,NBA coach and player among 34 arrested in sports rigging probe,https://www.ctvnews.ca/video/2025/10/23/ctv-national-news-nba-coach-and-player-among-34-arrested-in-sports-rigging-probe/,"<a href=""https://www.ctvnews.ca/video/2025/10/23/ctv-national-news-nba-coach-and-player-among-34-arrested-in-sports-rigging-probe/"">NBA coach and player among 34 arrested in sports rigging probe</a>"
7,Blue Jays ticket surge prompts Ontario to consider cap on resale prices,https://www.ctvnews.ca/video/2025/10/23/ctv-national-news-blue-jays-ticket-surge-prompts-ontario-to-consider-cap-on-resale-prices/,"<a href=""https://www.ctvnews.ca/video/2025/10/23/ctv-national-news-blue-jays-ticket-surge-prompts-ontario-to-consider-cap-on-resale-prices/"">Blue Jays ticket surge prompts Ontario to consider cap on resale prices</a>"
8,‘Make this country proud of us’: Inside the Blue Jays’ World Series preparations,https://www.ctvnews.ca/video/2025/10/23/ctv-national-news-blue-jays-speak-about-their-world-series-preparations/,"<a href=""https://www.ctvnews.ca/video/2025/10/23/ctv-national-news-blue-jays-speak-about-their-world-series-preparations/"">‘Make this country proud of us’: Inside the Blue Jays’ World Series preparations</a>"
