rank,Article title,url,title_with_link
1,LIVE NOW: Donald Trump delivers special address at WEF,https://www.ctvnews.ca/video/live/2026/01/20/live-donald-trump-delivers-special-address-at-wef/,"<a href=""https://www.ctvnews.ca/video/live/2026/01/20/live-donald-trump-delivers-special-address-at-wef/"">LIVE NOW: Donald Trump delivers special address at WEF</a>"
2,Family warns others after narrowly avoiding paying $34K to questionable door-to-door roofers,https://www.ctvnews.ca/toronto/video/2026/01/21/family-speaks-out-after-narrowly-avoiding-paying-34000-to-door-to-door-roofers/,"<a href=""https://www.ctvnews.ca/toronto/video/2026/01/21/family-speaks-out-after-narrowly-avoiding-paying-34000-to-door-to-door-roofers/"">Family warns others after narrowly avoiding paying $34K to questionable door-to-door roofers</a>"
3,Ottawa woman waits nearly three hours for an ambulance after breaking both legs,https://www.ctvnews.ca/ottawa/video/2026/01/20/lengthy-wait-for-an-ottawa-ambulance/,"<a href=""https://www.ctvnews.ca/ottawa/video/2026/01/20/lengthy-wait-for-an-ottawa-ambulance/"">Ottawa woman waits nearly three hours for an ambulance after breaking both legs</a>"
4,'He wants to be the centre of attention': Mulcair on what to expect as Trump heads to Davos,https://www.ctvnews.ca/video/2026/01/21/he-wants-to-be-the-centre-of-attention-mulcair-on-what-to-expect-as-trump-heads-to-davos/,"<a href=""https://www.ctvnews.ca/video/2026/01/21/he-wants-to-be-the-centre-of-attention-mulcair-on-what-to-expect-as-trump-heads-to-davos/"">'He wants to be the centre of attention': Mulcair on what to expect as Trump heads to Davos</a>"
5,‘Everything was just blown up’: Car goes airborne and throws driver into pool in wild car crash,https://www.ctvnews.ca/video/2026/01/21/everything-was-just-blown-up-car-goes-airborne-and-throws-driver-into-pool-in-wild-car-crash/,"<a href=""https://www.ctvnews.ca/video/2026/01/21/everything-was-just-blown-up-car-goes-airborne-and-throws-driver-into-pool-in-wild-car-crash/"">‘Everything was just blown up’: Car goes airborne and throws driver into pool in wild car crash</a>"
6,Dog rescued after four hours stranded on icy river,https://www.ctvnews.ca/video/2026/01/21/dog-rescued-after-four-hours-stranded-on-icy-river/,"<a href=""https://www.ctvnews.ca/video/2026/01/21/dog-rescued-after-four-hours-stranded-on-icy-river/"">Dog rescued after four hours stranded on icy river</a>"
7,Carney’s unifying speech at WEF garners international attention,https://www.ctvnews.ca/video/2026/01/20/ctv-national-news-carneys-unifying-speech-at-wef-garners-international-attention/,"<a href=""https://www.ctvnews.ca/video/2026/01/20/ctv-national-news-carneys-unifying-speech-at-wef-garners-international-attention/"">Carney’s unifying speech at WEF garners international attention</a>"
8,Search on for suspects who crushed coyotes on their snowmobiles in Saskatchewan,https://www.ctvnews.ca/saskatoon/video/2026/01/21/sask-seeks-suspects-who-crushed-coyotes-on-their-snowmobiles/,"<a href=""https://www.ctvnews.ca/saskatoon/video/2026/01/21/sask-seeks-suspects-who-crushed-coyotes-on-their-snowmobiles/"">Search on for suspects who crushed coyotes on their snowmobiles in Saskatchewan</a>"
