rank,Article title,url,title_with_link
1,Prince Andrew arrested on 66th birthday amid Epstein investigation,https://www.ctvnews.ca/video/2026/02/19/ctv-national-news-prince-andrew-arrested-on-66th-birthday-amid-epstein-investigation/,"<a href=""https://www.ctvnews.ca/video/2026/02/19/ctv-national-news-prince-andrew-arrested-on-66th-birthday-amid-epstein-investigation/"">Prince Andrew arrested on 66th birthday amid Epstein investigation</a>"
2,King Charles releases statement about former prince Andrew’s arrest,https://www.ctvnews.ca/video/2026/02/20/king-charles-releases-statement-about-former-prince-andrews-arrest/,"<a href=""https://www.ctvnews.ca/video/2026/02/20/king-charles-releases-statement-about-former-prince-andrews-arrest/"">King Charles releases statement about former prince Andrew’s arrest</a>"
3,"Arrest of Andrew ’a shame,’ and ‘a very sad thing’ for Royal Family: Trump",https://www.ctvnews.ca/video/2026/02/19/arrest-of-andrew-a-shame-and-a-very-sad-thing-for-royal-family-trump/,"<a href=""https://www.ctvnews.ca/video/2026/02/19/arrest-of-andrew-a-shame-and-a-very-sad-thing-for-royal-family-trump/"">Arrest of Andrew ’a shame,’ and ‘a very sad thing’ for Royal Family: Trump</a>"
4,'This is an extraordinary day for the monarchy': Royal commentator on Andrew's arrest,https://www.ctvnews.ca/video/2026/02/19/ctv-national-news-this-is-an-extraordinary-day-for-the-monarchy-royal-commentator-on-andrews-ar/,"<a href=""https://www.ctvnews.ca/video/2026/02/19/ctv-national-news-this-is-an-extraordinary-day-for-the-monarchy-royal-commentator-on-andrews-ar/"">'This is an extraordinary day for the monarchy': Royal commentator on Andrew's arrest</a>"
5,No big moment came from any of the five candidates for the NDP leadership: Aiello,https://www.ctvnews.ca/video/2026/02/20/no-big-moment-came-from-any-of-the-five-candidates-for-the-ndp-leadership-aiello/,"<a href=""https://www.ctvnews.ca/video/2026/02/20/no-big-moment-came-from-any-of-the-five-candidates-for-the-ndp-leadership-aiello/"">No big moment came from any of the five candidates for the NDP leadership: Aiello</a>"
6,Smith’s announcement of immigration referendum ‘a distraction exercise’: analyst,https://www.ctvnews.ca/video/2026/02/20/smiths-announcement-of-immigration-referendum-a-distraction-exercise-analyst/,"<a href=""https://www.ctvnews.ca/video/2026/02/20/smiths-announcement-of-immigration-referendum-a-distraction-exercise-analyst/"">Smith’s announcement of immigration referendum ‘a distraction exercise’: analyst</a>"
7,'We are taking back control of our Canadian economy': Finance minister on CUSMA and global trade,https://www.ctvnews.ca/video/2026/02/19/we-are-taking-back-control-of-our-canadian-economy-finance-minister-on-cusma-and-global-trade/,"<a href=""https://www.ctvnews.ca/video/2026/02/19/we-are-taking-back-control-of-our-canadian-economy-finance-minister-on-cusma-and-global-trade/"">'We are taking back control of our Canadian economy': Finance minister on CUSMA and global trade</a>"
8,Ottawa unveils crackdown on violent extortion targeting businesses,https://www.ctvnews.ca/video/2026/02/19/ctv-national-news-ottawa-unveils-crackdown-on-violent-extortion-targeting-businesses/,"<a href=""https://www.ctvnews.ca/video/2026/02/19/ctv-national-news-ottawa-unveils-crackdown-on-violent-extortion-targeting-businesses/"">Ottawa unveils crackdown on violent extortion targeting businesses</a>"
