rank,Article title,url,title_with_link
1,Warning: Suspected boat carrying drugs blown up in Eastern Pacific,https://www.ctvnews.ca/video/2025/10/31/warning-suspected-boat-carrying-drugs-blown-up-in-eastern-pacific/,"<a href=""https://www.ctvnews.ca/video/2025/10/31/warning-suspected-boat-carrying-drugs-blown-up-in-eastern-pacific/"">Warning: Suspected boat carrying drugs blown up in Eastern Pacific</a>"
2,‘Active weather day’ across Canada on Halloween,https://www.ctvnews.ca/video/2025/10/31/active-weather-day-across-canada-on-halloween/,"<a href=""https://www.ctvnews.ca/video/2025/10/31/active-weather-day-across-canada-on-halloween/"">‘Active weather day’ across Canada on Halloween</a>"
3,"Five more people arrested in Louvre heist, but jewels still not found",https://www.ctvnews.ca/video/2025/10/31/five-more-people-arrested-in-louvre-heist-but-jewels-still-not-found/,"<a href=""https://www.ctvnews.ca/video/2025/10/31/five-more-people-arrested-in-louvre-heist-but-jewels-still-not-found/"">Five more people arrested in Louvre heist, but jewels still not found</a>"
4,Police officer appears at virtual court hearing without pants,https://www.ctvnews.ca/video/2025/10/31/police-officer-appears-at-virtual-court-hearing-without-pants/,"<a href=""https://www.ctvnews.ca/video/2025/10/31/police-officer-appears-at-virtual-court-hearing-without-pants/"">Police officer appears at virtual court hearing without pants</a>"
5,Dad released from ICE custody as daughter battles Stage 4 cancer,https://www.ctvnews.ca/video/2025/10/31/dad-released-from-ice-custody-as-daughter-battles-stage-4-cancer/,"<a href=""https://www.ctvnews.ca/video/2025/10/31/dad-released-from-ice-custody-as-daughter-battles-stage-4-cancer/"">Dad released from ICE custody as daughter battles Stage 4 cancer</a>"
6,New homeowner finds dead body of previous owner inside the house,https://www.ctvnews.ca/video/2025/10/31/new-homeowner-finds-dead-body-of-previous-owner-inside-the-house/,"<a href=""https://www.ctvnews.ca/video/2025/10/31/new-homeowner-finds-dead-body-of-previous-owner-inside-the-house/"">New homeowner finds dead body of previous owner inside the house</a>"
7,'You don't have to live like this': Poilievre addresses youth 'hopelessness' in pre-budget speech,https://www.ctvnews.ca/video/2025/10/31/you-dont-have-to-live-like-this-poilievre-addresses-youth-hopelessness-in-pre-budget-speech/,"<a href=""https://www.ctvnews.ca/video/2025/10/31/you-dont-have-to-live-like-this-poilievre-addresses-youth-hopelessness-in-pre-budget-speech/"">'You don't have to live like this': Poilievre addresses youth 'hopelessness' in pre-budget speech</a>"
8,Brad Marchand returns home as guest coach honouring friend’s daughter,https://www.ctvnews.ca/video/2025/10/31/ctv-national-news-brad-marchand-returns-home-as-guest-coach-honouring-friends-daughter/,"<a href=""https://www.ctvnews.ca/video/2025/10/31/ctv-national-news-brad-marchand-returns-home-as-guest-coach-honouring-friends-daughter/"">Brad Marchand returns home as guest coach honouring friend’s daughter</a>"
