rank,Article title,url,title_with_link
1,LIVE SOON: Question period in the House of Commons,https://www.ctvnews.ca/video/live/2025/09/15/live-soon-question-period-in-the-house-of-commons/,"<a href=""https://www.ctvnews.ca/video/live/2025/09/15/live-soon-question-period-in-the-house-of-commons/"">LIVE SOON: Question period in the House of Commons</a>"
2,LIVE NOW: Utah officials to formally charge Charlie Kirk shooting suspect,https://www.ctvnews.ca/video/live/2025/09/16/live-now-utah-officials-to-formally-charge-charlie-kirk-shooting-suspect/,"<a href=""https://www.ctvnews.ca/video/live/2025/09/16/live-now-utah-officials-to-formally-charge-charlie-kirk-shooting-suspect/"">LIVE NOW: Utah officials to formally charge Charlie Kirk shooting suspect</a>"
3,Suspect in Ontario distraction theft hugs and kisses senior while putting fake jewelry on her,https://www.ctvnews.ca/video/2025/09/16/suspect-in-hamilton-distraction-theft-hugs-and-kisses-senior-while-putting-fake-jewelry-on-her/,"<a href=""https://www.ctvnews.ca/video/2025/09/16/suspect-in-hamilton-distraction-theft-hugs-and-kisses-senior-while-putting-fake-jewelry-on-her/"">Suspect in Ontario distraction theft hugs and kisses senior while putting fake jewelry on her</a>"
4,‘It’s unbelievable’: Katzberg on winning gold in hammer throw at world championship,https://www.ctvnews.ca/video/2025/09/16/its-unbelievable-katzberg-on-winning-gold-in-hammer-throw-at-world-championship/,"<a href=""https://www.ctvnews.ca/video/2025/09/16/its-unbelievable-katzberg-on-winning-gold-in-hammer-throw-at-world-championship/"">‘It’s unbelievable’: Katzberg on winning gold in hammer throw at world championship</a>"
5,Video shows moment police arrest suspects wanted in ‘violent’ carjacking in Oshawa,https://www.ctvnews.ca/toronto/video/2025/09/16/video-shows-moment-police-arrest-suspects-wanted-in-violent-carjacking-in-oshawa/,"<a href=""https://www.ctvnews.ca/toronto/video/2025/09/16/video-shows-moment-police-arrest-suspects-wanted-in-violent-carjacking-in-oshawa/"">Video shows moment police arrest suspects wanted in ‘violent’ carjacking in Oshawa</a>"
6,‘Most powerful political leader in the country who has not served as PM’: Reid on Freeland,https://www.ctvnews.ca/video/2025/09/16/most-powerful-political-leader-in-the-country-who-has-not-served-as-pm-reid-on-freeland/,"<a href=""https://www.ctvnews.ca/video/2025/09/16/most-powerful-political-leader-in-the-country-who-has-not-served-as-pm-reid-on-freeland/"">‘Most powerful political leader in the country who has not served as PM’: Reid on Freeland</a>"
7,Witnesses describe ‘surreal’ moment plane crashed onto Toronto soccer field,https://www.ctvnews.ca/toronto/video/2025/09/16/witnesses-describe-surreal-moment-plane-crashed-onto-toronto-soccer-field/,"<a href=""https://www.ctvnews.ca/toronto/video/2025/09/16/witnesses-describe-surreal-moment-plane-crashed-onto-toronto-soccer-field/"">Witnesses describe ‘surreal’ moment plane crashed onto Toronto soccer field</a>"
8,Why Canada is seeing a recent uptick in COVID-19 cases: Dr. Marla Shapiro,https://www.ctvnews.ca/video/2025/09/16/covid-19-cases-climbing-across-canada/,"<a href=""https://www.ctvnews.ca/video/2025/09/16/covid-19-cases-climbing-across-canada/"">Why Canada is seeing a recent uptick in COVID-19 cases: Dr. Marla Shapiro</a>"
