rank,Article title,url,title_with_link
1,‘We got him’: Utah governor confirms arrest of suspect in Charlie Kirk killing,https://www.ctvnews.ca/video/2025/09/12/we-got-him-utah-governor-confirms-arrest-of-suspect-in-charlie-kirk-killing/,"<a href=""https://www.ctvnews.ca/video/2025/09/12/we-got-him-utah-governor-confirms-arrest-of-suspect-in-charlie-kirk-killing/"">‘We got him’: Utah governor confirms arrest of suspect in Charlie Kirk killing</a>"
2,‘No way!’: Townsend reacts to Trump’s claims Russian drones invading Poland was an accident,https://www.ctvnews.ca/video/2025/09/12/no-way-townsend-reacts-to-trumps-claims-russian-drones-invading-poland-was-an-accident/,"<a href=""https://www.ctvnews.ca/video/2025/09/12/no-way-townsend-reacts-to-trumps-claims-russian-drones-invading-poland-was-an-accident/"">‘No way!’: Townsend reacts to Trump’s claims Russian drones invading Poland was an accident</a>"
3,"‘He’s got a knife, he’s in the garage’: Chilling 911 call and video in Bowmanville, Ont. home invasion",https://www.ctvnews.ca/toronto/video/2025/09/12/hes-got-a-knife-hes-in-the-garage-chilling-911-call-and-video-in-bowmanville-home-invasion/,"<a href=""https://www.ctvnews.ca/toronto/video/2025/09/12/hes-got-a-knife-hes-in-the-garage-chilling-911-call-and-video-in-bowmanville-home-invasion/"">‘He’s got a knife, he’s in the garage’: Chilling 911 call and video in Bowmanville, Ont. home invasion</a>"
4,"Student, teacher get in physical altercation over cell phone in the classroom",https://www.ctvnews.ca/video/2025/09/12/student-teacher-get-in-physical-altercation-over-cell-phone-in-the-classroom/,"<a href=""https://www.ctvnews.ca/video/2025/09/12/student-teacher-get-in-physical-altercation-over-cell-phone-in-the-classroom/"">Student, teacher get in physical altercation over cell phone in the classroom</a>"
5,Family of suspect turning him in an ‘interesting twist’ in the investigation: former FBI analyst,https://www.ctvnews.ca/video/2025/09/12/family-of-suspect-turning-him-in-an-interesting-twist-in-the-investigation-former-fbi-analyst/,"<a href=""https://www.ctvnews.ca/video/2025/09/12/family-of-suspect-turning-him-in-an-interesting-twist-in-the-investigation-former-fbi-analyst/"">Family of suspect turning him in an ‘interesting twist’ in the investigation: former FBI analyst</a>"
6,WARNING: Man arrested after allegedly beheading Texas motel manager,https://www.ctvnews.ca/video/2025/09/12/warning-man-arrested-after-allegedly-beheading-texas-motel-manager/,"<a href=""https://www.ctvnews.ca/video/2025/09/12/warning-man-arrested-after-allegedly-beheading-texas-motel-manager/"">WARNING: Man arrested after allegedly beheading Texas motel manager</a>"
7,‘We have made historic progress for Charlie’: officials confirm the arrest of 22-year-old suspect,https://www.ctvnews.ca/video/2025/09/12/we-have-made-historic-progress-for-charlie-officials-confirm-the-arrest-of-22-year-old-suspect/,"<a href=""https://www.ctvnews.ca/video/2025/09/12/we-have-made-historic-progress-for-charlie-officials-confirm-the-arrest-of-22-year-old-suspect/"">‘We have made historic progress for Charlie’: officials confirm the arrest of 22-year-old suspect</a>"
8,Hamilton Tiger-Cats GM Ted Goveia dead after battle with cancer,https://www.ctvnews.ca/video/2025/09/12/hamilton-tiger-cats-gm-ted-goveia-dead-after-battle-with-cancer/,"<a href=""https://www.ctvnews.ca/video/2025/09/12/hamilton-tiger-cats-gm-ted-goveia-dead-after-battle-with-cancer/"">Hamilton Tiger-Cats GM Ted Goveia dead after battle with cancer</a>"
