rank,Article title,url,title_with_link
1,TikTok collected geographical and biometric information from Canadian users: B.C. official,https://www.ctvnews.ca/video/2025/09/24/tiktok-collected-geographical-and-biometric-information-from-canadian-users-bc-official/,"<a href=""https://www.ctvnews.ca/video/2025/09/24/tiktok-collected-geographical-and-biometric-information-from-canadian-users-bc-official/"">TikTok collected geographical and biometric information from Canadian users: B.C. official</a>"
2,‘We don’t know if this is going to last’: Ham on Trump’s shift in support for Ukraine,https://www.ctvnews.ca/video/2025/09/24/we-dont-know-if-this-is-going-to-last-ham-on-trumps-shift-in-support-for-ukraine/,"<a href=""https://www.ctvnews.ca/video/2025/09/24/we-dont-know-if-this-is-going-to-last-ham-on-trumps-shift-in-support-for-ukraine/"">‘We don’t know if this is going to last’: Ham on Trump’s shift in support for Ukraine</a>"
3,PM Carney says Canada recognizing Palestinian state 'part of a coordinated effort' to achieve peace,https://www.ctvnews.ca/video/2025/09/24/pm-carney-says-canada-recognizing-palestinian-state-part-of-a-coordinated-effort-to-achieve-peace/,"<a href=""https://www.ctvnews.ca/video/2025/09/24/pm-carney-says-canada-recognizing-palestinian-state-part-of-a-coordinated-effort-to-achieve-peace/"">PM Carney says Canada recognizing Palestinian state 'part of a coordinated effort' to achieve peace</a>"
4,Donald Trump delivers harsh words at UN,https://www.ctvnews.ca/video/2025/09/23/ctv-national-news-donald-trump-delivers-harsh-words-at-un/,"<a href=""https://www.ctvnews.ca/video/2025/09/23/ctv-national-news-donald-trump-delivers-harsh-words-at-un/"">Donald Trump delivers harsh words at UN</a>"
5,Search for missing 5-year-old Alberta boy enters third day,https://www.ctvnews.ca/calgary/video/2025/09/24/search-continues-for-missing-boy/,"<a href=""https://www.ctvnews.ca/calgary/video/2025/09/24/search-continues-for-missing-boy/"">Search for missing 5-year-old Alberta boy enters third day</a>"
6,Owners of B.C. ostrich farm at centre of looming cull arrested,https://www.ctvnews.ca/video/2025/09/23/ctv-national-news-owners-of-ostrich-farm-at-centre-of-looming-cull-arrested/,"<a href=""https://www.ctvnews.ca/video/2025/09/23/ctv-national-news-owners-of-ostrich-farm-at-centre-of-looming-cull-arrested/"">Owners of B.C. ostrich farm at centre of looming cull arrested</a>"
7,Details emerging in fatal police shooting of teen near Montreal,https://www.ctvnews.ca/video/2025/09/23/ctv-national-news-details-emerging-in-fatal-police-shooting-of-teen-near-montreal/,"<a href=""https://www.ctvnews.ca/video/2025/09/23/ctv-national-news-details-emerging-in-fatal-police-shooting-of-teen-near-montreal/"">Details emerging in fatal police shooting of teen near Montreal</a>"
8,Family of Montreal woman gets closure after her killer is identified 17 years after her death,https://www.ctvnews.ca/montreal/video/2025/09/23/family-of-slain-girl-coming-to-terms-with-justice-17-years-later/,"<a href=""https://www.ctvnews.ca/montreal/video/2025/09/23/family-of-slain-girl-coming-to-terms-with-justice-17-years-later/"">Family of Montreal woman gets closure after her killer is identified 17 years after her death</a>"
