rank,Article title,url,title_with_link
1,Senior dies after being hit by Jeep captured driving recklessly on sidewalk in Vancouver,https://www.ctvnews.ca/vancouver/video/2026/05/28/senior-hit-by-vehicle-in-west-end-has-died/,"<a href=""https://www.ctvnews.ca/vancouver/video/2026/05/28/senior-hit-by-vehicle-in-west-end-has-died/"">Senior dies after being hit by Jeep captured driving recklessly on sidewalk in Vancouver</a>"
2,Police thank community for support after missing Toronto teen found safe,https://www.ctvnews.ca/toronto/video/2026/05/28/police-thank-community-for-support-after-missing-teen-girl-found-safe/,"<a href=""https://www.ctvnews.ca/toronto/video/2026/05/28/police-thank-community-for-support-after-missing-teen-girl-found-safe/"">Police thank community for support after missing Toronto teen found safe</a>"
3,‘Nature does its own thing’: Deer breaks through glass door to get into school,https://www.ctvnews.ca/video/2026/05/28/nature-does-its-own-thing-deer-breaks-through-glass-door-to-get-into-school/,"<a href=""https://www.ctvnews.ca/video/2026/05/28/nature-does-its-own-thing-deer-breaks-through-glass-door-to-get-into-school/"">‘Nature does its own thing’: Deer breaks through glass door to get into school</a>"
4,Non-residents hit with fines for parking at this Montreal transit station,https://www.ctvnews.ca/montreal/video/2026/05/28/no-parking-at-kirkland-rem-station-for-non-residents/,"<a href=""https://www.ctvnews.ca/montreal/video/2026/05/28/no-parking-at-kirkland-rem-station-for-non-residents/"">Non-residents hit with fines for parking at this Montreal transit station</a>"
5,B.C.'s top doctor says stronger alcohol should be more expensive,https://www.ctvnews.ca/video/2026/05/28/bcs-top-doctor-says-stronger-alcohol-should-be-more-expensive/,"<a href=""https://www.ctvnews.ca/video/2026/05/28/bcs-top-doctor-says-stronger-alcohol-should-be-more-expensive/"">B.C.'s top doctor says stronger alcohol should be more expensive</a>"
6,Calgary woman speaks out after brutal attack on CTrain platform,https://www.ctvnews.ca/calgary/video/2026/05/27/woman-speaking-out-about-attack-on-ctrain-platform/,"<a href=""https://www.ctvnews.ca/calgary/video/2026/05/27/woman-speaking-out-about-attack-on-ctrain-platform/"">Calgary woman speaks out after brutal attack on CTrain platform</a>"
7,U.S. treasury secretary denies Trump’s threats against Oman,https://www.ctvnews.ca/video/2026/05/28/us-treasury-secretary-denies-trumps-threats-against-oman/,"<a href=""https://www.ctvnews.ca/video/2026/05/28/us-treasury-secretary-denies-trumps-threats-against-oman/"">U.S. treasury secretary denies Trump’s threats against Oman</a>"
8,Rogue tire narrowly misses police vehicle on Colorado highway,https://www.ctvnews.ca/video/2026/05/28/rogue-tire-narrowly-misses-police-vehicle-on-colorado-highway/,"<a href=""https://www.ctvnews.ca/video/2026/05/28/rogue-tire-narrowly-misses-police-vehicle-on-colorado-highway/"">Rogue tire narrowly misses police vehicle on Colorado highway</a>"
