rank,Article title,url,title_with_link
1,Doctors perform surgery as earthquake hits cancer centre in Russia,https://www.ctvnews.ca/video/2025/07/30/doctors-perform-surgery-as-earthquake-hits-cancer-centre-in-russia/,"<a href=""https://www.ctvnews.ca/video/2025/07/30/doctors-perform-surgery-as-earthquake-hits-cancer-centre-in-russia/"">Doctors perform surgery as earthquake hits cancer centre in Russia</a>"
2,How does an earthquake trigger a tsunami? Warnings in effect for B.C. coastline,https://www.ctvnews.ca/video/2025/07/30/how-does-an-earthquake-trigger-a-tsunami-warnings-in-effect-for-bc-coastline/,"<a href=""https://www.ctvnews.ca/video/2025/07/30/how-does-an-earthquake-trigger-a-tsunami-warnings-in-effect-for-bc-coastline/"">How does an earthquake trigger a tsunami? Warnings in effect for B.C. coastline</a>"
3,"Massive 8.8 quake strikes off Russia, triggering tsunami warnings in dozens of countries including Canada",https://www.ctvnews.ca/video/2025/07/30/massive-88-quake-strikes-off-russia-triggering-tsunami-warnings-in-dozens-of-countries/,"<a href=""https://www.ctvnews.ca/video/2025/07/30/massive-88-quake-strikes-off-russia-triggering-tsunami-warnings-in-dozens-of-countries/"">Massive 8.8 quake strikes off Russia, triggering tsunami warnings in dozens of countries including Canada</a>"
4,"Dramatic video shows car plowing into London, Ont. grocery store",https://www.ctvnews.ca/london/video/2025/07/29/dramatic-video-shows-car-drive-grocery-store/,"<a href=""https://www.ctvnews.ca/london/video/2025/07/29/dramatic-video-shows-car-drive-grocery-store/"">Dramatic video shows car plowing into London, Ont. grocery store</a>"
5,Dentist accused of killing his wife by poisoning her protein shakes faces trial,https://www.ctvnews.ca/video/2025/07/30/dentist-accused-of-killing-his-wife-by-poisoning-her-protein-shakes-faces-trial/,"<a href=""https://www.ctvnews.ca/video/2025/07/30/dentist-accused-of-killing-his-wife-by-poisoning-her-protein-shakes-faces-trial/"">Dentist accused of killing his wife by poisoning her protein shakes faces trial</a>"
6,Katy Perry set to take stage in Ottawa as fans react to dinner date with Justin Trudeau,https://www.ctvnews.ca/video/2025/07/29/katy-perry-set-to-take-stage-in-ottawa-as-fans-react-to-dinner-date-with-justin-trudeau/,"<a href=""https://www.ctvnews.ca/video/2025/07/29/katy-perry-set-to-take-stage-in-ottawa-as-fans-react-to-dinner-date-with-justin-trudeau/"">Katy Perry set to take stage in Ottawa as fans react to dinner date with Justin Trudeau</a>"
7,Vancouver police release images of suspects in attempted ‘strong-arm’ robbery of senior,https://www.ctvnews.ca/vancouver/video/2025/07/30/suspects-sought-in-strong-arm-attempted-robbery-of-senior/,"<a href=""https://www.ctvnews.ca/vancouver/video/2025/07/30/suspects-sought-in-strong-arm-attempted-robbery-of-senior/"">Vancouver police release images of suspects in attempted ‘strong-arm’ robbery of senior</a>"
8,Ottawa discussing following U.K.'s threat to recognize a Palestinian state over war in Gaza,https://www.ctvnews.ca/video/2025/07/30/ctv-national-news-ottawa-discussing-joining-uks-ultimatum-to-israel/,"<a href=""https://www.ctvnews.ca/video/2025/07/30/ctv-national-news-ottawa-discussing-joining-uks-ultimatum-to-israel/"">Ottawa discussing following U.K.'s threat to recognize a Palestinian state over war in Gaza</a>"
