rank,Article title,url,title_with_link
1,Majority of Canadians are 'satisfied' with the government under PM Carney: Leger,https://www.ctvnews.ca/video/2025/09/03/majority-of-canadians-are-satisfied-with-the-government-under-pm-carney-leger/,"<a href=""https://www.ctvnews.ca/video/2025/09/03/majority-of-canadians-are-satisfied-with-the-government-under-pm-carney-leger/"">Majority of Canadians are 'satisfied' with the government under PM Carney: Leger</a>"
2,"15 people dead, 18 injured following streetcar derailment in Lisbon",https://www.ctvnews.ca/video/2025/09/03/15-people-dead-18-injured-following-streetcar-derailment-in-lisbon/,"<a href=""https://www.ctvnews.ca/video/2025/09/03/15-people-dead-18-injured-following-streetcar-derailment-in-lisbon/"">15 people dead, 18 injured following streetcar derailment in Lisbon</a>"
3,Growing number of companies using AI to create interactive avatars of deceased loved ones,https://www.ctvnews.ca/video/2025/09/03/growing-number-of-companies-using-ai-to-create-interactive-avatars-of-deceased-loved-ones/,"<a href=""https://www.ctvnews.ca/video/2025/09/03/growing-number-of-companies-using-ai-to-create-interactive-avatars-of-deceased-loved-ones/"">Growing number of companies using AI to create interactive avatars of deceased loved ones</a>"
4,'China put on quite a show of military might and capacities': Advisor on China's military parade,https://www.ctvnews.ca/video/2025/09/03/china-put-on-quite-a-show-of-military-might-and-capacities-advisor-on-chinas-military-parade/,"<a href=""https://www.ctvnews.ca/video/2025/09/03/china-put-on-quite-a-show-of-military-might-and-capacities-advisor-on-chinas-military-parade/"">'China put on quite a show of military might and capacities': Advisor on China's military parade</a>"
5,Trial of former president a ‘historic moment in Brazil’s democracy’: analyst,https://www.ctvnews.ca/video/2025/09/03/trial-of-former-president-a-historic-moment-in-brazils-democracy-analyst/,"<a href=""https://www.ctvnews.ca/video/2025/09/03/trial-of-former-president-a-historic-moment-in-brazils-democracy-analyst/"">Trial of former president a ‘historic moment in Brazil’s democracy’: analyst</a>"
6,"Liberal cabinet meets to set agenda, outline budget priorities ahead of Carney-Poilievre clash",https://www.ctvnews.ca/video/2025/09/03/liberal-cabinet-meets-to-set-agenda-outline-budget-priorities-ahead-of-carney-poilievre-clash/,"<a href=""https://www.ctvnews.ca/video/2025/09/03/liberal-cabinet-meets-to-set-agenda-outline-budget-priorities-ahead-of-carney-poilievre-clash/"">Liberal cabinet meets to set agenda, outline budget priorities ahead of Carney-Poilievre clash</a>"
7,Moments before and after alleged drug boat shot down by U.S. forces in the southern Caribbean,https://www.ctvnews.ca/video/2025/09/03/moments-before-and-after-alleged-drug-boat-shot-down-by-us-forces-in-the-southern-caribbean/,"<a href=""https://www.ctvnews.ca/video/2025/09/03/moments-before-and-after-alleged-drug-boat-shot-down-by-us-forces-in-the-southern-caribbean/"">Moments before and after alleged drug boat shot down by U.S. forces in the southern Caribbean</a>"
8,'He swung at me twice and missed': B.C. town on edge after axe attack,https://www.ctvnews.ca/vancouver/video/2025/09/03/bc-town-on-edge-after-axe-attack/,"<a href=""https://www.ctvnews.ca/vancouver/video/2025/09/03/bc-town-on-edge-after-axe-attack/"">'He swung at me twice and missed': B.C. town on edge after axe attack</a>"
