rank,Article title,url,title_with_link
1,New ‘Build Canada Homes’ project ‘is no miracle’: MP Aitchison,https://www.ctvnews.ca/video/2026/01/12/new-build-canada-homes-project-is-no-miracle-mp-aitchison/,"<a href=""https://www.ctvnews.ca/video/2026/01/12/new-build-canada-homes-project-is-no-miracle-mp-aitchison/"">New ‘Build Canada Homes’ project ‘is no miracle’: MP Aitchison</a>"
2,Canada must ‘refresh a relationship with Xi Jinping’: Moore,https://www.ctvnews.ca/video/2026/01/12/canada-must-refresh-a-relationship-with-xi-jinping-moore/,"<a href=""https://www.ctvnews.ca/video/2026/01/12/canada-must-refresh-a-relationship-with-xi-jinping-moore/"">Canada must ‘refresh a relationship with Xi Jinping’: Moore</a>"
3,"Wild video shows driver thrown from car after losing control, spinning into homes",https://www.ctvnews.ca/video/2026/01/12/wild-video-shows-driver-thrown-from-car-after-losing-control-spinning-into-homes/,"<a href=""https://www.ctvnews.ca/video/2026/01/12/wild-video-shows-driver-thrown-from-car-after-losing-control-spinning-into-homes/"">Wild video shows driver thrown from car after losing control, spinning into homes</a>"
4,Stars of 'Heated Rivalry' present at the Golden Globes,https://www.ctvnews.ca/video/2026/01/12/stars-of-heated-rivalry-present-at-the-golden-globes/,"<a href=""https://www.ctvnews.ca/video/2026/01/12/stars-of-heated-rivalry-present-at-the-golden-globes/"">Stars of 'Heated Rivalry' present at the Golden Globes</a>"
5,LIVE: Update on Calgary watermain issues,https://www.ctvnews.ca/video/live/2026/01/09/live-update-on-calgary-watermain-issues/,"<a href=""https://www.ctvnews.ca/video/live/2026/01/09/live-update-on-calgary-watermain-issues/"">LIVE: Update on Calgary watermain issues</a>"
6,Ex-husband arrested in fatal shooting of Ohio couple while children at home,https://www.ctvnews.ca/video/2026/01/12/ex-husband-arrested-in-fatal-shooting-of-ohio-couple-while-kids-at-home/,"<a href=""https://www.ctvnews.ca/video/2026/01/12/ex-husband-arrested-in-fatal-shooting-of-ohio-couple-while-kids-at-home/"">Ex-husband arrested in fatal shooting of Ohio couple while children at home</a>"
7,Warning: U-Haul truck barrels through crowd at anti-Iranian regime demonstration in Los Angeles,https://www.ctvnews.ca/video/2026/01/12/warning-u-haul-truck-barrels-through-crowd-at-anti-iranian-regime-demonstration-in-los-angeles/,"<a href=""https://www.ctvnews.ca/video/2026/01/12/warning-u-haul-truck-barrels-through-crowd-at-anti-iranian-regime-demonstration-in-los-angeles/"">Warning: U-Haul truck barrels through crowd at anti-Iranian regime demonstration in Los Angeles</a>"
8,Challenge to assisted dying law heading to B.C. Supreme Court,https://www.ctvnews.ca/video/2026/01/12/challenge-to-assisted-dying-law-heading-to-bc-supreme-court/,"<a href=""https://www.ctvnews.ca/video/2026/01/12/challenge-to-assisted-dying-law-heading-to-bc-supreme-court/"">Challenge to assisted dying law heading to B.C. Supreme Court</a>"
