rank,Article title,url,title_with_link
1,B.C. mom meets the man whose life was saved by her late son's organ donation,https://www.ctvnews.ca/vancouver/video/2026/04/21/liver-transplant-recipient-meets-donors-mom/,"<a href=""https://www.ctvnews.ca/vancouver/video/2026/04/21/liver-transplant-recipient-meets-donors-mom/"">B.C. mom meets the man whose life was saved by her late son's organ donation</a>"
2,Farmers squeezed by rising costs amid Middle East instability,https://www.ctvnews.ca/video/2026/04/21/farmers-squeezed-by-rising-costs-amid-middle-east-instability/,"<a href=""https://www.ctvnews.ca/video/2026/04/21/farmers-squeezed-by-rising-costs-amid-middle-east-instability/"">Farmers squeezed by rising costs amid Middle East instability</a>"
3,Drake's massive ice sculpture in Toronto draws hundreds of people as police called to control crowd,https://www.ctvnews.ca/toronto/video/shows/ctv-news-at-noon/2026/04/20/drake-teases-iceman-album-with-ice-block-sculpture-downtown/,"<a href=""https://www.ctvnews.ca/toronto/video/shows/ctv-news-at-noon/2026/04/20/drake-teases-iceman-album-with-ice-block-sculpture-downtown/"">Drake's massive ice sculpture in Toronto draws hundreds of people as police called to control crowd</a>"
4,Singer D4vd pleads not guilty to first-degree murder of 14-year-old Celeste Rivas,https://www.ctvnews.ca/video/2026/04/21/singer-d4vd-pleads-not-guilty-to-first-degree-murder-of-14-year-old-celeste-rivas/,"<a href=""https://www.ctvnews.ca/video/2026/04/21/singer-d4vd-pleads-not-guilty-to-first-degree-murder-of-14-year-old-celeste-rivas/"">Singer D4vd pleads not guilty to first-degree murder of 14-year-old Celeste Rivas</a>"
5,Apple CEO Tim Cook’s legacy as he steps down after 15 years,https://www.ctvnews.ca/video/2026/04/21/apple-ceo-tim-cooks-legacy-as-he-steps-down-after-15-years/,"<a href=""https://www.ctvnews.ca/video/2026/04/21/apple-ceo-tim-cooks-legacy-as-he-steps-down-after-15-years/"">Apple CEO Tim Cook’s legacy as he steps down after 15 years</a>"
6,Why a Northern Ontario township is still under a state of emergency,https://www.ctvnews.ca/video/2026/04/21/why-a-northern-ontario-township-is-still-under-a-state-of-emergency/,"<a href=""https://www.ctvnews.ca/video/2026/04/21/why-a-northern-ontario-township-is-still-under-a-state-of-emergency/"">Why a Northern Ontario township is still under a state of emergency</a>"
7,Bank of Canada faces rate decision as inflation pressures mount,https://www.ctvnews.ca/video/2026/04/20/ctv-national-news-bank-of-canada-faces-rate-decision-as-inflation-pressures-mount/,"<a href=""https://www.ctvnews.ca/video/2026/04/20/ctv-national-news-bank-of-canada-faces-rate-decision-as-inflation-pressures-mount/"">Bank of Canada faces rate decision as inflation pressures mount</a>"
8,‘It just kept coming’: Witnesses describe the chaos after Mexico shooting,https://www.ctvnews.ca/video/2026/04/20/it-just-kept-coming-witnesses-describe-the-chaos-after-mexico-shooting/,"<a href=""https://www.ctvnews.ca/video/2026/04/20/it-just-kept-coming-witnesses-describe-the-chaos-after-mexico-shooting/"">‘It just kept coming’: Witnesses describe the chaos after Mexico shooting</a>"
