rank,Article title,url,title_with_link
1,Rare moment in nature: Hours-long sperm whale birth captured on camera,https://www.ctvnews.ca/video/2026/03/27/rare-moment-in-nature-hours-long-sperm-whale-birth-captured-on-camera/,"<a href=""https://www.ctvnews.ca/video/2026/03/27/rare-moment-in-nature-hours-long-sperm-whale-birth-captured-on-camera/"">Rare moment in nature: Hours-long sperm whale birth captured on camera</a>"
2,Opening Day buzz: What can the Jays' off-season acquisitions bring to the 2026 squad?,https://www.ctvnews.ca/video/2026/03/27/opening-day-buzz-what-can-the-jays-off-season-acquisitions-bring-to-the-2026-squad/,"<a href=""https://www.ctvnews.ca/video/2026/03/27/opening-day-buzz-what-can-the-jays-off-season-acquisitions-bring-to-the-2026-squad/"">Opening Day buzz: What can the Jays' off-season acquisitions bring to the 2026 squad?</a>"
3,Hockey coach calls out former team over alleged discrimination,https://www.ctvnews.ca/toronto/video/2026/03/26/hockey-coach-calls-out-former-team-over-alleged-discrimination/,"<a href=""https://www.ctvnews.ca/toronto/video/2026/03/26/hockey-coach-calls-out-former-team-over-alleged-discrimination/"">Hockey coach calls out former team over alleged discrimination</a>"
4,LIVE at 2 p.m. ET: NDP leadership convention kicks off amid party's push to rebuild,https://www.ctvnews.ca/video/live/2026/03/25/live-at-2-pm-et-ndp-leadership-convention-kicks-off-amid-partys-push-to-rebuild/,"<a href=""https://www.ctvnews.ca/video/live/2026/03/25/live-at-2-pm-et-ndp-leadership-convention-kicks-off-amid-partys-push-to-rebuild/"">LIVE at 2 p.m. ET: NDP leadership convention kicks off amid party's push to rebuild</a>"
5,"Positive health expectations linked to better cognition, less decline: study",https://www.ctvnews.ca/video/2026/03/27/positive-health-expectations-linked-to-better-cognition-less-decline-study/,"<a href=""https://www.ctvnews.ca/video/2026/03/27/positive-health-expectations-linked-to-better-cognition-less-decline-study/"">Positive health expectations linked to better cognition, less decline: study</a>"
6,NDP ‘worried’ Avi Lewis won’t be able to win seats in House of Commons: Mulcair,https://www.ctvnews.ca/video/2026/03/27/ndp-worried-avi-lewis-wont-be-able-to-win-seats-in-house-of-commons-mulcair/,"<a href=""https://www.ctvnews.ca/video/2026/03/27/ndp-worried-avi-lewis-wont-be-able-to-win-seats-in-house-of-commons-mulcair/"">NDP ‘worried’ Avi Lewis won’t be able to win seats in House of Commons: Mulcair</a>"
7,‘It’s difficult to conduct negotiations if you keep killing the leaders’: Thompson on U.S.-Iran talks,https://www.ctvnews.ca/video/2026/03/27/its-difficult-to-conduct-negotiations-if-you-keep-killing-the-leaders-thompson/,"<a href=""https://www.ctvnews.ca/video/2026/03/27/its-difficult-to-conduct-negotiations-if-you-keep-killing-the-leaders-thompson/"">‘It’s difficult to conduct negotiations if you keep killing the leaders’: Thompson on U.S.-Iran talks</a>"
8,"Trump 'won’t say it, but he’s desperately trying to bring oil prices down’: Ham",https://www.ctvnews.ca/video/2026/03/27/trump-wont-say-it-but-hes-desperately-trying-to-bring-oil-prices-down-ham/,"<a href=""https://www.ctvnews.ca/video/2026/03/27/trump-wont-say-it-but-hes-desperately-trying-to-bring-oil-prices-down-ham/"">Trump 'won’t say it, but he’s desperately trying to bring oil prices down’: Ham</a>"
