rank,Article title,url,title_with_link
1,WARNING: 37-year-old woman shot and killed during ICE operation in Minnesota,https://www.ctvnews.ca/video/2026/01/07/warning-37-year-old-woman-shot-and-killed-during-ice-operation-in-minnesota/,"<a href=""https://www.ctvnews.ca/video/2026/01/07/warning-37-year-old-woman-shot-and-killed-during-ice-operation-in-minnesota/"">WARNING: 37-year-old woman shot and killed during ICE operation in Minnesota</a>"
2,"‘This guy is not playing’: Police open fire at man who stole bulldozer, tried to run over officer",https://www.ctvnews.ca/video/2026/01/08/this-guy-is-not-playing-police-open-fire-at-man-who-stole-bulldozer-tried-to-run-over-officer/,"<a href=""https://www.ctvnews.ca/video/2026/01/08/this-guy-is-not-playing-police-open-fire-at-man-who-stole-bulldozer-tried-to-run-over-officer/"">‘This guy is not playing’: Police open fire at man who stole bulldozer, tried to run over officer</a>"
3,WARNING: Dashcam video captures brutal attack on Florida Uber driver,https://www.ctvnews.ca/video/2026/01/08/warning-dashcam-video-captures-brutal-attack-on-florida-uber-driver/,"<a href=""https://www.ctvnews.ca/video/2026/01/08/warning-dashcam-video-captures-brutal-attack-on-florida-uber-driver/"">WARNING: Dashcam video captures brutal attack on Florida Uber driver</a>"
4,"Two homes targeted in extortion-related shootings, police in B.C. say",https://www.ctvnews.ca/vancouver/video/2026/01/08/2-homes-targeted-in-extortion-related-shootings-police-say/,"<a href=""https://www.ctvnews.ca/vancouver/video/2026/01/08/2-homes-targeted-in-extortion-related-shootings-police-say/"">Two homes targeted in extortion-related shootings, police in B.C. say</a>"
5,Union for WestJet flight attendants says it wasn't consulted before company reduced legroom between rows,https://www.ctvnews.ca/edmonton/video/2026/01/08/union-concerned-about-reduced-legroom-on-westjet-flights/,"<a href=""https://www.ctvnews.ca/edmonton/video/2026/01/08/union-concerned-about-reduced-legroom-on-westjet-flights/"">Union for WestJet flight attendants says it wasn't consulted before company reduced legroom between rows</a>"
6,'I just want to know what happened to him': Ont. father secretly recorded woman accused in toddler's death,https://www.ctvnews.ca/london/video/2026/01/08/i-just-want-to-know-what-happened-to-him/,"<a href=""https://www.ctvnews.ca/london/video/2026/01/08/i-just-want-to-know-what-happened-to-him/"">'I just want to know what happened to him': Ont. father secretly recorded woman accused in toddler's death</a>"
7,WARNING: Woman sues apartment over spider bites which led to amputations,https://www.ctvnews.ca/video/2026/01/08/warning-woman-sues-apartment-over-spider-bites-which-led-to-amputations/,"<a href=""https://www.ctvnews.ca/video/2026/01/08/warning-woman-sues-apartment-over-spider-bites-which-led-to-amputations/"">WARNING: Woman sues apartment over spider bites which led to amputations</a>"
8,Mountie in B.C. faces termination for sexist comments made in a group chat,https://www.ctvnews.ca/vancouver/video/2026/01/08/mountie-faces-termination-for-sexist-comments/,"<a href=""https://www.ctvnews.ca/vancouver/video/2026/01/08/mountie-faces-termination-for-sexist-comments/"">Mountie in B.C. faces termination for sexist comments made in a group chat</a>"
