rank,Article title,url,title_with_link
1,"PM Carney’s U.K. trip 'aims to boost strategic ties, not just focus on trade deal': trade lawyer",https://www.ctvnews.ca/video/2025/09/25/pm-carneys-uk-trip-aims-to-boost-strategic-ties-not-just-focus-on-trade-deal-trade-lawyer/,"<a href=""https://www.ctvnews.ca/video/2025/09/25/pm-carneys-uk-trip-aims-to-boost-strategic-ties-not-just-focus-on-trade-deal-trade-lawyer/"">PM Carney’s U.K. trip 'aims to boost strategic ties, not just focus on trade deal': trade lawyer</a>"
2,Canadian tourist killed in drive-by shooting during golf trip in Wisconsin,https://www.ctvnews.ca/video/2025/09/25/canadian-tourist-killed-in-drive-by-shooting-during-golf-trip-in-wisconsin/,"<a href=""https://www.ctvnews.ca/video/2025/09/25/canadian-tourist-killed-in-drive-by-shooting-during-golf-trip-in-wisconsin/"">Canadian tourist killed in drive-by shooting during golf trip in Wisconsin</a>"
3,"Canada Post to cut mail delivery frequency, union warns of ‘huge job loss’",https://www.ctvnews.ca/video/2025/09/25/canada-post-to-cut-mail-delivery-frequency-union-warns-of-huge-job-loss/,"<a href=""https://www.ctvnews.ca/video/2025/09/25/canada-post-to-cut-mail-delivery-frequency-union-warns-of-huge-job-loss/"">Canada Post to cut mail delivery frequency, union warns of ‘huge job loss’</a>"
4,LIVE @ 2:30 p.m. MST: RCMP share update on missing Alberta boy,https://www.ctvnews.ca/video/live/2025/09/25/live-230-pm-mst-rcmp-share-update-on-missing-alberta-boy/,"<a href=""https://www.ctvnews.ca/video/live/2025/09/25/live-230-pm-mst-rcmp-share-update-on-missing-alberta-boy/"">LIVE @ 2:30 p.m. MST: RCMP share update on missing Alberta boy</a>"
5,‘Absolutely sabotage’: Trump demands investigation in United Nations escalator-gate,https://www.ctvnews.ca/video/2025/09/25/absolutely-sabotage-trump-demands-investigation-in-united-nations-escalator-gate/,"<a href=""https://www.ctvnews.ca/video/2025/09/25/absolutely-sabotage-trump-demands-investigation-in-united-nations-escalator-gate/"">‘Absolutely sabotage’: Trump demands investigation in United Nations escalator-gate</a>"
6,Robert Pickton’s killer testifies he ‘did it for the victims’,https://www.ctvnews.ca/video/2025/09/25/robert-picktons-killer-testifies-he-did-it-for-the-victims/,"<a href=""https://www.ctvnews.ca/video/2025/09/25/robert-picktons-killer-testifies-he-did-it-for-the-victims/"">Robert Pickton’s killer testifies he ‘did it for the victims’</a>"
7,Projected rise in national deficit ‘kind of surprising’: economist,https://www.ctvnews.ca/video/2025/09/25/projected-rise-in-national-deficit-kind-of-surprising-economist/,"<a href=""https://www.ctvnews.ca/video/2025/09/25/projected-rise-in-national-deficit-kind-of-surprising-economist/"">Projected rise in national deficit ‘kind of surprising’: economist</a>"
8,What can Canada offer in trade talks with U.K. leaders?,https://www.ctvnews.ca/video/2025/09/25/what-can-canada-offer-in-trade-talks-with-uk-leaders/,"<a href=""https://www.ctvnews.ca/video/2025/09/25/what-can-canada-offer-in-trade-talks-with-uk-leaders/"">What can Canada offer in trade talks with U.K. leaders?</a>"
