rank,Article title,url,title_with_link
1,Spirit Airlines shutting down operations over rising fuel prices,https://www.ctvnews.ca/video/2026/05/02/spirit-airlines-shutting-down-operations-over-rising-fuel-prices/,"<a href=""https://www.ctvnews.ca/video/2026/05/02/spirit-airlines-shutting-down-operations-over-rising-fuel-prices/"">Spirit Airlines shutting down operations over rising fuel prices</a>"
2,Calgary father charged in deaths of his two young children,https://www.ctvnews.ca/video/2026/05/02/ctv-national-news-calgary-father-charged-in-deaths-of-his-two-young-children/,"<a href=""https://www.ctvnews.ca/video/2026/05/02/ctv-national-news-calgary-father-charged-in-deaths-of-his-two-young-children/"">Calgary father charged in deaths of his two young children</a>"
3,Unruly passenger removed from plane after refusing to get off phone,https://www.ctvnews.ca/video/2026/05/01/unruly-passenger-removed-from-plane-after-refusing-to-get-off-phone/,"<a href=""https://www.ctvnews.ca/video/2026/05/01/unruly-passenger-removed-from-plane-after-refusing-to-get-off-phone/"">Unruly passenger removed from plane after refusing to get off phone</a>"
4,‘It’s coming for you!’: Shark chases surfers more than 1.5 kilometres,https://www.ctvnews.ca/video/2026/05/01/its-coming-for-you-shark-chases-surfers-more-than-15-kilometres/,"<a href=""https://www.ctvnews.ca/video/2026/05/01/its-coming-for-you-shark-chases-surfers-more-than-15-kilometres/"">‘It’s coming for you!’: Shark chases surfers more than 1.5 kilometres</a>"
5,Images released of youth suspected in back-to-back Toronto-area synagogue shootings,https://www.ctvnews.ca/toronto/video/2026/05/01/images-of-youth-suspected-in-gta-synagogue-shootings-released/,"<a href=""https://www.ctvnews.ca/toronto/video/2026/05/01/images-of-youth-suspected-in-gta-synagogue-shootings-released/"">Images released of youth suspected in back-to-back Toronto-area synagogue shootings</a>"
6,Appeal to solve bizarre case of B.C. man who disappeared without a trace nearly 40 years ago,https://www.ctvnews.ca/vancouver/video/2026/05/01/appeal-to-solve-40-year-old-missing-man-case/,"<a href=""https://www.ctvnews.ca/vancouver/video/2026/05/01/appeal-to-solve-40-year-old-missing-man-case/"">Appeal to solve bizarre case of B.C. man who disappeared without a trace nearly 40 years ago</a>"
7,Florida police officer who killed young girl in car crash was allegedly late for work,https://www.ctvnews.ca/video/2026/05/01/florida-police-officer-who-killed-young-girl-in-car-crash-was-allegedly-late-for-work/,"<a href=""https://www.ctvnews.ca/video/2026/05/01/florida-police-officer-who-killed-young-girl-in-car-crash-was-allegedly-late-for-work/"">Florida police officer who killed young girl in car crash was allegedly late for work</a>"
8,Gas prices spike across Canada and expected to keep going up,https://www.ctvnews.ca/video/2026/05/01/gas-prices-spike-across-canada-and-expected-to-keep-going-up/,"<a href=""https://www.ctvnews.ca/video/2026/05/01/gas-prices-spike-across-canada-and-expected-to-keep-going-up/"">Gas prices spike across Canada and expected to keep going up</a>"
