rank,Article title,url,title_with_link
1,Dramatic rescue from cruise ship off B.C. coast,https://www.ctvnews.ca/vancouver/video/2025/08/27/dramatic-rescue-from-cruise-ship-off-bc-coast/,"<a href=""https://www.ctvnews.ca/vancouver/video/2025/08/27/dramatic-rescue-from-cruise-ship-off-bc-coast/"">Dramatic rescue from cruise ship off B.C. coast</a>"
2,Cracker Barrel abandons plan to adopt new logo following customer backlash,https://www.ctvnews.ca/video/2025/08/27/cracker-barrel-abandons-plan-to-adopt-new-logo-following-customer-backlash/,"<a href=""https://www.ctvnews.ca/video/2025/08/27/cracker-barrel-abandons-plan-to-adopt-new-logo-following-customer-backlash/"">Cracker Barrel abandons plan to adopt new logo following customer backlash</a>"
3,Report finds Canadian snowbirds are looking to ditch U.S. properties,https://www.ctvnews.ca/video/2025/08/27/report-finds-canadian-snowbirds-are-looking-to-ditch-us-properties/,"<a href=""https://www.ctvnews.ca/video/2025/08/27/report-finds-canadian-snowbirds-are-looking-to-ditch-us-properties/"">Report finds Canadian snowbirds are looking to ditch U.S. properties</a>"
4,Saucy skirmish: Thousands pack the streets of Spain for ‘La Tomatina’,https://www.ctvnews.ca/video/2025/08/27/saucy-skirmish-thousands-pack-the-streets-of-spain-for-la-tomatina/,"<a href=""https://www.ctvnews.ca/video/2025/08/27/saucy-skirmish-thousands-pack-the-streets-of-spain-for-la-tomatina/"">Saucy skirmish: Thousands pack the streets of Spain for ‘La Tomatina’</a>"
5,PM Carney wraps up European visit with trip to Latvian military base,https://www.ctvnews.ca/video/2025/08/27/pm-carney-wraps-up-european-visit-with-trip-to-latvian-military-base/,"<a href=""https://www.ctvnews.ca/video/2025/08/27/pm-carney-wraps-up-european-visit-with-trip-to-latvian-military-base/"">PM Carney wraps up European visit with trip to Latvian military base</a>"
6,Minneapolis Catholic school shooter fired shots from outside building,https://www.ctvnews.ca/video/2025/08/27/minneapolis-catholic-school-shooter-fired-shots-from-outside-building/,"<a href=""https://www.ctvnews.ca/video/2025/08/27/minneapolis-catholic-school-shooter-fired-shots-from-outside-building/"">Minneapolis Catholic school shooter fired shots from outside building</a>"
7,B.C. family's encounter with orcas caught on camera,https://www.ctvnews.ca/vancouver/video/2025/08/27/encounter-with-orcas-caught-on-camera/,"<a href=""https://www.ctvnews.ca/vancouver/video/2025/08/27/encounter-with-orcas-caught-on-camera/"">B.C. family's encounter with orcas caught on camera</a>"
8,"Doorbell camera catches bear sneaking up on, charging Florida man",https://www.ctvnews.ca/video/2025/08/27/doorbell-camera-catches-bear-sneaking-up-on-charging-florida-man/,"<a href=""https://www.ctvnews.ca/video/2025/08/27/doorbell-camera-catches-bear-sneaking-up-on-charging-florida-man/"">Doorbell camera catches bear sneaking up on, charging Florida man</a>"
