rank,Article title,url,title_with_link
1,"Video appears to show Toronto police car running over suspect, officer",https://www.ctvnews.ca/toronto/video/2025/11/03/video-appears-to-show-toronto-police-car-running-over-suspect-officer/,"<a href=""https://www.ctvnews.ca/toronto/video/2025/11/03/video-appears-to-show-toronto-police-car-running-over-suspect-officer/"">Video appears to show Toronto police car running over suspect, officer</a>"
2,"Man jumps fence and assaults two inmates at women’s prison in Kitchener, Ont.",https://www.ctvnews.ca/kitchener/video/2025/11/03/man-breaks-into-kitchener-ont-womens-prison/,"<a href=""https://www.ctvnews.ca/kitchener/video/2025/11/03/man-breaks-into-kitchener-ont-womens-prison/"">Man jumps fence and assaults two inmates at women’s prison in Kitchener, Ont.</a>"
3,"‘It’s my baby versus the animal’: Woman shoots escaped lab monkey, fearing for her child’s safety",https://www.ctvnews.ca/video/2025/11/04/its-my-baby-versus-the-animal-woman-shoots-escaped-lab-monkey-fearing-for-her-childs-safety/,"<a href=""https://www.ctvnews.ca/video/2025/11/04/its-my-baby-versus-the-animal-woman-shoots-escaped-lab-monkey-fearing-for-her-childs-safety/"">‘It’s my baby versus the animal’: Woman shoots escaped lab monkey, fearing for her child’s safety</a>"
4,Chaotic scene after gunfire erupts at Airbnb house party in Ohio packed with teenagers,https://www.ctvnews.ca/video/2025/11/04/chaotic-scene-after-gunfire-erupts-at-airbnb-house-party-in-ohio-packed-with-teenagers/,"<a href=""https://www.ctvnews.ca/video/2025/11/04/chaotic-scene-after-gunfire-erupts-at-airbnb-house-party-in-ohio-packed-with-teenagers/"">Chaotic scene after gunfire erupts at Airbnb house party in Ohio packed with teenagers</a>"
5,‘I thought somebody was going to die’: Police cars crash into each other while responding to call,https://www.ctvnews.ca/video/2025/11/04/i-thought-somebody-was-going-to-die-police-cars-crash-into-each-other-while-responding-to-call/,"<a href=""https://www.ctvnews.ca/video/2025/11/04/i-thought-somebody-was-going-to-die-police-cars-crash-into-each-other-while-responding-to-call/"">‘I thought somebody was going to die’: Police cars crash into each other while responding to call</a>"
6,Fake ads with cheap deals on social media trick two Ontario residents out of $385,https://www.ctvnews.ca/toronto/video/2025/11/04/fake-ads-with-cheap-deals-on-social-media-trick-two-ontario-residents-out-of-385/,"<a href=""https://www.ctvnews.ca/toronto/video/2025/11/04/fake-ads-with-cheap-deals-on-social-media-trick-two-ontario-residents-out-of-385/"">Fake ads with cheap deals on social media trick two Ontario residents out of $385</a>"
7,"Ford: ‘You could put me on a stretching rack, I wouldn’t apologize’ to Trump",https://www.ctvnews.ca/video/2025/11/03/ford-you-could-put-me-on-a-stretching-rack-i-wouldnt-apologize-to-trump/,"<a href=""https://www.ctvnews.ca/video/2025/11/03/ford-you-could-put-me-on-a-stretching-rack-i-wouldnt-apologize-to-trump/"">Ford: ‘You could put me on a stretching rack, I wouldn’t apologize’ to Trump</a>"
8,"Windsor-Detroit Tunnel, vital lifeline between Canada and U.S., turns 95",https://www.ctvnews.ca/windsor/video/2025/11/03/windsor-detroit-tunnel-turns-95/,"<a href=""https://www.ctvnews.ca/windsor/video/2025/11/03/windsor-detroit-tunnel-turns-95/"">Windsor-Detroit Tunnel, vital lifeline between Canada and U.S., turns 95</a>"
