rank,Article title,url,title_with_link
1,'He needs to focus on his number one customer': Doug Ford on trade talks with Trump,https://www.ctvnews.ca/video/2025/07/28/he-needs-to-focus-on-his-number-one-customer-doug-ford-on-trade-talks-with-trump/,"<a href=""https://www.ctvnews.ca/video/2025/07/28/he-needs-to-focus-on-his-number-one-customer-doug-ford-on-trade-talks-with-trump/"">'He needs to focus on his number one customer': Doug Ford on trade talks with Trump</a>"
2,Advocate sounds alarm on hunger crisis in Gaza: ‘Our teams are desperate’,https://www.ctvnews.ca/video/2025/07/28/advocate-sounds-alarm-on-hunger-crisis-in-gaza-our-teams-are-desperate/,"<a href=""https://www.ctvnews.ca/video/2025/07/28/advocate-sounds-alarm-on-hunger-crisis-in-gaza-our-teams-are-desperate/"">Advocate sounds alarm on hunger crisis in Gaza: ‘Our teams are desperate’</a>"
3,'Canada is simply not the White House's priority right now': Reid on looming trade deal deadline,https://www.ctvnews.ca/video/2025/07/28/canada-is-simply-not-the-white-houses-priority-right-now-reid-on-looming-trade-deal-deadline/,"<a href=""https://www.ctvnews.ca/video/2025/07/28/canada-is-simply-not-the-white-houses-priority-right-now-reid-on-looming-trade-deal-deadline/"">'Canada is simply not the White House's priority right now': Reid on looming trade deal deadline</a>"
4,Air Canada flight attendants begin voting on possibility of a strike,https://www.ctvnews.ca/video/2025/07/28/air-canada-flight-attendants-begin-voting-on-possibility-of-a-strike/,"<a href=""https://www.ctvnews.ca/video/2025/07/28/air-canada-flight-attendants-begin-voting-on-possibility-of-a-strike/"">Air Canada flight attendants begin voting on possibility of a strike</a>"
5,"Air quality warning, alerts across Canada",https://www.ctvnews.ca/video/2025/07/28/air-quality-warning-alerts-across-canada/,"<a href=""https://www.ctvnews.ca/video/2025/07/28/air-quality-warning-alerts-across-canada/"">Air quality warning, alerts across Canada</a>"
6,"‘We will only sign the right deal, a good deal for Canada’: Carney",https://www.ctvnews.ca/video/2025/07/28/we-will-only-sign-the-right-deal-a-good-deal-for-canada-carney/,"<a href=""https://www.ctvnews.ca/video/2025/07/28/we-will-only-sign-the-right-deal-a-good-deal-for-canada-carney/"">‘We will only sign the right deal, a good deal for Canada’: Carney</a>"
7,UN meeting in New York hopes to tackle Israeli-Palestinian two-state solution,https://www.ctvnews.ca/video/2025/07/28/un-meeting-in-new-york-hopes-to-tackle-israeli-palestinian-two-state-solution/,"<a href=""https://www.ctvnews.ca/video/2025/07/28/un-meeting-in-new-york-hopes-to-tackle-israeli-palestinian-two-state-solution/"">UN meeting in New York hopes to tackle Israeli-Palestinian two-state solution</a>"
8,Two-state solution remains only viable path to peace for Israel and Palestine: Anand,https://www.ctvnews.ca/video/2025/07/28/two-state-solution-remains-only-viable-path-to-peace-for-israel-and-palestine-anand/,"<a href=""https://www.ctvnews.ca/video/2025/07/28/two-state-solution-remains-only-viable-path-to-peace-for-israel-and-palestine-anand/"">Two-state solution remains only viable path to peace for Israel and Palestine: Anand</a>"
