rank,Article title,url,title_with_link
1,Artemis II astronaut captures rare 'Earthset' on iPhone during moon flyby,https://www.ctvnews.ca/video/2026/04/22/artemis-ii-astronaut-captures-rare-earthset-on-iphone-during-moon-flyby/,"<a href=""https://www.ctvnews.ca/video/2026/04/22/artemis-ii-astronaut-captures-rare-earthset-on-iphone-during-moon-flyby/"">Artemis II astronaut captures rare 'Earthset' on iPhone during moon flyby</a>"
2,U.S. senator blames Lutnick's 'insulting' rhetoric for sharp drop in Canadian tourism,https://www.ctvnews.ca/video/2026/04/22/shaheen-calls-lutnicks-canada-rhetoric-insulting/,"<a href=""https://www.ctvnews.ca/video/2026/04/22/shaheen-calls-lutnicks-canada-rhetoric-insulting/"">U.S. senator blames Lutnick's 'insulting' rhetoric for sharp drop in Canadian tourism</a>"
3,"Tick season starts early in Canada, raising concerns about a potential surge in Lyme disease cases",https://www.ctvnews.ca/video/2026/04/22/tick-season-starts-early-in-canada-raising-concerns-about-a-potential-surge-in-lyme-disease-cases/,"<a href=""https://www.ctvnews.ca/video/2026/04/22/tick-season-starts-early-in-canada-raising-concerns-about-a-potential-surge-in-lyme-disease-cases/"">Tick season starts early in Canada, raising concerns about a potential surge in Lyme disease cases</a>"
4,‘It will save lives’: U.K. imposes lifetime smoking ban for children,https://www.ctvnews.ca/video/2026/04/22/it-will-save-lives-uk-imposes-lifetime-smoking-ban-for-children/,"<a href=""https://www.ctvnews.ca/video/2026/04/22/it-will-save-lives-uk-imposes-lifetime-smoking-ban-for-children/"">‘It will save lives’: U.K. imposes lifetime smoking ban for children</a>"
5,"NYPD, troopers pull passengers from burning car wreck in New York",https://www.ctvnews.ca/video/2026/04/22/nypd-troopers-pull-passengers-from-burning-car-wreck-in-new-york/,"<a href=""https://www.ctvnews.ca/video/2026/04/22/nypd-troopers-pull-passengers-from-burning-car-wreck-in-new-york/"">NYPD, troopers pull passengers from burning car wreck in New York</a>"
6,Watch the moment an electric wheelchair bursts into flames,https://www.ctvnews.ca/video/2026/04/22/watch-the-moment-an-electric-wheelchair-bursts-into-flames/,"<a href=""https://www.ctvnews.ca/video/2026/04/22/watch-the-moment-an-electric-wheelchair-bursts-into-flames/"">Watch the moment an electric wheelchair bursts into flames</a>"
7,Video shows rescue of woman who nearly froze to death in northern Ontario,https://www.ctvnews.ca/northern-ontario/video/2026/04/21/lost-photographer-rescued-from-deep-snow/,"<a href=""https://www.ctvnews.ca/northern-ontario/video/2026/04/21/lost-photographer-rescued-from-deep-snow/"">Video shows rescue of woman who nearly froze to death in northern Ontario</a>"
8,Canada-U.S. trade talks heat up as both sides exchange barbs,https://www.ctvnews.ca/video/2026/04/22/ctv-national-news-canada-us-trade-talks-heat-up-as-both-sides-exchange-barbs/,"<a href=""https://www.ctvnews.ca/video/2026/04/22/ctv-national-news-canada-us-trade-talks-heat-up-as-both-sides-exchange-barbs/"">Canada-U.S. trade talks heat up as both sides exchange barbs</a>"
