rank,Article title,url,title_with_link
1,CTV National News: How the U.S. government shutdown could impact air travel in Canada,https://www.ctvnews.ca/video/2025/10/27/ctv-national-news-how-the-us-government-shutdown-could-impact-air-travel-in-canada/,"<a href=""https://www.ctvnews.ca/video/2025/10/27/ctv-national-news-how-the-us-government-shutdown-could-impact-air-travel-in-canada/"">CTV National News: How the U.S. government shutdown could impact air travel in Canada</a>"
2,CTV National News: Calls for action to protect Canadians against wildfires,https://www.ctvnews.ca/video/2025/10/27/ctv-national-news-calls-for-action-to-protect-canadians-against-wildfires/,"<a href=""https://www.ctvnews.ca/video/2025/10/27/ctv-national-news-calls-for-action-to-protect-canadians-against-wildfires/"">CTV National News: Calls for action to protect Canadians against wildfires</a>"
3,CTV National News: LA's Latin community living in fear amid ICE raids,https://www.ctvnews.ca/video/2025/10/27/ctv-national-news-las-latin-community-living-in-fear-amid-ice-raids/,"<a href=""https://www.ctvnews.ca/video/2025/10/27/ctv-national-news-las-latin-community-living-in-fear-amid-ice-raids/"">CTV National News: LA's Latin community living in fear amid ICE raids</a>"
4,CTV National News: Canadians delaying life milestones for homeownership,https://www.ctvnews.ca/video/2025/10/27/ctv-national-news-canadians-delaying-life-milestones-for-homeownership/,"<a href=""https://www.ctvnews.ca/video/2025/10/27/ctv-national-news-canadians-delaying-life-milestones-for-homeownership/"">CTV National News: Canadians delaying life milestones for homeownership</a>"
5,CTV National News: Future of vehicle manufacturing in Canada,https://www.ctvnews.ca/video/2025/10/27/ctv-national-news-future-of-vehicle-manufacturing-in-canada/,"<a href=""https://www.ctvnews.ca/video/2025/10/27/ctv-national-news-future-of-vehicle-manufacturing-in-canada/"">CTV National News: Future of vehicle manufacturing in Canada</a>"
6,CTV News in Malaysia: How Canada is responding to Trump's latest tariff announcement,https://www.ctvnews.ca/video/2025/10/27/ctv-national-news-whats-next-for-trade-talks-with-canada-and-us/,"<a href=""https://www.ctvnews.ca/video/2025/10/27/ctv-national-news-whats-next-for-trade-talks-with-canada-and-us/"">CTV News in Malaysia: How Canada is responding to Trump's latest tariff announcement</a>"
7,Hamas widening search for bodies of hostages in Gaza,https://www.ctvnews.ca/video/2025/10/26/hamas-widening-search-for-bodies-of-hostages-in-gaza/,"<a href=""https://www.ctvnews.ca/video/2025/10/26/hamas-widening-search-for-bodies-of-hostages-in-gaza/"">Hamas widening search for bodies of hostages in Gaza</a>"
8,Aluminum industry still waiting on details on President Trump’s tariff hike,https://www.ctvnews.ca/video/2025/10/26/aluminum-industry-still-waiting-on-details-on-president-trumps-tariff-hike/,"<a href=""https://www.ctvnews.ca/video/2025/10/26/aluminum-industry-still-waiting-on-details-on-president-trumps-tariff-hike/"">Aluminum industry still waiting on details on President Trump’s tariff hike</a>"
