rank,Article title,url,title_with_link
1,WATCH LIVE: PM Carney and Premier Smith make an energy announcement,https://www.ctvnews.ca/video/live/2026/05/14/watch-live-pm-carney-and-premier-smith-make-an-energy-announcement/,"<a href=""https://www.ctvnews.ca/video/live/2026/05/14/watch-live-pm-carney-and-premier-smith-make-an-energy-announcement/"">WATCH LIVE: PM Carney and Premier Smith make an energy announcement</a>"
2,WARNING: Florida deputy stabbed by attacker saved by his bulletproof vest,https://www.ctvnews.ca/video/2026/05/15/warning-florida-deputy-stabbed-by-attacker-saved-by-his-bulletproof-vest/,"<a href=""https://www.ctvnews.ca/video/2026/05/15/warning-florida-deputy-stabbed-by-attacker-saved-by-his-bulletproof-vest/"">WARNING: Florida deputy stabbed by attacker saved by his bulletproof vest</a>"
3,Reactions pour in from both sides of the aisle after Alberta separation ruling,https://www.ctvnews.ca/video/2026/05/14/ctv-national-news-reactions-pour-in-from-both-sides-of-the-aisle-after-alberta-separation-ruling/,"<a href=""https://www.ctvnews.ca/video/2026/05/14/ctv-national-news-reactions-pour-in-from-both-sides-of-the-aisle-after-alberta-separation-ruling/"">Reactions pour in from both sides of the aisle after Alberta separation ruling</a>"
4,Video shows pit bull with no leash kill small dog and injure woman in Toronto,https://www.ctvnews.ca/toronto/video/shows/ctv-news-at-noon/2026/05/13/video-shows-pit-bull-with-no-leash-kill-small-dog-and-injure-woman-in-toronto/,"<a href=""https://www.ctvnews.ca/toronto/video/shows/ctv-news-at-noon/2026/05/13/video-shows-pit-bull-with-no-leash-kill-small-dog-and-injure-woman-in-toronto/"">Video shows pit bull with no leash kill small dog and injure woman in Toronto</a>"
5,‘It was horrifying’: Duck recovering after being found with arrow through bill,https://www.ctvnews.ca/video/2026/05/15/it-was-horrifying-duck-recovering-after-being-found-with-arrow-through-bill/,"<a href=""https://www.ctvnews.ca/video/2026/05/15/it-was-horrifying-duck-recovering-after-being-found-with-arrow-through-bill/"">‘It was horrifying’: Duck recovering after being found with arrow through bill</a>"
6,Car goes airborne during police chase,https://www.ctvnews.ca/video/2026/05/15/car-goes-airborne-during-police-chase/,"<a href=""https://www.ctvnews.ca/video/2026/05/15/car-goes-airborne-during-police-chase/"">Car goes airborne during police chase</a>"
7,Watch the CN Tower ‘freeze' over as Drake releases new albums,https://www.ctvnews.ca/toronto/video/2026/05/15/watch-as-the-cn-tower-freezes-over/,"<a href=""https://www.ctvnews.ca/toronto/video/2026/05/15/watch-as-the-cn-tower-freezes-over/"">Watch the CN Tower ‘freeze' over as Drake releases new albums</a>"
8,WARNING: 11-year-old and her dog attacked by two Rottweilers,https://www.ctvnews.ca/windsor/video/2026/05/14/11-year-old-girl-and-her-dog-attacked-by-two-rottweilers/,"<a href=""https://www.ctvnews.ca/windsor/video/2026/05/14/11-year-old-girl-and-her-dog-attacked-by-two-rottweilers/"">WARNING: 11-year-old and her dog attacked by two Rottweilers</a>"
