rank,Article title,url,title_with_link
1,What will Conservative Leader Pierre Poilievre say after this leadership review tomorrow?,https://www.ctvnews.ca/video/2026/01/30/what-will-conservative-leader-pierre-poilievre-say-after-this-leadership-review-tomorrow/,"<a href=""https://www.ctvnews.ca/video/2026/01/30/what-will-conservative-leader-pierre-poilievre-say-after-this-leadership-review-tomorrow/"">What will Conservative Leader Pierre Poilievre say after this leadership review tomorrow?</a>"
2,Trump threatens to decertify Canadian aircrafts despite receiving all regularity approvals,https://www.ctvnews.ca/video/2026/01/30/trump-threatens-to-decertify-canadian-aircrafts-despite-receiving-all-regularity-approvals/,"<a href=""https://www.ctvnews.ca/video/2026/01/30/trump-threatens-to-decertify-canadian-aircrafts-despite-receiving-all-regularity-approvals/"">Trump threatens to decertify Canadian aircrafts despite receiving all regularity approvals</a>"
3,Trump threatens Canada with tariffs on aviation sector,https://www.ctvnews.ca/video/2026/01/30/trump-threatens-canada-with-tariffs-on-aviation-sector/,"<a href=""https://www.ctvnews.ca/video/2026/01/30/trump-threatens-canada-with-tariffs-on-aviation-sector/"">Trump threatens Canada with tariffs on aviation sector</a>"
4,‘Heated Rivalry’ a true ‘made in Canada phenomenon’: Watch PM Carney’s full remarks,https://www.ctvnews.ca/video/2026/01/30/heated-rivalry-a-true-made-in-canada-phenomenon-watch-pm-carneys-full-remarks/,"<a href=""https://www.ctvnews.ca/video/2026/01/30/heated-rivalry-a-true-made-in-canada-phenomenon-watch-pm-carneys-full-remarks/"">‘Heated Rivalry’ a true ‘made in Canada phenomenon’: Watch PM Carney’s full remarks</a>"
5,Premier Eby calls Alberta separatist talks with U.S. ‘treason’ amid unity push,https://www.ctvnews.ca/video/2026/01/29/ctv-national-news-premier-eby-calls-alberta-separatist-talks-with-us-treason-amid-unity-push/,"<a href=""https://www.ctvnews.ca/video/2026/01/29/ctv-national-news-premier-eby-calls-alberta-separatist-talks-with-us-treason-amid-unity-push/"">Premier Eby calls Alberta separatist talks with U.S. ‘treason’ amid unity push</a>"
6,PM Carney hugs 'Heated Rivalry' star Hudson Williams,https://www.ctvnews.ca/video/2026/01/30/pm-carney-hugs-heated-rivalry-star-hudson-williams/,"<a href=""https://www.ctvnews.ca/video/2026/01/30/pm-carney-hugs-heated-rivalry-star-hudson-williams/"">PM Carney hugs 'Heated Rivalry' star Hudson Williams</a>"
7,"GM cuts third shift at Oshawa, Ont. plant, hundreds of jobs affected",https://www.ctvnews.ca/video/2026/01/29/ctv-national-news-gm-cuts-third-shift-at-oshawa-ont-plant-hundreds-of-jobs-affected/,"<a href=""https://www.ctvnews.ca/video/2026/01/29/ctv-national-news-gm-cuts-third-shift-at-oshawa-ont-plant-hundreds-of-jobs-affected/"">GM cuts third shift at Oshawa, Ont. plant, hundreds of jobs affected</a>"
8,New ICE chief outlines priorities after fatal shootings in Minneapolis,https://www.ctvnews.ca/video/2026/01/29/ctv-national-news-new-ice-chief-outlines-priorities-after-fatal-shootings-in-minneapolis/,"<a href=""https://www.ctvnews.ca/video/2026/01/29/ctv-national-news-new-ice-chief-outlines-priorities-after-fatal-shootings-in-minneapolis/"">New ICE chief outlines priorities after fatal shootings in Minneapolis</a>"
