rank,Article title,url,title_with_link
1,"Boy’s leg broken in Calgary hit-and run, other drivers pass by as he crawls to safety",https://www.ctvnews.ca/calgary/video/2026/03/13/surveillance-footage-captures-hit-and-run-in-ne-calgary/,"<a href=""https://www.ctvnews.ca/calgary/video/2026/03/13/surveillance-footage-captures-hit-and-run-in-ne-calgary/"">Boy’s leg broken in Calgary hit-and run, other drivers pass by as he crawls to safety</a>"
2,"Canada, NATO partners ‘prepared to defend the Arctic’: PM Carney",https://www.ctvnews.ca/video/2026/03/13/canada-nato-partners-prepared-to-defend-the-arctic-pm-carney/,"<a href=""https://www.ctvnews.ca/video/2026/03/13/canada-nato-partners-prepared-to-defend-the-arctic-pm-carney/"">Canada, NATO partners ‘prepared to defend the Arctic’: PM Carney</a>"
3,'It's a very real threat': Former NATO commander on Iran vowing to block the Strait of Hormuz,https://www.ctvnews.ca/video/2026/03/13/its-a-very-real-threat-former-nato-commander-on-iran-vowing-to-block-the-strait-of-hormuz/,"<a href=""https://www.ctvnews.ca/video/2026/03/13/its-a-very-real-threat-former-nato-commander-on-iran-vowing-to-block-the-strait-of-hormuz/"">'It's a very real threat': Former NATO commander on Iran vowing to block the Strait of Hormuz</a>"
4,'The U.S. administration is sidelining its allies': Military expert on easing sanctions on Russia,https://www.ctvnews.ca/video/2026/03/13/the-us-administration-is-sidelining-its-allies-military-expert-on-easing-sanctions-on-russia/,"<a href=""https://www.ctvnews.ca/video/2026/03/13/the-us-administration-is-sidelining-its-allies-military-expert-on-easing-sanctions-on-russia/"">'The U.S. administration is sidelining its allies': Military expert on easing sanctions on Russia</a>"
5,Will Jessie Buckley get the Oscar this weekend for ‘Hamnet’?,https://www.ctvnews.ca/video/2026/03/13/will-jessie-buckley-get-the-oscar-this-weekend-for-hamnet/,"<a href=""https://www.ctvnews.ca/video/2026/03/13/will-jessie-buckley-get-the-oscar-this-weekend-for-hamnet/"">Will Jessie Buckley get the Oscar this weekend for ‘Hamnet’?</a>"
6,"Oscars shake up musical performances, spotlight on Kpop Demon Hunters and Sinners",https://www.ctvnews.ca/video/2026/03/13/oscars-shake-up-musical-performances-spotlight-on-kpop-demon-hunters-and-sinners/,"<a href=""https://www.ctvnews.ca/video/2026/03/13/oscars-shake-up-musical-performances-spotlight-on-kpop-demon-hunters-and-sinners/"">Oscars shake up musical performances, spotlight on Kpop Demon Hunters and Sinners</a>"
7,Ontario government’s call to keep some documents secret ‘a bit suspect’: analyst,https://www.ctvnews.ca/video/2026/03/13/ontario-governments-call-to-keep-some-documents-secret-a-bit-suspect-analyst/,"<a href=""https://www.ctvnews.ca/video/2026/03/13/ontario-governments-call-to-keep-some-documents-secret-a-bit-suspect-analyst/"">Ontario government’s call to keep some documents secret ‘a bit suspect’: analyst</a>"
8,Fewer Canadians planning trips to the U.S. this year,https://www.ctvnews.ca/video/2026/03/13/fewer-canadians-planning-trips-to-the-us-this-year/,"<a href=""https://www.ctvnews.ca/video/2026/03/13/fewer-canadians-planning-trips-to-the-us-this-year/"">Fewer Canadians planning trips to the U.S. this year</a>"
