rank,Article title,url,title_with_link
1,Thousands of Epstein files released by Trump DOJ ahead of deadline,https://www.ctvnews.ca/video/2025/12/19/ctv-national-news-thousands-of-epstein-files-released-by-trump-doj-ahead-of-deadline/,"<a href=""https://www.ctvnews.ca/video/2025/12/19/ctv-national-news-thousands-of-epstein-files-released-by-trump-doj-ahead-of-deadline/"">Thousands of Epstein files released by Trump DOJ ahead of deadline</a>"
2,Quebec Superior Court releases Daniel Jolivet on bail after 33 years in prison,https://www.ctvnews.ca/video/2025/12/19/ctv-national-news-quebec-superior-court-releases-daniel-jolivet-on-bail-after-33-years-in-prison/,"<a href=""https://www.ctvnews.ca/video/2025/12/19/ctv-national-news-quebec-superior-court-releases-daniel-jolivet-on-bail-after-33-years-in-prison/"">Quebec Superior Court releases Daniel Jolivet on bail after 33 years in prison</a>"
3,'Avatar is made for the big screen': Film critic,https://www.ctvnews.ca/video/2025/12/20/avatar-is-made-for-the-big-screen-film-critic/,"<a href=""https://www.ctvnews.ca/video/2025/12/20/avatar-is-made-for-the-big-screen-film-critic/"">'Avatar is made for the big screen': Film critic</a>"
4,Ontario and New York state strengthen nuclear ties amid trade uncertainty,https://www.ctvnews.ca/video/2025/12/19/ctv-national-news-ontario-and-new-york-state-strengthen-nuclear-ties-amid-trade-uncertainty/,"<a href=""https://www.ctvnews.ca/video/2025/12/19/ctv-national-news-ontario-and-new-york-state-strengthen-nuclear-ties-amid-trade-uncertainty/"">Ontario and New York state strengthen nuclear ties amid trade uncertainty</a>"
5,'Surveillance video will tell the real story': Epstein survivors’ attorney on files released by DOJ,https://www.ctvnews.ca/video/2025/12/20/surveillance-video-will-tell-the-real-story-epstein-survivors-attorney-on-files-released-by-doj/,"<a href=""https://www.ctvnews.ca/video/2025/12/20/surveillance-video-will-tell-the-real-story-epstein-survivors-attorney-on-files-released-by-doj/"">'Surveillance video will tell the real story': Epstein survivors’ attorney on files released by DOJ</a>"
6,Toronto man charged in alleged ISIS linked terrorism case,https://www.ctvnews.ca/video/2025/12/20/ctv-national-news-toronto-man-charged-in-alleged-isis-linked-terrorism-case/,"<a href=""https://www.ctvnews.ca/video/2025/12/20/ctv-national-news-toronto-man-charged-in-alleged-isis-linked-terrorism-case/"">Toronto man charged in alleged ISIS linked terrorism case</a>"
7,Trade uncertainty weighs on Canadian retail sales,https://www.ctvnews.ca/video/2025/12/19/ctv-national-news-trade-uncertainty-weighs-on-canadian-retail-sales/,"<a href=""https://www.ctvnews.ca/video/2025/12/19/ctv-national-news-trade-uncertainty-weighs-on-canadian-retail-sales/"">Trade uncertainty weighs on Canadian retail sales</a>"
8,W5 probe reveals who is behind crypto scams targeting Canadians,https://www.ctvnews.ca/video/2025/12/19/ctv-national-news-w5-probe-reveals-who-is-behind-crypto-scams-targeting-canadians/,"<a href=""https://www.ctvnews.ca/video/2025/12/19/ctv-national-news-w5-probe-reveals-who-is-behind-crypto-scams-targeting-canadians/"">W5 probe reveals who is behind crypto scams targeting Canadians</a>"
