rank,Article title,url,title_with_link
1,Buckled columns inside Manhattan high rise prompts evacuation,https://www.ctvnews.ca/video/2026/07/07/buckled-columns-inside-manhattan-high-rise-prompts-evacuation/,"<a href=""https://www.ctvnews.ca/video/2026/07/07/buckled-columns-inside-manhattan-high-rise-prompts-evacuation/"">Buckled columns inside Manhattan high rise prompts evacuation</a>"
2,"Rogers shuts down two Vancouver radio stations, lays off hundreds across the country",https://www.ctvnews.ca/vancouver/video/2026/07/08/rogers-shuts-down-two-vancouver-radio-stations/,"<a href=""https://www.ctvnews.ca/vancouver/video/2026/07/08/rogers-shuts-down-two-vancouver-radio-stations/"">Rogers shuts down two Vancouver radio stations, lays off hundreds across the country</a>"
3,NYC blocks evacuated after workers find building at risk of collapse,https://www.ctvnews.ca/video/2026/07/07/nyc-blocks-evacuated-after-workers-find-building-at-risk-of-collapse/,"<a href=""https://www.ctvnews.ca/video/2026/07/07/nyc-blocks-evacuated-after-workers-find-building-at-risk-of-collapse/"">NYC blocks evacuated after workers find building at risk of collapse</a>"
4,"Alleged assault, racist rant caught on video at Halifax Costco",https://www.ctvnews.ca/atlantic/video/2026/07/07/racist-rant-caught-on-video-in-halifax-costco/,"<a href=""https://www.ctvnews.ca/atlantic/video/2026/07/07/racist-rant-caught-on-video-in-halifax-costco/"">Alleged assault, racist rant caught on video at Halifax Costco</a>"
5,This AI 'actor' is sparking backlash from the film industry,https://www.ctvnews.ca/video/2026/07/07/ctv-national-news-hybrid-human-ai-produced-film-garnering-backlash-from-film-industry/,"<a href=""https://www.ctvnews.ca/video/2026/07/07/ctv-national-news-hybrid-human-ai-produced-film-garnering-backlash-from-film-industry/"">This AI 'actor' is sparking backlash from the film industry</a>"
6,Fatal crash on notorious B.C. highway traps travellers for hours,https://www.ctvnews.ca/vancouver/video/2026/07/07/fatal-crash-on-bc-highway-leaves-thousands-stranded/,"<a href=""https://www.ctvnews.ca/vancouver/video/2026/07/07/fatal-crash-on-bc-highway-leaves-thousands-stranded/"">Fatal crash on notorious B.C. highway traps travellers for hours</a>"
7,Six Ontario residents charged in $20M cocaine bust linked to Central America,https://www.ctvnews.ca/kitchener/video/2026/07/07/six-kitchener-residents-charged-in-20m-cocaine-bust/,"<a href=""https://www.ctvnews.ca/kitchener/video/2026/07/07/six-kitchener-residents-charged-in-20m-cocaine-bust/"">Six Ontario residents charged in $20M cocaine bust linked to Central America</a>"
8,"Ontario woman seeks $1,800 refund for cancelled European trip",https://www.ctvnews.ca/toronto/video/2026/07/06/woman-seeks-refund-for-cancelled-european-trip/,"<a href=""https://www.ctvnews.ca/toronto/video/2026/07/06/woman-seeks-refund-for-cancelled-european-trip/"">Ontario woman seeks $1,800 refund for cancelled European trip</a>"
