rank,Article title,url,title_with_link
1,‘Pure evil’: 16 children rescued from deplorable conditions at Ohio home,https://www.ctvnews.ca/video/2026/07/02/pure-evil-16-children-rescued-from-deplorable-conditions-at-ohio-home/,"<a href=""https://www.ctvnews.ca/video/2026/07/02/pure-evil-16-children-rescued-from-deplorable-conditions-at-ohio-home/"">‘Pure evil’: 16 children rescued from deplorable conditions at Ohio home</a>"
2,Carney ‘doubled our deficit and the policies that the Liberals have brought forward': Poilievre,https://www.ctvnews.ca/video/2026/07/02/carney-doubled-our-deficit-and-the-policies-that-the-liberals-have-brought-forward-poilievre/,"<a href=""https://www.ctvnews.ca/video/2026/07/02/carney-doubled-our-deficit-and-the-policies-that-the-liberals-have-brought-forward-poilievre/"">Carney ‘doubled our deficit and the policies that the Liberals have brought forward': Poilievre</a>"
3,White House defending Trump’s US$2.2B windfall earned during first year back in office,https://www.ctvnews.ca/video/2026/07/02/white-house-defending-trumps-us22b-windfall-earned-during-first-year-back-in-office/,"<a href=""https://www.ctvnews.ca/video/2026/07/02/white-house-defending-trumps-us22b-windfall-earned-during-first-year-back-in-office/"">White House defending Trump’s US$2.2B windfall earned during first year back in office</a>"
4,This daredevil couple scaled the Empire State Building and got engaged in the sky,https://www.ctvnews.ca/video/2026/07/02/daredevil-couple-arrested-after-scaling-empire-state-building-for-engagement-shoot/,"<a href=""https://www.ctvnews.ca/video/2026/07/02/daredevil-couple-arrested-after-scaling-empire-state-building-for-engagement-shoot/"">This daredevil couple scaled the Empire State Building and got engaged in the sky</a>"
5,Ottawa’s energy deal with B.C. will ‘set the stage’ for Alberta’s new pipeline: Reid,https://www.ctvnews.ca/video/2026/07/02/ottawas-energy-deal-with-bc-will-set-the-stage-for-albertas-new-pipeline-reid/,"<a href=""https://www.ctvnews.ca/video/2026/07/02/ottawas-energy-deal-with-bc-will-set-the-stage-for-albertas-new-pipeline-reid/"">Ottawa’s energy deal with B.C. will ‘set the stage’ for Alberta’s new pipeline: Reid</a>"
6,WATCH LIVE: Tracking thunderstorms in New Brunswick on Environment Canada radar,https://www.ctvnews.ca/video/live/2026/06/30/live-severe-thunderstorm-alerts/,"<a href=""https://www.ctvnews.ca/video/live/2026/06/30/live-severe-thunderstorm-alerts/"">WATCH LIVE: Tracking thunderstorms in New Brunswick on Environment Canada radar</a>"
7,"Record rainfall drenches Ottawa, turning streets into rivers",https://www.ctvnews.ca/ottawa/video/2026/07/02/your-morning-ottawa-update-ottawa-receives-110-mm-of-rain-on-canada-day/,"<a href=""https://www.ctvnews.ca/ottawa/video/2026/07/02/your-morning-ottawa-update-ottawa-receives-110-mm-of-rain-on-canada-day/"">Record rainfall drenches Ottawa, turning streets into rivers</a>"
8,"Man delivers Windsor, Ont. pizza to former resident nearly 500km away in show of community support",https://www.ctvnews.ca/windsor/video/2026/06/30/windsor-pizza-delivered-to-sault-ste-marie/,"<a href=""https://www.ctvnews.ca/windsor/video/2026/06/30/windsor-pizza-delivered-to-sault-ste-marie/"">Man delivers Windsor, Ont. pizza to former resident nearly 500km away in show of community support</a>"
