rank,Article title,url,title_with_link
1,Lawsuits accuse dating app of allowing former cardiologist sentenced to 158 years in prison to target women,https://www.ctvnews.ca/video/2025/12/17/lawsuits-accuse-dating-app-of-allowing-sexual-predator-to-target-women/,"<a href=""https://www.ctvnews.ca/video/2025/12/17/lawsuits-accuse-dating-app-of-allowing-sexual-predator-to-target-women/"">Lawsuits accuse dating app of allowing former cardiologist sentenced to 158 years in prison to target women</a>"
2,"ICE breaks car window to detain couple, drags woman on snowy street",https://www.ctvnews.ca/video/2025/12/17/ice-breaks-car-window-to-detain-couple-drags-woman-on-snowy-street/,"<a href=""https://www.ctvnews.ca/video/2025/12/17/ice-breaks-car-window-to-detain-couple-drags-woman-on-snowy-street/"">ICE breaks car window to detain couple, drags woman on snowy street</a>"
3,Florida Governor Ron DeSantis takes aim at Ontario Premier Doug Ford over tourism comments,https://www.ctvnews.ca/video/2025/12/17/florida-governor-ron-desantis-takes-aim-at-ontario-premier-doug-ford-over-tourism-comments/,"<a href=""https://www.ctvnews.ca/video/2025/12/17/florida-governor-ron-desantis-takes-aim-at-ontario-premier-doug-ford-over-tourism-comments/"">Florida Governor Ron DeSantis takes aim at Ontario Premier Doug Ford over tourism comments</a>"
4,Why some immigration experts are warning Canadians not to travel to the U.S.,https://www.ctvnews.ca/video/2025/12/17/ctv-national-news-some-immigration-experts-are-warning-canadians-not-to-travel-to-the-us/,"<a href=""https://www.ctvnews.ca/video/2025/12/17/ctv-national-news-some-immigration-experts-are-warning-canadians-not-to-travel-to-the-us/"">Why some immigration experts are warning Canadians not to travel to the U.S.</a>"
5,Police shoot armed man acting erratically at LRT station in Calgary,https://www.ctvnews.ca/calgary/video/2025/12/17/police-shoot-man-in-dalhousie/,"<a href=""https://www.ctvnews.ca/calgary/video/2025/12/17/police-shoot-man-in-dalhousie/"">Police shoot armed man acting erratically at LRT station in Calgary</a>"
6,‘GTA in real life’: Stolen Ferrari sparks explosion after crashing during police chase,https://www.ctvnews.ca/video/2025/12/17/stolen-ferrari-crashes-during-police-chase-sparking-explosion/,"<a href=""https://www.ctvnews.ca/video/2025/12/17/stolen-ferrari-crashes-during-police-chase-sparking-explosion/"">‘GTA in real life’: Stolen Ferrari sparks explosion after crashing during police chase</a>"
7,Trump looks to ‘reassure’ voters with address to the nation in the face of a rising cost of living,https://www.ctvnews.ca/video/2025/12/17/trump-looks-to-reassure-voters-with-address-to-the-nation-in-the-face-of-a-rising-cost-of-living/,"<a href=""https://www.ctvnews.ca/video/2025/12/17/trump-looks-to-reassure-voters-with-address-to-the-nation-in-the-face-of-a-rising-cost-of-living/"">Trump looks to ‘reassure’ voters with address to the nation in the face of a rising cost of living</a>"
8,LIVE @ 11:30 EST: Holiday travel tips from the U.S. Transportation Security Administration,https://www.ctvnews.ca/video/live/2025/12/17/live-1130-est-holiday-travel-tips-from-the-us-transportation-security-administration/,"<a href=""https://www.ctvnews.ca/video/live/2025/12/17/live-1130-est-holiday-travel-tips-from-the-us-transportation-security-administration/"">LIVE @ 11:30 EST: Holiday travel tips from the U.S. Transportation Security Administration</a>"
