rank,Article title,url,title_with_link
1,Air Canada pilot accused of flying 17 years without a valid licence,https://www.ctvnews.ca/video/2026/06/09/ctv-national-news-air-canada-pilot-accused-of-flying-17-years-without-a-valid-licence/,"<a href=""https://www.ctvnews.ca/video/2026/06/09/ctv-national-news-air-canada-pilot-accused-of-flying-17-years-without-a-valid-licence/"">Air Canada pilot accused of flying 17 years without a valid licence</a>"
2,Officers captured pushing Montreal cruiser stuck in ditch,https://www.ctvnews.ca/video/2026/06/09/officers-captured-pushing-montreal-cruiser-stuck-in-ditch/,"<a href=""https://www.ctvnews.ca/video/2026/06/09/officers-captured-pushing-montreal-cruiser-stuck-in-ditch/"">Officers captured pushing Montreal cruiser stuck in ditch</a>"
3,Robot kicks child in the stomach during performance,https://www.ctvnews.ca/video/2026/06/09/robot-kicks-child-in-the-stomach-during-performance/,"<a href=""https://www.ctvnews.ca/video/2026/06/09/robot-kicks-child-in-the-stomach-during-performance/"">Robot kicks child in the stomach during performance</a>"
4,Man hiding from police in a swamp gets attacked by an alligator,https://www.ctvnews.ca/video/2026/06/09/man-hiding-from-police-in-a-swamp-gets-attacked-by-an-alligator/,"<a href=""https://www.ctvnews.ca/video/2026/06/09/man-hiding-from-police-in-a-swamp-gets-attacked-by-an-alligator/"">Man hiding from police in a swamp gets attacked by an alligator</a>"
5,Seaplane captured making emergency landing on Phoenix roadway,https://www.ctvnews.ca/video/2026/06/09/seaplane-captured-making-emergency-landing-on-phoenix-roadway/,"<a href=""https://www.ctvnews.ca/video/2026/06/09/seaplane-captured-making-emergency-landing-on-phoenix-roadway/"">Seaplane captured making emergency landing on Phoenix roadway</a>"
6,New wave of online disinformation after Zelenskyy's open letter to Putin | Deception Decoded,https://www.ctvnews.ca/video/2026/06/09/new-wave-of-online-disinformation-after-zelenskyys-open-letter-to-putin-deception-decoded/,"<a href=""https://www.ctvnews.ca/video/2026/06/09/new-wave-of-online-disinformation-after-zelenskyys-open-letter-to-putin-deception-decoded/"">New wave of online disinformation after Zelenskyy's open letter to Putin | Deception Decoded</a>"
7,Wrong phone number leads to unlikely friendship and preservation of 500K photos,https://www.ctvnews.ca/video/2026/06/09/wrong-phone-number-leads-to-unlikely-friendship-and-preservation-of-500k-photos/,"<a href=""https://www.ctvnews.ca/video/2026/06/09/wrong-phone-number-leads-to-unlikely-friendship-and-preservation-of-500k-photos/"">Wrong phone number leads to unlikely friendship and preservation of 500K photos</a>"
8,Trump walks out of NBC interview after ‘heated and volatile exchange’ with reporter,https://www.ctvnews.ca/video/2026/06/08/trump-walks-out-of-nbc-interview-after-heated-and-volatile-exchange-with-reporter/,"<a href=""https://www.ctvnews.ca/video/2026/06/08/trump-walks-out-of-nbc-interview-after-heated-and-volatile-exchange-with-reporter/"">Trump walks out of NBC interview after ‘heated and volatile exchange’ with reporter</a>"
