rank,Article title,url,title_with_link
1,"Trump on CUSMA: 'We'll maybe let it expire, or we'll maybe work out another deal'",https://www.ctvnews.ca/video/2025/12/04/trump-on-cusma-well-maybe-let-it-expire-or-well-maybe-work-out-another-deal/,"<a href=""https://www.ctvnews.ca/video/2025/12/04/trump-on-cusma-well-maybe-let-it-expire-or-well-maybe-work-out-another-deal/"">Trump on CUSMA: 'We'll maybe let it expire, or we'll maybe work out another deal'</a>"
2,Calgary teen faces charges for alleged use of AI in extreme form of bullying,https://www.ctvnews.ca/video/2025/12/03/ctv-national-news-calgary-teen-faces-charges-for-alleged-use-of-ai-in-extreme-form-of-bullying/,"<a href=""https://www.ctvnews.ca/video/2025/12/03/ctv-national-news-calgary-teen-faces-charges-for-alleged-use-of-ai-in-extreme-form-of-bullying/"">Calgary teen faces charges for alleged use of AI in extreme form of bullying</a>"
3,How the Algoma Steel layoffs are impacting Sault Ste. Marie and Michigan,https://www.ctvnews.ca/video/2025/12/03/ctv-national-news-how-the-algoma-steel-layoffs-are-impacting-sault-ste-marie-and-michigan/,"<a href=""https://www.ctvnews.ca/video/2025/12/03/ctv-national-news-how-the-algoma-steel-layoffs-are-impacting-sault-ste-marie-and-michigan/"">How the Algoma Steel layoffs are impacting Sault Ste. Marie and Michigan</a>"
4,Rustad pushes back after being ousted as B.C. Conservative Party Leader,https://www.ctvnews.ca/vancouver/video/2025/12/04/rustad-pushes-back-after-being-ousted-as-bc-conservative-party-leader/,"<a href=""https://www.ctvnews.ca/vancouver/video/2025/12/04/rustad-pushes-back-after-being-ousted-as-bc-conservative-party-leader/"">Rustad pushes back after being ousted as B.C. Conservative Party Leader</a>"
5,Veteran Ontario police officer under investigation for dangerous driving at Santa parade,https://www.ctvnews.ca/barrie/video/2025/12/03/veteran-yrp-officer-under-investigation-for-dangerous-driving-at-santa-parade/,"<a href=""https://www.ctvnews.ca/barrie/video/2025/12/03/veteran-yrp-officer-under-investigation-for-dangerous-driving-at-santa-parade/"">Veteran Ontario police officer under investigation for dangerous driving at Santa parade</a>"
6,Police charge Ontario politician with uttering death threats,https://www.ctvnews.ca/video/2025/12/03/ctv-national-news-police-charge-ontario-politician-with-uttering-death-threats/,"<a href=""https://www.ctvnews.ca/video/2025/12/03/ctv-national-news-police-charge-ontario-politician-with-uttering-death-threats/"">Police charge Ontario politician with uttering death threats</a>"
7,ICE purchases $10M worth of armoured vehicles from Canadian manufacturer,https://www.ctvnews.ca/video/2025/12/03/ctv-national-news-ice-purchases-10m-worth-of-armoured-vehicles-from-canadian-manufacturer/,"<a href=""https://www.ctvnews.ca/video/2025/12/03/ctv-national-news-ice-purchases-10m-worth-of-armoured-vehicles-from-canadian-manufacturer/"">ICE purchases $10M worth of armoured vehicles from Canadian manufacturer</a>"
8,"Canada pledges $235 million in defence, security funding for Ukraine",https://www.ctvnews.ca/video/2025/12/04/canada-pledges-235-million-in-defence-security-funding-for-ukraine/,"<a href=""https://www.ctvnews.ca/video/2025/12/04/canada-pledges-235-million-in-defence-security-funding-for-ukraine/"">Canada pledges $235 million in defence, security funding for Ukraine</a>"
