rank,Article title,url,title_with_link
1,"Trump tells female reporter, ‘Quiet, piggy’ when asked about Epstein files",https://www.ctvnews.ca/video/2025/11/18/trump-tells-female-reporter-quiet-piggy-when-asked-about-epstein-files/,"<a href=""https://www.ctvnews.ca/video/2025/11/18/trump-tells-female-reporter-quiet-piggy-when-asked-about-epstein-files/"">Trump tells female reporter, ‘Quiet, piggy’ when asked about Epstein files</a>"
2,U.S. teen stabbed 14 times by ‘obsessed’ co-worker,https://www.ctvnews.ca/video/2025/11/18/us-teen-stabbed-14-times-by-obsessed-co-worker/,"<a href=""https://www.ctvnews.ca/video/2025/11/18/us-teen-stabbed-14-times-by-obsessed-co-worker/"">U.S. teen stabbed 14 times by ‘obsessed’ co-worker</a>"
3,"DoorDash driver charged after posting video of nude, sleeping customer to social media",https://www.ctvnews.ca/video/2025/11/18/doordash-driver-charged-after-posting-video-of-nude-sleeping-customer-to-social-media/,"<a href=""https://www.ctvnews.ca/video/2025/11/18/doordash-driver-charged-after-posting-video-of-nude-sleeping-customer-to-social-media/"">DoorDash driver charged after posting video of nude, sleeping customer to social media</a>"
4,Ottawa couple loses more than $300k in suspected investment fraud by people they trusted,https://www.ctvnews.ca/ottawa/video/2025/11/17/spot-the-scam-week-ottawa-couple-loses-300k/,"<a href=""https://www.ctvnews.ca/ottawa/video/2025/11/17/spot-the-scam-week-ottawa-couple-loses-300k/"">Ottawa couple loses more than $300k in suspected investment fraud by people they trusted</a>"
5,Clever sea wolf pulls crab traps out of water to eat bait in British Columbia,https://www.ctvnews.ca/video/2025/11/18/clever-sea-wolf-pulls-crab-traps-out-of-water-to-eat-bait-in-british-columbia/,"<a href=""https://www.ctvnews.ca/video/2025/11/18/clever-sea-wolf-pulls-crab-traps-out-of-water-to-eat-bait-in-british-columbia/"">Clever sea wolf pulls crab traps out of water to eat bait in British Columbia</a>"
6,"20-year-old Manitoba man dead, others in hospital after drinking ‘liquid substance’",https://www.ctvnews.ca/winnipeg/video/2025/11/18/liquid-substance-leaves-man-dead-others-hospitalized/,"<a href=""https://www.ctvnews.ca/winnipeg/video/2025/11/18/liquid-substance-leaves-man-dead-others-hospitalized/"">20-year-old Manitoba man dead, others in hospital after drinking ‘liquid substance’</a>"
7,U.S. man charged for shooting and killing woman who went to wrong home,https://www.ctvnews.ca/video/2025/11/18/us-man-charged-for-shooting-and-killing-woman-who-went-to-wrong-home/,"<a href=""https://www.ctvnews.ca/video/2025/11/18/us-man-charged-for-shooting-and-killing-woman-who-went-to-wrong-home/"">U.S. man charged for shooting and killing woman who went to wrong home</a>"
8,Actor and activist Richard Gere voices concerns over Canada-China relationship,https://www.ctvnews.ca/video/2025/11/18/ctv-national-news-actor-and-activist-richard-gere-voices-concerns-over-canada-china-relationship/,"<a href=""https://www.ctvnews.ca/video/2025/11/18/ctv-national-news-actor-and-activist-richard-gere-voices-concerns-over-canada-china-relationship/"">Actor and activist Richard Gere voices concerns over Canada-China relationship</a>"
