rank,Article title,url,title_with_link
1,'What a messy morning': OPP Sgt. Kerry Schmidt on road conditions in the GTA,https://www.ctvnews.ca/toronto/video/2026/01/15/what-a-messy-morning-opp-sgt-kerry-schmidt-on-road-conditions-in-the-gta/,"<a href=""https://www.ctvnews.ca/toronto/video/2026/01/15/what-a-messy-morning-opp-sgt-kerry-schmidt-on-road-conditions-in-the-gta/"">'What a messy morning': OPP Sgt. Kerry Schmidt on road conditions in the GTA</a>"
2,Spouse of Canada's worst mass shooter shares glimpse into his dark mind,https://www.ctvnews.ca/video/2026/01/15/spouse-of-canadas-worst-mass-shooter-shares-glimpse-into-his-dark-mind/,"<a href=""https://www.ctvnews.ca/video/2026/01/15/spouse-of-canadas-worst-mass-shooter-shares-glimpse-into-his-dark-mind/"">Spouse of Canada's worst mass shooter shares glimpse into his dark mind</a>"
3,"'I felt like I was going to lose my family, my kids': Ont. man speaks after being run over by SUV",https://www.ctvnews.ca/london/video/2026/01/14/i-felt-like-i-was-going-to-lose-my-family-my-kids/,"<a href=""https://www.ctvnews.ca/london/video/2026/01/14/i-felt-like-i-was-going-to-lose-my-family-my-kids/"">'I felt like I was going to lose my family, my kids': Ont. man speaks after being run over by SUV</a>"
4,Vancouver fast-food worker allegedly assaulted after refusing to add free bacon to burger,https://www.ctvnews.ca/vancouver/video/2026/01/15/vancouver-fast-food-worker-allegedly-assaulted-after-refusing-to-add-free-bacon-to-burger/,"<a href=""https://www.ctvnews.ca/vancouver/video/2026/01/15/vancouver-fast-food-worker-allegedly-assaulted-after-refusing-to-add-free-bacon-to-burger/"">Vancouver fast-food worker allegedly assaulted after refusing to add free bacon to burger</a>"
5,"Wall of water gushes onto highway in Kitchener, Ont. after watermain break",https://www.ctvnews.ca/kitchener/video/2026/01/14/wall-of-water-gushes-onto-kitchener-highway/,"<a href=""https://www.ctvnews.ca/kitchener/video/2026/01/14/wall-of-water-gushes-onto-kitchener-highway/"">Wall of water gushes onto highway in Kitchener, Ont. after watermain break</a>"
6,LIVE look at Toronto-area roads from inside CP24 news cruiser,https://www.ctvnews.ca/video/live/2026/01/14/live-look-at-toronto-area-roads-from-inside-cp24-news-cruiser/,"<a href=""https://www.ctvnews.ca/video/live/2026/01/14/live-look-at-toronto-area-roads-from-inside-cp24-news-cruiser/"">LIVE look at Toronto-area roads from inside CP24 news cruiser</a>"
7,Woman with disabilities left on accessible transit bus for hours after it became stuck in snow,https://www.ctvnews.ca/edmonton/video/2026/01/15/disabled-woman-left-on-dats-bus-for-hours/,"<a href=""https://www.ctvnews.ca/edmonton/video/2026/01/15/disabled-woman-left-on-dats-bus-for-hours/"">Woman with disabilities left on accessible transit bus for hours after it became stuck in snow</a>"
8,Watch as cars are swept out to sea amid major flash flooding in Australia,https://www.ctvnews.ca/video/2026/01/15/watch-as-cars-are-swept-out-to-sea-amid-major-flash-flooding-in-australia/,"<a href=""https://www.ctvnews.ca/video/2026/01/15/watch-as-cars-are-swept-out-to-sea-amid-major-flash-flooding-in-australia/"">Watch as cars are swept out to sea amid major flash flooding in Australia</a>"
