rank,Article title,url,title_with_link
1,Canada could feel some indirect weather impact as Hurricane Melissa travels northeast,https://www.ctvnews.ca/video/2025/10/29/canada-could-feel-some-indirect-weather-impact-as-hurricane-melissa-travels-northeast/,"<a href=""https://www.ctvnews.ca/video/2025/10/29/canada-could-feel-some-indirect-weather-impact-as-hurricane-melissa-travels-northeast/"">Canada could feel some indirect weather impact as Hurricane Melissa travels northeast</a>"
2,Jamaica declared a disaster area after Hurricane Melissa leaves trail of devastation,https://www.ctvnews.ca/video/2025/10/29/jamaica-declared-a-disaster-area-after-hurricane-melissa-leaves-trail-of-devastation/,"<a href=""https://www.ctvnews.ca/video/2025/10/29/jamaica-declared-a-disaster-area-after-hurricane-melissa-leaves-trail-of-devastation/"">Jamaica declared a disaster area after Hurricane Melissa leaves trail of devastation</a>"
3,LIVE: Tracking Hurricane Melissa as it makes landfall in Cuba,https://www.ctvnews.ca/video/live/2025/10/28/live-tracking-hurricane-melissa-as-it-makes-landfall-in-cuba/,"<a href=""https://www.ctvnews.ca/video/live/2025/10/28/live-tracking-hurricane-melissa-as-it-makes-landfall-in-cuba/"">LIVE: Tracking Hurricane Melissa as it makes landfall in Cuba</a>"
4,"Two Ontario homeowners shocked after receiving large water bills totalling nearly $20,000",https://www.ctvnews.ca/toronto/video/2025/10/28/two-ontario-homeowners-shocked-after-receiving-large-water-bills-totalling-nearly-20000/,"<a href=""https://www.ctvnews.ca/toronto/video/2025/10/28/two-ontario-homeowners-shocked-after-receiving-large-water-bills-totalling-nearly-20000/"">Two Ontario homeowners shocked after receiving large water bills totalling nearly $20,000</a>"
5,LIVE @ 10:30 a.m. EST: Bank of Canada makes key interest rate announcement,https://www.ctvnews.ca/video/live/2025/10/29/live-1030-am-est-bank-of-canada-makes-key-interest-rate-announcement/,"<a href=""https://www.ctvnews.ca/video/live/2025/10/29/live-1030-am-est-bank-of-canada-makes-key-interest-rate-announcement/"">LIVE @ 10:30 a.m. EST: Bank of Canada makes key interest rate announcement</a>"
6,Hurricane floodwaters rush through streets in Santiago de Cuba,https://www.ctvnews.ca/video/2025/10/29/hurricane-floodwaters-rush-through-streets-in-santiago-de-cuba/,"<a href=""https://www.ctvnews.ca/video/2025/10/29/hurricane-floodwaters-rush-through-streets-in-santiago-de-cuba/"">Hurricane floodwaters rush through streets in Santiago de Cuba</a>"
7,Hurricane Melissa losing wind intensity as it heads north after slamming Jamaica,https://www.ctvnews.ca/video/2025/10/29/hurricane-melissa-losing-wind-intensity-as-it-heads-north-after-slamming-jamaica/,"<a href=""https://www.ctvnews.ca/video/2025/10/29/hurricane-melissa-losing-wind-intensity-as-it-heads-north-after-slamming-jamaica/"">Hurricane Melissa losing wind intensity as it heads north after slamming Jamaica</a>"
8,‘To be expected’: U.S. ambassador reportedly hurls insults at Ont. trade rep,https://www.ctvnews.ca/video/2025/10/29/to-be-expected-us-ambassador-reportedly-hurls-insults-at-ont-trade-rep/,"<a href=""https://www.ctvnews.ca/video/2025/10/29/to-be-expected-us-ambassador-reportedly-hurls-insults-at-ont-trade-rep/"">‘To be expected’: U.S. ambassador reportedly hurls insults at Ont. trade rep</a>"
