rank,Article title,url,title_with_link
1,CTV News confirms name of Tumbler Ridge suspect: Here's what we know,https://www.ctvnews.ca/video/2026/02/11/ctv-news-confirms-name-of-tumbler-ridge-suspect-heres-what-we-know/,"<a href=""https://www.ctvnews.ca/video/2026/02/11/ctv-news-confirms-name-of-tumbler-ridge-suspect-heres-what-we-know/"">CTV News confirms name of Tumbler Ridge suspect: Here's what we know</a>"
2,‘The nation mourns with you’: PM Carney gives an emotional statement on deadly B.C. mass shooting,https://www.ctvnews.ca/video/2026/02/11/the-nation-mourns-with-you-pm-carney-gives-an-emotional-statement-on-deadly-bc-mass-shooting/,"<a href=""https://www.ctvnews.ca/video/2026/02/11/the-nation-mourns-with-you-pm-carney-gives-an-emotional-statement-on-deadly-bc-mass-shooting/"">‘The nation mourns with you’: PM Carney gives an emotional statement on deadly B.C. mass shooting</a>"
3,'I can’t even imagine the phone calls that parents might have received': Poilievre on B.C. shooting,https://www.ctvnews.ca/video/2026/02/11/i-cant-even-imagine-the-phone-calls-that-parents-might-have-received-poilievre-on-bc-shooting/,"<a href=""https://www.ctvnews.ca/video/2026/02/11/i-cant-even-imagine-the-phone-calls-that-parents-might-have-received-poilievre-on-bc-shooting/"">'I can’t even imagine the phone calls that parents might have received': Poilievre on B.C. shooting</a>"
4,"Community of Tumbler Ridge waking up with grief, but very few answers: pastor",https://www.ctvnews.ca/video/2026/02/11/community-of-tumbler-ridge-waking-up-with-grief-but-very-few-answers-pastor/,"<a href=""https://www.ctvnews.ca/video/2026/02/11/community-of-tumbler-ridge-waking-up-with-grief-but-very-few-answers-pastor/"">Community of Tumbler Ridge waking up with grief, but very few answers: pastor</a>"
5,Police release man after questioning in Nancy Guthrie investigation,https://www.ctvnews.ca/video/2026/02/11/police-release-man-after-questioning-in-nancy-guthrie-investigation/,"<a href=""https://www.ctvnews.ca/video/2026/02/11/police-release-man-after-questioning-in-nancy-guthrie-investigation/"">Police release man after questioning in Nancy Guthrie investigation</a>"
6,Warning: Video shows struggle between man with bat and Peterborough store clerk during violent robbery,https://www.ctvnews.ca/toronto/video/2026/02/11/warning-video-shows-struggle-between-man-with-bat-and-peterborough-store-clerk/,"<a href=""https://www.ctvnews.ca/toronto/video/2026/02/11/warning-video-shows-struggle-between-man-with-bat-and-peterborough-store-clerk/"">Warning: Video shows struggle between man with bat and Peterborough store clerk during violent robbery</a>"
7,Plane makes emergency landing on a road and hits several vehicles,https://www.ctvnews.ca/video/2026/02/11/plane-makes-emergency-landing-on-a-road-and-hits-several-vehicles/,"<a href=""https://www.ctvnews.ca/video/2026/02/11/plane-makes-emergency-landing-on-a-road-and-hits-several-vehicles/"">Plane makes emergency landing on a road and hits several vehicles</a>"
8,Family survives boat capsizing near lighthouse in California,https://www.ctvnews.ca/video/2026/02/11/family-survives-boat-capsizing-near-lighthouse-in-california/,"<a href=""https://www.ctvnews.ca/video/2026/02/11/family-survives-boat-capsizing-near-lighthouse-in-california/"">Family survives boat capsizing near lighthouse in California</a>"
