rank,Article title,url,title_with_link
1,LIVE FROM SPACE: Artemis II crew to speak to PM Carney as they prepare for journey back to Earth,https://www.ctvnews.ca/video/live/2026/04/07/live-from-space-artemis-ii-crew-to-speak-to-pm-carney-as-they-prepare-for-journey-back-to-earth/,"<a href=""https://www.ctvnews.ca/video/live/2026/04/07/live-from-space-artemis-ii-crew-to-speak-to-pm-carney-as-they-prepare-for-journey-back-to-earth/"">LIVE FROM SPACE: Artemis II crew to speak to PM Carney as they prepare for journey back to Earth</a>"
2,‘Iran begged for this ceasefire’: Hegseth claims victory after reaching temporary peace deal,https://www.ctvnews.ca/video/2026/04/08/iran-begged-for-this-ceasefire-hegseth-claims-victory-after-reaching-temporary-peace-deal/,"<a href=""https://www.ctvnews.ca/video/2026/04/08/iran-begged-for-this-ceasefire-hegseth-claims-victory-after-reaching-temporary-peace-deal/"">‘Iran begged for this ceasefire’: Hegseth claims victory after reaching temporary peace deal</a>"
3,What could Trump's next move be? Here's what we know,https://www.ctvnews.ca/video/2026/04/08/what-could-trumps-next-move-be-heres-what-we-know/,"<a href=""https://www.ctvnews.ca/video/2026/04/08/what-could-trumps-next-move-be-heres-what-we-know/"">What could Trump's next move be? Here's what we know</a>"
4,B.C. woman finds out husband was already married to multiple women | W5,https://www.ctvnews.ca/video/2026/04/08/bc-woman-finds-out-husband-was-already-married-to-multiple-women-w5/,"<a href=""https://www.ctvnews.ca/video/2026/04/08/bc-woman-finds-out-husband-was-already-married-to-multiple-women-w5/"">B.C. woman finds out husband was already married to multiple women | W5</a>"
5,Mayor calls prank 'disrespectful' as Volkswagen continues to hang from mountain in B.C.,https://www.ctvnews.ca/vancouver/video/2026/04/08/squamish-mayor-calls-prank-disrespectful/,"<a href=""https://www.ctvnews.ca/vancouver/video/2026/04/08/squamish-mayor-calls-prank-disrespectful/"">Mayor calls prank 'disrespectful' as Volkswagen continues to hang from mountain in B.C.</a>"
6,Artemis II observations show where humans may have advantage over robots: astronomer,https://www.ctvnews.ca/video/2026/04/08/artemis-ii-observations-show-where-humans-may-have-advantage-over-robots-astronomer/,"<a href=""https://www.ctvnews.ca/video/2026/04/08/artemis-ii-observations-show-where-humans-may-have-advantage-over-robots-astronomer/"">Artemis II observations show where humans may have advantage over robots: astronomer</a>"
7,Why CUSMA talks exceeding deadline may be beneficial amid current U.S. administration,https://www.ctvnews.ca/video/2026/04/08/why-cusma-talks-exceeding-deadline-may-be-beneficial-amid-current-us-administration/,"<a href=""https://www.ctvnews.ca/video/2026/04/08/why-cusma-talks-exceeding-deadline-may-be-beneficial-amid-current-us-administration/"">Why CUSMA talks exceeding deadline may be beneficial amid current U.S. administration</a>"
8,Ex-pilot who hijacked small plane speaks after guilty plea,https://www.ctvnews.ca/vancouver/video/2026/04/08/ex-pilot-who-hijacked-small-plane-speaks-after-guilty-plea/,"<a href=""https://www.ctvnews.ca/vancouver/video/2026/04/08/ex-pilot-who-hijacked-small-plane-speaks-after-guilty-plea/"">Ex-pilot who hijacked small plane speaks after guilty plea</a>"
