rank,Article title,url,title_with_link
1,‘You know what’s an irritant? 50 per cent tariff on steel': PM Carney,https://www.ctvnews.ca/video/2026/04/23/i-dont-get-up-first-thing-in-the-morning-thinking-about-the-united-states-pm-carney/,"<a href=""https://www.ctvnews.ca/video/2026/04/23/i-dont-get-up-first-thing-in-the-morning-thinking-about-the-united-states-pm-carney/"">‘You know what’s an irritant? 50 per cent tariff on steel': PM Carney</a>"
2,"‘Lighten up, buddy!’: Mulcair reacts to Lutnick’s comments on trade with Canada",https://www.ctvnews.ca/video/2026/04/23/lighten-up-buddy-mulcair-reacts-to-lutnicks-comments-on-trade-with-canada/,"<a href=""https://www.ctvnews.ca/video/2026/04/23/lighten-up-buddy-mulcair-reacts-to-lutnicks-comments-on-trade-with-canada/"">‘Lighten up, buddy!’: Mulcair reacts to Lutnick’s comments on trade with Canada</a>"
3,Security guard shoots robbery suspect after vehicle rams jewelry store in California,https://www.ctvnews.ca/video/2026/04/23/security-guard-shoots-robbery-suspect-after-vehicle-rams-jewelry-store-in-california/,"<a href=""https://www.ctvnews.ca/video/2026/04/23/security-guard-shoots-robbery-suspect-after-vehicle-rams-jewelry-store-in-california/"">Security guard shoots robbery suspect after vehicle rams jewelry store in California</a>"
4,"Two trains collide in Denmark, leaving multiple people injured",https://www.ctvnews.ca/video/2026/04/23/two-trains-collide-in-denmark-leaving-multiple-people-injured/,"<a href=""https://www.ctvnews.ca/video/2026/04/23/two-trains-collide-in-denmark-leaving-multiple-people-injured/"">Two trains collide in Denmark, leaving multiple people injured</a>"
5,Toronto landlord shocked after receiving nearly $32K 'catch-up' water bill,https://www.ctvnews.ca/toronto/video/2026/04/22/toronto-landlord-shocked-by-31000-water-bill/,"<a href=""https://www.ctvnews.ca/toronto/video/2026/04/22/toronto-landlord-shocked-by-31000-water-bill/"">Toronto landlord shocked after receiving nearly $32K 'catch-up' water bill</a>"
6,Bear stealing a bag of Doritos from Connecticut backyard caught on camera,https://www.ctvnews.ca/toronto/video/2026/04/23/bear-stealing-a-bag-of-doritos-from-connecticut-backyard-caught-on-camera/,"<a href=""https://www.ctvnews.ca/toronto/video/2026/04/23/bear-stealing-a-bag-of-doritos-from-connecticut-backyard-caught-on-camera/"">Bear stealing a bag of Doritos from Connecticut backyard caught on camera</a>"
7,‘We’re ready’: PM Carney on negotiations with the U.S. amid rising trade tensions,https://www.ctvnews.ca/video/2026/04/23/were-ready-pm-carney-on-negotiations-with-the-us-amid-rising-trade-tensions/,"<a href=""https://www.ctvnews.ca/video/2026/04/23/were-ready-pm-carney-on-negotiations-with-the-us-amid-rising-trade-tensions/"">‘We’re ready’: PM Carney on negotiations with the U.S. amid rising trade tensions</a>"
8,Middle East war causing airlines to suspend flights due to soaring fuel costs,https://www.ctvnews.ca/video/2026/04/23/middle-east-war-causing-airlines-to-suspend-flights-due-to-soaring-fuel-costs/,"<a href=""https://www.ctvnews.ca/video/2026/04/23/middle-east-war-causing-airlines-to-suspend-flights-due-to-soaring-fuel-costs/"">Middle East war causing airlines to suspend flights due to soaring fuel costs</a>"
