rank,Article title,url,title_with_link
1,'Innocent people are going to die': Expert weighs in on military response to Jerusalem bus attack,https://www.ctvnews.ca/video/2025/09/08/innocent-people-are-going-to-die-expert-weighs-in-on-military-response-to-jerusalem-bus-attack/,"<a href=""https://www.ctvnews.ca/video/2025/09/08/innocent-people-are-going-to-die-expert-weighs-in-on-military-response-to-jerusalem-bus-attack/"">'Innocent people are going to die': Expert weighs in on military response to Jerusalem bus attack</a>"
2,LIVE: B.C. RCMP provide update on Rabih Alkhalil escape investigation,https://www.ctvnews.ca/video/live/2025/09/08/live-bc-rcmp-provide-update-on-rabih-alkhalil-escape-investigation/,"<a href=""https://www.ctvnews.ca/video/live/2025/09/08/live-bc-rcmp-provide-update-on-rabih-alkhalil-escape-investigation/"">LIVE: B.C. RCMP provide update on Rabih Alkhalil escape investigation</a>"
3,AluQuébec CEO praises Joly’s announcement as ‘good news’ for aluminum sector,https://www.ctvnews.ca/video/2025/09/08/aluquebec-ceo-praises-jolys-announcement-as-good-news-for-aluminum-sector/,"<a href=""https://www.ctvnews.ca/video/2025/09/08/aluquebec-ceo-praises-jolys-announcement-as-good-news-for-aluminum-sector/"">AluQuébec CEO praises Joly’s announcement as ‘good news’ for aluminum sector</a>"
4,At least 19 dead after police in Nepal open fire on protesters,https://www.ctvnews.ca/video/2025/09/08/at-least-19-dead-after-police-in-nepal-open-fire-on-protesters/,"<a href=""https://www.ctvnews.ca/video/2025/09/08/at-least-19-dead-after-police-in-nepal-open-fire-on-protesters/"">At least 19 dead after police in Nepal open fire on protesters</a>"
5,Dozens injured after Ukraine hit with massive Russian air attack,https://www.ctvnews.ca/video/2025/09/08/dozens-injured-after-ukraine-hit-with-massive-russian-air-attack/,"<a href=""https://www.ctvnews.ca/video/2025/09/08/dozens-injured-after-ukraine-hit-with-massive-russian-air-attack/"">Dozens injured after Ukraine hit with massive Russian air attack</a>"
6,‘It’s time to be our own best customers’: PM Carney pledges $80M in aid for Atlantic businesses,https://www.ctvnews.ca/video/2025/09/08/its-time-to-be-our-own-best-customers-pm-carney-pledges-80m-in-aid-for-atlantic-businesses/,"<a href=""https://www.ctvnews.ca/video/2025/09/08/its-time-to-be-our-own-best-customers-pm-carney-pledges-80m-in-aid-for-atlantic-businesses/"">‘It’s time to be our own best customers’: PM Carney pledges $80M in aid for Atlantic businesses</a>"
7,Former N.L. premier reacts to PM Carney’s $80M boost for Atlantic Canada businesses,https://www.ctvnews.ca/video/2025/09/08/former-nl-premier-reacts-to-pm-carneys-80m-boost-for-atlantic-canada-businesses/,"<a href=""https://www.ctvnews.ca/video/2025/09/08/former-nl-premier-reacts-to-pm-carneys-80m-boost-for-atlantic-canada-businesses/"">Former N.L. premier reacts to PM Carney’s $80M boost for Atlantic Canada businesses</a>"
8,Suspects arrested after snatching $60K gift box from California wedding,https://www.ctvnews.ca/video/2025/09/08/suspects-arrested-after-snatching-60k-gift-box-from-california-wedding/,"<a href=""https://www.ctvnews.ca/video/2025/09/08/suspects-arrested-after-snatching-60k-gift-box-from-california-wedding/"">Suspects arrested after snatching $60K gift box from California wedding</a>"
