rank,Article title,url,title_with_link
1,"Failed attempted robbery in Ontario caught on camera, two men charged",https://www.ctvnews.ca/video/2026/02/23/failed-attempted-robbery-in-york-region-caught-on-camera/,"<a href=""https://www.ctvnews.ca/video/2026/02/23/failed-attempted-robbery-in-york-region-caught-on-camera/"">Failed attempted robbery in Ontario caught on camera, two men charged</a>"
2,Warning: Woman escapes alleged kidnapping attempt caught on camera,https://www.ctvnews.ca/video/2026/02/23/warning-woman-escapes-alleged-kidnapping-attempt-caught-on-camera/,"<a href=""https://www.ctvnews.ca/video/2026/02/23/warning-woman-escapes-alleged-kidnapping-attempt-caught-on-camera/"">Warning: Woman escapes alleged kidnapping attempt caught on camera</a>"
3,"Inside Guadalajara airport: Chaos erupts, tourist scramble for cover as violence erupts in Mexico",https://www.ctvnews.ca/video/2026/02/23/inside-guadalajara-airport-chaos-erupts-as-violence-erupts-in-mexico/,"<a href=""https://www.ctvnews.ca/video/2026/02/23/inside-guadalajara-airport-chaos-erupts-as-violence-erupts-in-mexico/"">Inside Guadalajara airport: Chaos erupts, tourist scramble for cover as violence erupts in Mexico</a>"
4,Canadians stuck in Mexico 'very concerned and frightened': Travel expert,https://www.ctvnews.ca/video/2026/02/23/canadians-stuck-in-mexico-very-concerned-and-frightened-travel-expert/,"<a href=""https://www.ctvnews.ca/video/2026/02/23/canadians-stuck-in-mexico-very-concerned-and-frightened-travel-expert/"">Canadians stuck in Mexico 'very concerned and frightened': Travel expert</a>"
5,'My balcony was covered with plumes of smoke': Canadian in Puerta Vallarta,https://www.ctvnews.ca/video/2026/02/23/my-balcony-was-covered-with-plumes-of-smoke-canadian-in-puerta-vallarta/,"<a href=""https://www.ctvnews.ca/video/2026/02/23/my-balcony-was-covered-with-plumes-of-smoke-canadian-in-puerta-vallarta/"">'My balcony was covered with plumes of smoke': Canadian in Puerta Vallarta</a>"
6,SCOTUS ruling on tariffs creating a 'massive battle' between Trump and Congress: analyst,https://www.ctvnews.ca/video/2026/02/23/scotus-ruling-on-tariffs-creating-a-massive-battle-between-trump-and-congress-analyst/,"<a href=""https://www.ctvnews.ca/video/2026/02/23/scotus-ruling-on-tariffs-creating-a-massive-battle-between-trump-and-congress-analyst/"">SCOTUS ruling on tariffs creating a 'massive battle' between Trump and Congress: analyst</a>"
7,"Pickup truck crashes into grocery store in Ontario, driver charged",https://www.ctvnews.ca/kitchener/video/2026/02/23/pickup-truck-crashes-into-brantford-no-frills/,"<a href=""https://www.ctvnews.ca/kitchener/video/2026/02/23/pickup-truck-crashes-into-brantford-no-frills/"">Pickup truck crashes into grocery store in Ontario, driver charged</a>"
8,Major fire destroys historic church in Quebec,https://www.ctvnews.ca/montreal/video/2026/02/23/major-fire-destroys-montreal-church/,"<a href=""https://www.ctvnews.ca/montreal/video/2026/02/23/major-fire-destroys-montreal-church/"">Major fire destroys historic church in Quebec</a>"
