rank,Article title,url,title_with_link
1,Several Alberta campgrounds hit by tornadoes over the last week,https://www.ctvnews.ca/edmonton/video/2026/07/14/several-alberta-campgrounds-hit-by-tornadoes/,"<a href=""https://www.ctvnews.ca/edmonton/video/2026/07/14/several-alberta-campgrounds-hit-by-tornadoes/"">Several Alberta campgrounds hit by tornadoes over the last week</a>"
2,Sea surface drones can be seen striking an Iranian port in newly released U.S. video,https://www.ctvnews.ca/video/2026/07/13/sea-surface-drones-can-be-seen-striking-an-iranian-port-in-newly-released-us-video/,"<a href=""https://www.ctvnews.ca/video/2026/07/13/sea-surface-drones-can-be-seen-striking-an-iranian-port-in-newly-released-us-video/"">Sea surface drones can be seen striking an Iranian port in newly released U.S. video</a>"
3,Massive bison tosses tourist into the air at Yellowstone National Park,https://www.ctvnews.ca/video/2026/07/13/massive-bison-tosses-tourist-into-the-air-at-yellowstone-national-park/,"<a href=""https://www.ctvnews.ca/video/2026/07/13/massive-bison-tosses-tourist-into-the-air-at-yellowstone-national-park/"">Massive bison tosses tourist into the air at Yellowstone National Park</a>"
4,Deadly shooting at Toronto festival sparks calls for crackdown on illegal guns,https://www.ctvnews.ca/video/2026/07/13/ctv-national-news-deadly-shooting-at-toronto-festival-sparks-calls-for-crackdown-on-illegal-guns/,"<a href=""https://www.ctvnews.ca/video/2026/07/13/ctv-national-news-deadly-shooting-at-toronto-festival-sparks-calls-for-crackdown-on-illegal-guns/"">Deadly shooting at Toronto festival sparks calls for crackdown on illegal guns</a>"
5,Experts warn about a common auto insurance mistake in shared households,https://www.ctvnews.ca/toronto/video/2026/07/13/experts-warn-about-a-common-auto-insurance-mistake-in-shared-households/,"<a href=""https://www.ctvnews.ca/toronto/video/2026/07/13/experts-warn-about-a-common-auto-insurance-mistake-in-shared-households/"">Experts warn about a common auto insurance mistake in shared households</a>"
6,Bear steals golf clubs on course in British Columbia,https://www.ctvnews.ca/vancouver/video/2026/07/13/bear-grabs-golf-bag-in-pitt-meadows/,"<a href=""https://www.ctvnews.ca/vancouver/video/2026/07/13/bear-grabs-golf-bag-in-pitt-meadows/"">Bear steals golf clubs on course in British Columbia</a>"
7,Meet the teens choosing flip phones over smartphones,https://www.ctvnews.ca/video/2026/07/13/ctv-national-news-meet-the-teens-choosing-flip-phones-over-smartphones/,"<a href=""https://www.ctvnews.ca/video/2026/07/13/ctv-national-news-meet-the-teens-choosing-flip-phones-over-smartphones/"">Meet the teens choosing flip phones over smartphones</a>"
8,Deadly tick-borne disease has health officials on high alert,https://www.ctvnews.ca/video/2026/07/13/ctv-national-news-deadly-tick-borne-disease-has-health-officials-on-high-alert/,"<a href=""https://www.ctvnews.ca/video/2026/07/13/ctv-national-news-deadly-tick-borne-disease-has-health-officials-on-high-alert/"">Deadly tick-borne disease has health officials on high alert</a>"
