rank,Article title,url,title_with_link
1,‘I don’t think I was going that fast’: Ontario teen pulled over going 147 km/h,https://www.ctvnews.ca/toronto/video/2026/04/23/i-dont-think-i-was-going-that-fast-hamilton-teen-pulled-over-going-147-kmh/,"<a href=""https://www.ctvnews.ca/toronto/video/2026/04/23/i-dont-think-i-was-going-that-fast-hamilton-teen-pulled-over-going-147-kmh/"">‘I don’t think I was going that fast’: Ontario teen pulled over going 147 km/h</a>"
2,Toronto soccer fans unable to refund tickets through FIFA website,https://www.ctvnews.ca/toronto/video/2026/04/23/toronto-soccer-fans-unable-to-refund-tickets-through-fifa-website/,"<a href=""https://www.ctvnews.ca/toronto/video/2026/04/23/toronto-soccer-fans-unable-to-refund-tickets-through-fifa-website/"">Toronto soccer fans unable to refund tickets through FIFA website</a>"
3,Bear stealing a bag of Doritos from Connecticut backyard caught on camera,https://www.ctvnews.ca/toronto/video/2026/04/23/bear-stealing-a-bag-of-doritos-from-connecticut-backyard-caught-on-camera/,"<a href=""https://www.ctvnews.ca/toronto/video/2026/04/23/bear-stealing-a-bag-of-doritos-from-connecticut-backyard-caught-on-camera/"">Bear stealing a bag of Doritos from Connecticut backyard caught on camera</a>"
4,Ex-Mountie accused of foreign interference speaks outside of Vancouver trial,https://www.ctvnews.ca/vancouver/video/2026/04/24/accused-ex-mountie-speaks-outside-vancouver-trial/,"<a href=""https://www.ctvnews.ca/vancouver/video/2026/04/24/accused-ex-mountie-speaks-outside-vancouver-trial/"">Ex-Mountie accused of foreign interference speaks outside of Vancouver trial</a>"
5,Ontario home catches fire twice in less than two days,https://www.ctvnews.ca/london/video/2026/04/23/home-catches-fire-twice-in-less-than-two-days/,"<a href=""https://www.ctvnews.ca/london/video/2026/04/23/home-catches-fire-twice-in-less-than-two-days/"">Ontario home catches fire twice in less than two days</a>"
6,Video shows family reeling in massive great white shark in Florida,https://www.ctvnews.ca/video/2026/04/23/video-shows-family-reeling-in-massive-great-white-shark-in-florida/,"<a href=""https://www.ctvnews.ca/video/2026/04/23/video-shows-family-reeling-in-massive-great-white-shark-in-florida/"">Video shows family reeling in massive great white shark in Florida</a>"
7,"‘Lighten up, buddy!’: Mulcair reacts to Lutnick’s comments on trade with Canada",https://www.ctvnews.ca/video/2026/04/23/lighten-up-buddy-mulcair-reacts-to-lutnicks-comments-on-trade-with-canada/,"<a href=""https://www.ctvnews.ca/video/2026/04/23/lighten-up-buddy-mulcair-reacts-to-lutnicks-comments-on-trade-with-canada/"">‘Lighten up, buddy!’: Mulcair reacts to Lutnick’s comments on trade with Canada</a>"
8,‘You know what’s an irritant? 50 per cent tariff on steel': PM Carney,https://www.ctvnews.ca/video/2026/04/23/i-dont-get-up-first-thing-in-the-morning-thinking-about-the-united-states-pm-carney/,"<a href=""https://www.ctvnews.ca/video/2026/04/23/i-dont-get-up-first-thing-in-the-morning-thinking-about-the-united-states-pm-carney/"">‘You know what’s an irritant? 50 per cent tariff on steel': PM Carney</a>"
