rank,Article title,url,title_with_link
1,‘Childish attempt’ to mock the law with Franklin the Turtle depiction: Ham,https://www.ctvnews.ca/video/2025/12/02/childish-attempt-to-mock-the-law-with-franklin-the-turtle-depiction-ham/,"<a href=""https://www.ctvnews.ca/video/2025/12/02/childish-attempt-to-mock-the-law-with-franklin-the-turtle-depiction-ham/"">‘Childish attempt’ to mock the law with Franklin the Turtle depiction: Ham</a>"
2,Attorneys offer ‘surprise explanation’ for woman’s death at husband’s murder trial,https://www.ctvnews.ca/video/2025/12/02/attorneys-offer-surprise-explanation-for-womans-death-at-husbands-murder-trial/,"<a href=""https://www.ctvnews.ca/video/2025/12/02/attorneys-offer-surprise-explanation-for-womans-death-at-husbands-murder-trial/"">Attorneys offer ‘surprise explanation’ for woman’s death at husband’s murder trial</a>"
3,Celebrity clothing stolen in highly co-ordinated robbery at Manhattan consignment shop,https://www.ctvnews.ca/video/2025/12/02/celebrity-clothing-stolen-in-highly-co-ordinated-robbery-at-manhattan-consignment-shop/,"<a href=""https://www.ctvnews.ca/video/2025/12/02/celebrity-clothing-stolen-in-highly-co-ordinated-robbery-at-manhattan-consignment-shop/"">Celebrity clothing stolen in highly co-ordinated robbery at Manhattan consignment shop</a>"
4,Woman charged in NICU break-in at B.C. hospital has police history,https://www.ctvnews.ca/vancouver/video/2025/12/02/woman-charged-in-nicu-break-in-has-police-history/,"<a href=""https://www.ctvnews.ca/vancouver/video/2025/12/02/woman-charged-in-nicu-break-in-has-police-history/"">Woman charged in NICU break-in at B.C. hospital has police history</a>"
5,People should not be using religion to justify committing hate crimes: Miller speaks upon return to cabinet,https://www.ctvnews.ca/video/2025/12/02/people-should-not-be-using-religion-to-justify-committing-hate-crimes-miller/,"<a href=""https://www.ctvnews.ca/video/2025/12/02/people-should-not-be-using-religion-to-justify-committing-hate-crimes-miller/"">People should not be using religion to justify committing hate crimes: Miller speaks upon return to cabinet</a>"
6,Mysterious fireball caught streaking across the sky in parts of Alberta,https://www.ctvnews.ca/calgary/video/2025/12/02/fireball-in-the-sky/,"<a href=""https://www.ctvnews.ca/calgary/video/2025/12/02/fireball-in-the-sky/"">Mysterious fireball caught streaking across the sky in parts of Alberta</a>"
7,‘Feels shocking to the system’: Cold chill throughout parts of Canada,https://www.ctvnews.ca/video/2025/12/02/feels-shocking-to-the-system-cold-chill-throughout-parts-of-canada/,"<a href=""https://www.ctvnews.ca/video/2025/12/02/feels-shocking-to-the-system-cold-chill-throughout-parts-of-canada/"">‘Feels shocking to the system’: Cold chill throughout parts of Canada</a>"
8,Halifax-area youth sentenced to four years in custody for fatally stabbing high school student,https://www.ctvnews.ca/atlantic/video/2025/12/01/halifax-area-youth-sentenced-for-fatal-stabbing/,"<a href=""https://www.ctvnews.ca/atlantic/video/2025/12/01/halifax-area-youth-sentenced-for-fatal-stabbing/"">Halifax-area youth sentenced to four years in custody for fatally stabbing high school student</a>"
