rank,Article title,url,title_with_link
1,Trump claims Iran war 'close to over' as blockade continues,https://www.ctvnews.ca/video/2026/04/15/trump-claims-iran-war-close-to-over-as-blockade-continues/,"<a href=""https://www.ctvnews.ca/video/2026/04/15/trump-claims-iran-war-close-to-over-as-blockade-continues/"">Trump claims Iran war 'close to over' as blockade continues</a>"
2,JD Vance heckled as he says Pope Leo should 'be careful' when talking theology,https://www.ctvnews.ca/video/2026/04/15/jd-vance-heckled-as-he-says-pope-leo-should-be-careful-when-talking-theology/,"<a href=""https://www.ctvnews.ca/video/2026/04/15/jd-vance-heckled-as-he-says-pope-leo-should-be-careful-when-talking-theology/"">JD Vance heckled as he says Pope Leo should 'be careful' when talking theology</a>"
3,70-car pileup on Colorado highway sends eight people to hospital,https://www.ctvnews.ca/video/2026/04/15/70-car-pileup-on-colorado-highway-sends-eight-people-to-hospital/,"<a href=""https://www.ctvnews.ca/video/2026/04/15/70-car-pileup-on-colorado-highway-sends-eight-people-to-hospital/"">70-car pileup on Colorado highway sends eight people to hospital</a>"
4,Possible ‘global recession’ looms as conflict in Middle East rages on,https://www.ctvnews.ca/toronto/video/2026/04/15/possible-global-recession-looms-as-conflict-in-middle-east-rages-on/,"<a href=""https://www.ctvnews.ca/toronto/video/2026/04/15/possible-global-recession-looms-as-conflict-in-middle-east-rages-on/"">Possible ‘global recession’ looms as conflict in Middle East rages on</a>"
5,PM Carney temporarily suspends federal gas tax,https://www.ctvnews.ca/video/2026/04/14/ctv-national-news-pm-carney-temporarily-suspends-federal-gas-tax/,"<a href=""https://www.ctvnews.ca/video/2026/04/14/ctv-national-news-pm-carney-temporarily-suspends-federal-gas-tax/"">PM Carney temporarily suspends federal gas tax</a>"
6,Watch the moment an earthquake shakes the House of Commons,https://www.ctvnews.ca/ottawa/video/2026/04/14/watch-the-moment-earthquake-rattles-house-of-commons/,"<a href=""https://www.ctvnews.ca/ottawa/video/2026/04/14/watch-the-moment-earthquake-rattles-house-of-commons/"">Watch the moment an earthquake shakes the House of Commons</a>"
7,"Byelection wins give Liberals majority, expose slipping Conservative support",https://www.ctvnews.ca/video/2026/04/14/ctv-national-news-byelection-wins-give-liberals-majority-expose-slipping-conservative-support/,"<a href=""https://www.ctvnews.ca/video/2026/04/14/ctv-national-news-byelection-wins-give-liberals-majority-expose-slipping-conservative-support/"">Byelection wins give Liberals majority, expose slipping Conservative support</a>"
8,"Toronto rally marks 'Equal Pay Day', pushes to close gender pay gap",https://www.ctvnews.ca/video/2026/04/14/ctv-national-news-toronto-rally-marks-equal-pay-day-pushes-to-close-gender-pay-gap/,"<a href=""https://www.ctvnews.ca/video/2026/04/14/ctv-national-news-toronto-rally-marks-equal-pay-day-pushes-to-close-gender-pay-gap/"">Toronto rally marks 'Equal Pay Day', pushes to close gender pay gap</a>"
