rank,Article title,url,title_with_link
1,New evacuation orders for parts of northern Ontario as strong winds move wildfires,https://www.ctvnews.ca/video/2026/07/17/new-evacuation-orders-for-parts-of-northern-ontario-as-strong-winds-move-wildfires/,"<a href=""https://www.ctvnews.ca/video/2026/07/17/new-evacuation-orders-for-parts-of-northern-ontario-as-strong-winds-move-wildfires/"">New evacuation orders for parts of northern Ontario as strong winds move wildfires</a>"
2,Ford says U.S. officials ‘chirping away’ about Ontario wildfires should help instead,https://www.ctvnews.ca/video/2026/07/17/ford-says-us-officials-chirping-away-about-ontario-wildfires-should-help-instead/,"<a href=""https://www.ctvnews.ca/video/2026/07/17/ford-says-us-officials-chirping-away-about-ontario-wildfires-should-help-instead/"">Ford says U.S. officials ‘chirping away’ about Ontario wildfires should help instead</a>"
3,Three AI chatbots try to count to 100 together... chaos ensues,https://www.ctvnews.ca/video/2026/07/17/three-ai-chatbots-try-to-count-to-100-together-chaos-ensues/,"<a href=""https://www.ctvnews.ca/video/2026/07/17/three-ai-chatbots-try-to-count-to-100-together-chaos-ensues/"">Three AI chatbots try to count to 100 together... chaos ensues</a>"
4,Lone survivor rescued from B.C. helicopter crash,https://www.ctvnews.ca/vancouver/video/2026/07/16/lone-survivor-rescued-from-bc-helicopter-crash-2/,"<a href=""https://www.ctvnews.ca/vancouver/video/2026/07/16/lone-survivor-rescued-from-bc-helicopter-crash-2/"">Lone survivor rescued from B.C. helicopter crash</a>"
5,‘Odyssey’ is ‘filmmaking on a truly epic scale’: Crouse,https://www.ctvnews.ca/video/2026/07/17/odyssey-is-filmmaking-on-a-truly-epic-scale-crouse/,"<a href=""https://www.ctvnews.ca/video/2026/07/17/odyssey-is-filmmaking-on-a-truly-epic-scale-crouse/"">‘Odyssey’ is ‘filmmaking on a truly epic scale’: Crouse</a>"
6,"Hot, humid conditions may have caused a train to derail in Montreal suburb",https://www.ctvnews.ca/video/2026/07/16/ctv-national-news-hot-humid-conditions-may-have-caused-train-to-derail-in-montreal-suburb/,"<a href=""https://www.ctvnews.ca/video/2026/07/16/ctv-national-news-hot-humid-conditions-may-have-caused-train-to-derail-in-montreal-suburb/"">Hot, humid conditions may have caused a train to derail in Montreal suburb</a>"
7,Trump says China ‘did everything possible’ to prevent him from winning 2020 presidential election,https://www.ctvnews.ca/video/2026/07/17/trump-says-china-did-everything-possible-to-prevent-him-from-winning-2020-presidential-election/,"<a href=""https://www.ctvnews.ca/video/2026/07/17/trump-says-china-did-everything-possible-to-prevent-him-from-winning-2020-presidential-election/"">Trump says China ‘did everything possible’ to prevent him from winning 2020 presidential election</a>"
8,U-17 finalists kicked out after 'meaningless' match sparks outrage,https://www.ctvnews.ca/vancouver/video/2026/07/16/youth-soccer-playoff-controversy/,"<a href=""https://www.ctvnews.ca/vancouver/video/2026/07/16/youth-soccer-playoff-controversy/"">U-17 finalists kicked out after 'meaningless' match sparks outrage</a>"
