rank,Article title,url,title_with_link
1,Canadian drivers are not pumped about rising gas prices,https://www.ctvnews.ca/video/2026/03/04/ctv-national-news-canadian-drivers-are-not-pumped-about-rising-gas-prices/,"<a href=""https://www.ctvnews.ca/video/2026/03/04/ctv-national-news-canadian-drivers-are-not-pumped-about-rising-gas-prices/"">Canadian drivers are not pumped about rising gas prices</a>"
2,Meteor fireball behind mysterious flash and boom over Vancouver,https://www.ctvnews.ca/video/2026/03/05/ctv-national-news-meteor-fireball-behind-mysterious-flash-and-boom-over-vancouver/,"<a href=""https://www.ctvnews.ca/video/2026/03/05/ctv-national-news-meteor-fireball-behind-mysterious-flash-and-boom-over-vancouver/"">Meteor fireball behind mysterious flash and boom over Vancouver</a>"
3,Market volatility grows as global conflict rattles investors,https://www.ctvnews.ca/video/2026/03/04/ctv-national-news-market-volatility-grows-as-global-conflict-rattles-investors/,"<a href=""https://www.ctvnews.ca/video/2026/03/04/ctv-national-news-market-volatility-grows-as-global-conflict-rattles-investors/"">Market volatility grows as global conflict rattles investors</a>"
4,Trump says U.S. struck Iran to stop nuclear threat: ‘It’s a nation that’s out of control’,https://www.ctvnews.ca/video/2026/03/04/trump-says-us-struck-iran-to-stop-nuclear-threat-its-a-nation-thats-out-of-control/,"<a href=""https://www.ctvnews.ca/video/2026/03/04/trump-says-us-struck-iran-to-stop-nuclear-threat-its-a-nation-thats-out-of-control/"">Trump says U.S. struck Iran to stop nuclear threat: ‘It’s a nation that’s out of control’</a>"
5,Leavitt rejects question asking her to clarify why the U.S. went to war with Iran,https://www.ctvnews.ca/video/2026/03/04/leavitt-rejects-question-asking-her-to-clarify-why-the-us-went-to-war-with-iran/,"<a href=""https://www.ctvnews.ca/video/2026/03/04/leavitt-rejects-question-asking-her-to-clarify-why-the-us-went-to-war-with-iran/"">Leavitt rejects question asking her to clarify why the U.S. went to war with Iran</a>"
6,NATO ally Turkey targeted as Middle East conflict escalates,https://www.ctvnews.ca/video/2026/03/04/ctv-national-news-nato-ally-turkey-targeted-as-middle-east-conflict-escalates/,"<a href=""https://www.ctvnews.ca/video/2026/03/04/ctv-national-news-nato-ally-turkey-targeted-as-middle-east-conflict-escalates/"">NATO ally Turkey targeted as Middle East conflict escalates</a>"
7,‘One can never categorically rule out participation’: Carney on Canada joining war in Iran,https://www.ctvnews.ca/video/2026/03/05/one-can-never-categorically-rule-out-participation-carney-on-canada-joining-war-in-iran/,"<a href=""https://www.ctvnews.ca/video/2026/03/05/one-can-never-categorically-rule-out-participation-carney-on-canada-joining-war-in-iran/"">‘One can never categorically rule out participation’: Carney on Canada joining war in Iran</a>"
8,Canadians struggle to leave the Middle East as conflict disrupts travel,https://www.ctvnews.ca/video/2026/03/04/ctv-national-news-canadians-struggle-to-leave-the-middle-east-as-conflict-disrupts-travel/,"<a href=""https://www.ctvnews.ca/video/2026/03/04/ctv-national-news-canadians-struggle-to-leave-the-middle-east-as-conflict-disrupts-travel/"">Canadians struggle to leave the Middle East as conflict disrupts travel</a>"
