rank,Article title,url,title_with_link
1,"LIVE expected soon: FBI, RCMP officials to hold joint press conference",https://www.ctvnews.ca/video/live/2026/01/16/live-fbi-rcmp-officials-to-hold-joint-press-conference/,"<a href=""https://www.ctvnews.ca/video/live/2026/01/16/live-fbi-rcmp-officials-to-hold-joint-press-conference/"">LIVE expected soon: FBI, RCMP officials to hold joint press conference</a>"
2,"FBI says Ryan Wedding, former Olympian-turned alleged drug kingpin, arrested: reports",https://www.ctvnews.ca/video/2026/01/23/fbi-says-ryan-wedding-former-olympian-turned-alleged-drug-kingpin-arrested-reports/,"<a href=""https://www.ctvnews.ca/video/2026/01/23/fbi-says-ryan-wedding-former-olympian-turned-alleged-drug-kingpin-arrested-reports/"">FBI says Ryan Wedding, former Olympian-turned alleged drug kingpin, arrested: reports</a>"
3,What’s driving the cold snap that’s hitting Canada?,https://www.ctvnews.ca/video/2026/01/23/whats-driving-the-cold-snap-thats-hitting-canada/,"<a href=""https://www.ctvnews.ca/video/2026/01/23/whats-driving-the-cold-snap-thats-hitting-canada/"">What’s driving the cold snap that’s hitting Canada?</a>"
4,What is Trump's 'Board of Peace' and what will it mean for people in Gaza?,https://www.ctvnews.ca/video/2026/01/23/what-is-trumps-board-of-peace-and-what-will-it-mean-for-people-in-gaza/,"<a href=""https://www.ctvnews.ca/video/2026/01/23/what-is-trumps-board-of-peace-and-what-will-it-mean-for-people-in-gaza/"">What is Trump's 'Board of Peace' and what will it mean for people in Gaza?</a>"
5,Vegas rolling the dice with promotion to try and lure Canadians back,https://www.ctvnews.ca/video/2026/01/23/vegas-rolling-the-dice-with-promotion-to-try-and-lure-canadians-back/,"<a href=""https://www.ctvnews.ca/video/2026/01/23/vegas-rolling-the-dice-with-promotion-to-try-and-lure-canadians-back/"">Vegas rolling the dice with promotion to try and lure Canadians back</a>"
6,Buck runs amuck inside a U.S. bank after crashing through window,https://www.ctvnews.ca/video/2026/01/23/video-captures-buck-running-amuck-inside-a-ny-bank-after-crashing-through-front-window/,"<a href=""https://www.ctvnews.ca/video/2026/01/23/video-captures-buck-running-amuck-inside-a-ny-bank-after-crashing-through-front-window/"">Buck runs amuck inside a U.S. bank after crashing through window</a>"
7,Aid groups work to help homeless during ‘exceptionally challenging’ cold snap,https://www.ctvnews.ca/video/2026/01/23/aid-groups-work-to-help-homeless-during-exceptionally-challenging-cold-snap/,"<a href=""https://www.ctvnews.ca/video/2026/01/23/aid-groups-work-to-help-homeless-during-exceptionally-challenging-cold-snap/"">Aid groups work to help homeless during ‘exceptionally challenging’ cold snap</a>"
8,‘It was really worth the wait’: 94-year-old finally gets sidewalks outside her home after decades,https://www.ctvnews.ca/video/2026/01/23/it-was-really-worth-the-wait-94-year-old-finally-gets-sidewalks-outside-her-home-after-decades/,"<a href=""https://www.ctvnews.ca/video/2026/01/23/it-was-really-worth-the-wait-94-year-old-finally-gets-sidewalks-outside-her-home-after-decades/"">‘It was really worth the wait’: 94-year-old finally gets sidewalks outside her home after decades</a>"
