rank,Article title,url,title_with_link
1,PM Carney sets conditions for new oil pipeline,https://www.ctvnews.ca/video/2026/05/20/pm-carney-sets-conditions-for-new-oil-pipeline/,"<a href=""https://www.ctvnews.ca/video/2026/05/20/pm-carney-sets-conditions-for-new-oil-pipeline/"">PM Carney sets conditions for new oil pipeline</a>"
2,Drug traffickers 'got smart' and moved operations to Canada: FBI director Patel,https://www.ctvnews.ca/video/2026/05/20/drug-traffickers-got-smart-and-moved-operations-to-canada-fbi-director-patel/,"<a href=""https://www.ctvnews.ca/video/2026/05/20/drug-traffickers-got-smart-and-moved-operations-to-canada-fbi-director-patel/"">Drug traffickers 'got smart' and moved operations to Canada: FBI director Patel</a>"
3,CTV News obtains video from inside nightclub during alleged assault by off-duty police officers,https://www.ctvnews.ca/vancouver/video/2026/05/20/video-shows-vpd-officers-altercation-at-nightclub/,"<a href=""https://www.ctvnews.ca/vancouver/video/2026/05/20/video-shows-vpd-officers-altercation-at-nightclub/"">CTV News obtains video from inside nightclub during alleged assault by off-duty police officers</a>"
4,One person being assessed for Ebola virus after trip to Africa: Ontario Ministry of Health,https://www.ctvnews.ca/toronto/video/2026/05/20/one-person-being-assessed-for-ebola-virus-after-trip-to-africa-ontario-ministry-of-health/,"<a href=""https://www.ctvnews.ca/toronto/video/2026/05/20/one-person-being-assessed-for-ebola-virus-after-trip-to-africa-ontario-ministry-of-health/"">One person being assessed for Ebola virus after trip to Africa: Ontario Ministry of Health</a>"
5,Man rescued then arrested after getting stuck inside movie theatre wall void for ten hours,https://www.ctvnews.ca/video/2026/05/20/man-rescued-then-arrested-after-getting-stuck-inside-movie-theatre-wall-void-for-ten-hours/,"<a href=""https://www.ctvnews.ca/video/2026/05/20/man-rescued-then-arrested-after-getting-stuck-inside-movie-theatre-wall-void-for-ten-hours/"">Man rescued then arrested after getting stuck inside movie theatre wall void for ten hours</a>"
6,Charges laid against owners of dogs that attacked 11-year-old girl,https://www.ctvnews.ca/windsor/video/2026/05/20/charges-laid-against-owners-of-dogs-that-attacked-11-year-old-girl/,"<a href=""https://www.ctvnews.ca/windsor/video/2026/05/20/charges-laid-against-owners-of-dogs-that-attacked-11-year-old-girl/"">Charges laid against owners of dogs that attacked 11-year-old girl</a>"
7,Driver abandons Cybertruck in a lake after trying to use ‘Wade Mode’ feature,https://www.ctvnews.ca/video/2026/05/20/driver-abandons-cybertruck-in-a-lake-after-trying-to-use-wade-mode-feature/,"<a href=""https://www.ctvnews.ca/video/2026/05/20/driver-abandons-cybertruck-in-a-lake-after-trying-to-use-wade-mode-feature/"">Driver abandons Cybertruck in a lake after trying to use ‘Wade Mode’ feature</a>"
8,"Teens charged in jewelry store break-in, robbery in Ontario",https://www.ctvnews.ca/london/video/2026/05/19/teenagers-charged-in-jewellery-store-break-in-robbery-in-st-thomas/,"<a href=""https://www.ctvnews.ca/london/video/2026/05/19/teenagers-charged-in-jewellery-store-break-in-robbery-in-st-thomas/"">Teens charged in jewelry store break-in, robbery in Ontario</a>"
