rank,Article title,url,title_with_link
1,"Canadian killed in Lisbon streetcar crash was celebrating his birthday, says brother",https://www.ctvnews.ca/video/2025/09/05/canadian-killed-in-lisbon-streetcar-crash-was-celebrating-his-birthday-says-brother/,"<a href=""https://www.ctvnews.ca/video/2025/09/05/canadian-killed-in-lisbon-streetcar-crash-was-celebrating-his-birthday-says-brother/"">Canadian killed in Lisbon streetcar crash was celebrating his birthday, says brother</a>"
2,Two Canadians among those killed in Portuguese streetcar crash,https://www.ctvnews.ca/video/2025/09/05/two-canadians-among-those-killed-in-portuguese-streetcar-crash/,"<a href=""https://www.ctvnews.ca/video/2025/09/05/two-canadians-among-those-killed-in-portuguese-streetcar-crash/"">Two Canadians among those killed in Portuguese streetcar crash</a>"
3,‘A new era of prosperity’: PM Carney announces new measures for industrial sectors,https://www.ctvnews.ca/video/2025/09/05/a-new-era-of-prosperity-pm-carney-announces-new-measures-for-industrial-sectors/,"<a href=""https://www.ctvnews.ca/video/2025/09/05/a-new-era-of-prosperity-pm-carney-announces-new-measures-for-industrial-sectors/"">‘A new era of prosperity’: PM Carney announces new measures for industrial sectors</a>"
4,"‘They got everything’: Thieves cut through roof, steal millions in gold and jewelry",https://www.ctvnews.ca/video/2025/09/05/they-got-everything-thieves-cut-through-roof-steal-millions-in-gold-and-jewelry/,"<a href=""https://www.ctvnews.ca/video/2025/09/05/they-got-everything-thieves-cut-through-roof-steal-millions-in-gold-and-jewelry/"">‘They got everything’: Thieves cut through roof, steal millions in gold and jewelry</a>"
5,"Dabrowski wins second U.S. Open title, Auger-Aliassime prepares for semi-final match",https://www.ctvnews.ca/video/2025/09/05/dabrowski-wins-second-us-open-title-auger-aliassime-prepares-for-semi-final-match/,"<a href=""https://www.ctvnews.ca/video/2025/09/05/dabrowski-wins-second-us-open-title-auger-aliassime-prepares-for-semi-final-match/"">Dabrowski wins second U.S. Open title, Auger-Aliassime prepares for semi-final match</a>"
6,Police call about woman calling for help turns out to be screaming goat,https://www.ctvnews.ca/video/2025/09/05/police-call-about-woman-calling-for-help-turns-out-to-be-screaming-goat/,"<a href=""https://www.ctvnews.ca/video/2025/09/05/police-call-about-woman-calling-for-help-turns-out-to-be-screaming-goat/"">Police call about woman calling for help turns out to be screaming goat</a>"
7,'Fundamental change in our economy': Reid on PM unveiling billions in aid for tariff-hit sectors,https://www.ctvnews.ca/video/2025/09/05/fundamental-change-in-our-economy-reid-on-pm-unveiling-billions-in-aid-for-tariff-hit-sectors/,"<a href=""https://www.ctvnews.ca/video/2025/09/05/fundamental-change-in-our-economy-reid-on-pm-unveiling-billions-in-aid-for-tariff-hit-sectors/"">'Fundamental change in our economy': Reid on PM unveiling billions in aid for tariff-hit sectors</a>"
8,Canadian producer takes ‘tremendous pride’ in premiering ‘Frankenstein’ at TIFF,https://www.ctvnews.ca/video/2025/09/05/canadian-producer-takes-tremendous-pride-in-premiering-frankenstein-at-tiff/,"<a href=""https://www.ctvnews.ca/video/2025/09/05/canadian-producer-takes-tremendous-pride-in-premiering-frankenstein-at-tiff/"">Canadian producer takes ‘tremendous pride’ in premiering ‘Frankenstein’ at TIFF</a>"
