rank,Article title,url,title_with_link
1,"LIVE NOW: After record-setting distance, Jeremy Hansen and Artemis II crew heading back to Earth",https://www.ctvnews.ca/video/live/2026/04/07/live-from-space-artemis-ii-crew-to-speak-to-pm-carney-as-they-prepare-for-journey-back-to-earth/,"<a href=""https://www.ctvnews.ca/video/live/2026/04/07/live-from-space-artemis-ii-crew-to-speak-to-pm-carney-as-they-prepare-for-journey-back-to-earth/"">LIVE NOW: After record-setting distance, Jeremy Hansen and Artemis II crew heading back to Earth</a>"
2,‘Iran begged for this ceasefire’: Hegseth claims victory after reaching temporary peace deal,https://www.ctvnews.ca/video/2026/04/08/iran-begged-for-this-ceasefire-hegseth-claims-victory-after-reaching-temporary-peace-deal/,"<a href=""https://www.ctvnews.ca/video/2026/04/08/iran-begged-for-this-ceasefire-hegseth-claims-victory-after-reaching-temporary-peace-deal/"">‘Iran begged for this ceasefire’: Hegseth claims victory after reaching temporary peace deal</a>"
3,B.C. woman finds out husband was already married to multiple women | W5,https://www.ctvnews.ca/video/2026/04/08/bc-woman-finds-out-husband-was-already-married-to-multiple-women-w5/,"<a href=""https://www.ctvnews.ca/video/2026/04/08/bc-woman-finds-out-husband-was-already-married-to-multiple-women-w5/"">B.C. woman finds out husband was already married to multiple women | W5</a>"
4,Last‑minute ceasefire halts Trump’s threats against Iran,https://www.ctvnews.ca/video/2026/04/08/ctv-national-news-lastminute-ceasefire-halts-trumps-threats-against-iran/,"<a href=""https://www.ctvnews.ca/video/2026/04/08/ctv-national-news-lastminute-ceasefire-halts-trumps-threats-against-iran/"">Last‑minute ceasefire halts Trump’s threats against Iran</a>"
5,PM Carney asked why gas prices are going up if Canada has its own oil,https://www.ctvnews.ca/video/2026/04/07/pm-carney-asked-why-gas-prices-are-going-up-if-canada-has-its-own-oil/,"<a href=""https://www.ctvnews.ca/video/2026/04/07/pm-carney-asked-why-gas-prices-are-going-up-if-canada-has-its-own-oil/"">PM Carney asked why gas prices are going up if Canada has its own oil</a>"
6,U.S.-Iran temporary ceasefire ‘a big dramatic swing’ following Trump’s threats,https://www.ctvnews.ca/video/2026/04/08/us-iran-temporary-ceasefire-a-big-dramatic-swing-following-trumps-threats/,"<a href=""https://www.ctvnews.ca/video/2026/04/08/us-iran-temporary-ceasefire-a-big-dramatic-swing-following-trumps-threats/"">U.S.-Iran temporary ceasefire ‘a big dramatic swing’ following Trump’s threats</a>"
7,Human rights expert calls Trump’s Iran post ‘legally indefensible’,https://www.ctvnews.ca/video/2026/04/07/human-rights-expert-calls-trumps-iran-post-legally-indefensible/,"<a href=""https://www.ctvnews.ca/video/2026/04/07/human-rights-expert-calls-trumps-iran-post-legally-indefensible/"">Human rights expert calls Trump’s Iran post ‘legally indefensible’</a>"
8,An unusual and bold hockey stick theft in Quebec sparks debate over rising costs,https://www.ctvnews.ca/video/2026/04/07/ctv-national-news-an-unusual-and-bold-hockey-stick-theft-in-quebec-sparks-debate-over-rising-costs/,"<a href=""https://www.ctvnews.ca/video/2026/04/07/ctv-national-news-an-unusual-and-bold-hockey-stick-theft-in-quebec-sparks-debate-over-rising-costs/"">An unusual and bold hockey stick theft in Quebec sparks debate over rising costs</a>"
