rank,Article title,url,title_with_link
1,Middle East war widens as Iran expands targets,https://www.ctvnews.ca/video/2026/03/05/ctv-national-news-middle-east-war-widens-as-iran-expands-targets/,"<a href=""https://www.ctvnews.ca/video/2026/03/05/ctv-national-news-middle-east-war-widens-as-iran-expands-targets/"">Middle East war widens as Iran expands targets</a>"
2,Trump says he must help choose Iran’s next leader,https://www.ctvnews.ca/video/2026/03/05/ctv-national-news-trump-says-he-must-help-choose-irans-next-leader/,"<a href=""https://www.ctvnews.ca/video/2026/03/05/ctv-national-news-trump-says-he-must-help-choose-irans-next-leader/"">Trump says he must help choose Iran’s next leader</a>"
3,Expect a ‘very testy confirmation hearing’ for Sen. Markwayne Mullin: Ham,https://www.ctvnews.ca/video/2026/03/05/markwayne-mullin-to-replace-kristi-noem-as-head-of-us-department-of-homeland-security/,"<a href=""https://www.ctvnews.ca/video/2026/03/05/markwayne-mullin-to-replace-kristi-noem-as-head-of-us-department-of-homeland-security/"">Expect a ‘very testy confirmation hearing’ for Sen. Markwayne Mullin: Ham</a>"
4,What could Canada contribute if it participates in the conflict in the Middle East?,https://www.ctvnews.ca/video/2026/03/05/what-could-canada-contribute-if-it-participates-in-the-conflict-in-the-middle-east/,"<a href=""https://www.ctvnews.ca/video/2026/03/05/what-could-canada-contribute-if-it-participates-in-the-conflict-in-the-middle-east/"">What could Canada contribute if it participates in the conflict in the Middle East?</a>"
5,PM Carney won’t rule out Canadian military role in Middle East conflict,https://www.ctvnews.ca/video/2026/03/05/ctv-national-news-pm-carney-wont-rule-out-canadian-military-role-in-middle-east-conflict/,"<a href=""https://www.ctvnews.ca/video/2026/03/05/ctv-national-news-pm-carney-wont-rule-out-canadian-military-role-in-middle-east-conflict/"">PM Carney won’t rule out Canadian military role in Middle East conflict</a>"
6,Ottawa exploring new ways to help Canadians leave the Middle East,https://www.ctvnews.ca/video/2026/03/05/ctv-national-news-ottawa-exploring-new-ways-to-help-canadians-leave-the-middle-east/,"<a href=""https://www.ctvnews.ca/video/2026/03/05/ctv-national-news-ottawa-exploring-new-ways-to-help-canadians-leave-the-middle-east/"">Ottawa exploring new ways to help Canadians leave the Middle East</a>"
7,"Windsor, Ont. mayor asks Ford for permission to add temporary tolls to Ambassador Bridge",https://www.ctvnews.ca/video/2026/03/05/windsor-ont-mayor-asks-ford-for-permission-to-add-temporary-tolls-to-ambassador-bridge/,"<a href=""https://www.ctvnews.ca/video/2026/03/05/windsor-ont-mayor-asks-ford-for-permission-to-add-temporary-tolls-to-ambassador-bridge/"">Windsor, Ont. mayor asks Ford for permission to add temporary tolls to Ambassador Bridge</a>"
8,‘Iran is not Venezuela’: Middle East expert on Trump’s potential next steps,https://www.ctvnews.ca/video/2026/03/05/iran-is-not-venezuela-middle-east-expert-on-trumps-potential-next-steps/,"<a href=""https://www.ctvnews.ca/video/2026/03/05/iran-is-not-venezuela-middle-east-expert-on-trumps-potential-next-steps/"">‘Iran is not Venezuela’: Middle East expert on Trump’s potential next steps</a>"
