rank,Article title,url,title_with_link
1,Watch the full speech: Prime Minister Mark Carney outlines Canada’s values,https://www.ctvnews.ca/video/2026/01/22/watch-the-full-speech-prime-minister-mark-carney-outlines-canadas-values/,"<a href=""https://www.ctvnews.ca/video/2026/01/22/watch-the-full-speech-prime-minister-mark-carney-outlines-canadas-values/"">Watch the full speech: Prime Minister Mark Carney outlines Canada’s values</a>"
2,"‘Canada doesn’t live because of the United States, Canada thrives because we are Canadian’",https://www.ctvnews.ca/video/2026/01/22/canada-doesnt-live-because-of-the-united-states-canada-thrives-because-we-are-canadian/,"<a href=""https://www.ctvnews.ca/video/2026/01/22/canada-doesnt-live-because-of-the-united-states-canada-thrives-because-we-are-canadian/"">‘Canada doesn’t live because of the United States, Canada thrives because we are Canadian’</a>"
3,Extreme cold alert:  Parts of Canada sees significant temperature drop,https://www.ctvnews.ca/video/2026/01/22/extreme-cold-alert-parts-of-canada-sees-significant-temperature-drop/,"<a href=""https://www.ctvnews.ca/video/2026/01/22/extreme-cold-alert-parts-of-canada-sees-significant-temperature-drop/"">Extreme cold alert:  Parts of Canada sees significant temperature drop</a>"
4,"Reid on the PM's address: 'We got a speech about national identity, about the idea of Canada'",https://www.ctvnews.ca/video/2026/01/22/reid-on-the-pms-address-we-got-a-speech-about-national-identity-about-the-idea-of-canada/,"<a href=""https://www.ctvnews.ca/video/2026/01/22/reid-on-the-pms-address-we-got-a-speech-about-national-identity-about-the-idea-of-canada/"">Reid on the PM's address: 'We got a speech about national identity, about the idea of Canada'</a>"
5,'Sinners' sets a record: Here are some of the 2026 Oscar nominees,https://www.ctvnews.ca/video/2026/01/22/sinners-sets-a-record-here-are-some-of-the-2026-oscar-nominees/,"<a href=""https://www.ctvnews.ca/video/2026/01/22/sinners-sets-a-record-here-are-some-of-the-2026-oscar-nominees/"">'Sinners' sets a record: Here are some of the 2026 Oscar nominees</a>"
6,Canada needs to be a ‘beacon’ to a world at sea: PM Carney,https://www.ctvnews.ca/video/2026/01/22/canada-needs-to-be-a-beacon-to-a-world-at-sea-pm-carney/,"<a href=""https://www.ctvnews.ca/video/2026/01/22/canada-needs-to-be-a-beacon-to-a-world-at-sea-pm-carney/"">Canada needs to be a ‘beacon’ to a world at sea: PM Carney</a>"
7,U.S. governors criticize Trump over Greenland:  Here's what we know,https://www.ctvnews.ca/video/2026/01/22/us-governors-criticize-trump-over-greenland-heres-what-we-know/,"<a href=""https://www.ctvnews.ca/video/2026/01/22/us-governors-criticize-trump-over-greenland-heres-what-we-know/"">U.S. governors criticize Trump over Greenland:  Here's what we know</a>"
8,Canadian values ‘must be fought for’: PM Carney,https://www.ctvnews.ca/video/2026/01/22/canadian-values-must-be-fought-for-pm-carney/,"<a href=""https://www.ctvnews.ca/video/2026/01/22/canadian-values-must-be-fought-for-pm-carney/"">Canadian values ‘must be fought for’: PM Carney</a>"
