rank,Article title,url,title_with_link
1,"‘My mother had a crush on Charles,’ Trump says during welcome ceremony for Royals",https://www.ctvnews.ca/video/2026/04/28/my-mother-had-a-crush-on-charles-trump-says-while-hosting-royals/,"<a href=""https://www.ctvnews.ca/video/2026/04/28/my-mother-had-a-crush-on-charles-trump-says-while-hosting-royals/"">‘My mother had a crush on Charles,’ Trump says during welcome ceremony for Royals</a>"
2,"Hot air balloon crashes into casino, power line after unexpected launch",https://www.ctvnews.ca/video/2026/04/28/hot-air-balloon-crashes-into-casino-power-line-after-unexpected-launch/,"<a href=""https://www.ctvnews.ca/video/2026/04/28/hot-air-balloon-crashes-into-casino-power-line-after-unexpected-launch/"">Hot air balloon crashes into casino, power line after unexpected launch</a>"
3,Teens take lawnmower on joyride through Target in Florida,https://www.ctvnews.ca/video/2026/04/28/teens-take-lawnmower-on-joyride-through-target-in-florida/,"<a href=""https://www.ctvnews.ca/video/2026/04/28/teens-take-lawnmower-on-joyride-through-target-in-florida/"">Teens take lawnmower on joyride through Target in Florida</a>"
4,Saskatchewan tow crew goes viral for unusual animal rescue,https://www.ctvnews.ca/video/2026/04/28/ctv-national-news-saskatchewan-tow-crew-goes-viral-for-unusual-animal-rescue/,"<a href=""https://www.ctvnews.ca/video/2026/04/28/ctv-national-news-saskatchewan-tow-crew-goes-viral-for-unusual-animal-rescue/"">Saskatchewan tow crew goes viral for unusual animal rescue</a>"
5,Watch the moment a vehicle narrowly escaped collapse of historic building,https://www.ctvnews.ca/video/2026/04/28/watch-the-moment-a-vehicle-narrowly-escaped-collapse-of-historic-building/,"<a href=""https://www.ctvnews.ca/video/2026/04/28/watch-the-moment-a-vehicle-narrowly-escaped-collapse-of-historic-building/"">Watch the moment a vehicle narrowly escaped collapse of historic building</a>"
6,Advocates concerned after grey whale spotted in Vancouver,https://www.ctvnews.ca/vancouver/video/2026/04/28/grey-whale-sighted-in-vancouver/,"<a href=""https://www.ctvnews.ca/vancouver/video/2026/04/28/grey-whale-sighted-in-vancouver/"">Advocates concerned after grey whale spotted in Vancouver</a>"
7,Ontario woman frustrated after rodent damage forces thousands of dollars in car repairs,https://www.ctvnews.ca/toronto/video/2026/04/27/ontario-woman-frustrated-after-rodent-damage-forces-thousands-of-dollars-in-repairs/,"<a href=""https://www.ctvnews.ca/toronto/video/2026/04/27/ontario-woman-frustrated-after-rodent-damage-forces-thousands-of-dollars-in-repairs/"">Ontario woman frustrated after rodent damage forces thousands of dollars in car repairs</a>"
8,What Canadians need to hear to feel confidant in Canada's financial future,https://www.ctvnews.ca/video/2026/04/28/what-canadians-need-to-hear-to-feel-confidant-in-canadas-financial-future/,"<a href=""https://www.ctvnews.ca/video/2026/04/28/what-canadians-need-to-hear-to-feel-confidant-in-canadas-financial-future/"">What Canadians need to hear to feel confidant in Canada's financial future</a>"
