rank,Article title,url,title_with_link
1,NDP MP Lori Idlout crosses the floor to the Liberals,https://www.ctvnews.ca/video/2026/03/11/ctv-national-news-ndp-mp-lori-idlout-crosses-the-floor-to-the-liberals/,"<a href=""https://www.ctvnews.ca/video/2026/03/11/ctv-national-news-ndp-mp-lori-idlout-crosses-the-floor-to-the-liberals/"">NDP MP Lori Idlout crosses the floor to the Liberals</a>"
2,Local and federal agencies investigating U.S. Consulate shooting in Toronto,https://www.ctvnews.ca/video/2026/03/10/ctv-national-news-local-and-federal-agencies-investigating-us-consulate-shooting-in-toronto/,"<a href=""https://www.ctvnews.ca/video/2026/03/10/ctv-national-news-local-and-federal-agencies-investigating-us-consulate-shooting-in-toronto/"">Local and federal agencies investigating U.S. Consulate shooting in Toronto</a>"
3,Carney grilled during question period over shifting position on Iran war,https://www.ctvnews.ca/video/2026/03/10/ctv-national-news-carney-grilled-during-question-period-over-shifting-position-on-iran-war/,"<a href=""https://www.ctvnews.ca/video/2026/03/10/ctv-national-news-carney-grilled-during-question-period-over-shifting-position-on-iran-war/"">Carney grilled during question period over shifting position on Iran war</a>"
4,U.S. ramps up strikes on Iran as questions of when the war will end loom,https://www.ctvnews.ca/video/2026/03/10/ctv-national-news-us-ramps-up-strikes-on-iran-as-questions-of-when-the-war-will-end-loom/,"<a href=""https://www.ctvnews.ca/video/2026/03/10/ctv-national-news-us-ramps-up-strikes-on-iran-as-questions-of-when-the-war-will-end-loom/"">U.S. ramps up strikes on Iran as questions of when the war will end loom</a>"
5,Iranian students in Canada face financial uncertainty amid war in Iran,https://www.ctvnews.ca/video/2026/03/10/ctv-national-news-iranian-students-in-canada-face-financial-uncertainty-amid-war-in-iran/,"<a href=""https://www.ctvnews.ca/video/2026/03/10/ctv-national-news-iranian-students-in-canada-face-financial-uncertainty-amid-war-in-iran/"">Iranian students in Canada face financial uncertainty amid war in Iran</a>"
6,Notorious serial killer Allan Legere dead at 78,https://www.ctvnews.ca/video/2026/03/11/ctv-national-news-notorious-serial-killer-allan-legere-dead-at-78/,"<a href=""https://www.ctvnews.ca/video/2026/03/11/ctv-national-news-notorious-serial-killer-allan-legere-dead-at-78/"">Notorious serial killer Allan Legere dead at 78</a>"
7,Family of high school teacher killed in prank gone wrong wants charges against five teens dropped,https://www.ctvnews.ca/video/2026/03/10/family-of-high-school-teacher-killed-in-prank-gone-wrong-wants-charges-against-five-teens-dropped/,"<a href=""https://www.ctvnews.ca/video/2026/03/10/family-of-high-school-teacher-killed-in-prank-gone-wrong-wants-charges-against-five-teens-dropped/"">Family of high school teacher killed in prank gone wrong wants charges against five teens dropped</a>"
8,Colony of sea lions create a spectacle on Vancouver Island beach,https://www.ctvnews.ca/video/2026/03/10/ctv-national-news-colony-of-sea-lions-create-a-spectacle-on-vancouver-island-beach/,"<a href=""https://www.ctvnews.ca/video/2026/03/10/ctv-national-news-colony-of-sea-lions-create-a-spectacle-on-vancouver-island-beach/"">Colony of sea lions create a spectacle on Vancouver Island beach</a>"
