rank,Article title,url,title_with_link
1,Canada's effort to build trade relations outside the U.S.,https://www.ctvnews.ca/video/2026/05/03/canadas-effort-to-build-trade-relations-outside-the-us/,"<a href=""https://www.ctvnews.ca/video/2026/05/03/canadas-effort-to-build-trade-relations-outside-the-us/"">Canada's effort to build trade relations outside the U.S.</a>"
2,Poilievre says PM Mark Carney is 'just another Liberal',https://www.ctvnews.ca/video/2026/05/03/poilievre-says-pm-mark-carney-is-just-another-liberal/,"<a href=""https://www.ctvnews.ca/video/2026/05/03/poilievre-says-pm-mark-carney-is-just-another-liberal/"">Poilievre says PM Mark Carney is 'just another Liberal'</a>"
3,Community hosts vigil for missing Nova Scotia siblings Jack and Lilly,https://www.ctvnews.ca/video/2026/05/03/ctv-national-news-community-hosts-vigil-for-missing-nova-scotia-siblings-jack-and-lilly/,"<a href=""https://www.ctvnews.ca/video/2026/05/03/ctv-national-news-community-hosts-vigil-for-missing-nova-scotia-siblings-jack-and-lilly/"">Community hosts vigil for missing Nova Scotia siblings Jack and Lilly</a>"
4,CSIS says more youth and teens are becoming involved with terrorism,https://www.ctvnews.ca/video/2026/05/03/ctv-national-news-csis-says-more-youth-and-teens-are-becoming-involved-with-terrorism/,"<a href=""https://www.ctvnews.ca/video/2026/05/03/ctv-national-news-csis-says-more-youth-and-teens-are-becoming-involved-with-terrorism/"">CSIS says more youth and teens are becoming involved with terrorism</a>"
5,Has New Brunswick fixed its nursing shortage?,https://www.ctvnews.ca/video/2026/05/03/ctv-national-news-has-new-brunswick-fixed-its-nursing-shortage/,"<a href=""https://www.ctvnews.ca/video/2026/05/03/ctv-national-news-has-new-brunswick-fixed-its-nursing-shortage/"">Has New Brunswick fixed its nursing shortage?</a>"
6,What to expect from PM Carney’s Armenia trip,https://www.ctvnews.ca/video/2026/05/03/ctv-national-news-what-to-expect-from-pm-carneys-armenia-trip/,"<a href=""https://www.ctvnews.ca/video/2026/05/03/ctv-national-news-what-to-expect-from-pm-carneys-armenia-trip/"">What to expect from PM Carney’s Armenia trip</a>"
7,St. John’s residents protest proposed subdivision developments,https://www.ctvnews.ca/video/2026/05/03/ctv-national-news-st-johns-residents-protest-proposed-subdivision-developments/,"<a href=""https://www.ctvnews.ca/video/2026/05/03/ctv-national-news-st-johns-residents-protest-proposed-subdivision-developments/"">St. John’s residents protest proposed subdivision developments</a>"
8,Toronto planning to increase the number of first responders during FIFA World Cup,https://www.ctvnews.ca/video/2026/05/03/ctv-national-news-toronto-planning-to-increase-the-number-of-first-responders-during-fifa-world-cup/,"<a href=""https://www.ctvnews.ca/video/2026/05/03/ctv-national-news-toronto-planning-to-increase-the-number-of-first-responders-during-fifa-world-cup/"">Toronto planning to increase the number of first responders during FIFA World Cup</a>"
