rank,Article title,url,title_with_link
1,'I have no fear of the Trump administration': Pope Leo says he's not a politician,https://www.ctvnews.ca/video/2026/04/13/i-have-no-fear-of-the-trump-administration-pope-leo-says-hes-not-a-politician/,"<a href=""https://www.ctvnews.ca/video/2026/04/13/i-have-no-fear-of-the-trump-administration-pope-leo-says-hes-not-a-politician/"">'I have no fear of the Trump administration': Pope Leo says he's not a politician</a>"
2,Katy Perry and Justin Trudeau share a moment at Coachella,https://www.ctvnews.ca/video/2026/04/13/katy-perry-and-justin-trudeau-share-a-moment-at-coachella/,"<a href=""https://www.ctvnews.ca/video/2026/04/13/katy-perry-and-justin-trudeau-share-a-moment-at-coachella/"">Katy Perry and Justin Trudeau share a moment at Coachella</a>"
3,'It was horrible': B.C. woman detained by ICE describes harrowing conditions,https://www.ctvnews.ca/video/2026/04/13/it-was-horrible-bc-woman-detained-by-ice-describes-harrowing-conditions/,"<a href=""https://www.ctvnews.ca/video/2026/04/13/it-was-horrible-bc-woman-detained-by-ice-describes-harrowing-conditions/"">'It was horrible': B.C. woman detained by ICE describes harrowing conditions</a>"
4,Man once accused of wife's murder arrested in separate cold case from 1990,https://www.ctvnews.ca/video/2026/04/13/man-once-accused-of-wifes-murder-arrested-in-separate-cold-case-from-1990/,"<a href=""https://www.ctvnews.ca/video/2026/04/13/man-once-accused-of-wifes-murder-arrested-in-separate-cold-case-from-1990/"">Man once accused of wife's murder arrested in separate cold case from 1990</a>"
5,"Home of billionaire OpenAI CEO attacked with gunshots, Molotov cocktail",https://www.ctvnews.ca/video/2026/04/13/home-of-billionaire-openai-ceo-attacked-with-gunshots-molotov-cocktail/,"<a href=""https://www.ctvnews.ca/video/2026/04/13/home-of-billionaire-openai-ceo-attacked-with-gunshots-molotov-cocktail/"">Home of billionaire OpenAI CEO attacked with gunshots, Molotov cocktail</a>"
6,Watch: Sergio Garcia slams his driver in frustration on the tee box at the Masters,https://www.ctvnews.ca/video/2026/04/13/watch-sergio-garcia-slams-his-driver-in-frustration-on-the-tee-box-at-the-masters/,"<a href=""https://www.ctvnews.ca/video/2026/04/13/watch-sergio-garcia-slams-his-driver-in-frustration-on-the-tee-box-at-the-masters/"">Watch: Sergio Garcia slams his driver in frustration on the tee box at the Masters</a>"
7,‘This will be an historic outcome’: Reid on Liberals potentially earning majority government,https://www.ctvnews.ca/video/2026/04/13/this-will-be-an-historic-outcome-reid-on-liberals-potentially-earning-majority-government/,"<a href=""https://www.ctvnews.ca/video/2026/04/13/this-will-be-an-historic-outcome-reid-on-liberals-potentially-earning-majority-government/"">‘This will be an historic outcome’: Reid on Liberals potentially earning majority government</a>"
8,How does baseball's pitch-tracking system work? Here's what we know,https://www.ctvnews.ca/video/2026/04/13/how-does-baseballs-pitch-tracking-system-work-heres-what-we-know/,"<a href=""https://www.ctvnews.ca/video/2026/04/13/how-does-baseballs-pitch-tracking-system-work-heres-what-we-know/"">How does baseball's pitch-tracking system work? Here's what we know</a>"
