rank,Article title,url,title_with_link
1,Daredevil couple arrested after scaling Empire State Building for engagement shoot,https://www.ctvnews.ca/video/2026/07/02/daredevil-couple-arrested-after-scaling-empire-state-building-for-engagement-shoot/,"<a href=""https://www.ctvnews.ca/video/2026/07/02/daredevil-couple-arrested-after-scaling-empire-state-building-for-engagement-shoot/"">Daredevil couple arrested after scaling Empire State Building for engagement shoot</a>"
2,Record rainfall drenches Ottawa as Canada Day revelers warned to 'seek shelter',https://www.ctvnews.ca/ottawa/video/2026/07/02/your-morning-ottawa-update-ottawa-receives-110-mm-of-rain-on-canada-day/,"<a href=""https://www.ctvnews.ca/ottawa/video/2026/07/02/your-morning-ottawa-update-ottawa-receives-110-mm-of-rain-on-canada-day/"">Record rainfall drenches Ottawa as Canada Day revelers warned to 'seek shelter'</a>"
3,"Man delivers Windsor, Ont. pizza to former resident nearly 500km away in show of community support",https://www.ctvnews.ca/windsor/video/2026/06/30/windsor-pizza-delivered-to-sault-ste-marie/,"<a href=""https://www.ctvnews.ca/windsor/video/2026/06/30/windsor-pizza-delivered-to-sault-ste-marie/"">Man delivers Windsor, Ont. pizza to former resident nearly 500km away in show of community support</a>"
4,Man climbs from balcony to nearby window to escape fire at Belgian apartment building,https://www.ctvnews.ca/video/2026/07/01/man-climbs-from-balcony-to-nearby-window-to-escape-fire-at-belgian-apartment-building/,"<a href=""https://www.ctvnews.ca/video/2026/07/01/man-climbs-from-balcony-to-nearby-window-to-escape-fire-at-belgian-apartment-building/"">Man climbs from balcony to nearby window to escape fire at Belgian apartment building</a>"
5,Labrador City under state of emergency as wildfire rages,https://www.ctvnews.ca/video/2026/07/02/ctv-national-news-labrador-city-under-state-of-emergency-as-wildfire-rages/,"<a href=""https://www.ctvnews.ca/video/2026/07/02/ctv-national-news-labrador-city-under-state-of-emergency-as-wildfire-rages/"">Labrador City under state of emergency as wildfire rages</a>"
6,White House defending Trump’s US$2.2B windfall earned during first year back in office,https://www.ctvnews.ca/video/2026/07/02/white-house-defending-trumps-us22b-windfall-earned-during-first-year-back-in-office/,"<a href=""https://www.ctvnews.ca/video/2026/07/02/white-house-defending-trumps-us22b-windfall-earned-during-first-year-back-in-office/"">White House defending Trump’s US$2.2B windfall earned during first year back in office</a>"
7,Cristiano Ronaldo trains in Toronto ahead of World Cup match,https://www.ctvnews.ca/video/2026/07/02/cristiano-ronaldo-trains-in-toronto-ahead-of-world-cup-match/,"<a href=""https://www.ctvnews.ca/video/2026/07/02/cristiano-ronaldo-trains-in-toronto-ahead-of-world-cup-match/"">Cristiano Ronaldo trains in Toronto ahead of World Cup match</a>"
8,Watch PM Carney’s full address at the Canada Day celebration in Ottawa,https://www.ctvnews.ca/video/2026/07/01/watch-pm-carneys-full-address-at-the-canada-day-celebration-in-ottawa/,"<a href=""https://www.ctvnews.ca/video/2026/07/01/watch-pm-carneys-full-address-at-the-canada-day-celebration-in-ottawa/"">Watch PM Carney’s full address at the Canada Day celebration in Ottawa</a>"
