rank,Article title,url,title_with_link
1,Man casually eats salad amid D.C. shooting aftermath chaos,https://www.ctvnews.ca/video/2026/04/27/man-casually-eats-salad-amid-dc-shooting-aftermath-chaos/,"<a href=""https://www.ctvnews.ca/video/2026/04/27/man-casually-eats-salad-amid-dc-shooting-aftermath-chaos/"">Man casually eats salad amid D.C. shooting aftermath chaos</a>"
2,'You're horrible people': Trump snaps at 60 Minutes anchor,https://www.ctvnews.ca/video/2026/04/27/youre-horrible-people-trump-snaps-at-60-minutes-anchor/,"<a href=""https://www.ctvnews.ca/video/2026/04/27/youre-horrible-people-trump-snaps-at-60-minutes-anchor/"">'You're horrible people': Trump snaps at 60 Minutes anchor</a>"
3,Manitoba may have issues enforcing social media and AI chatbot ban for kids,https://www.ctvnews.ca/video/2026/04/27/manitoba-may-have-issues-enforcing-social-media-and-ai-chatbot-ban-for-kids/,"<a href=""https://www.ctvnews.ca/video/2026/04/27/manitoba-may-have-issues-enforcing-social-media-and-ai-chatbot-ban-for-kids/"">Manitoba may have issues enforcing social media and AI chatbot ban for kids</a>"
4,DOJ calls gala shooting an attempt on Trump's life,https://www.ctvnews.ca/video/2026/04/27/ctv-national-news-doj-calls-gala-shooting-an-attempt-on-trumps-life/,"<a href=""https://www.ctvnews.ca/video/2026/04/27/ctv-national-news-doj-calls-gala-shooting-an-attempt-on-trumps-life/"">DOJ calls gala shooting an attempt on Trump's life</a>"
5,‘What we need is for the Liberal government to get out of the way:’ Poilievre,https://www.ctvnews.ca/video/2026/04/27/what-we-need-is-for-the-liberal-government-to-get-out-of-the-way-poilievre/,"<a href=""https://www.ctvnews.ca/video/2026/04/27/what-we-need-is-for-the-liberal-government-to-get-out-of-the-way-poilievre/"">‘What we need is for the Liberal government to get out of the way:’ Poilievre</a>"
6,"King Charles and Queen Camilla arrive in Washington, D.C.",https://www.ctvnews.ca/video/2026/04/27/king-charles-and-queen-camilla-arrive-in-washington-dc/,"<a href=""https://www.ctvnews.ca/video/2026/04/27/king-charles-and-queen-camilla-arrive-in-washington-dc/"">King Charles and Queen Camilla arrive in Washington, D.C.</a>"
7,Families urge Parliament to combat social media harms to kids,https://www.ctvnews.ca/video/2026/04/27/ctv-national-news-families-urge-parliament-to-combat-social-media-harms-to-kids/,"<a href=""https://www.ctvnews.ca/video/2026/04/27/ctv-national-news-families-urge-parliament-to-combat-social-media-harms-to-kids/"">Families urge Parliament to combat social media harms to kids</a>"
8,Canada’s sovereign wealth fund is ‘needed to stimulate investment in Canada’: financial expert,https://www.ctvnews.ca/video/2026/04/27/canadas-sovereign-wealth-fund-is-needed-to-stimulate-investment-in-canada-financial-expert/,"<a href=""https://www.ctvnews.ca/video/2026/04/27/canadas-sovereign-wealth-fund-is-needed-to-stimulate-investment-in-canada-financial-expert/"">Canada’s sovereign wealth fund is ‘needed to stimulate investment in Canada’: financial expert</a>"
