rank,Article title,url,title_with_link
1,Dodgers force Game 7 of the World Series against the Blue Jays,https://www.ctvnews.ca/video/2025/11/01/ctv-national-news-dodgers-force-game-7-of-the-world-series-against-the-blue-jays/,"<a href=""https://www.ctvnews.ca/video/2025/11/01/ctv-national-news-dodgers-force-game-7-of-the-world-series-against-the-blue-jays/"">Dodgers force Game 7 of the World Series against the Blue Jays</a>"
2,"Blue Jays fall 3-1 to Dodgers in Game 6, World Series goes to Game 7",https://www.ctvnews.ca/toronto/video/2025/11/01/blue-jays-fall-3-1-to-dodgers-in-game-6-world-series-goes-to-game-7/,"<a href=""https://www.ctvnews.ca/toronto/video/2025/11/01/blue-jays-fall-3-1-to-dodgers-in-game-6-world-series-goes-to-game-7/"">Blue Jays fall 3-1 to Dodgers in Game 6, World Series goes to Game 7</a>"
3,Fans in Toronto react to Blue Jays' loss in Game 6 of the World Series,https://www.ctvnews.ca/video/2025/11/01/ctv-national-news-fans-in-toronto-react-to-blue-jays-loss-in-game-6-of-the-world-series/,"<a href=""https://www.ctvnews.ca/video/2025/11/01/ctv-national-news-fans-in-toronto-react-to-blue-jays-loss-in-game-6-of-the-world-series/"">Fans in Toronto react to Blue Jays' loss in Game 6 of the World Series</a>"
4,Tips for adjusting to time-switch this Sunday,https://www.ctvnews.ca/vancouver/video/2025/11/01/tips-for-adjusting-to-time-switch-this-sunday/,"<a href=""https://www.ctvnews.ca/vancouver/video/2025/11/01/tips-for-adjusting-to-time-switch-this-sunday/"">Tips for adjusting to time-switch this Sunday</a>"
5,Halloween candy advice for parents,https://www.ctvnews.ca/winnipeg/video/2025/10/31/halloween-candy-advice-for-parents/,"<a href=""https://www.ctvnews.ca/winnipeg/video/2025/10/31/halloween-candy-advice-for-parents/"">Halloween candy advice for parents</a>"
6,"Canada-U.S. trade talks still off following PM’s apology, according to Trump",https://www.ctvnews.ca/video/2025/10/31/ctv-national-news-canada-us-trade-talks-still-off-following-pms-apology-according-to-trump/,"<a href=""https://www.ctvnews.ca/video/2025/10/31/ctv-national-news-canada-us-trade-talks-still-off-following-pms-apology-according-to-trump/"">Canada-U.S. trade talks still off following PM’s apology, according to Trump</a>"
7,Canada-China relationship at a ‘turning point’: PM Carney,https://www.ctvnews.ca/video/2025/10/31/ctv-national-news-canada-china-relationship-at-a-turning-point-pm-carney/,"<a href=""https://www.ctvnews.ca/video/2025/10/31/ctv-national-news-canada-china-relationship-at-a-turning-point-pm-carney/"">Canada-China relationship at a ‘turning point’: PM Carney</a>"
8,Parts of Atlantic Canada postpone trick-or-treating due to weather,https://www.ctvnews.ca/video/2025/11/01/ctv-national-news-parts-of-atlantic-canada-postpone-trick-or-treating-due-to-weather/,"<a href=""https://www.ctvnews.ca/video/2025/11/01/ctv-national-news-parts-of-atlantic-canada-postpone-trick-or-treating-due-to-weather/"">Parts of Atlantic Canada postpone trick-or-treating due to weather</a>"
