rank,Article title,url,title_with_link
1,Yankees fans boo 'Oh Canada' ahead of Game 3 of the ALDS,https://www.ctvnews.ca/video/2025/10/08/yankees-fans-boo-oh-canada-ahead-of-game-3-of-the-alds/,"<a href=""https://www.ctvnews.ca/video/2025/10/08/yankees-fans-boo-oh-canada-ahead-of-game-3-of-the-alds/"">Yankees fans boo 'Oh Canada' ahead of Game 3 of the ALDS</a>"
2,Mulcair suggests Canada ‘held back’ on announcing anything post meeting with Trump,https://www.ctvnews.ca/video/2025/10/07/mulcair-suggests-canada-held-back-on-announcing-anything-post-meeting-with-trump/,"<a href=""https://www.ctvnews.ca/video/2025/10/07/mulcair-suggests-canada-held-back-on-announcing-anything-post-meeting-with-trump/"">Mulcair suggests Canada ‘held back’ on announcing anything post meeting with Trump</a>"
3,‘It makes me very concerned’: UNIFOR President Lana Payne on PM Carney’s meeting with Trump,https://www.ctvnews.ca/video/2025/10/08/it-makes-me-very-concerned-unifor-president-lana-payne-on-pm-carneys-meeting-with-trump/,"<a href=""https://www.ctvnews.ca/video/2025/10/08/it-makes-me-very-concerned-unifor-president-lana-payne-on-pm-carneys-meeting-with-trump/"">‘It makes me very concerned’: UNIFOR President Lana Payne on PM Carney’s meeting with Trump</a>"
4,Alberta Premier Danielle Smith facing pushback over proposed pipeline creation,https://www.ctvnews.ca/video/2025/10/07/ctv-national-news-premier-smith-facing-pushback-over-proposed-pipeline-creation/,"<a href=""https://www.ctvnews.ca/video/2025/10/07/ctv-national-news-premier-smith-facing-pushback-over-proposed-pipeline-creation/"">Alberta Premier Danielle Smith facing pushback over proposed pipeline creation</a>"
5,Ontario Premier Ford says he won't change his position on removing automated speed cameras,https://www.ctvnews.ca/toronto/video/2025/10/07/premier-ford-says-he-wont-change-his-position-on-removing-automated-speed-cameras/,"<a href=""https://www.ctvnews.ca/toronto/video/2025/10/07/premier-ford-says-he-wont-change-his-position-on-removing-automated-speed-cameras/"">Ontario Premier Ford says he won't change his position on removing automated speed cameras</a>"
6,Why Trump has deployed the National Guard from Texas to Chicago,https://www.ctvnews.ca/video/2025/10/07/ctv-national-news-why-trump-has-deployed-the-national-guard-from-texas-to-chicago/,"<a href=""https://www.ctvnews.ca/video/2025/10/07/ctv-national-news-why-trump-has-deployed-the-national-guard-from-texas-to-chicago/"">Why Trump has deployed the National Guard from Texas to Chicago</a>"
7,Alberta finance minister says it's too soon for government to end teacher strike,https://www.ctvnews.ca/edmonton/video/2025/10/07/alberta-minister-says-its-too-soon-for-government-to-end-teacher-strike/,"<a href=""https://www.ctvnews.ca/edmonton/video/2025/10/07/alberta-minister-says-its-too-soon-for-government-to-end-teacher-strike/"">Alberta finance minister says it's too soon for government to end teacher strike</a>"
8,Two Canadian families reflect on life since Oct. 7 attack,https://www.ctvnews.ca/video/2025/10/07/ctv-national-news-two-canadian-families-reflect-on-life-since-oct-7-attack/,"<a href=""https://www.ctvnews.ca/video/2025/10/07/ctv-national-news-two-canadian-families-reflect-on-life-since-oct-7-attack/"">Two Canadian families reflect on life since Oct. 7 attack</a>"
