rank,Article title,url,title_with_link
1,"LIVE NOW: After record-setting distance, Jeremy Hansen and Artemis II crew heading back to Earth",https://www.ctvnews.ca/video/live/2026/04/06/live-artemis-ii-begins-journey-back-to-earth-after-lunar-flyby/,"<a href=""https://www.ctvnews.ca/video/live/2026/04/06/live-artemis-ii-begins-journey-back-to-earth-after-lunar-flyby/"">LIVE NOW: After record-setting distance, Jeremy Hansen and Artemis II crew heading back to Earth</a>"
2,PM Carney asked why gas prices are going up if Canada has its own oil,https://www.ctvnews.ca/video/2026/04/07/pm-carney-asked-why-gas-prices-are-going-up-if-canada-has-its-own-oil/,"<a href=""https://www.ctvnews.ca/video/2026/04/07/pm-carney-asked-why-gas-prices-are-going-up-if-canada-has-its-own-oil/"">PM Carney asked why gas prices are going up if Canada has its own oil</a>"
3,Liberals eye majority as three key byelections near,https://www.ctvnews.ca/video/2026/04/07/ctv-national-news-liberals-eye-majority-as-three-key-byelections-near/,"<a href=""https://www.ctvnews.ca/video/2026/04/07/ctv-national-news-liberals-eye-majority-as-three-key-byelections-near/"">Liberals eye majority as three key byelections near</a>"
4,Senior Canadian commander in Latvia ‘temporarily’ removed from post,https://www.ctvnews.ca/video/2026/04/07/senior-canadian-commander-in-latvia-temporarily-removed-from-post/,"<a href=""https://www.ctvnews.ca/video/2026/04/07/senior-canadian-commander-in-latvia-temporarily-removed-from-post/"">Senior Canadian commander in Latvia ‘temporarily’ removed from post</a>"
5,Human rights expert calls Trump’s Iran post ‘legally indefensible’,https://www.ctvnews.ca/video/2026/04/07/human-rights-expert-calls-trumps-iran-post-legally-indefensible/,"<a href=""https://www.ctvnews.ca/video/2026/04/07/human-rights-expert-calls-trumps-iran-post-legally-indefensible/"">Human rights expert calls Trump’s Iran post ‘legally indefensible’</a>"
6,Thief steals high-end hockey sticks from Quebec sports store,https://www.ctvnews.ca/montreal/video/2026/04/07/thief-steals-high-end-hockey-sticks-from-quebec-sports-store/,"<a href=""https://www.ctvnews.ca/montreal/video/2026/04/07/thief-steals-high-end-hockey-sticks-from-quebec-sports-store/"">Thief steals high-end hockey sticks from Quebec sports store</a>"
7,A Canadian chef just won the 'Super Bowl of pizza',https://www.ctvnews.ca/toronto/video/2026/04/07/a-canadian-chef-just-won-the-super-bowl-of-pizza/,"<a href=""https://www.ctvnews.ca/toronto/video/2026/04/07/a-canadian-chef-just-won-the-super-bowl-of-pizza/"">A Canadian chef just won the 'Super Bowl of pizza'</a>"
8,Stunning new images reveal fresh details of the far side of the Moon,https://www.ctvnews.ca/video/2026/04/07/ctv-national-news-stunning-new-images-reveal-fresh-details-of-the-far-side-of-the-moon/,"<a href=""https://www.ctvnews.ca/video/2026/04/07/ctv-national-news-stunning-new-images-reveal-fresh-details-of-the-far-side-of-the-moon/"">Stunning new images reveal fresh details of the far side of the Moon</a>"
