rank,Article title,url,title_with_link
1,Canada’s men’s hockey going for gold after tense match against Finland,https://www.ctvnews.ca/video/2026/02/21/canadas-mens-hockey-going-for-gold-after-tense-match-against-finland/,"<a href=""https://www.ctvnews.ca/video/2026/02/21/canadas-mens-hockey-going-for-gold-after-tense-match-against-finland/"">Canada’s men’s hockey going for gold after tense match against Finland</a>"
2,‘Ambiguous and unstable time ahead’ after Trump’s tariff announcement: former Canada-U.S. advisor,https://www.ctvnews.ca/video/2026/02/21/ambiguous-and-unstable-time-ahead-after-trumps-tariff-announcement-former-canada-us-advisor/,"<a href=""https://www.ctvnews.ca/video/2026/02/21/ambiguous-and-unstable-time-ahead-after-trumps-tariff-announcement-former-canada-us-advisor/"">‘Ambiguous and unstable time ahead’ after Trump’s tariff announcement: former Canada-U.S. advisor</a>"
3,‘It's disrespectful to call members of the Supreme Court fools’: former judge reacts to Trump,https://www.ctvnews.ca/video/2026/02/21/its-disrespectful-to-call-members-of-the-supreme-court-fools-former-judge-reacts-to-trump/,"<a href=""https://www.ctvnews.ca/video/2026/02/21/its-disrespectful-to-call-members-of-the-supreme-court-fools-former-judge-reacts-to-trump/"">‘It's disrespectful to call members of the Supreme Court fools’: former judge reacts to Trump</a>"
4,How the markets reacted to the tariff ruling,https://www.ctvnews.ca/video/2026/02/20/ctv-national-news-how-the-markets-reacted-to-the-tariff-ruling/,"<a href=""https://www.ctvnews.ca/video/2026/02/20/ctv-national-news-how-the-markets-reacted-to-the-tariff-ruling/"">How the markets reacted to the tariff ruling</a>"
5,70-year-old man facing first-degree murder charges after stabbing outside Ottawa mall,https://www.ctvnews.ca/ottawa/video/2026/02/20/man-70-facing-charges-for-fatal-rideau-street-stabbing/,"<a href=""https://www.ctvnews.ca/ottawa/video/2026/02/20/man-70-facing-charges-for-fatal-rideau-street-stabbing/"">70-year-old man facing first-degree murder charges after stabbing outside Ottawa mall</a>"
6,Watch a dog Italian authorities say has been trained to illegally dump bags of garbage,https://www.ctvnews.ca/video/2026/02/20/watch-a-dog-italian-authorities-say-has-been-trained-to-illegally-dump-bags-of-garbage/,"<a href=""https://www.ctvnews.ca/video/2026/02/20/watch-a-dog-italian-authorities-say-has-been-trained-to-illegally-dump-bags-of-garbage/"">Watch a dog Italian authorities say has been trained to illegally dump bags of garbage</a>"
7,Ontario family frustrated after their recycling hasn’t been picked up for months,https://www.ctvnews.ca/barrie/video/2026/02/20/simcoe-county-family-waiting-for-recycling-pick-up-for-two-months/,"<a href=""https://www.ctvnews.ca/barrie/video/2026/02/20/simcoe-county-family-waiting-for-recycling-pick-up-for-two-months/"">Ontario family frustrated after their recycling hasn’t been picked up for months</a>"
8,Smith says critics who accuse immigration referendum of being ‘Nazi tactics’ are ‘just disgusting',https://www.ctvnews.ca/video/2026/02/20/smith-says-critics-who-accuse-immigration-referendum-of-being-nazi-tactics-are-just-disgusting/,"<a href=""https://www.ctvnews.ca/video/2026/02/20/smith-says-critics-who-accuse-immigration-referendum-of-being-nazi-tactics-are-just-disgusting/"">Smith says critics who accuse immigration referendum of being ‘Nazi tactics’ are ‘just disgusting'</a>"
