rank,Article title,url,title_with_link
1,Canada-U.S. trade minister on where negotiations with the U.S. stand,https://www.ctvnews.ca/video/2026/04/21/canada-us-trade-minister-on-where-negotiations-with-the-us-stand/,"<a href=""https://www.ctvnews.ca/video/2026/04/21/canada-us-trade-minister-on-where-negotiations-with-the-us-stand/"">Canada-U.S. trade minister on where negotiations with the U.S. stand</a>"
2,Trump extends ceasefire with Iran until 'unified proposal' is submitted,https://www.ctvnews.ca/video/2026/04/21/trump-extends-ceasefire-with-iran-until-unified-proposal-is-submitted/,"<a href=""https://www.ctvnews.ca/video/2026/04/21/trump-extends-ceasefire-with-iran-until-unified-proposal-is-submitted/"">Trump extends ceasefire with Iran until 'unified proposal' is submitted</a>"
3,Mass shooting at Teotihuacan pyramids was a planned attack: Mexican authorities,https://www.ctvnews.ca/video/2026/04/21/ctv-national-news-mass-shooting-at-teotihuacan-pyramids-was-a-planned-attack-mexican-authorities/,"<a href=""https://www.ctvnews.ca/video/2026/04/21/ctv-national-news-mass-shooting-at-teotihuacan-pyramids-was-a-planned-attack-mexican-authorities/"">Mass shooting at Teotihuacan pyramids was a planned attack: Mexican authorities</a>"
4,Goodale warns of ‘deadly serious’ stakes in Canada-U.S. trade talks,https://www.ctvnews.ca/video/2026/04/21/goodale-warns-of-deadly-serious-stakes-in-canada-us-trade-talks/,"<a href=""https://www.ctvnews.ca/video/2026/04/21/goodale-warns-of-deadly-serious-stakes-in-canada-us-trade-talks/"">Goodale warns of ‘deadly serious’ stakes in Canada-U.S. trade talks</a>"
5,Thousands of firefighters gather in B.C. for training ahead of wildfire season,https://www.ctvnews.ca/video/2026/04/21/ctv-national-news-hundreds-of-firefighters-gather-in-bc-for-training-ahead-of-wildfire-season/,"<a href=""https://www.ctvnews.ca/video/2026/04/21/ctv-national-news-hundreds-of-firefighters-gather-in-bc-for-training-ahead-of-wildfire-season/"">Thousands of firefighters gather in B.C. for training ahead of wildfire season</a>"
6,Watch the moment floodwaters rush into elementary school classroom,https://www.ctvnews.ca/video/2026/04/21/watch-the-moment-floodwaters-rush-into-elementary-school-classroom/,"<a href=""https://www.ctvnews.ca/video/2026/04/21/watch-the-moment-floodwaters-rush-into-elementary-school-classroom/"">Watch the moment floodwaters rush into elementary school classroom</a>"
7,"Interest in electric vehicles is on the rise, but are more actually being sold?",https://www.ctvnews.ca/kitchener/video/2026/04/21/interest-in-electric-vehicles-on-the-rise-but-does-it-mean-more-are-being-sold/,"<a href=""https://www.ctvnews.ca/kitchener/video/2026/04/21/interest-in-electric-vehicles-on-the-rise-but-does-it-mean-more-are-being-sold/"">Interest in electric vehicles is on the rise, but are more actually being sold?</a>"
8,Ontario woman surprises her husband by also qualifying for the Boston Marathon,https://www.ctvnews.ca/windsor/video/2026/04/21/windsor-wife-surprises-husband-with-dual-boston-marathon-qualifications/,"<a href=""https://www.ctvnews.ca/windsor/video/2026/04/21/windsor-wife-surprises-husband-with-dual-boston-marathon-qualifications/"">Ontario woman surprises her husband by also qualifying for the Boston Marathon</a>"
