rank,Article title,url,title_with_link
1,"B.C. pulp mill to shutter, leaving 350 out of work",https://www.ctvnews.ca/vancouver/video/2025/12/03/bc-pulp-mill-to-shutter-leaving-350-out-of-work/,"<a href=""https://www.ctvnews.ca/vancouver/video/2025/12/03/bc-pulp-mill-to-shutter-leaving-350-out-of-work/"">B.C. pulp mill to shutter, leaving 350 out of work</a>"
2,Major drug busts in Canada reveal most illegal drugs aren’t destined for U.S.,https://www.ctvnews.ca/video/2025/12/02/ctv-national-news-major-drug-busts-in-canada-reveal-most-illegal-drugs-arent-destined-for-us/,"<a href=""https://www.ctvnews.ca/video/2025/12/02/ctv-national-news-major-drug-busts-in-canada-reveal-most-illegal-drugs-arent-destined-for-us/"">Major drug busts in Canada reveal most illegal drugs aren’t destined for U.S.</a>"
3,A Vancouver family’s tragic warning on the dangers of illegal drugs,https://www.ctvnews.ca/video/2025/12/02/ctv-national-news-a-vancouver-familys-tragic-warning-on-the-dangers-of-illegal-drugs/,"<a href=""https://www.ctvnews.ca/video/2025/12/02/ctv-national-news-a-vancouver-familys-tragic-warning-on-the-dangers-of-illegal-drugs/"">A Vancouver family’s tragic warning on the dangers of illegal drugs</a>"
4,PM Carney meets with Indigenous leaders in Ottawa for AFN,https://www.ctvnews.ca/video/2025/12/02/ctv-national-news-pm-carney-meets-with-indigenous-leaders-in-ottawa-for-afn/,"<a href=""https://www.ctvnews.ca/video/2025/12/02/ctv-national-news-pm-carney-meets-with-indigenous-leaders-in-ottawa-for-afn/"">PM Carney meets with Indigenous leaders in Ottawa for AFN</a>"
5,Algoma Steel layoffs leave Ontario community shake,https://www.ctvnews.ca/video/2025/12/02/ctv-national-news-algoma-steel-layoffs-leave-ontario-community-shaken/,"<a href=""https://www.ctvnews.ca/video/2025/12/02/ctv-national-news-algoma-steel-layoffs-leave-ontario-community-shaken/"">Algoma Steel layoffs leave Ontario community shake</a>"
6,MOU a point of contention as Indigenous leaders meet in Ottawa,https://www.ctvnews.ca/video/2025/12/02/ctv-national-news-mou-a-point-of-contention-as-indigenous-leaders-meet-in-ottawa/,"<a href=""https://www.ctvnews.ca/video/2025/12/02/ctv-national-news-mou-a-point-of-contention-as-indigenous-leaders-meet-in-ottawa/"">MOU a point of contention as Indigenous leaders meet in Ottawa</a>"
7,PM Carney outlines major projects strategy with First Nations help,https://www.ctvnews.ca/video/2025/12/02/pm-carney-outlines-major-projects-strategy-with-first-nations-help/,"<a href=""https://www.ctvnews.ca/video/2025/12/02/pm-carney-outlines-major-projects-strategy-with-first-nations-help/"">PM Carney outlines major projects strategy with First Nations help</a>"
8,Putin threatens war against Europe ahead of Ukraine peace meeting,https://www.ctvnews.ca/video/2025/12/03/ctv-national-news-putin-threatens-war-against-europe-ahead-of-ukraine-peace-meeting/,"<a href=""https://www.ctvnews.ca/video/2025/12/03/ctv-national-news-putin-threatens-war-against-europe-ahead-of-ukraine-peace-meeting/"">Putin threatens war against Europe ahead of Ukraine peace meeting</a>"
