rank,Article title,url,title_with_link
1,What led police to the four military members accused of terror plot?,https://www.ctvnews.ca/video/2025/08/22/ctv-national-news-what-led-police-to-the-four-military-members-accused-of-terror-plot/,"<a href=""https://www.ctvnews.ca/video/2025/08/22/ctv-national-news-what-led-police-to-the-four-military-members-accused-of-terror-plot/"">What led police to the four military members accused of terror plot?</a>"
2,‘We should be angry’: WHO spokesperson on report confirming famine in Gaza,https://www.ctvnews.ca/video/2025/08/22/we-should-be-angry-who-spokesperson-on-report-confirming-famine-in-gaza/,"<a href=""https://www.ctvnews.ca/video/2025/08/22/we-should-be-angry-who-spokesperson-on-report-confirming-famine-in-gaza/"">‘We should be angry’: WHO spokesperson on report confirming famine in Gaza</a>"
3,Mother shocked by daughter's last messages with ChatGPT,https://www.ctvnews.ca/video/2025/08/22/ctv-national-news-mother-shocked-by-daughters-last-messages-with-chatgpt/,"<a href=""https://www.ctvnews.ca/video/2025/08/22/ctv-national-news-mother-shocked-by-daughters-last-messages-with-chatgpt/"">Mother shocked by daughter's last messages with ChatGPT</a>"
4,Parents say pharmacy mix up caused 10-year-old to overdose on her medication,https://www.ctvnews.ca/winnipeg/video/2025/08/21/medication-mess-causes-child-to-overdose/,"<a href=""https://www.ctvnews.ca/winnipeg/video/2025/08/21/medication-mess-causes-child-to-overdose/"">Parents say pharmacy mix up caused 10-year-old to overdose on her medication</a>"
5,Man charged with assault after attacking group of anti-Trump protesters,https://www.ctvnews.ca/video/2025/08/22/man-charged-with-assault-after-attacking-group-of-anti-trump-protesters/,"<a href=""https://www.ctvnews.ca/video/2025/08/22/man-charged-with-assault-after-attacking-group-of-anti-trump-protesters/"">Man charged with assault after attacking group of anti-Trump protesters</a>"
6,Carney reignites stalled Canada-U.S. trade talks by initiating meeting with Trump,https://www.ctvnews.ca/video/2025/08/22/ctv-national-news-carney-reignites-stalled-canada-us-trade-talks-by-initiating-meeting-with-trump/,"<a href=""https://www.ctvnews.ca/video/2025/08/22/ctv-national-news-carney-reignites-stalled-canada-us-trade-talks-by-initiating-meeting-with-trump/"">Carney reignites stalled Canada-U.S. trade talks by initiating meeting with Trump</a>"
7,Teen football player dies after suffering medical emergency during practice,https://www.ctvnews.ca/video/2025/08/22/teen-football-player-dies-after-suffering-medical-emergency-during-practice/,"<a href=""https://www.ctvnews.ca/video/2025/08/22/teen-football-player-dies-after-suffering-medical-emergency-during-practice/"">Teen football player dies after suffering medical emergency during practice</a>"
8,Australian postal worker goes viral for rescuing home’s laundry from the rain,https://www.ctvnews.ca/video/2025/08/22/australian-postal-worker-goes-viral-for-rescuing-homes-laundry-from-the-rain/,"<a href=""https://www.ctvnews.ca/video/2025/08/22/australian-postal-worker-goes-viral-for-rescuing-homes-laundry-from-the-rain/"">Australian postal worker goes viral for rescuing home’s laundry from the rain</a>"
