rank,Article title,url,title_with_link
1,CTV National News: Quebec cuts energy transition project Northvolt two years after initial approval,https://www.ctvnews.ca/video/2025/09/03/ctv-national-news-quebec-cuts-energy-transition-project-northvolt-two-years-after-initial-approval/,"<a href=""https://www.ctvnews.ca/video/2025/09/03/ctv-national-news-quebec-cuts-energy-transition-project-northvolt-two-years-after-initial-approval/"">CTV National News: Quebec cuts energy transition project Northvolt two years after initial approval</a>"
2,"CTV National News: Canada’s counter tariffs under CUSMA ends, Trump says tariffs to continue",https://www.ctvnews.ca/video/2025/09/03/ctv-national-news-canadas-counter-tariffs-under-cusma-ends-trump-says-tariffs-to-continue/,"<a href=""https://www.ctvnews.ca/video/2025/09/03/ctv-national-news-canadas-counter-tariffs-under-cusma-ends-trump-says-tariffs-to-continue/"">CTV National News: Canada’s counter tariffs under CUSMA ends, Trump says tariffs to continue</a>"
3,CTV National News: Trump continues sending U.S. federal troops into cities,https://www.ctvnews.ca/video/2025/09/03/ctv-national-news-trump-continues-sending-us-federal-troops-into-cities/,"<a href=""https://www.ctvnews.ca/video/2025/09/03/ctv-national-news-trump-continues-sending-us-federal-troops-into-cities/"">CTV National News: Trump continues sending U.S. federal troops into cities</a>"
4,CTV National News: World leaders attend China’s military parade in Tiananmen Square,https://www.ctvnews.ca/video/2025/09/03/ctv-national-news-world-leaders-attend-chinas-military-parade-in-tiananmen-square/,"<a href=""https://www.ctvnews.ca/video/2025/09/03/ctv-national-news-world-leaders-attend-chinas-military-parade-in-tiananmen-square/"">CTV National News: World leaders attend China’s military parade in Tiananmen Square</a>"
5,"CTV National News: Death toll in Afghanistan surpasses 1,400 after earthquake",https://www.ctvnews.ca/video/2025/09/03/ctv-national-news-death-toll-in-afghanistan-surpasses-1400-after-earthquake/,"<a href=""https://www.ctvnews.ca/video/2025/09/03/ctv-national-news-death-toll-in-afghanistan-surpasses-1400-after-earthquake/"">CTV National News: Death toll in Afghanistan surpasses 1,400 after earthquake</a>"
6,CTV National News: Holland College downsizes programs after international student cap,https://www.ctvnews.ca/video/2025/09/03/ctv-national-news-holland-college-downsizes-programs-after-international-student-cap/,"<a href=""https://www.ctvnews.ca/video/2025/09/03/ctv-national-news-holland-college-downsizes-programs-after-international-student-cap/"">CTV National News: Holland College downsizes programs after international student cap</a>"
7,CTV National News: New report finds mental health problems escalating in students,https://www.ctvnews.ca/video/2025/09/03/ctv-national-news-new-report-finds-mental-health-problems-escalating-in-students/,"<a href=""https://www.ctvnews.ca/video/2025/09/03/ctv-national-news-new-report-finds-mental-health-problems-escalating-in-students/"">CTV National News: New report finds mental health problems escalating in students</a>"
8,CTV National News: Alberta’s proposed book ban put on pause after massive backlash,https://www.ctvnews.ca/video/2025/09/03/ctv-national-news-albertas-proposed-book-ban-put-on-pause-after-massive-backlash/,"<a href=""https://www.ctvnews.ca/video/2025/09/03/ctv-national-news-albertas-proposed-book-ban-put-on-pause-after-massive-backlash/"">CTV National News: Alberta’s proposed book ban put on pause after massive backlash</a>"
