rank,Article title,url,title_with_link
1,Protesters shout as hockey players arrive at court for a judge’s verdict,https://www.ctvnews.ca/video/2025/07/24/protesters-shout-as-hockey-players-arrive-at-court-for-a-judges-verdict/,"<a href=""https://www.ctvnews.ca/video/2025/07/24/protesters-shout-as-hockey-players-arrive-at-court-for-a-judges-verdict/"">Protesters shout as hockey players arrive at court for a judge’s verdict</a>"
2,"LIVE: Outside a London, Ontario court as judge set to decide verdict in sexual assault trial",https://www.ctvnews.ca/video/live/2025/07/22/live-outside-a-london-ontario-court-as-judge-set-to-decide-verdict-in-sexual-assault-trial/,"<a href=""https://www.ctvnews.ca/video/live/2025/07/22/live-outside-a-london-ontario-court-as-judge-set-to-decide-verdict-in-sexual-assault-trial/"">LIVE: Outside a London, Ontario court as judge set to decide verdict in sexual assault trial</a>"
3,Breaking down definition of consent in hockey players’ sexual assault trial,https://www.ctvnews.ca/video/2025/07/24/breaking-down-definition-of-consent-in-hockey-players-sexual-assault-trial/,"<a href=""https://www.ctvnews.ca/video/2025/07/24/breaking-down-definition-of-consent-in-hockey-players-sexual-assault-trial/"">Breaking down definition of consent in hockey players’ sexual assault trial</a>"
4,"Ohio officers ‘ambushed’ as they ate lunch in patrol vehicles, two in critical condition",https://www.ctvnews.ca/video/2025/07/24/ohio-officers-ambushed-as-they-ate-lunch-in-patrol-vehicles-two-in-critical-condition/,"<a href=""https://www.ctvnews.ca/video/2025/07/24/ohio-officers-ambushed-as-they-ate-lunch-in-patrol-vehicles-two-in-critical-condition/"">Ohio officers ‘ambushed’ as they ate lunch in patrol vehicles, two in critical condition</a>"
5,Ghislaine Maxwell expected to speak with DOJ on Epstein’s international sex ring,https://www.ctvnews.ca/video/2025/07/24/ghislaine-maxwell-expected-to-speak-with-doj-on-epsteins-international-sex-ring/,"<a href=""https://www.ctvnews.ca/video/2025/07/24/ghislaine-maxwell-expected-to-speak-with-doj-on-epsteins-international-sex-ring/"">Ghislaine Maxwell expected to speak with DOJ on Epstein’s international sex ring</a>"
6,Quebec man detained by U.S. Coast Guard while fishing in lake,https://www.ctvnews.ca/montreal/video/2025/07/23/quebec-man-detained-by-us-coast-guard-while-fishing-in-lake/,"<a href=""https://www.ctvnews.ca/montreal/video/2025/07/23/quebec-man-detained-by-us-coast-guard-while-fishing-in-lake/"">Quebec man detained by U.S. Coast Guard while fishing in lake</a>"
7,"Air quality, heat warnings and special weather statements across Canada",https://www.ctvnews.ca/video/2025/07/24/air-quality-heat-warnings-and-special-weather-statements-across-canada/,"<a href=""https://www.ctvnews.ca/video/2025/07/24/air-quality-heat-warnings-and-special-weather-statements-across-canada/"">Air quality, heat warnings and special weather statements across Canada</a>"
8,"Passenger plane carrying 49 people crashes in eastern Russia, no survivors expected",https://www.ctvnews.ca/video/2025/07/24/passenger-plane-carrying-49-people-crashes-in-eastern-russia-no-survivors-expected/,"<a href=""https://www.ctvnews.ca/video/2025/07/24/passenger-plane-carrying-49-people-crashes-in-eastern-russia-no-survivors-expected/"">Passenger plane carrying 49 people crashes in eastern Russia, no survivors expected</a>"
