rank,Article title,url,title_with_link
1,Buffalo Sabres fans sing 'O Canada' after singer's mic cuts out,https://www.ctvnews.ca/video/2026/04/29/buffalo-sabres-fans-sing-o-canada-after-singers-mic-cuts-out/,"<a href=""https://www.ctvnews.ca/video/2026/04/29/buffalo-sabres-fans-sing-o-canada-after-singers-mic-cuts-out/"">Buffalo Sabres fans sing 'O Canada' after singer's mic cuts out</a>"
2,Aerial view of Toronto Humber Yacht Club fire that destroyed building,https://www.ctvnews.ca/toronto/video/2026/04/29/aerial-view-of-toronto-humber-yacht-club-fire-that-destroyed-building/,"<a href=""https://www.ctvnews.ca/toronto/video/2026/04/29/aerial-view-of-toronto-humber-yacht-club-fire-that-destroyed-building/"">Aerial view of Toronto Humber Yacht Club fire that destroyed building</a>"
3,28-year-old arrested after 3D printed guns and components seized: police,https://www.ctvnews.ca/toronto/video/2026/04/29/28-year-old-arrested-after-3d-printed-guns-and-components-seized-police/,"<a href=""https://www.ctvnews.ca/toronto/video/2026/04/29/28-year-old-arrested-after-3d-printed-guns-and-components-seized-police/"">28-year-old arrested after 3D printed guns and components seized: police</a>"
4,Giant baseball-sized hail smashes windshield in Missouri,https://www.ctvnews.ca/toronto/video/2026/04/29/giant-baseball-sized-hail-smashes-windshield-in-missouri/,"<a href=""https://www.ctvnews.ca/toronto/video/2026/04/29/giant-baseball-sized-hail-smashes-windshield-in-missouri/"">Giant baseball-sized hail smashes windshield in Missouri</a>"
5,"Ontario woman outraged after being billed more than $1,700 in 407 toll rate charges",https://www.ctvnews.ca/toronto/video/2026/04/28/concerns-over-cost-of-bills-from-highway-407/,"<a href=""https://www.ctvnews.ca/toronto/video/2026/04/28/concerns-over-cost-of-bills-from-highway-407/"">Ontario woman outraged after being billed more than $1,700 in 407 toll rate charges</a>"
6,"Hot air balloon crashes into casino, power line after unexpected launch",https://www.ctvnews.ca/video/2026/04/28/hot-air-balloon-crashes-into-casino-power-line-after-unexpected-launch/,"<a href=""https://www.ctvnews.ca/video/2026/04/28/hot-air-balloon-crashes-into-casino-power-line-after-unexpected-launch/"">Hot air balloon crashes into casino, power line after unexpected launch</a>"
7,Watch the moment a vehicle narrowly escaped collapse of historic building,https://www.ctvnews.ca/video/2026/04/28/watch-the-moment-a-vehicle-narrowly-escaped-collapse-of-historic-building/,"<a href=""https://www.ctvnews.ca/video/2026/04/28/watch-the-moment-a-vehicle-narrowly-escaped-collapse-of-historic-building/"">Watch the moment a vehicle narrowly escaped collapse of historic building</a>"
8,"‘My mother had a crush on Charles,’ Trump says during welcome ceremony for Royals",https://www.ctvnews.ca/video/2026/04/28/my-mother-had-a-crush-on-charles-trump-says-while-hosting-royals/,"<a href=""https://www.ctvnews.ca/video/2026/04/28/my-mother-had-a-crush-on-charles-trump-says-while-hosting-royals/"">‘My mother had a crush on Charles,’ Trump says during welcome ceremony for Royals</a>"
