rank,Article title,url,title_with_link
1,Quebec Superior Court releases Daniel Jolivet on bail after 33 years in prison,https://www.ctvnews.ca/video/2025/12/19/ctv-national-news-quebec-superior-court-releases-daniel-jolivet-on-bail-after-33-years-in-prison/,"<a href=""https://www.ctvnews.ca/video/2025/12/19/ctv-national-news-quebec-superior-court-releases-daniel-jolivet-on-bail-after-33-years-in-prison/"">Quebec Superior Court releases Daniel Jolivet on bail after 33 years in prison</a>"
2,'DOJ is in fact in the process of releasing them': Ham updates the release of all the Epstein files,https://www.ctvnews.ca/video/2025/12/19/doj-is-in-fact-in-the-process-of-releasing-them-ham-updates-the-release-of-all-the-epstein-files/,"<a href=""https://www.ctvnews.ca/video/2025/12/19/doj-is-in-fact-in-the-process-of-releasing-them-ham-updates-the-release-of-all-the-epstein-files/"">'DOJ is in fact in the process of releasing them': Ham updates the release of all the Epstein files</a>"
3,New ‘Avatar’ movie has familiar storytelling and dialogue: film critic,https://www.ctvnews.ca/video/2025/12/19/new-avatar-movie-has-familiar-storytelling-and-dialogue-film-critic/,"<a href=""https://www.ctvnews.ca/video/2025/12/19/new-avatar-movie-has-familiar-storytelling-and-dialogue-film-critic/"">New ‘Avatar’ movie has familiar storytelling and dialogue: film critic</a>"
4,"Welland, Ont., remains under a shelter-in-place order after an officer was shot",https://www.ctvnews.ca/video/2025/12/19/welland-ont-remains-under-a-shelter-in-place-order-after-an-officer-was-shot/,"<a href=""https://www.ctvnews.ca/video/2025/12/19/welland-ont-remains-under-a-shelter-in-place-order-after-an-officer-was-shot/"">Welland, Ont., remains under a shelter-in-place order after an officer was shot</a>"
5,RCMP charge Toronto resident with terrorism-related offences,https://www.ctvnews.ca/video/2025/12/19/rcmp-charge-toronto-resident-with-terrorism-related-offences/,"<a href=""https://www.ctvnews.ca/video/2025/12/19/rcmp-charge-toronto-resident-with-terrorism-related-offences/"">RCMP charge Toronto resident with terrorism-related offences</a>"
6,"‘Disappointed, nervous’: Epstein survivor on U.S. DOJ not meeting deadline to release files",https://www.ctvnews.ca/video/2025/12/19/disappointed-nervous-epstein-survivor-on-us-doj-not-meeting-deadline-to-release-files/,"<a href=""https://www.ctvnews.ca/video/2025/12/19/disappointed-nervous-epstein-survivor-on-us-doj-not-meeting-deadline-to-release-files/"">‘Disappointed, nervous’: Epstein survivor on U.S. DOJ not meeting deadline to release files</a>"
7,"Wrapping up a year in Canadian politics: a federal election, trade war, and more",https://www.ctvnews.ca/video/2025/12/19/wrapping-up-a-year-in-canadian-politics-a-federal-election-trade-war-and-more/,"<a href=""https://www.ctvnews.ca/video/2025/12/19/wrapping-up-a-year-in-canadian-politics-a-federal-election-trade-war-and-more/"">Wrapping up a year in Canadian politics: a federal election, trade war, and more</a>"
8,‘They want access to our market’: McLaughlin on why U.S. is pushing against CUSMA,https://www.ctvnews.ca/video/2025/12/19/they-want-access-to-our-market-mclaughlin-on-why-us-is-pushing-against-cusma/,"<a href=""https://www.ctvnews.ca/video/2025/12/19/they-want-access-to-our-market-mclaughlin-on-why-us-is-pushing-against-cusma/"">‘They want access to our market’: McLaughlin on why U.S. is pushing against CUSMA</a>"
