rank,Article title,url,title_with_link
1,"‘That’s irresponsible, that’s not right’: PM Carney reacts to latest conflict between U.S. and Iran",https://www.ctvnews.ca/video/2026/07/08/thats-irresponsible-thats-not-right-pm-carney-reacts-to-latest-conflict-between-us-and-iran/,"<a href=""https://www.ctvnews.ca/video/2026/07/08/thats-irresponsible-thats-not-right-pm-carney-reacts-to-latest-conflict-between-us-and-iran/"">‘That’s irresponsible, that’s not right’: PM Carney reacts to latest conflict between U.S. and Iran</a>"
2,"'For me, I think it's over ...it's just a waste of time dealing with them': Trump",https://www.ctvnews.ca/video/2026/07/08/for-me-i-think-its-over-its-just-a-waste-of-time-dealing-with-them-trump/,"<a href=""https://www.ctvnews.ca/video/2026/07/08/for-me-i-think-its-over-its-just-a-waste-of-time-dealing-with-them-trump/"">'For me, I think it's over ...it's just a waste of time dealing with them': Trump</a>"
3,"Homeowner slapped with nearly $3K water bill, city admits fault but refuses to adjust amount",https://www.ctvnews.ca/video/2026/07/07/homeowner-slapped-with-nearly-3k-water-bill-city-admits-fault-but-refuses-to-adjust-amount/,"<a href=""https://www.ctvnews.ca/video/2026/07/07/homeowner-slapped-with-nearly-3k-water-bill-city-admits-fault-but-refuses-to-adjust-amount/"">Homeowner slapped with nearly $3K water bill, city admits fault but refuses to adjust amount</a>"
4,"Alleged assault, racist rant caught on video at Halifax Costco",https://www.ctvnews.ca/atlantic/video/2026/07/07/racist-rant-caught-on-video-in-halifax-costco/,"<a href=""https://www.ctvnews.ca/atlantic/video/2026/07/07/racist-rant-caught-on-video-in-halifax-costco/"">Alleged assault, racist rant caught on video at Halifax Costco</a>"
5,Ukrainian TikTok star documents life in Canada,https://www.ctvnews.ca/winnipeg/video/2026/07/07/ukrainian-tiktok-star-documents-life-in-canada/,"<a href=""https://www.ctvnews.ca/winnipeg/video/2026/07/07/ukrainian-tiktok-star-documents-life-in-canada/"">Ukrainian TikTok star documents life in Canada</a>"
6,‘Hybrid’ human-AI produced film garnering backlash from film industry,https://www.ctvnews.ca/video/2026/07/07/ctv-national-news-hybrid-human-ai-produced-film-garnering-backlash-from-film-industry/,"<a href=""https://www.ctvnews.ca/video/2026/07/07/ctv-national-news-hybrid-human-ai-produced-film-garnering-backlash-from-film-industry/"">‘Hybrid’ human-AI produced film garnering backlash from film industry</a>"
7,Possible tornado leaves path of destruction at southwestern Ontario trailer park,https://www.ctvnews.ca/london/video/2026/07/07/huron-county-storm-damage/,"<a href=""https://www.ctvnews.ca/london/video/2026/07/07/huron-county-storm-damage/"">Possible tornado leaves path of destruction at southwestern Ontario trailer park</a>"
8,"Rogers shuts down two Vancouver radio stations, lays off hundreds across the country",https://www.ctvnews.ca/vancouver/video/2026/07/08/rogers-shuts-down-two-vancouver-radio-stations/,"<a href=""https://www.ctvnews.ca/vancouver/video/2026/07/08/rogers-shuts-down-two-vancouver-radio-stations/"">Rogers shuts down two Vancouver radio stations, lays off hundreds across the country</a>"
