rank,Article title,url,title_with_link
1,LIVE: Sask. Premier Scott Moe to speak on new canola tariffs,https://www.ctvnews.ca/video/live/2025/08/12/live-sask-premier-scott-moe-to-speak-on-new-canola-tariffs/,"<a href=""https://www.ctvnews.ca/video/live/2025/08/12/live-sask-premier-scott-moe-to-speak-on-new-canola-tariffs/"">LIVE: Sask. Premier Scott Moe to speak on new canola tariffs</a>"
2,Neighbour left stunned after Barrie home explodes in dramatic video,https://www.ctvnews.ca/barrie/video/2025/08/11/one-dead-in-barrie-home-explosion/,"<a href=""https://www.ctvnews.ca/barrie/video/2025/08/11/one-dead-in-barrie-home-explosion/"">Neighbour left stunned after Barrie home explodes in dramatic video</a>"
3,2 Ontario women lose more than $50K after clicking link texted to them,https://www.ctvnews.ca/toronto/video/2025/08/12/two-ontario-women-lose-more-than-48000-to-smishing-scam/,"<a href=""https://www.ctvnews.ca/toronto/video/2025/08/12/two-ontario-women-lose-more-than-48000-to-smishing-scam/"">2 Ontario women lose more than $50K after clicking link texted to them</a>"
4,Missouri teen who fell 70 metres into a ravine wakes up after 11 days in a coma,https://www.ctvnews.ca/video/2025/08/12/missouri-teen-who-fell-70-metres-into-a-ravine-wakes-up-after-11-days-in-a-coma/,"<a href=""https://www.ctvnews.ca/video/2025/08/12/missouri-teen-who-fell-70-metres-into-a-ravine-wakes-up-after-11-days-in-a-coma/"">Missouri teen who fell 70 metres into a ravine wakes up after 11 days in a coma</a>"
5,‘Extreme disappointment in what China has done’: Canadian Canola Growers Association President & CEO,https://www.ctvnews.ca/video/2025/08/12/extreme-disappointment-in-what-china-has-done-canadian-canola-growers-association-president-ceo/,"<a href=""https://www.ctvnews.ca/video/2025/08/12/extreme-disappointment-in-what-china-has-done-canadian-canola-growers-association-president-ceo/"">‘Extreme disappointment in what China has done’: Canadian Canola Growers Association President & CEO</a>"
6,WATCH: Chinese warship collides with its own coast guard vessel,https://www.ctvnews.ca/video/2025/08/12/watch-chinese-warship-collides-with-its-own-coast-guard-vessel/,"<a href=""https://www.ctvnews.ca/video/2025/08/12/watch-chinese-warship-collides-with-its-own-coast-guard-vessel/"">WATCH: Chinese warship collides with its own coast guard vessel</a>"
7,At least two dead and dozens injured after explosion at Pennsylvania steel mill,https://www.ctvnews.ca/video/2025/08/12/at-least-two-dead-and-dozens-injured-after-explosion-at-pennsylvania-steel-mill/,"<a href=""https://www.ctvnews.ca/video/2025/08/12/at-least-two-dead-and-dozens-injured-after-explosion-at-pennsylvania-steel-mill/"">At least two dead and dozens injured after explosion at Pennsylvania steel mill</a>"
8,Two men arrested in deadly Hamilton-area shooting,https://www.ctvnews.ca/video/2025/08/12/two-men-arrested-in-deadly-hamilton-area-shooting/,"<a href=""https://www.ctvnews.ca/video/2025/08/12/two-men-arrested-in-deadly-hamilton-area-shooting/"">Two men arrested in deadly Hamilton-area shooting</a>"
