rank,Article title,url,title_with_link
1,‘I just called him an elephant’: Ford jokes after taking aim at Trump,https://www.ctvnews.ca/toronto/video/2025/10/14/i-just-called-him-an-elephant-ford-jokes-after-taking-aim-at-trump/,"<a href=""https://www.ctvnews.ca/toronto/video/2025/10/14/i-just-called-him-an-elephant-ford-jokes-after-taking-aim-at-trump/"">‘I just called him an elephant’: Ford jokes after taking aim at Trump</a>"
2,"Woman’s death ruled a suicide for a second time, despite being stabbed at least 20 times",https://www.ctvnews.ca/video/2025/10/14/womans-death-ruled-a-suicide-for-a-second-time-despite-being-stabbed-at-least-20-times/,"<a href=""https://www.ctvnews.ca/video/2025/10/14/womans-death-ruled-a-suicide-for-a-second-time-despite-being-stabbed-at-least-20-times/"">Woman’s death ruled a suicide for a second time, despite being stabbed at least 20 times</a>"
3,Couple forced into their garage at gunpoint in home invasion before suspects flee,https://www.ctvnews.ca/video/2025/10/14/couple-forced-into-their-garage-at-gunpoint-in-home-invasion-before-suspects-flee/,"<a href=""https://www.ctvnews.ca/video/2025/10/14/couple-forced-into-their-garage-at-gunpoint-in-home-invasion-before-suspects-flee/"">Couple forced into their garage at gunpoint in home invasion before suspects flee</a>"
4,"Some victims in Toronto gas explosion were ‘exhibiting signs of burns,’ officials say",https://www.ctvnews.ca/toronto/video/2025/10/14/some-victims-in-north-york-gas-explosion-were-exhibiting-signs-of-burns-officials-say/,"<a href=""https://www.ctvnews.ca/toronto/video/2025/10/14/some-victims-in-north-york-gas-explosion-were-exhibiting-signs-of-burns-officials-say/"">Some victims in Toronto gas explosion were ‘exhibiting signs of burns,’ officials say</a>"
5,Couple killed after small plane crashes on Massachusetts highway,https://www.ctvnews.ca/video/2025/10/14/couple-killed-after-small-plane-crashes-on-massachusetts-highway/,"<a href=""https://www.ctvnews.ca/video/2025/10/14/couple-killed-after-small-plane-crashes-on-massachusetts-highway/"">Couple killed after small plane crashes on Massachusetts highway</a>"
6,Dramatic video of Coast Guard helicopter rescuing person in water off Massachusetts,https://www.ctvnews.ca/video/2025/10/14/dramatic-video-of-coast-guard-helicopter-rescuing-person-in-water-off-massachusetts/,"<a href=""https://www.ctvnews.ca/video/2025/10/14/dramatic-video-of-coast-guard-helicopter-rescuing-person-in-water-off-massachusetts/"">Dramatic video of Coast Guard helicopter rescuing person in water off Massachusetts</a>"
7,"Canadian Tire says names, emails of some customers exposed following data breach",https://www.ctvnews.ca/toronto/video/2025/10/14/canadian-tire-says-names-emails-of-some-customers-exposed-following-data-breach/,"<a href=""https://www.ctvnews.ca/toronto/video/2025/10/14/canadian-tire-says-names-emails-of-some-customers-exposed-following-data-breach/"">Canadian Tire says names, emails of some customers exposed following data breach</a>"
8,Roof ripped off building amid severe weather in Oregon,https://www.ctvnews.ca/video/2025/10/14/roof-ripped-off-building-amid-severe-weather-in-oregon/,"<a href=""https://www.ctvnews.ca/video/2025/10/14/roof-ripped-off-building-amid-severe-weather-in-oregon/"">Roof ripped off building amid severe weather in Oregon</a>"
