rank,Article title,url,title_with_link
1,Record snowfall causes major disruptions across Canada,https://www.ctvnews.ca/video/2026/01/26/ctv-national-news-record-snowfall-causes-major-disruptions-across-canada/,"<a href=""https://www.ctvnews.ca/video/2026/01/26/ctv-national-news-record-snowfall-causes-major-disruptions-across-canada/"">Record snowfall causes major disruptions across Canada</a>"
2,Former cabinet minister Kirsty Duncan dies at 59,https://www.ctvnews.ca/video/2026/01/26/former-cabinet-minister-kirsty-duncan-dies-at-59/,"<a href=""https://www.ctvnews.ca/video/2026/01/26/former-cabinet-minister-kirsty-duncan-dies-at-59/"">Former cabinet minister Kirsty Duncan dies at 59</a>"
3,Ottawa announces new measures to tackle affordability crisis,https://www.ctvnews.ca/video/2026/01/26/ctv-national-news-ottawa-announces-new-measures-to-tackle-affordability-crisis/,"<a href=""https://www.ctvnews.ca/video/2026/01/26/ctv-national-news-ottawa-announces-new-measures-to-tackle-affordability-crisis/"">Ottawa announces new measures to tackle affordability crisis</a>"
4,One driver dead after two vehicles careen over Ontario Highway 8 overpass,https://www.ctvnews.ca/kitchener/video/2026/01/26/two-vehicles-careen-over-highway-8-overpass-one-driver-dead/,"<a href=""https://www.ctvnews.ca/kitchener/video/2026/01/26/two-vehicles-careen-over-highway-8-overpass-one-driver-dead/"">One driver dead after two vehicles careen over Ontario Highway 8 overpass</a>"
5,Water gushes through the ceiling after pipes burst at Montreal hospital,https://www.ctvnews.ca/montreal/video/2026/01/26/pipes-burst-at-montreals-douglas-hospital/,"<a href=""https://www.ctvnews.ca/montreal/video/2026/01/26/pipes-burst-at-montreals-douglas-hospital/"">Water gushes through the ceiling after pipes burst at Montreal hospital</a>"
6,"Unexplained multi-day police presence in London, Ont. neighbourhood unnerves residents",https://www.ctvnews.ca/london/video/2026/01/26/multi-day-police-presence-on-chesham-avenue-unnerves-residents/,"<a href=""https://www.ctvnews.ca/london/video/2026/01/26/multi-day-police-presence-on-chesham-avenue-unnerves-residents/"">Unexplained multi-day police presence in London, Ont. neighbourhood unnerves residents</a>"
7,Cyclist group files complaint after members were charged by Toronto police after being hit by a car,https://www.ctvnews.ca/toronto/video/2026/01/26/cyclist-group-files-complaint-with-tps-after-members-hit-by-a-car-were-charged-by-police/,"<a href=""https://www.ctvnews.ca/toronto/video/2026/01/26/cyclist-group-files-complaint-with-tps-after-members-hit-by-a-car-were-charged-by-police/"">Cyclist group files complaint after members were charged by Toronto police after being hit by a car</a>"
8,Carney meets with Ford amid criticisms over Canada’s trade deal with China,https://www.ctvnews.ca/video/2026/01/26/ctv-national-news-carney-meets-with-ford-amid-criticisms-over-canadas-trade-deal-with-china/,"<a href=""https://www.ctvnews.ca/video/2026/01/26/ctv-national-news-carney-meets-with-ford-amid-criticisms-over-canadas-trade-deal-with-china/"">Carney meets with Ford amid criticisms over Canada’s trade deal with China</a>"
