rank,Article title,url,title_with_link
1,Canadians on Cuban vacation say their ‘whole hotel’ was relocated due to fuel shortage,https://www.ctvnews.ca/video/2026/02/06/canadians-on-cuban-vacation-say-their-whole-hotel-was-relocated-due-to-fuel-shortage/,"<a href=""https://www.ctvnews.ca/video/2026/02/06/canadians-on-cuban-vacation-say-their-whole-hotel-was-relocated-due-to-fuel-shortage/"">Canadians on Cuban vacation say their ‘whole hotel’ was relocated due to fuel shortage</a>"
2,Milano Olympics off to a ‘fast start’ with mixed curling: sports journalist,https://www.ctvnews.ca/video/2026/02/06/milano-olympics-off-to-a-fast-start-with-mixed-curling-sports-journalist/,"<a href=""https://www.ctvnews.ca/video/2026/02/06/milano-olympics-off-to-a-fast-start-with-mixed-curling-sports-journalist/"">Milano Olympics off to a ‘fast start’ with mixed curling: sports journalist</a>"
3,"Ontario woman out $150,000 after using private lender to make extra money",https://www.ctvnews.ca/toronto/video/2026/02/06/whitby-ont-woman-out-150000-after-using-private-lender-to-make-extra-money/,"<a href=""https://www.ctvnews.ca/toronto/video/2026/02/06/whitby-ont-woman-out-150000-after-using-private-lender-to-make-extra-money/"">Ontario woman out $150,000 after using private lender to make extra money</a>"
4,Felony charges against Gavin McKenna officially withdrawn,https://www.ctvnews.ca/video/2026/02/06/felony-charges-against-gavin-mckenna-officially-withdrawn/,"<a href=""https://www.ctvnews.ca/video/2026/02/06/felony-charges-against-gavin-mckenna-officially-withdrawn/"">Felony charges against Gavin McKenna officially withdrawn</a>"
5,Crowd sings ‘O Canada’ at consulate flag raising ceremony in Greenland,https://www.ctvnews.ca/video/2026/02/06/crowd-sings-o-canada-at-consulate-flag-raising-ceremony-in-greenland/,"<a href=""https://www.ctvnews.ca/video/2026/02/06/crowd-sings-o-canada-at-consulate-flag-raising-ceremony-in-greenland/"">Crowd sings ‘O Canada’ at consulate flag raising ceremony in Greenland</a>"
6,"Anand discusses future Canada-Greenland transportation links, sustainability",https://www.ctvnews.ca/video/2026/02/06/anand-discusses-future-canada-greenland-transportation-links-sustainability/,"<a href=""https://www.ctvnews.ca/video/2026/02/06/anand-discusses-future-canada-greenland-transportation-links-sustainability/"">Anand discusses future Canada-Greenland transportation links, sustainability</a>"
7,Car makers ‘planning for the electric future’ but consumers not there yet: CVMA,https://www.ctvnews.ca/video/2026/02/06/car-makers-planning-for-the-electric-future-but-consumers-not-there-yet-cvma/,"<a href=""https://www.ctvnews.ca/video/2026/02/06/car-makers-planning-for-the-electric-future-but-consumers-not-there-yet-cvma/"">Car makers ‘planning for the electric future’ but consumers not there yet: CVMA</a>"
8,"First ransom deadline in Nancy Guthrie case passes, no word yet from abductors",https://www.ctvnews.ca/video/2026/02/06/first-ransom-deadline-in-nancy-guthrie-case-passes-no-word-yet-from-abductors/,"<a href=""https://www.ctvnews.ca/video/2026/02/06/first-ransom-deadline-in-nancy-guthrie-case-passes-no-word-yet-from-abductors/"">First ransom deadline in Nancy Guthrie case passes, no word yet from abductors</a>"
