rank,Article title,url,title_with_link
1,"Halifax wildfire caused by human activity, officials say",https://www.ctvnews.ca/atlantic/video/2025/08/13/halifax-wildfire-caused-by-human-activity-officials-say/,"<a href=""https://www.ctvnews.ca/atlantic/video/2025/08/13/halifax-wildfire-caused-by-human-activity-officials-say/"">Halifax wildfire caused by human activity, officials say</a>"
2,‘Those mountains were all on fire’: Newfoundland evacuee recalls her ‘scary’ escape,https://www.ctvnews.ca/video/2025/08/13/those-mountains-were-all-on-fire-newfoundland-evacuee-recalls-her-scary-escape/,"<a href=""https://www.ctvnews.ca/video/2025/08/13/those-mountains-were-all-on-fire-newfoundland-evacuee-recalls-her-scary-escape/"">‘Those mountains were all on fire’: Newfoundland evacuee recalls her ‘scary’ escape</a>"
3,People helping each other amid wildfires shows Newfoundland spirit: Red Cross VP,https://www.ctvnews.ca/video/2025/08/13/people-helping-each-other-amid-wildfires-shows-newfoundland-spirit-red-cross-vp/,"<a href=""https://www.ctvnews.ca/video/2025/08/13/people-helping-each-other-amid-wildfires-shows-newfoundland-spirit-red-cross-vp/"">People helping each other amid wildfires shows Newfoundland spirit: Red Cross VP</a>"
4,Volpe: Ontario’s tariff support plan for businesses arrives at the right time,https://www.ctvnews.ca/video/2025/08/13/volpe-ontarios-tariff-support-plan-for-businesses-arrives-at-the-right-time/,"<a href=""https://www.ctvnews.ca/video/2025/08/13/volpe-ontarios-tariff-support-plan-for-businesses-arrives-at-the-right-time/"">Volpe: Ontario’s tariff support plan for businesses arrives at the right time</a>"
5,N.L. pizzeria steps up to feed firefighters battling wildfires,https://www.ctvnews.ca/video/2025/08/13/nl-pizzeria-steps-up-to-feed-firefighters-battling-wildfires/,"<a href=""https://www.ctvnews.ca/video/2025/08/13/nl-pizzeria-steps-up-to-feed-firefighters-battling-wildfires/"">N.L. pizzeria steps up to feed firefighters battling wildfires</a>"
6,Woman accused of lighting her ex’s car on fire while he worked,https://www.ctvnews.ca/video/2025/08/13/woman-accused-of-lighting-her-exs-car-on-fire-while-he-worked/,"<a href=""https://www.ctvnews.ca/video/2025/08/13/woman-accused-of-lighting-her-exs-car-on-fire-while-he-worked/"">Woman accused of lighting her ex’s car on fire while he worked</a>"
7,Industry leader weigh in on effectiveness of Ontario’s $1B loan program amid tariff war,https://www.ctvnews.ca/video/2025/08/13/industry-leader-weigh-in-on-effectiveness-of-ontarios-1b-loan-program-amid-tariff-war/,"<a href=""https://www.ctvnews.ca/video/2025/08/13/industry-leader-weigh-in-on-effectiveness-of-ontarios-1b-loan-program-amid-tariff-war/"">Industry leader weigh in on effectiveness of Ontario’s $1B loan program amid tariff war</a>"
8,Air Canada flight attendant dispute ‘adding another layer of uncertainty’ to the economy,https://www.ctvnews.ca/video/2025/08/13/air-canada-flight-attendant-dispute-adding-another-layer-of-uncertainty-to-the-economy/,"<a href=""https://www.ctvnews.ca/video/2025/08/13/air-canada-flight-attendant-dispute-adding-another-layer-of-uncertainty-to-the-economy/"">Air Canada flight attendant dispute ‘adding another layer of uncertainty’ to the economy</a>"
