rank,Article title,url,title_with_link
1,100-year-old Saskatoon mystery solved: ‘Woman in the well’ finally identified as Alice Spence,https://www.ctvnews.ca/saskatoon/video/2025/09/30/100-year-old-saskatoon-mystery-solved/,"<a href=""https://www.ctvnews.ca/saskatoon/video/2025/09/30/100-year-old-saskatoon-mystery-solved/"">100-year-old Saskatoon mystery solved: ‘Woman in the well’ finally identified as Alice Spence</a>"
2,Community wrangles gator after authorities leave it in McDonald’s parking lot for days,https://www.ctvnews.ca/video/2025/09/30/alligator-wanders-into-mcdonalds-parking-lot-stays-there-for-days/,"<a href=""https://www.ctvnews.ca/video/2025/09/30/alligator-wanders-into-mcdonalds-parking-lot-stays-there-for-days/"">Community wrangles gator after authorities leave it in McDonald’s parking lot for days</a>"
3,This new actor created by artificial intelligence is creating backlash in Hollywood,https://www.ctvnews.ca/video/2025/09/30/this-new-actor-created-by-artificial-intelligence-is-creating-backlash-in-hollywood/,"<a href=""https://www.ctvnews.ca/video/2025/09/30/this-new-actor-created-by-artificial-intelligence-is-creating-backlash-in-hollywood/"">This new actor created by artificial intelligence is creating backlash in Hollywood</a>"
4,Three people charged after $75K worth of merchandise stolen from Rideau Centre in Ottawa,https://www.ctvnews.ca/ottawa/video/2025/09/29/three-charged-after-thousands-stolen-from-rideau-centre/,"<a href=""https://www.ctvnews.ca/ottawa/video/2025/09/29/three-charged-after-thousands-stolen-from-rideau-centre/"">Three people charged after $75K worth of merchandise stolen from Rideau Centre in Ottawa</a>"
5,‘Our stories matter throughout the year’: Residential school survivor,https://www.ctvnews.ca/video/2025/09/30/ctv-national-news-our-stories-matter-throughout-the-year-residential-school-survivor/,"<a href=""https://www.ctvnews.ca/video/2025/09/30/ctv-national-news-our-stories-matter-throughout-the-year-residential-school-survivor/"">‘Our stories matter throughout the year’: Residential school survivor</a>"
6,WATCH: Firefly rocket explodes during launch attempt,https://www.ctvnews.ca/video/2025/09/30/watch-firefly-rocket-explodes-during-launch-attempt/,"<a href=""https://www.ctvnews.ca/video/2025/09/30/watch-firefly-rocket-explodes-during-launch-attempt/"">WATCH: Firefly rocket explodes during launch attempt</a>"
7,Ontario couple stranded with flat tire in Spain is also robbed on the side of the road,https://www.ctvnews.ca/toronto/video/2025/09/29/ontario-couple-stranded-with-flat-tire-in-spain-is-also-robbed-on-the-side-of-the-road/,"<a href=""https://www.ctvnews.ca/toronto/video/2025/09/29/ontario-couple-stranded-with-flat-tire-in-spain-is-also-robbed-on-the-side-of-the-road/"">Ontario couple stranded with flat tire in Spain is also robbed on the side of the road</a>"
8,"GRAPHIC: Police officer's gruesome testimony in Sahra Bulle murder trial in Windsor, Ont.",https://www.ctvnews.ca/windsor/video/2025/09/29/graphic-police-officer-testifies-in-bulle-murder-trial/,"<a href=""https://www.ctvnews.ca/windsor/video/2025/09/29/graphic-police-officer-testifies-in-bulle-murder-trial/"">GRAPHIC: Police officer's gruesome testimony in Sahra Bulle murder trial in Windsor, Ont.</a>"
