rank,Article title,url,title_with_link
1,‘Huge deficit’ coming despite deep cuts expected in upcoming fall budget: Reid,https://www.ctvnews.ca/toronto/video/2025/10/10/huge-deficit-coming-despite-deep-cuts-expected-in-upcoming-fall-budget-reid/,"<a href=""https://www.ctvnews.ca/toronto/video/2025/10/10/huge-deficit-coming-despite-deep-cuts-expected-in-upcoming-fall-budget-reid/"">‘Huge deficit’ coming despite deep cuts expected in upcoming fall budget: Reid</a>"
2,"Three new budget measures: Automatic benefits, food program, Canada Strong pass",https://www.ctvnews.ca/video/2025/10/10/three-new-budget-measures-automatic-benefits-food-program-canada-strong-pass/,"<a href=""https://www.ctvnews.ca/video/2025/10/10/three-new-budget-measures-automatic-benefits-food-program-canada-strong-pass/"">Three new budget measures: Automatic benefits, food program, Canada Strong pass</a>"
3,‘Great choice’: Reaction to Nobel Peace Prize awarded to Venezuelan activist,https://www.ctvnews.ca/video/2025/10/10/great-choice-reaction-to-nobel-peace-prize-awarded-to-venezuelan-activist/,"<a href=""https://www.ctvnews.ca/video/2025/10/10/great-choice-reaction-to-nobel-peace-prize-awarded-to-venezuelan-activist/"">‘Great choice’: Reaction to Nobel Peace Prize awarded to Venezuelan activist</a>"
4,LIVE: Keg tapping kicks off Kitchener-Waterloo Oktoberfest!,https://www.ctvnews.ca/video/live/2025/10/01/live-keg-tapping-kicks-off-kitchener-waterloo-oktoberfest/,"<a href=""https://www.ctvnews.ca/video/live/2025/10/01/live-keg-tapping-kicks-off-kitchener-waterloo-oktoberfest/"">LIVE: Keg tapping kicks off Kitchener-Waterloo Oktoberfest!</a>"
5,"Ontario man out $80,000 after falling victim to romance scam",https://www.ctvnews.ca/toronto/video/2025/10/10/ontario-man-out-80000-after-falling-victim-to-romance-scam/,"<a href=""https://www.ctvnews.ca/toronto/video/2025/10/10/ontario-man-out-80000-after-falling-victim-to-romance-scam/"">Ontario man out $80,000 after falling victim to romance scam</a>"
6,U.S. President Trump still ‘dictating so many of these economic decisions’ in Canada: Reid,https://www.ctvnews.ca/video/2025/10/10/us-president-trump-still-dictating-so-many-of-these-economic-decisions-in-canada-reid/,"<a href=""https://www.ctvnews.ca/video/2025/10/10/us-president-trump-still-dictating-so-many-of-these-economic-decisions-in-canada-reid/"">U.S. President Trump still ‘dictating so many of these economic decisions’ in Canada: Reid</a>"
7,Ceasefire between Israel and Hamas now in effect,https://www.ctvnews.ca/video/2025/10/10/ceasefire-between-israel-and-hamas-now-in-effect/,"<a href=""https://www.ctvnews.ca/video/2025/10/10/ceasefire-between-israel-and-hamas-now-in-effect/"">Ceasefire between Israel and Hamas now in effect</a>"
8,Memorial bench honouring slain couple stolen from Ont. park,https://www.ctvnews.ca/london/video/2025/10/09/memorial-bench-stolen/,"<a href=""https://www.ctvnews.ca/london/video/2025/10/09/memorial-bench-stolen/"">Memorial bench honouring slain couple stolen from Ont. park</a>"
