rank,Article title,url,title_with_link
1,Bombardier unveiled what it calls the 'world’s fastest business jet',https://www.ctvnews.ca/video/2025/12/09/bombardier-unveiled-what-it-calls-the-worlds-fastest-business-jet/,"<a href=""https://www.ctvnews.ca/video/2025/12/09/bombardier-unveiled-what-it-calls-the-worlds-fastest-business-jet/"">Bombardier unveiled what it calls the 'world’s fastest business jet'</a>"
2,‘It left me broken’: Ottawa man with hernia accused of shoplifting at Farm Boy,https://www.ctvnews.ca/video/2025/12/09/it-left-me-broken-ottawa-man-with-hernia-accused-of-shoplifting-at-farm-boy/,"<a href=""https://www.ctvnews.ca/video/2025/12/09/it-left-me-broken-ottawa-man-with-hernia-accused-of-shoplifting-at-farm-boy/"">‘It left me broken’: Ottawa man with hernia accused of shoplifting at Farm Boy</a>"
3,'Project Wrangler' organized crime crackdown leads to 13 arrests,https://www.ctvnews.ca/video/2025/12/08/ctv-national-news-project-wrangler-organized-crime-crackdown-leads-to-13-arrests/,"<a href=""https://www.ctvnews.ca/video/2025/12/08/ctv-national-news-project-wrangler-organized-crime-crackdown-leads-to-13-arrests/"">'Project Wrangler' organized crime crackdown leads to 13 arrests</a>"
4,Ottawa man wants apology after hernia leads to shoplifting accusation,https://www.ctvnews.ca/ottawa/video/2025/12/08/ottawa-man-wants-apology-after-hernia-leads-to-shoplifting-accusation/,"<a href=""https://www.ctvnews.ca/ottawa/video/2025/12/08/ottawa-man-wants-apology-after-hernia-leads-to-shoplifting-accusation/"">Ottawa man wants apology after hernia leads to shoplifting accusation</a>"
5,"London, Ont.'s mayor calls on the province to declare a state of emergency over homelessness",https://www.ctvnews.ca/video/2025/12/09/london-onts-mayor-calls-on-the-province-to-declare-a-state-of-emergency-over-homelessness/,"<a href=""https://www.ctvnews.ca/video/2025/12/09/london-onts-mayor-calls-on-the-province-to-declare-a-state-of-emergency-over-homelessness/"">London, Ont.'s mayor calls on the province to declare a state of emergency over homelessness</a>"
6,Ottawa opens new system to fast-track permanent residency for foreign doctors,https://www.ctvnews.ca/video/2025/12/08/ctv-national-news-ottawa-opens-new-system-to-fast-track-permanent-residency-for-foreign-doctors/,"<a href=""https://www.ctvnews.ca/video/2025/12/08/ctv-national-news-ottawa-opens-new-system-to-fast-track-permanent-residency-for-foreign-doctors/"">Ottawa opens new system to fast-track permanent residency for foreign doctors</a>"
7,Man who killed New Brunswick police officer in 1987 released on day parole,https://www.ctvnews.ca/atlantic/video/2025/12/08/man-who-killed-nb-officer-released-on-day-parole/,"<a href=""https://www.ctvnews.ca/atlantic/video/2025/12/08/man-who-killed-nb-officer-released-on-day-parole/"">Man who killed New Brunswick police officer in 1987 released on day parole</a>"
8,Nurses across Canada report facing threats of violence from patients daily,https://www.ctvnews.ca/video/2025/12/08/ctv-national-news-nurses-across-canada-report-facing-threats-of-violence-from-patients-daily/,"<a href=""https://www.ctvnews.ca/video/2025/12/08/ctv-national-news-nurses-across-canada-report-facing-threats-of-violence-from-patients-daily/"">Nurses across Canada report facing threats of violence from patients daily</a>"
