rank,Article title,url,title_with_link
1,‘Everything is on the table’: Ontario Premier Ford on combatting latest U.S. tariff threat,https://www.ctvnews.ca/video/2026/07/22/everything-is-on-the-table-ontario-premier-ford-on-combatting-latest-us-tariff-threat/,"<a href=""https://www.ctvnews.ca/video/2026/07/22/everything-is-on-the-table-ontario-premier-ford-on-combatting-latest-us-tariff-threat/"">‘Everything is on the table’: Ontario Premier Ford on combatting latest U.S. tariff threat</a>"
2,Whale watchers catch rare sight of orcas hunting dolphins in California,https://www.ctvnews.ca/video/2026/07/22/whale-watchers-catch-rare-sight-of-orcas-hunting-dolphins-in-california/,"<a href=""https://www.ctvnews.ca/video/2026/07/22/whale-watchers-catch-rare-sight-of-orcas-hunting-dolphins-in-california/"">Whale watchers catch rare sight of orcas hunting dolphins in California</a>"
3,Witnesses say knife-wielding suspect shot by police in B.C.,https://www.ctvnews.ca/vancouver/video/2026/07/22/witnesses-describe-frightening-scene-at-shopping-centre/,"<a href=""https://www.ctvnews.ca/vancouver/video/2026/07/22/witnesses-describe-frightening-scene-at-shopping-centre/"">Witnesses say knife-wielding suspect shot by police in B.C.</a>"
4,Two tornadoes confirmed to have touched down in Alberta,https://www.ctvnews.ca/edmonton/video/2026/07/22/2-tornadoes-confirmed-to-have-touched-down-in-rocky-mountain-house/,"<a href=""https://www.ctvnews.ca/edmonton/video/2026/07/22/2-tornadoes-confirmed-to-have-touched-down-in-rocky-mountain-house/"">Two tornadoes confirmed to have touched down in Alberta</a>"
5,Suspect fleeing cops does swan dive off bridge to evade capture,https://www.ctvnews.ca/video/2026/07/22/suspect-fleeing-cops-does-swan-dive-off-bridge-to-evade-capture/,"<a href=""https://www.ctvnews.ca/video/2026/07/22/suspect-fleeing-cops-does-swan-dive-off-bridge-to-evade-capture/"">Suspect fleeing cops does swan dive off bridge to evade capture</a>"
6,Prince George turns 13 as Royal Family shares new portrait,https://www.ctvnews.ca/video/2026/07/22/prince-george-turns-13/,"<a href=""https://www.ctvnews.ca/video/2026/07/22/prince-george-turns-13/"">Prince George turns 13 as Royal Family shares new portrait</a>"
7,Toddler declared dead found alive in Arizona morgue,https://www.ctvnews.ca/video/2026/07/22/toddler-declared-dead-found-alive-in-arizona-morgue/,"<a href=""https://www.ctvnews.ca/video/2026/07/22/toddler-declared-dead-found-alive-in-arizona-morgue/"">Toddler declared dead found alive in Arizona morgue</a>"
8,New out of control wildfire spreading quickly in B.C.,https://www.ctvnews.ca/vancouver/video/2026/07/22/bcs-wildfire-fight-intensifies/,"<a href=""https://www.ctvnews.ca/vancouver/video/2026/07/22/bcs-wildfire-fight-intensifies/"">New out of control wildfire spreading quickly in B.C.</a>"
