rank,Article title,url,title_with_link
1,Trump moving ‘full steam ahead’ in attempt to annex Greenland; will he try the same with Canada?,https://www.ctvnews.ca/video/2025/12/22/trump-moving-full-steam-ahead-in-attempt-to-annex-greenland-will-he-try-the-same-with-canada/,"<a href=""https://www.ctvnews.ca/video/2025/12/22/trump-moving-full-steam-ahead-in-attempt-to-annex-greenland-will-he-try-the-same-with-canada/"">Trump moving ‘full steam ahead’ in attempt to annex Greenland; will he try the same with Canada?</a>"
2,"These counterfeit bills circulating across Canada look so real, they’re almost impossible to detect",https://www.ctvnews.ca/toronto/video/2025/12/22/extremely-difficult-to-detect-these-counterfeit-bills-on-the-rise-across-canada/,"<a href=""https://www.ctvnews.ca/toronto/video/2025/12/22/extremely-difficult-to-detect-these-counterfeit-bills-on-the-rise-across-canada/"">These counterfeit bills circulating across Canada look so real, they’re almost impossible to detect</a>"
3,Rapper Nicki Minaj praises ‘assassin’ JD Vance in event with Turning Point USA’s Erika Kirk,https://www.ctvnews.ca/video/2025/12/22/rapper-nicki-minaj-praises-assassin-jd-vance-in-event-with-turning-point-usas-erika-kirk/,"<a href=""https://www.ctvnews.ca/video/2025/12/22/rapper-nicki-minaj-praises-assassin-jd-vance-in-event-with-turning-point-usas-erika-kirk/"">Rapper Nicki Minaj praises ‘assassin’ JD Vance in event with Turning Point USA’s Erika Kirk</a>"
4,99-year-old N.B. volunteer doesn’t let age stop him from giving back,https://www.ctvnews.ca/atlantic/video/2025/12/22/holiday-hero/,"<a href=""https://www.ctvnews.ca/atlantic/video/2025/12/22/holiday-hero/"">99-year-old N.B. volunteer doesn’t let age stop him from giving back</a>"
5,Watch the implosion of a historic bridge connecting Iowa and Wisconsin,https://www.ctvnews.ca/video/2025/12/22/watch-the-implosion-of-a-historic-bridge-connecting-iowa-and-wisconsin/,"<a href=""https://www.ctvnews.ca/video/2025/12/22/watch-the-implosion-of-a-historic-bridge-connecting-iowa-and-wisconsin/"">Watch the implosion of a historic bridge connecting Iowa and Wisconsin</a>"
6,Infamous geyser at Yellowstone park has an explosive ‘morning kablooey’,https://www.ctvnews.ca/video/2025/12/22/infamous-geyser-at-yellowstone-park-has-an-explosive-morning-kablooey/,"<a href=""https://www.ctvnews.ca/video/2025/12/22/infamous-geyser-at-yellowstone-park-has-an-explosive-morning-kablooey/"">Infamous geyser at Yellowstone park has an explosive ‘morning kablooey’</a>"
7,Trump administration continues to target vessels they say funds Maduro's ‘illegitimate regime’,https://www.ctvnews.ca/video/2025/12/22/trump-administration-continues-to-target-vessels-they-say-funds-maduros-illegitimate-regime/,"<a href=""https://www.ctvnews.ca/video/2025/12/22/trump-administration-continues-to-target-vessels-they-say-funds-maduros-illegitimate-regime/"">Trump administration continues to target vessels they say funds Maduro's ‘illegitimate regime’</a>"
8,"Despite holiday spending cuts, WEM GM says that Alberta is still 'very strong for retail'",https://www.ctvnews.ca/video/2025/12/22/despite-holiday-spending-cuts-wem-gm-says-that-alberta-is-still-very-strong-for-retail/,"<a href=""https://www.ctvnews.ca/video/2025/12/22/despite-holiday-spending-cuts-wem-gm-says-that-alberta-is-still-very-strong-for-retail/"">Despite holiday spending cuts, WEM GM says that Alberta is still 'very strong for retail'</a>"
