rank,Article title,url,title_with_link
1,Criminals exporting meth from Canada in imaginative and alarming ways,https://www.ctvnews.ca/video/2025/10/16/criminals-exporting-meth-from-canada-in-imaginative-and-alarming-ways/,"<a href=""https://www.ctvnews.ca/video/2025/10/16/criminals-exporting-meth-from-canada-in-imaginative-and-alarming-ways/"">Criminals exporting meth from Canada in imaginative and alarming ways</a>"
2,Ottawa considering legal action over Stellantis moving production to U.S.,https://www.ctvnews.ca/video/2025/10/15/ctv-national-news-ottawa-considering-legal-action-over-stellantis-moving-production-to-us/,"<a href=""https://www.ctvnews.ca/video/2025/10/15/ctv-national-news-ottawa-considering-legal-action-over-stellantis-moving-production-to-us/"">Ottawa considering legal action over Stellantis moving production to U.S.</a>"
3,Uncertainty over thousands of jobs at Stellantis’ plant in Brampton,https://www.ctvnews.ca/video/2025/10/15/ctv-national-news-uncertainty-over-thousands-of-jobs-at-stellantis-plant-in-brampton/,"<a href=""https://www.ctvnews.ca/video/2025/10/15/ctv-national-news-uncertainty-over-thousands-of-jobs-at-stellantis-plant-in-brampton/"">Uncertainty over thousands of jobs at Stellantis’ plant in Brampton</a>"
4,Final moments of Game 3 as the Blue Jays secure a dominating win over Mariners,https://www.ctvnews.ca/video/2025/10/16/final-moments-of-game-3-as-the-blue-jays-secure-a-dominating-win-over-mariners/,"<a href=""https://www.ctvnews.ca/video/2025/10/16/final-moments-of-game-3-as-the-blue-jays-secure-a-dominating-win-over-mariners/"">Final moments of Game 3 as the Blue Jays secure a dominating win over Mariners</a>"
5,Blue Jays snap back with a big win over Mariners in Game 3 of ALCS,https://www.ctvnews.ca/video/2025/10/16/ctv-national-news-in-seattle-blue-jays-snap-back-with-a-big-win-over-mariners-in-game-3-of-alcs/,"<a href=""https://www.ctvnews.ca/video/2025/10/16/ctv-national-news-in-seattle-blue-jays-snap-back-with-a-big-win-over-mariners-in-game-3-of-alcs/"">Blue Jays snap back with a big win over Mariners in Game 3 of ALCS</a>"
6,Multiple airports in Canada hit by Hackers spreading pro-Hamas messages,https://www.ctvnews.ca/video/2025/10/16/ctv-national-news-multiple-airports-in-canada-hit-by-hackers-spreading-pro-hamas-messages/,"<a href=""https://www.ctvnews.ca/video/2025/10/16/ctv-national-news-multiple-airports-in-canada-hit-by-hackers-spreading-pro-hamas-messages/"">Multiple airports in Canada hit by Hackers spreading pro-Hamas messages</a>"
7,Ire in Israel over Hamas’ slow release of remaining hostages,https://www.ctvnews.ca/video/2025/10/15/ctv-national-news-ire-in-israel-over-hamas-slow-release-of-remaining-hostages/,"<a href=""https://www.ctvnews.ca/video/2025/10/15/ctv-national-news-ire-in-israel-over-hamas-slow-release-of-remaining-hostages/"">Ire in Israel over Hamas’ slow release of remaining hostages</a>"
8,Conservatives unveil new plan to improve youth unemployment,https://www.ctvnews.ca/video/2025/10/15/ctv-national-news-conservatives-unveil-new-plan-to-improve-youth-unemployment/,"<a href=""https://www.ctvnews.ca/video/2025/10/15/ctv-national-news-conservatives-unveil-new-plan-to-improve-youth-unemployment/"">Conservatives unveil new plan to improve youth unemployment</a>"
