rank,Article title,url,title_with_link
1,Trump 'clearly stretching the bounds of his authority': Ex-White House official on Colombia aid cut,https://www.ctvnews.ca/video/2025/10/20/trump-clearly-stretching-the-bounds-of-his-authority-ex-white-house-official-on-colombia-aid-cut/,"<a href=""https://www.ctvnews.ca/video/2025/10/20/trump-clearly-stretching-the-bounds-of-his-authority-ex-white-house-official-on-colombia-aid-cut/"">Trump 'clearly stretching the bounds of his authority': Ex-White House official on Colombia aid cut</a>"
2,Two workers killed after Boeing 747 cargo plane skids off runway in Hong Kong,https://www.ctvnews.ca/toronto/video/2025/10/20/two-workers-killed-after-boeing-747-cargo-plane-skids-off-runway-in-hong-kong/,"<a href=""https://www.ctvnews.ca/toronto/video/2025/10/20/two-workers-killed-after-boeing-747-cargo-plane-skids-off-runway-in-hong-kong/"">Two workers killed after Boeing 747 cargo plane skids off runway in Hong Kong</a>"
3,OHL captain loses golf club during simulator swing,https://www.ctvnews.ca/toronto/video/2025/10/20/ohl-captain-loses-golf-club-during-simulator-swing-2/,"<a href=""https://www.ctvnews.ca/toronto/video/2025/10/20/ohl-captain-loses-golf-club-during-simulator-swing-2/"">OHL captain loses golf club during simulator swing</a>"
4,"Newly announced measures ‘a big, bold step’ to combat fraud: Minister",https://www.ctvnews.ca/video/2025/10/20/newly-announced-measures-a-big-bold-step-to-combat-fraud-minister/,"<a href=""https://www.ctvnews.ca/video/2025/10/20/newly-announced-measures-a-big-bold-step-to-combat-fraud-minister/"">Newly announced measures ‘a big, bold step’ to combat fraud: Minister</a>"
5,LIVE: Blue Jays and Mariners players to speak ahead of Game 7,https://www.ctvnews.ca/video/live/2025/10/20/live-blue-jays-and-mariners-players-to-speak-ahead-of-game-7/,"<a href=""https://www.ctvnews.ca/video/live/2025/10/20/live-blue-jays-and-mariners-players-to-speak-ahead-of-game-7/"">LIVE: Blue Jays and Mariners players to speak ahead of Game 7</a>"
6,Analyst: 'Not a lot of energy or enthusiasm' as Albertans head to polls for municipal elections,https://www.ctvnews.ca/video/2025/10/20/analyst-not-a-lot-of-energy-or-enthusiasm-as-albertans-head-to-polls-for-municipal-elections/,"<a href=""https://www.ctvnews.ca/video/2025/10/20/analyst-not-a-lot-of-energy-or-enthusiasm-as-albertans-head-to-polls-for-municipal-elections/"">Analyst: 'Not a lot of energy or enthusiasm' as Albertans head to polls for municipal elections</a>"
7,U.S. man ‘humiliated’ after flight attendant demanded he put headphones over his hearing aids,https://www.ctvnews.ca/video/2025/10/20/us-man-humiliated-after-flight-attendant-demanded-he-put-headphones-over-his-hearing-aids/,"<a href=""https://www.ctvnews.ca/video/2025/10/20/us-man-humiliated-after-flight-attendant-demanded-he-put-headphones-over-his-hearing-aids/"">U.S. man ‘humiliated’ after flight attendant demanded he put headphones over his hearing aids</a>"
8,Canucks’ Evander Kane dines with FBI Director Patel,https://www.ctvnews.ca/video/2025/10/20/canucks-evander-kane-dines-with-fbi-director-patel/,"<a href=""https://www.ctvnews.ca/video/2025/10/20/canucks-evander-kane-dines-with-fbi-director-patel/"">Canucks’ Evander Kane dines with FBI Director Patel</a>"
