rank,Article title,url,title_with_link
1,Man selling pieces of trash from Taylor Swift and Travis Kelce's wedding,https://www.ctvnews.ca/video/2026/07/10/man-selling-pieces-of-trash-collected-outside-madison-square-garden-after-taylor-swifts-wedding/,"<a href=""https://www.ctvnews.ca/video/2026/07/10/man-selling-pieces-of-trash-collected-outside-madison-square-garden-after-taylor-swifts-wedding/"">Man selling pieces of trash from Taylor Swift and Travis Kelce's wedding</a>"
2,Renewed push for information in 25-year-old Ontario woman’s disappearance in 1988,https://www.ctvnews.ca/kitchener/video/2026/07/09/unsolved-519-lois-hanna-disappears-in-lucknow-ont/,"<a href=""https://www.ctvnews.ca/kitchener/video/2026/07/09/unsolved-519-lois-hanna-disappears-in-lucknow-ont/"">Renewed push for information in 25-year-old Ontario woman’s disappearance in 1988</a>"
3,"Elderly woman discharged from hospital, taken by cab to Ontario motel and abandoned",https://www.ctvnews.ca/toronto/video/2026/07/09/elderly-woman-discharged-from-hospital-taken-by-cab-to-bowmanville-motel-and-abandoned/,"<a href=""https://www.ctvnews.ca/toronto/video/2026/07/09/elderly-woman-discharged-from-hospital-taken-by-cab-to-bowmanville-motel-and-abandoned/"">Elderly woman discharged from hospital, taken by cab to Ontario motel and abandoned</a>"
4,Canadian airports warning against AI-generated misinformation,https://www.ctvnews.ca/video/2026/07/09/ctv-national-news-canadian-airports-warning-against-ai-generated-misinformation/,"<a href=""https://www.ctvnews.ca/video/2026/07/09/ctv-national-news-canadian-airports-warning-against-ai-generated-misinformation/"">Canadian airports warning against AI-generated misinformation</a>"
5,"Restoration companies slammed after floods across Ottawa, leaving residents vulnerable",https://www.ctvnews.ca/ottawa/video/2026/07/09/restoration-companies-slammed-after-canada-day-floods/,"<a href=""https://www.ctvnews.ca/ottawa/video/2026/07/09/restoration-companies-slammed-after-canada-day-floods/"">Restoration companies slammed after floods across Ottawa, leaving residents vulnerable</a>"
6,Ontario driver labelled as 'belligerent female' by police fights traffic stop ticket and wins,https://www.ctvnews.ca/toronto/video/2026/07/08/driver-fights-traffic-stop-ticket-and-wins/,"<a href=""https://www.ctvnews.ca/toronto/video/2026/07/08/driver-fights-traffic-stop-ticket-and-wins/"">Ontario driver labelled as 'belligerent female' by police fights traffic stop ticket and wins</a>"
7,'O Canada' played in Saudi Arabia for first time in 26 years. Here's what Mark Carney said,https://www.ctvnews.ca/video/2026/07/09/o-canada-played-in-saudi-arabia-for-first-time-in-26-years-heres-what-mark-carney-said/,"<a href=""https://www.ctvnews.ca/video/2026/07/09/o-canada-played-in-saudi-arabia-for-first-time-in-26-years-heres-what-mark-carney-said/"">'O Canada' played in Saudi Arabia for first time in 26 years. Here's what Mark Carney said</a>"
8,Air Canada flight from L.A. to Montreal veers off runway after landing,https://www.ctvnews.ca/video/2026/07/10/air-canada-flight-from-la-to-montreal-veers-off-runway-after-landing/,"<a href=""https://www.ctvnews.ca/video/2026/07/10/air-canada-flight-from-la-to-montreal-veers-off-runway-after-landing/"">Air Canada flight from L.A. to Montreal veers off runway after landing</a>"
