rank,Article title,url,title_with_link
1,Canada faces second-worst wildfire season on record,https://www.ctvnews.ca/video/2025/08/13/ctv-national-news-canada-faces-second-worst-wildfire-season-on-record/,"<a href=""https://www.ctvnews.ca/video/2025/08/13/ctv-national-news-canada-faces-second-worst-wildfire-season-on-record/"">Canada faces second-worst wildfire season on record</a>"
2,"Rare Vancouver Island wildfire threatens homes, cuts power",https://www.ctvnews.ca/video/2025/08/13/ctv-national-news-rare-vancouver-island-wildfire-threatens-homes-cuts-power/,"<a href=""https://www.ctvnews.ca/video/2025/08/13/ctv-national-news-rare-vancouver-island-wildfire-threatens-homes-cuts-power/"">Rare Vancouver Island wildfire threatens homes, cuts power</a>"
3,Ottawa pushes back on China’s canola tariffs,https://www.ctvnews.ca/video/2025/08/13/ctv-national-news-ottawa-pushes-back-on-chinas-canola-tariffs/,"<a href=""https://www.ctvnews.ca/video/2025/08/13/ctv-national-news-ottawa-pushes-back-on-chinas-canola-tariffs/"">Ottawa pushes back on China’s canola tariffs</a>"
4,Ottawa fast-tracks energy projects amid climate policy questions,https://www.ctvnews.ca/video/2025/08/13/ctv-national-news-ottawa-fast-tracks-energy-projects-amid-climate-policy-questions/,"<a href=""https://www.ctvnews.ca/video/2025/08/13/ctv-national-news-ottawa-fast-tracks-energy-projects-amid-climate-policy-questions/"">Ottawa fast-tracks energy projects amid climate policy questions</a>"
5,Low water levels stall cargo ship near Montreal,https://www.ctvnews.ca/video/2025/08/13/ctv-national-news-low-water-levels-stall-cargo-ship-near-montreal/,"<a href=""https://www.ctvnews.ca/video/2025/08/13/ctv-national-news-low-water-levels-stall-cargo-ship-near-montreal/"">Low water levels stall cargo ship near Montreal</a>"
6,Teen in deadly crash appears in court,https://www.ctvnews.ca/video/2025/08/13/ctv-national-news-teen-in-deadly-crash-appears-in-court/,"<a href=""https://www.ctvnews.ca/video/2025/08/13/ctv-national-news-teen-in-deadly-crash-appears-in-court/"">Teen in deadly crash appears in court</a>"
7,Meteor shower set to light up night sky,https://www.ctvnews.ca/video/2025/08/13/ctv-national-news-meteor-shower-set-to-light-up-night-sky/,"<a href=""https://www.ctvnews.ca/video/2025/08/13/ctv-national-news-meteor-shower-set-to-light-up-night-sky/"">Meteor shower set to light up night sky</a>"
8,Caught on camera: Dump truck tears through Ottawa neighbourhood,https://www.ctvnews.ca/ottawa/video/2025/08/12/caught-on-camera-dump-truck-tears-through-ottawa-neighbourhood/,"<a href=""https://www.ctvnews.ca/ottawa/video/2025/08/12/caught-on-camera-dump-truck-tears-through-ottawa-neighbourhood/"">Caught on camera: Dump truck tears through Ottawa neighbourhood</a>"
