rank,Article title,url,title_with_link
1,CTV National News: Evacuees in Atlantic Canada unsure when they can return home,https://www.ctvnews.ca/video/2025/08/14/ctv-national-news-evacuees-in-atlantic-canada-unsure-when-they-can-return-home/,"<a href=""https://www.ctvnews.ca/video/2025/08/14/ctv-national-news-evacuees-in-atlantic-canada-unsure-when-they-can-return-home/"">CTV National News: Evacuees in Atlantic Canada unsure when they can return home</a>"
2,"CTV National News: CUPE says Air Canada attendants earn less than minimum wage, airline disagrees",https://www.ctvnews.ca/video/2025/08/14/ctv-national-news-cupe-says-air-canada-attendants-earn-less-than-minimum-wage-airline-disagrees/,"<a href=""https://www.ctvnews.ca/video/2025/08/14/ctv-national-news-cupe-says-air-canada-attendants-earn-less-than-minimum-wage-airline-disagrees/"">CTV National News: CUPE says Air Canada attendants earn less than minimum wage, airline disagrees</a>"
3,"CUPE claims latest offer was ‘more than fair,’ urges Air Canada to return to bargaining table",https://www.ctvnews.ca/video/2025/08/14/cupe-claims-latest-offer-was-more-than-fair-urges-air-canada-to-return-to-bargaining-table/,"<a href=""https://www.ctvnews.ca/video/2025/08/14/cupe-claims-latest-offer-was-more-than-fair-urges-air-canada-to-return-to-bargaining-table/"">CUPE claims latest offer was ‘more than fair,’ urges Air Canada to return to bargaining table</a>"
4,'It is an unnerving time’: Port Alberni Mayor on wildfire’s impact on community,https://www.ctvnews.ca/video/2025/08/14/it-is-an-unnerving-time-port-alberni-mayor-on-wildfires-impact-on-community/,"<a href=""https://www.ctvnews.ca/video/2025/08/14/it-is-an-unnerving-time-port-alberni-mayor-on-wildfires-impact-on-community/"">'It is an unnerving time’: Port Alberni Mayor on wildfire’s impact on community</a>"
5,N.S. wildfire grows from 30 to 300 hectares; forces evacuations,https://www.ctvnews.ca/atlantic/video/2025/08/14/ns-wildfire-forces-evacuations/,"<a href=""https://www.ctvnews.ca/atlantic/video/2025/08/14/ns-wildfire-forces-evacuations/"">N.S. wildfire grows from 30 to 300 hectares; forces evacuations</a>"
6,‘Time to put Canadians back in the driver’s seat’: Poilievre hopes to end gas-powered vehicle ban,https://www.ctvnews.ca/video/2025/08/14/time-to-put-canadians-back-in-the-drivers-seat-poilievre-hopes-to-end-gas-powered-vehicle-ban/,"<a href=""https://www.ctvnews.ca/video/2025/08/14/time-to-put-canadians-back-in-the-drivers-seat-poilievre-hopes-to-end-gas-powered-vehicle-ban/"">‘Time to put Canadians back in the driver’s seat’: Poilievre hopes to end gas-powered vehicle ban</a>"
7,Ont. Premier Ford slams Campbell's for 'misleading the people' with soup labels,https://www.ctvnews.ca/video/2025/08/14/ont-premier-ford-slams-campbells-for-misleading-the-people-with-soup-labels/,"<a href=""https://www.ctvnews.ca/video/2025/08/14/ont-premier-ford-slams-campbells-for-misleading-the-people-with-soup-labels/"">Ont. Premier Ford slams Campbell's for 'misleading the people' with soup labels</a>"
8,Air Canada interrupted by flight attendants during press conference,https://www.ctvnews.ca/video/2025/08/14/air-canada-interrupted-by-flight-attendants-during-press-conference/,"<a href=""https://www.ctvnews.ca/video/2025/08/14/air-canada-interrupted-by-flight-attendants-during-press-conference/"">Air Canada interrupted by flight attendants during press conference</a>"
