rank,Article title,url,title_with_link
1,"CTV News in Mexico: At least 73 people killed, including 25 National Guard members, in Mexico",https://www.ctvnews.ca/video/2026/02/24/ctv-news-in-mexico-at-least-73-people-killed-including-25-national-guard-members-in-mexico/,"<a href=""https://www.ctvnews.ca/video/2026/02/24/ctv-news-in-mexico-at-least-73-people-killed-including-25-national-guard-members-in-mexico/"">CTV News in Mexico: At least 73 people killed, including 25 National Guard members, in Mexico</a>"
2,'They got what they deserved and we got what we deserved': Brad Jacobs on stone touching controversy,https://www.ctvnews.ca/video/2026/02/24/they-got-what-they-deserved-and-we-got-what-we-deserved-brad-jacobs-on-stone-touching-controversy/,"<a href=""https://www.ctvnews.ca/video/2026/02/24/they-got-what-they-deserved-and-we-got-what-we-deserved-brad-jacobs-on-stone-touching-controversy/"">'They got what they deserved and we got what we deserved': Brad Jacobs on stone touching controversy</a>"
3,Some Canadians head for vacation in Mexico despite travel alert,https://www.ctvnews.ca/video/2026/02/24/ctv-national-news-some-canadians-head-for-vacation-in-mexico-despite-travel-alert/,"<a href=""https://www.ctvnews.ca/video/2026/02/24/ctv-national-news-some-canadians-head-for-vacation-in-mexico-despite-travel-alert/"">Some Canadians head for vacation in Mexico despite travel alert</a>"
4,Ambassador Bridge owner donates money to block Gordie Howe Bridge opening,https://www.ctvnews.ca/windsor/video/2026/02/23/ambassador-bridge-owner-donates-money-to-block-gordie-howe-bridge-opening/,"<a href=""https://www.ctvnews.ca/windsor/video/2026/02/23/ambassador-bridge-owner-donates-money-to-block-gordie-howe-bridge-opening/"">Ambassador Bridge owner donates money to block Gordie Howe Bridge opening</a>"
5,Trump’s latest tariff threat garners worldwide pushback,https://www.ctvnews.ca/video/2026/02/23/ctv-national-news-trumps-latest-tariff-threat-garners-worldwide-pushback/,"<a href=""https://www.ctvnews.ca/video/2026/02/23/ctv-national-news-trumps-latest-tariff-threat-garners-worldwide-pushback/"">Trump’s latest tariff threat garners worldwide pushback</a>"
6,CTV News in Mexico: Chaos erupts in Puerto Vallarta following killing of cartel kingpin ‘El Mencho’,https://www.ctvnews.ca/video/2026/02/23/ctv-news-in-mexico-chaos-erupts-in-puerto-vallarta-following-killing-of-cartel-kingpin-el-mencho/,"<a href=""https://www.ctvnews.ca/video/2026/02/23/ctv-news-in-mexico-chaos-erupts-in-puerto-vallarta-following-killing-of-cartel-kingpin-el-mencho/"">CTV News in Mexico: Chaos erupts in Puerto Vallarta following killing of cartel kingpin ‘El Mencho’</a>"
7,Loblaws announces big expansion plans across Canada,https://www.ctvnews.ca/video/2026/02/23/ctv-national-news-loblaws-announces-big-expansion-plans-across-canada/,"<a href=""https://www.ctvnews.ca/video/2026/02/23/ctv-national-news-loblaws-announces-big-expansion-plans-across-canada/"">Loblaws announces big expansion plans across Canada</a>"
8,‘The biggest mistake is accepting a refund’: Passenger advocate warns stranded travellers in Mexico,https://www.ctvnews.ca/video/2026/02/24/the-biggest-mistake-is-accepting-a-refund-passenger-advocate-warns-stranded-travellers-in-mexico/,"<a href=""https://www.ctvnews.ca/video/2026/02/24/the-biggest-mistake-is-accepting-a-refund-passenger-advocate-warns-stranded-travellers-in-mexico/"">‘The biggest mistake is accepting a refund’: Passenger advocate warns stranded travellers in Mexico</a>"
