rank,Article title,url,title_with_link
1,Wild video shows robbery suspect stopped by onlooker at Oshawa mall,https://www.ctvnews.ca/toronto/video/2026/03/30/wild-video-shows-robbery-suspect-stopped-by-onlooker-at-oshawa-mall/,"<a href=""https://www.ctvnews.ca/toronto/video/2026/03/30/wild-video-shows-robbery-suspect-stopped-by-onlooker-at-oshawa-mall/"">Wild video shows robbery suspect stopped by onlooker at Oshawa mall</a>"
2,Chaotic scene as smash-and-grab robbery suspects flee police in Oshawa,https://www.ctvnews.ca/toronto/video/2026/03/30/chaotic-scene-as-smash-and-grab-robbery-suspects-flee-police-in-oshawa/,"<a href=""https://www.ctvnews.ca/toronto/video/2026/03/30/chaotic-scene-as-smash-and-grab-robbery-suspects-flee-police-in-oshawa/"">Chaotic scene as smash-and-grab robbery suspects flee police in Oshawa</a>"
3,Canada goose causes chaos at Wilfrid Laurier University campus Starbucks,https://www.ctvnews.ca/toronto/video/2026/03/30/canada-goose-causes-chaos-at-wilfrid-laurier-university-campus-starbucks/,"<a href=""https://www.ctvnews.ca/toronto/video/2026/03/30/canada-goose-causes-chaos-at-wilfrid-laurier-university-campus-starbucks/"">Canada goose causes chaos at Wilfrid Laurier University campus Starbucks</a>"
4,"Aerial view of zig-zag train derailment in St. Catharines, Ontario",https://www.ctvnews.ca/toronto/video/2026/03/30/aerial-view-of-zig-zag-train-derailment-in-st-catharines-ontario/,"<a href=""https://www.ctvnews.ca/toronto/video/2026/03/30/aerial-view-of-zig-zag-train-derailment-in-st-catharines-ontario/"">Aerial view of zig-zag train derailment in St. Catharines, Ontario</a>"
5,'This isn't gonna turn me into a Liberal?' Premier Ford jokes about drinking PM Carney's water,https://www.ctvnews.ca/video/2026/03/30/this-isnt-gonna-turn-me-into-a-liberal-premier-ford-jokes-about-drinking-pm-carneys-water/,"<a href=""https://www.ctvnews.ca/video/2026/03/30/this-isnt-gonna-turn-me-into-a-liberal-premier-ford-jokes-about-drinking-pm-carneys-water/"">'This isn't gonna turn me into a Liberal?' Premier Ford jokes about drinking PM Carney's water</a>"
6,OPP investigate 'extremely dangerous' wrong-way driver on Highway 403 in Ontario,https://www.ctvnews.ca/kitchener/video/2026/03/29/wrong-way-driver-caught-on-camera/,"<a href=""https://www.ctvnews.ca/kitchener/video/2026/03/29/wrong-way-driver-caught-on-camera/"">OPP investigate 'extremely dangerous' wrong-way driver on Highway 403 in Ontario</a>"
7,‘We’re seeing some promise here’: Several vessels granted access to move through Strait of Hormuz,https://www.ctvnews.ca/video/2026/03/30/were-seeing-some-promise-here-several-vessels-granted-access-to-move-through-strait-of-hormuz/,"<a href=""https://www.ctvnews.ca/video/2026/03/30/were-seeing-some-promise-here-several-vessels-granted-access-to-move-through-strait-of-hormuz/"">‘We’re seeing some promise here’: Several vessels granted access to move through Strait of Hormuz</a>"
8,New Canada-Ontario housing deal is ‘very good public policy’: Moore,https://www.ctvnews.ca/video/2026/03/30/new-canada-ontario-housing-deal-is-very-good-public-policy-moore/,"<a href=""https://www.ctvnews.ca/video/2026/03/30/new-canada-ontario-housing-deal-is-very-good-public-policy-moore/"">New Canada-Ontario housing deal is ‘very good public policy’: Moore</a>"
