rank,Article title,url,title_with_link
1,Major flooding in Eastern Ontario and Quebec,https://www.ctvnews.ca/video/2026/04/20/major-flooding-in-eastern-ontario-and-quebec/,"<a href=""https://www.ctvnews.ca/video/2026/04/20/major-flooding-in-eastern-ontario-and-quebec/"">Major flooding in Eastern Ontario and Quebec</a>"
2,Rising water puts Montreal communities on alert,https://www.ctvnews.ca/montreal/video/2026/04/19/rising-water-puts-montreal-communities-on-alert/,"<a href=""https://www.ctvnews.ca/montreal/video/2026/04/19/rising-water-puts-montreal-communities-on-alert/"">Rising water puts Montreal communities on alert</a>"
3,‘The U.S. has changed and we must respond’: Carney talks U.S. ties in address to Canadians,https://www.ctvnews.ca/video/2026/04/19/the-us-has-changed-and-we-must-respond-carney-talks-us-ties-in-address-to-canadians/,"<a href=""https://www.ctvnews.ca/video/2026/04/19/the-us-has-changed-and-we-must-respond-carney-talks-us-ties-in-address-to-canadians/"">‘The U.S. has changed and we must respond’: Carney talks U.S. ties in address to Canadians</a>"
4,Doug Ford announces Ontario will move to sell newly acquired jet following backlash,https://www.ctvnews.ca/toronto/video/2026/04/19/doug-ford-announces-ontario-will-move-to-sell-newly-acquired-jet-following-backlash/,"<a href=""https://www.ctvnews.ca/toronto/video/2026/04/19/doug-ford-announces-ontario-will-move-to-sell-newly-acquired-jet-following-backlash/"">Doug Ford announces Ontario will move to sell newly acquired jet following backlash</a>"
5,Police describe ‘incredibly gruesome’ mass shooting in Louisiana,https://www.ctvnews.ca/video/2026/04/20/ctv-national-news-police-describe-incredibly-gruesome-mass-shooting-in-louisiana/,"<a href=""https://www.ctvnews.ca/video/2026/04/20/ctv-national-news-police-describe-incredibly-gruesome-mass-shooting-in-louisiana/"">Police describe ‘incredibly gruesome’ mass shooting in Louisiana</a>"
6,Trump makes new threats against Iran on social media,https://www.ctvnews.ca/video/2026/04/20/ctv-national-news-trump-makes-new-threats-against-iran-on-social-media/,"<a href=""https://www.ctvnews.ca/video/2026/04/20/ctv-national-news-trump-makes-new-threats-against-iran-on-social-media/"">Trump makes new threats against Iran on social media</a>"
7,Bullying leads to massive school absences for students in P.E.I.,https://www.ctvnews.ca/video/2026/04/20/ctv-national-news-bullying-leads-to-massive-school-absences-for-students-in-pei/,"<a href=""https://www.ctvnews.ca/video/2026/04/20/ctv-national-news-bullying-leads-to-massive-school-absences-for-students-in-pei/"">Bullying leads to massive school absences for students in P.E.I.</a>"
8,Canada is ‘in the 30 per cent zone’ of a recession: former governor of the BOC,https://www.ctvnews.ca/video/2026/04/19/ctv-qp-canada-is-in-the-30-per-cent-zone-of-a-recession-former-governor-of-the-boc/,"<a href=""https://www.ctvnews.ca/video/2026/04/19/ctv-qp-canada-is-in-the-30-per-cent-zone-of-a-recession-former-governor-of-the-boc/"">Canada is ‘in the 30 per cent zone’ of a recession: former governor of the BOC</a>"
