Rank,Article title,url,Byline,Article type,title_with_link
1,Canadian warship transits Taiwan Strait despite China’s warning,https://www.theglobeandmail.com/politics/article-hmcs-charlottetown-canadian-warship-taiwan-strait/,No byline found,No article type found,"<a href=""https://www.theglobeandmail.com/politics/article-hmcs-charlottetown-canadian-warship-taiwan-strait/"">Canadian warship transits Taiwan Strait despite China’s warning</a>"
2,"In the vital trucking sector, weak oversight is leaving Canada’s workers unprotected and unsafe",https://www.theglobeandmail.com/canada/article-trucking-industry-drivers-canada-investigation/,No byline found,No article type found,"<a href=""https://www.theglobeandmail.com/canada/article-trucking-industry-drivers-canada-investigation/"">In the vital trucking sector, weak oversight is leaving Canada’s workers unprotected and unsafe</a>"
3,Supreme Court of Canada won’t hear appeal of Aboriginal title case in New Brunswick,https://www.theglobeandmail.com/canada/article-supreme-court-of-canada-wont-hear-appeal-of-aboriginal-title-case-in/,No byline found,No article type found,"<a href=""https://www.theglobeandmail.com/canada/article-supreme-court-of-canada-wont-hear-appeal-of-aboriginal-title-case-in/"">Supreme Court of Canada won’t hear appeal of Aboriginal title case in New Brunswick</a>"
4,Lip liner is making a comeback. Here’s how to wear it in 2026,https://www.theglobeandmail.com/life/style/fashion-and-beauty/article-lip-liner-makeup-fashion/,No byline found,No article type found,"<a href=""https://www.theglobeandmail.com/life/style/fashion-and-beauty/article-lip-liner-makeup-fashion/"">Lip liner is making a comeback. Here’s how to wear it in 2026</a>"
5,"Mother of infant found dead has also died, Halifax police say",https://www.theglobeandmail.com/canada/article-missing-newborn-halifax-nova-scotia/,No byline found,No article type found,"<a href=""https://www.theglobeandmail.com/canada/article-missing-newborn-halifax-nova-scotia/"">Mother of infant found dead has also died, Halifax police say</a>"
6,When your side hustle loses money – and the CRA comes knocking,https://www.theglobeandmail.com/investing/personal-finance/taxes/article-side-hustle-cra-tax-return-business/,Tim Cestnick,Opinion,"<a href=""https://www.theglobeandmail.com/investing/personal-finance/taxes/article-side-hustle-cra-tax-return-business/"">When your side hustle loses money – and the CRA comes knocking</a>"
7,"U.S. consumers are seeing prices climb, and not just for fuel",https://www.theglobeandmail.com/business/article-decoder-us-prices-inflation-energy-food-tariffs-ai/,No byline found,No article type found,"<a href=""https://www.theglobeandmail.com/business/article-decoder-us-prices-inflation-energy-food-tariffs-ai/"">U.S. consumers are seeing prices climb, and not just for fuel</a>"
8,Building resilience against Alzheimer’s disease,https://www.theglobeandmail.com/canada/article-alzheimers-disease-resilience-health-advice/,No byline found,No article type found,"<a href=""https://www.theglobeandmail.com/canada/article-alzheimers-disease-resilience-health-advice/"">Building resilience against Alzheimer’s disease</a>"
