Rank,Article title,url,Byline,Article type,title_with_link
1,Toronto man poised to become the first Canadian cured of HIV,https://www.theglobeandmail.com/canada/article-toronto-man-poised-to-become-the-first-canadian-cured-of-hiv/,No byline found,No article type found,"<a href=""https://www.theglobeandmail.com/canada/article-toronto-man-poised-to-become-the-first-canadian-cured-of-hiv/"">Toronto man poised to become the first Canadian cured of HIV</a>"
2,News To Me – Air Force None,https://www.theglobeandmail.com/opinion/article-news-to-me-air-force-none/,Gabrielle Drolet,Opinion,"<a href=""https://www.theglobeandmail.com/opinion/article-news-to-me-air-force-none/"">News To Me – Air Force None</a>"
3,Home of the week: ‘Every child’s drawing of a house’ near Georgian Bay,https://www.theglobeandmail.com/real-estate/article-georgian-bay-stone-cottage-meaford-ontario-home-of-the-week/,No byline found,No article type found,"<a href=""https://www.theglobeandmail.com/real-estate/article-georgian-bay-stone-cottage-meaford-ontario-home-of-the-week/"">Home of the week: ‘Every child’s drawing of a house’ near Georgian Bay</a>"
4,"Trump safe after shots fired at White House correspondents’ dinner, suspected gunman detained",https://www.theglobeandmail.com/world/us-politics/article-trump-safe-after-security-incident-at-white-house-correspondents/,No byline found,No article type found,"<a href=""https://www.theglobeandmail.com/world/us-politics/article-trump-safe-after-security-incident-at-white-house-correspondents/"">Trump safe after shots fired at White House correspondents’ dinner, suspected gunman detained</a>"
5,The swoon boom: Meet the business-savvy smut-mongers of the Great Hot North,https://www.theglobeandmail.com/business/rob-magazine/article-the-swoon-boom-meet-the-business-savvy-smut-mongers-of-the-great-hot/,No byline found,No article type found,"<a href=""https://www.theglobeandmail.com/business/rob-magazine/article-the-swoon-boom-meet-the-business-savvy-smut-mongers-of-the-great-hot/"">The swoon boom: Meet the business-savvy smut-mongers of the Great Hot North</a>"
6,How a postcard helped curb absentee rates at a Northern Ontario school board,https://www.theglobeandmail.com/canada/article-how-a-postcard-helped-curb-absentee-rates-at-a-northern-ontario-school/,No byline found,No article type found,"<a href=""https://www.theglobeandmail.com/canada/article-how-a-postcard-helped-curb-absentee-rates-at-a-northern-ontario-school/"">How a postcard helped curb absentee rates at a Northern Ontario school board</a>"
7,Mexico says U.S. agents killed in car crash weren’t authorized to participate in local operation,https://www.theglobeandmail.com/world/article-mexico-says-us-agents-killed-in-car-crash-werent-authorized-to/,No byline found,No article type found,"<a href=""https://www.theglobeandmail.com/world/article-mexico-says-us-agents-killed-in-car-crash-werent-authorized-to/"">Mexico says U.S. agents killed in car crash weren’t authorized to participate in local operation</a>"
8,What Iran has taught Canada about negotiating with Trump,https://www.theglobeandmail.com/business/commentary/article-iran-war-trump-carney-trade-usmca-negotiation/,Tony Keller,Opinion,"<a href=""https://www.theglobeandmail.com/business/commentary/article-iran-war-trump-carney-trade-usmca-negotiation/"">What Iran has taught Canada about negotiating with Trump</a>"
