Rank,Article title,url,Byline,Article type,title_with_link
1,"As Israeli ground invasion launches, Palestinians in Gaza City say they’re trapped or fleeing on unsafe roads",https://www.theglobeandmail.com/world/article-israel-invasion-gaza-city-population-flees/,No byline found,No article type found,"<a href=""https://www.theglobeandmail.com/world/article-israel-invasion-gaza-city-population-flees/"">As Israeli ground invasion launches, Palestinians in Gaza City say they’re trapped or fleeing on unsafe roads</a>"
2,Britain prepares for Trump’s arrival with pomp and protests,https://www.theglobeandmail.com/world/article-trump-state-visit-to-britain/,No byline found,No article type found,"<a href=""https://www.theglobeandmail.com/world/article-trump-state-visit-to-britain/"">Britain prepares for Trump’s arrival with pomp and protests</a>"
3,Mark Carney tries to win the Cup ... after the parade,https://www.theglobeandmail.com/opinion/editorials/article-mark-carney-tries-to-win-the-cup-after-the-parade/,No byline found,No article type found,"<a href=""https://www.theglobeandmail.com/opinion/editorials/article-mark-carney-tries-to-win-the-cup-after-the-parade/"">Mark Carney tries to win the Cup ... after the parade</a>"
4,"Neil Young is getting an 80th birthday party at Massey Hall, with a homegrown tribute concert",https://www.theglobeandmail.com/arts/music/article-neil-young-toronto-massey-hall-birthday-music/,No byline found,No article type found,"<a href=""https://www.theglobeandmail.com/arts/music/article-neil-young-toronto-massey-hall-birthday-music/"">Neil Young is getting an 80th birthday party at Massey Hall, with a homegrown tribute concert</a>"
5,Joly says Anglo American promises around Teck takeover don’t go far enough,https://www.theglobeandmail.com/business/article-melanie-joly-teck-resources-anglo-american-mining-takeover/,No byline found,No article type found,"<a href=""https://www.theglobeandmail.com/business/article-melanie-joly-teck-resources-anglo-american-mining-takeover/"">Joly says Anglo American promises around Teck takeover don’t go far enough</a>"
6,"Carney, Poilievre face off for first time in Parliament",https://www.theglobeandmail.com/politics/article-carney-poilievre-parliament-return/,No byline found,No article type found,"<a href=""https://www.theglobeandmail.com/politics/article-carney-poilievre-parliament-return/"">Carney, Poilievre face off for first time in Parliament</a>"
7,Will Charlie Kirk’s death be a turning point for America?,https://www.theglobeandmail.com/world/us-politics/article-charlie-kirk-turning-point-usa-republicans-democrats/,No byline found,Analysis,"<a href=""https://www.theglobeandmail.com/world/us-politics/article-charlie-kirk-turning-point-usa-republicans-democrats/"">Will Charlie Kirk’s death be a turning point for America?</a>"
8,"August inflation rate ticks up to 1.9%, rising less than expected",https://www.theglobeandmail.com/business/article-august-inflation-canada-interest-rates/,No byline found,No article type found,"<a href=""https://www.theglobeandmail.com/business/article-august-inflation-canada-interest-rates/"">August inflation rate ticks up to 1.9%, rising less than expected</a>"
