Rank,Article title,url,Byline,Article type,title_with_link
1,Popeyes franchises shut down over unpaid wages placed into receivership,https://www.theglobeandmail.com/business/article-popeyes-ontario-shut-down-unpaid-wages-lawsuit-unsafe-chicken/,No byline found,No article type found,"<a href=""https://www.theglobeandmail.com/business/article-popeyes-ontario-shut-down-unpaid-wages-lawsuit-unsafe-chicken/"">Popeyes franchises shut down over unpaid wages placed into receivership</a>"
2,JPMorgan plots expansion into banking for Canadian tech firms,https://www.theglobeandmail.com/business/technology/article-jpmorgan-technology-banking-innovation-economy-managing-director/,No byline found,No article type found,"<a href=""https://www.theglobeandmail.com/business/technology/article-jpmorgan-technology-banking-innovation-economy-managing-director/"">JPMorgan plots expansion into banking for Canadian tech firms</a>"
3,"Should recently widowed Curtis, 55, draw from RRSPs before tapping into taxable investments?",https://www.theglobeandmail.com/investing/personal-finance/financial-facelift/article-rrsps-financial-investments-early-retirement/,No byline found,No article type found,"<a href=""https://www.theglobeandmail.com/investing/personal-finance/financial-facelift/article-rrsps-financial-investments-early-retirement/"">Should recently widowed Curtis, 55, draw from RRSPs before tapping into taxable investments?</a>"
4,The bitter truth is that cheaper housing means a retirement crisis for homeowners,https://www.theglobeandmail.com/business/commentary/article-housing-prices-retirement-plan-middle-class/,John Turley-Ewart,Opinion,"<a href=""https://www.theglobeandmail.com/business/commentary/article-housing-prices-retirement-plan-middle-class/"">The bitter truth is that cheaper housing means a retirement crisis for homeowners</a>"
5,Where is Canada’s leverage in trade talks with Trump?,https://www.theglobeandmail.com/opinion/article-canada-leverage-mark-carney-donald-trump-trade-tariffs/,Fen Osler Hampson,Opinion,"<a href=""https://www.theglobeandmail.com/opinion/article-canada-leverage-mark-carney-donald-trump-trade-tariffs/"">Where is Canada’s leverage in trade talks with Trump?</a>"
6,The story behind the Blue Jays’ bedazzled home run jacket,https://www.theglobeandmail.com/life/style/article-blue-jays-world-series-home-run-jacket-origin-story/,No byline found,No article type found,"<a href=""https://www.theglobeandmail.com/life/style/article-blue-jays-world-series-home-run-jacket-origin-story/"">The story behind the Blue Jays’ bedazzled home run jacket</a>"
7,Pentagon accepts anonymous $130-million donation to pay military during government shutdown,https://www.theglobeandmail.com/world/us-politics/article-pentagon-donation-shutdown-military-donald-trump-anonymous/,No byline found,No article type found,"<a href=""https://www.theglobeandmail.com/world/us-politics/article-pentagon-donation-shutdown-military-donald-trump-anonymous/"">Pentagon accepts anonymous $130-million donation to pay military during government shutdown</a>"
8,Fixed mortgage rates are dropping after months of stagnancy,https://www.theglobeandmail.com/investing/personal-finance/article-fixed-mortgage-rates-are-dropping-after-months-of-stagnancy/,No byline found,No article type found,"<a href=""https://www.theglobeandmail.com/investing/personal-finance/article-fixed-mortgage-rates-are-dropping-after-months-of-stagnancy/"">Fixed mortgage rates are dropping after months of stagnancy</a>"
