Rank,Article title,url,Byline,Article type,title_with_link
1,"Even in close-knit families, caring for aging parents takes its toll on sibling relationships",https://www.theglobeandmail.com/investing/personal-finance/retirement/article-aging-parents-caregiving-sibling-conflict-relationships-family/,No byline found,No article type found,"<a href=""https://www.theglobeandmail.com/investing/personal-finance/retirement/article-aging-parents-caregiving-sibling-conflict-relationships-family/"">Even in close-knit families, caring for aging parents takes its toll on sibling relationships</a>"
2,Italy’s Stelvio ski run will keep Olympians on their toes – or shaking in their boots,https://www.theglobeandmail.com/sports/article-milan-olympics-stelvio-ski-race/,No byline found,No article type found,"<a href=""https://www.theglobeandmail.com/sports/article-milan-olympics-stelvio-ski-race/"">Italy’s Stelvio ski run will keep Olympians on their toes – or shaking in their boots</a>"
3,How would Trump behave differently if he was legitimately losing his mind?,https://www.theglobeandmail.com/opinion/article-donald-trump-behaviour-cognitive-decline/,Robyn Urback,Opinion,"<a href=""https://www.theglobeandmail.com/opinion/article-donald-trump-behaviour-cognitive-decline/"">How would Trump behave differently if he was legitimately losing his mind?</a>"
4,Here are the U.S. military assets being deployed to the Middle East,https://www.theglobeandmail.com/world/article-us-military-assets-aircraft-carrier-iran-middle-east-donald-trump/,No byline found,No article type found,"<a href=""https://www.theglobeandmail.com/world/article-us-military-assets-aircraft-carrier-iran-middle-east-donald-trump/"">Here are the U.S. military assets being deployed to the Middle East</a>"
5,"Left and right, Minnesotans look for a way out of chaos",https://www.theglobeandmail.com/world/us-politics/article-minnesota-chaos-immigration-raids-trump/,No byline found,No article type found,"<a href=""https://www.theglobeandmail.com/world/us-politics/article-minnesota-chaos-immigration-raids-trump/"">Left and right, Minnesotans look for a way out of chaos</a>"
6,U.S. trade policy toward Canada is far more restrictive than tariff rates suggest,https://www.theglobeandmail.com/business/article-us-trade-policy-canada-tariffs-usmca-restrictive/,No byline found,No article type found,"<a href=""https://www.theglobeandmail.com/business/article-us-trade-policy-canada-tariffs-usmca-restrictive/"">U.S. trade policy toward Canada is far more restrictive than tariff rates suggest</a>"
7,CPP payments slow in 2026 as retirees cope with high living costs,https://www.theglobeandmail.com/investing/personal-finance/retirement/article-cpp-payments-2026-retirement-cost-of-living-pension/,No byline found,No article type found,"<a href=""https://www.theglobeandmail.com/investing/personal-finance/retirement/article-cpp-payments-2026-retirement-cost-of-living-pension/"">CPP payments slow in 2026 as retirees cope with high living costs</a>"
8,Canadian fugitive Ryan Wedding arrested in Mexico,https://www.theglobeandmail.com/canada/article-ryan-wedding-arrest-fbi-most-wanted/,No byline found,No article type found,"<a href=""https://www.theglobeandmail.com/canada/article-ryan-wedding-arrest-fbi-most-wanted/"">Canadian fugitive Ryan Wedding arrested in Mexico</a>"
