Rank,Article title,url,Byline,Article type,title_with_link
1,How many donations have poured in to repair 24 Sussex so far? Take our business and investing news quiz,https://www.theglobeandmail.com/business/article-24-sussex-gdp-usmca-donald-trump-gander-business-quiz-july-3/,No byline found,No article type found,"<a href=""https://www.theglobeandmail.com/business/article-24-sussex-gdp-usmca-donald-trump-gander-business-quiz-july-3/"">How many donations have poured in to repair 24 Sussex so far? Take our business and investing news quiz</a>"
2,Condo developers are offering big discounts in exchange for signing NDAs,https://www.theglobeandmail.com/investing/personal-finance/article-condo-prices-ndas-discount-sales-developers-real-estate/,No byline found,No article type found,"<a href=""https://www.theglobeandmail.com/investing/personal-finance/article-condo-prices-ndas-discount-sales-developers-real-estate/"">Condo developers are offering big discounts in exchange for signing NDAs</a>"
3,Ontario dancer Ariel Hyatt goes viral for blending Canadian step-dancing with heavy metal hits,https://www.theglobeandmail.com/culture/article-ontario-dancer-ariel-hyatt-step-dancing-heavy-metal/,No byline found,No article type found,"<a href=""https://www.theglobeandmail.com/culture/article-ontario-dancer-ariel-hyatt-step-dancing-heavy-metal/"">Ontario dancer Ariel Hyatt goes viral for blending Canadian step-dancing with heavy metal hits</a>"
4,How a retired couple started a bakery on a small B.C. island,https://www.theglobeandmail.com/investing/personal-finance/retirement/article-how-a-retired-couple-started-a-bakery-on-a-small-bc-island/,No byline found,No article type found,"<a href=""https://www.theglobeandmail.com/investing/personal-finance/retirement/article-how-a-retired-couple-started-a-bakery-on-a-small-bc-island/"">How a retired couple started a bakery on a small B.C. island</a>"
5,"On its 250th birthday, the United States has turned heel",https://www.theglobeandmail.com/opinion/article-on-its-250th-birthday-the-united-states-has-turned-heel/,Andrew Potter,Opinion,"<a href=""https://www.theglobeandmail.com/opinion/article-on-its-250th-birthday-the-united-states-has-turned-heel/"">On its 250th birthday, the United States has turned heel</a>"
6,Canada World Cup game highlights: Canada’s stunning run comes to an end after 3-0 loss to Morocco,https://www.theglobeandmail.com/sports/soccer/article-canada-vs-morocco-live-updates-score-result-highlights/,No byline found,No article type found,"<a href=""https://www.theglobeandmail.com/sports/soccer/article-canada-vs-morocco-live-updates-score-result-highlights/"">Canada World Cup game highlights: Canada’s stunning run comes to an end after 3-0 loss to Morocco</a>"
7,"Can Murray, 58, and Sylvia, 57, retire and still provide needed support for their kids?",https://www.theglobeandmail.com/investing/personal-finance/financial-facelift/article-financial-facelift-murray-sylvia-retirement-children-finances/,No byline found,No article type found,"<a href=""https://www.theglobeandmail.com/investing/personal-finance/financial-facelift/article-financial-facelift-murray-sylvia-retirement-children-finances/"">Can Murray, 58, and Sylvia, 57, retire and still provide needed support for their kids?</a>"
8,"With both growth engines down, Canada’s economy is adrift",https://www.theglobeandmail.com/investing/markets/inside-the-market/article-canada-labour-productivity-gap-immigration-economy-growth/,No byline found,No article type found,"<a href=""https://www.theglobeandmail.com/investing/markets/inside-the-market/article-canada-labour-productivity-gap-immigration-economy-growth/"">With both growth engines down, Canada’s economy is adrift</a>"
