Rank,Article title,url,Byline,Article type,title_with_link
1,"Beaches bungalow sells for $476,000 over asking",https://www.theglobeandmail.com/real-estate/toronto/article-beaches-bungalow-sells-for-476000-over-asking/,No byline found,No article type found,"<a href=""https://www.theglobeandmail.com/real-estate/toronto/article-beaches-bungalow-sells-for-476000-over-asking/"">Beaches bungalow sells for $476,000 over asking</a>"
2,"Giving thanks with Canadian wine, starting with these eight worthwhile bottles",https://www.theglobeandmail.com/life/style/food-and-drink/article-thanksgiving-canadian-wines/,No byline found,No article type found,"<a href=""https://www.theglobeandmail.com/life/style/food-and-drink/article-thanksgiving-canadian-wines/"">Giving thanks with Canadian wine, starting with these eight worthwhile bottles</a>"
3,Buyer revises bid for Scarborough home after initial offer rejected,https://www.theglobeandmail.com/real-estate/toronto/article-buyer-revises-bid-scarborough-two-storey-home/,No byline found,No article type found,"<a href=""https://www.theglobeandmail.com/real-estate/toronto/article-buyer-revises-bid-scarborough-two-storey-home/"">Buyer revises bid for Scarborough home after initial offer rejected</a>"
4,TD’s new CEO Ray Chun is choosing shareholders over investment bankers,https://www.theglobeandmail.com/business/article-td-ray-chun-chose-shareholders-investment-bankers/,No byline found,Analysis,"<a href=""https://www.theglobeandmail.com/business/article-td-ray-chun-chose-shareholders-investment-bankers/"">TD’s new CEO Ray Chun is choosing shareholders over investment bankers</a>"
5,"For those about to retire, is it better to start CPP in late 2025 or wait until 2026?",https://www.theglobeandmail.com/investing/personal-finance/retirement/article-retirement-planning-when-to-start-cpp/,No byline found,No article type found,"<a href=""https://www.theglobeandmail.com/investing/personal-finance/retirement/article-retirement-planning-when-to-start-cpp/"">For those about to retire, is it better to start CPP in late 2025 or wait until 2026?</a>"
6,"The Liberals push the envelope, finally, at Canada Post",https://www.theglobeandmail.com/opinion/editorials/article-the-liberals-push-the-envelope-finally-at-canada-post/,No byline found,No article type found,"<a href=""https://www.theglobeandmail.com/opinion/editorials/article-the-liberals-push-the-envelope-finally-at-canada-post/"">The Liberals push the envelope, finally, at Canada Post</a>"
7,Their father died and left $6-million to their mother. Here’s how three siblings set a wealth transfer in motion,https://www.theglobeandmail.com/investing/personal-finance/retirement/article-their-father-died-and-left-6-million-to-their-mother-heres-how-three/,No byline found,No article type found,"<a href=""https://www.theglobeandmail.com/investing/personal-finance/retirement/article-their-father-died-and-left-6-million-to-their-mother-heres-how-three/"">Their father died and left $6-million to their mother. Here’s how three siblings set a wealth transfer in motion</a>"
8,"Ontario needs almost $2-billion to make $10-a-day child care a reality, A-G says",https://www.theglobeandmail.com/canada/article-ontario-10-a-day-child-care-2026-auditor-report/,No byline found,No article type found,"<a href=""https://www.theglobeandmail.com/canada/article-ontario-10-a-day-child-care-2026-auditor-report/"">Ontario needs almost $2-billion to make $10-a-day child care a reality, A-G says</a>"
