Rank,Article title,url,Byline,Article type,title_with_link
1,"If the Dodgers had trouble getting out of Pearson, that makes them like the rest of us",https://www.theglobeandmail.com/sports/baseball/article-blue-jays-world-series-dodgers-travel-dave-roberts/,Cathal Kelly,Opinion,"<a href=""https://www.theglobeandmail.com/sports/baseball/article-blue-jays-world-series-dodgers-travel-dave-roberts/"">If the Dodgers had trouble getting out of Pearson, that makes them like the rest of us</a>"
2,"Carney saw Reagan anti-tariff ad before it aired, Ford says",https://www.theglobeandmail.com/canada/article-doug-ford-defends-ontario-tariff-reagan-ad/,No byline found,No article type found,"<a href=""https://www.theglobeandmail.com/canada/article-doug-ford-defends-ontario-tariff-reagan-ad/"">Carney saw Reagan anti-tariff ad before it aired, Ford says</a>"
3,"Massacres under way in Darfur after militia captures besieged city, reports say",https://www.theglobeandmail.com/world/article-massacres-under-way-in-darfur-after-militia-captures-besieged-city/,No byline found,No article type found,"<a href=""https://www.theglobeandmail.com/world/article-massacres-under-way-in-darfur-after-militia-captures-besieged-city/"">Massacres under way in Darfur after militia captures besieged city, reports say</a>"
4,Health Canada approves drug that slows progression of Alzheimer’s disease,https://www.theglobeandmail.com/canada/article-health-canada-approves-lecanemab-leqembi-alzheimers-disease-medication/,No byline found,No article type found,"<a href=""https://www.theglobeandmail.com/canada/article-health-canada-approves-lecanemab-leqembi-alzheimers-disease-medication/"">Health Canada approves drug that slows progression of Alzheimer’s disease</a>"
5,Sportsnet’s Hazel Mae enjoys the comforts of home during the World Series,https://www.theglobeandmail.com/sports/baseball/article-blue-jays-world-series-dodgers-hazel-mae-sportsnet/,No byline found,No article type found,"<a href=""https://www.theglobeandmail.com/sports/baseball/article-blue-jays-world-series-dodgers-hazel-mae-sportsnet/"">Sportsnet’s Hazel Mae enjoys the comforts of home during the World Series</a>"
6,Concerned about your protein powder habit? Consider these whole food protein swaps,https://www.theglobeandmail.com/life/health-and-fitness/article-beck-diet-health-protein-powder-whole-food/,No byline found,No article type found,"<a href=""https://www.theglobeandmail.com/life/health-and-fitness/article-beck-diet-health-protein-powder-whole-food/"">Concerned about your protein powder habit? Consider these whole food protein swaps</a>"
7,Wealthsimple’s milestone deal: Online financial-services giant hits $10-billion valuation with $750-million financing,https://www.theglobeandmail.com/business/technology/article-wealthsimple-raises-750-million-valuation-10-billion-dragoneer-gic/,No byline found,No article type found,"<a href=""https://www.theglobeandmail.com/business/technology/article-wealthsimple-raises-750-million-valuation-10-billion-dragoneer-gic/"">Wealthsimple’s milestone deal: Online financial-services giant hits $10-billion valuation with $750-million financing</a>"
8,The bitter truth is that cheaper housing means a retirement crisis for homeowners,https://www.theglobeandmail.com/business/commentary/article-housing-prices-retirement-plan-middle-class/,John Turley-Ewart,Opinion,"<a href=""https://www.theglobeandmail.com/business/commentary/article-housing-prices-retirement-plan-middle-class/"">The bitter truth is that cheaper housing means a retirement crisis for homeowners</a>"
