Rank,Article title,url,Byline,Article type,title_with_link
1,‘We’re in our mid-50s. Do we have enough money to retire comfortably in a decade?’,https://www.theglobeandmail.com/investing/personal-finance/retirement/article-retirement-saving-investing-advice-finance-homes-travel/,No byline found,No article type found,"<a href=""https://www.theglobeandmail.com/investing/personal-finance/retirement/article-retirement-saving-investing-advice-finance-homes-travel/"">‘We’re in our mid-50s. Do we have enough money to retire comfortably in a decade?’</a>"
2,"I’m stepping back from our culture of overwhelm, and bringing the kids with me",https://www.theglobeandmail.com/life/first-person/article-cellphones-parenting-culture-of-overwhelm/,No byline found,No article type found,"<a href=""https://www.theglobeandmail.com/life/first-person/article-cellphones-parenting-culture-of-overwhelm/"">I’m stepping back from our culture of overwhelm, and bringing the kids with me</a>"
3,"Sarah McLachlan might be a little broken, but she’s happier than ever",https://www.theglobeandmail.com/arts/music/article-sarah-mclachlan-better-broken-lilith-fair-tiff/,No byline found,No article type found,"<a href=""https://www.theglobeandmail.com/arts/music/article-sarah-mclachlan-better-broken-lilith-fair-tiff/"">Sarah McLachlan might be a little broken, but she’s happier than ever</a>"
4,"BC Ferries deal raised with Transport Canada weeks before Freeland’s criticism, e-mails show",https://www.theglobeandmail.com/politics/article-bc-ferries-deal-raised-with-transport-canada-weeks-before-freelands/,No byline found,No article type found,"<a href=""https://www.theglobeandmail.com/politics/article-bc-ferries-deal-raised-with-transport-canada-weeks-before-freelands/"">BC Ferries deal raised with Transport Canada weeks before Freeland’s criticism, e-mails show</a>"
5,"Canada, Mexico to sign strategic partnership during Carney visit",https://www.theglobeandmail.com/politics/article-canada-mexico-strategic-partnership-carney-sheinbaum-trade/,No byline found,No article type found,"<a href=""https://www.theglobeandmail.com/politics/article-canada-mexico-strategic-partnership-carney-sheinbaum-trade/"">Canada, Mexico to sign strategic partnership during Carney visit</a>"
6,Number of GTA homes being taken over by lenders is skyrocketing,https://www.theglobeandmail.com/real-estate/article-gta-homes-lenders-power-of-sale/,No byline found,No article type found,"<a href=""https://www.theglobeandmail.com/real-estate/article-gta-homes-lenders-power-of-sale/"">Number of GTA homes being taken over by lenders is skyrocketing</a>"
7,"The American right discovers that it loves cancel culture, too",https://www.theglobeandmail.com/opinion/article-american-right-cancel-culture-jimmy-kimmel-charlie-kirk/,Robyn Urback,Opinion,"<a href=""https://www.theglobeandmail.com/opinion/article-american-right-cancel-culture-jimmy-kimmel-charlie-kirk/"">The American right discovers that it loves cancel culture, too</a>"
8,Jimmy Kimmel’s on-air suspension marks a new chapter in Trump’s culture war,https://www.theglobeandmail.com/arts/article-jimmy-kimmel-show-abc-charlie-kirk-remarks/,No byline found,No article type found,"<a href=""https://www.theglobeandmail.com/arts/article-jimmy-kimmel-show-abc-charlie-kirk-remarks/"">Jimmy Kimmel’s on-air suspension marks a new chapter in Trump’s culture war</a>"
