Rank,Article title,url,Byline,Article type,title_with_link
1,"I’m stepping back from our culture of overwhelm, and bringing the kids with me",https://www.theglobeandmail.com/life/first-person/article-cellphones-parenting-culture-of-overwhelm/,No byline found,No article type found,"<a href=""https://www.theglobeandmail.com/life/first-person/article-cellphones-parenting-culture-of-overwhelm/"">I’m stepping back from our culture of overwhelm, and bringing the kids with me</a>"
2,The Polaris Music Prize is 20 years old. Here’s what artists want for its future,https://www.theglobeandmail.com/arts/music/article-polaris-music-prize-2025-nominees/,No byline found,No article type found,"<a href=""https://www.theglobeandmail.com/arts/music/article-polaris-music-prize-2025-nominees/"">The Polaris Music Prize is 20 years old. Here’s what artists want for its future</a>"
3,Trump vows crackdown on left-wing groups after Charlie Kirk’s assassination,https://www.theglobeandmail.com/world/us-politics/article-trump-crackdown-charlie-kirk/,No byline found,No article type found,"<a href=""https://www.theglobeandmail.com/world/us-politics/article-trump-crackdown-charlie-kirk/"">Trump vows crackdown on left-wing groups after Charlie Kirk’s assassination</a>"
4,"How this teacher used a $150,000 inheritance to finally stop working",https://www.theglobeandmail.com/investing/personal-finance/retirement/article-inheritance-retirement-pension-large-family/,No byline found,No article type found,"<a href=""https://www.theglobeandmail.com/investing/personal-finance/retirement/article-inheritance-retirement-pension-large-family/"">How this teacher used a $150,000 inheritance to finally stop working</a>"
5,"Canada, Mexico to sign strategic partnership during Carney visit",https://www.theglobeandmail.com/politics/article-canada-mexico-strategic-partnership-carney-sheinbaum-trade/,No byline found,No article type found,"<a href=""https://www.theglobeandmail.com/politics/article-canada-mexico-strategic-partnership-carney-sheinbaum-trade/"">Canada, Mexico to sign strategic partnership during Carney visit</a>"
6,Why Canada and Mexico need each other to take on Trump,https://www.theglobeandmail.com/opinion/article-canada-mexico-relationship-carney-visit-trade/,Denise Dresser,Opinion,"<a href=""https://www.theglobeandmail.com/opinion/article-canada-mexico-relationship-carney-visit-trade/"">Why Canada and Mexico need each other to take on Trump</a>"
7,Number of GTA homes being taken over by lenders is skyrocketing,https://www.theglobeandmail.com/real-estate/article-gta-homes-lenders-power-of-sale/,No byline found,No article type found,"<a href=""https://www.theglobeandmail.com/real-estate/article-gta-homes-lenders-power-of-sale/"">Number of GTA homes being taken over by lenders is skyrocketing</a>"
8,"Neil Young is getting an 80th birthday party at Massey Hall, with a homegrown tribute concert",https://www.theglobeandmail.com/arts/music/article-neil-young-toronto-massey-hall-birthday-music/,No byline found,No article type found,"<a href=""https://www.theglobeandmail.com/arts/music/article-neil-young-toronto-massey-hall-birthday-music/"">Neil Young is getting an 80th birthday party at Massey Hall, with a homegrown tribute concert</a>"
