Rank,Article title,url,Byline,Article type,title_with_link
1,"As an ER doc and a mom, here are five things I don’t let my kids do because the risks are too high",https://www.theglobeandmail.com/life/advice/article-as-an-er-doc-and-a-mom-here-are-five-things-i-dont-let-my-kids-do/,No byline found,No article type found,"<a href=""https://www.theglobeandmail.com/life/advice/article-as-an-er-doc-and-a-mom-here-are-five-things-i-dont-let-my-kids-do/"">As an ER doc and a mom, here are five things I don’t let my kids do because the risks are too high</a>"
2,"How a self-employed accountant grew her TFSA from $190,000 to $575,000 in a year",https://www.theglobeandmail.com/investing/investment-ideas/article-accountants-sector-rotation-strategy-results-in-a-skyrocketing-tfsa/,No byline found,No article type found,"<a href=""https://www.theglobeandmail.com/investing/investment-ideas/article-accountants-sector-rotation-strategy-results-in-a-skyrocketing-tfsa/"">How a self-employed accountant grew her TFSA from $190,000 to $575,000 in a year</a>"
3,Is it illegal to stop before turning right at a green light?,https://www.theglobeandmail.com/drive/culture/article-is-it-illegal-to-stop-before-turning-right-at-a-green-light/,No byline found,No article type found,"<a href=""https://www.theglobeandmail.com/drive/culture/article-is-it-illegal-to-stop-before-turning-right-at-a-green-light/"">Is it illegal to stop before turning right at a green light?</a>"
4,How can you save money this year? Our personal finance experts answered your questions,https://www.theglobeandmail.com/investing/personal-finance/article-saving-money-2026-retirement-reader-questions/,No byline found,No article type found,"<a href=""https://www.theglobeandmail.com/investing/personal-finance/article-saving-money-2026-retirement-reader-questions/"">How can you save money this year? Our personal finance experts answered your questions</a>"
5,The ‘motherhood penalty’: An accountant (and mother) explains the hidden costs of parenting,https://www.theglobeandmail.com/life/advice/parenting/article-motherhood-penalty-hidden-costs-of-parenting/,No byline found,No article type found,"<a href=""https://www.theglobeandmail.com/life/advice/parenting/article-motherhood-penalty-hidden-costs-of-parenting/"">The ‘motherhood penalty’: An accountant (and mother) explains the hidden costs of parenting</a>"
6,"America had lots of warning about Trump - thousands of years’ worth, in fact",https://www.theglobeandmail.com/opinion/article-donald-trump-democracy-authoritarian-imperial-dictator-fascism-plato/,Gary Mason,Opinion,"<a href=""https://www.theglobeandmail.com/opinion/article-donald-trump-democracy-authoritarian-imperial-dictator-fascism-plato/"">America had lots of warning about Trump - thousands of years’ worth, in fact</a>"
7,Rutherford says Canucks are ‘open for business’ as they navigate rebuild,https://www.theglobeandmail.com/sports/hockey/article-jim-rutherford-vancouver-canucks-open-for-business-rebuild/,Gary Mason,Opinion,"<a href=""https://www.theglobeandmail.com/sports/hockey/article-jim-rutherford-vancouver-canucks-open-for-business-rebuild/"">Rutherford says Canucks are ‘open for business’ as they navigate rebuild</a>"
8,Condos a bright spot as Toronto-area home sales revisit levels last seen in 2000,https://www.theglobeandmail.com/real-estate/toronto/article-toronto-area-home-sales-levels-condos/,No byline found,No article type found,"<a href=""https://www.theglobeandmail.com/real-estate/toronto/article-toronto-area-home-sales-levels-condos/"">Condos a bright spot as Toronto-area home sales revisit levels last seen in 2000</a>"
