Rank,Article title,url,Byline,Article type,title_with_link
1,Canadian dollar edges higher as risk appetite improves,https://www.theglobeandmail.com/investing/article-canadian-dollar-edges-higher-as-risk-appetite-improves/,No byline found,No article type found,"<a href=""https://www.theglobeandmail.com/investing/article-canadian-dollar-edges-higher-as-risk-appetite-improves/"">Canadian dollar edges higher as risk appetite improves</a>"
2,Why we should be leery of Reza Pahlavi as a leader of Iran,https://www.theglobeandmail.com/opinion/article-why-we-should-be-leery-of-reza-pahlavi-as-a-leader-of-iran/,Kaveh Shahrooz,Opinion,"<a href=""https://www.theglobeandmail.com/opinion/article-why-we-should-be-leery-of-reza-pahlavi-as-a-leader-of-iran/"">Why we should be leery of Reza Pahlavi as a leader of Iran</a>"
3,"Of the floor crossings so far, Lori Idlout’s defection will leave a mark",https://www.theglobeandmail.com/politics/opinion/article-of-the-floor-crossings-so-far-lori-idlouts-defection-will-leave-a-mark/,Campbell Clark,Opinion,"<a href=""https://www.theglobeandmail.com/politics/opinion/article-of-the-floor-crossings-so-far-lori-idlouts-defection-will-leave-a-mark/"">Of the floor crossings so far, Lori Idlout’s defection will leave a mark</a>"
4,Before the Bell: What every Canadian investor needs to know today,https://www.theglobeandmail.com/investing/markets/inside-the-market/article-before-the-bell-what-every-canadian-investor-needs-to-know-today-1432/,No byline found,No article type found,"<a href=""https://www.theglobeandmail.com/investing/markets/inside-the-market/article-before-the-bell-what-every-canadian-investor-needs-to-know-today-1432/"">Before the Bell: What every Canadian investor needs to know today</a>"
5,IEA backs record release from strategic oil reserves to bring down prices,https://www.theglobeandmail.com/business/industry-news/energy-and-resources/article-iea-release-strategic-oil-reserves-prices/,No byline found,No article type found,"<a href=""https://www.theglobeandmail.com/business/industry-news/energy-and-resources/article-iea-release-strategic-oil-reserves-prices/"">IEA backs record release from strategic oil reserves to bring down prices</a>"
6,My workplace makes my colleague pray in the stairwell. Aren’t they legally obligated to provide a comfortable place?,https://www.theglobeandmail.com/business/careers/career-advice/article-my-workplace-makes-my-colleague-pray-in-the-stairwell-arent-they/,No byline found,No article type found,"<a href=""https://www.theglobeandmail.com/business/careers/career-advice/article-my-workplace-makes-my-colleague-pray-in-the-stairwell-arent-they/"">My workplace makes my colleague pray in the stairwell. Aren’t they legally obligated to provide a comfortable place?</a>"
7,"KPMG had most deficiencies in audit files reviewed last year of Big Four firms, regulator finds",https://www.theglobeandmail.com/business/article-audits-kpmg-pwc-deloitte-ey-big-four-accounting-firms-inspections/,No byline found,No article type found,"<a href=""https://www.theglobeandmail.com/business/article-audits-kpmg-pwc-deloitte-ey-big-four-accounting-firms-inspections/"">KPMG had most deficiencies in audit files reviewed last year of Big Four firms, regulator finds</a>"
8,"Fifteens, a Northern Ireland treat, are a nostalgic indulgence",https://www.theglobeandmail.com/life/style/food-and-drink/article-fifteens-a-northern-ireland-treat-are-a-nostalgic-indulgence/,No byline found,No article type found,"<a href=""https://www.theglobeandmail.com/life/style/food-and-drink/article-fifteens-a-northern-ireland-treat-are-a-nostalgic-indulgence/"">Fifteens, a Northern Ireland treat, are a nostalgic indulgence</a>"
