Rank,Article title,url,Byline,Article type,title_with_link
1,Air Canada flight cancellations costing travellers more than ticket prices as strike looms,https://www.theglobeandmail.com/investing/personal-finance/article-air-canada-strike-cancellations-upend-summer-travel-plans/,No byline found,No article type found,"<a href=""https://www.theglobeandmail.com/investing/personal-finance/article-air-canada-strike-cancellations-upend-summer-travel-plans/"">Air Canada flight cancellations costing travellers more than ticket prices as strike looms</a>"
2,How did Gwyneth Paltrow go from ingenue to jade-egg pusher?,https://www.theglobeandmail.com/arts/article-amy-odell-gwyneth-paltrow-biography/,No byline found,No article type found,"<a href=""https://www.theglobeandmail.com/arts/article-amy-odell-gwyneth-paltrow-biography/"">How did Gwyneth Paltrow go from ingenue to jade-egg pusher?</a>"
3,"With Poilievre on the ballot, voters in an overlooked corner of Alberta look for a brighter future",https://www.theglobeandmail.com/canada/alberta/article-pierre-poilievre-battle-river-crowfoot-alberta-election/,No byline found,No article type found,"<a href=""https://www.theglobeandmail.com/canada/alberta/article-pierre-poilievre-battle-river-crowfoot-alberta-election/"">With Poilievre on the ballot, voters in an overlooked corner of Alberta look for a brighter future</a>"
4,I asked ChatGPT to predict my retirement and it helped calm my financial anxiety,https://www.theglobeandmail.com/investing/personal-finance/retirement/article-chatgpt-ai-retirement-financial-anxiety/,No byline found,No article type found,"<a href=""https://www.theglobeandmail.com/investing/personal-finance/retirement/article-chatgpt-ai-retirement-financial-anxiety/"">I asked ChatGPT to predict my retirement and it helped calm my financial anxiety</a>"
5,Man charged in crash involving Ontario Premier Doug Ford now facing charges in fatal collision,https://www.theglobeandmail.com/canada/article-man-charged-in-fatal-collision-the-same-driver-involved-in-crash-with/,No byline found,No article type found,"<a href=""https://www.theglobeandmail.com/canada/article-man-charged-in-fatal-collision-the-same-driver-involved-in-crash-with/"">Man charged in crash involving Ontario Premier Doug Ford now facing charges in fatal collision</a>"
6,A young Afghan and her family were about to be deported back to the Taliban. One text changed everything,https://www.theglobeandmail.com/opinion/article-afghan-family-taliban-pakistan-deported-wazhma-hamidi/,Doug Saunders,Opinion,"<a href=""https://www.theglobeandmail.com/opinion/article-afghan-family-taliban-pakistan-deported-wazhma-hamidi/"">A young Afghan and her family were about to be deported back to the Taliban. One text changed everything</a>"
7,"Longest ballot protest in Alberta federal by-election is ‘abuse of process,’ says former chief electoral officer",https://www.theglobeandmail.com/politics/article-longest-ballot-battle-river-crowfoot-by-election-electoral-officer/,No byline found,No article type found,"<a href=""https://www.theglobeandmail.com/politics/article-longest-ballot-battle-river-crowfoot-by-election-electoral-officer/"">Longest ballot protest in Alberta federal by-election is ‘abuse of process,’ says former chief electoral officer</a>"
8,"Hezbollah raises spectre of civil war, resisting pressure to disarm",https://www.theglobeandmail.com/world/article-hezbollah-lebanon-israel-disarmament-plan/,No byline found,No article type found,"<a href=""https://www.theglobeandmail.com/world/article-hezbollah-lebanon-israel-disarmament-plan/"">Hezbollah raises spectre of civil war, resisting pressure to disarm</a>"
