Rank,Article title,url,Byline,Article type,title_with_link
1,Is it illegal to stop before turning right at a green light?,https://www.theglobeandmail.com/drive/culture/article-is-it-illegal-to-stop-before-turning-right-at-a-green-light/,No byline found,No article type found,"<a href=""https://www.theglobeandmail.com/drive/culture/article-is-it-illegal-to-stop-before-turning-right-at-a-green-light/"">Is it illegal to stop before turning right at a green light?</a>"
2,"From Washington to Iqaluit, Carney’s travels reveal a lot about his priorities",https://www.theglobeandmail.com/canada/article-mark-carney-travels-trips-mapped/,No byline found,No article type found,"<a href=""https://www.theglobeandmail.com/canada/article-mark-carney-travels-trips-mapped/"">From Washington to Iqaluit, Carney’s travels reveal a lot about his priorities</a>"
3,"The Globe’s Christmas painting: Home on the Range, by William Kurelek",https://www.theglobeandmail.com/culture/article-globe-christmas-painting-home-on-the-range-by-william-kurelek/,No byline found,No article type found,"<a href=""https://www.theglobeandmail.com/culture/article-globe-christmas-painting-home-on-the-range-by-william-kurelek/"">The Globe’s Christmas painting: Home on the Range, by William Kurelek</a>"
4,Warren Buffett is about to retire. Do not despair,https://www.theglobeandmail.com/investing/personal-finance/article-warren-buffett-is-about-to-retire-do-not-despair/,No byline found,No article type found,"<a href=""https://www.theglobeandmail.com/investing/personal-finance/article-warren-buffett-is-about-to-retire-do-not-despair/"">Warren Buffett is about to retire. Do not despair</a>"
5,Parmigiano Reggiano Puffs are the fancy-ish snack you need this holiday,https://www.theglobeandmail.com/life/style/food-and-drink/article-recipe-parmigiano-reggiano-puffs-holiday-winter-snack/,No byline found,No article type found,"<a href=""https://www.theglobeandmail.com/life/style/food-and-drink/article-recipe-parmigiano-reggiano-puffs-holiday-winter-snack/"">Parmigiano Reggiano Puffs are the fancy-ish snack you need this holiday</a>"
6,Trump’s new Presidential Walk of Fame plaques are another attempt at rewriting history,https://www.theglobeandmail.com/world/us-politics/article-trump-presidential-walk-of-fame-plaques-rewriting-history/,No byline found,Analysis,"<a href=""https://www.theglobeandmail.com/world/us-politics/article-trump-presidential-walk-of-fame-plaques-rewriting-history/"">Trump’s new Presidential Walk of Fame plaques are another attempt at rewriting history</a>"
7,These Santa letters from children bring the holiday magic,https://www.theglobeandmail.com/life/article-santa-letters-from-children-north-pole-2025/,No byline found,No article type found,"<a href=""https://www.theglobeandmail.com/life/article-santa-letters-from-children-north-pole-2025/"">These Santa letters from children bring the holiday magic</a>"
8,"Powerful winter storm lashes Southern California, bringing flash floods and mudslides",https://www.theglobeandmail.com/world/article-powerful-winter-storm-lashes-southern-california-bringing-flash-floods/,No byline found,No article type found,"<a href=""https://www.theglobeandmail.com/world/article-powerful-winter-storm-lashes-southern-california-bringing-flash-floods/"">Powerful winter storm lashes Southern California, bringing flash floods and mudslides</a>"
