Rank,Article title,url,Byline,Article type,title_with_link
1,Bell to expand fibre internet service into Western Canada on Telus network,https://www.theglobeandmail.com/business/article-bell-canada-expand-fibre-internet-service-telus/,No byline found,No article type found,"<a href=""https://www.theglobeandmail.com/business/article-bell-canada-expand-fibre-internet-service-telus/"">Bell to expand fibre internet service into Western Canada on Telus network</a>"
2,"Seven ways to prepare for the next stock market crash, which could be nasty",https://www.theglobeandmail.com/investing/personal-finance/article-tips-prepare-stock-market-crash/,Rob Carrick,Opinion,"<a href=""https://www.theglobeandmail.com/investing/personal-finance/article-tips-prepare-stock-market-crash/"">Seven ways to prepare for the next stock market crash, which could be nasty</a>"
3,This is what the opening move of the U.S.’s attempted annexation of Canada could look like,https://www.theglobeandmail.com/opinion/article-trump-us-annex-canada-arctic-maritime-sovereignty/,Franklyn Griffiths,Opinion,"<a href=""https://www.theglobeandmail.com/opinion/article-trump-us-annex-canada-arctic-maritime-sovereignty/"">This is what the opening move of the U.S.’s attempted annexation of Canada could look like</a>"
4,Will I get a ticket if I don’t stop for three seconds before turning right at a red light?,https://www.theglobeandmail.com/drive/culture/article-will-i-get-a-ticket-if-i-dont-stop-for-three-seconds-before-turning/,No byline found,No article type found,"<a href=""https://www.theglobeandmail.com/drive/culture/article-will-i-get-a-ticket-if-i-dont-stop-for-three-seconds-before-turning/"">Will I get a ticket if I don’t stop for three seconds before turning right at a red light?</a>"
5,Wrongfully convicted New Brunswick man who spent 18 years in prison dies from cancer,https://www.theglobeandmail.com/canada/article-wrongfully-convicted-new-brunswick-man-dies-from-cancer/,No byline found,No article type found,"<a href=""https://www.theglobeandmail.com/canada/article-wrongfully-convicted-new-brunswick-man-dies-from-cancer/"">Wrongfully convicted New Brunswick man who spent 18 years in prison dies from cancer</a>"
6,IMF warns global markets could be headed for ‘disorderly’ correction,https://www.theglobeandmail.com/business/article-imf-warns-global-markets-could-be-headed-for-disorderly-correction/,No byline found,No article type found,"<a href=""https://www.theglobeandmail.com/business/article-imf-warns-global-markets-could-be-headed-for-disorderly-correction/"">IMF warns global markets could be headed for ‘disorderly’ correction</a>"
7,"Bloc lays out 18 budget demands, listing six as non-negotiable",https://www.theglobeandmail.com/politics/article-bloc-quebecois-budget-demands/,No byline found,No article type found,"<a href=""https://www.theglobeandmail.com/politics/article-bloc-quebecois-budget-demands/"">Bloc lays out 18 budget demands, listing six as non-negotiable</a>"
8,"Carney’s climate vision to deprioritize emissions targets, focus on economic advantages",https://www.theglobeandmail.com/business/article-mark-carney-climate-competitiveness-strategy-emissions-targets-energy/,No byline found,Analysis,"<a href=""https://www.theglobeandmail.com/business/article-mark-carney-climate-competitiveness-strategy-emissions-targets-energy/"">Carney’s climate vision to deprioritize emissions targets, focus on economic advantages</a>"
