Rank,Article title,url,Byline,Article type,title_with_link
1,23 well-performing Canadian ETFs with reasonable fees,https://www.theglobeandmail.com/investing/investment-ideas/number-cruncher/article-canadian-etfs-reasonable-fees-cruncher/,No byline found,No article type found,"<a href=""https://www.theglobeandmail.com/investing/investment-ideas/number-cruncher/article-canadian-etfs-reasonable-fees-cruncher/"">23 well-performing Canadian ETFs with reasonable fees</a>"
2,Iran dismisses U.S. ceasefire plan and issues its own counterproposal,https://www.theglobeandmail.com/world/article-iran-war-us-ceasefire-plan/,No byline found,No article type found,"<a href=""https://www.theglobeandmail.com/world/article-iran-war-us-ceasefire-plan/"">Iran dismisses U.S. ceasefire plan and issues its own counterproposal</a>"
3,"War is not a game, Mr. Trump",https://www.theglobeandmail.com/opinion/article-trump-iran-war-middle-east/,Marsha Lederman,Opinion,"<a href=""https://www.theglobeandmail.com/opinion/article-trump-iran-war-middle-east/"">War is not a game, Mr. Trump</a>"
4,‘No common sense’: Ride in a robotaxi shows the promise – and limits – of driverless cars,https://www.theglobeandmail.com/drive/mobility/article-no-common-sense-ride-in-a-robotaxi-shows-the-promise-and-limits-of/,No byline found,No article type found,"<a href=""https://www.theglobeandmail.com/drive/mobility/article-no-common-sense-ride-in-a-robotaxi-shows-the-promise-and-limits-of/"">‘No common sense’: Ride in a robotaxi shows the promise – and limits – of driverless cars</a>"
5,Experts say two pilots killed in Air Canada crash had little chance of survival,https://www.theglobeandmail.com/canada/article-air-canada-crash-pilots-survival-chance-experts/,No byline found,No article type found,"<a href=""https://www.theglobeandmail.com/canada/article-air-canada-crash-pilots-survival-chance-experts/"">Experts say two pilots killed in Air Canada crash had little chance of survival</a>"
6,"As Americans in Canada prepare U.S. tax filings, lower citizenship renunciation fee offers a way out",https://www.theglobeandmail.com/investing/globe-advisor/advisor-news/article-as-americans-in-canada-prepare-us-tax-filings-lower-citizenship/,No byline found,No article type found,"<a href=""https://www.theglobeandmail.com/investing/globe-advisor/advisor-news/article-as-americans-in-canada-prepare-us-tax-filings-lower-citizenship/"">As Americans in Canada prepare U.S. tax filings, lower citizenship renunciation fee offers a way out</a>"
7,This week’s highest savings account and guaranteed investment certificate rates,https://www.theglobeandmail.com/investing/personal-finance/article-highest-rates-savings-accounts-guaranteed-investment-certificates/,No byline found,No article type found,"<a href=""https://www.theglobeandmail.com/investing/personal-finance/article-highest-rates-savings-accounts-guaranteed-investment-certificates/"">This week’s highest savings account and guaranteed investment certificate rates</a>"
8,Air Canada CEO criticized for English-only condolence message after plane crash,https://www.theglobeandmail.com/politics/article-carney-says-air-canada-ceo-showed-a-lack-of-compassion-with-english/,No byline found,No article type found,"<a href=""https://www.theglobeandmail.com/politics/article-carney-says-air-canada-ceo-showed-a-lack-of-compassion-with-english/"">Air Canada CEO criticized for English-only condolence message after plane crash</a>"
