Rank,Article title,url,Byline,Article type,title_with_link
1,Wealthsimple and Visa experiment with U.S. stablecoin to settle payments more quickly,https://www.theglobeandmail.com/business/article-wealthsimple-visa-pilot-us-stablecoin-payments-settlement/,No byline found,No article type found,"<a href=""https://www.theglobeandmail.com/business/article-wealthsimple-visa-pilot-us-stablecoin-payments-settlement/"">Wealthsimple and Visa experiment with U.S. stablecoin to settle payments more quickly</a>"
2,A breakup in Alberta hands crisis communications firm Navigator a crisis of its own,https://www.theglobeandmail.com/business/article-navigator-jaime-watt-signal-hill-pr-calgary/,No byline found,No article type found,"<a href=""https://www.theglobeandmail.com/business/article-navigator-jaime-watt-signal-hill-pr-calgary/"">A breakup in Alberta hands crisis communications firm Navigator a crisis of its own</a>"
3,Are Canadian taxpayers on the hook for risky mortgages?,https://www.theglobeandmail.com/investing/personal-finance/article-are-canadian-taxpayers-on-the-hook-for-risky-mortgages/,No byline found,Analysis,"<a href=""https://www.theglobeandmail.com/investing/personal-finance/article-are-canadian-taxpayers-on-the-hook-for-risky-mortgages/"">Are Canadian taxpayers on the hook for risky mortgages?</a>"
4,Former Supreme Court judge Louise Arbour named Canada’s next Governor-General,https://www.theglobeandmail.com/politics/article-new-governor-general-canada-louise-arbour/,No byline found,No article type found,"<a href=""https://www.theglobeandmail.com/politics/article-new-governor-general-canada-louise-arbour/"">Former Supreme Court judge Louise Arbour named Canada’s next Governor-General</a>"
5,"Non-profit behind failed PrescribeIT program spent more than $400,000 on executive travel in three years",https://www.theglobeandmail.com/canada/article-prescribeit-canada-health-infoway-400000-executive-travel-three-years/,No byline found,No article type found,"<a href=""https://www.theglobeandmail.com/canada/article-prescribeit-canada-health-infoway-400000-executive-travel-three-years/"">Non-profit behind failed PrescribeIT program spent more than $400,000 on executive travel in three years</a>"
6,John Chayka’s tenure with the Maple Leafs begins under intense scrutiny,https://www.theglobeandmail.com/sports/hockey/article-john-chaykas-tenure-with-the-maple-leafs-begins-under-intense-scrutiny/,Cathal Kelly,Opinion,"<a href=""https://www.theglobeandmail.com/sports/hockey/article-john-chaykas-tenure-with-the-maple-leafs-begins-under-intense-scrutiny/"">John Chayka’s tenure with the Maple Leafs begins under intense scrutiny</a>"
7,Alleged drug trafficker in Project South probe has $1.5-million bail revoked,https://www.theglobeandmail.com/canada/article-toronto-police-project-south-brian-da-costa-bail-revoked/,No byline found,No article type found,"<a href=""https://www.theglobeandmail.com/canada/article-toronto-police-project-south-brian-da-costa-bail-revoked/"">Alleged drug trafficker in Project South probe has $1.5-million bail revoked</a>"
8,Toronto woman with bipolar disorder asks Ontario court to grant her emergency MAID access,https://www.theglobeandmail.com/canada/article-toronto-woman-with-bipolar-disorder-asks-ontario-court-to-grant-her/,No byline found,No article type found,"<a href=""https://www.theglobeandmail.com/canada/article-toronto-woman-with-bipolar-disorder-asks-ontario-court-to-grant-her/"">Toronto woman with bipolar disorder asks Ontario court to grant her emergency MAID access</a>"
