Rank,Article title,url,Byline,Article type,title_with_link
1,Wednesday’s analyst upgrades and downgrades,https://www.theglobeandmail.com/investing/markets/inside-the-market/article-wednesdays-analyst-upgrades-and-downgrades-261/,No byline found,No article type found,"<a href=""https://www.theglobeandmail.com/investing/markets/inside-the-market/article-wednesdays-analyst-upgrades-and-downgrades-261/"">Wednesday’s analyst upgrades and downgrades</a>"
2,"Prepare to pay more for your morning coffee, mocha or matcha latte",https://www.theglobeandmail.com/investing/personal-finance/article-coffee-matcha-chocolate-prices-rising-cafes/,No byline found,No article type found,"<a href=""https://www.theglobeandmail.com/investing/personal-finance/article-coffee-matcha-chocolate-prices-rising-cafes/"">Prepare to pay more for your morning coffee, mocha or matcha latte</a>"
3,My estranged father died in hospital after years of drug use. He was more than a statistic,https://www.theglobeandmail.com/opinion/article-my-estranged-father-died-in-hospital-after-years-of-drug-use-he-was/,No byline found,No article type found,"<a href=""https://www.theglobeandmail.com/opinion/article-my-estranged-father-died-in-hospital-after-years-of-drug-use-he-was/"">My estranged father died in hospital after years of drug use. He was more than a statistic</a>"
4,Mexico grapples with Trump’s unrelenting demands,https://www.theglobeandmail.com/world/article-mexico-grapples-with-trumps-unrelenting-demands/,No byline found,No article type found,"<a href=""https://www.theglobeandmail.com/world/article-mexico-grapples-with-trumps-unrelenting-demands/"">Mexico grapples with Trump’s unrelenting demands</a>"
5,‘Pierre’s riding to lose’: candidates in Alberta by-election get together for debate,https://www.theglobeandmail.com/canada/article-pierres-riding-to-lose-candidates-in-alberta-by-election-get-together/,No byline found,No article type found,"<a href=""https://www.theglobeandmail.com/canada/article-pierres-riding-to-lose-candidates-in-alberta-by-election-get-together/"">‘Pierre’s riding to lose’: candidates in Alberta by-election get together for debate</a>"
6,Is denying a drug to a terminally ill 10-year-old cruel – or is it good governance?,https://www.theglobeandmail.com/opinion/article-is-denying-a-drug-to-a-terminally-ill-10-year-old-cruel-or-is-it-good/,No byline found,No article type found,"<a href=""https://www.theglobeandmail.com/opinion/article-is-denying-a-drug-to-a-terminally-ill-10-year-old-cruel-or-is-it-good/"">Is denying a drug to a terminally ill 10-year-old cruel – or is it good governance?</a>"
7,B.C. coast under tsunami advisory after massive earthquake hits Russia,https://www.theglobeandmail.com/canada/article-bc-tsunami-warning-after-russian-earthquake/,No byline found,No article type found,"<a href=""https://www.theglobeandmail.com/canada/article-bc-tsunami-warning-after-russian-earthquake/"">B.C. coast under tsunami advisory after massive earthquake hits Russia</a>"
8,BMO analyst see big upside in these two utilities stocks,https://www.theglobeandmail.com/investing/markets/inside-the-market/article-bmo-analyst-see-big-upside-in-these-two-utilities-stocks/,No byline found,No article type found,"<a href=""https://www.theglobeandmail.com/investing/markets/inside-the-market/article-bmo-analyst-see-big-upside-in-these-two-utilities-stocks/"">BMO analyst see big upside in these two utilities stocks</a>"
