Rank,Article title,url,Byline,Article type,title_with_link
1,Canadian producers relieved as Trump’s 50% tariff on imported copper spares key products,https://www.theglobeandmail.com/business/article-donald-trump-copper-imports-tariff/,No byline found,No article type found,"<a href=""https://www.theglobeandmail.com/business/article-donald-trump-copper-imports-tariff/"">Canadian producers relieved as Trump’s 50% tariff on imported copper spares key products</a>"
2,"Ontario’s plan to remove bike lanes unconstitutional, court rules",https://www.theglobeandmail.com/canada/article-ontario-bike-lanes-unconstitutional-charter-toronto-doug-ford/,No byline found,No article type found,"<a href=""https://www.theglobeandmail.com/canada/article-ontario-bike-lanes-unconstitutional-charter-toronto-doug-ford/"">Ontario’s plan to remove bike lanes unconstitutional, court rules</a>"
3,"Billionaire Weston family to buy Hudson’s Bay charter in $12.5-million deal, donate to museum",https://www.theglobeandmail.com/business/article-hudsons-bay-company-royal-charter-weston-family/,No byline found,No article type found,"<a href=""https://www.theglobeandmail.com/business/article-hudsons-bay-company-royal-charter-weston-family/"">Billionaire Weston family to buy Hudson’s Bay charter in $12.5-million deal, donate to museum</a>"
4,Carney says Canada intends to recognize a Palestinian state in September,https://www.theglobeandmail.com/canada/article-canada-palestinian-state-recognition-carney-israel-gaza/,No byline found,No article type found,"<a href=""https://www.theglobeandmail.com/canada/article-canada-palestinian-state-recognition-carney-israel-gaza/"">Carney says Canada intends to recognize a Palestinian state in September</a>"
5,The bitter truth is that cheaper housing means a retirement crisis for homeowners,https://www.theglobeandmail.com/business/commentary/article-housing-prices-retirement-plan-middle-class/,John Turley-Ewart,Opinion,"<a href=""https://www.theglobeandmail.com/business/commentary/article-housing-prices-retirement-plan-middle-class/"">The bitter truth is that cheaper housing means a retirement crisis for homeowners</a>"
6,"Prepare to pay more for your morning coffee, mocha or matcha latte",https://www.theglobeandmail.com/investing/personal-finance/article-coffee-matcha-chocolate-prices-rising-cafes/,No byline found,No article type found,"<a href=""https://www.theglobeandmail.com/investing/personal-finance/article-coffee-matcha-chocolate-prices-rising-cafes/"">Prepare to pay more for your morning coffee, mocha or matcha latte</a>"
7,My estranged father died in hospital after years of drug use. He was more than a statistic,https://www.theglobeandmail.com/opinion/article-my-estranged-father-died-in-hospital-after-years-of-drug-use-he-was/,No byline found,No article type found,"<a href=""https://www.theglobeandmail.com/opinion/article-my-estranged-father-died-in-hospital-after-years-of-drug-use-he-was/"">My estranged father died in hospital after years of drug use. He was more than a statistic</a>"
8,Trump says U.S.-Canada trade deal may be difficult after plan to back Palestine statehood,https://www.theglobeandmail.com/business/article-trump-us-canada-trade-deal-palestine-statehood-israel-mark-carney/,No byline found,No article type found,"<a href=""https://www.theglobeandmail.com/business/article-trump-us-canada-trade-deal-palestine-statehood-israel-mark-carney/"">Trump says U.S.-Canada trade deal may be difficult after plan to back Palestine statehood</a>"
