Rank,Article title,url,Byline,Article type,title_with_link
1,How to save the young and the jobless of Canada,https://www.theglobeandmail.com/business/commentary/article-youth-unemployment-labour-force-jobs-careers-immigration/,Claude Lavoie,Opinion,"<a href=""https://www.theglobeandmail.com/business/commentary/article-youth-unemployment-labour-force-jobs-careers-immigration/"">How to save the young and the jobless of Canada</a>"
2,TD names new heads for fixed income and equities after leadership shakeup,https://www.theglobeandmail.com/business/article-td-bank-fixed-income-equities-executive-leadership-global-markets/,No byline found,No article type found,"<a href=""https://www.theglobeandmail.com/business/article-td-bank-fixed-income-equities-executive-leadership-global-markets/"">TD names new heads for fixed income and equities after leadership shakeup</a>"
3,"Seven ways to prepare for the next stock-market crash, which could be nasty",https://www.theglobeandmail.com/investing/personal-finance/article-tips-prepare-stock-market-crash/,Rob Carrick,Opinion,"<a href=""https://www.theglobeandmail.com/investing/personal-finance/article-tips-prepare-stock-market-crash/"">Seven ways to prepare for the next stock-market crash, which could be nasty</a>"
4,A Saskatchewan star party draws amateur astronomers together in wonder,https://www.theglobeandmail.com/canada/article-friendly-skies-saskatchewan-underexposed/,No byline found,No article type found,"<a href=""https://www.theglobeandmail.com/canada/article-friendly-skies-saskatchewan-underexposed/"">A Saskatchewan star party draws amateur astronomers together in wonder</a>"
5,Alberta doubling down on AI data centres with new mandate for utilities minister,https://www.theglobeandmail.com/business/article-alberta-ai-data-centres-minister-mandate/,No byline found,No article type found,"<a href=""https://www.theglobeandmail.com/business/article-alberta-ai-data-centres-minister-mandate/"">Alberta doubling down on AI data centres with new mandate for utilities minister</a>"
6,Be prepared for interest rates to start rising in late 2026: Desjardins’ chief economist,https://www.theglobeandmail.com/investing/markets/inside-the-market/article-be-prepared-for-interest-rates-to-start-rising-in-late-2026-desjardins/,No byline found,No article type found,"<a href=""https://www.theglobeandmail.com/investing/markets/inside-the-market/article-be-prepared-for-interest-rates-to-start-rising-in-late-2026-desjardins/"">Be prepared for interest rates to start rising in late 2026: Desjardins’ chief economist</a>"
7,Blue Jays’ bats stay hot as they tie ALCS with 8-2 win against Mariners,https://www.theglobeandmail.com/sports/baseball/article-blue-jays-vs-mariners-score-game-4-alcs-mlb-playoffs/,No byline found,No article type found,"<a href=""https://www.theglobeandmail.com/sports/baseball/article-blue-jays-vs-mariners-score-game-4-alcs-mlb-playoffs/"">Blue Jays’ bats stay hot as they tie ALCS with 8-2 win against Mariners</a>"
8,The RDSP is an investment account that’s worth its many hassles,https://www.theglobeandmail.com/investing/personal-finance/article-rdsp-investment-savings-account-issues/,No byline found,No article type found,"<a href=""https://www.theglobeandmail.com/investing/personal-finance/article-rdsp-investment-savings-account-issues/"">The RDSP is an investment account that’s worth its many hassles</a>"
