Rank,Article title,url,Byline,Article type,title_with_link
1,Putin accuses Europeans of sabotaging U.S.-led peace efforts,https://www.theglobeandmail.com/world/article-witkoff-kushner-putin-meeting-russia-ukraine-war/,No byline found,No article type found,"<a href=""https://www.theglobeandmail.com/world/article-witkoff-kushner-putin-meeting-russia-ukraine-war/"">Putin accuses Europeans of sabotaging U.S.-led peace efforts</a>"
2,"Can this Ottawa couple find a four-bedroom home outside the city for $800,000?",https://www.theglobeandmail.com/investing/personal-finance/article-can-this-ottawa-couple-find-a-four-bedroom-home-outside-the-city-for/,No byline found,No article type found,"<a href=""https://www.theglobeandmail.com/investing/personal-finance/article-can-this-ottawa-couple-find-a-four-bedroom-home-outside-the-city-for/"">Can this Ottawa couple find a four-bedroom home outside the city for $800,000?</a>"
3,An illustration in Robert Munsch’s beloved Love You Forever didn’t seem right. I set out to discover why,https://www.theglobeandmail.com/culture/books/article-robert-munsch-love-you-forever-illustration-mystery/,No byline found,No article type found,"<a href=""https://www.theglobeandmail.com/culture/books/article-robert-munsch-love-you-forever-illustration-mystery/"">An illustration in Robert Munsch’s beloved Love You Forever didn’t seem right. I set out to discover why</a>"
4,Canada’s public health plans end talks with Novo Nordisk to cover weight-loss drug Wegovy,https://www.theglobeandmail.com/business/economy/article-canadas-public-drug-plans-novo-nordisk-end-talks-to-cover-wegovy/,No byline found,No article type found,"<a href=""https://www.theglobeandmail.com/business/economy/article-canadas-public-drug-plans-novo-nordisk-end-talks-to-cover-wegovy/"">Canada’s public health plans end talks with Novo Nordisk to cover weight-loss drug Wegovy</a>"
5,"To get the best mortgage rate, look behind the opaque curtain of Big Bank pricing",https://www.theglobeandmail.com/investing/personal-finance/article-mortgage-rates-big-bank-prices-negotiation/,No byline found,Analysis,"<a href=""https://www.theglobeandmail.com/investing/personal-finance/article-mortgage-rates-big-bank-prices-negotiation/"">To get the best mortgage rate, look behind the opaque curtain of Big Bank pricing</a>"
6,Dignity for the mentally ill cannot be deemed a nuisance,https://www.theglobeandmail.com/opinion/editorials/article-dignity-for-the-mentally-ill-cannot-be-deemed-a-nuisance/,No byline found,No article type found,"<a href=""https://www.theglobeandmail.com/opinion/editorials/article-dignity-for-the-mentally-ill-cannot-be-deemed-a-nuisance/"">Dignity for the mentally ill cannot be deemed a nuisance</a>"
7,White House says follow-up strike on alleged drug boat was lawful,https://www.theglobeandmail.com/world/article-white-house-says-follow-up-strike-on-alleged-drug-boat-was-lawful/,No byline found,No article type found,"<a href=""https://www.theglobeandmail.com/world/article-white-house-says-follow-up-strike-on-alleged-drug-boat-was-lawful/"">White House says follow-up strike on alleged drug boat was lawful</a>"
8,Publisher condemns Franklin the Turtle’s ‘violent’ depiction in post by Pete Hegseth,https://www.theglobeandmail.com/culture/books/article-franklin-the-turtle-publisher-us-defense-secretary-hegseth/,No byline found,No article type found,"<a href=""https://www.theglobeandmail.com/culture/books/article-franklin-the-turtle-publisher-us-defense-secretary-hegseth/"">Publisher condemns Franklin the Turtle’s ‘violent’ depiction in post by Pete Hegseth</a>"
