Rank,Article title,url,Byline,Article type,title_with_link
1,Revitalized Auger-Aliassime faces daunting task to reach U.S. Open final,https://www.theglobeandmail.com/sports/tennis/article-felix-auger-aliassime-vs-jannik-sinner-us-open-2025-schedule/,No byline found,No article type found,"<a href=""https://www.theglobeandmail.com/sports/tennis/article-felix-auger-aliassime-vs-jannik-sinner-us-open-2025-schedule/"">Revitalized Auger-Aliassime faces daunting task to reach U.S. Open final</a>"
2,"About 475 people detained during immigration raid in Georgia, Homeland Security official says",https://www.theglobeandmail.com/business/article-immigration-raid-georgia-hyundai-electric-vehicle-plant/,No byline found,No article type found,"<a href=""https://www.theglobeandmail.com/business/article-immigration-raid-georgia-hyundai-electric-vehicle-plant/"">About 475 people detained during immigration raid in Georgia, Homeland Security official says</a>"
3,"Woman and suspect killed, at least seven more injured in stabbing attack in Manitoba",https://www.theglobeandmail.com/canada/article-stabbing-mass-casualty-event-manitoba-first-nation/,No byline found,No article type found,"<a href=""https://www.theglobeandmail.com/canada/article-stabbing-mass-casualty-event-manitoba-first-nation/"">Woman and suspect killed, at least seven more injured in stabbing attack in Manitoba</a>"
4,"The highest-yielding stocks on the TSX, plus risk data",https://www.theglobeandmail.com/investing/markets/inside-the-market/article-the-highest-yielding-stocks-on-the-tsx-plus-risk-data-226/,No byline found,No article type found,"<a href=""https://www.theglobeandmail.com/investing/markets/inside-the-market/article-the-highest-yielding-stocks-on-the-tsx-plus-risk-data-226/"">The highest-yielding stocks on the TSX, plus risk data</a>"
5,"TIFF 2025: The blood, sweat and fears of Matthew McConaughey",https://www.theglobeandmail.com/arts/film/tiff/article-tiff-2025-matthew-mcconaughey-the-lost-bus-poems-and-prayers/,No byline found,No article type found,"<a href=""https://www.theglobeandmail.com/arts/film/tiff/article-tiff-2025-matthew-mcconaughey-the-lost-bus-poems-and-prayers/"">TIFF 2025: The blood, sweat and fears of Matthew McConaughey</a>"
6,U.S.-based Indigenous group sues for right to shape how history is taught in B.C.,https://www.theglobeandmail.com/world/article-us-based-indigenous-group-sues-for-right-to-shape-how-history-is/,No byline found,No article type found,"<a href=""https://www.theglobeandmail.com/world/article-us-based-indigenous-group-sues-for-right-to-shape-how-history-is/"">U.S.-based Indigenous group sues for right to shape how history is taught in B.C.</a>"
7,Canada’s unemployment rate in August climbs to nine-year high outside of pandemic,https://www.theglobeandmail.com/business/article-canadas-unemployment-rate-in-august-climbs-to-nine-year-high-outside/,No byline found,No article type found,"<a href=""https://www.theglobeandmail.com/business/article-canadas-unemployment-rate-in-august-climbs-to-nine-year-high-outside/"">Canada’s unemployment rate in August climbs to nine-year high outside of pandemic</a>"
8,"Richmond Hill home gets three offers, sells $58,000 under asking",https://www.theglobeandmail.com/real-estate/toronto/article-richmond-hill-home-gets-three-offers-sells-58000-under-asking/,No byline found,No article type found,"<a href=""https://www.theglobeandmail.com/real-estate/toronto/article-richmond-hill-home-gets-three-offers-sells-58000-under-asking/"">Richmond Hill home gets three offers, sells $58,000 under asking</a>"
