Rank,Article title,url,Byline,Article type,title_with_link
1,Buckingham Palace willing to co-operate with any police inquiry into former prince Andrew,https://www.theglobeandmail.com/world/article-former-prince-andrew-uk-trade-files-epstein-emails/,No byline found,No article type found,"<a href=""https://www.theglobeandmail.com/world/article-former-prince-andrew-uk-trade-files-epstein-emails/"">Buckingham Palace willing to co-operate with any police inquiry into former prince Andrew</a>"
2,"Where’s Mark Carney? Sadly, not where he should be: the Olympics",https://www.theglobeandmail.com/sports/article-wheres-mark-carney-sadly-not-where-he-should-be-the-olympics/,Cathal Kelly,Opinion,"<a href=""https://www.theglobeandmail.com/sports/article-wheres-mark-carney-sadly-not-where-he-should-be-the-olympics/"">Where’s Mark Carney? Sadly, not where he should be: the Olympics</a>"
3,"Canadian women lead Czechia in third period, Gilles and Poirier sit in third after ice dance rhythm event",https://www.theglobeandmail.com/sports/olympics/article-winter-olympics-2026-day-3-live-results-medals-canada/,No byline found,No article type found,"<a href=""https://www.theglobeandmail.com/sports/olympics/article-winter-olympics-2026-day-3-live-results-medals-canada/"">Canadian women lead Czechia in third period, Gilles and Poirier sit in third after ice dance rhythm event</a>"
4,Money managers weigh in on this year’s best long-term RRSP investments,https://www.theglobeandmail.com/investing/globe-advisor/advisor-stocks/article-money-managers-weigh-in-on-this-years-best-long-term-rrsp-investments/,No byline found,No article type found,"<a href=""https://www.theglobeandmail.com/investing/globe-advisor/advisor-stocks/article-money-managers-weigh-in-on-this-years-best-long-term-rrsp-investments/"">Money managers weigh in on this year’s best long-term RRSP investments</a>"
5,This tiny B.C. city is one of the most livable in Canada – for those who can find it,https://www.theglobeandmail.com/business/article-canada-most-livable-small-city-pitt-meadows/,No byline found,No article type found,"<a href=""https://www.theglobeandmail.com/business/article-canada-most-livable-small-city-pitt-meadows/"">This tiny B.C. city is one of the most livable in Canada – for those who can find it</a>"
6,"Carney, Ford discussed idea of an early federal election to secure majority, sources say",https://www.theglobeandmail.com/politics/article-ford-advises-carney-securing-majority-would-bolster-economic-stability/,No byline found,No article type found,"<a href=""https://www.theglobeandmail.com/politics/article-ford-advises-carney-securing-majority-would-bolster-economic-stability/"">Carney, Ford discussed idea of an early federal election to secure majority, sources say</a>"
7,Starmer’s leadership on the rocks as Mandelson-Epstein revelations spark a crisis,https://www.theglobeandmail.com/world/article-uk-starmer-mandelson-epstein-crisis/,No byline found,No article type found,"<a href=""https://www.theglobeandmail.com/world/article-uk-starmer-mandelson-epstein-crisis/"">Starmer’s leadership on the rocks as Mandelson-Epstein revelations spark a crisis</a>"
8,Ontario inspector-general launches provincewide review of corruption in policing,https://www.theglobeandmail.com/canada/article-ontario-provincewide-review-corruption-in-policing/,No byline found,No article type found,"<a href=""https://www.theglobeandmail.com/canada/article-ontario-provincewide-review-corruption-in-policing/"">Ontario inspector-general launches provincewide review of corruption in policing</a>"
