Rank,Article title,url,Byline,Article type,title_with_link
1,Carney’s best option for more affordable EVs? Open the door to Europe,https://www.theglobeandmail.com/drive/culture/article-carneys-best-option-for-more-affordable-evs-open-the-door-to-europe/,Matt Bubbers,Opinion,"<a href=""https://www.theglobeandmail.com/drive/culture/article-carneys-best-option-for-more-affordable-evs-open-the-door-to-europe/"">Carney’s best option for more affordable EVs? Open the door to Europe</a>"
2,RBC analyst picks biggest winners from national energy infrastructure plans,https://www.theglobeandmail.com/investing/markets/inside-the-market/article-rbc-analyst-picks-biggest-winners-from-national-energy-infrastructure/,No byline found,No article type found,"<a href=""https://www.theglobeandmail.com/investing/markets/inside-the-market/article-rbc-analyst-picks-biggest-winners-from-national-energy-infrastructure/"">RBC analyst picks biggest winners from national energy infrastructure plans</a>"
3,"Anchor Travis Dhanraj files human rights complaint against CBC, alleging discrimination, harassment",https://www.theglobeandmail.com/arts/television/article-anchor-travis-dhanraj-files-human-rights-complaint-against-cbc/,No byline found,No article type found,"<a href=""https://www.theglobeandmail.com/arts/television/article-anchor-travis-dhanraj-files-human-rights-complaint-against-cbc/"">Anchor Travis Dhanraj files human rights complaint against CBC, alleging discrimination, harassment</a>"
4,Canada’s economy is bad. But the U.S. economy is worse,https://www.theglobeandmail.com/business/commentary/article-canada-us-economy-inflation-interest-rates/,John Rapley,Opinion,"<a href=""https://www.theglobeandmail.com/business/commentary/article-canada-us-economy-inflation-interest-rates/"">Canada’s economy is bad. But the U.S. economy is worse</a>"
5,‘Forever chemicals’ in tap water leave these communities in a toxic limbo,https://www.theglobeandmail.com/canada/article-forever-chemicals-tap-drinking-water-contamination-pfas/,No byline found,No article type found,"<a href=""https://www.theglobeandmail.com/canada/article-forever-chemicals-tap-drinking-water-contamination-pfas/"">‘Forever chemicals’ in tap water leave these communities in a toxic limbo</a>"
6,Canada had – and lost – its lead in AI. Can it avoid making the same mistake in the next emerging global technology race?,https://www.theglobeandmail.com/business/article-canada-leader-quantum-computing/,No byline found,No article type found,"<a href=""https://www.theglobeandmail.com/business/article-canada-leader-quantum-computing/"">Canada had – and lost – its lead in AI. Can it avoid making the same mistake in the next emerging global technology race?</a>"
7,Rate cuts are coming. But will dividend stocks care?,https://www.theglobeandmail.com/investing/markets/inside-the-market/article-rate-cuts-are-coming-but-will-dividend-stocks-care/,No byline found,No article type found,"<a href=""https://www.theglobeandmail.com/investing/markets/inside-the-market/article-rate-cuts-are-coming-but-will-dividend-stocks-care/"">Rate cuts are coming. But will dividend stocks care?</a>"
8,‘Rarely does Donald Trump hand Canada a gift … this immensely important biotechnology is a once-in-a-lifetime opportunity that Canada shouldn’t miss.’ Letters to the editor for Sept. 13,https://www.theglobeandmail.com/opinion/letters/article-mrna-vaccine-research-rarely-does-donald-trump-hand-canada-a-gift/,No byline found,No article type found,"<a href=""https://www.theglobeandmail.com/opinion/letters/article-mrna-vaccine-research-rarely-does-donald-trump-hand-canada-a-gift/"">‘Rarely does Donald Trump hand Canada a gift … this immensely important biotechnology is a once-in-a-lifetime opportunity that Canada shouldn’t miss.’ Letters to the editor for Sept. 13</a>"
