Rank,Article title,url,Byline,Article type,title_with_link
1,Suncor rides a wave of demand for made-in-Canada jet fuel,https://www.theglobeandmail.com/business/article-suncor-rides-a-wave-of-demand-for-made-in-canada-jet-fuel/,No byline found,No article type found,"<a href=""https://www.theglobeandmail.com/business/article-suncor-rides-a-wave-of-demand-for-made-in-canada-jet-fuel/"">Suncor rides a wave of demand for made-in-Canada jet fuel</a>"
2,AirAsia hungry for more Airbus A220 jets after historic multi-billion-dollar order,https://www.theglobeandmail.com/business/article-airbus-airasia-150-canadian-made-jets-deal/,No byline found,No article type found,"<a href=""https://www.theglobeandmail.com/business/article-airbus-airasia-150-canadian-made-jets-deal/"">AirAsia hungry for more Airbus A220 jets after historic multi-billion-dollar order</a>"
3,Kenney calls on federalists to step up in Alberta separation debate,https://www.theglobeandmail.com/canada/article-kenney-calls-on-federalists-to-step-up-in-alberta-separation-debate/,No byline found,No article type found,"<a href=""https://www.theglobeandmail.com/canada/article-kenney-calls-on-federalists-to-step-up-in-alberta-separation-debate/"">Kenney calls on federalists to step up in Alberta separation debate</a>"
4,A small Ontario town fears collapse as its last bank branch closes,https://www.theglobeandmail.com/investing/personal-finance/article-a-small-ontario-town-fears-collapse-as-its-last-bank-branch-closes/,No byline found,No article type found,"<a href=""https://www.theglobeandmail.com/investing/personal-finance/article-a-small-ontario-town-fears-collapse-as-its-last-bank-branch-closes/"">A small Ontario town fears collapse as its last bank branch closes</a>"
5,Iran reviewing new U.S. proposal as sources say sides closing in on deal to end war,https://www.theglobeandmail.com/world/article-iran-seeks-fair-deal-after-us-pauses-operation-to-open-strait-of/,No byline found,No article type found,"<a href=""https://www.theglobeandmail.com/world/article-iran-seeks-fair-deal-after-us-pauses-operation-to-open-strait-of/"">Iran reviewing new U.S. proposal as sources say sides closing in on deal to end war</a>"
6,Luxury condos to sprout from a restored 1930s auto showroom in Toronto,https://www.theglobeandmail.com/real-estate/toronto/article-luxury-condos-to-sprout-from-pierce-arrow-building-toronto/,No byline found,No article type found,"<a href=""https://www.theglobeandmail.com/real-estate/toronto/article-luxury-condos-to-sprout-from-pierce-arrow-building-toronto/"">Luxury condos to sprout from a restored 1930s auto showroom in Toronto</a>"
7,Erskine-Smith’s campaign pushes back on Ontario Liberal Party membership rejections,https://www.theglobeandmail.com/canada/article-erskine-smiths-campaign-pushes-back-on-ontario-liberal-party/,No byline found,No article type found,"<a href=""https://www.theglobeandmail.com/canada/article-erskine-smiths-campaign-pushes-back-on-ontario-liberal-party/"">Erskine-Smith’s campaign pushes back on Ontario Liberal Party membership rejections</a>"
8,Canadian dollar dips as oil price drop crimps BoC rate hike bets,https://www.theglobeandmail.com/investing/article-canadian-dollar-dips-as-oil-price-drop-crimps-boc-rate-cut-bets/,No byline found,No article type found,"<a href=""https://www.theglobeandmail.com/investing/article-canadian-dollar-dips-as-oil-price-drop-crimps-boc-rate-cut-bets/"">Canadian dollar dips as oil price drop crimps BoC rate hike bets</a>"
