Rank,Article title,url,Byline,Article type,title_with_link
1,"FIFA president will not get a motorcade escort for meeting being held in Vancouver, police say",https://www.theglobeandmail.com/canada/article-fifa-president-motorcade-escort-vancouver/,No byline found,No article type found,"<a href=""https://www.theglobeandmail.com/canada/article-fifa-president-motorcade-escort-vancouver/"">FIFA president will not get a motorcade escort for meeting being held in Vancouver, police say</a>"
2,U.S. Department of Justice indicts former Fauci adviser for hiding e-mails,https://www.theglobeandmail.com/world/us-politics/article-us-department-justice-indicts-former-fauci-adviser-for-hiding-emails/,No byline found,No article type found,"<a href=""https://www.theglobeandmail.com/world/us-politics/article-us-department-justice-indicts-former-fauci-adviser-for-hiding-emails/"">U.S. Department of Justice indicts former Fauci adviser for hiding e-mails</a>"
3,"BoC holds rate at 2.25%, but warns of energy and trade risks",https://www.theglobeandmail.com/business/economy/article-bank-of-canada-interest-rate-april-29-announcement/,No byline found,No article type found,"<a href=""https://www.theglobeandmail.com/business/economy/article-bank-of-canada-interest-rate-april-29-announcement/"">BoC holds rate at 2.25%, but warns of energy and trade risks</a>"
4,Ten fast-growing Canadian companies at reasonable valuations,https://www.theglobeandmail.com/investing/investment-ideas/number-cruncher/article-ten-fast-growing-canadian-companies-at-reasonable-valuations/,No byline found,No article type found,"<a href=""https://www.theglobeandmail.com/investing/investment-ideas/number-cruncher/article-ten-fast-growing-canadian-companies-at-reasonable-valuations/"">Ten fast-growing Canadian companies at reasonable valuations</a>"
5,Here’s what I do when my skin colour becomes more interesting than the scenery when I travel,https://www.theglobeandmail.com/life/travel/article-heres-what-i-do-when-my-skin-colour-becomes-more-interesting-than-the/,No byline found,No article type found,"<a href=""https://www.theglobeandmail.com/life/travel/article-heres-what-i-do-when-my-skin-colour-becomes-more-interesting-than-the/"">Here’s what I do when my skin colour becomes more interesting than the scenery when I travel</a>"
6,The upside-down world of Liberal budgets,https://www.theglobeandmail.com/opinion/editorials/article-the-upside-down-world-of-liberal-budgets/,No byline found,No article type found,"<a href=""https://www.theglobeandmail.com/opinion/editorials/article-the-upside-down-world-of-liberal-budgets/"">The upside-down world of Liberal budgets</a>"
7,"Extra contributions for federal pensions added up to an estimated $2-billion. Now, Ottawa is trying to address it",https://www.theglobeandmail.com/investing/personal-finance/retirement/article-federal-pensions-contributions-public-sector-union-accounting/,No byline found,No article type found,"<a href=""https://www.theglobeandmail.com/investing/personal-finance/retirement/article-federal-pensions-contributions-public-sector-union-accounting/"">Extra contributions for federal pensions added up to an estimated $2-billion. Now, Ottawa is trying to address it</a>"
8,"Quebec furniture maker Bestar to shut down factories, union officials say",https://www.theglobeandmail.com/business/article-quebec-furniture-maker-bestar-to-shut-down-factories-union-officials/,No byline found,No article type found,"<a href=""https://www.theglobeandmail.com/business/article-quebec-furniture-maker-bestar-to-shut-down-factories-union-officials/"">Quebec furniture maker Bestar to shut down factories, union officials say</a>"
