Rank,Article title,url,Byline,Article type,title_with_link
1,‘An ugly moment for IBM and software stocks’: Big Blue shares suffer their biggest ever one-day plunge after earnings warning,https://www.theglobeandmail.com/investing/article-ibm-revenue-forecast-below-estimates-ai-spending/,No byline found,No article type found,"<a href=""https://www.theglobeandmail.com/investing/article-ibm-revenue-forecast-below-estimates-ai-spending/"">‘An ugly moment for IBM and software stocks’: Big Blue shares suffer their biggest ever one-day plunge after earnings warning</a>"
2,Boy who killed elderly woman in Pickering apologizes during sentencing hearing,https://www.theglobeandmail.com/canada/toronto/article-15-year-old-boy-apologizes-in-court-for-killing-elderly-woman-in/,No byline found,No article type found,"<a href=""https://www.theglobeandmail.com/canada/toronto/article-15-year-old-boy-apologizes-in-court-for-killing-elderly-woman-in/"">Boy who killed elderly woman in Pickering apologizes during sentencing hearing</a>"
3,ARC shareholders approve $16.4-billion deal with Shell,https://www.theglobeandmail.com/business/industry-news/energy-and-resources/article-arc-shareholders-approve-164-billion-deal-with-shell/,No byline found,No article type found,"<a href=""https://www.theglobeandmail.com/business/industry-news/energy-and-resources/article-arc-shareholders-approve-164-billion-deal-with-shell/"">ARC shareholders approve $16.4-billion deal with Shell</a>"
4,"Meet the new bank, same as the old bank?",https://www.theglobeandmail.com/investing/personal-finance/article-canada-banks-telecom-service-providers-customer-loyalty/,No byline found,No article type found,"<a href=""https://www.theglobeandmail.com/investing/personal-finance/article-canada-banks-telecom-service-providers-customer-loyalty/"">Meet the new bank, same as the old bank?</a>"
5,We can’t lock down street festivals. But we can do more to lock up losers with guns,https://www.theglobeandmail.com/opinion/article-we-cant-lock-down-street-festivals-but-we-can-do-more-to-lock-up/,No byline found,No article type found,"<a href=""https://www.theglobeandmail.com/opinion/article-we-cant-lock-down-street-festivals-but-we-can-do-more-to-lock-up/"">We can’t lock down street festivals. But we can do more to lock up losers with guns</a>"
6,"In Vancouver, cycling volunteers help seniors break out of isolation and feel the wind in their hair",https://www.theglobeandmail.com/canada/article-vancouver-volunteers-seniors-cycling-without-age-care-homes-isolation/,No byline found,No article type found,"<a href=""https://www.theglobeandmail.com/canada/article-vancouver-volunteers-seniors-cycling-without-age-care-homes-isolation/"">In Vancouver, cycling volunteers help seniors break out of isolation and feel the wind in their hair</a>"
7,"On in-office days, I’m forced to use a sick day instead of working from home. Is this legal?",https://www.theglobeandmail.com/business/careers/career-advice/article-on-in-office-days-im-forced-to-use-a-sick-day-instead-of-working-from/,No byline found,No article type found,"<a href=""https://www.theglobeandmail.com/business/careers/career-advice/article-on-in-office-days-im-forced-to-use-a-sick-day-instead-of-working-from/"">On in-office days, I’m forced to use a sick day instead of working from home. Is this legal?</a>"
8,"What to know about cyclosporiasis, the gastrointestinal illness outbreak hitting the U.S.",https://www.theglobeandmail.com/canada/article-what-to-know-about-cyclosporiasis-the-gastrointestinal-illness/,No byline found,No article type found,"<a href=""https://www.theglobeandmail.com/canada/article-what-to-know-about-cyclosporiasis-the-gastrointestinal-illness/"">What to know about cyclosporiasis, the gastrointestinal illness outbreak hitting the U.S.</a>"
