Rank,Article title,url,Byline,Article type,title_with_link
1,"Many seniors want to age in place, but few are prepared for the financial and emotional costs",https://www.theglobeandmail.com/investing/personal-finance/retirement/article-many-seniors-want-to-age-in-place-but-few-are-prepared-for-the/,No byline found,No article type found,"<a href=""https://www.theglobeandmail.com/investing/personal-finance/retirement/article-many-seniors-want-to-age-in-place-but-few-are-prepared-for-the/"">Many seniors want to age in place, but few are prepared for the financial and emotional costs</a>"
2,"OPP arrest 20 people, recover more than 300 vehicles in auto theft network bust",https://www.theglobeandmail.com/canada/article-ontario-provincial-police-auto-theft-network-bust/,No byline found,No article type found,"<a href=""https://www.theglobeandmail.com/canada/article-ontario-provincial-police-auto-theft-network-bust/"">OPP arrest 20 people, recover more than 300 vehicles in auto theft network bust</a>"
3,Trump is interrupting the Survivor finale – but Global has picked the perfect replacement programming,https://www.theglobeandmail.com/culture/article-survivor-finale-global-cbs-trump-speech-broadcast-border-security/,J. Kelly Nestruck,Opinion,"<a href=""https://www.theglobeandmail.com/culture/article-survivor-finale-global-cbs-trump-speech-broadcast-border-security/"">Trump is interrupting the Survivor finale – but Global has picked the perfect replacement programming</a>"
4,Trump insults former presidents with new plaques on White House’s Walk of Fame,https://www.theglobeandmail.com/world/article-trump-plaques-white-house-walk-fame-biden-obama/,No byline found,No article type found,"<a href=""https://www.theglobeandmail.com/world/article-trump-plaques-white-house-walk-fame-biden-obama/"">Trump insults former presidents with new plaques on White House’s Walk of Fame</a>"
5,Toronto’s St. James Cathedral offers a traditional Christmas service in a fraction of the time,https://www.theglobeandmail.com/life/article-torontos-st-james-cathedral-merry-moments/,No byline found,No article type found,"<a href=""https://www.theglobeandmail.com/life/article-torontos-st-james-cathedral-merry-moments/"">Toronto’s St. James Cathedral offers a traditional Christmas service in a fraction of the time</a>"
6,"Winter storm moves into Ontario, Quebec after causing traffic chaos in the Prairies",https://www.theglobeandmail.com/canada/article-winter-storm-prairies-ontario-quebec/,No byline found,No article type found,"<a href=""https://www.theglobeandmail.com/canada/article-winter-storm-prairies-ontario-quebec/"">Winter storm moves into Ontario, Quebec after causing traffic chaos in the Prairies</a>"
7,Eli Lilly & Co. cuts price of popular diabetes and weight-loss drugs in Canada,https://www.theglobeandmail.com/business/article-eli-lilly-co-cuts-price-of-popular-diabetes-and-weight-loss-drugs-in/,No byline found,No article type found,"<a href=""https://www.theglobeandmail.com/business/article-eli-lilly-co-cuts-price-of-popular-diabetes-and-weight-loss-drugs-in/"">Eli Lilly & Co. cuts price of popular diabetes and weight-loss drugs in Canada</a>"
8,Look out for these loyalty program changes in 2026,https://www.theglobeandmail.com/investing/personal-finance/article-loyalty-card-enthusiasts-look-out-for-these-loyalty-program-changes-in/,Barry Choi,Opinion,"<a href=""https://www.theglobeandmail.com/investing/personal-finance/article-loyalty-card-enthusiasts-look-out-for-these-loyalty-program-changes-in/"">Look out for these loyalty program changes in 2026</a>"
