Rank,Article title,url,Byline,Article type,title_with_link
1,Have Victoria’s millions made a difference on Pandora Avenue? The Globe returns to check,https://www.theglobeandmail.com/canada/article-fentanyl-victoria-pandora-avenue-homelessness/,No byline found,No article type found,"<a href=""https://www.theglobeandmail.com/canada/article-fentanyl-victoria-pandora-avenue-homelessness/"">Have Victoria’s millions made a difference on Pandora Avenue? The Globe returns to check</a>"
2,Carney could have borrowed more and taken bigger risks in his budget,https://www.theglobeandmail.com/business/commentary/article-federal-budget-carney-borrowed-more-risks-investment/,John Rapley,Opinion,"<a href=""https://www.theglobeandmail.com/business/commentary/article-federal-budget-carney-borrowed-more-risks-investment/"">Carney could have borrowed more and taken bigger risks in his budget</a>"
3,Ottawa plans to spend big on defence. But is there a long-term vision for Canada’s military?,https://www.theglobeandmail.com/politics/article-federal-budget-2025-defence-spending-canadian-military-carney/,No byline found,No article type found,"<a href=""https://www.theglobeandmail.com/politics/article-federal-budget-2025-defence-spending-canadian-military-carney/"">Ottawa plans to spend big on defence. But is there a long-term vision for Canada’s military?</a>"
4,Crackdowns at the beach heighten Syrian women’s fears for their freedoms,https://www.theglobeandmail.com/world/article-syria-beach-crackdowns-women-al-sharaa-government/,No byline found,No article type found,"<a href=""https://www.theglobeandmail.com/world/article-syria-beach-crackdowns-women-al-sharaa-government/"">Crackdowns at the beach heighten Syrian women’s fears for their freedoms</a>"
5,Shadow fleet activity off Singapore demonstrates ‘Wild West’ of sanction-evading oil transfers,https://www.theglobeandmail.com/world/article-shadow-fleet-activity-off-singapore-demonstrates-wild-west-of-sanction/,No byline found,No article type found,"<a href=""https://www.theglobeandmail.com/world/article-shadow-fleet-activity-off-singapore-demonstrates-wild-west-of-sanction/"">Shadow fleet activity off Singapore demonstrates ‘Wild West’ of sanction-evading oil transfers</a>"
6,Displaying the couch Blue Jay Addison Barger slept on is more than a cheap stunt,https://www.theglobeandmail.com/life/article-blue-jays-addison-barger-couch-hotel-world-series/,No byline found,No article type found,"<a href=""https://www.theglobeandmail.com/life/article-blue-jays-addison-barger-couch-hotel-world-series/"">Displaying the couch Blue Jay Addison Barger slept on is more than a cheap stunt</a>"
7,"As Neil Young turns 80, his Canadian roots mean more than ever before",https://www.theglobeandmail.com/culture/music/article-neil-young-80th-birthday-canadian-roots/,No byline found,No article type found,"<a href=""https://www.theglobeandmail.com/culture/music/article-neil-young-80th-birthday-canadian-roots/"">As Neil Young turns 80, his Canadian roots mean more than ever before</a>"
8,The week’s best fixed and variable mortgage rates,https://www.theglobeandmail.com/investing/personal-finance/article-best-fixed-variable-mortgage-interest-rates-bank-of-canada/,No byline found,No article type found,"<a href=""https://www.theglobeandmail.com/investing/personal-finance/article-best-fixed-variable-mortgage-interest-rates-bank-of-canada/"">The week’s best fixed and variable mortgage rates</a>"
