Rank,Article title,url,Byline,Article type,title_with_link
1,Hydro One CEO David Lebeter to take temporary compassionate care leave,https://www.theglobeandmail.com/business/article-hydro-one-ceo-david-lebeter-to-take-temporary-compassionate-care-leave/,No byline found,No article type found,"<a href=""https://www.theglobeandmail.com/business/article-hydro-one-ceo-david-lebeter-to-take-temporary-compassionate-care-leave/"">Hydro One CEO David Lebeter to take temporary compassionate care leave</a>"
2,Air Canada plans to cancel flights before a potential strike. Here’s what you may be entitled to,https://www.theglobeandmail.com/investing/personal-finance/retirement/article-air-canada-strike-flight-cancellations-refund-rebooking-compensation/,No byline found,No article type found,"<a href=""https://www.theglobeandmail.com/investing/personal-finance/retirement/article-air-canada-strike-flight-cancellations-refund-rebooking-compensation/"">Air Canada plans to cancel flights before a potential strike. Here’s what you may be entitled to</a>"
3,Wealthsimple asks Ottawa to review rising bank transfer fees,https://www.theglobeandmail.com/business/article-wealthsimple-asks-ottawa-to-review-rising-bank-transfer-fees/,No byline found,No article type found,"<a href=""https://www.theglobeandmail.com/business/article-wealthsimple-asks-ottawa-to-review-rising-bank-transfer-fees/"">Wealthsimple asks Ottawa to review rising bank transfer fees</a>"
4,Toronto man races streetcars on foot – and wins – to highlight transit issues,https://www.theglobeandmail.com/canada/article-toronto-man-races-streetcars-ttc-transit-issues/,No byline found,No article type found,"<a href=""https://www.theglobeandmail.com/canada/article-toronto-man-races-streetcars-ttc-transit-issues/"">Toronto man races streetcars on foot – and wins – to highlight transit issues</a>"
5,Man charged in crash involving Ontario Premier Doug Ford now facing charges in fatal collision,https://www.theglobeandmail.com/canada/article-man-charged-in-fatal-collision-the-same-driver-involved-in-crash-with/,No byline found,No article type found,"<a href=""https://www.theglobeandmail.com/canada/article-man-charged-in-fatal-collision-the-same-driver-involved-in-crash-with/"">Man charged in crash involving Ontario Premier Doug Ford now facing charges in fatal collision</a>"
6,It’s a fantasy to think the USMCA will survive,https://www.theglobeandmail.com/opinion/article-usmca-cusma-trump-carney-trade-mexico/,Lawrence L. Herman,Opinion,"<a href=""https://www.theglobeandmail.com/opinion/article-usmca-cusma-trump-carney-trade-mexico/"">It’s a fantasy to think the USMCA will survive</a>"
7,TIFF’s latest censorship controversy is more than just a tiff. It’s existential,https://www.theglobeandmail.com/opinion/article-tiff-road-between-us-ultimate-rescue-barry-avrich/,Marsha Lederman,Opinion,"<a href=""https://www.theglobeandmail.com/opinion/article-tiff-road-between-us-ultimate-rescue-barry-avrich/"">TIFF’s latest censorship controversy is more than just a tiff. It’s existential</a>"
8,Flight attendants interrupt Air Canada news conference as contract talks stall,https://www.theglobeandmail.com/business/article-air-canada-strike-attendants-union-labour-flight-cancellations/,No byline found,No article type found,"<a href=""https://www.theglobeandmail.com/business/article-air-canada-strike-attendants-union-labour-flight-cancellations/"">Flight attendants interrupt Air Canada news conference as contract talks stall</a>"
