Rank,Article title,url,Byline,Article type,title_with_link
1,Doug Ford says his cellphone records must remain hidden to protect privacy,https://www.theglobeandmail.com/politics/article-doug-ford-foi-cell-phone-records-privacy/,No byline found,No article type found,"<a href=""https://www.theglobeandmail.com/politics/article-doug-ford-foi-cell-phone-records-privacy/"">Doug Ford says his cellphone records must remain hidden to protect privacy</a>"
2,The most oversold and overbought stocks on the TSX,https://www.theglobeandmail.com/investing/markets/inside-the-market/article-the-most-oversold-and-overbought-stocks-on-the-tsx-168/,No byline found,No article type found,"<a href=""https://www.theglobeandmail.com/investing/markets/inside-the-market/article-the-most-oversold-and-overbought-stocks-on-the-tsx-168/"">The most oversold and overbought stocks on the TSX</a>"
3,How much do you know about healthy eating? Take our nutrition quiz,https://www.theglobeandmail.com/life/article-healthy-eating-nutrition-quiz/,No byline found,No article type found,"<a href=""https://www.theglobeandmail.com/life/article-healthy-eating-nutrition-quiz/"">How much do you know about healthy eating? Take our nutrition quiz</a>"
4,How to shop the fall 2026 runway trends that are on sale now,https://www.theglobeandmail.com/life/style/fashion-and-beauty/article-shop-fall-2026-fashion-runway-trends-on-sale/,No byline found,No article type found,"<a href=""https://www.theglobeandmail.com/life/style/fashion-and-beauty/article-shop-fall-2026-fashion-runway-trends-on-sale/"">How to shop the fall 2026 runway trends that are on sale now</a>"
5,"Boomers aren’t really hoarding wealth, but an aging population requires reforms",https://www.theglobeandmail.com/opinion/article-boomers-generational-wealth-aging-population-reforms/,Sasha van Katwyk,Opinion,"<a href=""https://www.theglobeandmail.com/opinion/article-boomers-generational-wealth-aging-population-reforms/"">Boomers aren’t really hoarding wealth, but an aging population requires reforms</a>"
6,European leaders rebuff Trump’s calls for military help in Strait of Hormuz,https://www.theglobeandmail.com/world/article-starmer-carney-meeting-strait-of-hormuz-iran-war/,No byline found,No article type found,"<a href=""https://www.theglobeandmail.com/world/article-starmer-carney-meeting-strait-of-hormuz-iran-war/"">European leaders rebuff Trump’s calls for military help in Strait of Hormuz</a>"
7,One Battle After Another wins big as Canadians triumph in heated rivalry with Hollywood,https://www.theglobeandmail.com/culture/film-and-tv/film/article-oscars-2026-best-and-worst-moments/,No byline found,No article type found,"<a href=""https://www.theglobeandmail.com/culture/film-and-tv/film/article-oscars-2026-best-and-worst-moments/"">One Battle After Another wins big as Canadians triumph in heated rivalry with Hollywood</a>"
8,He’s useful in a crisis – but is he any good at politics? A look at Mark Carney’s first year,https://www.theglobeandmail.com/politics/opinion/article-hes-useful-in-a-crisis-but-is-he-any-good-at-politics-a-look-at-mark/,Shannon Proudfoot,Opinion,"<a href=""https://www.theglobeandmail.com/politics/opinion/article-hes-useful-in-a-crisis-but-is-he-any-good-at-politics-a-look-at-mark/"">He’s useful in a crisis – but is he any good at politics? A look at Mark Carney’s first year</a>"
