Rank,Article title,url,Byline,Article type,title_with_link
1,Why is France recognizing Palestinian statehood and who else has?,https://www.theglobeandmail.com/world/article-why-is-france-recognizing-palestinian-statehood-and-who-else-has/,No byline found,No article type found,"<a href=""https://www.theglobeandmail.com/world/article-why-is-france-recognizing-palestinian-statehood-and-who-else-has/"">Why is France recognizing Palestinian statehood and who else has?</a>"
2,Three workers rescued from B.C. mine after more than 60 hours underground,https://www.theglobeandmail.com/business/industry-news/energy-and-resources/article-three-workers-trapped-in-bc-mine-rescued-after-more-than-60-hours/,No byline found,No article type found,"<a href=""https://www.theglobeandmail.com/business/industry-news/energy-and-resources/article-three-workers-trapped-in-bc-mine-rescued-after-more-than-60-hours/"">Three workers rescued from B.C. mine after more than 60 hours underground</a>"
3,Astronomer HR head caught with CEO at Coldplay concert resigns,https://www.theglobeandmail.com/business/article-hr-exec-whose-embrace-with-ce0-was-caught-on-cam-during-coldplay/,No byline found,No article type found,"<a href=""https://www.theglobeandmail.com/business/article-hr-exec-whose-embrace-with-ce0-was-caught-on-cam-during-coldplay/"">Astronomer HR head caught with CEO at Coldplay concert resigns</a>"
4,"Real estate is not a financial slam dunk, Canadians are learning the hard way",https://www.theglobeandmail.com/investing/markets/inside-the-market/article-real-estate-is-not-a-financial-slam-dunk-canadians-are-learning-the/,No byline found,No article type found,"<a href=""https://www.theglobeandmail.com/investing/markets/inside-the-market/article-real-estate-is-not-a-financial-slam-dunk-canadians-are-learning-the/"">Real estate is not a financial slam dunk, Canadians are learning the hard way</a>"
5,Trump says trade deal with Canada may not be reached,https://www.theglobeandmail.com/world/article-trump-canada-us-trade-deal/,No byline found,No article type found,"<a href=""https://www.theglobeandmail.com/world/article-trump-canada-us-trade-deal/"">Trump says trade deal with Canada may not be reached</a>"
6,Social media is serving up big muscles and normalizing steroid use,https://www.theglobeandmail.com/life/health-and-fitness/article-social-media-shame-steroids-testosterone-mens-health/,No byline found,No article type found,"<a href=""https://www.theglobeandmail.com/life/health-and-fitness/article-social-media-shame-steroids-testosterone-mens-health/"">Social media is serving up big muscles and normalizing steroid use</a>"
7,TD Bank tells staff to work from the office four days a week as of November,https://www.theglobeandmail.com/business/article-td-bank-return-to-office-mandate/,No byline found,No article type found,"<a href=""https://www.theglobeandmail.com/business/article-td-bank-return-to-office-mandate/"">TD Bank tells staff to work from the office four days a week as of November</a>"
8,NHLPA says players should get opportunity to ‘return to work’ at the league,https://www.theglobeandmail.com/sports/article-nhl-to-review-hockey-canada-verdict/,No byline found,No article type found,"<a href=""https://www.theglobeandmail.com/sports/article-nhl-to-review-hockey-canada-verdict/"">NHLPA says players should get opportunity to ‘return to work’ at the league</a>"
