Rank,Article title,url,Byline,Article type,title_with_link
1,Stephanie Smyth once covered Doug Ford on the news. Now she faces him in the Ontario legislature,https://www.theglobeandmail.com/canada/article-stephanie-smyth-doug-ford-ontario-legislature/,No byline found,No article type found,"<a href=""https://www.theglobeandmail.com/canada/article-stephanie-smyth-doug-ford-ontario-legislature/"">Stephanie Smyth once covered Doug Ford on the news. Now she faces him in the Ontario legislature</a>"
2,"In Canada, householders must use ‘reasonable force’ against an intruder. That’s perfectly reasonable",https://www.theglobeandmail.com/opinion/article-in-canada-householders-must-use-reasonable-force-against-an-intruder/,No byline found,No article type found,"<a href=""https://www.theglobeandmail.com/opinion/article-in-canada-householders-must-use-reasonable-force-against-an-intruder/"">In Canada, householders must use ‘reasonable force’ against an intruder. That’s perfectly reasonable</a>"
3,"CIBC third-quarter profit rises on strong retail banking, capital markets results",https://www.theglobeandmail.com/business/article-cibc-third-quarter-earnings-profit-rises/,No byline found,No article type found,"<a href=""https://www.theglobeandmail.com/business/article-cibc-third-quarter-earnings-profit-rises/"">CIBC third-quarter profit rises on strong retail banking, capital markets results</a>"
4,An Ontario woman died of an infection after an abortion. Her sister says doctors failed her,https://www.theglobeandmail.com/canada/article-rheanna-laderoute-death-ontario-southlake-hospital-doctors-discipline/,No byline found,No article type found,"<a href=""https://www.theglobeandmail.com/canada/article-rheanna-laderoute-death-ontario-southlake-hospital-doctors-discipline/"">An Ontario woman died of an infection after an abortion. Her sister says doctors failed her</a>"
5,Thursday’s analyst upgrades and downgrades,https://www.theglobeandmail.com/investing/markets/inside-the-market/article-thursdays-analyst-upgrades-and-downgrades-273/,No byline found,No article type found,"<a href=""https://www.theglobeandmail.com/investing/markets/inside-the-market/article-thursdays-analyst-upgrades-and-downgrades-273/"">Thursday’s analyst upgrades and downgrades</a>"
6,"Russia launches mass overnight drone and missile attack on Kyiv, killing at least 17",https://www.theglobeandmail.com/world/article-russia-launches-mass-overnight-drone-and-missile-attack-on-kyiv/,No byline found,No article type found,"<a href=""https://www.theglobeandmail.com/world/article-russia-launches-mass-overnight-drone-and-missile-attack-on-kyiv/"">Russia launches mass overnight drone and missile attack on Kyiv, killing at least 17</a>"
7,Ontario securities regulator files to force former Bridging Finance executives into bankruptcy,https://www.theglobeandmail.com/business/article-ontario-securities-regulator-files-to-force-former-bridging-finance/,No byline found,No article type found,"<a href=""https://www.theglobeandmail.com/business/article-ontario-securities-regulator-files-to-force-former-bridging-finance/"">Ontario securities regulator files to force former Bridging Finance executives into bankruptcy</a>"
8,"Defence procurement secretary and Lockheed Martin meet, discuss purchase of fighter jets",https://www.theglobeandmail.com/business/economy/article-defence-procurement-stephen-fuhr-lockheed-martin-fighter-jets-purchase/,No byline found,No article type found,"<a href=""https://www.theglobeandmail.com/business/economy/article-defence-procurement-stephen-fuhr-lockheed-martin-fighter-jets-purchase/"">Defence procurement secretary and Lockheed Martin meet, discuss purchase of fighter jets</a>"
