Rank,Article title,url,Byline,Article type,title_with_link
1,Before the Bell: What every Canadian investor needs to know today,https://www.theglobeandmail.com/investing/markets/inside-the-market/article-before-the-bell-what-every-canadian-investor-needs-to-know-today-1446/,No byline found,No article type found,"<a href=""https://www.theglobeandmail.com/investing/markets/inside-the-market/article-before-the-bell-what-every-canadian-investor-needs-to-know-today-1446/"">Before the Bell: What every Canadian investor needs to know today</a>"
2,Canada won’t underestimate ‘tough’ Bosnia and Herzegovina in World Cup opener,https://www.theglobeandmail.com/sports/article-canada-wont-underestimate-tough-bosnia-and-herzegovina-in-world-cup/,No byline found,No article type found,"<a href=""https://www.theglobeandmail.com/sports/article-canada-wont-underestimate-tough-bosnia-and-herzegovina-in-world-cup/"">Canada won’t underestimate ‘tough’ Bosnia and Herzegovina in World Cup opener</a>"
3,It’s obvious where Mark Carney stands on forced labour in China,https://www.theglobeandmail.com/opinion/article-its-obvious-where-mark-carney-stands-on-forced-labour-in-china/,No byline found,No article type found,"<a href=""https://www.theglobeandmail.com/opinion/article-its-obvious-where-mark-carney-stands-on-forced-labour-in-china/"">It’s obvious where Mark Carney stands on forced labour in China</a>"
4,"Anand, Saudi officials discuss how Canada might help open Strait of Hormuz",https://www.theglobeandmail.com/politics/article-anand-saudi-officials-discuss-how-canada-might-help-open-strait-of/,No byline found,No article type found,"<a href=""https://www.theglobeandmail.com/politics/article-anand-saudi-officials-discuss-how-canada-might-help-open-strait-of/"">Anand, Saudi officials discuss how Canada might help open Strait of Hormuz</a>"
5,"Stephen Lewis, humanitarian and former Ontario NDP leader, dies at 88",https://www.theglobeandmail.com/canada/article-stephen-lewis-dies-ndp-avi-lewis/,No byline found,No article type found,"<a href=""https://www.theglobeandmail.com/canada/article-stephen-lewis-dies-ndp-avi-lewis/"">Stephen Lewis, humanitarian and former Ontario NDP leader, dies at 88</a>"
6,Good income gushers are hard to find. Do not despair,https://www.theglobeandmail.com/investing/personal-finance/article-on-money-income-gushers-interest-rates-stock-market/,No byline found,No article type found,"<a href=""https://www.theglobeandmail.com/investing/personal-finance/article-on-money-income-gushers-interest-rates-stock-market/"">Good income gushers are hard to find. Do not despair</a>"
7,"Analysts’ forecast returns, recommendations and yields for all stocks in the S&P/TSX Composite Index",https://www.theglobeandmail.com/investing/markets/inside-the-market/article-analysts-forecast-returns-recommendations-and-yields-for-all-stocks-in-58/,No byline found,No article type found,"<a href=""https://www.theglobeandmail.com/investing/markets/inside-the-market/article-analysts-forecast-returns-recommendations-and-yields-for-all-stocks-in-58/"">Analysts’ forecast returns, recommendations and yields for all stocks in the S&P/TSX Composite Index</a>"
8,"At 75, I moved to Spain with my family. When they left, I stayed",https://www.theglobeandmail.com/life/first-person/article-at-75-i-moved-to-spain-with-my-family-when-they-left-i-stayed/,No byline found,No article type found,"<a href=""https://www.theglobeandmail.com/life/first-person/article-at-75-i-moved-to-spain-with-my-family-when-they-left-i-stayed/"">At 75, I moved to Spain with my family. When they left, I stayed</a>"
