Rank,Article title,url,Byline,Article type,title_with_link
1,There was little confidence in TD’s ‘highly confident’ support for GameStop’s eBay bid,https://www.theglobeandmail.com/business/article-there-was-little-confidence-in-tds-highly-confident-support-for/,No byline found,Analysis,"<a href=""https://www.theglobeandmail.com/business/article-there-was-little-confidence-in-tds-highly-confident-support-for/"">There was little confidence in TD’s ‘highly confident’ support for GameStop’s eBay bid</a>"
2,"This is neither peace nor war, and everyone’s a winner and a loser",https://www.theglobeandmail.com/world/us-politics/article-this-is-neither-peace-nor-war-and-everyones-a-winner-and-a-loser/,No byline found,Analysis,"<a href=""https://www.theglobeandmail.com/world/us-politics/article-this-is-neither-peace-nor-war-and-everyones-a-winner-and-a-loser/"">This is neither peace nor war, and everyone’s a winner and a loser</a>"
3,Is AI coming for our thinking? Behold the age of ‘cognitive surrender’,https://www.theglobeandmail.com/life/social-trends/article-is-ai-coming-for-our-thinking-behold-the-age-of-cognitive-surrender/,No byline found,No article type found,"<a href=""https://www.theglobeandmail.com/life/social-trends/article-is-ai-coming-for-our-thinking-behold-the-age-of-cognitive-surrender/"">Is AI coming for our thinking? Behold the age of ‘cognitive surrender’</a>"
4,"No, aging baby boomers will not trigger a glut of suburban homes for young families",https://www.theglobeandmail.com/investing/personal-finance/article-housing-baby-boomers-suburban-homes-young-families/,Mike Moffatt,Opinion,"<a href=""https://www.theglobeandmail.com/investing/personal-finance/article-housing-baby-boomers-suburban-homes-young-families/"">No, aging baby boomers will not trigger a glut of suburban homes for young families</a>"
5,Separatist leader accused of misusing Alberta electors list refuses to co-operate with investigators,https://www.theglobeandmail.com/canada/alberta/article-separatist-leader-accused-of-misusing-alberta-electors-list-refuses-to/,No byline found,No article type found,"<a href=""https://www.theglobeandmail.com/canada/alberta/article-separatist-leader-accused-of-misusing-alberta-electors-list-refuses-to/"">Separatist leader accused of misusing Alberta electors list refuses to co-operate with investigators</a>"
6,"Ottawa, Alberta close to reaching industrial carbon pricing deal, sources say",https://www.theglobeandmail.com/politics/article-ottawa-alberta-industrial-carbon-pricing-oil-pipeline-smith-carney/,No byline found,No article type found,"<a href=""https://www.theglobeandmail.com/politics/article-ottawa-alberta-industrial-carbon-pricing-oil-pipeline-smith-carney/"">Ottawa, Alberta close to reaching industrial carbon pricing deal, sources say</a>"
7,Eight beaten-down TSX companies growing at cheap valuations,https://www.theglobeandmail.com/investing/investment-ideas/number-cruncher/article-tsx-companies-stocks-cruncher-wsp-birchcliff/,No byline found,No article type found,"<a href=""https://www.theglobeandmail.com/investing/investment-ideas/number-cruncher/article-tsx-companies-stocks-cruncher-wsp-birchcliff/"">Eight beaten-down TSX companies growing at cheap valuations</a>"
8,Premier Danielle Smith leads a separatist party,https://www.theglobeandmail.com/opinion/article-alberta-independence-danielle-smith-separatists-referendum/,Gary Mason,Opinion,"<a href=""https://www.theglobeandmail.com/opinion/article-alberta-independence-danielle-smith-separatists-referendum/"">Premier Danielle Smith leads a separatist party</a>"
