Rank,Article title,url,Byline,Article type,title_with_link
1,What to know about Diego Garcia after Iran targets island’s U.K.-U.S. base,https://www.theglobeandmail.com/world/article-diego-garcia-iran-explainer/,No byline found,No article type found,"<a href=""https://www.theglobeandmail.com/world/article-diego-garcia-iran-explainer/"">What to know about Diego Garcia after Iran targets island’s U.K.-U.S. base</a>"
2,Renovated 1920s cabin in North Vancouver draws an appreciative buyer after long sale,https://www.theglobeandmail.com/real-estate/vancouver/article-renovated-1920s-cabin-north-vancouver-deep-cove-long-sale/,No byline found,No article type found,"<a href=""https://www.theglobeandmail.com/real-estate/vancouver/article-renovated-1920s-cabin-north-vancouver-deep-cove-long-sale/"">Renovated 1920s cabin in North Vancouver draws an appreciative buyer after long sale</a>"
3,The Hormuz crisis instantly exposed the risks of rolling back green and cleantech agendas,https://www.theglobeandmail.com/business/commentary/article-iran-war-strait-of-hormuz-oil-renewable-energy-wind-nuclear/,Eric Reguly,Opinion,"<a href=""https://www.theglobeandmail.com/business/commentary/article-iran-war-strait-of-hormuz-oil-renewable-energy-wind-nuclear/"">The Hormuz crisis instantly exposed the risks of rolling back green and cleantech agendas</a>"
4,Pierre Poilievre and Joe Rogan talk a little bit about politics and so much about kettlebells,https://www.theglobeandmail.com/politics/opinion/article-pierre-poilievre-joe-rogan-experience-politics-kettlebells/,Shannon Proudfoot,Opinion,"<a href=""https://www.theglobeandmail.com/politics/opinion/article-pierre-poilievre-joe-rogan-experience-politics-kettlebells/"">Pierre Poilievre and Joe Rogan talk a little bit about politics and so much about kettlebells</a>"
5,The new ordeal of an innocent man,https://www.theglobeandmail.com/canada/toronto/article-the-new-ordeal-of-an-innocent-man/,Marcus Gee,Opinion,"<a href=""https://www.theglobeandmail.com/canada/toronto/article-the-new-ordeal-of-an-innocent-man/"">The new ordeal of an innocent man</a>"
6,Vancouver condo investors sell and head for the sidelines,https://www.theglobeandmail.com/real-estate/vancouver/article-vancouver-condo-investors-sell-and-head-for-the-sidelines/,No byline found,No article type found,"<a href=""https://www.theglobeandmail.com/real-estate/vancouver/article-vancouver-condo-investors-sell-and-head-for-the-sidelines/"">Vancouver condo investors sell and head for the sidelines</a>"
7,Afghans are addicted to a call-in TV show that lets them speak freely. It’s just not produced in Afghanistan,https://www.theglobeandmail.com/world/article-afghanistan-jan-e-gap-tv-show/,No byline found,No article type found,"<a href=""https://www.theglobeandmail.com/world/article-afghanistan-jan-e-gap-tv-show/"">Afghans are addicted to a call-in TV show that lets them speak freely. It’s just not produced in Afghanistan</a>"
8,How the oil shock could lead to wider economic pain for Canada,https://www.theglobeandmail.com/business/article-oil-shock-wider-economic-pain-canada/,No byline found,No article type found,"<a href=""https://www.theglobeandmail.com/business/article-oil-shock-wider-economic-pain-canada/"">How the oil shock could lead to wider economic pain for Canada</a>"
