Rank,Article title,url,Byline,Article type,title_with_link
1,The most oversold and overbought stocks on the TSX,https://www.theglobeandmail.com/investing/markets/inside-the-market/article-the-most-oversold-and-overbought-stocks-on-the-tsx-168/,No byline found,No article type found,"<a href=""https://www.theglobeandmail.com/investing/markets/inside-the-market/article-the-most-oversold-and-overbought-stocks-on-the-tsx-168/"">The most oversold and overbought stocks on the TSX</a>"
2,Canada’s inflation rate eases to 1.8% in February but rising oil prices likely to change outlook,https://www.theglobeandmail.com/business/economy/article-canadas-inflation-rate-february-statscan-interest-rates/,No byline found,No article type found,"<a href=""https://www.theglobeandmail.com/business/economy/article-canadas-inflation-rate-february-statscan-interest-rates/"">Canada’s inflation rate eases to 1.8% in February but rising oil prices likely to change outlook</a>"
3,Looking for bargain stocks with cash flow? Consider this strategy,https://www.theglobeandmail.com/investing/markets/inside-the-market/article-looking-for-bargain-stocks-with-cash-flow-consider-this-strategy/,No byline found,No article type found,"<a href=""https://www.theglobeandmail.com/investing/markets/inside-the-market/article-looking-for-bargain-stocks-with-cash-flow-consider-this-strategy/"">Looking for bargain stocks with cash flow? Consider this strategy</a>"
4,Company offers use of private deep-water Baffin Island port to Department of National Defence,https://www.theglobeandmail.com/politics/article-baffin-island-port-department-of-national-defence-offer/,No byline found,No article type found,"<a href=""https://www.theglobeandmail.com/politics/article-baffin-island-port-department-of-national-defence-offer/"">Company offers use of private deep-water Baffin Island port to Department of National Defence</a>"
5,"Boomers aren’t really hoarding wealth, but an aging population requires reforms",https://www.theglobeandmail.com/opinion/article-boomers-generational-wealth-aging-population-reforms/,Sasha van Katwyk,Opinion,"<a href=""https://www.theglobeandmail.com/opinion/article-boomers-generational-wealth-aging-population-reforms/"">Boomers aren’t really hoarding wealth, but an aging population requires reforms</a>"
6,"Starmer rules out NATO mission to open Strait of Hormuz, says Britain is working with allies on a plan",https://www.theglobeandmail.com/world/article-starmer-carney-meeting-strait-of-hormuz-iran-war/,No byline found,No article type found,"<a href=""https://www.theglobeandmail.com/world/article-starmer-carney-meeting-strait-of-hormuz-iran-war/"">Starmer rules out NATO mission to open Strait of Hormuz, says Britain is working with allies on a plan</a>"
7,One Battle After Another wins big as Canadians triumph in heated rivalry with Hollywood,https://www.theglobeandmail.com/culture/film-and-tv/film/article-oscars-2026-best-and-worst-moments/,No byline found,No article type found,"<a href=""https://www.theglobeandmail.com/culture/film-and-tv/film/article-oscars-2026-best-and-worst-moments/"">One Battle After Another wins big as Canadians triumph in heated rivalry with Hollywood</a>"
8,A committee to duck density and democracy,https://www.theglobeandmail.com/opinion/editorials/article-toronto-housing-planning-density/,No byline found,No article type found,"<a href=""https://www.theglobeandmail.com/opinion/editorials/article-toronto-housing-planning-density/"">A committee to duck density and democracy</a>"
