Rank,Article title,url,Byline,Article type,title_with_link
1,Investor buys Barrie bungalow after conditional sale falls through,https://www.theglobeandmail.com/real-estate/toronto/article-investor-buys-barrie-bungalow-after-conditional-sale-falls-through/,No byline found,No article type found,"<a href=""https://www.theglobeandmail.com/real-estate/toronto/article-investor-buys-barrie-bungalow-after-conditional-sale-falls-through/"">Investor buys Barrie bungalow after conditional sale falls through</a>"
2,U.S. lumber group expands list of complaints against Canadian softwood producers,https://www.theglobeandmail.com/business/article-us-lumber-group-complaints-canadian-softwood-producers/,No byline found,No article type found,"<a href=""https://www.theglobeandmail.com/business/article-us-lumber-group-complaints-canadian-softwood-producers/"">U.S. lumber group expands list of complaints against Canadian softwood producers</a>"
3,Elon Musk’s Starlink internet plans ignite anger in South Africa,https://www.theglobeandmail.com/business/article-elon-musk-starlink-spacex-south-africa-zimbabwe/,No byline found,No article type found,"<a href=""https://www.theglobeandmail.com/business/article-elon-musk-starlink-spacex-south-africa-zimbabwe/"">Elon Musk’s Starlink internet plans ignite anger in South Africa</a>"
4,Former prince Andrew arrested on suspicion of misconduct in public office related to Epstein ties,https://www.theglobeandmail.com/world/article-former-prince-andrew-arrested-epstein/,No byline found,No article type found,"<a href=""https://www.theglobeandmail.com/world/article-former-prince-andrew-arrested-epstein/"">Former prince Andrew arrested on suspicion of misconduct in public office related to Epstein ties</a>"
5,The time bomb waiting to blow up B.C.’s budget,https://www.theglobeandmail.com/opinion/editorials/article-the-time-bomb-waiting-to-blow-up-bcs-budget/,No byline found,No article type found,"<a href=""https://www.theglobeandmail.com/opinion/editorials/article-the-time-bomb-waiting-to-blow-up-bcs-budget/"">The time bomb waiting to blow up B.C.’s budget</a>"
6,"Canada to curl for men’s gold, women’s team into semis and Sharpe stable after halfpipe crash",https://www.theglobeandmail.com/sports/olympics/article-milan-olympics-womens-hockey-gold-live-updates/,No byline found,No article type found,"<a href=""https://www.theglobeandmail.com/sports/olympics/article-milan-olympics-womens-hockey-gold-live-updates/"">Canada to curl for men’s gold, women’s team into semis and Sharpe stable after halfpipe crash</a>"
7,CPP payments slow in 2026 as retirees cope with high living costs,https://www.theglobeandmail.com/investing/personal-finance/retirement/article-cpp-payments-2026-retirement-cost-of-living-pension/,No byline found,No article type found,"<a href=""https://www.theglobeandmail.com/investing/personal-finance/retirement/article-cpp-payments-2026-retirement-cost-of-living-pension/"">CPP payments slow in 2026 as retirees cope with high living costs</a>"
8,Canada loses overtime heartbreaker to U.S. 2-1 in women’s gold-medal hockey final,https://www.theglobeandmail.com/sports/olympics/article-olympic-hockey-canada-vs-us-gold-medal-game-womens-score/,No byline found,No article type found,"<a href=""https://www.theglobeandmail.com/sports/olympics/article-olympic-hockey-canada-vs-us-gold-medal-game-womens-score/"">Canada loses overtime heartbreaker to U.S. 2-1 in women’s gold-medal hockey final</a>"
