Rank,Article title,url,Byline,Article type,title_with_link
1,How did the Temporary Foreign Worker program come to be the scapegoat for all our ills?,https://www.theglobeandmail.com/opinion/article-temporary-foreign-worker-program-immigration-scapegoat/,No byline found,No article type found,"<a href=""https://www.theglobeandmail.com/opinion/article-temporary-foreign-worker-program-immigration-scapegoat/"">How did the Temporary Foreign Worker program come to be the scapegoat for all our ills?</a>"
2,"Edmonton police publicly challenge Crown prosecutors, demand manslaughter plea deal is scrapped",https://www.theglobeandmail.com/canada/alberta/article-edmonton-police-crown-prosecutors-manslaughter-plea-deal/,No byline found,No article type found,"<a href=""https://www.theglobeandmail.com/canada/alberta/article-edmonton-police-crown-prosecutors-manslaughter-plea-deal/"">Edmonton police publicly challenge Crown prosecutors, demand manslaughter plea deal is scrapped</a>"
3,Air Canada updates: What happens next after flight attendants rejected agreement?,https://www.theglobeandmail.com/canada/article-air-canada-flight-attendants-union-strike-bargaining-agreement/,No byline found,No article type found,"<a href=""https://www.theglobeandmail.com/canada/article-air-canada-flight-attendants-union-strike-bargaining-agreement/"">Air Canada updates: What happens next after flight attendants rejected agreement?</a>"
4,TIFF CEO Cameron Bailey says reversals around Oct. 7 documentary ‘caused a lot of pain’,https://www.theglobeandmail.com/arts/film/tiff/article-tiff-ceo-cameron-bailey-speaks-out-on-reversal-of-oct-7-documentary-i/,No byline found,No article type found,"<a href=""https://www.theglobeandmail.com/arts/film/tiff/article-tiff-ceo-cameron-bailey-speaks-out-on-reversal-of-oct-7-documentary-i/"">TIFF CEO Cameron Bailey says reversals around Oct. 7 documentary ‘caused a lot of pain’</a>"
5,"Stellantis, GM shift announcements a ‘sign of life’ for auto sector, union head says",https://www.theglobeandmail.com/business/article-stellantis-general-motors-shifts-auto-sector-tariffs-jobs-union-trump/,No byline found,No article type found,"<a href=""https://www.theglobeandmail.com/business/article-stellantis-general-motors-shifts-auto-sector-tariffs-jobs-union-trump/"">Stellantis, GM shift announcements a ‘sign of life’ for auto sector, union head says</a>"
6,Poland invokes NATO treaty Article 4 after drones shot down during Russian attack on Ukraine,https://www.theglobeandmail.com/world/article-poland-shoots-down-russian-drones/,No byline found,No article type found,"<a href=""https://www.theglobeandmail.com/world/article-poland-shoots-down-russian-drones/"">Poland invokes NATO treaty Article 4 after drones shot down during Russian attack on Ukraine</a>"
7,Lumber prices haven’t bottomed yet. Here’s when they will,https://www.theglobeandmail.com/investing/investment-ideas/article-where-are-lumber-prices-heading/,No byline found,No article type found,"<a href=""https://www.theglobeandmail.com/investing/investment-ideas/article-where-are-lumber-prices-heading/"">Lumber prices haven’t bottomed yet. Here’s when they will</a>"
8,"Public Safety Minister’s link to civil liberties group doesn’t require ethics screen, watchdog says",https://www.theglobeandmail.com/canada/article-public-safety-minister-gary-anandasangaree-conflict-of-interest/,No byline found,No article type found,"<a href=""https://www.theglobeandmail.com/canada/article-public-safety-minister-gary-anandasangaree-conflict-of-interest/"">Public Safety Minister’s link to civil liberties group doesn’t require ethics screen, watchdog says</a>"
