Rank,Article title,url,Byline,Article type,title_with_link
1,Toronto man poised to become the first Canadian cured of HIV,https://www.theglobeandmail.com/canada/article-toronto-man-poised-to-become-the-first-canadian-cured-of-hiv/,No byline found,No article type found,"<a href=""https://www.theglobeandmail.com/canada/article-toronto-man-poised-to-become-the-first-canadian-cured-of-hiv/"">Toronto man poised to become the first Canadian cured of HIV</a>"
2,"Trump safe after shots fired at White House correspondents’ dinner, suspected gunman detained",https://www.theglobeandmail.com/world/us-politics/article-trump-safe-after-security-incident-at-white-house-correspondents/,No byline found,No article type found,"<a href=""https://www.theglobeandmail.com/world/us-politics/article-trump-safe-after-security-incident-at-white-house-correspondents/"">Trump safe after shots fired at White House correspondents’ dinner, suspected gunman detained</a>"
3,Buckingham Palace discussing royal visit with Washington after shooting near Trump,https://www.theglobeandmail.com/world/article-king-charles-us-visit-2026-trump-april-26/,No byline found,No article type found,"<a href=""https://www.theglobeandmail.com/world/article-king-charles-us-visit-2026-trump-april-26/"">Buckingham Palace discussing royal visit with Washington after shooting near Trump</a>"
4,"Who is Cole Tomas Allen, the alleged attacker at the White House correspondents’ dinner",https://www.theglobeandmail.com/world/article-cole-tomas-allen-shooter-california-april-26/,No byline found,No article type found,"<a href=""https://www.theglobeandmail.com/world/article-cole-tomas-allen-shooter-california-april-26/"">Who is Cole Tomas Allen, the alleged attacker at the White House correspondents’ dinner</a>"
5,The costly fantasy of high-speed rail,https://www.theglobeandmail.com/opinion/editorials/article-the-costly-fantasy-of-high-speed-rail/,No byline found,No article type found,"<a href=""https://www.theglobeandmail.com/opinion/editorials/article-the-costly-fantasy-of-high-speed-rail/"">The costly fantasy of high-speed rail</a>"
6,Mexico says U.S. agents killed in car crash weren’t authorized to participate in local operation,https://www.theglobeandmail.com/world/article-mexico-says-us-agents-killed-in-car-crash-werent-authorized-to/,No byline found,No article type found,"<a href=""https://www.theglobeandmail.com/world/article-mexico-says-us-agents-killed-in-car-crash-werent-authorized-to/"">Mexico says U.S. agents killed in car crash weren’t authorized to participate in local operation</a>"
7,So much for the end of high inflation,https://www.theglobeandmail.com/investing/markets/inside-the-market/article-high-inflation-iran-war-market-forces/,No byline found,No article type found,"<a href=""https://www.theglobeandmail.com/investing/markets/inside-the-market/article-high-inflation-iran-war-market-forces/"">So much for the end of high inflation</a>"
8,Canada’s Best Executives 2026: The unsung lieutenants who give their companies the extra edge,https://www.theglobeandmail.com/business/rob-magazine/article-best-executives-2026/,No byline found,No article type found,"<a href=""https://www.theglobeandmail.com/business/rob-magazine/article-best-executives-2026/"">Canada’s Best Executives 2026: The unsung lieutenants who give their companies the extra edge</a>"
