Rank,Article title,url,Byline,Article type,title_with_link
1,How Trump plans to continue his trade war with Canada without IEEPA,https://www.theglobeandmail.com/business/article-how-trump-plans-to-continue-trade-war-supreme-court-ieepa/,No byline found,No article type found,"<a href=""https://www.theglobeandmail.com/business/article-how-trump-plans-to-continue-trade-war-supreme-court-ieepa/"">How Trump plans to continue his trade war with Canada without IEEPA</a>"
2,MacKinnon seizes the moment to etch his name in the stars,https://www.theglobeandmail.com/sports/olympics/article-mackinnon-seizes-the-moment-to-etch-his-name-in-the-stars/,Cathal Kelly,Opinion,"<a href=""https://www.theglobeandmail.com/sports/olympics/article-mackinnon-seizes-the-moment-to-etch-his-name-in-the-stars/"">MacKinnon seizes the moment to etch his name in the stars</a>"
3,What to watch this weekend: Netflix’s German spy thriller Unfamiliar is uber entertaining,https://www.theglobeandmail.com/culture/film-and-tv/television/article-tv-unfamiliar-detectorists-bugonia-bravest-knight-judge-tyco/,No byline found,No article type found,"<a href=""https://www.theglobeandmail.com/culture/film-and-tv/television/article-tv-unfamiliar-detectorists-bugonia-bravest-knight-judge-tyco/"">What to watch this weekend: Netflix’s German spy thriller Unfamiliar is uber entertaining</a>"
4,U.S. lumber group expands list of complaints against Canadian softwood producers,https://www.theglobeandmail.com/business/article-us-lumber-group-complaints-canadian-softwood-producers/,No byline found,No article type found,"<a href=""https://www.theglobeandmail.com/business/article-us-lumber-group-complaints-canadian-softwood-producers/"">U.S. lumber group expands list of complaints against Canadian softwood producers</a>"
5,The Globe’s 20 best dividend-paying stocks of the year,https://www.theglobeandmail.com/investing/markets/inside-the-market/article-dividend-all-stars-20-best-performing-dividend-stocks-tsx/,No byline found,No article type found,"<a href=""https://www.theglobeandmail.com/investing/markets/inside-the-market/article-dividend-all-stars-20-best-performing-dividend-stocks-tsx/"">The Globe’s 20 best dividend-paying stocks of the year</a>"
6,"Carney, Ford discussed idea of an early federal election to secure majority, sources say",https://www.theglobeandmail.com/politics/article-ford-advises-carney-securing-majority-would-bolster-economic-stability/,No byline found,No article type found,"<a href=""https://www.theglobeandmail.com/politics/article-ford-advises-carney-securing-majority-would-bolster-economic-stability/"">Carney, Ford discussed idea of an early federal election to secure majority, sources say</a>"
7,"Around the world, Donald Trump is destroying Brand America",https://www.theglobeandmail.com/opinion/article-donald-trump-brand-america-us-reputation/,Gary Mason,Opinion,"<a href=""https://www.theglobeandmail.com/opinion/article-donald-trump-brand-america-us-reputation/"">Around the world, Donald Trump is destroying Brand America</a>"
8,How the former prince Andrew could be removed from the line of succession,https://www.theglobeandmail.com/world/article-prince-andrew-removed-line-succession-throne/,No byline found,No article type found,"<a href=""https://www.theglobeandmail.com/world/article-prince-andrew-removed-line-succession-throne/"">How the former prince Andrew could be removed from the line of succession</a>"
