Rank,Article title,url,Byline,Article type,title_with_link
1,Catherine McKenna’s memoir trashes Trudeau. So why was the carbon-tax-killing Carney spared?,https://www.theglobeandmail.com/opinion/article-catherine-mckenna-memoir-run-like-a-girl-carbon-tax-carney/,Lawrence Martin,Opinion,"<a href=""https://www.theglobeandmail.com/opinion/article-catherine-mckenna-memoir-run-like-a-girl-carbon-tax-carney/"">Catherine McKenna’s memoir trashes Trudeau. So why was the carbon-tax-killing Carney spared?</a>"
2,This is what the opening move of the U.S.’s attempted annexation of Canada could look like,https://www.theglobeandmail.com/opinion/article-trump-us-annex-canada-arctic-maritime-sovereignty/,Franklyn Griffiths,Opinion,"<a href=""https://www.theglobeandmail.com/opinion/article-trump-us-annex-canada-arctic-maritime-sovereignty/"">This is what the opening move of the U.S.’s attempted annexation of Canada could look like</a>"
3,Canada has lost the plot on MAID,https://www.theglobeandmail.com/opinion/article-canada-lost-plot-maid-medical-assistance-in-dying/,No byline found,No article type found,"<a href=""https://www.theglobeandmail.com/opinion/article-canada-lost-plot-maid-medical-assistance-in-dying/"">Canada has lost the plot on MAID</a>"
4,What to know about this fall’s COVID-19 vaccine,https://www.theglobeandmail.com/life/wellness/article-covid-vaccines-registration-eligibility-pfizer-vs-moderna/,No byline found,No article type found,"<a href=""https://www.theglobeandmail.com/life/wellness/article-covid-vaccines-registration-eligibility-pfizer-vs-moderna/"">What to know about this fall’s COVID-19 vaccine</a>"
5,"After five decades of official bilingualism, federal language training remains a study in failure",https://www.theglobeandmail.com/opinion/article-bilingualism-federal-language-mary-simon-training-study-in-failure/,Konrad Yakabuski,Opinion,"<a href=""https://www.theglobeandmail.com/opinion/article-bilingualism-federal-language-mary-simon-training-study-in-failure/"">After five decades of official bilingualism, federal language training remains a study in failure</a>"
6,Six Canadian stocks among RBC’s top 30 global ideas,https://www.theglobeandmail.com/investing/markets/inside-the-market/article-six-canadian-stocks-among-rbcs-top-30-global-ideas/,No byline found,No article type found,"<a href=""https://www.theglobeandmail.com/investing/markets/inside-the-market/article-six-canadian-stocks-among-rbcs-top-30-global-ideas/"">Six Canadian stocks among RBC’s top 30 global ideas</a>"
7,"Yes, Slave Play is edgy and sharp. But Canadian Stage’s landmark production is more than that",https://www.theglobeandmail.com/culture/stage/article-canadian-stage-jeremy-o-harris-slave-play-toronto/,No byline found,No article type found,"<a href=""https://www.theglobeandmail.com/culture/stage/article-canadian-stage-jeremy-o-harris-slave-play-toronto/"">Yes, Slave Play is edgy and sharp. But Canadian Stage’s landmark production is more than that</a>"
8,"Instead of waiting for a Canadian team to win the Stanley Cup, Canada should launch its own domestic hockey league",https://www.theglobeandmail.com/opinion/article-nhl-stanley-cup-canada-domestic-hockey-league/,Henry Mintzberg,Opinion,"<a href=""https://www.theglobeandmail.com/opinion/article-nhl-stanley-cup-canada-domestic-hockey-league/"">Instead of waiting for a Canadian team to win the Stanley Cup, Canada should launch its own domestic hockey league</a>"
