Rank,Article title,url,Byline,Article type,title_with_link
1,Canada set to start World Cup without injured star Alphonso Davies,https://www.theglobeandmail.com/sports/soccer/article-canada-world-cup-alphonso-davies-injuries/,No byline found,No article type found,"<a href=""https://www.theglobeandmail.com/sports/soccer/article-canada-world-cup-alphonso-davies-injuries/"">Canada set to start World Cup without injured star Alphonso Davies</a>"
2,"More Canadians will inherit their family home, entrenching inequality across generations",https://www.theglobeandmail.com/investing/personal-finance/article-housing-real-estate-family-home-generation-inequality/,Mike Moffatt,Opinion,"<a href=""https://www.theglobeandmail.com/investing/personal-finance/article-housing-real-estate-family-home-generation-inequality/"">More Canadians will inherit their family home, entrenching inequality across generations</a>"
3,"Along with peace prospects, Trump suffers a series of defeats",https://www.theglobeandmail.com/world/us-politics/article-trump-iran-war-enemy-purge/,No byline found,Analysis,"<a href=""https://www.theglobeandmail.com/world/us-politics/article-trump-iran-war-enemy-purge/"">Along with peace prospects, Trump suffers a series of defeats</a>"
4,"Photos at the University of Saskatchewan could help corroborate residential school claims, Indigenous advocate says",https://www.theglobeandmail.com/politics/article-residential-school-indigenous-photographs-university-of-saskatchewan/,No byline found,No article type found,"<a href=""https://www.theglobeandmail.com/politics/article-residential-school-indigenous-photographs-university-of-saskatchewan/"">Photos at the University of Saskatchewan could help corroborate residential school claims, Indigenous advocate says</a>"
5,"Majority of party members likely to back Alberta separation, UCP president says",https://www.theglobeandmail.com/canada/alberta/article-majority-of-party-members-likely-to-back-alberta-separation-ucp/,No byline found,No article type found,"<a href=""https://www.theglobeandmail.com/canada/alberta/article-majority-of-party-members-likely-to-back-alberta-separation-ucp/"">Majority of party members likely to back Alberta separation, UCP president says</a>"
6,Six-figure income as skincare influencer helped this Torontonian buy her first home at 26,https://www.theglobeandmail.com/investing/personal-finance/article-my-first-home-toronto-condo-content-creator-income/,No byline found,No article type found,"<a href=""https://www.theglobeandmail.com/investing/personal-finance/article-my-first-home-toronto-condo-content-creator-income/"">Six-figure income as skincare influencer helped this Torontonian buy her first home at 26</a>"
7,They planned to retire early. Rising costs are putting that to the test,https://www.theglobeandmail.com/investing/personal-finance/retirement/article-fire-financial-independence-retire-early/,No byline found,No article type found,"<a href=""https://www.theglobeandmail.com/investing/personal-finance/retirement/article-fire-financial-independence-retire-early/"">They planned to retire early. Rising costs are putting that to the test</a>"
8,"Carney calls Alberta separation vote unhelpful, undemocratic",https://www.theglobeandmail.com/politics/article-mark-carney-alberta-separation-may-25-press-conference-ottawa/,No byline found,No article type found,"<a href=""https://www.theglobeandmail.com/politics/article-mark-carney-alberta-separation-may-25-press-conference-ottawa/"">Carney calls Alberta separation vote unhelpful, undemocratic</a>"
