Rank,Article title,url,Byline,Article type,title_with_link
1,How much downside protection do you really have in your portfolio? Here’s how to find out,https://www.theglobeandmail.com/investing/investment-ideas/article-how-much-downside-protection-do-you-really-have-in-your-portfolio/,Kevin Foley,Opinion,"<a href=""https://www.theglobeandmail.com/investing/investment-ideas/article-how-much-downside-protection-do-you-really-have-in-your-portfolio/"">How much downside protection do you really have in your portfolio? Here’s how to find out</a>"
2,"Golden Tempo wins Belmont Stakes, doubling up on Kentucky Derby triumph",https://www.theglobeandmail.com/sports/article-golden-tempo-wins-belmont-stakes-kentucky-derby-horse-racing/,No byline found,No article type found,"<a href=""https://www.theglobeandmail.com/sports/article-golden-tempo-wins-belmont-stakes-kentucky-derby-horse-racing/"">Golden Tempo wins Belmont Stakes, doubling up on Kentucky Derby triumph</a>"
3,Four ways sophisticated swindlers are duping Canadians – and how to protect yourself,https://www.theglobeandmail.com/business/economy/article-most-common-online-scams-canada-prevention/,No byline found,No article type found,"<a href=""https://www.theglobeandmail.com/business/economy/article-most-common-online-scams-canada-prevention/"">Four ways sophisticated swindlers are duping Canadians – and how to protect yourself</a>"
4,"The bride wore orange: Colourful, non-traditional bridal gowns showcase individual flair",https://www.theglobeandmail.com/life/style/fashion-and-beauty/article-colourful-non-traditional-wedding-dresses-canada/,No byline found,No article type found,"<a href=""https://www.theglobeandmail.com/life/style/fashion-and-beauty/article-colourful-non-traditional-wedding-dresses-canada/"">The bride wore orange: Colourful, non-traditional bridal gowns showcase individual flair</a>"
5,News To Me – ‘Optimized’ authenticity,https://www.theglobeandmail.com/opinion/article-news-to-me-optimized-authenticity/,Gabrielle Drolet,Opinion,"<a href=""https://www.theglobeandmail.com/opinion/article-news-to-me-optimized-authenticity/"">News To Me – ‘Optimized’ authenticity</a>"
6,Victoria Mboko embraces surprise offer to assist Serena Williams’s comeback,https://www.theglobeandmail.com/sports/tennis/article-victoria-mboko-serena-williams-comeback-queens-club-doubles/,No byline found,No article type found,"<a href=""https://www.theglobeandmail.com/sports/tennis/article-victoria-mboko-serena-williams-comeback-queens-club-doubles/"">Victoria Mboko embraces surprise offer to assist Serena Williams’s comeback</a>"
7,The importance of friendship in marriage: How long-term couples have stayed friends through the years,https://www.theglobeandmail.com/life/advice/relationships/article-marriage-friendships-relationships-weddings/,No byline found,No article type found,"<a href=""https://www.theglobeandmail.com/life/advice/relationships/article-marriage-friendships-relationships-weddings/"">The importance of friendship in marriage: How long-term couples have stayed friends through the years</a>"
8,Air conditioning may kill you: The drawbacks of overadapting to a burning world,https://www.theglobeandmail.com/business/commentary/article-air-conditioning-may-kill-you-the-drawbacks-of-overadapting-to-a/,John Rapley,Opinion,"<a href=""https://www.theglobeandmail.com/business/commentary/article-air-conditioning-may-kill-you-the-drawbacks-of-overadapting-to-a/"">Air conditioning may kill you: The drawbacks of overadapting to a burning world</a>"
