Rank,Article title,url,Byline,Article type,title_with_link
1,How much downside protection do you really have in your portfolio? Here’s how to find out,https://www.theglobeandmail.com/investing/investment-ideas/article-how-much-downside-protection-do-you-really-have-in-your-portfolio/,Kevin Foley,Opinion,"<a href=""https://www.theglobeandmail.com/investing/investment-ideas/article-how-much-downside-protection-do-you-really-have-in-your-portfolio/"">How much downside protection do you really have in your portfolio? Here’s how to find out</a>"
2,"Golden Tempo wins Belmont Stakes, doubling up on Kentucky Derby triumph",https://www.theglobeandmail.com/sports/article-golden-tempo-wins-belmont-stakes-kentucky-derby-horse-racing/,No byline found,No article type found,"<a href=""https://www.theglobeandmail.com/sports/article-golden-tempo-wins-belmont-stakes-kentucky-derby-horse-racing/"">Golden Tempo wins Belmont Stakes, doubling up on Kentucky Derby triumph</a>"
3,Four ways sophisticated swindlers are duping Canadians – and how to protect yourself,https://www.theglobeandmail.com/business/economy/article-most-common-online-scams-canada-prevention/,No byline found,No article type found,"<a href=""https://www.theglobeandmail.com/business/economy/article-most-common-online-scams-canada-prevention/"">Four ways sophisticated swindlers are duping Canadians – and how to protect yourself</a>"
4,"The bride wore orange: Colourful, non-traditional bridal gowns showcase individual flair",https://www.theglobeandmail.com/life/style/fashion-and-beauty/article-colourful-non-traditional-wedding-dresses-canada/,No byline found,No article type found,"<a href=""https://www.theglobeandmail.com/life/style/fashion-and-beauty/article-colourful-non-traditional-wedding-dresses-canada/"">The bride wore orange: Colourful, non-traditional bridal gowns showcase individual flair</a>"
5,Short-term rental hosts cry foul over lack of World Cup demand,https://www.theglobeandmail.com/canada/article-fifa-world-cup-accommodations-airbnbs-hotels-toronto-vancouver/,No byline found,No article type found,"<a href=""https://www.theglobeandmail.com/canada/article-fifa-world-cup-accommodations-airbnbs-hotels-toronto-vancouver/"">Short-term rental hosts cry foul over lack of World Cup demand</a>"
6,The missing words in Mark Carney’s antisemitism speech,https://www.theglobeandmail.com/opinion/editorials/article-the-missing-words-in-mark-carneys-antisemitism-speech/,No byline found,No article type found,"<a href=""https://www.theglobeandmail.com/opinion/editorials/article-the-missing-words-in-mark-carneys-antisemitism-speech/"">The missing words in Mark Carney’s antisemitism speech</a>"
7,News To Me – ‘Optimized’ authenticity,https://www.theglobeandmail.com/opinion/article-news-to-me-optimized-authenticity/,Gabrielle Drolet,Opinion,"<a href=""https://www.theglobeandmail.com/opinion/article-news-to-me-optimized-authenticity/"">News To Me – ‘Optimized’ authenticity</a>"
8,"In Hong Kong schools, attendance isn’t an issue. The pressure is",https://www.theglobeandmail.com/world/article-in-hong-kong-schools-attendance-isnt-an-issue-the-pressure-is/,No byline found,No article type found,"<a href=""https://www.theglobeandmail.com/world/article-in-hong-kong-schools-attendance-isnt-an-issue-the-pressure-is/"">In Hong Kong schools, attendance isn’t an issue. The pressure is</a>"
