Rank,Article title,url,Byline,Article type,title_with_link
1,Barrick picks U.S. over Canada for primary stock listing of North American spinout,https://www.theglobeandmail.com/business/article-barrick-primary-stock-listing-north-american-spinout-executive-team/,No byline found,No article type found,"<a href=""https://www.theglobeandmail.com/business/article-barrick-primary-stock-listing-north-american-spinout-executive-team/"">Barrick picks U.S. over Canada for primary stock listing of North American spinout</a>"
2,"Suspended between two worlds, train travel offers me the chance to just be",https://www.theglobeandmail.com/life/first-person/article-suspended-between-two-worlds-train-travel-offers-me-the-chance-to-just/,No byline found,No article type found,"<a href=""https://www.theglobeandmail.com/life/first-person/article-suspended-between-two-worlds-train-travel-offers-me-the-chance-to-just/"">Suspended between two worlds, train travel offers me the chance to just be</a>"
3,"Behold, the decline of OPEC and the twilight of the Arab oil age",https://www.theglobeandmail.com/business/commentary/article-behold-the-decline-of-the-opec-and-the-twilight-of-the-arab-oil-age/,Rashid Husain Syed,Opinion,"<a href=""https://www.theglobeandmail.com/business/commentary/article-behold-the-decline-of-the-opec-and-the-twilight-of-the-arab-oil-age/"">Behold, the decline of OPEC and the twilight of the Arab oil age</a>"
4,Ottawa draws mixed reviews with new sovereign wealth fund to finance major projects,https://www.theglobeandmail.com/politics/article-carney-to-announce-sovereign-wealth-fund-monday/,No byline found,No article type found,"<a href=""https://www.theglobeandmail.com/politics/article-carney-to-announce-sovereign-wealth-fund-monday/"">Ottawa draws mixed reviews with new sovereign wealth fund to finance major projects</a>"
5,McDavid and the Oilers’ shortcomings are hockey’s loss,https://www.theglobeandmail.com/sports/hockey/article-connor-mcdavid-edmonton-oilers-nhl-playoffs-ducks/,Cathal Kelly,Opinion,"<a href=""https://www.theglobeandmail.com/sports/hockey/article-connor-mcdavid-edmonton-oilers-nhl-playoffs-ducks/"">McDavid and the Oilers’ shortcomings are hockey’s loss</a>"
6,Ten fast-growing Canadian companies at reasonable valuations,https://www.theglobeandmail.com/investing/investment-ideas/number-cruncher/article-ten-fast-growing-canadian-companies-at-reasonable-valuations/,No byline found,No article type found,"<a href=""https://www.theglobeandmail.com/investing/investment-ideas/number-cruncher/article-ten-fast-growing-canadian-companies-at-reasonable-valuations/"">Ten fast-growing Canadian companies at reasonable valuations</a>"
7,"Ottawa announces $6-billion for skilled trades, projects smaller deficit in spring economic update",https://www.theglobeandmail.com/politics/article-spring-economic-update-francois-philippe-champagne-mark-carney-april/,No byline found,No article type found,"<a href=""https://www.theglobeandmail.com/politics/article-spring-economic-update-francois-philippe-champagne-mark-carney-april/"">Ottawa announces $6-billion for skilled trades, projects smaller deficit in spring economic update</a>"
8,Shell sees strong case for second phase of LNG Canada after conversations with governments,https://www.theglobeandmail.com/business/article-shell-sees-strong-case-for-second-phase-of-lng-canada-after/,No byline found,No article type found,"<a href=""https://www.theglobeandmail.com/business/article-shell-sees-strong-case-for-second-phase-of-lng-canada-after/"">Shell sees strong case for second phase of LNG Canada after conversations with governments</a>"
