Rank,Article title,url,Byline,Article type,title_with_link
1,How this miniaturist made it big with her tiny creations,https://www.theglobeandmail.com/life/article-how-this-miniaturist-made-it-big-with-her-tiny-creations/,No byline found,No article type found,"<a href=""https://www.theglobeandmail.com/life/article-how-this-miniaturist-made-it-big-with-her-tiny-creations/"">How this miniaturist made it big with her tiny creations</a>"
2,Hockey Canada sex-assault trial spotlights roadblocks and missed opportunities in first London police probe,https://www.theglobeandmail.com/canada/article-hockey-canada-sex-assault-trial-roadblocks-flaws-first-london-police/,No byline found,No article type found,"<a href=""https://www.theglobeandmail.com/canada/article-hockey-canada-sex-assault-trial-roadblocks-flaws-first-london-police/"">Hockey Canada sex-assault trial spotlights roadblocks and missed opportunities in first London police probe</a>"
3,"With Poilievre in town, rural Alberta by-election race heats up ahead of August vote",https://www.theglobeandmail.com/canada/alberta/article-with-poilievre-in-town-rural-alberta-by-election-race-heats-up-ahead/,No byline found,No article type found,"<a href=""https://www.theglobeandmail.com/canada/alberta/article-with-poilievre-in-town-rural-alberta-by-election-race-heats-up-ahead/"">With Poilievre in town, rural Alberta by-election race heats up ahead of August vote</a>"
4,"So, your friend says you can bring your dog to their cottage - should you?",https://www.theglobeandmail.com/opinion/article-dog-visiting-friends-cottage/,Dianne Rinehart,Opinion,"<a href=""https://www.theglobeandmail.com/opinion/article-dog-visiting-friends-cottage/"">So, your friend says you can bring your dog to their cottage - should you?</a>"
5,This retiree was shocked to find herself the beneficiary of an old friend’s will,https://www.theglobeandmail.com/investing/personal-finance/retirement/article-retiree-surprise-will-inheritance-money-beneficiary/,No byline found,No article type found,"<a href=""https://www.theglobeandmail.com/investing/personal-finance/retirement/article-retiree-surprise-will-inheritance-money-beneficiary/"">This retiree was shocked to find herself the beneficiary of an old friend’s will</a>"
6,The bitter truth is that cheaper housing means a retirement crisis for homeowners,https://www.theglobeandmail.com/business/commentary/article-housing-prices-retirement-plan-middle-class/,John Turley-Ewart,Opinion,"<a href=""https://www.theglobeandmail.com/business/commentary/article-housing-prices-retirement-plan-middle-class/"">The bitter truth is that cheaper housing means a retirement crisis for homeowners</a>"
7,Teck Resources gives green light to $2.4-billion B.C. mine extension,https://www.theglobeandmail.com/business/article-teck-resources-highland-valley-copper-mine-extension-bc/,No byline found,No article type found,"<a href=""https://www.theglobeandmail.com/business/article-teck-resources-highland-valley-copper-mine-extension-bc/"">Teck Resources gives green light to $2.4-billion B.C. mine extension</a>"
8,TD Bank tells staff to work from the office four days a week as of November,https://www.theglobeandmail.com/business/article-td-bank-return-to-office-mandate/,No byline found,No article type found,"<a href=""https://www.theglobeandmail.com/business/article-td-bank-return-to-office-mandate/"">TD Bank tells staff to work from the office four days a week as of November</a>"
