Rank,Article title,url,Byline,Article type,title_with_link
1,"Inside the empire of James Cameron, king of fire and ash",https://www.theglobeandmail.com/culture/film-and-tv/film/article-inside-the-empire-of-james-cameron-king-of-fire-and-ash/,No byline found,No article type found,"<a href=""https://www.theglobeandmail.com/culture/film-and-tv/film/article-inside-the-empire-of-james-cameron-king-of-fire-and-ash/"">Inside the empire of James Cameron, king of fire and ash</a>"
2,Our guide to the top 250 stocks in Canada,https://www.theglobeandmail.com/investing/markets/inside-the-market/article-globe-250-stocks-2025/,No byline found,No article type found,"<a href=""https://www.theglobeandmail.com/investing/markets/inside-the-market/article-globe-250-stocks-2025/"">Our guide to the top 250 stocks in Canada</a>"
3,Just have people over! Chelsea Fagan on combatting loneliness and ditching perfection,https://www.theglobeandmail.com/life/style/food-and-drink/article-tk-qa-with-chelsea-fagan-author-of-having-people-over/,No byline found,No article type found,"<a href=""https://www.theglobeandmail.com/life/style/food-and-drink/article-tk-qa-with-chelsea-fagan-author-of-having-people-over/"">Just have people over! Chelsea Fagan on combatting loneliness and ditching perfection</a>"
4,Why we need to party more,https://www.theglobeandmail.com/life/social-trends/article-why-we-need-to-party-more/,Marlowe Granados,Opinion,"<a href=""https://www.theglobeandmail.com/life/social-trends/article-why-we-need-to-party-more/"">Why we need to party more</a>"
5,"‘As a senior with 35-year-olds still living in my basement, I see every day that young people need more help.’ Letters to the editor for Nov. 16",https://www.theglobeandmail.com/opinion/letters/article-35-year-olds-still-living-in-my-basement-young-people-need-more-help/,No byline found,No article type found,"<a href=""https://www.theglobeandmail.com/opinion/letters/article-35-year-olds-still-living-in-my-basement-young-people-need-more-help/"">‘As a senior with 35-year-olds still living in my basement, I see every day that young people need more help.’ Letters to the editor for Nov. 16</a>"
6,"RCMP investigating Ryan Wedding, aiming to lay charges in Canada",https://www.theglobeandmail.com/canada/article-rcmp-investigating-ryan-wedding-aiming-to-lay-charges-in-canada/,No byline found,No article type found,"<a href=""https://www.theglobeandmail.com/canada/article-rcmp-investigating-ryan-wedding-aiming-to-lay-charges-in-canada/"">RCMP investigating Ryan Wedding, aiming to lay charges in Canada</a>"
7,How well do you remember 2025? Take our year-end news quiz,https://www.theglobeandmail.com/canada/article-2025-news-quiz-top-stories-biggest-moments-of-the-year/,No byline found,No article type found,"<a href=""https://www.theglobeandmail.com/canada/article-2025-news-quiz-top-stories-biggest-moments-of-the-year/"">How well do you remember 2025? Take our year-end news quiz</a>"
8,"After taking drastic steps on opioids, an Ontario city struggles to find its footing",https://www.theglobeandmail.com/canada/article-barrie-ontario-opioid-crisis-drug-epidemic-overdose-abuse/,No byline found,No article type found,"<a href=""https://www.theglobeandmail.com/canada/article-barrie-ontario-opioid-crisis-drug-epidemic-overdose-abuse/"">After taking drastic steps on opioids, an Ontario city struggles to find its footing</a>"
