Rank,Article title,url,Byline,Article type,title_with_link
1,Mad King Trump would break the world to gain Greenland,https://www.theglobeandmail.com/politics/opinion/article-mad-king-trump-would-break-the-world-to-gain-greenland/,Campbell Clark,Opinion,"<a href=""https://www.theglobeandmail.com/politics/opinion/article-mad-king-trump-would-break-the-world-to-gain-greenland/"">Mad King Trump would break the world to gain Greenland</a>"
2,Is it illegal to stop before turning right at a green light?,https://www.theglobeandmail.com/drive/culture/article-is-it-illegal-to-stop-before-turning-right-at-a-green-light/,No byline found,No article type found,"<a href=""https://www.theglobeandmail.com/drive/culture/article-is-it-illegal-to-stop-before-turning-right-at-a-green-light/"">Is it illegal to stop before turning right at a green light?</a>"
3,Canada weighs plans to send soldiers to Greenland as show of NATO solidarity,https://www.theglobeandmail.com/politics/article-canada-soldiers-greenland-nato-training-denmark-tariffs-donald-trump/,No byline found,No article type found,"<a href=""https://www.theglobeandmail.com/politics/article-canada-soldiers-greenland-nato-training-denmark-tariffs-donald-trump/"">Canada weighs plans to send soldiers to Greenland as show of NATO solidarity</a>"
4,"Quebec department store set to take over two former HBC locations, filings show",https://www.theglobeandmail.com/business/article-les-ailes-de-la-mode-former-hbc-locations-quebec/,No byline found,No article type found,"<a href=""https://www.theglobeandmail.com/business/article-les-ailes-de-la-mode-former-hbc-locations-quebec/"">Quebec department store set to take over two former HBC locations, filings show</a>"
5,"Transport Canada aims to eliminate 600 jobs, deputy minister says in e-mail to staff",https://www.theglobeandmail.com/politics/article-transport-canada-job-cuts/,No byline found,No article type found,"<a href=""https://www.theglobeandmail.com/politics/article-transport-canada-job-cuts/"">Transport Canada aims to eliminate 600 jobs, deputy minister says in e-mail to staff</a>"
6,Why you should add fermented food to your diet every day,https://www.theglobeandmail.com/life/health-and-fitness/article-why-you-should-add-fermented-food-to-your-diet-every-day/,No byline found,No article type found,"<a href=""https://www.theglobeandmail.com/life/health-and-fitness/article-why-you-should-add-fermented-food-to-your-diet-every-day/"">Why you should add fermented food to your diet every day</a>"
7,Nova Scotia denies accusations of undermining Canada in softwood lumber dispute with U.S.,https://www.theglobeandmail.com/business/article-nova-scotia-defends-itself-canada-us-softwood-lumber-dispute/,No byline found,No article type found,"<a href=""https://www.theglobeandmail.com/business/article-nova-scotia-defends-itself-canada-us-softwood-lumber-dispute/"">Nova Scotia denies accusations of undermining Canada in softwood lumber dispute with U.S.</a>"
8,Three stocks with strong insider interest that may benefit from renewed Canada-China ties,https://www.theglobeandmail.com/investing/markets/inside-the-market/article-three-stocks-with-strong-insider-interest-that-may-benefit-from/,No byline found,No article type found,"<a href=""https://www.theglobeandmail.com/investing/markets/inside-the-market/article-three-stocks-with-strong-insider-interest-that-may-benefit-from/"">Three stocks with strong insider interest that may benefit from renewed Canada-China ties</a>"
