Rank,Article title,url,Byline,Article type,title_with_link
1,Modelling scout with ties to Epstein found dead at his home outside Paris,https://www.theglobeandmail.com/world/article-epstein-french-modelling-scout-found-dead/,No byline found,No article type found,"<a href=""https://www.theglobeandmail.com/world/article-epstein-french-modelling-scout-found-dead/"">Modelling scout with ties to Epstein found dead at his home outside Paris</a>"
2,‘This Canadian will never purchase California wine or visit the United States ever again. This is not friendship.’ Letters to the editor for July 22,https://www.theglobeandmail.com/opinion/letters/article-i-will-never-buy-california-wine-or-visit-the-united-states-ever-again/,No byline found,No article type found,"<a href=""https://www.theglobeandmail.com/opinion/letters/article-i-will-never-buy-california-wine-or-visit-the-united-states-ever-again/"">‘This Canadian will never purchase California wine or visit the United States ever again. This is not friendship.’ Letters to the editor for July 22</a>"
3,Workplace pension plans have failed most Canadians,https://www.theglobeandmail.com/investing/personal-finance/article-workplace-pension-plan-fail-retirement/,Frederick Vettese,Opinion,"<a href=""https://www.theglobeandmail.com/investing/personal-finance/article-workplace-pension-plan-fail-retirement/"">Workplace pension plans have failed most Canadians</a>"
4,Netflix’s The Hawk could’ve been a movie,https://www.theglobeandmail.com/culture/film-and-tv/television/article-the-hawk-netflix-review-will-ferrell-series/,No byline found,No article type found,"<a href=""https://www.theglobeandmail.com/culture/film-and-tv/television/article-the-hawk-netflix-review-will-ferrell-series/"">Netflix’s The Hawk could’ve been a movie</a>"
5,Christopher Nolan’s The Odyssey is the future of filmgoing – if we want it to be,https://www.theglobeandmail.com/culture/film-and-tv/film/article-odyssey-review-christopher-nolan-matt-damon/,No byline found,No article type found,"<a href=""https://www.theglobeandmail.com/culture/film-and-tv/film/article-odyssey-review-christopher-nolan-matt-damon/"">Christopher Nolan’s The Odyssey is the future of filmgoing – if we want it to be</a>"
6,"B.C. wildfires shut down major highways, Fraser Canyon residents told to flee",https://www.theglobeandmail.com/canada/british-columbia/article-bc-wildfires-boston-bar-fraser-canyon/,No byline found,No article type found,"<a href=""https://www.theglobeandmail.com/canada/british-columbia/article-bc-wildfires-boston-bar-fraser-canyon/"">B.C. wildfires shut down major highways, Fraser Canyon residents told to flee</a>"
7,Canadian industries set to be most affected by Trump’s threatened tariffs,https://www.theglobeandmail.com/business/article-the-canadian-industries-set-to-be-most-affected-by-trumps-latest/,No byline found,No article type found,"<a href=""https://www.theglobeandmail.com/business/article-the-canadian-industries-set-to-be-most-affected-by-trumps-latest/"">Canadian industries set to be most affected by Trump’s threatened tariffs</a>"
8,Alphabet tops Wall Street estimates for quarterly cloud revenue growth,https://www.theglobeandmail.com/business/article-alphabet-google-earnings-cloud-revenue-growth/,No byline found,No article type found,"<a href=""https://www.theglobeandmail.com/business/article-alphabet-google-earnings-cloud-revenue-growth/"">Alphabet tops Wall Street estimates for quarterly cloud revenue growth</a>"
