Rank,Article title,url,Byline,Article type,title_with_link
1,We rekindled our passion for hiking among the volcanic peaks of Portugal’s Azores,https://www.theglobeandmail.com/life/travel/article-hiking-sao-miguel-island-portugal-azores/,No byline found,No article type found,"<a href=""https://www.theglobeandmail.com/life/travel/article-hiking-sao-miguel-island-portugal-azores/"">We rekindled our passion for hiking among the volcanic peaks of Portugal’s Azores</a>"
2,Blue Jays broadcaster Joe Siddall enters his first season as main analyst full of gratitude,https://www.theglobeandmail.com/sports/baseball/article-blue-jays-broadcaster-joe-siddall-enters-his-first-season-as-main/,No byline found,No article type found,"<a href=""https://www.theglobeandmail.com/sports/baseball/article-blue-jays-broadcaster-joe-siddall-enters-his-first-season-as-main/"">Blue Jays broadcaster Joe Siddall enters his first season as main analyst full of gratitude</a>"
3,"Can Clement and Uma, both in their mid-40s, afford to buy a $2-million cottage?",https://www.theglobeandmail.com/investing/personal-finance/financial-facelift/article-clement-uma-afford-buy-2-million-cottage/,No byline found,No article type found,"<a href=""https://www.theglobeandmail.com/investing/personal-finance/financial-facelift/article-clement-uma-afford-buy-2-million-cottage/"">Can Clement and Uma, both in their mid-40s, afford to buy a $2-million cottage?</a>"
4,San Francisco – the most childless city in the U.S. – could be a glimpse into Canada’s future,https://www.theglobeandmail.com/life/article-san-francisco-childless-city-glimpse-into-canadas-future/,No byline found,No article type found,"<a href=""https://www.theglobeandmail.com/life/article-san-francisco-childless-city-glimpse-into-canadas-future/"">San Francisco – the most childless city in the U.S. – could be a glimpse into Canada’s future</a>"
5,When do drivers legally have to signal?,https://www.theglobeandmail.com/drive/culture/article-when-do-drivers-legally-have-to-signal/,No byline found,No article type found,"<a href=""https://www.theglobeandmail.com/drive/culture/article-when-do-drivers-legally-have-to-signal/"">When do drivers legally have to signal?</a>"
6,Sergio Garcia receives Masters’ first code-of-conduct warning after breaking driver in frustration,https://www.theglobeandmail.com/sports/golf/article-sergio-garcia-receives-masters-first-code-of-conduct-warning-after/,No byline found,No article type found,"<a href=""https://www.theglobeandmail.com/sports/golf/article-sergio-garcia-receives-masters-first-code-of-conduct-warning-after/"">Sergio Garcia receives Masters’ first code-of-conduct warning after breaking driver in frustration</a>"
7,"We need to embrace the art of diplomacy, not the art of the deal",https://www.theglobeandmail.com/opinion/article-michael-ignatieff-diplomacy-or-art-of-the-deal/,Michael Ignatieff,Opinion,"<a href=""https://www.theglobeandmail.com/opinion/article-michael-ignatieff-diplomacy-or-art-of-the-deal/"">We need to embrace the art of diplomacy, not the art of the deal</a>"
8,These ancient walkways in the Swiss Alps make for easy mountain trekking,https://www.theglobeandmail.com/life/travel/article-switzerland-hiking-valais/,No byline found,No article type found,"<a href=""https://www.theglobeandmail.com/life/travel/article-switzerland-hiking-valais/"">These ancient walkways in the Swiss Alps make for easy mountain trekking</a>"
