Rank,Article title,url,title_with_link
1,Some Indigenous businesses halt exports to U.S. despite long-standing free-trade ties,https://globalnews.ca/news/11358045/some-indigenous-businesses-halt-exports-to-u-s-despite-long-standing-free-trade-ties/,"<a href=""https://globalnews.ca/news/11358045/some-indigenous-businesses-halt-exports-to-u-s-despite-long-standing-free-trade-ties/"">Some Indigenous businesses halt exports to U.S. despite long-standing free-trade ties</a>"
2,The condo market is struggling. Are they still a good retirement plan?,https://globalnews.ca/news/11356252/condo-market-struggling-retirement-plan/,"<a href=""https://globalnews.ca/news/11356252/condo-market-struggling-retirement-plan/"">The condo market is struggling. Are they still a good retirement plan?</a>"
3,Margaret Atwood takes aim at Alberta’s school library books ban with satirical story,https://globalnews.ca/news/11358174/margaret-atwood-takes-aim-at-albertas-school-library-books-ban-with-satirical-story/,"<a href=""https://globalnews.ca/news/11358174/margaret-atwood-takes-aim-at-albertas-school-library-books-ban-with-satirical-story/"">Margaret Atwood takes aim at Alberta’s school library books ban with satirical story</a>"
4,"As Canadians travel more at home, here’s where many are visiting",https://globalnews.ca/news/11350646/canadian-travel-destinations-2025/,"<a href=""https://globalnews.ca/news/11350646/canadian-travel-destinations-2025/"">As Canadians travel more at home, here’s where many are visiting</a>"
5,Number of sick days taken by public servants growing post-COVID,https://globalnews.ca/news/11357829/sick-days-post-covid/,"<a href=""https://globalnews.ca/news/11357829/sick-days-post-covid/"">Number of sick days taken by public servants growing post-COVID</a>"
