Rank,Article title,url,Byline,Article type,title_with_link
1,Canada has gone full villain in curling,https://www.theglobeandmail.com/sports/olympics/article-milan-cortina-2026-canada-curling-scandal-rachel-homan/,Cathal Kelly,Opinion,"<a href=""https://www.theglobeandmail.com/sports/olympics/article-milan-cortina-2026-canada-curling-scandal-rachel-homan/"">Canada has gone full villain in curling</a>"
2,"The pothole season in `Moontreal’ is so bad, not even the mayor can escape",https://www.theglobeandmail.com/canada/article-the-pothole-season-in-moontreal-is-so-bad-not-even-the-mayor-can/,No byline found,No article type found,"<a href=""https://www.theglobeandmail.com/canada/article-the-pothole-season-in-moontreal-is-so-bad-not-even-the-mayor-can/"">The pothole season in `Moontreal’ is so bad, not even the mayor can escape</a>"
3,Kayaking the remote coast of Mexico’s Baja California Peninsula reveals hidden beaches and wild landscapes,https://www.theglobeandmail.com/life/travel/article-kayaking-the-remote-coast-of-mexicos-baja-california-peninsula-reveals/,No byline found,No article type found,"<a href=""https://www.theglobeandmail.com/life/travel/article-kayaking-the-remote-coast-of-mexicos-baja-california-peninsula-reveals/"">Kayaking the remote coast of Mexico’s Baja California Peninsula reveals hidden beaches and wild landscapes</a>"
4,Your hands need extra care in the winter – here are six products that can help,https://www.theglobeandmail.com/life/style/fashion-and-beauty/article-winter-dry-skin-hand-care-lotion/,No byline found,No article type found,"<a href=""https://www.theglobeandmail.com/life/style/fashion-and-beauty/article-winter-dry-skin-hand-care-lotion/"">Your hands need extra care in the winter – here are six products that can help</a>"
5,"On-ice losses are one thing, but Canada is in danger of losing its greatest cultural asset",https://www.theglobeandmail.com/sports/article-hockey-canada-losses-wins-trade-war-elbows-up/,Cathal Kelly,Opinion,"<a href=""https://www.theglobeandmail.com/sports/article-hockey-canada-losses-wins-trade-war-elbows-up/"">On-ice losses are one thing, but Canada is in danger of losing its greatest cultural asset</a>"
6,Collapse of Ontario real estate firm leaves investors looking for answers,https://www.theglobeandmail.com/canada/article-scott-reid-heritage-properties-ontario-real-estate-investors/,No byline found,No article type found,"<a href=""https://www.theglobeandmail.com/canada/article-scott-reid-heritage-properties-ontario-real-estate-investors/"">Collapse of Ontario real estate firm leaves investors looking for answers</a>"
7,Kingsbury wins Canada’s first gold medal of Games in men’s dual moguls,https://www.theglobeandmail.com/sports/olympics/article-winter-olympics-2026-mikael-kingsbury-medal-mens-dual-moguls/,No byline found,No article type found,"<a href=""https://www.theglobeandmail.com/sports/olympics/article-winter-olympics-2026-mikael-kingsbury-medal-mens-dual-moguls/"">Kingsbury wins Canada’s first gold medal of Games in men’s dual moguls</a>"
8,CPP payments slow in 2026 as retirees cope with high living costs,https://www.theglobeandmail.com/investing/personal-finance/retirement/article-cpp-payments-2026-retirement-cost-of-living-pension/,No byline found,No article type found,"<a href=""https://www.theglobeandmail.com/investing/personal-finance/retirement/article-cpp-payments-2026-retirement-cost-of-living-pension/"">CPP payments slow in 2026 as retirees cope with high living costs</a>"
