Rank,Article title,url,Byline,Article type,title_with_link
1,Popeyes franchises shut down over unpaid wages placed into receivership,https://www.theglobeandmail.com/business/article-popeyes-ontario-shut-down-unpaid-wages-lawsuit-unsafe-chicken/,No byline found,No article type found,"<a href=""https://www.theglobeandmail.com/business/article-popeyes-ontario-shut-down-unpaid-wages-lawsuit-unsafe-chicken/"">Popeyes franchises shut down over unpaid wages placed into receivership</a>"
2,"Cottage buyers sign quick deal, expecting prices to rise from U.S. influx",https://www.theglobeandmail.com/real-estate/article-cottage-buyers-sign-quick-deal-us-influx-lake-of-bays/,No byline found,No article type found,"<a href=""https://www.theglobeandmail.com/real-estate/article-cottage-buyers-sign-quick-deal-us-influx-lake-of-bays/"">Cottage buyers sign quick deal, expecting prices to rise from U.S. influx</a>"
3,The Jays tried to get Shohei Ohtani. The guy they got instead put them in the World Series,https://www.theglobeandmail.com/sports/baseball/article-world-series-blue-jays-dodgers-vladimir-guererro-jr-shohei-ohtani/,Cathal Kelly,Opinion,"<a href=""https://www.theglobeandmail.com/sports/baseball/article-world-series-blue-jays-dodgers-vladimir-guererro-jr-shohei-ohtani/"">The Jays tried to get Shohei Ohtani. The guy they got instead put them in the World Series</a>"
4,The bitter truth is that cheaper housing means a retirement crisis for homeowners,https://www.theglobeandmail.com/business/commentary/article-housing-prices-retirement-plan-middle-class/,John Turley-Ewart,Opinion,"<a href=""https://www.theglobeandmail.com/business/commentary/article-housing-prices-retirement-plan-middle-class/"">The bitter truth is that cheaper housing means a retirement crisis for homeowners</a>"
5,Game 1 of the World Series is a must-win for the Blue Jays,https://www.theglobeandmail.com/sports/baseball/article-blue-jays-must-win-world-series-game-1-vs-los-angeles-dodgers/,Cathal Kelly,Opinion,"<a href=""https://www.theglobeandmail.com/sports/baseball/article-blue-jays-must-win-world-series-game-1-vs-los-angeles-dodgers/"">Game 1 of the World Series is a must-win for the Blue Jays</a>"
6,Fixed mortgage rates are dropping after months of stagnancy,https://www.theglobeandmail.com/investing/personal-finance/article-fixed-mortgage-rates-are-dropping-after-months-of-stagnancy/,No byline found,No article type found,"<a href=""https://www.theglobeandmail.com/investing/personal-finance/article-fixed-mortgage-rates-are-dropping-after-months-of-stagnancy/"">Fixed mortgage rates are dropping after months of stagnancy</a>"
7,Canada doesn’t like immigration any more. This is a problem,https://www.theglobeandmail.com/business/commentary/article-canada-immigration-government-support-economy-ottawa/,Kevin Yin,Opinion,"<a href=""https://www.theglobeandmail.com/business/commentary/article-canada-immigration-government-support-economy-ottawa/"">Canada doesn’t like immigration any more. This is a problem</a>"
8,Canada needs to rein in spending. How about we stop handing out billions to wealthy seniors?,https://www.theglobeandmail.com/opinion/article-canada-spending-budget-old-age-security-retirement-income/,No byline found,No article type found,"<a href=""https://www.theglobeandmail.com/opinion/article-canada-spending-budget-old-age-security-retirement-income/"">Canada needs to rein in spending. How about we stop handing out billions to wealthy seniors?</a>"
