Rank,Article title,url,Byline,Article type,title_with_link
1,Wednesday’s analyst upgrades and downgrades,https://www.theglobeandmail.com/investing/markets/inside-the-market/article-wednesdays-analyst-upgrades-and-downgrades-261/,No byline found,No article type found,"<a href=""https://www.theglobeandmail.com/investing/markets/inside-the-market/article-wednesdays-analyst-upgrades-and-downgrades-261/"">Wednesday’s analyst upgrades and downgrades</a>"
2,My estranged father died in hospital after years of drug use. He was more than a statistic,https://www.theglobeandmail.com/opinion/article-my-estranged-father-died-in-hospital-after-years-of-drug-use-he-was/,No byline found,No article type found,"<a href=""https://www.theglobeandmail.com/opinion/article-my-estranged-father-died-in-hospital-after-years-of-drug-use-he-was/"">My estranged father died in hospital after years of drug use. He was more than a statistic</a>"
3,Mexico grapples with Trump’s unrelenting demands,https://www.theglobeandmail.com/world/article-mexico-grapples-with-trumps-unrelenting-demands/,No byline found,No article type found,"<a href=""https://www.theglobeandmail.com/world/article-mexico-grapples-with-trumps-unrelenting-demands/"">Mexico grapples with Trump’s unrelenting demands</a>"
4,‘Pierre’s riding to lose’: candidates in Alberta by-election get together for debate,https://www.theglobeandmail.com/canada/article-pierres-riding-to-lose-candidates-in-alberta-by-election-get-together/,No byline found,No article type found,"<a href=""https://www.theglobeandmail.com/canada/article-pierres-riding-to-lose-candidates-in-alberta-by-election-get-together/"">‘Pierre’s riding to lose’: candidates in Alberta by-election get together for debate</a>"
5,"I have been let go, but asked to work for two weeks in lieu of severance. Can I switch?",https://www.theglobeandmail.com/business/careers/career-advice/article-i-have-been-let-go-but-asked-to-work-for-two-weeks-instead-of-receive/,No byline found,No article type found,"<a href=""https://www.theglobeandmail.com/business/careers/career-advice/article-i-have-been-let-go-but-asked-to-work-for-two-weeks-instead-of-receive/"">I have been let go, but asked to work for two weeks in lieu of severance. Can I switch?</a>"
6,B.C. coast under tsunami advisory after massive earthquake hits Russia,https://www.theglobeandmail.com/canada/article-bc-tsunami-warning-after-russian-earthquake/,No byline found,No article type found,"<a href=""https://www.theglobeandmail.com/canada/article-bc-tsunami-warning-after-russian-earthquake/"">B.C. coast under tsunami advisory after massive earthquake hits Russia</a>"
7,Alison Brie and Dave Franco go full Eyes Wide Shut in the hilarious and disgusting new thriller Together,https://www.theglobeandmail.com/arts/film/reviews/article-together-alison-brie-dave-franco-thriller-eyes-wide-shut/,No byline found,No article type found,"<a href=""https://www.theglobeandmail.com/arts/film/reviews/article-together-alison-brie-dave-franco-thriller-eyes-wide-shut/"">Alison Brie and Dave Franco go full Eyes Wide Shut in the hilarious and disgusting new thriller Together</a>"
8,Before the Bell: What every Canadian investor needs to know today,https://www.theglobeandmail.com/investing/markets/inside-the-market/article-before-the-bell-what-every-canadian-investor-needs-to-know-today-1278/,No byline found,No article type found,"<a href=""https://www.theglobeandmail.com/investing/markets/inside-the-market/article-before-the-bell-what-every-canadian-investor-needs-to-know-today-1278/"">Before the Bell: What every Canadian investor needs to know today</a>"
