Rank,Article title,url,Byline,Article type,title_with_link
1,"White supremacist march counts as free speech in ‘messy democracy,’ says U.S. Interior Secretary",https://www.theglobeandmail.com/world/article-white-supremacist-patriot-front-free-speech-july-4/,No byline found,No article type found,"<a href=""https://www.theglobeandmail.com/world/article-white-supremacist-patriot-front-free-speech-july-4/"">White supremacist march counts as free speech in ‘messy democracy,’ says U.S. Interior Secretary</a>"
2,Condo developers are offering big discounts in exchange for signing NDAs,https://www.theglobeandmail.com/investing/personal-finance/article-condo-prices-ndas-discount-sales-developers-real-estate/,No byline found,No article type found,"<a href=""https://www.theglobeandmail.com/investing/personal-finance/article-condo-prices-ndas-discount-sales-developers-real-estate/"">Condo developers are offering big discounts in exchange for signing NDAs</a>"
3,Balogun available for World Cup clash with Belgium despite red card suspension,https://www.theglobeandmail.com/sports/soccer/article-balogun-us-belgium-world-cup-red-suspension-trump/,No byline found,No article type found,"<a href=""https://www.theglobeandmail.com/sports/soccer/article-balogun-us-belgium-world-cup-red-suspension-trump/"">Balogun available for World Cup clash with Belgium despite red card suspension</a>"
4,"Trump administration not seeking new bids, will use same company to repair Reflecting Pool",https://www.theglobeandmail.com/world/article-trump-lincoln-memorial-reflecting-pool/,No byline found,No article type found,"<a href=""https://www.theglobeandmail.com/world/article-trump-lincoln-memorial-reflecting-pool/"">Trump administration not seeking new bids, will use same company to repair Reflecting Pool</a>"
5,Ontario dancer Ariel Hyatt goes viral for blending Canadian step-dancing with heavy metal hits,https://www.theglobeandmail.com/culture/article-ontario-dancer-ariel-hyatt-step-dancing-heavy-metal/,No byline found,No article type found,"<a href=""https://www.theglobeandmail.com/culture/article-ontario-dancer-ariel-hyatt-step-dancing-heavy-metal/"">Ontario dancer Ariel Hyatt goes viral for blending Canadian step-dancing with heavy metal hits</a>"
6,"Taylor Swift and Travis Kelce, from friendship bracelets to wedding rings",https://www.theglobeandmail.com/culture/film-and-tv/article-taylor-swift-travis-kelce-wedding/,No byline found,No article type found,"<a href=""https://www.theglobeandmail.com/culture/film-and-tv/article-taylor-swift-travis-kelce-wedding/"">Taylor Swift and Travis Kelce, from friendship bracelets to wedding rings</a>"
7,Is the left lane for passing only?,https://www.theglobeandmail.com/drive/culture/article-is-the-left-lane-for-passing-only/,No byline found,No article type found,"<a href=""https://www.theglobeandmail.com/drive/culture/article-is-the-left-lane-for-passing-only/"">Is the left lane for passing only?</a>"
8,"Dear family: when I’m dead, make sure these clichés are not in my obituary",https://www.theglobeandmail.com/life/first-person/article-cliches-family-writing-obituary/,No byline found,No article type found,"<a href=""https://www.theglobeandmail.com/life/first-person/article-cliches-family-writing-obituary/"">Dear family: when I’m dead, make sure these clichés are not in my obituary</a>"
