Rank,Article title,url,title_with_link
1,Trump dump? More than half of Canadians with U.S. properties want to ditch them,https://globalnews.ca/news/11350508/canadian-property-owners-in-us/,"<a href=""https://globalnews.ca/news/11350508/canadian-property-owners-in-us/"">Trump dump? More than half of Canadians with U.S. properties want to ditch them</a>"
2,"2 children dead, 17 people injured in Minnesota church, school shooting",https://globalnews.ca/news/11352067/mass-shooting-minnesota-annunciation-catholic-church-school/,"<a href=""https://globalnews.ca/news/11352067/mass-shooting-minnesota-annunciation-catholic-church-school/"">2 children dead, 17 people injured in Minnesota church, school shooting</a>"
3,"Taylor Swift, Travis Kelce engaged as pop star reveals 1st glimpse of ring",https://globalnews.ca/news/11350655/taylor-swift-travis-kelce-engagement/,"<a href=""https://globalnews.ca/news/11350655/taylor-swift-travis-kelce-engagement/"">Taylor Swift, Travis Kelce engaged as pop star reveals 1st glimpse of ring</a>"
4,"‘Put American spirits back’ on Canadian shelves, U.S. booze group urges",https://globalnews.ca/news/11348782/donald-trump-tariffs-canada-american-alcohol/,"<a href=""https://globalnews.ca/news/11348782/donald-trump-tariffs-canada-american-alcohol/"">‘Put American spirits back’ on Canadian shelves, U.S. booze group urges</a>"
5,Canada Post lost $407 million in ‘largest loss’ in a single quarter,https://globalnews.ca/news/11350437/canada-post-lost-millions-second-quarter/,"<a href=""https://globalnews.ca/news/11350437/canada-post-lost-millions-second-quarter/"">Canada Post lost $407 million in ‘largest loss’ in a single quarter</a>"
