Rank,Article title,url,Byline,Article type,title_with_link
1,"As an ER doc and a mom, here are five things I don’t let my kids do because the risks are too high",https://www.theglobeandmail.com/life/advice/article-as-an-er-doc-and-a-mom-here-are-five-things-i-dont-let-my-kids-do/,No byline found,No article type found,"<a href=""https://www.theglobeandmail.com/life/advice/article-as-an-er-doc-and-a-mom-here-are-five-things-i-dont-let-my-kids-do/"">As an ER doc and a mom, here are five things I don’t let my kids do because the risks are too high</a>"
2,The view from China: What does Beijing want from Carney’s visit?,https://www.theglobeandmail.com/world/article-the-view-from-china-what-does-beijing-want-from-carneys-visit/,No byline found,No article type found,"<a href=""https://www.theglobeandmail.com/world/article-the-view-from-china-what-does-beijing-want-from-carneys-visit/"">The view from China: What does Beijing want from Carney’s visit?</a>"
3,What has three years of decriminalization of drug possession yielded in B.C.?,https://www.theglobeandmail.com/opinion/article-drug-possession-decriminalization-bc-health-addiction-overdose-opioids/,André Picard,Opinion,"<a href=""https://www.theglobeandmail.com/opinion/article-drug-possession-decriminalization-bc-health-addiction-overdose-opioids/"">What has three years of decriminalization of drug possession yielded in B.C.?</a>"
4,Could this Toronto couple find a detached home with transit access on a $1-million budget?,https://www.theglobeandmail.com/investing/personal-finance/article-toronto-detached-home-transit-access-1-million-budget/,No byline found,No article type found,"<a href=""https://www.theglobeandmail.com/investing/personal-finance/article-toronto-detached-home-transit-access-1-million-budget/"">Could this Toronto couple find a detached home with transit access on a $1-million budget?</a>"
5,"Have high cholesterol? Follow this science-backed diet, even partially, to lower your level",https://www.theglobeandmail.com/life/health-and-fitness/article-portfolio-diet-lower-bad-cholesterol/,No byline found,No article type found,"<a href=""https://www.theglobeandmail.com/life/health-and-fitness/article-portfolio-diet-lower-bad-cholesterol/"">Have high cholesterol? Follow this science-backed diet, even partially, to lower your level</a>"
6,Ontario Power Generation seeks rate increase for electricity from nuclear plants,https://www.theglobeandmail.com/business/article-ontario-power-generation-rate-increase-application-electricity-nuclear/,No byline found,No article type found,"<a href=""https://www.theglobeandmail.com/business/article-ontario-power-generation-rate-increase-application-electricity-nuclear/"">Ontario Power Generation seeks rate increase for electricity from nuclear plants</a>"
7,"In a pivot, Carney seeks to reset relationship with China, build trade ties",https://www.theglobeandmail.com/politics/article-carney-china-trip-trade-tariffs-national-security/,No byline found,No article type found,"<a href=""https://www.theglobeandmail.com/politics/article-carney-china-trip-trade-tariffs-national-security/"">In a pivot, Carney seeks to reset relationship with China, build trade ties</a>"
8,The ‘motherhood penalty’: An accountant (and mother) explains the hidden costs of parenting,https://www.theglobeandmail.com/life/advice/parenting/article-motherhood-penalty-hidden-costs-of-parenting/,No byline found,No article type found,"<a href=""https://www.theglobeandmail.com/life/advice/parenting/article-motherhood-penalty-hidden-costs-of-parenting/"">The ‘motherhood penalty’: An accountant (and mother) explains the hidden costs of parenting</a>"
