Rank,Article title,url,Byline,Article type,title_with_link
1,"As Alberta teachers strike, thousands rally in Edmonton to support educators",https://www.theglobeandmail.com/canada/article-edmonton-rally-alberta-teachers-strike/,No byline found,No article type found,"<a href=""https://www.theglobeandmail.com/canada/article-edmonton-rally-alberta-teachers-strike/"">As Alberta teachers strike, thousands rally in Edmonton to support educators</a>"
2,"Carney has large and risky job ahead of him on Washington visit, former officials say",https://www.theglobeandmail.com/politics/article-carney-trump-tariff-talks-return-to-washington/,No byline found,No article type found,"<a href=""https://www.theglobeandmail.com/politics/article-carney-trump-tariff-talks-return-to-washington/"">Carney has large and risky job ahead of him on Washington visit, former officials say</a>"
3,"When crafting an investing strategy, retirees often forget to consider inflation",https://www.theglobeandmail.com/investing/markets/inside-the-market/article-retirees-often-forget-inflation-investment-strategy/,No byline found,No article type found,"<a href=""https://www.theglobeandmail.com/investing/markets/inside-the-market/article-retirees-often-forget-inflation-investment-strategy/"">When crafting an investing strategy, retirees often forget to consider inflation</a>"
4,France faces fresh political turmoil after Prime Minister Sébastien Lecornu resigns weeks into role,https://www.theglobeandmail.com/world/article-france-prime-minister-sebastien-lecornu-resigns/,No byline found,No article type found,"<a href=""https://www.theglobeandmail.com/world/article-france-prime-minister-sebastien-lecornu-resigns/"">France faces fresh political turmoil after Prime Minister Sébastien Lecornu resigns weeks into role</a>"
5,Pembina Pipeline a contender to buy minority stake in natural gas division from KKR,https://www.theglobeandmail.com/business/article-pembina-pipeline-kkr-natural-gas-division-buy-back/,No byline found,No article type found,"<a href=""https://www.theglobeandmail.com/business/article-pembina-pipeline-kkr-natural-gas-division-buy-back/"">Pembina Pipeline a contender to buy minority stake in natural gas division from KKR</a>"
6,Poll on U.S. political division points to irreconcilable differences,https://www.theglobeandmail.com/world/us-politics/article-us-political-division-irreconcilable-differences-poll/,No byline found,Analysis,"<a href=""https://www.theglobeandmail.com/world/us-politics/article-us-political-division-irreconcilable-differences-poll/"">Poll on U.S. political division points to irreconcilable differences</a>"
7,Impaired driver arrested after two people struck by vehicle in Toronto,https://www.theglobeandmail.com/canada/article-impaired-driver-arrested-after-two-people-struck-by-vehicle-in-toronto/,No byline found,No article type found,"<a href=""https://www.theglobeandmail.com/canada/article-impaired-driver-arrested-after-two-people-struck-by-vehicle-in-toronto/"">Impaired driver arrested after two people struck by vehicle in Toronto</a>"
8,"The Blue Jays, full of swagger, have the Yankees on the brink",https://www.theglobeandmail.com/sports/baseball/article-toronto-blue-jays-swagger-new-york-yankees-on-the-brink/,Cathal Kelly,Opinion,"<a href=""https://www.theglobeandmail.com/sports/baseball/article-toronto-blue-jays-swagger-new-york-yankees-on-the-brink/"">The Blue Jays, full of swagger, have the Yankees on the brink</a>"
