Rank,Article title,url,Byline,Article type,title_with_link
1,Before the Bell: What every Canadian investor needs to know today,https://www.theglobeandmail.com/investing/markets/inside-the-market/article-before-the-bell-what-every-canadian-investor-needs-to-know-today-1281/,No byline found,No article type found,"<a href=""https://www.theglobeandmail.com/investing/markets/inside-the-market/article-before-the-bell-what-every-canadian-investor-needs-to-know-today-1281/"">Before the Bell: What every Canadian investor needs to know today</a>"
2,A mysterious illness has killed billions of sea stars. Now scientists say they’ve solved the case,https://www.theglobeandmail.com/canada/science/article-sea-star-wasting-disease-source-recovery-new-research-breakthrough/,No byline found,No article type found,"<a href=""https://www.theglobeandmail.com/canada/science/article-sea-star-wasting-disease-source-recovery-new-research-breakthrough/"">A mysterious illness has killed billions of sea stars. Now scientists say they’ve solved the case</a>"
3,Two new rideshare companies try to compete with Uber and Lyft in Toronto,https://www.theglobeandmail.com/business/article-rideshare-hopp-hovr-uber-lyft-trade-war/,No byline found,No article type found,"<a href=""https://www.theglobeandmail.com/business/article-rideshare-hopp-hovr-uber-lyft-trade-war/"">Two new rideshare companies try to compete with Uber and Lyft in Toronto</a>"
4,Movement to recognize Palestinian statehood reflects Israel’s growing isolation,https://www.theglobeandmail.com/world/article-canada-france-britain-israel-international-palestinian-state-netanyahu/,No byline found,Analysis,"<a href=""https://www.theglobeandmail.com/world/article-canada-france-britain-israel-international-palestinian-state-netanyahu/"">Movement to recognize Palestinian statehood reflects Israel’s growing isolation</a>"
5,‘I see Mark Carney following in the steps of Brian Mulroney.’ Letters to the editor for Aug. 4,https://www.theglobeandmail.com/opinion/letters/article-i-see-mark-carney-following-in-the-steps-of-brian-mulroney/,No byline found,No article type found,"<a href=""https://www.theglobeandmail.com/opinion/letters/article-i-see-mark-carney-following-in-the-steps-of-brian-mulroney/"">‘I see Mark Carney following in the steps of Brian Mulroney.’ Letters to the editor for Aug. 4</a>"
6,How will Canadian consumers be affected by Trump’s de minimis changes?,https://www.theglobeandmail.com/investing/personal-finance/article-trump-de-minimis-changes-canadian-consumer-affect/,No byline found,No article type found,"<a href=""https://www.theglobeandmail.com/investing/personal-finance/article-trump-de-minimis-changes-canadian-consumer-affect/"">How will Canadian consumers be affected by Trump’s de minimis changes?</a>"
7,U.S. Justice Department moves ahead with investigation into origins of Trump-Russia probe,https://www.theglobeandmail.com/world/us-politics/article-trump-russia-probe-investigation-us-justice-department/,No byline found,No article type found,"<a href=""https://www.theglobeandmail.com/world/us-politics/article-trump-russia-probe-investigation-us-justice-department/"">U.S. Justice Department moves ahead with investigation into origins of Trump-Russia probe</a>"
8,These outdoor cooking tools can turn you into a grill master,https://www.theglobeandmail.com/life/home-and-design/article-barbecue-bbq-outdoor-cooking-tools/,No byline found,No article type found,"<a href=""https://www.theglobeandmail.com/life/home-and-design/article-barbecue-bbq-outdoor-cooking-tools/"">These outdoor cooking tools can turn you into a grill master</a>"
