Rank,Article title,url,Byline,Article type,title_with_link
1,Before the Bell: What every Canadian investor needs to know today,https://www.theglobeandmail.com/investing/markets/inside-the-market/article-before-the-bell-what-every-canadian-investor-needs-to-know-today-1445/,No byline found,No article type found,"<a href=""https://www.theglobeandmail.com/investing/markets/inside-the-market/article-before-the-bell-what-every-canadian-investor-needs-to-know-today-1445/"">Before the Bell: What every Canadian investor needs to know today</a>"
2,Tribunal approves $8.5-billion deal for Ontario First Nations to lead their own child welfare,https://www.theglobeandmail.com/canada/article-human-rights-tribunal-child-welfare-agreement-ontario-first-nations/,No byline found,No article type found,"<a href=""https://www.theglobeandmail.com/canada/article-human-rights-tribunal-child-welfare-agreement-ontario-first-nations/"">Tribunal approves $8.5-billion deal for Ontario First Nations to lead their own child welfare</a>"
3,Canucks’ decision to revoke credential of reporter alarms colleagues,https://www.theglobeandmail.com/sports/hockey/article-vancouver-canucks-credential-reporter-nhl/,No byline found,No article type found,"<a href=""https://www.theglobeandmail.com/sports/hockey/article-vancouver-canucks-credential-reporter-nhl/"">Canucks’ decision to revoke credential of reporter alarms colleagues</a>"
4,"Want to slow brain aging? Follow this diet, a new study suggests",https://www.theglobeandmail.com/life/health-and-fitness/article-mind-diet-brain-aging-health/,No byline found,No article type found,"<a href=""https://www.theglobeandmail.com/life/health-and-fitness/article-mind-diet-brain-aging-health/"">Want to slow brain aging? Follow this diet, a new study suggests</a>"
5,"What is B.C.’s new health care law, Bill 36?",https://www.theglobeandmail.com/canada/article-what-is-bcs-new-health-care-law-bill-36/,No byline found,No article type found,"<a href=""https://www.theglobeandmail.com/canada/article-what-is-bcs-new-health-care-law-bill-36/"">What is B.C.’s new health care law, Bill 36?</a>"
6,"B.C.’s move away from self-regulation for health workers is imperfect, but overdue",https://www.theglobeandmail.com/opinion/article-bc-bill-36-self-regulation-health-care-workers-patients/,André Picard,Opinion,"<a href=""https://www.theglobeandmail.com/opinion/article-bc-bill-36-self-regulation-health-care-workers-patients/"">B.C.’s move away from self-regulation for health workers is imperfect, but overdue</a>"
7,NDP Leader Avi Lewis vows to move party to the left and stop oil industry expansion,https://www.theglobeandmail.com/canada/article-ndp-leader-avi-lewis/,No byline found,No article type found,"<a href=""https://www.theglobeandmail.com/canada/article-ndp-leader-avi-lewis/"">NDP Leader Avi Lewis vows to move party to the left and stop oil industry expansion</a>"
8,Meet the winners of the 2026 Gairdner Awards,https://www.theglobeandmail.com/canada/article-meet-the-winners-of-the-2026-gairdner-awards/,No byline found,No article type found,"<a href=""https://www.theglobeandmail.com/canada/article-meet-the-winners-of-the-2026-gairdner-awards/"">Meet the winners of the 2026 Gairdner Awards</a>"
