Rank,Article title,url,Byline,Article type,title_with_link
1,"Jerry Adler, behind-the-scenes Broadway vet turned Sopranos star, dies at 96",https://www.theglobeandmail.com/arts/article-jerry-adler-behind-the-scenes-broadway-vet-turned-sopranos-star-dies/,No byline found,No article type found,"<a href=""https://www.theglobeandmail.com/arts/article-jerry-adler-behind-the-scenes-broadway-vet-turned-sopranos-star-dies/"">Jerry Adler, behind-the-scenes Broadway vet turned Sopranos star, dies at 96</a>"
2,Carney’s cut to PEI tolls is a bridge too far,https://www.theglobeandmail.com/opinion/editorials/article-carneys-cut-to-pei-tolls-are-a-bridge-too-far/,No byline found,No article type found,"<a href=""https://www.theglobeandmail.com/opinion/editorials/article-carneys-cut-to-pei-tolls-are-a-bridge-too-far/"">Carney’s cut to PEI tolls is a bridge too far</a>"
3,The Ukraine emergency is far from over – because Donald Trump is the emergency,https://www.theglobeandmail.com/opinion/article-ukraine-russia-donald-trump-putin-europe/,No byline found,No article type found,"<a href=""https://www.theglobeandmail.com/opinion/article-ukraine-russia-donald-trump-putin-europe/"">The Ukraine emergency is far from over – because Donald Trump is the emergency</a>"
4,Respect has always been central to the American experience. But disrespect explains the country today,https://www.theglobeandmail.com/opinion/article-donald-trump-usa-america-respect-shribman/,David Shribman,Opinion,"<a href=""https://www.theglobeandmail.com/opinion/article-donald-trump-usa-america-respect-shribman/"">Respect has always been central to the American experience. But disrespect explains the country today</a>"
5,Former Alberta deputy premier launches pro-Canada petition amid calls for separation,https://www.theglobeandmail.com/canada/alberta/article-alberta-forever-canadian-petition-thomas-lukaszuk/,No byline found,No article type found,"<a href=""https://www.theglobeandmail.com/canada/alberta/article-alberta-forever-canadian-petition-thomas-lukaszuk/"">Former Alberta deputy premier launches pro-Canada petition amid calls for separation</a>"
6,"Israeli forces open fire on crowd of aid-seekers near Gaza City, killing four",https://www.theglobeandmail.com/world/article-israel-gaza-palestinian-killed-seeking-aid/,No byline found,No article type found,"<a href=""https://www.theglobeandmail.com/world/article-israel-gaza-palestinian-killed-seeking-aid/"">Israeli forces open fire on crowd of aid-seekers near Gaza City, killing four</a>"
7,"Air Canada resumes flying, Carney drops some retaliatory tariffs and Cenovus Energy set to buy MEG Energy: Must-read business and investing stories",https://www.theglobeandmail.com/business/article-air-canada-carney-retaliatory-tariffs-cenovus-meg-energy-august-24/,No byline found,No article type found,"<a href=""https://www.theglobeandmail.com/business/article-air-canada-carney-retaliatory-tariffs-cenovus-meg-energy-august-24/"">Air Canada resumes flying, Carney drops some retaliatory tariffs and Cenovus Energy set to buy MEG Energy: Must-read business and investing stories</a>"
8,"Can Diego, 71, and Monique, 68, spend $130,000 a year in retirement and still give to charity?",https://www.theglobeandmail.com/investing/personal-finance/financial-facelift/article-diego-monique-retirement-estate-travel-charity/,No byline found,No article type found,"<a href=""https://www.theglobeandmail.com/investing/personal-finance/financial-facelift/article-diego-monique-retirement-estate-travel-charity/"">Can Diego, 71, and Monique, 68, spend $130,000 a year in retirement and still give to charity?</a>"
