Rank,Article title,url,Byline,Article type,title_with_link
1,"I’m stepping back from our culture of overwhelm, and bringing the kids with me",https://www.theglobeandmail.com/life/first-person/article-cellphones-parenting-culture-of-overwhelm/,No byline found,No article type found,"<a href=""https://www.theglobeandmail.com/life/first-person/article-cellphones-parenting-culture-of-overwhelm/"">I’m stepping back from our culture of overwhelm, and bringing the kids with me</a>"
2,The Polaris Music Prize is 20 years old. Here’s what artists want for its future,https://www.theglobeandmail.com/arts/music/article-polaris-music-prize-2025-nominees/,No byline found,No article type found,"<a href=""https://www.theglobeandmail.com/arts/music/article-polaris-music-prize-2025-nominees/"">The Polaris Music Prize is 20 years old. Here’s what artists want for its future</a>"
3,"How this teacher used a $150,000 inheritance to finally stop working",https://www.theglobeandmail.com/investing/personal-finance/retirement/article-inheritance-retirement-pension-large-family/,No byline found,No article type found,"<a href=""https://www.theglobeandmail.com/investing/personal-finance/retirement/article-inheritance-retirement-pension-large-family/"">How this teacher used a $150,000 inheritance to finally stop working</a>"
4,"Canada, Mexico to sign strategic partnership during Carney visit",https://www.theglobeandmail.com/politics/article-canada-mexico-strategic-partnership-carney-sheinbaum-trade/,No byline found,No article type found,"<a href=""https://www.theglobeandmail.com/politics/article-canada-mexico-strategic-partnership-carney-sheinbaum-trade/"">Canada, Mexico to sign strategic partnership during Carney visit</a>"
5,Why Canada and Mexico need each other to take on Trump,https://www.theglobeandmail.com/opinion/article-canada-mexico-relationship-carney-visit-trade/,Denise Dresser,Opinion,"<a href=""https://www.theglobeandmail.com/opinion/article-canada-mexico-relationship-carney-visit-trade/"">Why Canada and Mexico need each other to take on Trump</a>"
6,Number of GTA homes being taken over by lenders is skyrocketing,https://www.theglobeandmail.com/real-estate/article-gta-homes-lenders-power-of-sale/,No byline found,No article type found,"<a href=""https://www.theglobeandmail.com/real-estate/article-gta-homes-lenders-power-of-sale/"">Number of GTA homes being taken over by lenders is skyrocketing</a>"
7,"New bill would define hatred in the Criminal Code, make promotion of terror groups illegal",https://www.theglobeandmail.com/politics/article-new-anti-hate-bill-glorifying-terror-groups-illegal-criminal-code/,No byline found,No article type found,"<a href=""https://www.theglobeandmail.com/politics/article-new-anti-hate-bill-glorifying-terror-groups-illegal-criminal-code/"">New bill would define hatred in the Criminal Code, make promotion of terror groups illegal</a>"
8,Investors push back on Teck-Anglo merger over price and index exclusion,https://www.theglobeandmail.com/business/article-teck-resources-anglo-american-merger-mining-energy-investors-tsx/,No byline found,No article type found,"<a href=""https://www.theglobeandmail.com/business/article-teck-resources-anglo-american-merger-mining-energy-investors-tsx/"">Investors push back on Teck-Anglo merger over price and index exclusion</a>"
