Rank,Article title,url,Byline,Article type,title_with_link
1,"Ontario overhauls MAID oversight committee, critics say it’s to remove dissenters",https://www.theglobeandmail.com/canada/article-ontario-overhauls-maid-oversight-committee-critics-say-its-to-remove/,No byline found,No article type found,"<a href=""https://www.theglobeandmail.com/canada/article-ontario-overhauls-maid-oversight-committee-critics-say-its-to-remove/"">Ontario overhauls MAID oversight committee, critics say it’s to remove dissenters</a>"
2,Three keys to cutting your risk of heart attack and stroke,https://www.theglobeandmail.com/life/wellness/article-small-changes-to-improve-heart-health-sleep-diet-exercise/,No byline found,No article type found,"<a href=""https://www.theglobeandmail.com/life/wellness/article-small-changes-to-improve-heart-health-sleep-diet-exercise/"">Three keys to cutting your risk of heart attack and stroke</a>"
3,Coachella fashion serves up modern joy and nostalgia in equal measure,https://www.theglobeandmail.com/life/style/fashion-and-beauty/article-coachella-fashion-serves-up-modern-joy-and-nostalgia-in-equal-measure/,No byline found,No article type found,"<a href=""https://www.theglobeandmail.com/life/style/fashion-and-beauty/article-coachella-fashion-serves-up-modern-joy-and-nostalgia-in-equal-measure/"">Coachella fashion serves up modern joy and nostalgia in equal measure</a>"
4,"At Coachella, Justin Bieber, Justin Trudeau and Katy Perry search for relevance",https://www.theglobeandmail.com/culture/music/article-coachella-justin-bieber-justin-trudeau-katy-perry-search-for-relevancy/,Brad Wheeler,Opinion,"<a href=""https://www.theglobeandmail.com/culture/music/article-coachella-justin-bieber-justin-trudeau-katy-perry-search-for-relevancy/"">At Coachella, Justin Bieber, Justin Trudeau and Katy Perry search for relevance</a>"
5,"Anthropic’s AI model sparks rush from industry, government to batten down defence hatches",https://www.theglobeandmail.com/business/economy/article-anthropic-mythos-ai-defence/,No byline found,No article type found,"<a href=""https://www.theglobeandmail.com/business/economy/article-anthropic-mythos-ai-defence/"">Anthropic’s AI model sparks rush from industry, government to batten down defence hatches</a>"
6,By-elections start Phase 2 of the Carney government,https://www.theglobeandmail.com/politics/opinion/article-byelection-results-liberal-majority-government-carney-phase-2/,Campbell Clark,Opinion,"<a href=""https://www.theglobeandmail.com/politics/opinion/article-byelection-results-liberal-majority-government-carney-phase-2/"">By-elections start Phase 2 of the Carney government</a>"
7,Canadian companies need access to Anthropic’s Mythos before hackers arrive,https://www.theglobeandmail.com/business/commentary/article-anthropic-mythos-ai-glasswing-hackers-defence/,Andrew Willis,Opinion,"<a href=""https://www.theglobeandmail.com/business/commentary/article-anthropic-mythos-ai-glasswing-hackers-defence/"">Canadian companies need access to Anthropic’s Mythos before hackers arrive</a>"
8,Iran trolls Trump on social media after he launches his own blockade of the Strait of Hormuz,https://www.theglobeandmail.com/world/us-politics/article-iran-trolls-trump-on-social-media-after-he-launches-his-own-blockade/,No byline found,No article type found,"<a href=""https://www.theglobeandmail.com/world/us-politics/article-iran-trolls-trump-on-social-media-after-he-launches-his-own-blockade/"">Iran trolls Trump on social media after he launches his own blockade of the Strait of Hormuz</a>"
