Rank,Article title,url,Byline,Article type,title_with_link
1,"At the bars lining London’s streets, the Hockey Canada verdict hits close to home",https://www.theglobeandmail.com/canada/article-london-ontario-reaction-hockey-canada-trial-jacks/,No byline found,No article type found,"<a href=""https://www.theglobeandmail.com/canada/article-london-ontario-reaction-hockey-canada-trial-jacks/"">At the bars lining London’s streets, the Hockey Canada verdict hits close to home</a>"
2,Israeli ambassador rejects Carney’s criticism of aid delivery in Gaza,https://www.theglobeandmail.com/canada/article-israeli-ambassador-rejects-carneys-criticism-of-aid-delivery-in-gaza/,No byline found,No article type found,"<a href=""https://www.theglobeandmail.com/canada/article-israeli-ambassador-rejects-carneys-criticism-of-aid-delivery-in-gaza/"">Israeli ambassador rejects Carney’s criticism of aid delivery in Gaza</a>"
3,Two offers for Toronto condo ‘almost unheard of’ in current market,https://www.theglobeandmail.com/real-estate/toronto/article-toronto-bloor-condo-spring-market/,No byline found,No article type found,"<a href=""https://www.theglobeandmail.com/real-estate/toronto/article-toronto-bloor-condo-spring-market/"">Two offers for Toronto condo ‘almost unheard of’ in current market</a>"
4,My estranged father died in hospital after years of drug use. He was more than a statistic,https://www.theglobeandmail.com/opinion/article-my-estranged-father-died-in-hospital-after-years-of-drug-use-he-was/,No byline found,No article type found,"<a href=""https://www.theglobeandmail.com/opinion/article-my-estranged-father-died-in-hospital-after-years-of-drug-use-he-was/"">My estranged father died in hospital after years of drug use. He was more than a statistic</a>"
5,"After the Hockey Canada verdict, advocates fear survivors will fall silent",https://www.theglobeandmail.com/canada/article-hockey-canada-sexual-assault-trial-verdict-survivors/,No byline found,No article type found,"<a href=""https://www.theglobeandmail.com/canada/article-hockey-canada-sexual-assault-trial-verdict-survivors/"">After the Hockey Canada verdict, advocates fear survivors will fall silent</a>"
6,Try these three daily exercises to keep your hips happy and healthy,https://www.theglobeandmail.com/life/health-and-fitness/article-mobility-exercises-hips/,No byline found,No article type found,"<a href=""https://www.theglobeandmail.com/life/health-and-fitness/article-mobility-exercises-hips/"">Try these three daily exercises to keep your hips happy and healthy</a>"
7,Gen Z is saving for retirement better than millennials,https://www.theglobeandmail.com/investing/personal-finance/retirement/article-retirement-savings-gen-z-canadians/,No byline found,No article type found,"<a href=""https://www.theglobeandmail.com/investing/personal-finance/retirement/article-retirement-savings-gen-z-canadians/"">Gen Z is saving for retirement better than millennials</a>"
8,"#MeToo changed our culture, but it couldn’t change our courts",https://www.theglobeandmail.com/opinion/article-hockey-canada-trial-verdict-sexual-assault-metoo/,No byline found,No article type found,"<a href=""https://www.theglobeandmail.com/opinion/article-hockey-canada-trial-verdict-sexual-assault-metoo/"">#MeToo changed our culture, but it couldn’t change our courts</a>"
