Rank,Article title,url,Byline,Article type,title_with_link
1,"Men convicted in St. Michael’s Hospital fraud case ask Ontario judge to reopen trial, acquit them",https://www.theglobeandmail.com/canada/article-two-men-convicted-fraud-st-michaels-hospital-ask-judge-reopen-trial/,No byline found,No article type found,"<a href=""https://www.theglobeandmail.com/canada/article-two-men-convicted-fraud-st-michaels-hospital-ask-judge-reopen-trial/"">Men convicted in St. Michael’s Hospital fraud case ask Ontario judge to reopen trial, acquit them</a>"
2,Bank of Montreal fined $4-million for overcharging customers on discounted plans,https://www.theglobeandmail.com/business/article-bank-of-montreal-bmo-fine/,No byline found,No article type found,"<a href=""https://www.theglobeandmail.com/business/article-bank-of-montreal-bmo-fine/"">Bank of Montreal fined $4-million for overcharging customers on discounted plans</a>"
3,Canadian miners seek payments for seized Venezuela gold deposits – but victory comes at a price,https://www.theglobeandmail.com/business/article-venezuela-gold-crystallex-rusoro-pdvsa-citgo-maduro/,No byline found,Analysis,"<a href=""https://www.theglobeandmail.com/business/article-venezuela-gold-crystallex-rusoro-pdvsa-citgo-maduro/"">Canadian miners seek payments for seized Venezuela gold deposits – but victory comes at a price</a>"
4,Six dividend ETF picks for RRSP season,https://www.theglobeandmail.com/investing/globe-advisor/advisor-etfs/article-six-dividend-etf-picks-for-rrsp-season/,No byline found,No article type found,"<a href=""https://www.theglobeandmail.com/investing/globe-advisor/advisor-etfs/article-six-dividend-etf-picks-for-rrsp-season/"">Six dividend ETF picks for RRSP season</a>"
5,Canada and France establish diplomatic presence in Greenland amid Trump threats,https://www.theglobeandmail.com/world/article-canada-and-france-establish-diplomatic-presence-in-greenland-amid/,No byline found,No article type found,"<a href=""https://www.theglobeandmail.com/world/article-canada-and-france-establish-diplomatic-presence-in-greenland-amid/"">Canada and France establish diplomatic presence in Greenland amid Trump threats</a>"
6,10 Canadian stocks with flexibility to thrive in uncertain markets,https://www.theglobeandmail.com/investing/investment-ideas/number-cruncher/article-canadian-stock-flexibility-balance-sheets-cash-flow/,No byline found,No article type found,"<a href=""https://www.theglobeandmail.com/investing/investment-ideas/number-cruncher/article-canadian-stock-flexibility-balance-sheets-cash-flow/"">10 Canadian stocks with flexibility to thrive in uncertain markets</a>"
7,Do Canadians really need to be hearing from Pete Hoekstra this much?,https://www.theglobeandmail.com/opinion/article-do-canadians-really-need-to-be-hearing-from-pete-hoekstra-this-much/,Peter Donolo,Opinion,"<a href=""https://www.theglobeandmail.com/opinion/article-do-canadians-really-need-to-be-hearing-from-pete-hoekstra-this-much/"">Do Canadians really need to be hearing from Pete Hoekstra this much?</a>"
8,Ski mountaineering’s debut at Milan Cortina throws the Olympic sports we know into reverse,https://www.theglobeandmail.com/sports/article-ski-mountaineerings-debut-at-milan-cortina-puts-the-olympic-sports-we/,No byline found,No article type found,"<a href=""https://www.theglobeandmail.com/sports/article-ski-mountaineerings-debut-at-milan-cortina-puts-the-olympic-sports-we/"">Ski mountaineering’s debut at Milan Cortina throws the Olympic sports we know into reverse</a>"
