Rank,Article title,url,Byline,Article type,title_with_link
1,The price of ignoring supply and demand,https://www.theglobeandmail.com/opinion/editorials/article-the-price-of-ignoring-supply-and-demand/,No byline found,No article type found,"<a href=""https://www.theglobeandmail.com/opinion/editorials/article-the-price-of-ignoring-supply-and-demand/"">The price of ignoring supply and demand</a>"
2,Insider Report: CEO invests over $1-million in this energy stock yielding 3.3%,https://www.theglobeandmail.com/investing/markets/inside-the-market/article-insider-report-ceo-invests-over-1-million-in-this-energy-stock/,No byline found,No article type found,"<a href=""https://www.theglobeandmail.com/investing/markets/inside-the-market/article-insider-report-ceo-invests-over-1-million-in-this-energy-stock/"">Insider Report: CEO invests over $1-million in this energy stock yielding 3.3%</a>"
3,"Xanadu stock takes another quantum leap, triggering five TSX trading halts",https://www.theglobeandmail.com/business/technology/article-xanadu-stock-quantum-computing-four-tsx-trading-halts/,No byline found,No article type found,"<a href=""https://www.theglobeandmail.com/business/technology/article-xanadu-stock-quantum-computing-four-tsx-trading-halts/"">Xanadu stock takes another quantum leap, triggering five TSX trading halts</a>"
4,Something Very Bad Is Going to Happen peels back the horrors of marriage,https://www.theglobeandmail.com/culture/film-and-tv/television/article-something-very-bad-is-going-to-happen-review/,No byline found,No article type found,"<a href=""https://www.theglobeandmail.com/culture/film-and-tv/television/article-something-very-bad-is-going-to-happen-review/"">Something Very Bad Is Going to Happen peels back the horrors of marriage</a>"
5,"Trudeau can live his postpolitical life however he wants, but it will invariably reflect on his time in office",https://www.theglobeandmail.com/opinion/article-trudeau-post-political-life-will-reflect-on-his-time-in-office/,No byline found,No article type found,"<a href=""https://www.theglobeandmail.com/opinion/article-trudeau-post-political-life-will-reflect-on-his-time-in-office/"">Trudeau can live his postpolitical life however he wants, but it will invariably reflect on his time in office</a>"
6,Friday’s analyst upgrades and downgrades,https://www.theglobeandmail.com/investing/markets/inside-the-market/article-fridays-analyst-upgrades-and-downgrades-297/,No byline found,No article type found,"<a href=""https://www.theglobeandmail.com/investing/markets/inside-the-market/article-fridays-analyst-upgrades-and-downgrades-297/"">Friday’s analyst upgrades and downgrades</a>"
7,Joining the EU would be a ridiculous response to Canada’s real problems,https://www.theglobeandmail.com/opinion/article-joining-the-eu-would-be-a-ridiculous-response-to-canadas-problems/,Andrew Coyne,Opinion,"<a href=""https://www.theglobeandmail.com/opinion/article-joining-the-eu-would-be-a-ridiculous-response-to-canadas-problems/"">Joining the EU would be a ridiculous response to Canada’s real problems</a>"
8,"Sexual-assault charges against Alberta spiritual leader John de Ruiter to be stayed, Crown tells complainants",https://www.theglobeandmail.com/canada/alberta/article-sexual-assault-charges-against-alberta-spiritual-leader-john-de-ruiter/,No byline found,No article type found,"<a href=""https://www.theglobeandmail.com/canada/alberta/article-sexual-assault-charges-against-alberta-spiritual-leader-john-de-ruiter/"">Sexual-assault charges against Alberta spiritual leader John de Ruiter to be stayed, Crown tells complainants</a>"
