Rank,Article title,url,Byline,Article type,title_with_link
1,How much do you know about healthy eating? Take our nutrition quiz,https://www.theglobeandmail.com/life/article-healthy-eating-nutrition-quiz/,No byline found,No article type found,"<a href=""https://www.theglobeandmail.com/life/article-healthy-eating-nutrition-quiz/"">How much do you know about healthy eating? Take our nutrition quiz</a>"
2,"Strong winds knock out power to thousands in Central Canada, Maritimes",https://www.theglobeandmail.com/canada/article-strong-winds-knock-out-power-to-thousands-in-ontario-and-the-maritimes/,No byline found,No article type found,"<a href=""https://www.theglobeandmail.com/canada/article-strong-winds-knock-out-power-to-thousands-in-ontario-and-the-maritimes/"">Strong winds knock out power to thousands in Central Canada, Maritimes</a>"
3,Ontario to allow BYOB at cultural and community outdoor events starting this spring,https://www.theglobeandmail.com/canada/article-ontario-to-allow-byob-at-cultural-and-community-outdoor-events/,No byline found,No article type found,"<a href=""https://www.theglobeandmail.com/canada/article-ontario-to-allow-byob-at-cultural-and-community-outdoor-events/"">Ontario to allow BYOB at cultural and community outdoor events starting this spring</a>"
4,"Stay Alive: Berlin, 1939-1945 paints a vivid portrait of a city under moral, financial, and military siege",https://www.theglobeandmail.com/culture/books/article-stay-alive-berlin-1939-1945-ian-buruma/,No byline found,No article type found,"<a href=""https://www.theglobeandmail.com/culture/books/article-stay-alive-berlin-1939-1945-ian-buruma/"">Stay Alive: Berlin, 1939-1945 paints a vivid portrait of a city under moral, financial, and military siege</a>"
5,Iran has a strategy. Does Trump?,https://www.theglobeandmail.com/business/commentary/article-iran-has-a-strategy-does-trump/,Tony Keller,Opinion,"<a href=""https://www.theglobeandmail.com/business/commentary/article-iran-has-a-strategy-does-trump/"">Iran has a strategy. Does Trump?</a>"
6,Home sales fall further in February as mortgage rates and ‘relentless’ weather weigh on market,https://www.theglobeandmail.com/business/article-home-sales-february-mortgage-rates-winter-weather/,No byline found,No article type found,"<a href=""https://www.theglobeandmail.com/business/article-home-sales-february-mortgage-rates-winter-weather/"">Home sales fall further in February as mortgage rates and ‘relentless’ weather weigh on market</a>"
7,Top U.S. counterterrorism official Joe Kent resigns over war with Iran,https://www.theglobeandmail.com/world/article-iran-war-us-counterterrorism-official-resigns-joseph-kent/,No byline found,No article type found,"<a href=""https://www.theglobeandmail.com/world/article-iran-war-us-counterterrorism-official-resigns-joseph-kent/"">Top U.S. counterterrorism official Joe Kent resigns over war with Iran</a>"
8,Millions of Cubans remain without power as Rubio calls for new leadership,https://www.theglobeandmail.com/world/article-cuba-power-outage-grid-oil-blockage-trump/,No byline found,No article type found,"<a href=""https://www.theglobeandmail.com/world/article-cuba-power-outage-grid-oil-blockage-trump/"">Millions of Cubans remain without power as Rubio calls for new leadership</a>"
