Rank,Article title,url,Byline,Article type,title_with_link
1,Four ways to disaster-proof your finances in this dreadful labour market,https://www.theglobeandmail.com/investing/personal-finance/article-on-money-four-ways-to-disaster-proof-your-finances/,No byline found,No article type found,"<a href=""https://www.theglobeandmail.com/investing/personal-finance/article-on-money-four-ways-to-disaster-proof-your-finances/"">Four ways to disaster-proof your finances in this dreadful labour market</a>"
2,Books we’re reading and loving in April,https://www.theglobeandmail.com/culture/books/article-best-books-to-read-april-2026/,No byline found,No article type found,"<a href=""https://www.theglobeandmail.com/culture/books/article-best-books-to-read-april-2026/"">Books we’re reading and loving in April</a>"
3,What to watch this weekend: The return of Jon Hamm’s Your Friends and Neighbors – and your friendly neighbourhood spiders,https://www.theglobeandmail.com/culture/film-and-tv/television/article-your-friends-and-neighbors-spiderman-cheetah/,No byline found,No article type found,"<a href=""https://www.theglobeandmail.com/culture/film-and-tv/television/article-your-friends-and-neighbors-spiderman-cheetah/"">What to watch this weekend: The return of Jon Hamm’s Your Friends and Neighbors – and your friendly neighbourhood spiders</a>"
4,"Court rules B.C. First Nation has land title, recognizing its full claim",https://www.theglobeandmail.com/canada/article-nuchatlaht-bc-first-nation-land-title-claim/,No byline found,No article type found,"<a href=""https://www.theglobeandmail.com/canada/article-nuchatlaht-bc-first-nation-land-title-claim/"">Court rules B.C. First Nation has land title, recognizing its full claim</a>"
5,Industry Minister rejects Stellantis plan to build Chinese EVs at idled Brampton plant,https://www.theglobeandmail.com/business/article-stellantis-chinese-evs-leapmotor-melanie-joly-brampton/,No byline found,No article type found,"<a href=""https://www.theglobeandmail.com/business/article-stellantis-chinese-evs-leapmotor-melanie-joly-brampton/"">Industry Minister rejects Stellantis plan to build Chinese EVs at idled Brampton plant</a>"
6,"Nicola Wealth halts investor redemptions on real estate value fund, plans to wind it down",https://www.theglobeandmail.com/business/article-nicola-wealth-investor-redemptions-real-estate-fund/,No byline found,No article type found,"<a href=""https://www.theglobeandmail.com/business/article-nicola-wealth-investor-redemptions-real-estate-fund/"">Nicola Wealth halts investor redemptions on real estate value fund, plans to wind it down</a>"
7,Trump has no Plan B in Iran. He never had much of a Plan A,https://www.theglobeandmail.com/business/commentary/article-donald-trump-iran-war-address-plan-b/,Tony Keller,Opinion,"<a href=""https://www.theglobeandmail.com/business/commentary/article-donald-trump-iran-war-address-plan-b/"">Trump has no Plan B in Iran. He never had much of a Plan A</a>"
8,Trump threatens more strikes on Iran’s infrastructure as efforts to reopen Strait of Hormuz continue,https://www.theglobeandmail.com/world/article-trump-threatens-more-strikes-on-iranian-infrastructure-as-efforts-to/,No byline found,No article type found,"<a href=""https://www.theglobeandmail.com/world/article-trump-threatens-more-strikes-on-iranian-infrastructure-as-efforts-to/"">Trump threatens more strikes on Iran’s infrastructure as efforts to reopen Strait of Hormuz continue</a>"
