Rank,Article title,url,Byline,Article type,title_with_link
1,Canadian dollar edges higher as risk appetite improves,https://www.theglobeandmail.com/investing/article-canadian-dollar-edges-higher-as-risk-appetite-improves/,No byline found,No article type found,"<a href=""https://www.theglobeandmail.com/investing/article-canadian-dollar-edges-higher-as-risk-appetite-improves/"">Canadian dollar edges higher as risk appetite improves</a>"
2,Philadelphia museum returns partial remains of Canadian First World War soldiers,https://www.theglobeandmail.com/canada/article-philadelphia-museum-returns-partial-remains-of-canadian-first-world/,No byline found,No article type found,"<a href=""https://www.theglobeandmail.com/canada/article-philadelphia-museum-returns-partial-remains-of-canadian-first-world/"">Philadelphia museum returns partial remains of Canadian First World War soldiers</a>"
3,"Ontario Teachers’ Pension Plan earns 6.7% return, marks down private equity and real estate assets",https://www.theglobeandmail.com/business/article-ontario-teachers-pension-plan-2025-return-private-equity-real-estate/,No byline found,No article type found,"<a href=""https://www.theglobeandmail.com/business/article-ontario-teachers-pension-plan-2025-return-private-equity-real-estate/"">Ontario Teachers’ Pension Plan earns 6.7% return, marks down private equity and real estate assets</a>"
4,MPs press Carney on Ottawa’s response to fallout from Iran war,https://www.theglobeandmail.com/politics/article-mark-carney-commons-debate-middle-east/,No byline found,No article type found,"<a href=""https://www.theglobeandmail.com/politics/article-mark-carney-commons-debate-middle-east/"">MPs press Carney on Ottawa’s response to fallout from Iran war</a>"
5,Leading during wartime will show us who Trump really is,https://www.theglobeandmail.com/world/us-politics/article-leading-during-wartime-will-show-us-who-trump-really-is/,No byline found,Analysis,"<a href=""https://www.theglobeandmail.com/world/us-politics/article-leading-during-wartime-will-show-us-who-trump-really-is/"">Leading during wartime will show us who Trump really is</a>"
6,The early winner of the Iran war? Vladimir Putin,https://www.theglobeandmail.com/opinion/article-the-early-winner-of-the-iran-war-vladimir-putin/,Gary Mason,Opinion,"<a href=""https://www.theglobeandmail.com/opinion/article-the-early-winner-of-the-iran-war-vladimir-putin/"">The early winner of the Iran war? Vladimir Putin</a>"
7,My workplace makes my colleague pray in the stairwell. Aren’t they legally obligated to provide a comfortable place?,https://www.theglobeandmail.com/business/careers/career-advice/article-my-workplace-makes-my-colleague-pray-in-the-stairwell-arent-they/,No byline found,No article type found,"<a href=""https://www.theglobeandmail.com/business/careers/career-advice/article-my-workplace-makes-my-colleague-pray-in-the-stairwell-arent-they/"">My workplace makes my colleague pray in the stairwell. Aren’t they legally obligated to provide a comfortable place?</a>"
8,"U.S., Israel hit Iran with intense air strikes as Revolutionary Guard vows to block oil shipments",https://www.theglobeandmail.com/world/article-iran-war-us-israel-strikes-oil-exports-trump/,No byline found,No article type found,"<a href=""https://www.theglobeandmail.com/world/article-iran-war-us-israel-strikes-oil-exports-trump/"">U.S., Israel hit Iran with intense air strikes as Revolutionary Guard vows to block oil shipments</a>"
