Rank,Article title,url,Byline,Article type,title_with_link
1,"For Jewish communities, Chinese food is more than a Christmas tradition – they’re also walking the wok",https://www.theglobeandmail.com/opinion/article-chinese-food-christmas-tradition-wok-jewish-community/,Jason Wang,Opinion,"<a href=""https://www.theglobeandmail.com/opinion/article-chinese-food-christmas-tradition-wok-jewish-community/"">For Jewish communities, Chinese food is more than a Christmas tradition – they’re also walking the wok</a>"
2,"From Washington to Iqaluit, Carney’s travels reveal a lot about his priorities",https://www.theglobeandmail.com/canada/article-mark-carney-travels-trips-mapped/,No byline found,No article type found,"<a href=""https://www.theglobeandmail.com/canada/article-mark-carney-travels-trips-mapped/"">From Washington to Iqaluit, Carney’s travels reveal a lot about his priorities</a>"
3,Carney formally names investment executive Mark Wiseman as next U.S. ambassador,https://www.theglobeandmail.com/politics/article-mark-wiseman-us-ambassador/,No byline found,No article type found,"<a href=""https://www.theglobeandmail.com/politics/article-mark-wiseman-us-ambassador/"">Carney formally names investment executive Mark Wiseman as next U.S. ambassador</a>"
4,Canada must acknowledge the implications of selling uranium to India,https://www.theglobeandmail.com/opinion/article-uranium-india-nuclear-canada-carney-npt-non-proliferation-cameco/,Gordon Edwards,Opinion,"<a href=""https://www.theglobeandmail.com/opinion/article-uranium-india-nuclear-canada-carney-npt-non-proliferation-cameco/"">Canada must acknowledge the implications of selling uranium to India</a>"
5,"Canada Post, union reach tentative agreements that include wage hikes, enhanced benefits",https://www.theglobeandmail.com/business/article-canada-post-canadian-union-of-postal-workers-tentative-agreements/,No byline found,No article type found,"<a href=""https://www.theglobeandmail.com/business/article-canada-post-canadian-union-of-postal-workers-tentative-agreements/"">Canada Post, union reach tentative agreements that include wage hikes, enhanced benefits</a>"
6,The Canadian bakeries and cafés that deliver on small daily indulgences for our readers,https://www.theglobeandmail.com/life/style/food-and-drink/article-treats-dining-out-bakeries-reader-responses/,No byline found,No article type found,"<a href=""https://www.theglobeandmail.com/life/style/food-and-drink/article-treats-dining-out-bakeries-reader-responses/"">The Canadian bakeries and cafés that deliver on small daily indulgences for our readers</a>"
7,"Is Canada’s population decline real, or a statistical mirage?",https://www.theglobeandmail.com/business/commentary/article-is-canadas-population-decline-real-or-a-statistical-mirage/,Tony Keller,Opinion,"<a href=""https://www.theglobeandmail.com/business/commentary/article-is-canadas-population-decline-real-or-a-statistical-mirage/"">Is Canada’s population decline real, or a statistical mirage?</a>"
8,Fiddler Ashley MacIsaac has show cancelled over Google AI-generated misinformation,https://www.theglobeandmail.com/culture/article-ashley-macisaac-show-cancelled-google-ai-misinformation-music-fiddler/,No byline found,No article type found,"<a href=""https://www.theglobeandmail.com/culture/article-ashley-macisaac-show-cancelled-google-ai-misinformation-music-fiddler/"">Fiddler Ashley MacIsaac has show cancelled over Google AI-generated misinformation</a>"
