Rank,Article title,url,Byline,Article type,title_with_link
1,Canadian economy snaps back from winter lull,https://www.theglobeandmail.com/business/article-canada-gdp-economy-2026-april-recession/,No byline found,No article type found,"<a href=""https://www.theglobeandmail.com/business/article-canada-gdp-economy-2026-april-recession/"">Canadian economy snaps back from winter lull</a>"
2,"Glacier lake bursts in B.C., triggering evacuation order",https://www.theglobeandmail.com/canada/article-glacier-lake-outburst-bc-flood-pemberton/,No byline found,No article type found,"<a href=""https://www.theglobeandmail.com/canada/article-glacier-lake-outburst-bc-flood-pemberton/"">Glacier lake bursts in B.C., triggering evacuation order</a>"
3,Indigenous leaders criticize claim that Northern Ontario evacuees are burdening Niagara Falls tourism,https://www.theglobeandmail.com/canada/article-kashechewan-first-nation-evacuees-niagara-falls/,No byline found,No article type found,"<a href=""https://www.theglobeandmail.com/canada/article-kashechewan-first-nation-evacuees-niagara-falls/"">Indigenous leaders criticize claim that Northern Ontario evacuees are burdening Niagara Falls tourism</a>"
4,‘I don’t want cheap American milk products. I would rather pay more for my milk.’ Letters to the editor for June 30,https://www.theglobeandmail.com/opinion/letters/article-i-dont-want-cheap-american-milk-i-would-rather-pay-more/,No byline found,No article type found,"<a href=""https://www.theglobeandmail.com/opinion/letters/article-i-dont-want-cheap-american-milk-i-would-rather-pay-more/"">‘I don’t want cheap American milk products. I would rather pay more for my milk.’ Letters to the editor for June 30</a>"
5,"Who does Mark Carney think we are, anyway?",https://www.theglobeandmail.com/politics/opinion/article-who-does-mark-carney-prime-minister-think-we-are/,No byline found,No article type found,"<a href=""https://www.theglobeandmail.com/politics/opinion/article-who-does-mark-carney-prime-minister-think-we-are/"">Who does Mark Carney think we are, anyway?</a>"
6,No extension to USMCA expected as key date arrives,https://www.theglobeandmail.com/world/us-politics/article-us-renew-trade-deal-canada-mexico-usmca/,No byline found,No article type found,"<a href=""https://www.theglobeandmail.com/world/us-politics/article-us-renew-trade-deal-canada-mexico-usmca/"">No extension to USMCA expected as key date arrives</a>"
7,Former top Republican sees ‘Fortress North America’ concept as a winner in USMCA trade talks,https://www.theglobeandmail.com/business/article-former-top-republican-sees-fortress-north-america-concept-as-a-winner/,No byline found,No article type found,"<a href=""https://www.theglobeandmail.com/business/article-former-top-republican-sees-fortress-north-america-concept-as-a-winner/"">Former top Republican sees ‘Fortress North America’ concept as a winner in USMCA trade talks</a>"
8,Six riveting thrillers to read this summer,https://www.theglobeandmail.com/culture/books/article-six-riveting-thrillers-to-read-this-summer/,No byline found,No article type found,"<a href=""https://www.theglobeandmail.com/culture/books/article-six-riveting-thrillers-to-read-this-summer/"">Six riveting thrillers to read this summer</a>"
