Rank,Article title,url,Byline,Article type,title_with_link
1,"Report showing rise in anti-Palestinian, anti-Arab racism after Oct. 7 attack to inform recommendations to government",https://www.theglobeandmail.com/politics/article-anti-palestinian-anti-arab-racism-report-recommendations-government/,No byline found,No article type found,"<a href=""https://www.theglobeandmail.com/politics/article-anti-palestinian-anti-arab-racism-report-recommendations-government/"">Report showing rise in anti-Palestinian, anti-Arab racism after Oct. 7 attack to inform recommendations to government</a>"
2,This Canadian is among the world’s top-ranked female players in a sport she calls ‘chess on grass’,https://www.theglobeandmail.com/life/article-mastering-it-professional-lawn-bowler-kelly-mckerihen/,No byline found,No article type found,"<a href=""https://www.theglobeandmail.com/life/article-mastering-it-professional-lawn-bowler-kelly-mckerihen/"">This Canadian is among the world’s top-ranked female players in a sport she calls ‘chess on grass’</a>"
3,"Mboko advances to women’s singles final at National Bank Open, continuing remarkable streak",https://www.theglobeandmail.com/sports/article-victoria-mboko-elena-rybakina-semifinal/,No byline found,No article type found,"<a href=""https://www.theglobeandmail.com/sports/article-victoria-mboko-elena-rybakina-semifinal/"">Mboko advances to women’s singles final at National Bank Open, continuing remarkable streak</a>"
4,What to watch this weekend: Re-examine a harrowing Canadian crime,https://www.theglobeandmail.com/arts/article-christine-jessop-jenna-ortega-wednesday-plan-b-outlander-kennedys/,No byline found,No article type found,"<a href=""https://www.theglobeandmail.com/arts/article-christine-jessop-jenna-ortega-wednesday-plan-b-outlander-kennedys/"">What to watch this weekend: Re-examine a harrowing Canadian crime</a>"
5,Ottawa faces growing pressure to loosen foreign homebuying ban,https://www.theglobeandmail.com/business/article-foreign-homebuying-ban-ottawa-pressure/,No byline found,No article type found,"<a href=""https://www.theglobeandmail.com/business/article-foreign-homebuying-ban-ottawa-pressure/"">Ottawa faces growing pressure to loosen foreign homebuying ban</a>"
6,"GFL’s infrastructure arm, GIP, sells stake to new private equity investor",https://www.theglobeandmail.com/business/article-gfls-infrastructure-arm-gip-sells-stake-to-new-private-equity-investor/,No byline found,No article type found,"<a href=""https://www.theglobeandmail.com/business/article-gfls-infrastructure-arm-gip-sells-stake-to-new-private-equity-investor/"">GFL’s infrastructure arm, GIP, sells stake to new private equity investor</a>"
7,"Defence review says Ottawa should stick with F-35 jets, sources say",https://www.theglobeandmail.com/canada/article-defence-review-ottawa-f35-jets/,No byline found,No article type found,"<a href=""https://www.theglobeandmail.com/canada/article-defence-review-ottawa-f35-jets/"">Defence review says Ottawa should stick with F-35 jets, sources say</a>"
8,Manitoba Métis Federation won’t attend Carney’s major projects meeting over inclusion of Ontario group,https://www.theglobeandmail.com/politics/article-manitoba-metis-federation-carney-major-projects-bill-meeting/,No byline found,No article type found,"<a href=""https://www.theglobeandmail.com/politics/article-manitoba-metis-federation-carney-major-projects-bill-meeting/"">Manitoba Métis Federation won’t attend Carney’s major projects meeting over inclusion of Ontario group</a>"
