Rank,Article title,url,Byline,Article type,title_with_link
1,France moves to suspend Shein over childlike sex dolls and weapons as Paris store opens,https://www.theglobeandmail.com/world/article-shein-fashion-paris-dolls-weapons-protest-online-retail/,No byline found,No article type found,"<a href=""https://www.theglobeandmail.com/world/article-shein-fashion-paris-dolls-weapons-protest-online-retail/"">France moves to suspend Shein over childlike sex dolls and weapons as Paris store opens</a>"
2,"Meet ‘the Walkers,’ a group of Gen Z friends taking social stardom and haters in stride",https://www.theglobeandmail.com/life/article-the-walkers-gen-z-friends-social-media-adulthood/,No byline found,No article type found,"<a href=""https://www.theglobeandmail.com/life/article-the-walkers-gen-z-friends-social-media-adulthood/"">Meet ‘the Walkers,’ a group of Gen Z friends taking social stardom and haters in stride</a>"
3,Mexican President Sheinbaum presses charges after man gropes her in street,https://www.theglobeandmail.com/world/article-mexico-president-claudia-sheinbaum-grope-street-sexual-assault/,No byline found,No article type found,"<a href=""https://www.theglobeandmail.com/world/article-mexico-president-claudia-sheinbaum-grope-street-sexual-assault/"">Mexican President Sheinbaum presses charges after man gropes her in street</a>"
4,India joins China in slapping tariffs on Canadian yellow peas,https://www.theglobeandmail.com/business/industry-news/article-india-joins-china-in-slapping-tariffs-on-canadian-yellow-peas/,No byline found,No article type found,"<a href=""https://www.theglobeandmail.com/business/industry-news/article-india-joins-china-in-slapping-tariffs-on-canadian-yellow-peas/"">India joins China in slapping tariffs on Canadian yellow peas</a>"
5,"Eight ways the budget affects your wallet, from vacant homes to student loans",https://www.theglobeandmail.com/investing/personal-finance/household-finances/article-federal-budget-2025-personal-finance/,No byline found,No article type found,"<a href=""https://www.theglobeandmail.com/investing/personal-finance/household-finances/article-federal-budget-2025-personal-finance/"">Eight ways the budget affects your wallet, from vacant homes to student loans</a>"
6,"Now that condo prices are down, Ottawa should buy them in bulk",https://www.theglobeandmail.com/business/commentary/article-now-that-condo-prices-are-down-ottawa-should-buy-them-in-bulk/,Ricardo Tranjan,Opinion,"<a href=""https://www.theglobeandmail.com/business/commentary/article-now-that-condo-prices-are-down-ottawa-should-buy-them-in-bulk/"">Now that condo prices are down, Ottawa should buy them in bulk</a>"
7,Canadian Tire to launch limited Hudson’s Bay holiday collection next month,https://www.theglobeandmail.com/business/article-canadian-tire-hudsons-bay-holiday-collection-multicoloured-stripes/,No byline found,No article type found,"<a href=""https://www.theglobeandmail.com/business/article-canadian-tire-hudsons-bay-holiday-collection-multicoloured-stripes/"">Canadian Tire to launch limited Hudson’s Bay holiday collection next month</a>"
8,Kids at higher risk of rare heart conditions after COVID-19 infection compared with after vaccine,https://www.theglobeandmail.com/life/wellness/article-qa-what-does-a-new-study-on-covid-19-tell-us-about-the-risks-to/,No byline found,No article type found,"<a href=""https://www.theglobeandmail.com/life/wellness/article-qa-what-does-a-new-study-on-covid-19-tell-us-about-the-risks-to/"">Kids at higher risk of rare heart conditions after COVID-19 infection compared with after vaccine</a>"
