Rank,Article title,url,Byline,Article type,title_with_link
1,"Toronto police share updated photo, new website in search for missing teen",https://www.theglobeandmail.com/canada/toronto/article-esther-missing-teen-toronto-police/,No byline found,No article type found,"<a href=""https://www.theglobeandmail.com/canada/toronto/article-esther-missing-teen-toronto-police/"">Toronto police share updated photo, new website in search for missing teen</a>"
2,TD bets on its Canadian businesses to prop up its growth ambitions,https://www.theglobeandmail.com/business/article-td-toronto-dominion-bank-growth-ambitions/,No byline found,No article type found,"<a href=""https://www.theglobeandmail.com/business/article-td-toronto-dominion-bank-growth-ambitions/"">TD bets on its Canadian businesses to prop up its growth ambitions</a>"
3,"Along with peace prospects, Trump suffers a series of defeats",https://www.theglobeandmail.com/world/us-politics/article-trump-iran-war-enemy-purge/,No byline found,Analysis,"<a href=""https://www.theglobeandmail.com/world/us-politics/article-trump-iran-war-enemy-purge/"">Along with peace prospects, Trump suffers a series of defeats</a>"
4,Hearing on application to retry Cowichan Tribes land claims case set to begin Monday,https://www.theglobeandmail.com/canada/article-cowichan-tribes-land-claim-case-application-to-retry-begins-monday/,No byline found,No article type found,"<a href=""https://www.theglobeandmail.com/canada/article-cowichan-tribes-land-claim-case-application-to-retry-begins-monday/"">Hearing on application to retry Cowichan Tribes land claims case set to begin Monday</a>"
5,Canadian gerrymandering is at the expense of urban voters,https://www.theglobeandmail.com/opinion/article-canada-gerrymandering-elections-urban-voters/,Tim Querengesser,Opinion,"<a href=""https://www.theglobeandmail.com/opinion/article-canada-gerrymandering-elections-urban-voters/"">Canadian gerrymandering is at the expense of urban voters</a>"
6,Insider Report: CEO invests US$29-million in this beaten-down real estate stock,https://www.theglobeandmail.com/investing/markets/inside-the-market/article-insider-report-ceo-invests-us29-million-in-this-beaten-down-real/,No byline found,No article type found,"<a href=""https://www.theglobeandmail.com/investing/markets/inside-the-market/article-insider-report-ceo-invests-us29-million-in-this-beaten-down-real/"">Insider Report: CEO invests US$29-million in this beaten-down real estate stock</a>"
7,TSX jumps to record high as easing Middle East tensions lift sentiment,https://www.theglobeandmail.com/investing/markets/inside-the-market/market-news/article-premarket-global-stocks-rise-oil-drops-on-us-iran-peace-deal-optimism/,No byline found,No article type found,"<a href=""https://www.theglobeandmail.com/investing/markets/inside-the-market/market-news/article-premarket-global-stocks-rise-oil-drops-on-us-iran-peace-deal-optimism/"">TSX jumps to record high as easing Middle East tensions lift sentiment</a>"
8,They planned to retire early. Rising costs are putting that to the test,https://www.theglobeandmail.com/investing/personal-finance/retirement/article-fire-financial-independence-retire-early/,No byline found,No article type found,"<a href=""https://www.theglobeandmail.com/investing/personal-finance/retirement/article-fire-financial-independence-retire-early/"">They planned to retire early. Rising costs are putting that to the test</a>"
