Rank,Article title,url,Byline,Article type,title_with_link
1,Megan Oldham wins slopestyle bronze for Canada’s second medal at Olympics,https://www.theglobeandmail.com/sports/article-winter-olympics-2026-womens-slopestyle-final-medals/,No byline found,No article type found,"<a href=""https://www.theglobeandmail.com/sports/article-winter-olympics-2026-womens-slopestyle-final-medals/"">Megan Oldham wins slopestyle bronze for Canada’s second medal at Olympics</a>"
2,"Former Prince Andrew shared U.K. trade files with Epstein, e-mails indicate",https://www.theglobeandmail.com/world/article-former-prince-andrew-uk-trade-files-epstein-emails/,No byline found,No article type found,"<a href=""https://www.theglobeandmail.com/world/article-former-prince-andrew-uk-trade-files-epstein-emails/"">Former Prince Andrew shared U.K. trade files with Epstein, e-mails indicate</a>"
3,"At the world’s crossroads, Carney draws on a legacy of religious thinkers",https://www.theglobeandmail.com/opinion/article-at-the-worlds-crossroads-carney-draws-on-a-legacy-of-religious/,Michael W. Higgins,Opinion,"<a href=""https://www.theglobeandmail.com/opinion/article-at-the-worlds-crossroads-carney-draws-on-a-legacy-of-religious/"">At the world’s crossroads, Carney draws on a legacy of religious thinkers</a>"
4,Will the Eglinton Crosstown carry Toronto forward?,https://www.theglobeandmail.com/canada/article-will-the-eglinton-crosstown-carry-toronto-forward/,Alex Bozikovic,Opinion,"<a href=""https://www.theglobeandmail.com/canada/article-will-the-eglinton-crosstown-carry-toronto-forward/"">Will the Eglinton Crosstown carry Toronto forward?</a>"
5,Let’s give everyone a four-day work week,https://www.theglobeandmail.com/business/commentary/article-lets-give-everyone-a-four-day-work-week/,Amir Barnea,Opinion,"<a href=""https://www.theglobeandmail.com/business/commentary/article-lets-give-everyone-a-four-day-work-week/"">Let’s give everyone a four-day work week</a>"
6,TD launches Super Bowl marketing campaign to refresh brand after money-laundering scandal,https://www.theglobeandmail.com/business/article-td-bank-ad-marketing-campaign-super-bowl/,No byline found,No article type found,"<a href=""https://www.theglobeandmail.com/business/article-td-bank-ad-marketing-campaign-super-bowl/"">TD launches Super Bowl marketing campaign to refresh brand after money-laundering scandal</a>"
7,Megan Oldham wins slopestyle bronze for Canada’s second medal at Olympics,https://www.theglobeandmail.com/sports/olympics/article-winter-olympics-2026-day-3-live-results-medals-canada/,No byline found,No article type found,"<a href=""https://www.theglobeandmail.com/sports/olympics/article-winter-olympics-2026-day-3-live-results-medals-canada/"">Megan Oldham wins slopestyle bronze for Canada’s second medal at Olympics</a>"
8,Morning Update: PM Carney tests waters for an early election,https://www.theglobeandmail.com/canada/article-morning-update-pm-carney-tests-waters-for-an-early-election/,No byline found,No article type found,"<a href=""https://www.theglobeandmail.com/canada/article-morning-update-pm-carney-tests-waters-for-an-early-election/"">Morning Update: PM Carney tests waters for an early election</a>"
