Rank,Article title,url,Byline,Article type,title_with_link
1,Biography explores life and work of environmental photographer Edward Burtynsky,https://www.theglobeandmail.com/culture/books/article-edward-burtynsky-biography-environmental-photographer/,No byline found,No article type found,"<a href=""https://www.theglobeandmail.com/culture/books/article-edward-burtynsky-biography-environmental-photographer/"">Biography explores life and work of environmental photographer Edward Burtynsky</a>"
2,TSN’s broadcast of Canada’s World Cup knockout debut draws average of 5.2-million viewers,https://www.theglobeandmail.com/sports/soccer/article-tsns-broadcast-canada-world-cup-knockout-match-52-million-viewers/,No byline found,No article type found,"<a href=""https://www.theglobeandmail.com/sports/soccer/article-tsns-broadcast-canada-world-cup-knockout-match-52-million-viewers/"">TSN’s broadcast of Canada’s World Cup knockout debut draws average of 5.2-million viewers</a>"
3,The song that brings my wife back from the fog of Alzheimer’s,https://www.theglobeandmail.com/life/first-person/article-the-song-that-brings-my-wife-back-from-the-fog-of-alzheimers/,No byline found,No article type found,"<a href=""https://www.theglobeandmail.com/life/first-person/article-the-song-that-brings-my-wife-back-from-the-fog-of-alzheimers/"">The song that brings my wife back from the fog of Alzheimer’s</a>"
4,‘I don’t want cheap American milk products. I would rather pay more for my milk.’ Letters to the editor for June 30,https://www.theglobeandmail.com/opinion/letters/article-i-dont-want-cheap-american-milk-i-would-rather-pay-more/,No byline found,No article type found,"<a href=""https://www.theglobeandmail.com/opinion/letters/article-i-dont-want-cheap-american-milk-i-would-rather-pay-more/"">‘I don’t want cheap American milk products. I would rather pay more for my milk.’ Letters to the editor for June 30</a>"
5,"Despite approval from Health Canada, delay in cancer drug funding leaves patients in limbo",https://www.theglobeandmail.com/canada/article-despite-approval-from-health-canada-delay-in-cancer-drug-funding/,No byline found,No article type found,"<a href=""https://www.theglobeandmail.com/canada/article-despite-approval-from-health-canada-delay-in-cancer-drug-funding/"">Despite approval from Health Canada, delay in cancer drug funding leaves patients in limbo</a>"
6,Tuesday’s analyst upgrades and downgrades,https://www.theglobeandmail.com/investing/markets/inside-the-market/article-tuesdays-analyst-upgrades-and-downgrades-301/,No byline found,No article type found,"<a href=""https://www.theglobeandmail.com/investing/markets/inside-the-market/article-tuesdays-analyst-upgrades-and-downgrades-301/"">Tuesday’s analyst upgrades and downgrades</a>"
7,Ontario and Quebec to see prolonged heat wave until weekend,https://www.theglobeandmail.com/canada/article-ontario-quebec-orange-warning-heat/,No byline found,No article type found,"<a href=""https://www.theglobeandmail.com/canada/article-ontario-quebec-orange-warning-heat/"">Ontario and Quebec to see prolonged heat wave until weekend</a>"
8,"Today’s World Cup scores, schedule and points tables",https://www.theglobeandmail.com/sports/soccer/article-fifa-world-cup-scores-schedule-today/,No byline found,No article type found,"<a href=""https://www.theglobeandmail.com/sports/soccer/article-fifa-world-cup-scores-schedule-today/"">Today’s World Cup scores, schedule and points tables</a>"
