Rank,Article title,url,Byline,Article type,title_with_link
1,These Gen Z friends gained online fame – and haters – for their hours-long Toronto walks,https://www.theglobeandmail.com/life/article-the-walkers-gen-z-friends-social-media-adulthood/,No byline found,No article type found,"<a href=""https://www.theglobeandmail.com/life/article-the-walkers-gen-z-friends-social-media-adulthood/"">These Gen Z friends gained online fame – and haters – for their hours-long Toronto walks</a>"
2,"Marry me orzo risotto: a 15-minute, one-pot meal (proposal optional)",https://www.theglobeandmail.com/life/style/food-and-drink/article-marry-me-orzo-risotto-one-pot-meal-recipe/,No byline found,No article type found,"<a href=""https://www.theglobeandmail.com/life/style/food-and-drink/article-marry-me-orzo-risotto-one-pot-meal-recipe/"">Marry me orzo risotto: a 15-minute, one-pot meal (proposal optional)</a>"
3,Canada to stockpile graphite and scandium in $2-billion push to disrupt Chinese domination,https://www.theglobeandmail.com/business/article-canada-stockpile-critical-minerals-disrupt-chinese-domination/,No byline found,No article type found,"<a href=""https://www.theglobeandmail.com/business/article-canada-stockpile-critical-minerals-disrupt-chinese-domination/"">Canada to stockpile graphite and scandium in $2-billion push to disrupt Chinese domination</a>"
4,"Federal budget’s $1-trillion investment goal could be an underestimate, Carney says",https://www.theglobeandmail.com/politics/article-federal-budget-2025-1-trillion-investment-underestimation-mark-carney/,No byline found,No article type found,"<a href=""https://www.theglobeandmail.com/politics/article-federal-budget-2025-1-trillion-investment-underestimation-mark-carney/"">Federal budget’s $1-trillion investment goal could be an underestimate, Carney says</a>"
5,France and Britain are in a fiscal mess. Can Canada avoid their fate?,https://www.theglobeandmail.com/opinion/article-canada-budget-economy-britain-uk-france-lecornu-reeves-starmer-macron/,Konrad Yakabuski,Opinion,"<a href=""https://www.theglobeandmail.com/opinion/article-canada-budget-economy-britain-uk-france-lecornu-reeves-starmer-macron/"">France and Britain are in a fiscal mess. Can Canada avoid their fate?</a>"
6,Kids at higher risk of rare heart conditions after COVID-19 infection compared with after vaccine,https://www.theglobeandmail.com/life/wellness/article-qa-what-does-a-new-study-on-covid-19-tell-us-about-the-risks-to/,No byline found,No article type found,"<a href=""https://www.theglobeandmail.com/life/wellness/article-qa-what-does-a-new-study-on-covid-19-tell-us-about-the-risks-to/"">Kids at higher risk of rare heart conditions after COVID-19 infection compared with after vaccine</a>"
7,"Now that condo prices are down, Ottawa should buy them in bulk",https://www.theglobeandmail.com/business/commentary/article-now-that-condo-prices-are-down-ottawa-should-buy-them-in-bulk/,Ricardo Tranjan,Opinion,"<a href=""https://www.theglobeandmail.com/business/commentary/article-now-that-condo-prices-are-down-ottawa-should-buy-them-in-bulk/"">Now that condo prices are down, Ottawa should buy them in bulk</a>"
8,U.S. Supreme Court questions legality of Trump’s tariffs,https://www.theglobeandmail.com/world/article-us-supreme-court-case-trump-tariffs-legality/,No byline found,No article type found,"<a href=""https://www.theglobeandmail.com/world/article-us-supreme-court-case-trump-tariffs-legality/"">U.S. Supreme Court questions legality of Trump’s tariffs</a>"
