Rank,Article title,url,Byline,Article type,title_with_link
1,Lutnick says he ‘barely had anything to do with’ Epstein amid calls to resign,https://www.theglobeandmail.com/world/us-politics/article-commerce-secretary-lutnick-epstein-revelations/,No byline found,No article type found,"<a href=""https://www.theglobeandmail.com/world/us-politics/article-commerce-secretary-lutnick-epstein-revelations/"">Lutnick says he ‘barely had anything to do with’ Epstein amid calls to resign</a>"
2,"After Poulin injury and physical tilt with U.S., Canadians struggling to find ‘the line’ at Olympics",https://www.theglobeandmail.com/sports/olympics/article-after-poulin-injury-and-physical-tilt-with-us-canadians-struggling-to/,No byline found,Analysis,"<a href=""https://www.theglobeandmail.com/sports/olympics/article-after-poulin-injury-and-physical-tilt-with-us-canadians-struggling-to/"">After Poulin injury and physical tilt with U.S., Canadians struggling to find ‘the line’ at Olympics</a>"
3,Federal ‘axe the fax’ e-prescription service built with Telus Health to shutter after $250-million spent,https://www.theglobeandmail.com/business/economy/article-federal-axe-the-fax-e-prescribing-service-built-with-telus-health-to/,No byline found,No article type found,"<a href=""https://www.theglobeandmail.com/business/economy/article-federal-axe-the-fax-e-prescribing-service-built-with-telus-health-to/"">Federal ‘axe the fax’ e-prescription service built with Telus Health to shutter after $250-million spent</a>"
4,Trump’s bridge threat heralds pain and turmoil in USMCA talks,https://www.theglobeandmail.com/business/commentary/article-trumps-bridge-threat-heralds-pain-and-turmoil-for-usmca-talks/,Lawrence Herman,Opinion,"<a href=""https://www.theglobeandmail.com/business/commentary/article-trumps-bridge-threat-heralds-pain-and-turmoil-for-usmca-talks/"">Trump’s bridge threat heralds pain and turmoil in USMCA talks</a>"
5,"Through the Eyes of God is a horrifying, gorgeous new play anchored by a virtuosic performance",https://www.theglobeandmail.com/culture/stage/article-through-the-eyes-of-god-anusree-roy/,No byline found,No article type found,"<a href=""https://www.theglobeandmail.com/culture/stage/article-through-the-eyes-of-god-anusree-roy/"">Through the Eyes of God is a horrifying, gorgeous new play anchored by a virtuosic performance</a>"
6,Trump is going through a bad patch – but don’t expect him to change,https://www.theglobeandmail.com/world/us-politics/article-trump-bad-bunny-hunter-hess/,No byline found,Analysis,"<a href=""https://www.theglobeandmail.com/world/us-politics/article-trump-bad-bunny-hunter-hess/"">Trump is going through a bad patch – but don’t expect him to change</a>"
7,France is ditching American tech. When will Canada?,https://www.theglobeandmail.com/business/commentary/article-france-is-ditching-american-tech-when-will-canada/,Vass Bednar,Opinion,"<a href=""https://www.theglobeandmail.com/business/commentary/article-france-is-ditching-american-tech-when-will-canada/"">France is ditching American tech. When will Canada?</a>"
8,Allied Property REIT raising $500-million to pay down debt,https://www.theglobeandmail.com/business/article-allied-property-reit-500-million-pay-debt-founder-steps-down/,No byline found,No article type found,"<a href=""https://www.theglobeandmail.com/business/article-allied-property-reit-500-million-pay-debt-founder-steps-down/"">Allied Property REIT raising $500-million to pay down debt</a>"
