Rank,Article title,url,Byline,Article type,title_with_link
1,Trump suspends green card lottery program after Brown University shooting,https://www.theglobeandmail.com/world/article-trump-suspends-green-card-lottery-program/,No byline found,No article type found,"<a href=""https://www.theglobeandmail.com/world/article-trump-suspends-green-card-lottery-program/"">Trump suspends green card lottery program after Brown University shooting</a>"
2,"Many seniors want to age in place, but few are prepared for the financial and emotional costs",https://www.theglobeandmail.com/investing/personal-finance/retirement/article-many-seniors-want-to-age-in-place-but-few-are-prepared-for-the/,No byline found,No article type found,"<a href=""https://www.theglobeandmail.com/investing/personal-finance/retirement/article-many-seniors-want-to-age-in-place-but-few-are-prepared-for-the/"">Many seniors want to age in place, but few are prepared for the financial and emotional costs</a>"
3,Our guide to the top 250 stocks in Canada,https://www.theglobeandmail.com/investing/markets/inside-the-market/article-globe-250-stocks-2025/,No byline found,No article type found,"<a href=""https://www.theglobeandmail.com/investing/markets/inside-the-market/article-globe-250-stocks-2025/"">Our guide to the top 250 stocks in Canada</a>"
4,Trump’s new Presidential Walk of Fame plaques are another attempt at rewriting history,https://www.theglobeandmail.com/world/us-politics/article-trump-presidential-walk-of-fame-plaques-rewriting-history/,No byline found,Analysis,"<a href=""https://www.theglobeandmail.com/world/us-politics/article-trump-presidential-walk-of-fame-plaques-rewriting-history/"">Trump’s new Presidential Walk of Fame plaques are another attempt at rewriting history</a>"
5,Friday’s analyst upgrades and downgrades,https://www.theglobeandmail.com/investing/markets/inside-the-market/article-fridays-analyst-upgrades-and-downgrades-283/,No byline found,No article type found,"<a href=""https://www.theglobeandmail.com/investing/markets/inside-the-market/article-fridays-analyst-upgrades-and-downgrades-283/"">Friday’s analyst upgrades and downgrades</a>"
6,"U.S. access to Canada’s critical minerals not ‘assured,’ Carney says",https://www.theglobeandmail.com/canada/article-us-access-critical-minerals-not-assured-carney-says/,No byline found,No article type found,"<a href=""https://www.theglobeandmail.com/canada/article-us-access-critical-minerals-not-assured-carney-says/"">U.S. access to Canada’s critical minerals not ‘assured,’ Carney says</a>"
7,What a lifetime of thrifting has taught me about the things we hold dear,https://www.theglobeandmail.com/opinion/article-thrifting-secondhand-shopping-lessons/,Liz Worth,Opinion,"<a href=""https://www.theglobeandmail.com/opinion/article-thrifting-secondhand-shopping-lessons/"">What a lifetime of thrifting has taught me about the things we hold dear</a>"
8,U.S. avocado growers hope push for trade walls will bear fruit,https://www.theglobeandmail.com/world/article-us-avocado-growers-hope-push-for-trade-walls-will-bear-fruit/,No byline found,No article type found,"<a href=""https://www.theglobeandmail.com/world/article-us-avocado-growers-hope-push-for-trade-walls-will-bear-fruit/"">U.S. avocado growers hope push for trade walls will bear fruit</a>"
