Rank,Article title,url,Byline,Article type,title_with_link
1,The most oversold and overbought stocks on the TSX,https://www.theglobeandmail.com/investing/markets/inside-the-market/article-the-most-oversold-and-overbought-stocks-on-the-tsx-168/,No byline found,No article type found,"<a href=""https://www.theglobeandmail.com/investing/markets/inside-the-market/article-the-most-oversold-and-overbought-stocks-on-the-tsx-168/"">The most oversold and overbought stocks on the TSX</a>"
2,How much do you know about healthy eating? Take our nutrition quiz,https://www.theglobeandmail.com/life/article-healthy-eating-nutrition-quiz/,No byline found,No article type found,"<a href=""https://www.theglobeandmail.com/life/article-healthy-eating-nutrition-quiz/"">How much do you know about healthy eating? Take our nutrition quiz</a>"
3,Oscar-winner Sean Penn skips ceremony to visit Ukraine,https://www.theglobeandmail.com/culture/film-and-tv/article-sean-penn-oscars-2026-ukraine/,No byline found,No article type found,"<a href=""https://www.theglobeandmail.com/culture/film-and-tv/article-sean-penn-oscars-2026-ukraine/"">Oscar-winner Sean Penn skips ceremony to visit Ukraine</a>"
4,Looking for bargain stocks with cash flow? Consider this strategy,https://www.theglobeandmail.com/investing/markets/inside-the-market/article-looking-for-bargain-stocks-with-cash-flow-consider-this-strategy/,No byline found,No article type found,"<a href=""https://www.theglobeandmail.com/investing/markets/inside-the-market/article-looking-for-bargain-stocks-with-cash-flow-consider-this-strategy/"">Looking for bargain stocks with cash flow? Consider this strategy</a>"
5,"Boomers aren’t really hoarding wealth, but an aging population requires reforms",https://www.theglobeandmail.com/opinion/article-boomers-generational-wealth-aging-population-reforms/,Sasha van Katwyk,Opinion,"<a href=""https://www.theglobeandmail.com/opinion/article-boomers-generational-wealth-aging-population-reforms/"">Boomers aren’t really hoarding wealth, but an aging population requires reforms</a>"
6,European leaders rebuff Trump’s calls for military help in Strait of Hormuz,https://www.theglobeandmail.com/world/article-starmer-carney-meeting-strait-of-hormuz-iran-war/,No byline found,No article type found,"<a href=""https://www.theglobeandmail.com/world/article-starmer-carney-meeting-strait-of-hormuz-iran-war/"">European leaders rebuff Trump’s calls for military help in Strait of Hormuz</a>"
7,One Battle After Another wins big as Canadians triumph in heated rivalry with Hollywood,https://www.theglobeandmail.com/culture/film-and-tv/film/article-oscars-2026-best-and-worst-moments/,No byline found,No article type found,"<a href=""https://www.theglobeandmail.com/culture/film-and-tv/film/article-oscars-2026-best-and-worst-moments/"">One Battle After Another wins big as Canadians triumph in heated rivalry with Hollywood</a>"
8,Court ruling on cottage shows what can happen when wills don’t account for rise in property value,https://www.theglobeandmail.com/investing/globe-advisor/advisor-news/article-court-ruling-on-cottage-shows-what-can-happen-when-wills-dont-account/,No byline found,No article type found,"<a href=""https://www.theglobeandmail.com/investing/globe-advisor/advisor-news/article-court-ruling-on-cottage-shows-what-can-happen-when-wills-dont-account/"">Court ruling on cottage shows what can happen when wills don’t account for rise in property value</a>"
