Rank,Article title,url,Byline,Article type,title_with_link
1,Is it illegal to stop before turning right at a green light?,https://www.theglobeandmail.com/drive/culture/article-is-it-illegal-to-stop-before-turning-right-at-a-green-light/,No byline found,No article type found,"<a href=""https://www.theglobeandmail.com/drive/culture/article-is-it-illegal-to-stop-before-turning-right-at-a-green-light/"">Is it illegal to stop before turning right at a green light?</a>"
2,Heated Rivalry’s U.S. invasion expands with Hudson Williams’ late-night debut on Jimmy Fallon,https://www.theglobeandmail.com/culture/film-and-tv/television/article-heated-rivalry-hudson-williams-jimmy-fallon/,No byline found,No article type found,"<a href=""https://www.theglobeandmail.com/culture/film-and-tv/television/article-heated-rivalry-hudson-williams-jimmy-fallon/"">Heated Rivalry’s U.S. invasion expands with Hudson Williams’ late-night debut on Jimmy Fallon</a>"
3,"Perfecting karpatka, a show-stopping dessert",https://www.theglobeandmail.com/life/style/food-and-drink/article-karpatka-dessert-recipe-lab/,No byline found,No article type found,"<a href=""https://www.theglobeandmail.com/life/style/food-and-drink/article-karpatka-dessert-recipe-lab/"">Perfecting karpatka, a show-stopping dessert</a>"
4,Aritzia reports quarterly sales over $1-billion for the first time,https://www.theglobeandmail.com/business/article-aritzia-earnings-third-quarter-us-expansion-sales-growth/,No byline found,No article type found,"<a href=""https://www.theglobeandmail.com/business/article-aritzia-earnings-third-quarter-us-expansion-sales-growth/"">Aritzia reports quarterly sales over $1-billion for the first time</a>"
5,The three tax Ds that matter most for Canadians in 2026,https://www.theglobeandmail.com/investing/personal-finance/taxes/article-tax-deducting-deferring-dividing-income-business/,Tim Cestnick,Opinion,"<a href=""https://www.theglobeandmail.com/investing/personal-finance/taxes/article-tax-deducting-deferring-dividing-income-business/"">The three tax Ds that matter most for Canadians in 2026</a>"
6,CIBC’s chief market technician thinks a correction is nearing - but it won’t be all bad news,https://www.theglobeandmail.com/investing/markets/inside-the-market/article-cibcs-chief-market-technician-thinks-a-correction-is-nearing-but-it/,No byline found,No article type found,"<a href=""https://www.theglobeandmail.com/investing/markets/inside-the-market/article-cibcs-chief-market-technician-thinks-a-correction-is-nearing-but-it/"">CIBC’s chief market technician thinks a correction is nearing - but it won’t be all bad news</a>"
7,That time in my life when lattes were an essential expense,https://www.theglobeandmail.com/investing/personal-finance/article-that-time-in-my-life-when-lattes-were-an-essential-expense/,No byline found,No article type found,"<a href=""https://www.theglobeandmail.com/investing/personal-finance/article-that-time-in-my-life-when-lattes-were-an-essential-expense/"">That time in my life when lattes were an essential expense</a>"
8,"No, Indigenous people are not coming to take Canadians’ homes",https://www.theglobeandmail.com/opinion/article-indigenous-property-bc-supreme-court-david-frum/,Tanya Talaga,Opinion,"<a href=""https://www.theglobeandmail.com/opinion/article-indigenous-property-bc-supreme-court-david-frum/"">No, Indigenous people are not coming to take Canadians’ homes</a>"
