Rank,Article title,url,Byline,Article type,title_with_link
1,Canadian dollar edges higher as risk appetite improves,https://www.theglobeandmail.com/investing/article-canadian-dollar-edges-higher-as-risk-appetite-improves/,No byline found,No article type found,"<a href=""https://www.theglobeandmail.com/investing/article-canadian-dollar-edges-higher-as-risk-appetite-improves/"">Canadian dollar edges higher as risk appetite improves</a>"
2,"More than 4,300 Canadians, permanent residents and family return from war-torn Middle East",https://www.theglobeandmail.com/politics/article-canadians-permanent-residents-middle-east-iran-war/,No byline found,No article type found,"<a href=""https://www.theglobeandmail.com/politics/article-canadians-permanent-residents-middle-east-iran-war/"">More than 4,300 Canadians, permanent residents and family return from war-torn Middle East</a>"
3,Philadelphia museum returns partial remains of Canadian First World War soldiers,https://www.theglobeandmail.com/canada/article-philadelphia-museum-returns-partial-remains-of-canadian-first-world/,No byline found,No article type found,"<a href=""https://www.theglobeandmail.com/canada/article-philadelphia-museum-returns-partial-remains-of-canadian-first-world/"">Philadelphia museum returns partial remains of Canadian First World War soldiers</a>"
4,Netflix’s Louis Theroux: Inside the Manosphere shows the entertainment value of extremism,https://www.theglobeandmail.com/culture/film-and-tv/television/article-louis-theroux-inside-the-manosphere-netflix/,No byline found,No article type found,"<a href=""https://www.theglobeandmail.com/culture/film-and-tv/television/article-louis-theroux-inside-the-manosphere-netflix/"">Netflix’s Louis Theroux: Inside the Manosphere shows the entertainment value of extremism</a>"
5,My workplace makes my colleague pray in the stairwell. Aren’t they legally obligated to provide a comfortable place?,https://www.theglobeandmail.com/business/careers/career-advice/article-my-workplace-makes-my-colleague-pray-in-the-stairwell-arent-they/,No byline found,No article type found,"<a href=""https://www.theglobeandmail.com/business/careers/career-advice/article-my-workplace-makes-my-colleague-pray-in-the-stairwell-arent-they/"">My workplace makes my colleague pray in the stairwell. Aren’t they legally obligated to provide a comfortable place?</a>"
6,"Meet MOTHRA, the thousand-eyed telescope in search of the cosmic web",https://www.theglobeandmail.com/canada/science/article-meet-mothra-the-thousand-eyed-telescope-in-search-of-the-cosmic-web/,No byline found,No article type found,"<a href=""https://www.theglobeandmail.com/canada/science/article-meet-mothra-the-thousand-eyed-telescope-in-search-of-the-cosmic-web/"">Meet MOTHRA, the thousand-eyed telescope in search of the cosmic web</a>"
7,Should Canada have a strategic oil reserve? It’s complicated,https://www.theglobeandmail.com/business/article-should-canada-have-a-strategic-oil-reserve-its-complicated/,No byline found,Analysis,"<a href=""https://www.theglobeandmail.com/business/article-should-canada-have-a-strategic-oil-reserve-its-complicated/"">Should Canada have a strategic oil reserve? It’s complicated</a>"
8,"U.S., Israel hit Iran with intense air strikes as Revolutionary Guard vows to block oil shipments",https://www.theglobeandmail.com/world/article-iran-war-us-israel-strikes-oil-exports-trump/,No byline found,No article type found,"<a href=""https://www.theglobeandmail.com/world/article-iran-war-us-israel-strikes-oil-exports-trump/"">U.S., Israel hit Iran with intense air strikes as Revolutionary Guard vows to block oil shipments</a>"
