Rank,Article title,url,Byline,Article type,title_with_link
1,Astronaut Jeremy Hansen announces he’s leaving Canadian Space Agency,https://www.theglobeandmail.com/canada/article-astronaut-jeremy-hansen-announces-hes-leaving-space-agency/,No byline found,No article type found,"<a href=""https://www.theglobeandmail.com/canada/article-astronaut-jeremy-hansen-announces-hes-leaving-space-agency/"">Astronaut Jeremy Hansen announces he’s leaving Canadian Space Agency</a>"
2,"More than 40% of Canadian manufacturers weighing move to U.S., KPMG poll finds",https://www.theglobeandmail.com/business/article-canadian-manufacturers-move-to-us-kpmg-survey/,No byline found,No article type found,"<a href=""https://www.theglobeandmail.com/business/article-canadian-manufacturers-move-to-us-kpmg-survey/"">More than 40% of Canadian manufacturers weighing move to U.S., KPMG poll finds</a>"
3,Canada picks Germany’s TKMS over South Korea’s Hanwha to build submarine fleet,https://www.theglobeandmail.com/politics/article-canada-submarine-contract-tkms-germany-mark-carney/,No byline found,No article type found,"<a href=""https://www.theglobeandmail.com/politics/article-canada-submarine-contract-tkms-germany-mark-carney/"">Canada picks Germany’s TKMS over South Korea’s Hanwha to build submarine fleet</a>"
4,"America rigs the World Cup, then bows out as a laughingstock",https://www.theglobeandmail.com/sports/soccer/article-belgium-vs-usa-world-cup-trump-infantino-balogun/,Cathal Kelly,Opinion,"<a href=""https://www.theglobeandmail.com/sports/soccer/article-belgium-vs-usa-world-cup-trump-infantino-balogun/"">America rigs the World Cup, then bows out as a laughingstock</a>"
5,"Alberta, Ontario propose new pipeline in bid to boost Canada’s energy independence",https://www.theglobeandmail.com/canada/article-alberta-ontario-propose-new-pipeline-to-sarnia-ontario/,No byline found,No article type found,"<a href=""https://www.theglobeandmail.com/canada/article-alberta-ontario-propose-new-pipeline-to-sarnia-ontario/"">Alberta, Ontario propose new pipeline in bid to boost Canada’s energy independence</a>"
6,Belgium shatters U.S.’s World Cup dream with emphatic 4-1 win,https://www.theglobeandmail.com/sports/soccer/article-belgium-vs-usa-world-cup-de-ketelaere-balogun/,No byline found,No article type found,"<a href=""https://www.theglobeandmail.com/sports/soccer/article-belgium-vs-usa-world-cup-de-ketelaere-balogun/"">Belgium shatters U.S.’s World Cup dream with emphatic 4-1 win</a>"
7,Kyle Lowry to retire as Toronto Raptor,https://www.theglobeandmail.com/sports/basketball/article-kyle-lowry-retirement-toronto-raptors/,No byline found,No article type found,"<a href=""https://www.theglobeandmail.com/sports/basketball/article-kyle-lowry-retirement-toronto-raptors/"">Kyle Lowry to retire as Toronto Raptor</a>"
8,Canada Soccer CEO Kevin Blue looks to build on World Cup breakthrough,https://www.theglobeandmail.com/sports/soccer/article-fifa-world-cup-canada-soccer-ceo-kevin-blue/,No byline found,No article type found,"<a href=""https://www.theglobeandmail.com/sports/soccer/article-fifa-world-cup-canada-soccer-ceo-kevin-blue/"">Canada Soccer CEO Kevin Blue looks to build on World Cup breakthrough</a>"
