Rank,Article title,url,Byline,Article type,title_with_link
1,U.S. Senate vote on nullifying tariffs on Canada shows opposition to Trump trade policy,https://www.theglobeandmail.com/world/us-politics/article-us-senate-vote-canada-tariffs-trump-trade-policy/,No byline found,No article type found,"<a href=""https://www.theglobeandmail.com/world/us-politics/article-us-senate-vote-canada-tariffs-trump-trade-policy/"">U.S. Senate vote on nullifying tariffs on Canada shows opposition to Trump trade policy</a>"
2,These Canadian oil stocks with long-life assets are seeing insider public market buying,https://www.theglobeandmail.com/investing/markets/inside-the-market/article-canadian-oil-stocks-long-life-assets-investing-stocks/,No byline found,No article type found,"<a href=""https://www.theglobeandmail.com/investing/markets/inside-the-market/article-canadian-oil-stocks-long-life-assets-investing-stocks/"">These Canadian oil stocks with long-life assets are seeing insider public market buying</a>"
3,Banks reassess financial-crime measures as higher-risk businesses go mainstream,https://www.theglobeandmail.com/business/article-banks-reassess-financial-crime-measures-as-higher-risk-businesses-go/,No byline found,No article type found,"<a href=""https://www.theglobeandmail.com/business/article-banks-reassess-financial-crime-measures-as-higher-risk-businesses-go/"">Banks reassess financial-crime measures as higher-risk businesses go mainstream</a>"
4,Expiry of U.S. patent held by Vanguard threatens to upend growth of Canada’s ETF industry,https://www.theglobeandmail.com/business/article-expiry-us-patent-vanguard-upend-growth-canada-etf-industry/,No byline found,No article type found,"<a href=""https://www.theglobeandmail.com/business/article-expiry-us-patent-vanguard-upend-growth-canada-etf-industry/"">Expiry of U.S. patent held by Vanguard threatens to upend growth of Canada’s ETF industry</a>"
5,"World Series tickets are a luxury item, and we shouldn’t put government caps on luxuries",https://www.theglobeandmail.com/opinion/article-world-series-tickets-luxury-item-government-caps-blue-jays/,No byline found,No article type found,"<a href=""https://www.theglobeandmail.com/opinion/article-world-series-tickets-luxury-item-government-caps-blue-jays/"">World Series tickets are a luxury item, and we shouldn’t put government caps on luxuries</a>"
6,Carney to meet with Xi as he seeks to offset damage from U.S. tariffs,https://www.theglobeandmail.com/politics/article-carney-xi-apec-meeting/,No byline found,No article type found,"<a href=""https://www.theglobeandmail.com/politics/article-carney-xi-apec-meeting/"">Carney to meet with Xi as he seeks to offset damage from U.S. tariffs</a>"
7,Repeat offenders: Blue Jays fans are getting sick of seeing the same ads on TV,https://www.theglobeandmail.com/sports/baseball/article-blue-jays-fans-sick-seeing-same-ads-tv/,No byline found,No article type found,"<a href=""https://www.theglobeandmail.com/sports/baseball/article-blue-jays-fans-sick-seeing-same-ads-tv/"">Repeat offenders: Blue Jays fans are getting sick of seeing the same ads on TV</a>"
8,CN Rail lays off 400 managers as freight volumes tied to U.S. trade war fall,https://www.theglobeandmail.com/business/article-cn-rail-job-cuts-trade-war/,No byline found,No article type found,"<a href=""https://www.theglobeandmail.com/business/article-cn-rail-job-cuts-trade-war/"">CN Rail lays off 400 managers as freight volumes tied to U.S. trade war fall</a>"
