Rank,Article title,url,Byline,Article type,title_with_link
1,Will I get a ticket if I don’t stop for three seconds before turning right at a red light?,https://www.theglobeandmail.com/drive/culture/article-will-i-get-a-ticket-if-i-dont-stop-for-three-seconds-before-turning/,No byline found,No article type found,"<a href=""https://www.theglobeandmail.com/drive/culture/article-will-i-get-a-ticket-if-i-dont-stop-for-three-seconds-before-turning/"">Will I get a ticket if I don’t stop for three seconds before turning right at a red light?</a>"
2,Ontario will apply new limits on residency applications from international medical graduates,https://www.theglobeandmail.com/canada/article-ontario-medical-school-residency-applications-international-grads/,No byline found,No article type found,"<a href=""https://www.theglobeandmail.com/canada/article-ontario-medical-school-residency-applications-international-grads/"">Ontario will apply new limits on residency applications from international medical graduates</a>"
3,"How Canada got immigration right for so long – and then got it very, very wrong",https://www.theglobeandmail.com/business/article-how-canada-got-immigration-right-and-then-very-wrong/,No byline found,No article type found,"<a href=""https://www.theglobeandmail.com/business/article-how-canada-got-immigration-right-and-then-very-wrong/"">How Canada got immigration right for so long – and then got it very, very wrong</a>"
4,"After Trump visit, Poilievre blames Carney for everything under the sun, including sunburn",https://www.theglobeandmail.com/politics/opinion/article-poilievre-blames-carney-for-everything-under-sun/,Shannon Proudfoot,Opinion,"<a href=""https://www.theglobeandmail.com/politics/opinion/article-poilievre-blames-carney-for-everything-under-sun/"">After Trump visit, Poilievre blames Carney for everything under the sun, including sunburn</a>"
5,The Mariners lulled the Blue Jays into a Game 1 loss,https://www.theglobeandmail.com/sports/baseball/article-blue-jays-vs-mariners-score-alds-game-1-mlb-gausman-miller/,Cathal Kelly,Opinion,"<a href=""https://www.theglobeandmail.com/sports/baseball/article-blue-jays-vs-mariners-score-alds-game-1-mlb-gausman-miller/"">The Mariners lulled the Blue Jays into a Game 1 loss</a>"
6,"After aggressively repaying a consumer proposal, Hamilton woman is excited for a fresh start",https://www.theglobeandmail.com/investing/personal-finance/young-money/article-paycheque-project-consumer-proposal-debt-hamilton/,No byline found,No article type found,"<a href=""https://www.theglobeandmail.com/investing/personal-finance/young-money/article-paycheque-project-consumer-proposal-debt-hamilton/"">After aggressively repaying a consumer proposal, Hamilton woman is excited for a fresh start</a>"
7,The bitter truth is that cheaper housing means a retirement crisis for homeowners,https://www.theglobeandmail.com/business/commentary/article-housing-prices-retirement-plan-middle-class/,John Turley-Ewart,Opinion,"<a href=""https://www.theglobeandmail.com/business/commentary/article-housing-prices-retirement-plan-middle-class/"">The bitter truth is that cheaper housing means a retirement crisis for homeowners</a>"
8,Readers share the signature Thanksgiving dishes that have become a tradition in their families,https://www.theglobeandmail.com/life/style/food-and-drink/article-thanksgiving-reader-favourite-dishes/,No byline found,No article type found,"<a href=""https://www.theglobeandmail.com/life/style/food-and-drink/article-thanksgiving-reader-favourite-dishes/"">Readers share the signature Thanksgiving dishes that have become a tradition in their families</a>"
