Rank,Article title,url,Byline,Article type,title_with_link
1,"Montreal girl allegedly killed by father drowned in New York state, autopsy shows",https://www.theglobeandmail.com/canada/article-montreal-girl-drowned-autopsy-father-charged/,No byline found,No article type found,"<a href=""https://www.theglobeandmail.com/canada/article-montreal-girl-drowned-autopsy-father-charged/"">Montreal girl allegedly killed by father drowned in New York state, autopsy shows</a>"
2,The Epstein files: Why it’s a big deal for MAGA and what’s happening,https://www.theglobeandmail.com/world/article-donald-trump-jeffrey-epstein-files-maga-what-is-happening/,No byline found,No article type found,"<a href=""https://www.theglobeandmail.com/world/article-donald-trump-jeffrey-epstein-files-maga-what-is-happening/"">The Epstein files: Why it’s a big deal for MAGA and what’s happening</a>"
3,"In remote Bamfield, B.C., get close to what makes Vancouver Island so special",https://www.theglobeandmail.com/life/travel/article-bamfield-bc-vancouver-island-coast-aguilar-point/,No byline found,No article type found,"<a href=""https://www.theglobeandmail.com/life/travel/article-bamfield-bc-vancouver-island-coast-aguilar-point/"">In remote Bamfield, B.C., get close to what makes Vancouver Island so special</a>"
4,"‘Not obvious’ that Canada will strike a trade deal with U.S., B.C. Premier Eby says",https://www.theglobeandmail.com/canada/article-eby-trade-deal-us-carney-retaliation/,No byline found,No article type found,"<a href=""https://www.theglobeandmail.com/canada/article-eby-trade-deal-us-carney-retaliation/"">‘Not obvious’ that Canada will strike a trade deal with U.S., B.C. Premier Eby says</a>"
5,Grizzly lunges at Calgary hikers on Kananaskis trail,https://www.theglobeandmail.com/canada/alberta/article-grizzly-calgary-hikers-kananaskis-trail/,No byline found,No article type found,"<a href=""https://www.theglobeandmail.com/canada/alberta/article-grizzly-calgary-hikers-kananaskis-trail/"">Grizzly lunges at Calgary hikers on Kananaskis trail</a>"
6,"Keep it up, nasty Canadians",https://www.theglobeandmail.com/politics/opinion/article-canada-boycott-us-alcohol-travel-donald-trump-pete-hoekstra-trade/,Campbell Clark,Opinion,"<a href=""https://www.theglobeandmail.com/politics/opinion/article-canada-boycott-us-alcohol-travel-donald-trump-pete-hoekstra-trade/"">Keep it up, nasty Canadians</a>"
7,This retiree was shocked to find herself the beneficiary of an old friend’s will,https://www.theglobeandmail.com/investing/personal-finance/retirement/article-retiree-surprise-will-inheritance-money-beneficiary/,No byline found,No article type found,"<a href=""https://www.theglobeandmail.com/investing/personal-finance/retirement/article-retiree-surprise-will-inheritance-money-beneficiary/"">This retiree was shocked to find herself the beneficiary of an old friend’s will</a>"
8,"In Kyiv, Canada’s ambassador shows solidarity by standing firm",https://www.theglobeandmail.com/world/article-natalka-cmoc-canada-ukraine-ambassador/,No byline found,No article type found,"<a href=""https://www.theglobeandmail.com/world/article-natalka-cmoc-canada-ukraine-ambassador/"">In Kyiv, Canada’s ambassador shows solidarity by standing firm</a>"
