Rank,Article title,url,Byline,Article type,title_with_link
1,Artemis II is about to break a record that should never have been,https://www.theglobeandmail.com/canada/science/article-artemis-ii-is-about-to-break-a-record-that-should-never-have-been/,No byline found,No article type found,"<a href=""https://www.theglobeandmail.com/canada/science/article-artemis-ii-is-about-to-break-a-record-that-should-never-have-been/"">Artemis II is about to break a record that should never have been</a>"
2,Canadian Olivia Cazes wants to be among the few who have crossed the Americas on horseback,https://www.theglobeandmail.com/life/article-canada-horseback-riding-americas/,No byline found,No article type found,"<a href=""https://www.theglobeandmail.com/life/article-canada-horseback-riding-americas/"">Canadian Olivia Cazes wants to be among the few who have crossed the Americas on horseback</a>"
3,News To Me – It’s all coming back to me now,https://www.theglobeandmail.com/opinion/article-news-to-me-its-all-coming-back-to-me-now/,Gabrielle Drolet,Opinion,"<a href=""https://www.theglobeandmail.com/opinion/article-news-to-me-its-all-coming-back-to-me-now/"">News To Me – It’s all coming back to me now</a>"
4,What I wish I knew before starting IVF,https://www.theglobeandmail.com/opinion/article-ivf-fertility-opinion-canada/,Kathryn Blaze Baum,Opinion,"<a href=""https://www.theglobeandmail.com/opinion/article-ivf-fertility-opinion-canada/"">What I wish I knew before starting IVF</a>"
5,Details emerge about U.S. military’s rescue of aviator shot down in Iran,https://www.theglobeandmail.com/world/article-us-iran-war-aviator-pilot-rescue/,No byline found,No article type found,"<a href=""https://www.theglobeandmail.com/world/article-us-iran-war-aviator-pilot-rescue/"">Details emerge about U.S. military’s rescue of aviator shot down in Iran</a>"
6,How to ease the price squeeze on the construction industry,https://www.theglobeandmail.com/opinion/editorials/article-how-to-ease-the-price-squeeze-on-the-construction-industry/,No byline found,No article type found,"<a href=""https://www.theglobeandmail.com/opinion/editorials/article-how-to-ease-the-price-squeeze-on-the-construction-industry/"">How to ease the price squeeze on the construction industry</a>"
7,Does the stairclimber machine actually live up to the hype?,https://www.theglobeandmail.com/life/wellness/fitness/article-does-the-stairclimber-machine-actually-live-up-to-the-hype/,No byline found,No article type found,"<a href=""https://www.theglobeandmail.com/life/wellness/fitness/article-does-the-stairclimber-machine-actually-live-up-to-the-hype/"">Does the stairclimber machine actually live up to the hype?</a>"
8,The Blue Jays can’t ride their playoff high into a new season,https://www.theglobeandmail.com/sports/baseball/article-the-blue-jays-cant-ride-their-playoff-high-into-a-new-season/,Cathal Kelly,Opinion,"<a href=""https://www.theglobeandmail.com/sports/baseball/article-the-blue-jays-cant-ride-their-playoff-high-into-a-new-season/"">The Blue Jays can’t ride their playoff high into a new season</a>"
