Rank,Article title,url,Byline,Article type,title_with_link
1,Two new rideshare companies try to compete with Uber and Lyft in Toronto,https://www.theglobeandmail.com/business/article-rideshare-hopp-hovr-uber-lyft-trade-war/,No byline found,No article type found,"<a href=""https://www.theglobeandmail.com/business/article-rideshare-hopp-hovr-uber-lyft-trade-war/"">Two new rideshare companies try to compete with Uber and Lyft in Toronto</a>"
2,"Trump raises tariffs on Canadian goods, BoC keeps rate steady and Telus’ new network deal: Must-read business and investing stories",https://www.theglobeandmail.com/business/article-trump-tariffs-bank-of-canada-telus-august-3/,No byline found,No article type found,"<a href=""https://www.theglobeandmail.com/business/article-trump-tariffs-bank-of-canada-telus-august-3/"">Trump raises tariffs on Canadian goods, BoC keeps rate steady and Telus’ new network deal: Must-read business and investing stories</a>"
3,‘I see Mark Carney following in the steps of Brian Mulroney.’ Letters to the editor for Aug. 4,https://www.theglobeandmail.com/opinion/letters/article-i-see-mark-carney-following-in-the-steps-of-brian-mulroney/,No byline found,No article type found,"<a href=""https://www.theglobeandmail.com/opinion/letters/article-i-see-mark-carney-following-in-the-steps-of-brian-mulroney/"">‘I see Mark Carney following in the steps of Brian Mulroney.’ Letters to the editor for Aug. 4</a>"
4,Hamas says it will allow aid for hostages in Gaza if Israel halts air strikes,https://www.theglobeandmail.com/world/article-hamas-aid-hostages-gaza-israel/,No byline found,No article type found,"<a href=""https://www.theglobeandmail.com/world/article-hamas-aid-hostages-gaza-israel/"">Hamas says it will allow aid for hostages in Gaza if Israel halts air strikes</a>"
5,These outdoor cooking tools can turn you into a grill master,https://www.theglobeandmail.com/life/home-and-design/article-barbecue-bbq-outdoor-cooking-tools/,No byline found,No article type found,"<a href=""https://www.theglobeandmail.com/life/home-and-design/article-barbecue-bbq-outdoor-cooking-tools/"">These outdoor cooking tools can turn you into a grill master</a>"
6,The bitter truth is that cheaper housing means a retirement crisis for homeowners,https://www.theglobeandmail.com/business/commentary/article-housing-prices-retirement-plan-middle-class/,John Turley-Ewart,Opinion,"<a href=""https://www.theglobeandmail.com/business/commentary/article-housing-prices-retirement-plan-middle-class/"">The bitter truth is that cheaper housing means a retirement crisis for homeowners</a>"
7,"In Buffalo, Wyoming, where the old ways keep the new ways out",https://www.theglobeandmail.com/world/article-in-buffalo-wyoming-where-the-old-ways-keep-the-new-ways-out/,No byline found,No article type found,"<a href=""https://www.theglobeandmail.com/world/article-in-buffalo-wyoming-where-the-old-ways-keep-the-new-ways-out/"">In Buffalo, Wyoming, where the old ways keep the new ways out</a>"
8,"How can Seth, 53, and Maeve, 54, reach their goal of spending $120,000 a year in retirement?",https://www.theglobeandmail.com/investing/personal-finance/financial-facelift/article-seth-maeve-defined-benefit-pension-retirement-travel/,No byline found,No article type found,"<a href=""https://www.theglobeandmail.com/investing/personal-finance/financial-facelift/article-seth-maeve-defined-benefit-pension-retirement-travel/"">How can Seth, 53, and Maeve, 54, reach their goal of spending $120,000 a year in retirement?</a>"
