Rank,Article title,url,Byline,Article type,title_with_link
1,"U.S. aircraft carrier arrives in the Caribbean, raising tensions in Venezuela",https://www.theglobeandmail.com/world/article-us-aircraft-carrier-gerald-ford-caribbean-venezuela-trump-maduro/,No byline found,No article type found,"<a href=""https://www.theglobeandmail.com/world/article-us-aircraft-carrier-gerald-ford-caribbean-venezuela-trump-maduro/"">U.S. aircraft carrier arrives in the Caribbean, raising tensions in Venezuela</a>"
2,A land-claims nightmare is emerging in B.C.,https://www.theglobeandmail.com/opinion/article-a-land-claims-nightmare-is-emerging-in-bc/,Gary Mason,Opinion,"<a href=""https://www.theglobeandmail.com/opinion/article-a-land-claims-nightmare-is-emerging-in-bc/"">A land-claims nightmare is emerging in B.C.</a>"
3,"MLS flips its schedule, pushing Canadian teams out in the cold",https://www.theglobeandmail.com/sports/soccer/article-mls-flips-its-schedule-and-pushes-canadian-teams-out-into-the-cold/,Cathal Kelly,Opinion,"<a href=""https://www.theglobeandmail.com/sports/soccer/article-mls-flips-its-schedule-and-pushes-canadian-teams-out-into-the-cold/"">MLS flips its schedule, pushing Canadian teams out in the cold</a>"
4,South African activist detained by U.S. border agents at Toronto’s Pearson Airport,https://www.theglobeandmail.com/canada/article-zackie-achmat-detained-us-ice-immigration-agents-toronto-pearson/,No byline found,No article type found,"<a href=""https://www.theglobeandmail.com/canada/article-zackie-achmat-detained-us-ice-immigration-agents-toronto-pearson/"">South African activist detained by U.S. border agents at Toronto’s Pearson Airport</a>"
5,Unions warn federal budget proposal could lead to pension cuts for government workers,https://www.theglobeandmail.com/investing/personal-finance/retirement/article-federal-budget-2025-government-workers-pension/,No byline found,No article type found,"<a href=""https://www.theglobeandmail.com/investing/personal-finance/retirement/article-federal-budget-2025-government-workers-pension/"">Unions warn federal budget proposal could lead to pension cuts for government workers</a>"
6,Imperial Pub closes after 81 years in downtown Toronto,https://www.theglobeandmail.com/canada/toronto/article-imperial-pub-closing-tmu-student-housing-downtown-toronto/,No byline found,No article type found,"<a href=""https://www.theglobeandmail.com/canada/toronto/article-imperial-pub-closing-tmu-student-housing-downtown-toronto/"">Imperial Pub closes after 81 years in downtown Toronto</a>"
7,"Oil and gas companies are falling back in love with Canada, one multibillion-dollar deal at a time",https://www.theglobeandmail.com/business/article-oil-and-gas-companies-canada-deals-ovintiv-baytex-cenovus-meg-energy/,No byline found,Analysis,"<a href=""https://www.theglobeandmail.com/business/article-oil-and-gas-companies-canada-deals-ovintiv-baytex-cenovus-meg-energy/"">Oil and gas companies are falling back in love with Canada, one multibillion-dollar deal at a time</a>"
8,Why professionals are stepping down the career ladder,https://www.theglobeandmail.com/business/careers/article-why-professionals-are-stepping-down-the-career-ladder/,No byline found,No article type found,"<a href=""https://www.theglobeandmail.com/business/careers/article-why-professionals-are-stepping-down-the-career-ladder/"">Why professionals are stepping down the career ladder</a>"
