Rank,Article title,url,Byline,Article type,title_with_link
1,Israel’s search in Lebanon for remains of long-lost weapons officer triggers deadly shootout,https://www.theglobeandmail.com/world/article-israel-lebanon-middle-east-war/,No byline found,No article type found,"<a href=""https://www.theglobeandmail.com/world/article-israel-lebanon-middle-east-war/"">Israel’s search in Lebanon for remains of long-lost weapons officer triggers deadly shootout</a>"
2,"LED headlight glare is annoying, but could it actually damage your eyes?",https://www.theglobeandmail.com/drive/culture/article-led-headlight-glare-is-annoying-but-could-it-actually-damage-your-eyes/,No byline found,No article type found,"<a href=""https://www.theglobeandmail.com/drive/culture/article-led-headlight-glare-is-annoying-but-could-it-actually-damage-your-eyes/"">LED headlight glare is annoying, but could it actually damage your eyes?</a>"
3,Powerful Yukon earthquake sheds light on changing seismic risk,https://www.theglobeandmail.com/canada/science/article-yukon-earthquake-seismic-risk-geology/,No byline found,No article type found,"<a href=""https://www.theglobeandmail.com/canada/science/article-yukon-earthquake-seismic-risk-geology/"">Powerful Yukon earthquake sheds light on changing seismic risk</a>"
4,Conflict in Persian Gulf threatens essential desalinated water supply,https://www.theglobeandmail.com/business/article-desalination-plants-middle-east-iran-war-oil-drinking-water/,No byline found,No article type found,"<a href=""https://www.theglobeandmail.com/business/article-desalination-plants-middle-east-iran-war-oil-drinking-water/"">Conflict in Persian Gulf threatens essential desalinated water supply</a>"
5,AI doesn’t make it better,https://www.theglobeandmail.com/opinion/article-ai-doesnt-make-it-better/,Anna Fitzpatrick,Opinion,"<a href=""https://www.theglobeandmail.com/opinion/article-ai-doesnt-make-it-better/"">AI doesn’t make it better</a>"
6,"When should Reid, 59, and Nikki, 62, begin selling their three rental properties to boost savings?",https://www.theglobeandmail.com/investing/personal-finance/financial-facelift/article-fanancial-facelift-advice-reid-nikki/,No byline found,No article type found,"<a href=""https://www.theglobeandmail.com/investing/personal-finance/financial-facelift/article-fanancial-facelift-advice-reid-nikki/"">When should Reid, 59, and Nikki, 62, begin selling their three rental properties to boost savings?</a>"
7,"Panel has reached consensus on next supreme leader, Iranian media reports",https://www.theglobeandmail.com/world/article-iran-supreme-leader-successor/,No byline found,No article type found,"<a href=""https://www.theglobeandmail.com/world/article-iran-supreme-leader-successor/"">Panel has reached consensus on next supreme leader, Iranian media reports</a>"
8,Does Donald Trump really know what ‘unconditional surrender’ means?,https://www.theglobeandmail.com/world/us-politics/article-iran-president-war-unconditional-surrender-us-trump/,No byline found,Analysis,"<a href=""https://www.theglobeandmail.com/world/us-politics/article-iran-president-war-unconditional-surrender-us-trump/"">Does Donald Trump really know what ‘unconditional surrender’ means?</a>"
