Rank,Article title,url,Byline,Article type,title_with_link
1,Iranian and Russian warships heading to South Africa for naval exercise,https://www.theglobeandmail.com/world/article-iran-russia-warships-south-africa-china-naval-exercise/,No byline found,No article type found,"<a href=""https://www.theglobeandmail.com/world/article-iran-russia-warships-south-africa-china-naval-exercise/"">Iranian and Russian warships heading to South Africa for naval exercise</a>"
2,Stranger Things series finale offers a sweet farewell after nine years,https://www.theglobeandmail.com/culture/article-stranger-things-series-finale-netflix-ending/,No byline found,No article type found,"<a href=""https://www.theglobeandmail.com/culture/article-stranger-things-series-finale-netflix-ending/"">Stranger Things series finale offers a sweet farewell after nine years</a>"
3,Naples set out to make subway stations ‘catacombs of beauty.’ The results will stop you in your tracks,https://www.theglobeandmail.com/world/article-naples-metro-station-art-archeology-trains-achille-bonito-oliva/,No byline found,No article type found,"<a href=""https://www.theglobeandmail.com/world/article-naples-metro-station-art-archeology-trains-achille-bonito-oliva/"">Naples set out to make subway stations ‘catacombs of beauty.’ The results will stop you in your tracks</a>"
4,Why I choose to raise my family in Attawapiskat,https://www.theglobeandmail.com/opinion/article-why-i-choose-to-raise-my-family-in-attawapiskat/,Adrian Sutherland,Opinion,"<a href=""https://www.theglobeandmail.com/opinion/article-why-i-choose-to-raise-my-family-in-attawapiskat/"">Why I choose to raise my family in Attawapiskat</a>"
5,"For California farmers, the agave plant is a source of hope in parched times",https://www.theglobeandmail.com/world/article-agave-plant-california-farmers-drought/,No byline found,No article type found,"<a href=""https://www.theglobeandmail.com/world/article-agave-plant-california-farmers-drought/"">For California farmers, the agave plant is a source of hope in parched times</a>"
6,High-speed rail is hardly the highest priority for Canada,https://www.theglobeandmail.com/opinion/article-high-speed-rail-trains-infrastructure-alto-canada/,Matti Siemiatycki,Opinion,"<a href=""https://www.theglobeandmail.com/opinion/article-high-speed-rail-trains-infrastructure-alto-canada/"">High-speed rail is hardly the highest priority for Canada</a>"
7,Canadian defenceman Parekh doing things his way at world juniors,https://www.theglobeandmail.com/sports/hockey/article-canadian-defenceman-parekh-doing-things-his-way-at-world-juniors/,No byline found,No article type found,"<a href=""https://www.theglobeandmail.com/sports/hockey/article-canadian-defenceman-parekh-doing-things-his-way-at-world-juniors/"">Canadian defenceman Parekh doing things his way at world juniors</a>"
8,"Not only is food more expensive, it is also becoming ultraprocessed garbage",https://www.theglobeandmail.com/business/commentary/article-food-more-expensive-becoming-ultraprocessed-garbage/,Vass Bednar,Opinion,"<a href=""https://www.theglobeandmail.com/business/commentary/article-food-more-expensive-becoming-ultraprocessed-garbage/"">Not only is food more expensive, it is also becoming ultraprocessed garbage</a>"
