Rank,Article title,url,Byline,Article type,title_with_link
1,Media mogul Jimmy Lai found guilty in Hong Kong court,https://www.theglobeandmail.com/world/article-media-mogul-jimmy-lai-found-guilty-in-hong-kong-court/,No byline found,No article type found,"<a href=""https://www.theglobeandmail.com/world/article-media-mogul-jimmy-lai-found-guilty-in-hong-kong-court/"">Media mogul Jimmy Lai found guilty in Hong Kong court</a>"
2,Potential disaster looms over Pierre Poilievre’s leadership,https://www.theglobeandmail.com/politics/opinion/article-pierre-poilievre-leadership-potential-disaster/,Campbell Clark,Opinion,"<a href=""https://www.theglobeandmail.com/politics/opinion/article-pierre-poilievre-leadership-potential-disaster/"">Potential disaster looms over Pierre Poilievre’s leadership</a>"
3,"Bystander who disarmed gunman at Bondi Beach recovering from surgery, family says",https://www.theglobeandmail.com/world/article-bystander-who-disarmed-armed-man-at-bondi-beach-shooting-hailed-as/,No byline found,No article type found,"<a href=""https://www.theglobeandmail.com/world/article-bystander-who-disarmed-armed-man-at-bondi-beach-shooting-hailed-as/"">Bystander who disarmed gunman at Bondi Beach recovering from surgery, family says</a>"
4,"Federal government funds four quantum computer developers, aiming to keep them in Canada",https://www.theglobeandmail.com/business/article-federal-government-funds-four-quantum-computer-developers-aiming-to/,No byline found,No article type found,"<a href=""https://www.theglobeandmail.com/business/article-federal-government-funds-four-quantum-computer-developers-aiming-to/"">Federal government funds four quantum computer developers, aiming to keep them in Canada</a>"
5,Director Rob Reiner and wife Michele found dead in their Los Angeles home,https://www.theglobeandmail.com/arts/article-director-rob-reiner-and-wife-michele-found-dead-in-their-home-police/,No byline found,No article type found,"<a href=""https://www.theglobeandmail.com/arts/article-director-rob-reiner-and-wife-michele-found-dead-in-their-home-police/"">Director Rob Reiner and wife Michele found dead in their Los Angeles home</a>"
6,What if pursuing carbon-free electricity does more harm than good?,https://www.theglobeandmail.com/business/commentary/article-what-if-pursuing-carbon-free-electricity-does-more-harm-than-good/,Bruce Lourie,Opinion,"<a href=""https://www.theglobeandmail.com/business/commentary/article-what-if-pursuing-carbon-free-electricity-does-more-harm-than-good/"">What if pursuing carbon-free electricity does more harm than good?</a>"
7,"Retired 82-year-old lawyer builds $600,000 TFSA with a ‘buy what you know’ strategy",https://www.theglobeandmail.com/investing/investment-ideas/article-retired-lawyer-600000-companies-popular-products/,No byline found,No article type found,"<a href=""https://www.theglobeandmail.com/investing/investment-ideas/article-retired-lawyer-600000-companies-popular-products/"">Retired 82-year-old lawyer builds $600,000 TFSA with a ‘buy what you know’ strategy</a>"
8,Before the Bell: What every Canadian investor needs to know today,https://www.theglobeandmail.com/investing/markets/inside-the-market/article-before-the-bell-what-every-canadian-investor-needs-to-know-today-1380/,No byline found,No article type found,"<a href=""https://www.theglobeandmail.com/investing/markets/inside-the-market/article-before-the-bell-what-every-canadian-investor-needs-to-know-today-1380/"">Before the Bell: What every Canadian investor needs to know today</a>"
