Rank,Article title,url,Byline,Article type,title_with_link
1,Canada’s housing market has frayed our social fabric. How did this happen?,https://www.theglobeandmail.com/opinion/article-canadas-housing-market-frayed-our-social-fabric-how-did-this-happen/,Jessica Barrett,Opinion,"<a href=""https://www.theglobeandmail.com/opinion/article-canadas-housing-market-frayed-our-social-fabric-how-did-this-happen/"">Canada’s housing market has frayed our social fabric. How did this happen?</a>"
2,What the U.S. military buildup against Iran looks like,https://www.theglobeandmail.com/world/article-what-the-us-military-buildup-against-iran-looks-like/,No byline found,No article type found,"<a href=""https://www.theglobeandmail.com/world/article-what-the-us-military-buildup-against-iran-looks-like/"">What the U.S. military buildup against Iran looks like</a>"
3,Fifty years of Rush’s 2112: The sound of a band that refused to bend,https://www.theglobeandmail.com/culture/article-rush-album-2112-fifty-years/,No byline found,No article type found,"<a href=""https://www.theglobeandmail.com/culture/article-rush-album-2112-fifty-years/"">Fifty years of Rush’s 2112: The sound of a band that refused to bend</a>"
4,Bell Canada and Telus reach agreement over network-sharing impasse,https://www.theglobeandmail.com/business/article-bell-canada-telus-agreement-network-sharing-impasse-crtc/,No byline found,No article type found,"<a href=""https://www.theglobeandmail.com/business/article-bell-canada-telus-agreement-network-sharing-impasse-crtc/"">Bell Canada and Telus reach agreement over network-sharing impasse</a>"
5,Taliban open to talks after Pakistan bombs major cities in Afghanistan,https://www.theglobeandmail.com/world/article-pakistan-afghanistan-open-war-strikes-kabul-taliban/,No byline found,No article type found,"<a href=""https://www.theglobeandmail.com/world/article-pakistan-afghanistan-open-war-strikes-kabul-taliban/"">Taliban open to talks after Pakistan bombs major cities in Afghanistan</a>"
6,"Big bank earnings point to more consumers struggling to pay off credit cards, mortgages",https://www.theglobeandmail.com/business/article-big-bank-earnings-point-to-more-consumers-struggling-to-pay-off-credit/,No byline found,No article type found,"<a href=""https://www.theglobeandmail.com/business/article-big-bank-earnings-point-to-more-consumers-struggling-to-pay-off-credit/"">Big bank earnings point to more consumers struggling to pay off credit cards, mortgages</a>"
7,How the unclasped handbag became a status symbol,https://www.theglobeandmail.com/life/style/fashion-and-beauty/article-birkin-unclasped-handbag-status-symbol/,No byline found,No article type found,"<a href=""https://www.theglobeandmail.com/life/style/fashion-and-beauty/article-birkin-unclasped-handbag-status-symbol/"">How the unclasped handbag became a status symbol</a>"
8,Senators captain Brady Tkachuk unhappy with White House AI video that insulted Canadians,https://www.theglobeandmail.com/sports/hockey/article-senators-captain-brady-tkachuk-unhappy-with-white-house-ai-video-that/,No byline found,No article type found,"<a href=""https://www.theglobeandmail.com/sports/hockey/article-senators-captain-brady-tkachuk-unhappy-with-white-house-ai-video-that/"">Senators captain Brady Tkachuk unhappy with White House AI video that insulted Canadians</a>"
