Rank,Article title,url,Byline,Article type,title_with_link
1,How Trump plans to continue his trade war with Canada without IEEPA,https://www.theglobeandmail.com/business/article-how-trump-plans-to-continue-trade-war-supreme-court-ieepa/,No byline found,No article type found,"<a href=""https://www.theglobeandmail.com/business/article-how-trump-plans-to-continue-trade-war-supreme-court-ieepa/"">How Trump plans to continue his trade war with Canada without IEEPA</a>"
2,"Armed man shot and killed after entering Mar-a-Lago’s secure perimeter, Secret Service says",https://www.theglobeandmail.com/world/article-us-secret-service-agents-shot-and-killed-armed-man-who-entered-the/,No byline found,No article type found,"<a href=""https://www.theglobeandmail.com/world/article-us-secret-service-agents-shot-and-killed-armed-man-who-entered-the/"">Armed man shot and killed after entering Mar-a-Lago’s secure perimeter, Secret Service says</a>"
3,The Globe’s 20 best dividend-paying stocks of the year,https://www.theglobeandmail.com/investing/markets/inside-the-market/article-dividend-all-stars-20-best-performing-dividend-stocks-tsx/,No byline found,No article type found,"<a href=""https://www.theglobeandmail.com/investing/markets/inside-the-market/article-dividend-all-stars-20-best-performing-dividend-stocks-tsx/"">The Globe’s 20 best dividend-paying stocks of the year</a>"
4,Olympics closing ceremony begins in Verona,https://www.theglobeandmail.com/sports/olympics/article-winter-olympics-canada-usa-gold-medal-game-closing-ceremony-live/,No byline found,No article type found,"<a href=""https://www.theglobeandmail.com/sports/olympics/article-winter-olympics-canada-usa-gold-medal-game-closing-ceremony-live/"">Olympics closing ceremony begins in Verona</a>"
5,Now is the time to invest like a coward,https://www.theglobeandmail.com/investing/markets/inside-the-market/article-time-to-invest-like-a-coward-markets/,No byline found,No article type found,"<a href=""https://www.theglobeandmail.com/investing/markets/inside-the-market/article-time-to-invest-like-a-coward-markets/"">Now is the time to invest like a coward</a>"
6,Retired constable charged in Project South corruption probe has first hearing,https://www.theglobeandmail.com/canada/article-retired-constable-charged-project-south-corruption-probe-first-hearing/,No byline found,No article type found,"<a href=""https://www.theglobeandmail.com/canada/article-retired-constable-charged-project-south-corruption-probe-first-hearing/"">Retired constable charged in Project South corruption probe has first hearing</a>"
7,Greenland prime minister says ‘no thanks’ to Trump’s hospital ship,https://www.theglobeandmail.com/world/article-greenland-prime-minister-says-no-thanks-to-trumps-hospital-ship/,No byline found,No article type found,"<a href=""https://www.theglobeandmail.com/world/article-greenland-prime-minister-says-no-thanks-to-trumps-hospital-ship/"">Greenland prime minister says ‘no thanks’ to Trump’s hospital ship</a>"
8,A better balance is needed on medically assisted death,https://www.theglobeandmail.com/opinion/editorials/article-better-balance-maid-medical-assistance-in-dying-supreme-court/,No byline found,No article type found,"<a href=""https://www.theglobeandmail.com/opinion/editorials/article-better-balance-maid-medical-assistance-in-dying-supreme-court/"">A better balance is needed on medically assisted death</a>"
