Rank,Article title,url,Byline,Article type,title_with_link
1,"With draft lottery win, the Leafs catch a bullet between their teeth",https://www.theglobeandmail.com/sports/hockey/article-toronto-maple-leafs-draft-pick-gavin-mckenna/,Cathal Kelly,Opinion,"<a href=""https://www.theglobeandmail.com/sports/hockey/article-toronto-maple-leafs-draft-pick-gavin-mckenna/"">With draft lottery win, the Leafs catch a bullet between their teeth</a>"
2,Are Canadian taxpayers on the hook for risky mortgages?,https://www.theglobeandmail.com/investing/personal-finance/article-are-canadian-taxpayers-on-the-hook-for-risky-mortgages/,No byline found,Analysis,"<a href=""https://www.theglobeandmail.com/investing/personal-finance/article-are-canadian-taxpayers-on-the-hook-for-risky-mortgages/"">Are Canadian taxpayers on the hook for risky mortgages?</a>"
3,Airbus wins order for as many as 150 Canadian-made A220 planes from AirAsia,https://www.theglobeandmail.com/business/article-airbus-wins-order-for-as-many-as-150-canadian-made-a220-planes-from/,No byline found,No article type found,"<a href=""https://www.theglobeandmail.com/business/article-airbus-wins-order-for-as-many-as-150-canadian-made-a220-planes-from/"">Airbus wins order for as many as 150 Canadian-made A220 planes from AirAsia</a>"
4,"Ted Turner, cable-news pioneer who founded CNN, dies at 87",https://www.theglobeandmail.com/world/article-cnn-founder-ted-turner-obituary/,No byline found,No article type found,"<a href=""https://www.theglobeandmail.com/world/article-cnn-founder-ted-turner-obituary/"">Ted Turner, cable-news pioneer who founded CNN, dies at 87</a>"
5,A small Ontario town fears collapse as its last bank branch closes,https://www.theglobeandmail.com/investing/personal-finance/article-a-small-ontario-town-fears-collapse-as-its-last-bank-branch-closes/,No byline found,No article type found,"<a href=""https://www.theglobeandmail.com/investing/personal-finance/article-a-small-ontario-town-fears-collapse-as-its-last-bank-branch-closes/"">A small Ontario town fears collapse as its last bank branch closes</a>"
6,Iran reviewing new U.S. proposal as sources say sides closing in on deal to end war,https://www.theglobeandmail.com/world/article-iran-seeks-fair-deal-after-us-pauses-operation-to-open-strait-of/,No byline found,No article type found,"<a href=""https://www.theglobeandmail.com/world/article-iran-seeks-fair-deal-after-us-pauses-operation-to-open-strait-of/"">Iran reviewing new U.S. proposal as sources say sides closing in on deal to end war</a>"
7,Luxury condos to sprout from a restored 1930s auto showroom in Toronto,https://www.theglobeandmail.com/real-estate/toronto/article-luxury-condos-to-sprout-from-pierce-arrow-building-toronto/,No byline found,No article type found,"<a href=""https://www.theglobeandmail.com/real-estate/toronto/article-luxury-condos-to-sprout-from-pierce-arrow-building-toronto/"">Luxury condos to sprout from a restored 1930s auto showroom in Toronto</a>"
8,"Board chair of non-profit behind failed PrescribeIT defends CEO’s nearly $900,000 compensation",https://www.theglobeandmail.com/canada/article-prescribeit-ceo-nonprofit-compensation-health-committee/,No byline found,No article type found,"<a href=""https://www.theglobeandmail.com/canada/article-prescribeit-ceo-nonprofit-compensation-health-committee/"">Board chair of non-profit behind failed PrescribeIT defends CEO’s nearly $900,000 compensation</a>"
