Rank,Article title,url,Byline,Article type,title_with_link
1,Canadiens beat Sabres 6-3 as Buffalo unravels in Game 5,https://www.theglobeandmail.com/sports/article-canadiens-beat-sabres-6-3-as-buffalo-unravels-in-game-5/,Cathal Kelly,Opinion,"<a href=""https://www.theglobeandmail.com/sports/article-canadiens-beat-sabres-6-3-as-buffalo-unravels-in-game-5/"">Canadiens beat Sabres 6-3 as Buffalo unravels in Game 5</a>"
2,"West Coast pipeline is conditional on carbon-capture project, Carney says",https://www.theglobeandmail.com/business/article-carney-smith-alberta-west-coast-pipeline-carbon-capture/,No byline found,No article type found,"<a href=""https://www.theglobeandmail.com/business/article-carney-smith-alberta-west-coast-pipeline-carbon-capture/"">West Coast pipeline is conditional on carbon-capture project, Carney says</a>"
3,McGuinty declines to say whether Canada would send more ships through Taiwan Strait,https://www.theglobeandmail.com/politics/article-mcguinty-canada-ships-through-taiwan-strait/,No byline found,No article type found,"<a href=""https://www.theglobeandmail.com/politics/article-mcguinty-canada-ships-through-taiwan-strait/"">McGuinty declines to say whether Canada would send more ships through Taiwan Strait</a>"
4,"Canada is one of history’s most successful countries. Here’s a look at who’s trying to destroy it, and how",https://www.theglobeandmail.com/opinion/article-canada-is-one-of-historys-most-successful-countries-heres-a-look-at/,Andrew Coyne,Opinion,"<a href=""https://www.theglobeandmail.com/opinion/article-canada-is-one-of-historys-most-successful-countries-heres-a-look-at/"">Canada is one of history’s most successful countries. Here’s a look at who’s trying to destroy it, and how</a>"
5,Why this $23-billion money manager is buying Caterpillar and selling Boston Scientific,https://www.theglobeandmail.com/investing/globe-advisor/advisor-funds/article-why-this-23-billion-money-manager-is-buying-caterpillar-and-selling/,No byline found,No article type found,"<a href=""https://www.theglobeandmail.com/investing/globe-advisor/advisor-funds/article-why-this-23-billion-money-manager-is-buying-caterpillar-and-selling/"">Why this $23-billion money manager is buying Caterpillar and selling Boston Scientific</a>"
6,Legal experts weigh in on what’s next for Alberta’s proposed separation referendum,https://www.theglobeandmail.com/canada/article-legal-experts-weigh-in-on-whats-next-for-albertas-proposed-separation/,No byline found,No article type found,"<a href=""https://www.theglobeandmail.com/canada/article-legal-experts-weigh-in-on-whats-next-for-albertas-proposed-separation/"">Legal experts weigh in on what’s next for Alberta’s proposed separation referendum</a>"
7,I know firsthand why the U.S. will never admit that it lost the war in Iran,https://www.theglobeandmail.com/opinion/article-i-know-firsthand-why-the-us-will-never-admit-that-it-lost-the-war-in/,Ben Rowswell,Opinion,"<a href=""https://www.theglobeandmail.com/opinion/article-i-know-firsthand-why-the-us-will-never-admit-that-it-lost-the-war-in/"">I know firsthand why the U.S. will never admit that it lost the war in Iran</a>"
8,"Independence referendums must respect Indigenous rights, Carney says",https://www.theglobeandmail.com/canada/alberta/article-alberta-must-respect-indigenous-rights-if-separation-referendum-is/,No byline found,No article type found,"<a href=""https://www.theglobeandmail.com/canada/alberta/article-alberta-must-respect-indigenous-rights-if-separation-referendum-is/"">Independence referendums must respect Indigenous rights, Carney says</a>"
