Rank,Article title,url,Byline,Article type,title_with_link
1,"At Coachella, Justin Bieber, Justin Trudeau and Katy Perry search for relevance",https://www.theglobeandmail.com/culture/music/article-coachella-justin-bieber-justin-trudeau-katy-perry-search-for-relevancy/,Brad Wheeler,Opinion,"<a href=""https://www.theglobeandmail.com/culture/music/article-coachella-justin-bieber-justin-trudeau-katy-perry-search-for-relevancy/"">At Coachella, Justin Bieber, Justin Trudeau and Katy Perry search for relevance</a>"
2,"It’s not all or nothing to improve heart health, new research suggests",https://www.theglobeandmail.com/life/wellness/article-small-changes-to-improve-heart-health-sleep-diet-exercise/,No byline found,No article type found,"<a href=""https://www.theglobeandmail.com/life/wellness/article-small-changes-to-improve-heart-health-sleep-diet-exercise/"">It’s not all or nothing to improve heart health, new research suggests</a>"
3,Portfolios for value and dividend investors to ponder,https://www.theglobeandmail.com/investing/markets/inside-the-market/article-portfolios-for-value-and-dividend-investors-to-ponder-2/,No byline found,No article type found,"<a href=""https://www.theglobeandmail.com/investing/markets/inside-the-market/article-portfolios-for-value-and-dividend-investors-to-ponder-2/"">Portfolios for value and dividend investors to ponder</a>"
4,Artemis II in pictures: A lunar destiny reborn,https://www.theglobeandmail.com/canada/article-artemis-ii-in-pictures-a-lunar-destiny-reborn/,No byline found,No article type found,"<a href=""https://www.theglobeandmail.com/canada/article-artemis-ii-in-pictures-a-lunar-destiny-reborn/"">Artemis II in pictures: A lunar destiny reborn</a>"
5,Restored mill home made of blocks chiselled from the river gorge,https://www.theglobeandmail.com/real-estate/article-restored-mill-home-elora-ontario-home-of-the-week/,No byline found,No article type found,"<a href=""https://www.theglobeandmail.com/real-estate/article-restored-mill-home-elora-ontario-home-of-the-week/"">Restored mill home made of blocks chiselled from the river gorge</a>"
6,"Ontario government broadens access to WSIB, raises age cut-off and benefits",https://www.theglobeandmail.com/business/article-ontario-government-broadens-access-to-wsib-raises-age-cut-off-and/,No byline found,No article type found,"<a href=""https://www.theglobeandmail.com/business/article-ontario-government-broadens-access-to-wsib-raises-age-cut-off-and/"">Ontario government broadens access to WSIB, raises age cut-off and benefits</a>"
7,When do drivers legally have to signal?,https://www.theglobeandmail.com/drive/culture/article-when-do-drivers-legally-have-to-signal/,No byline found,No article type found,"<a href=""https://www.theglobeandmail.com/drive/culture/article-when-do-drivers-legally-have-to-signal/"">When do drivers legally have to signal?</a>"
8,Sergio Garcia receives Masters’ first code-of-conduct warning after breaking driver in frustration,https://www.theglobeandmail.com/sports/golf/article-sergio-garcia-receives-masters-first-code-of-conduct-warning-after/,No byline found,No article type found,"<a href=""https://www.theglobeandmail.com/sports/golf/article-sergio-garcia-receives-masters-first-code-of-conduct-warning-after/"">Sergio Garcia receives Masters’ first code-of-conduct warning after breaking driver in frustration</a>"
