Rank,Article title,url,Byline,Article type,title_with_link
1,"Château Montebello forced into receivership, triggering new ownership mystery",https://www.theglobeandmail.com/business/article-chateau-montebello-receivership-ownership-evergrande-millennium-golden/,No byline found,No article type found,"<a href=""https://www.theglobeandmail.com/business/article-chateau-montebello-receivership-ownership-evergrande-millennium-golden/"">Château Montebello forced into receivership, triggering new ownership mystery</a>"
2,Rocket launch proves to be a milestone for budding Nova Scotia spaceport,https://www.theglobeandmail.com/business/article-rocket-launch-milestone-nova-scotia-spaceport-halifax/,No byline found,No article type found,"<a href=""https://www.theglobeandmail.com/business/article-rocket-launch-milestone-nova-scotia-spaceport-halifax/"">Rocket launch proves to be a milestone for budding Nova Scotia spaceport</a>"
3,Netflix’s Train Dreams is one of the year’s most beautiful and tender films,https://www.theglobeandmail.com/culture/film-and-tv/film/article-netflix-train-dreams-joel-edgerton-clint-bentley-felicity-jones/,No byline found,No article type found,"<a href=""https://www.theglobeandmail.com/culture/film-and-tv/film/article-netflix-train-dreams-joel-edgerton-clint-bentley-felicity-jones/"">Netflix’s Train Dreams is one of the year’s most beautiful and tender films</a>"
4,"Canada’s openness to foreign investment catching investors’ attention, Swedish fund manager says",https://www.theglobeandmail.com/business/article-canada-carney-foreign-investment-swedish-fund-manager/,No byline found,No article type found,"<a href=""https://www.theglobeandmail.com/business/article-canada-carney-foreign-investment-swedish-fund-manager/"">Canada’s openness to foreign investment catching investors’ attention, Swedish fund manager says</a>"
5,Cellphone ‘dead zones’ along Canadian roads pose public safety risks,https://www.theglobeandmail.com/canada/article-cellphone-service-dead-zones-canadian-roads-public-safety/,No byline found,No article type found,"<a href=""https://www.theglobeandmail.com/canada/article-cellphone-service-dead-zones-canadian-roads-public-safety/"">Cellphone ‘dead zones’ along Canadian roads pose public safety risks</a>"
6,Who are the Canadians facing charges connected to Ryan Wedding?,https://www.theglobeandmail.com/canada/article-who-are-the-canadians-facing-charges-connected-to-ryan-wedding/,No byline found,No article type found,"<a href=""https://www.theglobeandmail.com/canada/article-who-are-the-canadians-facing-charges-connected-to-ryan-wedding/"">Who are the Canadians facing charges connected to Ryan Wedding?</a>"
7,Conservative amendments to borders bill would make sweeping changes to asylum system,https://www.theglobeandmail.com/politics/article-borders-bill-immigration-asylum-seekers-refugees-tories-conservatives/,No byline found,No article type found,"<a href=""https://www.theglobeandmail.com/politics/article-borders-bill-immigration-asylum-seekers-refugees-tories-conservatives/"">Conservative amendments to borders bill would make sweeping changes to asylum system</a>"
8,Insider Report:  Large shareholder invests $7-million into this falling financial stock,https://www.theglobeandmail.com/investing/markets/inside-the-market/article-insider-report-large-shareholder-invests-7-million-into-this-falling/,No byline found,No article type found,"<a href=""https://www.theglobeandmail.com/investing/markets/inside-the-market/article-insider-report-large-shareholder-invests-7-million-into-this-falling/"">Insider Report:  Large shareholder invests $7-million into this falling financial stock</a>"
