Rank,Article title,url,Byline,Article type,title_with_link
1,Lots of other countries have charters of rights. None has anything like the notwithstanding clause,https://www.theglobeandmail.com/opinion/article-lots-of-other-countries-have-charters-of-rights-none-has-anything-like/,Andrew Coyne,Opinion,"<a href=""https://www.theglobeandmail.com/opinion/article-lots-of-other-countries-have-charters-of-rights-none-has-anything-like/"">Lots of other countries have charters of rights. None has anything like the notwithstanding clause</a>"
2,What message is Trump sending Iran by postponing Beijing trip?,https://www.theglobeandmail.com/world/us-politics/article-what-message-is-trump-sending-iran-by-postponing-beijing-trip/,No byline found,Analysis,"<a href=""https://www.theglobeandmail.com/world/us-politics/article-what-message-is-trump-sending-iran-by-postponing-beijing-trip/"">What message is Trump sending Iran by postponing Beijing trip?</a>"
3,"In the Iran war, the unexpected winner is also the loser",https://www.theglobeandmail.com/business/commentary/article-in-the-iran-war-the-unexpected-winner-is-also-the-loser/,John Rapley,Opinion,"<a href=""https://www.theglobeandmail.com/business/commentary/article-in-the-iran-war-the-unexpected-winner-is-also-the-loser/"">In the Iran war, the unexpected winner is also the loser</a>"
4,"Ottawa’s defence spending plan has ambition, but half of the equation is missing",https://www.theglobeandmail.com/politics/opinion/article-defence-spending-plan-has-ambition-mark-carney/,Campbell Clark,Opinion,"<a href=""https://www.theglobeandmail.com/politics/opinion/article-defence-spending-plan-has-ambition-mark-carney/"">Ottawa’s defence spending plan has ambition, but half of the equation is missing</a>"
5,"For these busy parents and professionals, AI agents are the personal assistants of their dreams",https://www.theglobeandmail.com/business/article-for-these-busy-parents-and-professionals-ai-agents-are-the-personal/,No byline found,No article type found,"<a href=""https://www.theglobeandmail.com/business/article-for-these-busy-parents-and-professionals-ai-agents-are-the-personal/"">For these busy parents and professionals, AI agents are the personal assistants of their dreams</a>"
6,Before the Bell: What every Canadian investor needs to know today,https://www.theglobeandmail.com/investing/markets/inside-the-market/article-before-the-bell-what-every-canadian-investor-needs-to-know-today-1443/,No byline found,No article type found,"<a href=""https://www.theglobeandmail.com/investing/markets/inside-the-market/article-before-the-bell-what-every-canadian-investor-needs-to-know-today-1443/"">Before the Bell: What every Canadian investor needs to know today</a>"
7,"B.C. Conservative MLA Hon Chan charged with assault, removed from caucus",https://www.theglobeandmail.com/canada/british-columbia/article-bc-conservative-mla-hon-chan-assault/,No byline found,No article type found,"<a href=""https://www.theglobeandmail.com/canada/british-columbia/article-bc-conservative-mla-hon-chan-assault/"">B.C. Conservative MLA Hon Chan charged with assault, removed from caucus</a>"
8,The week’s best fixed and variable mortgage rates,https://www.theglobeandmail.com/investing/personal-finance/article-hst-rebate-best-mortgage-rates-today-fixed-variable-march-26/,No byline found,No article type found,"<a href=""https://www.theglobeandmail.com/investing/personal-finance/article-hst-rebate-best-mortgage-rates-today-fixed-variable-march-26/"">The week’s best fixed and variable mortgage rates</a>"
