Rank,Article title,url,Byline,Article type,title_with_link
1,Pediatric society recommends cholesterol screening for kids between two and 10 years,https://www.theglobeandmail.com/canada/article-children-cholesterol-screening-pediatric-society/,No byline found,No article type found,"<a href=""https://www.theglobeandmail.com/canada/article-children-cholesterol-screening-pediatric-society/"">Pediatric society recommends cholesterol screening for kids between two and 10 years</a>"
2,Canada’s housing market has frayed our social fabric. How did this happen?,https://www.theglobeandmail.com/opinion/article-canadas-housing-market-frayed-our-social-fabric-how-did-this-happen/,Jessica Barrett,Opinion,"<a href=""https://www.theglobeandmail.com/opinion/article-canadas-housing-market-frayed-our-social-fabric-how-did-this-happen/"">Canada’s housing market has frayed our social fabric. How did this happen?</a>"
3,Fifty years of Rush’s 2112: The sound of a band that refused to bend,https://www.theglobeandmail.com/culture/article-rush-album-2112-fifty-years/,No byline found,No article type found,"<a href=""https://www.theglobeandmail.com/culture/article-rush-album-2112-fifty-years/"">Fifty years of Rush’s 2112: The sound of a band that refused to bend</a>"
4,What to know about tensions between Pakistan and Afghanistan,https://www.theglobeandmail.com/world/article-afghanistan-pakistan-war-what-to-know/,No byline found,No article type found,"<a href=""https://www.theglobeandmail.com/world/article-afghanistan-pakistan-war-what-to-know/"">What to know about tensions between Pakistan and Afghanistan</a>"
5,"China suspends some agricultural tariffs on Canada, maintains levy on canola seed",https://www.theglobeandmail.com/business/article-china-agricultural-tariffs-canada-canola-meal-and-seed-seafood/,No byline found,No article type found,"<a href=""https://www.theglobeandmail.com/business/article-china-agricultural-tariffs-canada-canola-meal-and-seed-seafood/"">China suspends some agricultural tariffs on Canada, maintains levy on canola seed</a>"
6,Senators captain Brady Tkachuk unhappy with White House AI video that insulted Canadians,https://www.theglobeandmail.com/sports/hockey/article-senators-captain-brady-tkachuk-unhappy-with-white-house-ai-video-that/,No byline found,No article type found,"<a href=""https://www.theglobeandmail.com/sports/hockey/article-senators-captain-brady-tkachuk-unhappy-with-white-house-ai-video-that/"">Senators captain Brady Tkachuk unhappy with White House AI video that insulted Canadians</a>"
7,Starmer’s party suffers crushing by-election defeat to Greens amid growing distrust,https://www.theglobeandmail.com/world/article-britain-election-labour-keir-starmer-green-party-hannah-spencer/,No byline found,No article type found,"<a href=""https://www.theglobeandmail.com/world/article-britain-election-labour-keir-starmer-green-party-hannah-spencer/"">Starmer’s party suffers crushing by-election defeat to Greens amid growing distrust</a>"
8,Canada’s economy contracts in final quarter of 2025 as firms draw down inventories,https://www.theglobeandmail.com/business/economy/article-canada-gdp-data-fourth-quarter-2025/,No byline found,No article type found,"<a href=""https://www.theglobeandmail.com/business/economy/article-canada-gdp-data-fourth-quarter-2025/"">Canada’s economy contracts in final quarter of 2025 as firms draw down inventories</a>"
