Rank,Article title,url,Byline,Article type,title_with_link
1,Donald Trump is having Nobel Peace Prize delusions,https://www.theglobeandmail.com/opinion/article-donald-trumps-nobel-peace-prize-delusions/,Nina Khrushcheva,Opinion,"<a href=""https://www.theglobeandmail.com/opinion/article-donald-trumps-nobel-peace-prize-delusions/"">Donald Trump is having Nobel Peace Prize delusions</a>"
2,"Some ultraprocessed foods are better for you than others, according to new science advisory",https://www.theglobeandmail.com/life/health-and-fitness/article-some-ultra-processed-foods-are-better-for-you-than-others-according-to/,No byline found,No article type found,"<a href=""https://www.theglobeandmail.com/life/health-and-fitness/article-some-ultra-processed-foods-are-better-for-you-than-others-according-to/"">Some ultraprocessed foods are better for you than others, according to new science advisory</a>"
3,"Treasure hunters in Cape Breton see therapy as the real prize, not lost pirate gold. Still, they hope for both",https://www.theglobeandmail.com/life/article-treasure-hunters-cape-breton-pirate-gold-mira-river/,No byline found,No article type found,"<a href=""https://www.theglobeandmail.com/life/article-treasure-hunters-cape-breton-pirate-gold-mira-river/"">Treasure hunters in Cape Breton see therapy as the real prize, not lost pirate gold. Still, they hope for both</a>"
4,Miriam Toews finds beauty in the uncertain,https://www.theglobeandmail.com/arts/article-miriam-toews-memoir-a-truce-that-is-not-peace-writing-grief/,No byline found,No article type found,"<a href=""https://www.theglobeandmail.com/arts/article-miriam-toews-memoir-a-truce-that-is-not-peace-writing-grief/"">Miriam Toews finds beauty in the uncertain</a>"
5,"Canada’s military operation in Latvia will be extended by three years, Carney says",https://www.theglobeandmail.com/politics/article-canada-military-operation-latvia-extended-mark-carney/,No byline found,No article type found,"<a href=""https://www.theglobeandmail.com/politics/article-canada-military-operation-latvia-extended-mark-carney/"">Canada’s military operation in Latvia will be extended by three years, Carney says</a>"
6,Benedict Cumberbatch and Olivia Colman should break up with the agents who sent them The Roses,https://www.theglobeandmail.com/arts/film/reviews/article-the-roses-benedict-cumberbatch-olivia-colman/,No byline found,No article type found,"<a href=""https://www.theglobeandmail.com/arts/film/reviews/article-the-roses-benedict-cumberbatch-olivia-colman/"">Benedict Cumberbatch and Olivia Colman should break up with the agents who sent them The Roses</a>"
7,"LeBlanc meets Lutnick in Washington, aiming to restart trade talks",https://www.theglobeandmail.com/world/us-politics/article-leblanc-met-lutnick-washington-trade-talks/,No byline found,No article type found,"<a href=""https://www.theglobeandmail.com/world/us-politics/article-leblanc-met-lutnick-washington-trade-talks/"">LeBlanc meets Lutnick in Washington, aiming to restart trade talks</a>"
8,MEG Energy bidding war sets the stage for oil patch takeovers,https://www.theglobeandmail.com/business/commentary/article-meg-energy-cenovus-bidding-war-oil-sands-takeover-deals-lenders/,Andrew Willis,Opinion,"<a href=""https://www.theglobeandmail.com/business/commentary/article-meg-energy-cenovus-bidding-war-oil-sands-takeover-deals-lenders/"">MEG Energy bidding war sets the stage for oil patch takeovers</a>"
