Rank,Article title,url,Byline,Article type,title_with_link
1,Homicide investigation underway after Vaughan home invasion leaves one person dead,https://www.theglobeandmail.com/canada/article-homicide-investigation-underway-after-vaughan-home-invasion-leaves-one/,No byline found,No article type found,"<a href=""https://www.theglobeandmail.com/canada/article-homicide-investigation-underway-after-vaughan-home-invasion-leaves-one/"">Homicide investigation underway after Vaughan home invasion leaves one person dead</a>"
2,"Make the best bubbling, fire-blistered pizza right in your own backyard",https://www.theglobeandmail.com/life/food-and-wine/article-backyard-pizza-oven/,No byline found,No article type found,"<a href=""https://www.theglobeandmail.com/life/food-and-wine/article-backyard-pizza-oven/"">Make the best bubbling, fire-blistered pizza right in your own backyard</a>"
3,Monty Python’s iconic lumberjack and Mountie costumes find permanent home on display in Canada,https://www.theglobeandmail.com/canada/article-monty-python-lumberjack-and-mountie-costumes-canada/,No byline found,No article type found,"<a href=""https://www.theglobeandmail.com/canada/article-monty-python-lumberjack-and-mountie-costumes-canada/"">Monty Python’s iconic lumberjack and Mountie costumes find permanent home on display in Canada</a>"
4,A rescue plan for Ottawa’s ailing core,https://www.theglobeandmail.com/opinion/editorials/article-a-rescue-plan-for-ottawas-ailing-core/,No byline found,No article type found,"<a href=""https://www.theglobeandmail.com/opinion/editorials/article-a-rescue-plan-for-ottawas-ailing-core/"">A rescue plan for Ottawa’s ailing core</a>"
5,Canada’s EI program is another old Liberal policy Carney should run through the shredder,https://www.theglobeandmail.com/business/commentary/article-canadas-ei-program-is-another-old-liberal-policy-carney-should-run/,John Turley-Ewart,Opinion,"<a href=""https://www.theglobeandmail.com/business/commentary/article-canadas-ei-program-is-another-old-liberal-policy-carney-should-run/"">Canada’s EI program is another old Liberal policy Carney should run through the shredder</a>"
6,"Tariffs hit GDP, Ottawa tries to talk trade with the U.S. and Canada Post reports biggest quarterly loss ever: Must-read business stories",https://www.theglobeandmail.com/business/article-trump-tariffs-gdp-shrinks-youth-unemployment-canada-post-losses/,No byline found,No article type found,"<a href=""https://www.theglobeandmail.com/business/article-trump-tariffs-gdp-shrinks-youth-unemployment-canada-post-losses/"">Tariffs hit GDP, Ottawa tries to talk trade with the U.S. and Canada Post reports biggest quarterly loss ever: Must-read business stories</a>"
7,Bruce Daisley on the return-to-office push and resistance against it,https://www.theglobeandmail.com/life/article-qa-bruce-daisley-return-to-office-push/,No byline found,No article type found,"<a href=""https://www.theglobeandmail.com/life/article-qa-bruce-daisley-return-to-office-push/"">Bruce Daisley on the return-to-office push and resistance against it</a>"
8,"Defying U.S. pressure, China’s Xi advances his vision for a new global order",https://www.theglobeandmail.com/world/article-shanghai-cooperation-organization-china-russia-india-trade-tariffs/,No byline found,No article type found,"<a href=""https://www.theglobeandmail.com/world/article-shanghai-cooperation-organization-china-russia-india-trade-tariffs/"">Defying U.S. pressure, China’s Xi advances his vision for a new global order</a>"
