Rank,Article title,url,title_with_link
1,"As Canadians travel more at home, here’s where many are visiting",https://globalnews.ca/news/11350646/canadian-travel-destinations-2025/,"<a href=""https://globalnews.ca/news/11350646/canadian-travel-destinations-2025/"">As Canadians travel more at home, here’s where many are visiting</a>"
2,What happens to Trump’s tariffs now that a federal appeals court has knocked them down?,https://globalnews.ca/news/11357211/trumps-tariffs/,"<a href=""https://globalnews.ca/news/11357211/trumps-tariffs/"">What happens to Trump’s tariffs now that a federal appeals court has knocked them down?</a>"
3,Hiker recovering after 18-metre fall near Squamish,https://globalnews.ca/news/11357704/hiker-recovering-after-18-metre-fall-near-squamish/,"<a href=""https://globalnews.ca/news/11357704/hiker-recovering-after-18-metre-fall-near-squamish/"">Hiker recovering after 18-metre fall near Squamish</a>"
4,Homebuyers got cold feet this summer. Will the chill continue this fall?,https://globalnews.ca/news/11355890/homebuyers-cold-feet-summer-fall-outlook/,"<a href=""https://globalnews.ca/news/11355890/homebuyers-cold-feet-summer-fall-outlook/"">Homebuyers got cold feet this summer. Will the chill continue this fall?</a>"
5,Canada’s GDP just fell. The bigger story is ‘beneath the hood’: experts,https://globalnews.ca/news/11355608/canada-gdp-june-2025/,"<a href=""https://globalnews.ca/news/11355608/canada-gdp-june-2025/"">Canada’s GDP just fell. The bigger story is ‘beneath the hood’: experts</a>"
