Rank,Article title,url,Byline,Article type,title_with_link
1,Baking for Orthodox Easter is a sweet comfort for confectioners of Kyiv,https://www.theglobeandmail.com/world/article-ukraine-orthodox-easter-baking-bread/,No byline found,No article type found,"<a href=""https://www.theglobeandmail.com/world/article-ukraine-orthodox-easter-baking-bread/"">Baking for Orthodox Easter is a sweet comfort for confectioners of Kyiv</a>"
2,Blue Jays broadcaster Joe Siddall enters his first season as main analyst full of gratitude,https://www.theglobeandmail.com/sports/baseball/article-blue-jays-broadcaster-joe-siddall-enters-his-first-season-as-main/,No byline found,No article type found,"<a href=""https://www.theglobeandmail.com/sports/baseball/article-blue-jays-broadcaster-joe-siddall-enters-his-first-season-as-main/"">Blue Jays broadcaster Joe Siddall enters his first season as main analyst full of gratitude</a>"
3,"Can Clement and Uma, both in their mid-40s, afford to buy a $2-million cottage?",https://www.theglobeandmail.com/investing/personal-finance/financial-facelift/article-clement-uma-afford-buy-2-million-cottage/,No byline found,No article type found,"<a href=""https://www.theglobeandmail.com/investing/personal-finance/financial-facelift/article-clement-uma-afford-buy-2-million-cottage/"">Can Clement and Uma, both in their mid-40s, afford to buy a $2-million cottage?</a>"
4,Restored mill home made of blocks chiselled from the river gorge,https://www.theglobeandmail.com/real-estate/article-restored-mill-home-elora-ontario-home-of-the-week/,No byline found,No article type found,"<a href=""https://www.theglobeandmail.com/real-estate/article-restored-mill-home-elora-ontario-home-of-the-week/"">Restored mill home made of blocks chiselled from the river gorge</a>"
5,"McIlroy stumbles, now shares lead with Cameron Young at Masters",https://www.theglobeandmail.com/sports/golf/article-mcilroy-stumbles-now-shares-lead-with-cameron-young-at-masters/,No byline found,No article type found,"<a href=""https://www.theglobeandmail.com/sports/golf/article-mcilroy-stumbles-now-shares-lead-with-cameron-young-at-masters/"">McIlroy stumbles, now shares lead with Cameron Young at Masters</a>"
6,San Francisco – the most childless city in the U.S. – could be a glimpse into Canada’s future,https://www.theglobeandmail.com/life/article-san-francisco-childless-city-glimpse-into-canadas-future/,No byline found,No article type found,"<a href=""https://www.theglobeandmail.com/life/article-san-francisco-childless-city-glimpse-into-canadas-future/"">San Francisco – the most childless city in the U.S. – could be a glimpse into Canada’s future</a>"
7,"We need to embrace the art of diplomacy, not the art of the deal",https://www.theglobeandmail.com/opinion/article-michael-ignatieff-diplomacy-or-art-of-the-deal/,Michael Ignatieff,Opinion,"<a href=""https://www.theglobeandmail.com/opinion/article-michael-ignatieff-diplomacy-or-art-of-the-deal/"">We need to embrace the art of diplomacy, not the art of the deal</a>"
8,"First Nations leader says his ‘heartsick’ wife, a B.C. MLA, opposes plan to pause DRIPA",https://www.theglobeandmail.com/canada/british-columbia/article-first-nations-leader-says-his-heartsick-wife-a-bc-mla-opposes-plan-to/,No byline found,No article type found,"<a href=""https://www.theglobeandmail.com/canada/british-columbia/article-first-nations-leader-says-his-heartsick-wife-a-bc-mla-opposes-plan-to/"">First Nations leader says his ‘heartsick’ wife, a B.C. MLA, opposes plan to pause DRIPA</a>"
