Rank,Article title,url,Byline,Article type,title_with_link
1,"Police arrest two teens in Nova Scotia, Manitoba accused of planning co-ordinated school attacks",https://www.theglobeandmail.com/canada/article-nova-scotia-manitoba-school-attacks-teens-arrested/,No byline found,No article type found,"<a href=""https://www.theglobeandmail.com/canada/article-nova-scotia-manitoba-school-attacks-teens-arrested/"">Police arrest two teens in Nova Scotia, Manitoba accused of planning co-ordinated school attacks</a>"
2,Don Cherry doesn’t fit the Order of Canada profile. But we shouldn’t ignore his legacy,https://www.theglobeandmail.com/opinion/article-don-cherry-order-of-canada-legacy/,No byline found,No article type found,"<a href=""https://www.theglobeandmail.com/opinion/article-don-cherry-order-of-canada-legacy/"">Don Cherry doesn’t fit the Order of Canada profile. But we shouldn’t ignore his legacy</a>"
3,Stock markets today: Major indexes close near lows  as oil prices rise and Powell fails to soothe nerves,https://www.theglobeandmail.com/investing/markets/inside-the-market/market-news/article-stock-market-today-live-updates-march-18/,No byline found,No article type found,"<a href=""https://www.theglobeandmail.com/investing/markets/inside-the-market/market-news/article-stock-market-today-live-updates-march-18/"">Stock markets today: Major indexes close near lows  as oil prices rise and Powell fails to soothe nerves</a>"
4,Canada reports first annual population decline on record,https://www.theglobeandmail.com/business/article-canada-reports-first-annual-population-decline-on-record/,No byline found,No article type found,"<a href=""https://www.theglobeandmail.com/business/article-canada-reports-first-annual-population-decline-on-record/"">Canada reports first annual population decline on record</a>"
5,"What this 85-year-old, seven-time executor can teach you about carrying out wills",https://www.theglobeandmail.com/investing/personal-finance/retirement/article-executor-will-testament-inheritance/,No byline found,No article type found,"<a href=""https://www.theglobeandmail.com/investing/personal-finance/retirement/article-executor-will-testament-inheritance/"">What this 85-year-old, seven-time executor can teach you about carrying out wills</a>"
6,Iran attacks Gulf energy assets in latest escalation,https://www.theglobeandmail.com/world/article-iran-war-us-israel-strait-of-hormuz-oil/,No byline found,No article type found,"<a href=""https://www.theglobeandmail.com/world/article-iran-war-us-israel-strait-of-hormuz-oil/"">Iran attacks Gulf energy assets in latest escalation</a>"
7,Collapse of fractional real estate investing firm shows risks of business model,https://www.theglobeandmail.com/real-estate/article-collapse-fractional-real-estate-investing-firm-business-model-risks/,No byline found,No article type found,"<a href=""https://www.theglobeandmail.com/real-estate/article-collapse-fractional-real-estate-investing-firm-business-model-risks/"">Collapse of fractional real estate investing firm shows risks of business model</a>"
8,"Downtown Toronto condo sells $184,900 below 2021 purchase price",https://www.theglobeandmail.com/real-estate/toronto/article-downtown-condo-sells-184900-below-2021-purchase-price/,No byline found,No article type found,"<a href=""https://www.theglobeandmail.com/real-estate/toronto/article-downtown-condo-sells-184900-below-2021-purchase-price/"">Downtown Toronto condo sells $184,900 below 2021 purchase price</a>"
