Rank,Article title,url,Byline,Article type,title_with_link
1,"Sarault wins bronze in women’s 500m short-track, Dandjinou narrowly misses men’s podium",https://www.theglobeandmail.com/sports/olympics/article-canada-aims-for-more-short-track-medals-as-mens-and-womens-hockey/,No byline found,No article type found,"<a href=""https://www.theglobeandmail.com/sports/olympics/article-canada-aims-for-more-short-track-medals-as-mens-and-womens-hockey/"">Sarault wins bronze in women’s 500m short-track, Dandjinou narrowly misses men’s podium</a>"
2,Stocks end sharply lower as tech rout deepens on AI angst,https://www.theglobeandmail.com/investing/markets/inside-the-market/market-news/article-premarket-us-stocks-futures-edge-higher-as-data-eases-economic-worries/,No byline found,No article type found,"<a href=""https://www.theglobeandmail.com/investing/markets/inside-the-market/market-news/article-premarket-us-stocks-futures-edge-higher-as-data-eases-economic-worries/"">Stocks end sharply lower as tech rout deepens on AI angst</a>"
3,"Telus names ex-CIBC chief Victor Dodig as CEO, replacing Darren Entwistle",https://www.theglobeandmail.com/business/article-telus-ceo-darren-entwistle-to-retire-in-june-victor-dodig-named/,No byline found,No article type found,"<a href=""https://www.theglobeandmail.com/business/article-telus-ceo-darren-entwistle-to-retire-in-june-victor-dodig-named/"">Telus names ex-CIBC chief Victor Dodig as CEO, replacing Darren Entwistle</a>"
4,Why gold prices took such a sudden dive on Thursday,https://www.theglobeandmail.com/investing/article-why-gold-prices-are-down-today/,No byline found,No article type found,"<a href=""https://www.theglobeandmail.com/investing/article-why-gold-prices-are-down-today/"">Why gold prices took such a sudden dive on Thursday</a>"
5,Ontario to lift freeze on domestic postsecondary tuition fees,https://www.theglobeandmail.com/canada/article-ontario-to-lift-freeze-on-domestic-postsecondary-tuition-fees/,No byline found,No article type found,"<a href=""https://www.theglobeandmail.com/canada/article-ontario-to-lift-freeze-on-domestic-postsecondary-tuition-fees/"">Ontario to lift freeze on domestic postsecondary tuition fees</a>"
6,Pierre Poilievre’s bespoke tax proposal is a bad fit,https://www.theglobeandmail.com/opinion/editorials/article-pierre-poilievres-bespoke-tax-treatment-proposal-is-a-bad-fit/,No byline found,No article type found,"<a href=""https://www.theglobeandmail.com/opinion/editorials/article-pierre-poilievres-bespoke-tax-treatment-proposal-is-a-bad-fit/"">Pierre Poilievre’s bespoke tax proposal is a bad fit</a>"
7,Prosecution in Frank Stronach trial to call seven complainants to testify,https://www.theglobeandmail.com/canada/article-frank-stronach-sex-assault-trial/,No byline found,No article type found,"<a href=""https://www.theglobeandmail.com/canada/article-frank-stronach-sex-assault-trial/"">Prosecution in Frank Stronach trial to call seven complainants to testify</a>"
8,"Celebrini, Canada’s youngest player, shines in 5-0 opening win over Czechia",https://www.theglobeandmail.com/sports/olympics/article-winter-olympics-2026-canada-vs-czechia-mens-hockey-score-celebrini/,No byline found,No article type found,"<a href=""https://www.theglobeandmail.com/sports/olympics/article-winter-olympics-2026-canada-vs-czechia-mens-hockey-score-celebrini/"">Celebrini, Canada’s youngest player, shines in 5-0 opening win over Czechia</a>"
