Rank,Article title,url,Byline,Article type,title_with_link
1,Barlow’s Research Roundup: These stocks are the big winners from Canada’s new nuclear energy plan,https://www.theglobeandmail.com/investing/markets/inside-the-market/article-barlows-research-roundup-these-stocks-are-the-big-winners-from-canadas/,No byline found,No article type found,"<a href=""https://www.theglobeandmail.com/investing/markets/inside-the-market/article-barlows-research-roundup-these-stocks-are-the-big-winners-from-canadas/"">Barlow’s Research Roundup: These stocks are the big winners from Canada’s new nuclear energy plan</a>"
2,BCE employees fired over ‘swipe and go’ office attendance sue for compensation,https://www.theglobeandmail.com/business/article-bce-employees-fired-swipe-and-go-in-office-attendance-legal/,No byline found,No article type found,"<a href=""https://www.theglobeandmail.com/business/article-bce-employees-fired-swipe-and-go-in-office-attendance-legal/"">BCE employees fired over ‘swipe and go’ office attendance sue for compensation</a>"
3,Burnaby landmark undergoes ‘reboot’,https://www.theglobeandmail.com/business/industry-news/property-report/article-burnaby-landmark-undergoes-reboot/,No byline found,No article type found,"<a href=""https://www.theglobeandmail.com/business/industry-news/property-report/article-burnaby-landmark-undergoes-reboot/"">Burnaby landmark undergoes ‘reboot’</a>"
4,Bad Canadian NHL teams are having a moment when it comes to their American talent,https://www.theglobeandmail.com/sports/hockey/article-nhl-brady-tkachuk-auston-matthews-hellebuyck/,Cathal Kelly,Opinion,"<a href=""https://www.theglobeandmail.com/sports/hockey/article-nhl-brady-tkachuk-auston-matthews-hellebuyck/"">Bad Canadian NHL teams are having a moment when it comes to their American talent</a>"
5,"Trump’s international approval ratings plummet, even among far-right groups",https://www.theglobeandmail.com/world/article-trumps-international-approval-ratings-plummet-far-right-pew-research/,No byline found,No article type found,"<a href=""https://www.theglobeandmail.com/world/article-trumps-international-approval-ratings-plummet-far-right-pew-research/"">Trump’s international approval ratings plummet, even among far-right groups</a>"
6,Canada’s Big Six banks are soaring like AI stocks. Can it seriously last?,https://www.theglobeandmail.com/business/article-canada-big-six-banks-soaring-like-ai-stocks-can-it-last/,No byline found,Analysis,"<a href=""https://www.theglobeandmail.com/business/article-canada-big-six-banks-soaring-like-ai-stocks-can-it-last/"">Canada’s Big Six banks are soaring like AI stocks. Can it seriously last?</a>"
7,"Canada in talks to buy about 30 Italian M-346 trainer jets for RCAF, sources say",https://www.theglobeandmail.com/business/international-business/european-business/article-canada-leonardo-m-346-trainer-jets-order-rcaf/,No byline found,No article type found,"<a href=""https://www.theglobeandmail.com/business/international-business/european-business/article-canada-leonardo-m-346-trainer-jets-order-rcaf/"">Canada in talks to buy about 30 Italian M-346 trainer jets for RCAF, sources say</a>"
8,Ontario ruling shows potential perils of parents naming a child joint home owner,https://www.theglobeandmail.com/investing/globe-advisor/advisor-news/article-ontario-ruling-shows-potential-perils-of-parents-naming-a-child-joint/,No byline found,No article type found,"<a href=""https://www.theglobeandmail.com/investing/globe-advisor/advisor-news/article-ontario-ruling-shows-potential-perils-of-parents-naming-a-child-joint/"">Ontario ruling shows potential perils of parents naming a child joint home owner</a>"
