Rank,Article title,url,Byline,Article type,title_with_link
1,Is it illegal to stop before turning right at a green light?,https://www.theglobeandmail.com/drive/culture/article-is-it-illegal-to-stop-before-turning-right-at-a-green-light/,No byline found,No article type found,"<a href=""https://www.theglobeandmail.com/drive/culture/article-is-it-illegal-to-stop-before-turning-right-at-a-green-light/"">Is it illegal to stop before turning right at a green light?</a>"
2,Warren Buffett is about to retire. Do not despair,https://www.theglobeandmail.com/investing/personal-finance/article-warren-buffett-is-about-to-retire-do-not-despair/,No byline found,No article type found,"<a href=""https://www.theglobeandmail.com/investing/personal-finance/article-warren-buffett-is-about-to-retire-do-not-despair/"">Warren Buffett is about to retire. Do not despair</a>"
3,Trump’s new Presidential Walk of Fame plaques are another attempt at rewriting history,https://www.theglobeandmail.com/world/us-politics/article-trump-presidential-walk-of-fame-plaques-rewriting-history/,No byline found,Analysis,"<a href=""https://www.theglobeandmail.com/world/us-politics/article-trump-presidential-walk-of-fame-plaques-rewriting-history/"">Trump’s new Presidential Walk of Fame plaques are another attempt at rewriting history</a>"
4,What a lifetime of thrifting has taught me about the things we hold dear,https://www.theglobeandmail.com/opinion/article-thrifting-secondhand-shopping-lessons/,Liz Worth,Opinion,"<a href=""https://www.theglobeandmail.com/opinion/article-thrifting-secondhand-shopping-lessons/"">What a lifetime of thrifting has taught me about the things we hold dear</a>"
5,"Poland intercepts Russian plane over Baltic Sea, reports airspace breaches from Belarus",https://www.theglobeandmail.com/world/article-poland-intercepts-russian-plane-over-baltic-sea-reports-airspace/,No byline found,No article type found,"<a href=""https://www.theglobeandmail.com/world/article-poland-intercepts-russian-plane-over-baltic-sea-reports-airspace/"">Poland intercepts Russian plane over Baltic Sea, reports airspace breaches from Belarus</a>"
6,How well do you remember 2025? Take our year-end news quiz,https://www.theglobeandmail.com/canada/article-2025-news-quiz-top-stories-biggest-moments-of-the-year/,No byline found,No article type found,"<a href=""https://www.theglobeandmail.com/canada/article-2025-news-quiz-top-stories-biggest-moments-of-the-year/"">How well do you remember 2025? Take our year-end news quiz</a>"
7,"Vibe-coding with AI brings computer programming to everyone, with pitfalls",https://www.theglobeandmail.com/business/article-vibe-coding-ai-tools-software-app-development/,No byline found,No article type found,"<a href=""https://www.theglobeandmail.com/business/article-vibe-coding-ai-tools-software-app-development/"">Vibe-coding with AI brings computer programming to everyone, with pitfalls</a>"
8,How top currencies performed against the loonie this year,https://www.theglobeandmail.com/business/article-currencies-loonie-canadian-dollar-trade-economy-finance/,No byline found,No article type found,"<a href=""https://www.theglobeandmail.com/business/article-currencies-loonie-canadian-dollar-trade-economy-finance/"">How top currencies performed against the loonie this year</a>"
