Rank,Article title,url,Byline,Article type,title_with_link
1,Norway’s Erling Haaland is the big winner at the World Cup thus far,https://www.theglobeandmail.com/sports/soccer/article-norway-erling-haaland-world-cup-striker-goal-scorer/,Cathal Kelly,Opinion,"<a href=""https://www.theglobeandmail.com/sports/soccer/article-norway-erling-haaland-world-cup-striker-goal-scorer/"">Norway’s Erling Haaland is the big winner at the World Cup thus far</a>"
2,Félix Auger-Aliassime fires long-time coach after losing epic Wimbledon quarter-final,https://www.theglobeandmail.com/sports/tennis/article-felix-auger-aliassime-coach-frederic-fontang-wimbledon/,No byline found,No article type found,"<a href=""https://www.theglobeandmail.com/sports/tennis/article-felix-auger-aliassime-coach-frederic-fontang-wimbledon/"">Félix Auger-Aliassime fires long-time coach after losing epic Wimbledon quarter-final</a>"
3,"Gordie Howe bridge to open July 27 after Canada, U.S. reach deal",https://www.theglobeandmail.com/canada/article-gordie-howe-bridge-set-to-open-late-july-after-canada-us-reach-deal/,No byline found,No article type found,"<a href=""https://www.theglobeandmail.com/canada/article-gordie-howe-bridge-set-to-open-late-july-after-canada-us-reach-deal/"">Gordie Howe bridge to open July 27 after Canada, U.S. reach deal</a>"
4,We’re asking the wrong question about children and screen time,https://www.theglobeandmail.com/opinion/article-were-asking-the-wrong-question-about-children-and-screen-time/,Nikki Martyn,Opinion,"<a href=""https://www.theglobeandmail.com/opinion/article-were-asking-the-wrong-question-about-children-and-screen-time/"">We’re asking the wrong question about children and screen time</a>"
5,Data Dive with Nik Nanos: The U.S.-Canada relationship looks very different depending on which side you stand,https://www.theglobeandmail.com/opinion/article-data-dive-with-nik-nanos-the-us-canada-relationship-looks-very/,Nik Nanos,Opinion,"<a href=""https://www.theglobeandmail.com/opinion/article-data-dive-with-nik-nanos-the-us-canada-relationship-looks-very/"">Data Dive with Nik Nanos: The U.S.-Canada relationship looks very different depending on which side you stand</a>"
6,"Toronto’s population whiplash leaves it at the bottom of the pack among Canadian, U.S. cities",https://www.theglobeandmail.com/business/article-toronto-population-decline/,No byline found,No article type found,"<a href=""https://www.theglobeandmail.com/business/article-toronto-population-decline/"">Toronto’s population whiplash leaves it at the bottom of the pack among Canadian, U.S. cities</a>"
7,"As debate over bullfighting intensifies, Spain faces a reckoning in the ring",https://www.theglobeandmail.com/world/article-bullfighting-spain-culture-animal-rights-activism/,No byline found,No article type found,"<a href=""https://www.theglobeandmail.com/world/article-bullfighting-spain-culture-animal-rights-activism/"">As debate over bullfighting intensifies, Spain faces a reckoning in the ring</a>"
8,"When it comes to soccer, this is as good as it gets for Canada",https://www.theglobeandmail.com/sports/soccer/article-fifa-world-cup-canada-good-as-it-gets/,Cathal Kelly,Opinion,"<a href=""https://www.theglobeandmail.com/sports/soccer/article-fifa-world-cup-canada-good-as-it-gets/"">When it comes to soccer, this is as good as it gets for Canada</a>"
