Rank,Article title,url,Byline,Article type,title_with_link
1,An illustration in Robert Munsch’s beloved Love You Forever didn’t seem right. I set out to discover why,https://www.theglobeandmail.com/culture/books/article-robert-munsch-love-you-forever-illustration-mystery/,No byline found,No article type found,"<a href=""https://www.theglobeandmail.com/culture/books/article-robert-munsch-love-you-forever-illustration-mystery/"">An illustration in Robert Munsch’s beloved Love You Forever didn’t seem right. I set out to discover why</a>"
2,Latino voters could determine who controls Congress after next year’s midterms,https://www.theglobeandmail.com/world/us-politics/article-latino-voters-trump-congress-midterms/,No byline found,No article type found,"<a href=""https://www.theglobeandmail.com/world/us-politics/article-latino-voters-trump-congress-midterms/"">Latino voters could determine who controls Congress after next year’s midterms</a>"
3,There was only one place that could soothe us: Sicily’s Cefalu,https://www.theglobeandmail.com/life/travel/article-italy-travel-sicily/,No byline found,No article type found,"<a href=""https://www.theglobeandmail.com/life/travel/article-italy-travel-sicily/"">There was only one place that could soothe us: Sicily’s Cefalu</a>"
4,"Former Canadian director of Philadelphia Art Museum accused by board of theft, court filings show",https://www.theglobeandmail.com/culture/article-sasha-suda-philadelphia-art-museum-dismissal-lawsuit-theft-allegations/,No byline found,No article type found,"<a href=""https://www.theglobeandmail.com/culture/article-sasha-suda-philadelphia-art-museum-dismissal-lawsuit-theft-allegations/"">Former Canadian director of Philadelphia Art Museum accused by board of theft, court filings show</a>"
5,"G20 leaders release declaration on climate change and debt, defying U.S. pressure",https://www.theglobeandmail.com/world/article-g20-declaration-defy-trump-climate-change-debt-relief/,No byline found,No article type found,"<a href=""https://www.theglobeandmail.com/world/article-g20-declaration-defy-trump-climate-change-debt-relief/"">G20 leaders release declaration on climate change and debt, defying U.S. pressure</a>"
6,An overachiever’s guide to holiday hosting,https://www.theglobeandmail.com/life/style/style-magazine/article-an-overachievers-guide-to-holiday-hosting/,No byline found,No article type found,"<a href=""https://www.theglobeandmail.com/life/style/style-magazine/article-an-overachievers-guide-to-holiday-hosting/"">An overachiever’s guide to holiday hosting</a>"
7,Ottawa is pressing Nutrien to change course on building a potash export terminal in the U.S.,https://www.theglobeandmail.com/business/economy/article-ottawa-nutrien-potash-export-terminal-in-the-us/,No byline found,No article type found,"<a href=""https://www.theglobeandmail.com/business/economy/article-ottawa-nutrien-potash-export-terminal-in-the-us/"">Ottawa is pressing Nutrien to change course on building a potash export terminal in the U.S.</a>"
8,"From airlines to winemakers, U.S. businesses push Trump to preserve North American free trade",https://www.theglobeandmail.com/world/article-from-airlines-to-winemakers-us-businesses-push-trump-to-preserve-north/,No byline found,No article type found,"<a href=""https://www.theglobeandmail.com/world/article-from-airlines-to-winemakers-us-businesses-push-trump-to-preserve-north/"">From airlines to winemakers, U.S. businesses push Trump to preserve North American free trade</a>"
