Rank,Article title,url,Byline,Article type,title_with_link
1,A swimsuit powerhouse built in Quebec,https://www.theglobeandmail.com/life/style/style-magazine/article-a-swimsuit-powerhouse-built-in-quebec/,No byline found,No article type found,"<a href=""https://www.theglobeandmail.com/life/style/style-magazine/article-a-swimsuit-powerhouse-built-in-quebec/"">A swimsuit powerhouse built in Quebec</a>"
2,TD bets on its Canadian businesses to prop up its growth ambitions,https://www.theglobeandmail.com/business/article-td-toronto-dominion-bank-growth-ambitions/,No byline found,No article type found,"<a href=""https://www.theglobeandmail.com/business/article-td-toronto-dominion-bank-growth-ambitions/"">TD bets on its Canadian businesses to prop up its growth ambitions</a>"
3,"More Canadians will inherit their family home, entrenching inequality across generations",https://www.theglobeandmail.com/investing/personal-finance/article-housing-real-estate-family-home-generation-inequality/,Mike Moffatt,Opinion,"<a href=""https://www.theglobeandmail.com/investing/personal-finance/article-housing-real-estate-family-home-generation-inequality/"">More Canadians will inherit their family home, entrenching inequality across generations</a>"
4,"Along with peace prospects, Trump suffers a series of defeats",https://www.theglobeandmail.com/world/us-politics/article-trump-iran-war-enemy-purge/,No byline found,Analysis,"<a href=""https://www.theglobeandmail.com/world/us-politics/article-trump-iran-war-enemy-purge/"">Along with peace prospects, Trump suffers a series of defeats</a>"
5,Two Nova Scotia teen hockey players plead not guilty in sexual assault case,https://www.theglobeandmail.com/canada/article-nova-scotia-hockey-teens-charged-with-sexual-assault-plead-not-guilty/,No byline found,No article type found,"<a href=""https://www.theglobeandmail.com/canada/article-nova-scotia-hockey-teens-charged-with-sexual-assault-plead-not-guilty/"">Two Nova Scotia teen hockey players plead not guilty in sexual assault case</a>"
6,Canadian gerrymandering is at the expense of urban voters,https://www.theglobeandmail.com/opinion/article-canada-gerrymandering-elections-urban-voters/,Tim Querengesser,Opinion,"<a href=""https://www.theglobeandmail.com/opinion/article-canada-gerrymandering-elections-urban-voters/"">Canadian gerrymandering is at the expense of urban voters</a>"
7,Should we care about faraway outbreaks of infectious disease?,https://www.theglobeandmail.com/opinion/article-canadians-response-ebola-hantavirus-outbreaks/,André Picard,Opinion,"<a href=""https://www.theglobeandmail.com/opinion/article-canadians-response-ebola-hantavirus-outbreaks/"">Should we care about faraway outbreaks of infectious disease?</a>"
8,Pembina going ahead with Heartland project,https://www.theglobeandmail.com/business/industry-news/energy-and-resources/article-pembina-going-ahead-with-heartland-project/,No byline found,No article type found,"<a href=""https://www.theglobeandmail.com/business/industry-news/energy-and-resources/article-pembina-going-ahead-with-heartland-project/"">Pembina going ahead with Heartland project</a>"
