Rank,Article title,url,Byline,Article type,title_with_link
1,Real estate developer Oxford Properties rehires former exec as CEO,https://www.theglobeandmail.com/business/article-oxford-properties-names-new-ceo/,No byline found,No article type found,"<a href=""https://www.theglobeandmail.com/business/article-oxford-properties-names-new-ceo/"">Real estate developer Oxford Properties rehires former exec as CEO</a>"
2,Fed rate cut now signals 3% inflation is the new 2%,https://www.theglobeandmail.com/investing/article-fed-rate-cut-now-signals-3-inflation-is-the-new-2/,No byline found,No article type found,"<a href=""https://www.theglobeandmail.com/investing/article-fed-rate-cut-now-signals-3-inflation-is-the-new-2/"">Fed rate cut now signals 3% inflation is the new 2%</a>"
3,Vancouver Mayor credits seven-month police ‘surge’ in Downtown Eastside for declining crime rates,https://www.theglobeandmail.com/canada/british-columbia/article-vancouver-mayor-credits-seven-month-police-surge-in-downtown-eastside/,No byline found,No article type found,"<a href=""https://www.theglobeandmail.com/canada/british-columbia/article-vancouver-mayor-credits-seven-month-police-surge-in-downtown-eastside/"">Vancouver Mayor credits seven-month police ‘surge’ in Downtown Eastside for declining crime rates</a>"
4,Air Canada updates: What happens next after flight attendants rejected agreement?,https://www.theglobeandmail.com/canada/article-air-canada-flight-attendants-union-strike-bargaining-agreement/,No byline found,No article type found,"<a href=""https://www.theglobeandmail.com/canada/article-air-canada-flight-attendants-union-strike-bargaining-agreement/"">Air Canada updates: What happens next after flight attendants rejected agreement?</a>"
5,The biggest tax that you’ve never heard of,https://www.theglobeandmail.com/opinion/editorials/article-the-biggest-tax-that-youve-never-heard-of/,No byline found,No article type found,"<a href=""https://www.theglobeandmail.com/opinion/editorials/article-the-biggest-tax-that-youve-never-heard-of/"">The biggest tax that you’ve never heard of</a>"
6,TIFF CEO Cameron Bailey speaks out on reversal of Oct. 7 documentary: ‘I know I caused a lot of pain’,https://www.theglobeandmail.com/arts/film/tiff/article-tiff-ceo-cameron-bailey-speaks-out-on-reversal-of-oct-7-documentary-i/,No byline found,No article type found,"<a href=""https://www.theglobeandmail.com/arts/film/tiff/article-tiff-ceo-cameron-bailey-speaks-out-on-reversal-of-oct-7-documentary-i/"">TIFF CEO Cameron Bailey speaks out on reversal of Oct. 7 documentary: ‘I know I caused a lot of pain’</a>"
7,The NDP remains an unserious party for a serious time,https://www.theglobeandmail.com/opinion/article-the-ndp-remains-an-unserious-party-for-a-serious-time/,No byline found,No article type found,"<a href=""https://www.theglobeandmail.com/opinion/article-the-ndp-remains-an-unserious-party-for-a-serious-time/"">The NDP remains an unserious party for a serious time</a>"
8,Ontario Premier Doug Ford threatens to get rid of automated speed cameras,https://www.theglobeandmail.com/canada/article-ontario-doug-ford-get-rid-automated-speed-cameras/,No byline found,No article type found,"<a href=""https://www.theglobeandmail.com/canada/article-ontario-doug-ford-get-rid-automated-speed-cameras/"">Ontario Premier Doug Ford threatens to get rid of automated speed cameras</a>"
