Rank,Article title,url,Byline,Article type,title_with_link
1,European Parliament postpones vote on U.S. trade deal again after tariff upheaval,https://www.theglobeandmail.com/world/article-european-parliament-postpones-vote-us-trade-deal/,No byline found,No article type found,"<a href=""https://www.theglobeandmail.com/world/article-european-parliament-postpones-vote-us-trade-deal/"">European Parliament postpones vote on U.S. trade deal again after tariff upheaval</a>"
2,Historic Montreal church destroyed by fire,https://www.theglobeandmail.com/canada/article-saint-paul-catholic-church-fire-montreal/,No byline found,No article type found,"<a href=""https://www.theglobeandmail.com/canada/article-saint-paul-catholic-church-fire-montreal/"">Historic Montreal church destroyed by fire</a>"
3,Donald Trump’s State of the Union address comes at an unusually provocative moment,https://www.theglobeandmail.com/world/us-politics/article-donald-trumps-state-of-the-union-address-comes-at-an-unusually/,No byline found,Analysis,"<a href=""https://www.theglobeandmail.com/world/us-politics/article-donald-trumps-state-of-the-union-address-comes-at-an-unusually/"">Donald Trump’s State of the Union address comes at an unusually provocative moment</a>"
4,Alberta cannot just up and leave Canada,https://www.theglobeandmail.com/opinion/article-alberta-cannot-just-up-and-leave-canada/,Kent McNeil,Opinion,"<a href=""https://www.theglobeandmail.com/opinion/article-alberta-cannot-just-up-and-leave-canada/"">Alberta cannot just up and leave Canada</a>"
5,Now is the time to invest like a coward,https://www.theglobeandmail.com/investing/markets/inside-the-market/article-time-to-invest-like-a-coward-markets/,No byline found,No article type found,"<a href=""https://www.theglobeandmail.com/investing/markets/inside-the-market/article-time-to-invest-like-a-coward-markets/"">Now is the time to invest like a coward</a>"
6,Ukrainian soldiers heal through dance as war enters fifth year,https://www.theglobeandmail.com/world/article-russia-ukraine-war-wounded-soldiers-healing-through-dance/,No byline found,No article type found,"<a href=""https://www.theglobeandmail.com/world/article-russia-ukraine-war-wounded-soldiers-healing-through-dance/"">Ukrainian soldiers heal through dance as war enters fifth year</a>"
7,"This 42-year-old and her daughter had a $450,000 budget for a home in Winnipeg. Here’s what she found",https://www.theglobeandmail.com/investing/personal-finance/article-this-42-year-old-and-her-daughter-had-a-450000-budget-for-a-home-in/,No byline found,No article type found,"<a href=""https://www.theglobeandmail.com/investing/personal-finance/article-this-42-year-old-and-her-daughter-had-a-450000-budget-for-a-home-in/"">This 42-year-old and her daughter had a $450,000 budget for a home in Winnipeg. Here’s what she found</a>"
8,CPP payment increases slow in 2026 as retirees cope with high living costs,https://www.theglobeandmail.com/investing/personal-finance/retirement/article-cpp-payments-2026-retirement-cost-of-living-pension/,No byline found,No article type found,"<a href=""https://www.theglobeandmail.com/investing/personal-finance/retirement/article-cpp-payments-2026-retirement-cost-of-living-pension/"">CPP payment increases slow in 2026 as retirees cope with high living costs</a>"
