Rank,Article title,url,Byline,Article type,title_with_link
1,"Elections Canada to issue write-in ballot in Poilievre’s by-election, citing long candidate list",https://www.theglobeandmail.com/canada/article-pierre-poilievre-byelection-longest-ballot/,No byline found,No article type found,"<a href=""https://www.theglobeandmail.com/canada/article-pierre-poilievre-byelection-longest-ballot/"">Elections Canada to issue write-in ballot in Poilievre’s by-election, citing long candidate list</a>"
2,Trump opens new golf course in Scotland before turning attention to Middle East,https://www.theglobeandmail.com/world/article-trump-golf-course-scotland-middle-east/,No byline found,No article type found,"<a href=""https://www.theglobeandmail.com/world/article-trump-golf-course-scotland-middle-east/"">Trump opens new golf course in Scotland before turning attention to Middle East</a>"
3,"The Asian century is here, but Canada isn’t ready",https://www.theglobeandmail.com/business/commentary/article-asia-pacific-trade-canada-gdp-markets/,Gary Comerford,Opinion,"<a href=""https://www.theglobeandmail.com/business/commentary/article-asia-pacific-trade-canada-gdp-markets/"">The Asian century is here, but Canada isn’t ready</a>"
4,The bitter truth is that cheaper housing means a retirement crisis for homeowners,https://www.theglobeandmail.com/business/commentary/article-housing-prices-retirement-plan-middle-class/,John Turley-Ewart,Opinion,"<a href=""https://www.theglobeandmail.com/business/commentary/article-housing-prices-retirement-plan-middle-class/"">The bitter truth is that cheaper housing means a retirement crisis for homeowners</a>"
5,My estranged father died in hospital after years of drug use. He was more than a statistic,https://www.theglobeandmail.com/opinion/article-my-estranged-father-died-in-hospital-after-years-of-drug-use-he-was/,No byline found,No article type found,"<a href=""https://www.theglobeandmail.com/opinion/article-my-estranged-father-died-in-hospital-after-years-of-drug-use-he-was/"">My estranged father died in hospital after years of drug use. He was more than a statistic</a>"
6,"Your questions about the Hockey Canada trial’s not-guilty verdict, answered",https://www.theglobeandmail.com/canada/article-hockey-canada-sexual-assault-trial-verdict-reader-questions/,No byline found,No article type found,"<a href=""https://www.theglobeandmail.com/canada/article-hockey-canada-sexual-assault-trial-verdict-reader-questions/"">Your questions about the Hockey Canada trial’s not-guilty verdict, answered</a>"
7,Is Coke any healthier when it’s made with cane sugar instead of high-fructose corn syrup?,https://www.theglobeandmail.com/life/health-and-fitness/article-cane-sugar-high-fructose-corn-syrup-coca-cola/,No byline found,No article type found,"<a href=""https://www.theglobeandmail.com/life/health-and-fitness/article-cane-sugar-high-fructose-corn-syrup-coca-cola/"">Is Coke any healthier when it’s made with cane sugar instead of high-fructose corn syrup?</a>"
8,"Almost 600 foreign nationals with criminal records due to be deported are missing, CBSA says",https://www.theglobeandmail.com/politics/article-foreign-nationals-missing-crime-canada-border-services-agency/,No byline found,No article type found,"<a href=""https://www.theglobeandmail.com/politics/article-foreign-nationals-missing-crime-canada-border-services-agency/"">Almost 600 foreign nationals with criminal records due to be deported are missing, CBSA says</a>"
