Rank,Article title,url,Byline,Article type,title_with_link
1,Game-changing technology may be on the horizon for children with disabling hearing loss,https://www.theglobeandmail.com/canada/article-children-disabling-hearing-loss-earmolds-technology-solution/,No byline found,No article type found,"<a href=""https://www.theglobeandmail.com/canada/article-children-disabling-hearing-loss-earmolds-technology-solution/"">Game-changing technology may be on the horizon for children with disabling hearing loss</a>"
2,First Nations chiefs demand apology after Carney says he could ‘outlast’ demonstrator,https://www.theglobeandmail.com/canada/article-first-nations-chiefs-carney-apology-demonstrator/,No byline found,No article type found,"<a href=""https://www.theglobeandmail.com/canada/article-first-nations-chiefs-carney-apology-demonstrator/"">First Nations chiefs demand apology after Carney says he could ‘outlast’ demonstrator</a>"
3,New car models and rising gas prices have more drivers considering EVs,https://www.theglobeandmail.com/investing/personal-finance/article-ev-electric-vehicle-auto-industry-fuel-price/,No byline found,No article type found,"<a href=""https://www.theglobeandmail.com/investing/personal-finance/article-ev-electric-vehicle-auto-industry-fuel-price/"">New car models and rising gas prices have more drivers considering EVs</a>"
4,Danielle Smith should make an example of the MLAs in her caucus who support Alberta’s independence,https://www.theglobeandmail.com/opinion/article-alberta-independence-separatism-danielle-smith-jason-stephan/,Gary Mason,Opinion,"<a href=""https://www.theglobeandmail.com/opinion/article-alberta-independence-separatism-danielle-smith-jason-stephan/"">Danielle Smith should make an example of the MLAs in her caucus who support Alberta’s independence</a>"
5,"Wildly absurd Canadian comedy Dead Lover will tickle your nose, among other things",https://www.theglobeandmail.com/culture/film-and-tv/film/article-dead-lover-review/,No byline found,No article type found,"<a href=""https://www.theglobeandmail.com/culture/film-and-tv/film/article-dead-lover-review/"">Wildly absurd Canadian comedy Dead Lover will tickle your nose, among other things</a>"
6,Good income gushers are hard to find. Do not despair,https://www.theglobeandmail.com/investing/personal-finance/article-on-money-income-gushers-interest-rates-stock-market/,No byline found,No article type found,"<a href=""https://www.theglobeandmail.com/investing/personal-finance/article-on-money-income-gushers-interest-rates-stock-market/"">Good income gushers are hard to find. Do not despair</a>"
7,"At 75, I moved to Spain with my family. When they left, I stayed",https://www.theglobeandmail.com/life/first-person/article-at-75-i-moved-to-spain-with-my-family-when-they-left-i-stayed/,No byline found,No article type found,"<a href=""https://www.theglobeandmail.com/life/first-person/article-at-75-i-moved-to-spain-with-my-family-when-they-left-i-stayed/"">At 75, I moved to Spain with my family. When they left, I stayed</a>"
8,Queen West penthouse condo price cut four times to find a buyer,https://www.theglobeandmail.com/real-estate/toronto/article-queen-west-penthouse-condo-price-cut-four-times-to-find-a-buyer/,No byline found,No article type found,"<a href=""https://www.theglobeandmail.com/real-estate/toronto/article-queen-west-penthouse-condo-price-cut-four-times-to-find-a-buyer/"">Queen West penthouse condo price cut four times to find a buyer</a>"
