Rank,Article title,url,Byline,Article type,title_with_link
1,What does David Eby have to be thankful for? An amateur Opposition in utter turmoil,https://www.theglobeandmail.com/opinion/article-what-does-david-eby-have-to-be-thankful-for-an-amateur-opposition-in/,Gary Mason,Opinion,"<a href=""https://www.theglobeandmail.com/opinion/article-what-does-david-eby-have-to-be-thankful-for-an-amateur-opposition-in/"">What does David Eby have to be thankful for? An amateur Opposition in utter turmoil</a>"
2,"No going back to former free trade system, Lutnick says",https://www.theglobeandmail.com/canada/article-auto-tariffs-cars-trade-trump-lutnick-carney-2/,No byline found,No article type found,"<a href=""https://www.theglobeandmail.com/canada/article-auto-tariffs-cars-trade-trump-lutnick-carney-2/"">No going back to former free trade system, Lutnick says</a>"
3,Morning Update: The numbers behind Alberta’s unprecedented teachers’ strike,https://www.theglobeandmail.com/canada/article-morning-update-the-numbers-behind-albertas-unprecedented-teachers/,No byline found,No article type found,"<a href=""https://www.theglobeandmail.com/canada/article-morning-update-the-numbers-behind-albertas-unprecedented-teachers/"">Morning Update: The numbers behind Alberta’s unprecedented teachers’ strike</a>"
4,Joly unveils three-point industrial strategy to counter Trump’s tariffs,https://www.theglobeandmail.com/politics/article-joly-unveils-three-point-industrial-strategy-to-counter-trumps-tariffs/,No byline found,No article type found,"<a href=""https://www.theglobeandmail.com/politics/article-joly-unveils-three-point-industrial-strategy-to-counter-trumps-tariffs/"">Joly unveils three-point industrial strategy to counter Trump’s tariffs</a>"
5,RBC analyst’s top picks in red-hot copper sector,https://www.theglobeandmail.com/investing/markets/inside-the-market/article-bofa-likes-health-care-stocks-including-this-company-with-an-obesity/,No byline found,No article type found,"<a href=""https://www.theglobeandmail.com/investing/markets/inside-the-market/article-bofa-likes-health-care-stocks-including-this-company-with-an-obesity/"">RBC analyst’s top picks in red-hot copper sector</a>"
6,Will Trump win the Nobel Peace Prize?,https://www.theglobeandmail.com/world/article-trump-nobel-peace-prize/,No byline found,No article type found,"<a href=""https://www.theglobeandmail.com/world/article-trump-nobel-peace-prize/"">Will Trump win the Nobel Peace Prize?</a>"
7,What should you bring to Thanksgiving this year? Our food experts answered your questions,https://www.theglobeandmail.com/life/style/food-and-drink/article-thanksgiving-hosting-recipes-reader-questions/,No byline found,No article type found,"<a href=""https://www.theglobeandmail.com/life/style/food-and-drink/article-thanksgiving-hosting-recipes-reader-questions/"">What should you bring to Thanksgiving this year? Our food experts answered your questions</a>"
8,Canada is close to losing its measles elimination status. What happens then?,https://www.theglobeandmail.com/canada/article-canada-measles-elimination-status-outbreak-vaccines/,No byline found,No article type found,"<a href=""https://www.theglobeandmail.com/canada/article-canada-measles-elimination-status-outbreak-vaccines/"">Canada is close to losing its measles elimination status. What happens then?</a>"
