Rank,Article title,url,Byline,Article type,title_with_link
1,Are cowboy boots still in? Canadian stylists share their tips for festival season,https://www.theglobeandmail.com/life/style/fashion-and-beauty/article-are-cowboy-boots-still-in-canadian-stylists-share-their-tips-for/,No byline found,No article type found,"<a href=""https://www.theglobeandmail.com/life/style/fashion-and-beauty/article-are-cowboy-boots-still-in-canadian-stylists-share-their-tips-for/"">Are cowboy boots still in? Canadian stylists share their tips for festival season</a>"
2,Wealthsimple moves to shift investors into private market fund,https://www.theglobeandmail.com/investing/markets/inside-the-market/article-wealthsimple-equity-investors-private-market-funds/,No byline found,No article type found,"<a href=""https://www.theglobeandmail.com/investing/markets/inside-the-market/article-wealthsimple-equity-investors-private-market-funds/"">Wealthsimple moves to shift investors into private market fund</a>"
3,"With rebates returning, PHEVs are a popular choice. Here are some SUVs that qualify, at least in the base trim",https://www.theglobeandmail.com/drive/reviews/article-with-rebates-returning-phevs-are-a-popular-choice-here-are-some-suvs/,No byline found,No article type found,"<a href=""https://www.theglobeandmail.com/drive/reviews/article-with-rebates-returning-phevs-are-a-popular-choice-here-are-some-suvs/"">With rebates returning, PHEVs are a popular choice. Here are some SUVs that qualify, at least in the base trim</a>"
4,"Canadians who fail to report foreign assets to the CRA risk audits, penalties",https://www.theglobeandmail.com/investing/globe-advisor/advisor-news/article-canadians-who-fail-to-report-foreign-assets-to-the-cra-risk-audits/,No byline found,No article type found,"<a href=""https://www.theglobeandmail.com/investing/globe-advisor/advisor-news/article-canadians-who-fail-to-report-foreign-assets-to-the-cra-risk-audits/"">Canadians who fail to report foreign assets to the CRA risk audits, penalties</a>"
5,This IT engineer had a half-million-dollar budget for a downtown Toronto condo. What did he buy?,https://www.theglobeandmail.com/investing/personal-finance/retirement/article-home-run-it-engineer-half-million-dollar-budget-condo-toronto/,No byline found,No article type found,"<a href=""https://www.theglobeandmail.com/investing/personal-finance/retirement/article-home-run-it-engineer-half-million-dollar-budget-condo-toronto/"">This IT engineer had a half-million-dollar budget for a downtown Toronto condo. What did he buy?</a>"
6,Before the Bell: What every Canadian investor needs to know today,https://www.theglobeandmail.com/investing/markets/inside-the-market/article-before-the-bell-what-every-canadian-investor-needs-to-know-today-1460/,No byline found,No article type found,"<a href=""https://www.theglobeandmail.com/investing/markets/inside-the-market/article-before-the-bell-what-every-canadian-investor-needs-to-know-today-1460/"">Before the Bell: What every Canadian investor needs to know today</a>"
7,B.C. tourist recounts moments before shooting at Mexico pyramids,https://www.theglobeandmail.com/canada/article-mexico-shooting-teotihuacan-pyramids/,No byline found,No article type found,"<a href=""https://www.theglobeandmail.com/canada/article-mexico-shooting-teotihuacan-pyramids/"">B.C. tourist recounts moments before shooting at Mexico pyramids</a>"
8,The ‘gravy plane’ mess has sent a message: Doug Ford should retire,https://www.theglobeandmail.com/opinion/article-doug-ford-jet-gravy-plane-retire/,John Ibbitson,Opinion,"<a href=""https://www.theglobeandmail.com/opinion/article-doug-ford-jet-gravy-plane-retire/"">The ‘gravy plane’ mess has sent a message: Doug Ford should retire</a>"
