Rank,Article title,url,title_with_link
1,Sudden medical emergency costs Alberta family nearly $100K while on vacation,https://globalnews.ca/news/11385611/sudden-emergency-alberta-family-100k-japan-vacation/,"<a href=""https://globalnews.ca/news/11385611/sudden-emergency-alberta-family-100k-japan-vacation/"">Sudden medical emergency costs Alberta family nearly $100K while on vacation</a>"
2,Most of Canada’s counter-tariffs on the U.S. have now ended,https://globalnews.ca/news/11369356/canada-counter-tariffs-ended/,"<a href=""https://globalnews.ca/news/11369356/canada-counter-tariffs-ended/"">Most of Canada’s counter-tariffs on the U.S. have now ended</a>"
3,The condo market is struggling. Are they still a good retirement plan?,https://globalnews.ca/news/11356252/condo-market-struggling-retirement-plan/,"<a href=""https://globalnews.ca/news/11356252/condo-market-struggling-retirement-plan/"">The condo market is struggling. Are they still a good retirement plan?</a>"
4,Some Indigenous businesses halt exports to U.S. despite long-standing free-trade ties,https://globalnews.ca/news/11358045/some-indigenous-businesses-halt-exports-to-u-s-despite-long-standing-free-trade-ties/,"<a href=""https://globalnews.ca/news/11358045/some-indigenous-businesses-halt-exports-to-u-s-despite-long-standing-free-trade-ties/"">Some Indigenous businesses halt exports to U.S. despite long-standing free-trade ties</a>"
5,Canadian farmers weigh future as Chinese tariffs hit canola prices,https://globalnews.ca/news/11373869/canadian-farmers-chinese-tariffs-canola/,"<a href=""https://globalnews.ca/news/11373869/canadian-farmers-chinese-tariffs-canola/"">Canadian farmers weigh future as Chinese tariffs hit canola prices</a>"
