Rank,Article title,url,Byline,Article type,title_with_link
1,Game 6 could be Bo Bichette’s last as a Blue Jay,https://www.theglobeandmail.com/sports/baseball/article-bo-bichette-blue-jays-vs-dodgers-game-6-world-series-mlb/,No byline found,No article type found,"<a href=""https://www.theglobeandmail.com/sports/baseball/article-bo-bichette-blue-jays-vs-dodgers-game-6-world-series-mlb/"">Game 6 could be Bo Bichette’s last as a Blue Jay</a>"
2,"How should Sid, 55, and Sherry, 46, draw down retirement savings given their age gap?",https://www.theglobeandmail.com/investing/personal-finance/financial-facelift/article-financial-facelift-retirement-savings-pension-income-age-gap/,No byline found,No article type found,"<a href=""https://www.theglobeandmail.com/investing/personal-finance/financial-facelift/article-financial-facelift-retirement-savings-pension-income-age-gap/"">How should Sid, 55, and Sherry, 46, draw down retirement savings given their age gap?</a>"
3,"Trump leaves APEC early, ceding spotlight to China",https://www.theglobeandmail.com/world/article-trump-xi-apec-us-china/,No byline found,No article type found,"<a href=""https://www.theglobeandmail.com/world/article-trump-xi-apec-us-china/"">Trump leaves APEC early, ceding spotlight to China</a>"
4,"What we need in this country is less money in politics, not more",https://www.theglobeandmail.com/opinion/article-ontario-premier-doug-ford-election-causes-wealthy/,No byline found,No article type found,"<a href=""https://www.theglobeandmail.com/opinion/article-ontario-premier-doug-ford-election-causes-wealthy/"">What we need in this country is less money in politics, not more</a>"
5,Why did U.S. Ambassador Pete Hoekstra swear at Ontario’s envoy? Take our business and investing news quiz,https://www.theglobeandmail.com/business/article-us-ambassador-pete-hoeskstra-nvidia-stock-business-quiz-october-31/,No byline found,No article type found,"<a href=""https://www.theglobeandmail.com/business/article-us-ambassador-pete-hoeskstra-nvidia-stock-business-quiz-october-31/"">Why did U.S. Ambassador Pete Hoekstra swear at Ontario’s envoy? Take our business and investing news quiz</a>"
6,Repeat offenders: Blue Jays fans are getting sick of seeing the same ads on TV,https://www.theglobeandmail.com/sports/baseball/article-blue-jays-fans-sick-seeing-same-ads-tv/,No byline found,No article type found,"<a href=""https://www.theglobeandmail.com/sports/baseball/article-blue-jays-fans-sick-seeing-same-ads-tv/"">Repeat offenders: Blue Jays fans are getting sick of seeing the same ads on TV</a>"
7,Supreme Court strikes down mandatory minimum sentence for child pornography,https://www.theglobeandmail.com/canada/article-mandatory-minimum-jail-sentence-child-pornography-supreme-court-ruling/,No byline found,No article type found,"<a href=""https://www.theglobeandmail.com/canada/article-mandatory-minimum-jail-sentence-child-pornography-supreme-court-ruling/"">Supreme Court strikes down mandatory minimum sentence for child pornography</a>"
8,World Series live updates: Dodgers’ Tommy Edman makes it home to put L.A. on the board against Toronto Blue Jays,https://www.theglobeandmail.com/sports/baseball/article-blue-jays-world-series-live-updates-dodgers-game-6-score-highlights/,No byline found,No article type found,"<a href=""https://www.theglobeandmail.com/sports/baseball/article-blue-jays-world-series-live-updates-dodgers-game-6-score-highlights/"">World Series live updates: Dodgers’ Tommy Edman makes it home to put L.A. on the board against Toronto Blue Jays</a>"
