Rank,Article title,url,Byline,Article type,title_with_link
1,Beaten-down TSX stocks that could now be end-of-year buys,https://www.theglobeandmail.com/investing/investment-ideas/number-cruncher/article-beaten-down-tsx-stocks-markets-tax-loss-selling/,No byline found,No article type found,"<a href=""https://www.theglobeandmail.com/investing/investment-ideas/number-cruncher/article-beaten-down-tsx-stocks-markets-tax-loss-selling/"">Beaten-down TSX stocks that could now be end-of-year buys</a>"
2,Man who disarmed Bondi Beach gunman hailed as hero as donations pour in,https://www.theglobeandmail.com/world/article-sydney-bondi-shooting-hero-ahmed-disarmed-gunman/,No byline found,No article type found,"<a href=""https://www.theglobeandmail.com/world/article-sydney-bondi-shooting-hero-ahmed-disarmed-gunman/"">Man who disarmed Bondi Beach gunman hailed as hero as donations pour in</a>"
3,Potential disaster looms over Pierre Poilievre’s leadership,https://www.theglobeandmail.com/politics/opinion/article-pierre-poilievre-leadership-potential-disaster/,Campbell Clark,Opinion,"<a href=""https://www.theglobeandmail.com/politics/opinion/article-pierre-poilievre-leadership-potential-disaster/"">Potential disaster looms over Pierre Poilievre’s leadership</a>"
4,"Rob Reiner’s son Nick arrested after filmmaker, wife found dead in L.A. home",https://www.theglobeandmail.com/arts/article-director-rob-reiner-and-wife-michele-found-dead-in-their-home-police/,No byline found,No article type found,"<a href=""https://www.theglobeandmail.com/arts/article-director-rob-reiner-and-wife-michele-found-dead-in-their-home-police/"">Rob Reiner’s son Nick arrested after filmmaker, wife found dead in L.A. home</a>"
5,WSP Global to buy TRC Companies in continued push to build capability,https://www.theglobeandmail.com/business/article-wsp-global-inc-trc-companies-deal/,No byline found,No article type found,"<a href=""https://www.theglobeandmail.com/business/article-wsp-global-inc-trc-companies-deal/"">WSP Global to buy TRC Companies in continued push to build capability</a>"
6,TD’s chief economist on why the BoC will stay on hold for two years and when a pivot in housing prices will arrive,https://www.theglobeandmail.com/investing/markets/inside-the-market/article-tds-chief-economist-on-why-the-boc-will-stay-on-hold-for-two-years-and/,No byline found,No article type found,"<a href=""https://www.theglobeandmail.com/investing/markets/inside-the-market/article-tds-chief-economist-on-why-the-boc-will-stay-on-hold-for-two-years-and/"">TD’s chief economist on why the BoC will stay on hold for two years and when a pivot in housing prices will arrive</a>"
7,Doug Ford shrinks Ontario Science Centre to fit in temporary home at Toronto Harbourfront,https://www.theglobeandmail.com/canada/toronto/article-ontario-science-centre-temporary-home-harbourfront/,Alex Bozikovic,Opinion,"<a href=""https://www.theglobeandmail.com/canada/toronto/article-ontario-science-centre-temporary-home-harbourfront/"">Doug Ford shrinks Ontario Science Centre to fit in temporary home at Toronto Harbourfront</a>"
8,U.S. startup partners with Canadian producer on carbon capture study in Alberta oil sands,https://www.theglobeandmail.com/business/article-us-start-up-teams-up-with-canadian-producer-to-launch-carbon-capture/,No byline found,No article type found,"<a href=""https://www.theglobeandmail.com/business/article-us-start-up-teams-up-with-canadian-producer-to-launch-carbon-capture/"">U.S. startup partners with Canadian producer on carbon capture study in Alberta oil sands</a>"
