Rank,Article title,url,title_with_link
1,Delta pilot’s ‘aggressive manoeuvre’ avoids mid-air collision with B-52 bomber,https://globalnews.ca/news/11296673/delta-pilot-avoids-collision-air-force-b-52-bomber/,"<a href=""https://globalnews.ca/news/11296673/delta-pilot-avoids-collision-air-force-b-52-bomber/"">Delta pilot’s ‘aggressive manoeuvre’ avoids mid-air collision with B-52 bomber</a>"
2,"Trump thinks Canadians are ‘mean and nasty’ for boycotting U.S. travel, booze: Ambassador",https://globalnews.ca/news/11297549/us-ambassador-canada-mean-nasty/,"<a href=""https://globalnews.ca/news/11297549/us-ambassador-canada-mean-nasty/"">Trump thinks Canadians are ‘mean and nasty’ for boycotting U.S. travel, booze: Ambassador</a>"
3,Will Bank of Canada cut rates next week? How new data factors into the call,https://globalnews.ca/news/11292901/business-sentiment-bank-of-canada/,"<a href=""https://globalnews.ca/news/11292901/business-sentiment-bank-of-canada/"">Will Bank of Canada cut rates next week? How new data factors into the call</a>"
4,"Ozzy Osbourne, rock icon and lead singer of Black Sabbath, dead at 76",https://globalnews.ca/news/11298651/ozzy-osbourne-dead-black-sabbath/,"<a href=""https://globalnews.ca/news/11298651/ozzy-osbourne-dead-black-sabbath/"">Ozzy Osbourne, rock icon and lead singer of Black Sabbath, dead at 76</a>"
5,Carney says he’ll only take ‘best deal for Canada’ in U.S. trade talks,https://globalnews.ca/news/11298183/mark-carney-premiers-summit-ontario/,"<a href=""https://globalnews.ca/news/11298183/mark-carney-premiers-summit-ontario/"">Carney says he’ll only take ‘best deal for Canada’ in U.S. trade talks</a>"
