Rank,Article title,url,Byline,Article type,title_with_link
1,"Trump leaves APEC early, ceding spotlight to China",https://www.theglobeandmail.com/world/article-trump-xi-apec-us-china/,No byline found,No article type found,"<a href=""https://www.theglobeandmail.com/world/article-trump-xi-apec-us-china/"">Trump leaves APEC early, ceding spotlight to China</a>"
2,"What we need in this country is less money in politics, not more",https://www.theglobeandmail.com/opinion/article-ontario-premier-doug-ford-election-causes-wealthy/,No byline found,No article type found,"<a href=""https://www.theglobeandmail.com/opinion/article-ontario-premier-doug-ford-election-causes-wealthy/"">What we need in this country is less money in politics, not more</a>"
3,Friday’s analyst upgrades and downgrades,https://www.theglobeandmail.com/investing/markets/inside-the-market/article-fridays-analyst-upgrades-and-downgrades-276/,No byline found,No article type found,"<a href=""https://www.theglobeandmail.com/investing/markets/inside-the-market/article-fridays-analyst-upgrades-and-downgrades-276/"">Friday’s analyst upgrades and downgrades</a>"
4,"CN cuts spending, lays off workers as tariffs curtail shipping to U.S.",https://www.theglobeandmail.com/business/article-cn-rail-posts-higher-profit-slashes-capital-spending-for-2026/,No byline found,No article type found,"<a href=""https://www.theglobeandmail.com/business/article-cn-rail-posts-higher-profit-slashes-capital-spending-for-2026/"">CN cuts spending, lays off workers as tariffs curtail shipping to U.S.</a>"
5,"How the Toronto condo bubble burst, the Home of the Week and more top real estate stories",https://www.theglobeandmail.com/business/article-real-estate-housing-news-october-31/,No byline found,No article type found,"<a href=""https://www.theglobeandmail.com/business/article-real-estate-housing-news-october-31/"">How the Toronto condo bubble burst, the Home of the Week and more top real estate stories</a>"
6,Why did U.S. Ambassador Pete Hoekstra swear at Ontario’s envoy? Take our business and investing news quiz,https://www.theglobeandmail.com/business/article-us-ambassador-pete-hoeskstra-nvidia-stock-business-quiz-october-31/,No byline found,No article type found,"<a href=""https://www.theglobeandmail.com/business/article-us-ambassador-pete-hoeskstra-nvidia-stock-business-quiz-october-31/"">Why did U.S. Ambassador Pete Hoekstra swear at Ontario’s envoy? Take our business and investing news quiz</a>"
7,Repeat offenders: Blue Jays fans are getting sick of seeing the same ads on TV,https://www.theglobeandmail.com/sports/baseball/article-blue-jays-fans-sick-seeing-same-ads-tv/,No byline found,No article type found,"<a href=""https://www.theglobeandmail.com/sports/baseball/article-blue-jays-fans-sick-seeing-same-ads-tv/"">Repeat offenders: Blue Jays fans are getting sick of seeing the same ads on TV</a>"
8,Supreme Court strikes down mandatory minimum sentence for child pornography,https://www.theglobeandmail.com/canada/article-mandatory-minimum-jail-sentence-child-pornography-supreme-court-ruling/,No byline found,No article type found,"<a href=""https://www.theglobeandmail.com/canada/article-mandatory-minimum-jail-sentence-child-pornography-supreme-court-ruling/"">Supreme Court strikes down mandatory minimum sentence for child pornography</a>"
