Rank,Article title,url,Byline,Article type,title_with_link
1,U.S. conducts strikes on Iran in response to Hormuz attack and says it violates ceasefire,https://www.theglobeandmail.com/world/article-donald-trump-blames-iran-for-hormuz-drone-strike-ceasefire-violation/,No byline found,No article type found,"<a href=""https://www.theglobeandmail.com/world/article-donald-trump-blames-iran-for-hormuz-drone-strike-ceasefire-violation/"">U.S. conducts strikes on Iran in response to Hormuz attack and says it violates ceasefire</a>"
2,"Plane makes emergency landing on Manitoba highway, one passenger hospitalized",https://www.theglobeandmail.com/canada/article-plane-makes-emergency-landing-on-manitoba-highway-one-passenger/,No byline found,No article type found,"<a href=""https://www.theglobeandmail.com/canada/article-plane-makes-emergency-landing-on-manitoba-highway-one-passenger/"">Plane makes emergency landing on Manitoba highway, one passenger hospitalized</a>"
3,JPMorgan’s Jamie Dimon plays down U.S.-Canada trade tensions as ‘a bump in the road’,https://www.theglobeandmail.com/business/article-jamie-dimon-jpmorgan-donald-trump-canada-bank/,No byline found,No article type found,"<a href=""https://www.theglobeandmail.com/business/article-jamie-dimon-jpmorgan-donald-trump-canada-bank/"">JPMorgan’s Jamie Dimon plays down U.S.-Canada trade tensions as ‘a bump in the road’</a>"
4,"John Bolton, former Trump adviser, pleads guilty to illegally holding classified information",https://www.theglobeandmail.com/world/article-john-bolton-pleads-guilty-holding-classified-information/,No byline found,No article type found,"<a href=""https://www.theglobeandmail.com/world/article-john-bolton-pleads-guilty-holding-classified-information/"">John Bolton, former Trump adviser, pleads guilty to illegally holding classified information</a>"
5,Michael J. Fox promoted within Order of Canada as one of 61 newly announced appointments,https://www.theglobeandmail.com/politics/article-michael-j-fox-order-of-canada-appointments-promotions/,No byline found,No article type found,"<a href=""https://www.theglobeandmail.com/politics/article-michael-j-fox-order-of-canada-appointments-promotions/"">Michael J. Fox promoted within Order of Canada as one of 61 newly announced appointments</a>"
6,Eurovision is a giant glittery mess – and CBC should absolutely jump into it,https://www.theglobeandmail.com/culture/film-and-tv/television/article-eurovision-is-a-giant-glittery-mess-and-cbc-should-absolutely-jump/,J. Kelly Nestruck,Opinion,"<a href=""https://www.theglobeandmail.com/culture/film-and-tv/television/article-eurovision-is-a-giant-glittery-mess-and-cbc-should-absolutely-jump/"">Eurovision is a giant glittery mess – and CBC should absolutely jump into it</a>"
7,Canada built the Gordie Howe bridge. Trump weaponized it,https://www.theglobeandmail.com/investing/markets/inside-the-market/article-gordie-howe-bridge-donald-trump-weaponized-infrastructure/,Tim Shufelt,Opinion,"<a href=""https://www.theglobeandmail.com/investing/markets/inside-the-market/article-gordie-howe-bridge-donald-trump-weaponized-infrastructure/"">Canada built the Gordie Howe bridge. Trump weaponized it</a>"
8,"Outgoing Telus CEO presents sunny view of his tenure, despite stock price challenges",https://www.theglobeandmail.com/business/article-telus-ceo-darren-entwistle-tenure-stock-price/,No byline found,No article type found,"<a href=""https://www.theglobeandmail.com/business/article-telus-ceo-darren-entwistle-tenure-stock-price/"">Outgoing Telus CEO presents sunny view of his tenure, despite stock price challenges</a>"
