Rank,Article title,url,Byline,Article type,title_with_link
1,Stephanie Smyth once covered Doug Ford on the news. Now she faces him in the Ontario legislature,https://www.theglobeandmail.com/canada/article-stephanie-smyth-doug-ford-ontario-legislature/,No byline found,No article type found,"<a href=""https://www.theglobeandmail.com/canada/article-stephanie-smyth-doug-ford-ontario-legislature/"">Stephanie Smyth once covered Doug Ford on the news. Now she faces him in the Ontario legislature</a>"
2,"Young Canadians falling behind payments as debt divide widens, report shows",https://www.theglobeandmail.com/investing/personal-finance/article-young-canadians-behind-payments-debt-divide/,No byline found,No article type found,"<a href=""https://www.theglobeandmail.com/investing/personal-finance/article-young-canadians-behind-payments-debt-divide/"">Young Canadians falling behind payments as debt divide widens, report shows</a>"
3,Etobicoke bungalow outshines competitors to draw multiple offers,https://www.theglobeandmail.com/real-estate/toronto/article-etobicoke-bungalow-outshines-competitors-to-draw-multiple-offers/,No byline found,No article type found,"<a href=""https://www.theglobeandmail.com/real-estate/toronto/article-etobicoke-bungalow-outshines-competitors-to-draw-multiple-offers/"">Etobicoke bungalow outshines competitors to draw multiple offers</a>"
4,Small caps to watch: Shares in Canadian lender plunge after earnings miss,https://www.theglobeandmail.com/investing/markets/inside-the-market/article-small-caps-to-watch-eqb-shares-poised-for-big-drop-after-earnings-miss/,No byline found,No article type found,"<a href=""https://www.theglobeandmail.com/investing/markets/inside-the-market/article-small-caps-to-watch-eqb-shares-poised-for-big-drop-after-earnings-miss/"">Small caps to watch: Shares in Canadian lender plunge after earnings miss</a>"
5,"Diageo to close Amherstburg, Ont., facility as it moves some bottling volume to U.S.",https://www.theglobeandmail.com/business/article-diageo-to-close-amherstburg-ont-facility-as-it-moves-some-bottling/,No byline found,No article type found,"<a href=""https://www.theglobeandmail.com/business/article-diageo-to-close-amherstburg-ont-facility-as-it-moves-some-bottling/"">Diageo to close Amherstburg, Ont., facility as it moves some bottling volume to U.S.</a>"
6,U.S. Border Patrol arrests firefighters as they battle Washington state wildfire,https://www.theglobeandmail.com/world/article-border-patrol-firefighters-washington-wildfire-immigration-ice-trump/,No byline found,No article type found,"<a href=""https://www.theglobeandmail.com/world/article-border-patrol-firefighters-washington-wildfire-immigration-ice-trump/"">U.S. Border Patrol arrests firefighters as they battle Washington state wildfire</a>"
7,This RRSP portfolio has returned more than 9% annually over the past 13 years - and I’m not changing a thing,https://www.theglobeandmail.com/investing/markets/inside-the-market/article-rrsp-investing-portfolio-stocks-shares-etf/,No byline found,No article type found,"<a href=""https://www.theglobeandmail.com/investing/markets/inside-the-market/article-rrsp-investing-portfolio-stocks-shares-etf/"">This RRSP portfolio has returned more than 9% annually over the past 13 years - and I’m not changing a thing</a>"
8,Quebec plans to outlaw public prayer in move to strengthen secularism,https://www.theglobeandmail.com/canada/article-public-prayer-quebec-secularism-roberge-legault/,No byline found,No article type found,"<a href=""https://www.theglobeandmail.com/canada/article-public-prayer-quebec-secularism-roberge-legault/"">Quebec plans to outlaw public prayer in move to strengthen secularism</a>"
