Rank,Article title,url,Byline,Article type,title_with_link
1,Carney announces $1.2-billion in lumber industry supports,https://www.theglobeandmail.com/business/article-carney-announces-12-billion-in-lumber-industry-supports/,No byline found,No article type found,"<a href=""https://www.theglobeandmail.com/business/article-carney-announces-12-billion-in-lumber-industry-supports/"">Carney announces $1.2-billion in lumber industry supports</a>"
2,"Canada’s trade deficit widened to $5.9-billion in June, second highest on record",https://www.theglobeandmail.com/business/article-national-trade-deficit-statistics-canada-us-tariffs/,No byline found,No article type found,"<a href=""https://www.theglobeandmail.com/business/article-national-trade-deficit-statistics-canada-us-tariffs/"">Canada’s trade deficit widened to $5.9-billion in June, second highest on record</a>"
3,The EU’s deal with Trump could blow up at any time,https://www.theglobeandmail.com/world/us-politics/article-the-eus-deal-with-trump-could-blow-up-at-any-time/,Eric Reguly,Opinion,"<a href=""https://www.theglobeandmail.com/world/us-politics/article-the-eus-deal-with-trump-could-blow-up-at-any-time/"">The EU’s deal with Trump could blow up at any time</a>"
4,The bitter truth is that cheaper housing means a retirement crisis for homeowners,https://www.theglobeandmail.com/business/commentary/article-housing-prices-retirement-plan-middle-class/,John Turley-Ewart,Opinion,"<a href=""https://www.theglobeandmail.com/business/commentary/article-housing-prices-retirement-plan-middle-class/"">The bitter truth is that cheaper housing means a retirement crisis for homeowners</a>"
5,"Just how serious is high cholesterol for retirees, and what can you do about it?",https://www.theglobeandmail.com/investing/personal-finance/retirement/article-just-how-serious-is-high-cholesterol-for-retirees-and-what-can-you-do/,No byline found,No article type found,"<a href=""https://www.theglobeandmail.com/investing/personal-finance/retirement/article-just-how-serious-is-high-cholesterol-for-retirees-and-what-can-you-do/"">Just how serious is high cholesterol for retirees, and what can you do about it?</a>"
6,Hiking this Vancouver Island park was my chance to step back into history,https://www.theglobeandmail.com/canada/article-strathcona-provincial-park-vancouver-island-bc-nature/,No byline found,No article type found,"<a href=""https://www.theglobeandmail.com/canada/article-strathcona-provincial-park-vancouver-island-bc-nature/"">Hiking this Vancouver Island park was my chance to step back into history</a>"
7,"Netanyahu will win the war in Gaza, but he’s lost it in London, Ottawa and Washington",https://www.theglobeandmail.com/opinion/article-benjamin-netanyahu-gaza-israel-famine/,No byline found,No article type found,"<a href=""https://www.theglobeandmail.com/opinion/article-benjamin-netanyahu-gaza-israel-famine/"">Netanyahu will win the war in Gaza, but he’s lost it in London, Ottawa and Washington</a>"
8,U.S. ITC investigating dairy protein dumping allegations against Canada’s supply management system,https://www.theglobeandmail.com/business/economy/article-us-itc-dairy-protein-dumping-canada-supply-management/,No byline found,No article type found,"<a href=""https://www.theglobeandmail.com/business/economy/article-us-itc-dairy-protein-dumping-canada-supply-management/"">U.S. ITC investigating dairy protein dumping allegations against Canada’s supply management system</a>"
