Rank,Article title,url,Byline,Article type,title_with_link
1,"Montreal girl allegedly killed by father drowned in New York state, autopsy shows",https://www.theglobeandmail.com/canada/article-montreal-girl-drowned-autopsy-father-charged/,No byline found,No article type found,"<a href=""https://www.theglobeandmail.com/canada/article-montreal-girl-drowned-autopsy-father-charged/"">Montreal girl allegedly killed by father drowned in New York state, autopsy shows</a>"
2,"Trump’s trade policy is completely nonsensical, and entirely clear",https://www.theglobeandmail.com/business/commentary/article-trump-trade-policy-howard-lutnick-usmca/,Tony Keller,Opinion,"<a href=""https://www.theglobeandmail.com/business/commentary/article-trump-trade-policy-howard-lutnick-usmca/"">Trump’s trade policy is completely nonsensical, and entirely clear</a>"
3,Grizzly lunges at Calgary hikers on Kananaskis trail,https://www.theglobeandmail.com/canada/alberta/article-grizzly-calgary-hikers-kananaskis-trail/,No byline found,No article type found,"<a href=""https://www.theglobeandmail.com/canada/alberta/article-grizzly-calgary-hikers-kananaskis-trail/"">Grizzly lunges at Calgary hikers on Kananaskis trail</a>"
4,Trump says U.S. Fed’s Powell will be out in eight months,https://www.theglobeandmail.com/world/article-trump-says-us-feds-powell-will-be-out-in-8-months/,No byline found,No article type found,"<a href=""https://www.theglobeandmail.com/world/article-trump-says-us-feds-powell-will-be-out-in-8-months/"">Trump says U.S. Fed’s Powell will be out in eight months</a>"
5,"The more you earn, the higher your retirement savings rate needs to be",https://www.theglobeandmail.com/investing/personal-finance/retirement/article-the-more-you-earn-the-higher-your-retirement-savings-rate-needs-to-be/,No byline found,No article type found,"<a href=""https://www.theglobeandmail.com/investing/personal-finance/retirement/article-the-more-you-earn-the-higher-your-retirement-savings-rate-needs-to-be/"">The more you earn, the higher your retirement savings rate needs to be</a>"
6,"Trump announces Japan trade deal, lowers threatened tariff to 15%",https://www.theglobeandmail.com/business/article-trump-trade-deal-japan-reciprocal-tariff/,No byline found,No article type found,"<a href=""https://www.theglobeandmail.com/business/article-trump-trade-deal-japan-reciprocal-tariff/"">Trump announces Japan trade deal, lowers threatened tariff to 15%</a>"
7,The bitter truth is that cheaper housing means a retirement crisis for homeowners,https://www.theglobeandmail.com/business/commentary/article-housing-prices-retirement-plan-middle-class/,John Turley-Ewart,Opinion,"<a href=""https://www.theglobeandmail.com/business/commentary/article-housing-prices-retirement-plan-middle-class/"">The bitter truth is that cheaper housing means a retirement crisis for homeowners</a>"
8,"When aggressive tactics are praised as legal strategy, it’s survivors like me who pay the price",https://www.theglobeandmail.com/opinion/article-hockey-canada-trial-jacob-hoggard-aggressive-legal-tactics/,J.B.,Opinion,"<a href=""https://www.theglobeandmail.com/opinion/article-hockey-canada-trial-jacob-hoggard-aggressive-legal-tactics/"">When aggressive tactics are praised as legal strategy, it’s survivors like me who pay the price</a>"
