Rank,Article title,url,title_with_link
1,Tsunami watch upgraded to advisory for much of B.C. coast after M8.8 quake off Russian coast,https://globalnews.ca/news/11310506/tsunami-advisory-russia-earthquake/,"<a href=""https://globalnews.ca/news/11310506/tsunami-advisory-russia-earthquake/"">Tsunami watch upgraded to advisory for much of B.C. coast after M8.8 quake off Russian coast</a>"
2,"Now-cancelled tsunami advisory shows we ‘know we’re ready,’ B.C. premier says",https://globalnews.ca/news/11310950/bc-tsunami-advisory-russia-earthquake/,"<a href=""https://globalnews.ca/news/11310950/bc-tsunami-advisory-russia-earthquake/"">Now-cancelled tsunami advisory shows we ‘know we’re ready,’ B.C. premier says</a>"
3,"Extremist influencers ‘weaponizing femininity,’ warns Canadian intelligence report",https://globalnews.ca/news/11309101/extremists-weaponizing-femininity-canadian-intelligence-report/,"<a href=""https://globalnews.ca/news/11309101/extremists-weaponizing-femininity-canadian-intelligence-report/"">Extremist influencers ‘weaponizing femininity,’ warns Canadian intelligence report</a>"
4,Katy Perry and Justin Trudeau spotted sharing a meal in Montreal,https://globalnews.ca/news/11309567/katy-perry-justin-trudeau-dinner-date-montreal/,"<a href=""https://globalnews.ca/news/11309567/katy-perry-justin-trudeau-dinner-date-montreal/"">Katy Perry and Justin Trudeau spotted sharing a meal in Montreal</a>"
5,Ford government agrees to fee cancelling $100M deal with Elon Musk’s Starlink,https://globalnews.ca/news/11310110/ontario-cancels-starlink-contract/,"<a href=""https://globalnews.ca/news/11310110/ontario-cancels-starlink-contract/"">Ford government agrees to fee cancelling $100M deal with Elon Musk’s Starlink</a>"
