Rank,Article title,url,Byline,Article type,title_with_link
1,Popeyes franchises shut down over unpaid wages placed into receivership,https://www.theglobeandmail.com/business/article-popeyes-ontario-shut-down-unpaid-wages-lawsuit-unsafe-chicken/,No byline found,No article type found,"<a href=""https://www.theglobeandmail.com/business/article-popeyes-ontario-shut-down-unpaid-wages-lawsuit-unsafe-chicken/"">Popeyes franchises shut down over unpaid wages placed into receivership</a>"
2,Alberta petition that could trigger separation referendum faces looming deadline,https://www.theglobeandmail.com/canada/alberta/article-alberta-petition-that-could-trigger-separation-referendum-faces/,No byline found,No article type found,"<a href=""https://www.theglobeandmail.com/canada/alberta/article-alberta-petition-that-could-trigger-separation-referendum-faces/"">Alberta petition that could trigger separation referendum faces looming deadline</a>"
3,The investing craze that could flatten the TSX,https://www.theglobeandmail.com/investing/markets/inside-the-market/article-the-investing-craze-that-could-flatten-the-tsx/,No byline found,No article type found,"<a href=""https://www.theglobeandmail.com/investing/markets/inside-the-market/article-the-investing-craze-that-could-flatten-the-tsx/"">The investing craze that could flatten the TSX</a>"
4,Trump announces 10% increase in tariffs on Canada for not pulling down Ontario ad sooner,https://www.theglobeandmail.com/politics/article-trump-tariffs-ford-carney-ontario-reagan-advertisement/,No byline found,No article type found,"<a href=""https://www.theglobeandmail.com/politics/article-trump-tariffs-ford-carney-ontario-reagan-advertisement/"">Trump announces 10% increase in tariffs on Canada for not pulling down Ontario ad sooner</a>"
5,There is no goth revival – the spooky subculture never died,https://www.theglobeandmail.com/opinion/article-goth-subculture-revival-younger-generations/,Liisa Ladouceur,Opinion,"<a href=""https://www.theglobeandmail.com/opinion/article-goth-subculture-revival-younger-generations/"">There is no goth revival – the spooky subculture never died</a>"
6,"Should recently widowed Curtis, 55, draw from RRSPs before tapping into taxable investments?",https://www.theglobeandmail.com/investing/personal-finance/financial-facelift/article-rrsps-financial-investments-early-retirement/,No byline found,No article type found,"<a href=""https://www.theglobeandmail.com/investing/personal-finance/financial-facelift/article-rrsps-financial-investments-early-retirement/"">Should recently widowed Curtis, 55, draw from RRSPs before tapping into taxable investments?</a>"
7,The bitter truth is that cheaper housing means a retirement crisis for homeowners,https://www.theglobeandmail.com/business/commentary/article-housing-prices-retirement-plan-middle-class/,John Turley-Ewart,Opinion,"<a href=""https://www.theglobeandmail.com/business/commentary/article-housing-prices-retirement-plan-middle-class/"">The bitter truth is that cheaper housing means a retirement crisis for homeowners</a>"
8,Carney faces historic choice between South Korea and Europe for submarine fleet,https://www.theglobeandmail.com/politics/article-carney-faces-historic-choice-between-south-korea-and-europe-for/,No byline found,No article type found,"<a href=""https://www.theglobeandmail.com/politics/article-carney-faces-historic-choice-between-south-korea-and-europe-for/"">Carney faces historic choice between South Korea and Europe for submarine fleet</a>"
