Rank,Article title,url,Byline,Article type,title_with_link
1,How Trump plans to continue his trade war with Canada without IEEPA,https://www.theglobeandmail.com/business/article-how-trump-plans-to-continue-trade-war-supreme-court-ieepa/,No byline found,No article type found,"<a href=""https://www.theglobeandmail.com/business/article-how-trump-plans-to-continue-trade-war-supreme-court-ieepa/"">How Trump plans to continue his trade war with Canada without IEEPA</a>"
2,"Armed man shot and killed after entering Mar-a-Lago’s secure perimeter, Secret Service says",https://www.theglobeandmail.com/world/article-us-secret-service-agents-shot-and-killed-armed-man-who-entered-the/,No byline found,No article type found,"<a href=""https://www.theglobeandmail.com/world/article-us-secret-service-agents-shot-and-killed-armed-man-who-entered-the/"">Armed man shot and killed after entering Mar-a-Lago’s secure perimeter, Secret Service says</a>"
3,Donald Trump’s State of the Union address comes at an unusually provocative moment,https://www.theglobeandmail.com/world/us-politics/article-donald-trumps-state-of-the-union-address-comes-at-an-unusually/,No byline found,Analysis,"<a href=""https://www.theglobeandmail.com/world/us-politics/article-donald-trumps-state-of-the-union-address-comes-at-an-unusually/"">Donald Trump’s State of the Union address comes at an unusually provocative moment</a>"
4,The Globe’s 20 best dividend-paying stocks of the year,https://www.theglobeandmail.com/investing/markets/inside-the-market/article-dividend-all-stars-20-best-performing-dividend-stocks-tsx/,No byline found,No article type found,"<a href=""https://www.theglobeandmail.com/investing/markets/inside-the-market/article-dividend-all-stars-20-best-performing-dividend-stocks-tsx/"">The Globe’s 20 best dividend-paying stocks of the year</a>"
5,Olympic Winter Games close with ceremony in Verona showcasing Italian arts and odes to athletes,https://www.theglobeandmail.com/sports/olympics/article-winter-olympics-canada-usa-gold-medal-game-closing-ceremony-live/,No byline found,No article type found,"<a href=""https://www.theglobeandmail.com/sports/olympics/article-winter-olympics-canada-usa-gold-medal-game-closing-ceremony-live/"">Olympic Winter Games close with ceremony in Verona showcasing Italian arts and odes to athletes</a>"
6,Now is the time to invest like a coward,https://www.theglobeandmail.com/investing/markets/inside-the-market/article-time-to-invest-like-a-coward-markets/,No byline found,No article type found,"<a href=""https://www.theglobeandmail.com/investing/markets/inside-the-market/article-time-to-invest-like-a-coward-markets/"">Now is the time to invest like a coward</a>"
7,Retired constable charged in Project South corruption probe has first hearing,https://www.theglobeandmail.com/canada/article-retired-constable-charged-project-south-corruption-probe-first-hearing/,No byline found,No article type found,"<a href=""https://www.theglobeandmail.com/canada/article-retired-constable-charged-project-south-corruption-probe-first-hearing/"">Retired constable charged in Project South corruption probe has first hearing</a>"
8,"Carney, Ford discussed idea of an early federal election to secure majority, sources say",https://www.theglobeandmail.com/politics/article-ford-advises-carney-securing-majority-would-bolster-economic-stability/,No byline found,No article type found,"<a href=""https://www.theglobeandmail.com/politics/article-ford-advises-carney-securing-majority-would-bolster-economic-stability/"">Carney, Ford discussed idea of an early federal election to secure majority, sources say</a>"
