Rank,Article title,url,Byline,Article type,title_with_link
1,Trump threatens to ‘take out’ all of Iran after ceasefire proposal is rejected,https://www.theglobeandmail.com/business/article-new-us-iran-ceasefire-proposal-is-shared-as-air-strikes-kill-more-than/,No byline found,No article type found,"<a href=""https://www.theglobeandmail.com/business/article-new-us-iran-ceasefire-proposal-is-shared-as-air-strikes-kill-more-than/"">Trump threatens to ‘take out’ all of Iran after ceasefire proposal is rejected</a>"
2,"As U.S. probes Canada over forced labour, data suggest it faces gaps of its own",https://www.theglobeandmail.com/business/article-forced-labour-xinjiang-uyghur-probes-trump-tariffs/,No byline found,No article type found,"<a href=""https://www.theglobeandmail.com/business/article-forced-labour-xinjiang-uyghur-probes-trump-tariffs/"">As U.S. probes Canada over forced labour, data suggest it faces gaps of its own</a>"
3,Artemis II is about to break a record that should never have been,https://www.theglobeandmail.com/canada/science/article-artemis-ii-is-about-to-break-a-record-that-should-never-have-been/,No byline found,No article type found,"<a href=""https://www.theglobeandmail.com/canada/science/article-artemis-ii-is-about-to-break-a-record-that-should-never-have-been/"">Artemis II is about to break a record that should never have been</a>"
4,Canadian Olivia Cazes wants to be among the few who have crossed the Americas on horseback,https://www.theglobeandmail.com/life/article-canada-horseback-riding-americas/,No byline found,No article type found,"<a href=""https://www.theglobeandmail.com/life/article-canada-horseback-riding-americas/"">Canadian Olivia Cazes wants to be among the few who have crossed the Americas on horseback</a>"
5,"Fans look back against visiting Dodgers, while the Jays sit in an unpleasant reality",https://www.theglobeandmail.com/sports/baseball/article-fans-look-back-against-visiting-dodgers-while-the-jays-sit-in-an/,Cathal Kelly,Opinion,"<a href=""https://www.theglobeandmail.com/sports/baseball/article-fans-look-back-against-visiting-dodgers-while-the-jays-sit-in-an/"">Fans look back against visiting Dodgers, while the Jays sit in an unpleasant reality</a>"
6,Details emerge about U.S. military’s rescue of aviator shot down in Iran,https://www.theglobeandmail.com/world/article-us-iran-war-aviator-pilot-rescue/,No byline found,No article type found,"<a href=""https://www.theglobeandmail.com/world/article-us-iran-war-aviator-pilot-rescue/"">Details emerge about U.S. military’s rescue of aviator shot down in Iran</a>"
7,"Toronto’s Rosedale residents invest in patrols, increased security after spate of break-ins",https://www.theglobeandmail.com/canada/article-toronto-rosedale-patrols-security-after-spate-of-break-ins/,No byline found,No article type found,"<a href=""https://www.theglobeandmail.com/canada/article-toronto-rosedale-patrols-security-after-spate-of-break-ins/"">Toronto’s Rosedale residents invest in patrols, increased security after spate of break-ins</a>"
8,Artemis II crew becomes first to view moon’s far side in the internet age,https://www.theglobeandmail.com/canada/science/article-artemis-ii-crew-becomes-first-to-view-moon-far-side/,No byline found,No article type found,"<a href=""https://www.theglobeandmail.com/canada/science/article-artemis-ii-crew-becomes-first-to-view-moon-far-side/"">Artemis II crew becomes first to view moon’s far side in the internet age</a>"
