Rank,Article title,url,Byline,Article type,title_with_link
1,The winners and losers of this year’s World Cup on and off the pitch,https://www.theglobeandmail.com/sports/article-winners-and-losers-world-cup-fifa/,Cathal Kelly,Opinion,"<a href=""https://www.theglobeandmail.com/sports/article-winners-and-losers-world-cup-fifa/"">The winners and losers of this year’s World Cup on and off the pitch</a>"
2,"In the housing market, what goes up must (must not) come down",https://www.theglobeandmail.com/opinion/editorials/article-in-the-housing-market-what-goes-up-must-must-not-come-down/,No byline found,No article type found,"<a href=""https://www.theglobeandmail.com/opinion/editorials/article-in-the-housing-market-what-goes-up-must-must-not-come-down/"">In the housing market, what goes up must (must not) come down</a>"
3,Evacuees of wildfires in northwestern Ontario recall harrowing escapes,https://www.theglobeandmail.com/canada/toronto/article-ontario-wildfire-evacuees-first-nation-thunder-bay/,No byline found,No article type found,"<a href=""https://www.theglobeandmail.com/canada/toronto/article-ontario-wildfire-evacuees-first-nation-thunder-bay/"">Evacuees of wildfires in northwestern Ontario recall harrowing escapes</a>"
4,"Have Giovanni, 41, and Tiyana, 37, underestimated spending and jeopardized their retirement plan?",https://www.theglobeandmail.com/investing/personal-finance/financial-facelift/article-giovanni-tiyana-spending-retirement-plan/,No byline found,No article type found,"<a href=""https://www.theglobeandmail.com/investing/personal-finance/financial-facelift/article-giovanni-tiyana-spending-retirement-plan/"">Have Giovanni, 41, and Tiyana, 37, underestimated spending and jeopardized their retirement plan?</a>"
5,The Canadian Banks have entered bubble territory. It’s time to take some profits,https://www.theglobeandmail.com/investing/markets/inside-the-market/article-david-rosenberg-the-canadian-banks-have-entered-bubble-territory-its/,David Rosenberg,Opinion,"<a href=""https://www.theglobeandmail.com/investing/markets/inside-the-market/article-david-rosenberg-the-canadian-banks-have-entered-bubble-territory-its/"">The Canadian Banks have entered bubble territory. It’s time to take some profits</a>"
6,B.C. wildfire season surges amid lightning strikes,https://www.theglobeandmail.com/canada/article-bc-wildfire-season-lightning-strikes/,No byline found,No article type found,"<a href=""https://www.theglobeandmail.com/canada/article-bc-wildfire-season-lightning-strikes/"">B.C. wildfire season surges amid lightning strikes</a>"
7,Andrew and Tristan Tate arrested in Miami as U.K. seeks extradition for rape and trafficking charges,https://www.theglobeandmail.com/world/article-uk-seeks-extradition-andrew-tristan-tate-arrested-miami/,No byline found,No article type found,"<a href=""https://www.theglobeandmail.com/world/article-uk-seeks-extradition-andrew-tristan-tate-arrested-miami/"">Andrew and Tristan Tate arrested in Miami as U.K. seeks extradition for rape and trafficking charges</a>"
8,Why Argentina will win the World Cup,https://www.theglobeandmail.com/sports/article-why-argentina-will-win-fifa-world-cup-final-spain/,No byline found,No article type found,"<a href=""https://www.theglobeandmail.com/sports/article-why-argentina-will-win-fifa-world-cup-final-spain/"">Why Argentina will win the World Cup</a>"
