Rank,Article title,url,Byline,Article type,title_with_link
1,"Economic Outlook 2026: The good, the bad and the downright scary",https://www.theglobeandmail.com/business/rob-magazine/article-economic-outlook-2026-trade-housing-artificial-intelligence/,No byline found,No article type found,"<a href=""https://www.theglobeandmail.com/business/rob-magazine/article-economic-outlook-2026-trade-housing-artificial-intelligence/"">Economic Outlook 2026: The good, the bad and the downright scary</a>"
2,The backlash against the Canadian Museum for Human Rights’ Nakba exhibit is preposterous,https://www.theglobeandmail.com/opinion/article-canadian-museum-for-human-rights-palestine-israel-nakba-exhibit/,Marsha Lederman,Opinion,"<a href=""https://www.theglobeandmail.com/opinion/article-canadian-museum-for-human-rights-palestine-israel-nakba-exhibit/"">The backlash against the Canadian Museum for Human Rights’ Nakba exhibit is preposterous</a>"
3,11 Canadian stocks for value-focused investors,https://www.theglobeandmail.com/investing/investment-ideas/number-cruncher/article-11-stocks-value-focused-investors-trading-central/,No byline found,No article type found,"<a href=""https://www.theglobeandmail.com/investing/investment-ideas/number-cruncher/article-11-stocks-value-focused-investors-trading-central/"">11 Canadian stocks for value-focused investors</a>"
4,Five things we learned from RBC economist Eric Lascelles,https://www.theglobeandmail.com/business/rob-magazine/article-five-things-we-learned-from-rbc-economist-eric-lascelles/,No byline found,No article type found,"<a href=""https://www.theglobeandmail.com/business/rob-magazine/article-five-things-we-learned-from-rbc-economist-eric-lascelles/"">Five things we learned from RBC economist Eric Lascelles</a>"
5,Steven Guilbeault resigns from cabinet in protest against Carney’s Alberta energy deal,https://www.theglobeandmail.com/politics/article-steven-guilbeault-resigns-from-cabinet/,No byline found,No article type found,"<a href=""https://www.theglobeandmail.com/politics/article-steven-guilbeault-resigns-from-cabinet/"">Steven Guilbeault resigns from cabinet in protest against Carney’s Alberta energy deal</a>"
6,The power of one: A new book shares financial advice for singles,https://www.theglobeandmail.com/investing/personal-finance/article-the-power-of-one-a-new-book-shares-financial-advice-for-singles/,No byline found,No article type found,"<a href=""https://www.theglobeandmail.com/investing/personal-finance/article-the-power-of-one-a-new-book-shares-financial-advice-for-singles/"">The power of one: A new book shares financial advice for singles</a>"
7,"One National Guard member shot in D.C. has died, Trump says",https://www.theglobeandmail.com/world/article-national-guard-shooting-suspect-cia-afghanistan/,No byline found,No article type found,"<a href=""https://www.theglobeandmail.com/world/article-national-guard-shooting-suspect-cia-afghanistan/"">One National Guard member shot in D.C. has died, Trump says</a>"
8,Rogers Sugar delays modernization project at aging Montreal factory,https://www.theglobeandmail.com/business/article-rogers-sugar-delays-modernization-project-at-aging-montreal-factory/,No byline found,No article type found,"<a href=""https://www.theglobeandmail.com/business/article-rogers-sugar-delays-modernization-project-at-aging-montreal-factory/"">Rogers Sugar delays modernization project at aging Montreal factory</a>"
