Rank,Article title,url,Byline,Article type,title_with_link
1,Thursday’s analyst upgrades and downgrades,https://www.theglobeandmail.com/investing/markets/inside-the-market/article-thursdays-analyst-upgrade-and-downgrades/,No byline found,No article type found,"<a href=""https://www.theglobeandmail.com/investing/markets/inside-the-market/article-thursdays-analyst-upgrade-and-downgrades/"">Thursday’s analyst upgrades and downgrades</a>"
2,B.C. centrists seek to revive provincial Liberal brand in wake of Conservative leadership race,https://www.theglobeandmail.com/canada/article-bc-centrists-seek-to-revive-provincial-liberal-brand-in-wake-of/,No byline found,No article type found,"<a href=""https://www.theglobeandmail.com/canada/article-bc-centrists-seek-to-revive-provincial-liberal-brand-in-wake-of/"">B.C. centrists seek to revive provincial Liberal brand in wake of Conservative leadership race</a>"
3,"Best of luck, you retail investors getting sucked into the SpaceX hype",https://www.theglobeandmail.com/business/commentary/article-spacex-ipo-retail-investors/,J. Ari Pandes,Opinion,"<a href=""https://www.theglobeandmail.com/business/commentary/article-spacex-ipo-retail-investors/"">Best of luck, you retail investors getting sucked into the SpaceX hype</a>"
4,The smart retirement planning move is to co-ordinate your RRSP contributions with CPP,https://www.theglobeandmail.com/investing/personal-finance/article-retirement-planning-rrsp-contributions-cpp/,No byline found,Analysis,"<a href=""https://www.theglobeandmail.com/investing/personal-finance/article-retirement-planning-rrsp-contributions-cpp/"">The smart retirement planning move is to co-ordinate your RRSP contributions with CPP</a>"
5,Pierre Poilievre tries on his Captain Canada hat. It looks good on him,https://www.theglobeandmail.com/opinion/article-pierre-poilievre-alberta-referendum-separatism/,No byline found,No article type found,"<a href=""https://www.theglobeandmail.com/opinion/article-pierre-poilievre-alberta-referendum-separatism/"">Pierre Poilievre tries on his Captain Canada hat. It looks good on him</a>"
6,"U.S. will hit Iran ‘very hard tonight,’ Trump warns",https://www.theglobeandmail.com/world/article-us-iran-exchange-fire/,No byline found,No article type found,"<a href=""https://www.theglobeandmail.com/world/article-us-iran-exchange-fire/"">U.S. will hit Iran ‘very hard tonight,’ Trump warns</a>"
7,The strongest women in Canada want you to embrace your strength,https://www.theglobeandmail.com/life/wellness/fitness/article-the-strongest-women-in-canada-want-you-to-embrace-your-strength/,No byline found,No article type found,"<a href=""https://www.theglobeandmail.com/life/wellness/fitness/article-the-strongest-women-in-canada-want-you-to-embrace-your-strength/"">The strongest women in Canada want you to embrace your strength</a>"
8,"At the Snowbirds’ training camp, sky-high magic begins on the ground",https://www.theglobeandmail.com/canada/article-snowbirds-schedule-plans-training-camp-comox-bc-underexposed/,No byline found,No article type found,"<a href=""https://www.theglobeandmail.com/canada/article-snowbirds-schedule-plans-training-camp-comox-bc-underexposed/"">At the Snowbirds’ training camp, sky-high magic begins on the ground</a>"
