Rank,Article title,url,Byline,Article type,title_with_link
1,Tax break to help business owners sell to employees to be made permanent,https://www.theglobeandmail.com/business/article-tax-break-small-business-owners-sell-to-employees-permanent/,No byline found,No article type found,"<a href=""https://www.theglobeandmail.com/business/article-tax-break-small-business-owners-sell-to-employees-permanent/"">Tax break to help business owners sell to employees to be made permanent</a>"
2,Oil hits wartime high of $125 a barrel on reports U.S. considering new attacks on Iran,https://www.theglobeandmail.com/business/international-business/african-and-mideast-business/article-oil-hits-wartime-high-of-125-a-barrel-on-reports-us-considering-new/,No byline found,No article type found,"<a href=""https://www.theglobeandmail.com/business/international-business/african-and-mideast-business/article-oil-hits-wartime-high-of-125-a-barrel-on-reports-us-considering-new/"">Oil hits wartime high of $125 a barrel on reports U.S. considering new attacks on Iran</a>"
3,Scorching new biography of Robert F. Kennedy Jr. exposes the man behind the caricature,https://www.theglobeandmail.com/culture/books/article-scorching-new-biography-of-robert-f-kennedy-jr-exposes-the-man-behind/,No byline found,No article type found,"<a href=""https://www.theglobeandmail.com/culture/books/article-scorching-new-biography-of-robert-f-kennedy-jr-exposes-the-man-behind/"">Scorching new biography of Robert F. Kennedy Jr. exposes the man behind the caricature</a>"
4,Royal Society of Canada’s executive director to step down,https://www.theglobeandmail.com/canada/article-royal-society-of-canada-executive-director-step-down-darren-gilmour/,No byline found,No article type found,"<a href=""https://www.theglobeandmail.com/canada/article-royal-society-of-canada-executive-director-step-down-darren-gilmour/"">Royal Society of Canada’s executive director to step down</a>"
5,Head of agency behind failed federal ‘axe the fax’ medical prescription program dismissed from role,https://www.theglobeandmail.com/business/economy/article-prescribeit-axe-the-fax-executive-salary/,No byline found,No article type found,"<a href=""https://www.theglobeandmail.com/business/economy/article-prescribeit-axe-the-fax-executive-salary/"">Head of agency behind failed federal ‘axe the fax’ medical prescription program dismissed from role</a>"
6,Three ways the spring economic update affects your wallet,https://www.theglobeandmail.com/investing/personal-finance/article-three-ways-the-spring-economic-statement-affects-your-wallet/,No byline found,No article type found,"<a href=""https://www.theglobeandmail.com/investing/personal-finance/article-three-ways-the-spring-economic-statement-affects-your-wallet/"">Three ways the spring economic update affects your wallet</a>"
7,"Housing slump will curb country’s economic growth, Bank of Canada says",https://www.theglobeandmail.com/business/article-housing-slump-will-curb-countrys-economic-growth-bank-of-canada-says/,No byline found,No article type found,"<a href=""https://www.theglobeandmail.com/business/article-housing-slump-will-curb-countrys-economic-growth-bank-of-canada-says/"">Housing slump will curb country’s economic growth, Bank of Canada says</a>"
8,Iranian soccer chief denied entry to Canada,https://www.theglobeandmail.com/canada/article-iranian-soccer-chief-denied-entry-to-canada/,No byline found,No article type found,"<a href=""https://www.theglobeandmail.com/canada/article-iranian-soccer-chief-denied-entry-to-canada/"">Iranian soccer chief denied entry to Canada</a>"
