Rank,Article title,url,Byline,Article type,title_with_link
1,Carney’s cabinet is 100 days into its term. Here’s how it’s changed Canada,https://www.theglobeandmail.com/politics/article-mark-carney-first-100-days/,No byline found,No article type found,"<a href=""https://www.theglobeandmail.com/politics/article-mark-carney-first-100-days/"">Carney’s cabinet is 100 days into its term. Here’s how it’s changed Canada</a>"
2,Health Canada approves updated Pfizer and Moderna COVID-19 vaccines for fall rollout,https://www.theglobeandmail.com/life/article-health-canada-approves-updated-pfizer-and-moderna-covid-19-vaccines/,No byline found,No article type found,"<a href=""https://www.theglobeandmail.com/life/article-health-canada-approves-updated-pfizer-and-moderna-covid-19-vaccines/"">Health Canada approves updated Pfizer and Moderna COVID-19 vaccines for fall rollout</a>"
3,Carney’s cut to PEI tolls is a bridge too far,https://www.theglobeandmail.com/opinion/editorials/article-carneys-cut-to-pei-tolls-are-a-bridge-too-far/,No byline found,No article type found,"<a href=""https://www.theglobeandmail.com/opinion/editorials/article-carneys-cut-to-pei-tolls-are-a-bridge-too-far/"">Carney’s cut to PEI tolls is a bridge too far</a>"
4,Ottawa drops some retaliatory tariffs against the U.S. in bid to reset trade talks,https://www.theglobeandmail.com/politics/article-trump-carney-canada-us-drop-retaliatory-tariffs/,No byline found,No article type found,"<a href=""https://www.theglobeandmail.com/politics/article-trump-carney-canada-us-drop-retaliatory-tariffs/"">Ottawa drops some retaliatory tariffs against the U.S. in bid to reset trade talks</a>"
5,Buyers leverage soft market in deal for two-bedroom Calgary condo,https://www.theglobeandmail.com/real-estate/calgary-and-edmonton/article-calgary-real-estate-condo-alberta/,No byline found,No article type found,"<a href=""https://www.theglobeandmail.com/real-estate/calgary-and-edmonton/article-calgary-real-estate-condo-alberta/"">Buyers leverage soft market in deal for two-bedroom Calgary condo</a>"
6,"Famine grips Gaza City, driven by war and aid restrictions, food crises authority says",https://www.theglobeandmail.com/world/article-famine-gaza-city-israel-war-aid/,No byline found,No article type found,"<a href=""https://www.theglobeandmail.com/world/article-famine-gaza-city-israel-war-aid/"">Famine grips Gaza City, driven by war and aid restrictions, food crises authority says</a>"
7,The bitter truth is that cheaper housing means a retirement crisis for homeowners,https://www.theglobeandmail.com/business/commentary/article-housing-prices-retirement-plan-middle-class/,John Turley-Ewart,Opinion,"<a href=""https://www.theglobeandmail.com/business/commentary/article-housing-prices-retirement-plan-middle-class/"">The bitter truth is that cheaper housing means a retirement crisis for homeowners</a>"
8,Respect has always been central to the American experience. But disrespect explains the country today,https://www.theglobeandmail.com/opinion/article-donald-trump-usa-america-respect-shribman/,David Shribman,Opinion,"<a href=""https://www.theglobeandmail.com/opinion/article-donald-trump-usa-america-respect-shribman/"">Respect has always been central to the American experience. But disrespect explains the country today</a>"
