Rank,Article title,url,Byline,Article type,title_with_link
1,Australia swelters through prolonged heat wave as temperatures near 50 C,https://www.theglobeandmail.com/world/article-australia-record-heat-wave-temperatures/,No byline found,No article type found,"<a href=""https://www.theglobeandmail.com/world/article-australia-record-heat-wave-temperatures/"">Australia swelters through prolonged heat wave as temperatures near 50 C</a>"
2,Dumbbells 101: Try these movements for a stronger core,https://www.theglobeandmail.com/life/wellness/fitness/article-dumbbells-core-workout/,No byline found,No article type found,"<a href=""https://www.theglobeandmail.com/life/wellness/fitness/article-dumbbells-core-workout/"">Dumbbells 101: Try these movements for a stronger core</a>"
3,India and EU clinch ‘mother of all deals’ after nearly 20 years of negotiations,https://www.theglobeandmail.com/business/article-india-eu-trade-deal/,No byline found,No article type found,"<a href=""https://www.theglobeandmail.com/business/article-india-eu-trade-deal/"">India and EU clinch ‘mother of all deals’ after nearly 20 years of negotiations</a>"
4,How much state violence will America accept?,https://www.theglobeandmail.com/opinion/article-ice-state-violence-minneapolis-immigration/,Debra Thompson,Opinion,"<a href=""https://www.theglobeandmail.com/opinion/article-ice-state-violence-minneapolis-immigration/"">How much state violence will America accept?</a>"
5,"Two federal officers fired shots during killing of Alex Pretti, says DHS official",https://www.theglobeandmail.com/world/us-politics/article-minnesota-judge-orders-ice-chief-to-appear-in-court/,No byline found,No article type found,"<a href=""https://www.theglobeandmail.com/world/us-politics/article-minnesota-judge-orders-ice-chief-to-appear-in-court/"">Two federal officers fired shots during killing of Alex Pretti, says DHS official</a>"
6,What could Xi’s latest military purge mean for China’s Taiwan plans?,https://www.theglobeandmail.com/world/article-china-xi-jinping-zhang-youxia-taiwan-military/,No byline found,Analysis,"<a href=""https://www.theglobeandmail.com/world/article-china-xi-jinping-zhang-youxia-taiwan-military/"">What could Xi’s latest military purge mean for China’s Taiwan plans?</a>"
7,‘Trump and civil unrest are undermining confidence’: U.S. dollar slides to a four-year low,https://www.theglobeandmail.com/investing/article-everyone-is-so-jittery-us-dollar-slides-for-fourth-day-as-traders-on/,No byline found,No article type found,"<a href=""https://www.theglobeandmail.com/investing/article-everyone-is-so-jittery-us-dollar-slides-for-fourth-day-as-traders-on/"">‘Trump and civil unrest are undermining confidence’: U.S. dollar slides to a four-year low</a>"
8,"MP Chak Au tenders resignation from Richmond, B.C., city council",https://www.theglobeandmail.com/politics/article-mp-chak-au-tenders-resignation-from-richmond-bc-city-council/,No byline found,No article type found,"<a href=""https://www.theglobeandmail.com/politics/article-mp-chak-au-tenders-resignation-from-richmond-bc-city-council/"">MP Chak Au tenders resignation from Richmond, B.C., city council</a>"
