Rank,Article title,url,Byline,Article type,title_with_link
1,"Economic Outlook 2026: The good, the bad and the downright scary",https://www.theglobeandmail.com/business/rob-magazine/article-economic-outlook-2026-trade-housing-artificial-intelligence/,No byline found,No article type found,"<a href=""https://www.theglobeandmail.com/business/rob-magazine/article-economic-outlook-2026-trade-housing-artificial-intelligence/"">Economic Outlook 2026: The good, the bad and the downright scary</a>"
2,Molson Coors accuses former Canadian staff of ‘complex’ embezzlement scheme,https://www.theglobeandmail.com/business/article-molson-coors-embezzlement-scheme-firkin-hospitality-group-fraud/,No byline found,No article type found,"<a href=""https://www.theglobeandmail.com/business/article-molson-coors-embezzlement-scheme-firkin-hospitality-group-fraud/"">Molson Coors accuses former Canadian staff of ‘complex’ embezzlement scheme</a>"
3,Insider Report: Chairman invests nearly $2-million in this industrial stock,https://www.theglobeandmail.com/investing/markets/inside-the-market/article-insider-report-chairman-invests-nearly-2-million-in-this-industrial/,No byline found,No article type found,"<a href=""https://www.theglobeandmail.com/investing/markets/inside-the-market/article-insider-report-chairman-invests-nearly-2-million-in-this-industrial/"">Insider Report: Chairman invests nearly $2-million in this industrial stock</a>"
4,The backlash against the Canadian Museum for Human Rights’ Nakba exhibit is preposterous,https://www.theglobeandmail.com/opinion/article-canadian-museum-for-human-rights-palestine-israel-nakba-exhibit/,Marsha Lederman,Opinion,"<a href=""https://www.theglobeandmail.com/opinion/article-canadian-museum-for-human-rights-palestine-israel-nakba-exhibit/"">The backlash against the Canadian Museum for Human Rights’ Nakba exhibit is preposterous</a>"
5,Thomas King’s storytelling now feels like a betrayal,https://www.theglobeandmail.com/opinion/article-thomas-king-storytelling-feels-like-a-betrayal-cherokee/,Tanya Talaga,Opinion,"<a href=""https://www.theglobeandmail.com/opinion/article-thomas-king-storytelling-feels-like-a-betrayal-cherokee/"">Thomas King’s storytelling now feels like a betrayal</a>"
6,Halifax bouncer found guilty of manslaughter in 2022 death of bar patron,https://www.theglobeandmail.com/canada/article-halifax-bouncer-guilty-manslaughter-ryan-sawyer/,No byline found,No article type found,"<a href=""https://www.theglobeandmail.com/canada/article-halifax-bouncer-guilty-manslaughter-ryan-sawyer/"">Halifax bouncer found guilty of manslaughter in 2022 death of bar patron</a>"
7,"Business Brief: Major projects, major issues",https://www.theglobeandmail.com/business/article-business-brief-major-projects-major-issues/,No byline found,No article type found,"<a href=""https://www.theglobeandmail.com/business/article-business-brief-major-projects-major-issues/"">Business Brief: Major projects, major issues</a>"
8,Buyer secures four-bedroom Etobicoke house after one day on the market,https://www.theglobeandmail.com/real-estate/toronto/article-etobicoke-house-chestnut-hills-real-estate-toronto/,No byline found,No article type found,"<a href=""https://www.theglobeandmail.com/real-estate/toronto/article-etobicoke-house-chestnut-hills-real-estate-toronto/"">Buyer secures four-bedroom Etobicoke house after one day on the market</a>"
