Rank,Article title,url,Byline,Article type,title_with_link
1,Lutnick says he ‘barely had anything to do with’ Epstein amid calls to resign,https://www.theglobeandmail.com/world/us-politics/article-commerce-secretary-lutnick-epstein-revelations/,No byline found,No article type found,"<a href=""https://www.theglobeandmail.com/world/us-politics/article-commerce-secretary-lutnick-epstein-revelations/"">Lutnick says he ‘barely had anything to do with’ Epstein amid calls to resign</a>"
2,Trump’s bridge threat heralds pain and turmoil for USMCA talks,https://www.theglobeandmail.com/business/commentary/article-trumps-bridge-threat-heralds-pain-and-turmoil-for-usmca-talks/,Lawrence Herman,Opinion,"<a href=""https://www.theglobeandmail.com/business/commentary/article-trumps-bridge-threat-heralds-pain-and-turmoil-for-usmca-talks/"">Trump’s bridge threat heralds pain and turmoil for USMCA talks</a>"
3,Federal ‘axe the fax’ e-prescription service built with Telus Health to shutter after $250-million spent,https://www.theglobeandmail.com/business/economy/article-federal-axe-the-fax-e-prescribing-service-built-with-telus-health-to/,No byline found,No article type found,"<a href=""https://www.theglobeandmail.com/business/economy/article-federal-axe-the-fax-e-prescribing-service-built-with-telus-health-to/"">Federal ‘axe the fax’ e-prescription service built with Telus Health to shutter after $250-million spent</a>"
4,Canada’s journey to Olympic men’s hockey glory had an important stopover in Halifax,https://www.theglobeandmail.com/sports/olympics/article-canada-olympic-hockey-halifax-crosby-mackinnon/,No byline found,No article type found,"<a href=""https://www.theglobeandmail.com/sports/olympics/article-canada-olympic-hockey-halifax-crosby-mackinnon/"">Canada’s journey to Olympic men’s hockey glory had an important stopover in Halifax</a>"
5,Canada takes frustrating 5-0 loss to U.S. in women’s hockey at Winter Olympics,https://www.theglobeandmail.com/sports/olympics/article-canada-us-womens-hockey-milan-cortina/,No byline found,No article type found,"<a href=""https://www.theglobeandmail.com/sports/olympics/article-canada-us-womens-hockey-milan-cortina/"">Canada takes frustrating 5-0 loss to U.S. in women’s hockey at Winter Olympics</a>"
6,Garish and silly ‘Wuthering Heights’ strands Margot Robbie and Jacob Elordi on the moors forevermore,https://www.theglobeandmail.com/culture/film-and-tv/film/article-wuthering-heights-margot-robbie-jacob-elordi/,No byline found,No article type found,"<a href=""https://www.theglobeandmail.com/culture/film-and-tv/film/article-wuthering-heights-margot-robbie-jacob-elordi/"">Garish and silly ‘Wuthering Heights’ strands Margot Robbie and Jacob Elordi on the moors forevermore</a>"
7,Trump is going through a bad patch – but don’t expect him to change,https://www.theglobeandmail.com/world/us-politics/article-trump-bad-bunny-hunter-hess/,No byline found,Analysis,"<a href=""https://www.theglobeandmail.com/world/us-politics/article-trump-bad-bunny-hunter-hess/"">Trump is going through a bad patch – but don’t expect him to change</a>"
8,France is ditching American tech. When will Canada?,https://www.theglobeandmail.com/business/commentary/article-france-is-ditching-american-tech-when-will-canada/,Vass Bednar,Opinion,"<a href=""https://www.theglobeandmail.com/business/commentary/article-france-is-ditching-american-tech-when-will-canada/"">France is ditching American tech. When will Canada?</a>"
