Rank,Article title,url,Byline,Article type,title_with_link
1,Lots of other countries have charters of rights. None has anything like the notwithstanding clause,https://www.theglobeandmail.com/opinion/article-lots-of-other-countries-have-charters-of-rights-none-has-anything-like/,Andrew Coyne,Opinion,"<a href=""https://www.theglobeandmail.com/opinion/article-lots-of-other-countries-have-charters-of-rights-none-has-anything-like/"">Lots of other countries have charters of rights. None has anything like the notwithstanding clause</a>"
2,23 well-performing Canadian ETFs with reasonable fees,https://www.theglobeandmail.com/investing/investment-ideas/number-cruncher/article-canadian-etfs-reasonable-fees-cruncher/,No byline found,No article type found,"<a href=""https://www.theglobeandmail.com/investing/investment-ideas/number-cruncher/article-canadian-etfs-reasonable-fees-cruncher/"">23 well-performing Canadian ETFs with reasonable fees</a>"
3,"War is not a game, Mr. Trump",https://www.theglobeandmail.com/opinion/article-trump-iran-war-middle-east/,Marsha Lederman,Opinion,"<a href=""https://www.theglobeandmail.com/opinion/article-trump-iran-war-middle-east/"">War is not a game, Mr. Trump</a>"
4,"Enbridge plans to fund policing costs for Line 5 pipeline reroute in U.S., raising concerns",https://www.theglobeandmail.com/business/article-enbridge-plans-to-fund-policing-costs-for-line-5-pipeline-reroute-in/,No byline found,No article type found,"<a href=""https://www.theglobeandmail.com/business/article-enbridge-plans-to-fund-policing-costs-for-line-5-pipeline-reroute-in/"">Enbridge plans to fund policing costs for Line 5 pipeline reroute in U.S., raising concerns</a>"
5,Ottawa hasn’t learned its lesson on immigration,https://www.theglobeandmail.com/opinion/editorials/article-ottawa-hasnt-learned-its-lesson-on-immigration/,No byline found,No article type found,"<a href=""https://www.theglobeandmail.com/opinion/editorials/article-ottawa-hasnt-learned-its-lesson-on-immigration/"">Ottawa hasn’t learned its lesson on immigration</a>"
6,Thursday’s analyst upgrades and downgrades,https://www.theglobeandmail.com/investing/markets/inside-the-market/article-thursdays-analyst-upgrades-and-downgrades-301/,No byline found,No article type found,"<a href=""https://www.theglobeandmail.com/investing/markets/inside-the-market/article-thursdays-analyst-upgrades-and-downgrades-301/"">Thursday’s analyst upgrades and downgrades</a>"
7,How tech billionaires are alienating neighbours in Toronto’s idyllic Wychwood Park,https://www.theglobeandmail.com/business/rob-magazine/article-how-tech-billionaires-are-alienating-neighbours-in-torontos-idyllic/,No byline found,No article type found,"<a href=""https://www.theglobeandmail.com/business/rob-magazine/article-how-tech-billionaires-are-alienating-neighbours-in-torontos-idyllic/"">How tech billionaires are alienating neighbours in Toronto’s idyllic Wychwood Park</a>"
8,"More kindergartners have a developmental vulnerability since pandemic, research shows",https://www.theglobeandmail.com/canada/article-kindergarten-developmental-vulnerability-pandemic-child-poverty/,No byline found,No article type found,"<a href=""https://www.theglobeandmail.com/canada/article-kindergarten-developmental-vulnerability-pandemic-child-poverty/"">More kindergartners have a developmental vulnerability since pandemic, research shows</a>"
