Rank,Article title,url,Byline,Article type,title_with_link
1,Oysterman Rodney Clark created ‘joyful chaos’ at his Toronto eatery,https://www.theglobeandmail.com/canada/article-rodney-clark-oysterman-pei-toronto-restaurant/,No byline found,No article type found,"<a href=""https://www.theglobeandmail.com/canada/article-rodney-clark-oysterman-pei-toronto-restaurant/"">Oysterman Rodney Clark created ‘joyful chaos’ at his Toronto eatery</a>"
2,"Proposed updates to B.C. heritage laws could bring ‘legal troubles,’ critics warn",https://www.theglobeandmail.com/canada/british-columbia/article-proposed-updates-to-bc-heritage-laws-could-bring-legal-troubles/,No byline found,No article type found,"<a href=""https://www.theglobeandmail.com/canada/british-columbia/article-proposed-updates-to-bc-heritage-laws-could-bring-legal-troubles/"">Proposed updates to B.C. heritage laws could bring ‘legal troubles,’ critics warn</a>"
3,There was only one place that could soothe us: Sicily’s Cefalu,https://www.theglobeandmail.com/life/travel/article-italy-travel-sicily/,No byline found,No article type found,"<a href=""https://www.theglobeandmail.com/life/travel/article-italy-travel-sicily/"">There was only one place that could soothe us: Sicily’s Cefalu</a>"
4,"G20 leaders release declaration on climate change and debt, defying U.S. pressure",https://www.theglobeandmail.com/world/article-g20-declaration-defy-trump-climate-change-debt-relief/,No byline found,No article type found,"<a href=""https://www.theglobeandmail.com/world/article-g20-declaration-defy-trump-climate-change-debt-relief/"">G20 leaders release declaration on climate change and debt, defying U.S. pressure</a>"
5,An overachiever’s guide to holiday hosting,https://www.theglobeandmail.com/life/style/style-magazine/article-an-overachievers-guide-to-holiday-hosting/,No byline found,No article type found,"<a href=""https://www.theglobeandmail.com/life/style/style-magazine/article-an-overachievers-guide-to-holiday-hosting/"">An overachiever’s guide to holiday hosting</a>"
6,"Former Canadian director of Philadelphia Art Museum accused by board of theft, court filings show",https://www.theglobeandmail.com/culture/article-sasha-suda-philadelphia-art-museum-dismissal-lawsuit-theft-allegations/,No byline found,No article type found,"<a href=""https://www.theglobeandmail.com/culture/article-sasha-suda-philadelphia-art-museum-dismissal-lawsuit-theft-allegations/"">Former Canadian director of Philadelphia Art Museum accused by board of theft, court filings show</a>"
7,Ottawa is pressing Nutrien to change course on building a potash export terminal in the U.S.,https://www.theglobeandmail.com/business/economy/article-ottawa-nutrien-potash-export-terminal-in-the-us/,No byline found,No article type found,"<a href=""https://www.theglobeandmail.com/business/economy/article-ottawa-nutrien-potash-export-terminal-in-the-us/"">Ottawa is pressing Nutrien to change course on building a potash export terminal in the U.S.</a>"
8,Taiwanese official warns Carney boosting ties with China will leave Canada vulnerable to coercion,https://www.theglobeandmail.com/politics/article-taiwan-canada-china-relationship-japan-retaliation/,No byline found,No article type found,"<a href=""https://www.theglobeandmail.com/politics/article-taiwan-canada-china-relationship-japan-retaliation/"">Taiwanese official warns Carney boosting ties with China will leave Canada vulnerable to coercion</a>"
