Rank,Article title,url,Byline,Article type,title_with_link
1,Violence in Canadian schools is reaching a tipping point. What needs to change?,https://www.theglobeandmail.com/opinion/article-violence-canadian-schools-students-teachers-solutions/,Naomi Buck,Opinion,"<a href=""https://www.theglobeandmail.com/opinion/article-violence-canadian-schools-students-teachers-solutions/"">Violence in Canadian schools is reaching a tipping point. What needs to change?</a>"
2,"If nothing else, Danielle Smith is a disruptor",https://www.theglobeandmail.com/opinion/article-if-nothing-else-danielle-smith-is-a-disruptor/,Robyn Urback,Opinion,"<a href=""https://www.theglobeandmail.com/opinion/article-if-nothing-else-danielle-smith-is-a-disruptor/"">If nothing else, Danielle Smith is a disruptor</a>"
3,"Explore The Globe 100 book archive, a complete collection of our annual list",https://www.theglobeandmail.com/culture/books/article-globe-100-archive-best-book-recommendations-lists/,No byline found,No article type found,"<a href=""https://www.theglobeandmail.com/culture/books/article-globe-100-archive-best-book-recommendations-lists/"">Explore The Globe 100 book archive, a complete collection of our annual list</a>"
4,"As a historic mission nears, astronaut Jeremy Hansen explains why Canada is moonward bound",https://www.theglobeandmail.com/canada/science/article-artemis-ii-mission-moon-nasa-orion-capsule-astronaut-jeremy-hansen/,No byline found,No article type found,"<a href=""https://www.theglobeandmail.com/canada/science/article-artemis-ii-mission-moon-nasa-orion-capsule-astronaut-jeremy-hansen/"">As a historic mission nears, astronaut Jeremy Hansen explains why Canada is moonward bound</a>"
5,Ukraine’s drones keep enemy soldiers and civilians weary,https://www.theglobeandmail.com/world/article-drone-combat-russia-ukraine-war-photo-essay/,No byline found,No article type found,"<a href=""https://www.theglobeandmail.com/world/article-drone-combat-russia-ukraine-war-photo-essay/"">Ukraine’s drones keep enemy soldiers and civilians weary</a>"
6,"Ukraine’s top peace negotiator quits after anti-corruption raid, deepening political crisis",https://www.theglobeandmail.com/world/article-ukraine-crisis-corruption-anti-graft-police/,No byline found,No article type found,"<a href=""https://www.theglobeandmail.com/world/article-ukraine-crisis-corruption-anti-graft-police/"">Ukraine’s top peace negotiator quits after anti-corruption raid, deepening political crisis</a>"
7,Parts of Ontario brace for up to 70 cm of snow as storm lingers into weekend,https://www.theglobeandmail.com/canada/article-ontario-snow-storm/,No byline found,No article type found,"<a href=""https://www.theglobeandmail.com/canada/article-ontario-snow-storm/"">Parts of Ontario brace for up to 70 cm of snow as storm lingers into weekend</a>"
8,The Globe 100: The best books of 2025,https://www.theglobeandmail.com/culture/books/article-globe-100-the-best-books-to-read-2025-3/,No byline found,No article type found,"<a href=""https://www.theglobeandmail.com/culture/books/article-globe-100-the-best-books-to-read-2025-3/"">The Globe 100: The best books of 2025</a>"
