Rank,Article title,url,Byline,Article type,title_with_link
1,Mad King Trump would break the world to gain Greenland,https://www.theglobeandmail.com/politics/opinion/article-mad-king-trump-would-break-the-world-to-gain-greenland/,Campbell Clark,Opinion,"<a href=""https://www.theglobeandmail.com/politics/opinion/article-mad-king-trump-would-break-the-world-to-gain-greenland/"">Mad King Trump would break the world to gain Greenland</a>"
2,Canada weighs plans to send soldiers to Greenland as show of NATO solidarity,https://www.theglobeandmail.com/politics/article-canada-soldiers-greenland-nato-training-denmark-tariffs-donald-trump/,No byline found,No article type found,"<a href=""https://www.theglobeandmail.com/politics/article-canada-soldiers-greenland-nato-training-denmark-tariffs-donald-trump/"">Canada weighs plans to send soldiers to Greenland as show of NATO solidarity</a>"
3,"Trump, other global leaders heading to Davos for World Economic Forum",https://www.theglobeandmail.com/business/article-davos-world-economic-forum-opens-donald-trump-inequality-trade/,No byline found,No article type found,"<a href=""https://www.theglobeandmail.com/business/article-davos-world-economic-forum-opens-donald-trump-inequality-trade/"">Trump, other global leaders heading to Davos for World Economic Forum</a>"
4,Six portfolios for dividend investors to ponder,https://www.theglobeandmail.com/investing/markets/inside-the-market/article-six-portfolios-for-dividend-investors-to-ponder/,No byline found,No article type found,"<a href=""https://www.theglobeandmail.com/investing/markets/inside-the-market/article-six-portfolios-for-dividend-investors-to-ponder/"">Six portfolios for dividend investors to ponder</a>"
5,"‘Sour start to 2026′ for Canadian economy, says BMO strategist",https://www.theglobeandmail.com/investing/markets/inside-the-market/article-sour-start-to-2026-for-canadian-economy-says-bmo-strategist/,No byline found,No article type found,"<a href=""https://www.theglobeandmail.com/investing/markets/inside-the-market/article-sour-start-to-2026-for-canadian-economy-says-bmo-strategist/"">‘Sour start to 2026′ for Canadian economy, says BMO strategist</a>"
6,Monday’s analyst upgrades and downgrades,https://www.theglobeandmail.com/investing/markets/inside-the-market/article-mondays-analyst-upgrades-and-downgrades-256/,No byline found,No article type found,"<a href=""https://www.theglobeandmail.com/investing/markets/inside-the-market/article-mondays-analyst-upgrades-and-downgrades-256/"">Monday’s analyst upgrades and downgrades</a>"
7,A 2038 Canadian Olympic bid could kick start a national rejuvenation project,https://www.theglobeandmail.com/sports/article-2038-canadian-olympic-bid-national-rejuvenation-project/,Cathal Kelly,Opinion,"<a href=""https://www.theglobeandmail.com/sports/article-2038-canadian-olympic-bid-national-rejuvenation-project/"">A 2038 Canadian Olympic bid could kick start a national rejuvenation project</a>"
8,Supreme Court weighs road safety against racial profiling in ‘driving while Black’ case,https://www.theglobeandmail.com/canada/article-supreme-court-driving-while-black-racial-profiling/,No byline found,No article type found,"<a href=""https://www.theglobeandmail.com/canada/article-supreme-court-driving-while-black-racial-profiling/"">Supreme Court weighs road safety against racial profiling in ‘driving while Black’ case</a>"
