Rank,Article title,url,Byline,Article type,title_with_link
1,Donald Trump is having Nobel Peace Prize delusions,https://www.theglobeandmail.com/opinion/article-donald-trumps-nobel-peace-prize-delusions/,Nina Khrushcheva,Opinion,"<a href=""https://www.theglobeandmail.com/opinion/article-donald-trumps-nobel-peace-prize-delusions/"">Donald Trump is having Nobel Peace Prize delusions</a>"
2,"Treasure hunters in Cape Breton see therapy as the real prize, not lost pirate gold. Still, they hope for both",https://www.theglobeandmail.com/life/article-treasure-hunters-cape-breton-pirate-gold-mira-river/,No byline found,No article type found,"<a href=""https://www.theglobeandmail.com/life/article-treasure-hunters-cape-breton-pirate-gold-mira-river/"">Treasure hunters in Cape Breton see therapy as the real prize, not lost pirate gold. Still, they hope for both</a>"
3,Miriam Toews finds beauty in the uncertain,https://www.theglobeandmail.com/arts/article-miriam-toews-memoir-a-truce-that-is-not-peace-writing-grief/,No byline found,No article type found,"<a href=""https://www.theglobeandmail.com/arts/article-miriam-toews-memoir-a-truce-that-is-not-peace-writing-grief/"">Miriam Toews finds beauty in the uncertain</a>"
4,Hospital attack a reminder that Netanyahu won’t let international pressure lead to a ceasefire this time,https://www.theglobeandmail.com/world/article-hospital-attack-a-reminder-that-netanyahu-wont-let-international/,No byline found,Analysis,"<a href=""https://www.theglobeandmail.com/world/article-hospital-attack-a-reminder-that-netanyahu-wont-let-international/"">Hospital attack a reminder that Netanyahu won’t let international pressure lead to a ceasefire this time</a>"
5,The bitter truth is that cheaper housing means a retirement crisis for homeowners,https://www.theglobeandmail.com/business/commentary/article-housing-prices-retirement-plan-middle-class/,John Turley-Ewart,Opinion,"<a href=""https://www.theglobeandmail.com/business/commentary/article-housing-prices-retirement-plan-middle-class/"">The bitter truth is that cheaper housing means a retirement crisis for homeowners</a>"
6,"Canada’s military operation in Latvia will be extended by three years, Carney says",https://www.theglobeandmail.com/politics/article-canada-military-operation-latvia-extended-mark-carney/,No byline found,No article type found,"<a href=""https://www.theglobeandmail.com/politics/article-canada-military-operation-latvia-extended-mark-carney/"">Canada’s military operation in Latvia will be extended by three years, Carney says</a>"
7,Benedict Cumberbatch and Olivia Colman should break up with the agents who sent them The Roses,https://www.theglobeandmail.com/arts/film/reviews/article-the-roses-benedict-cumberbatch-olivia-colman/,No byline found,No article type found,"<a href=""https://www.theglobeandmail.com/arts/film/reviews/article-the-roses-benedict-cumberbatch-olivia-colman/"">Benedict Cumberbatch and Olivia Colman should break up with the agents who sent them The Roses</a>"
8,"LeBlanc meets Lutnick in Washington, aiming to restart trade talks",https://www.theglobeandmail.com/world/us-politics/article-leblanc-met-lutnick-washington-trade-talks/,No byline found,No article type found,"<a href=""https://www.theglobeandmail.com/world/us-politics/article-leblanc-met-lutnick-washington-trade-talks/"">LeBlanc meets Lutnick in Washington, aiming to restart trade talks</a>"
