Rank,Article title,url,Byline,Article type,title_with_link
1,The State of the Union was a zoo – and Team USA the monkeys,https://www.theglobeandmail.com/sports/article-state-of-the-union-nhl-mens-team-usa-hockey-players/,Cathal Kelly,Opinion,"<a href=""https://www.theglobeandmail.com/sports/article-state-of-the-union-nhl-mens-team-usa-hockey-players/"">The State of the Union was a zoo – and Team USA the monkeys</a>"
2,Can a roast chicken dinner achieve restaurant-level taste? We tried,https://www.theglobeandmail.com/life/style/food-and-drink/article-can-a-roast-chicken-dinner-achieve-restaurant-level-taste-we-tried/,No byline found,No article type found,"<a href=""https://www.theglobeandmail.com/life/style/food-and-drink/article-can-a-roast-chicken-dinner-achieve-restaurant-level-taste-we-tried/"">Can a roast chicken dinner achieve restaurant-level taste? We tried</a>"
3,"In Mexico’s small towns and rural areas, cartel retaliation has residents on edge",https://www.theglobeandmail.com/world/article-mexico-small-towns-rural-areas-cartel-retaliation/,No byline found,No article type found,"<a href=""https://www.theglobeandmail.com/world/article-mexico-small-towns-rural-areas-cartel-retaliation/"">In Mexico’s small towns and rural areas, cartel retaliation has residents on edge</a>"
4,"Nvidia’s results beat estimates, but Wall Street wants more cash return",https://www.theglobeandmail.com/business/technology/article-nvidia-quarterly-earnings-wall-street-markets/,No byline found,No article type found,"<a href=""https://www.theglobeandmail.com/business/technology/article-nvidia-quarterly-earnings-wall-street-markets/"">Nvidia’s results beat estimates, but Wall Street wants more cash return</a>"
5,Sellers climb down on price as buyers unimpressed by house size,https://www.theglobeandmail.com/real-estate/toronto/article-sellers-climb-down-on-price-as-buyers-unimpressed-by-house-size/,No byline found,No article type found,"<a href=""https://www.theglobeandmail.com/real-estate/toronto/article-sellers-climb-down-on-price-as-buyers-unimpressed-by-house-size/"">Sellers climb down on price as buyers unimpressed by house size</a>"
6,Classes cancelled at Alberta high school after junior hockey players killed in crash,https://www.theglobeandmail.com/canada/alberta/article-classes-cancelled-at-alberta-high-school-after-junior-hockey-players/,No byline found,No article type found,"<a href=""https://www.theglobeandmail.com/canada/alberta/article-classes-cancelled-at-alberta-high-school-after-junior-hockey-players/"">Classes cancelled at Alberta high school after junior hockey players killed in crash</a>"
7,Why Canadian universities are cutting sports in a race to fix fragile funding models,https://www.theglobeandmail.com/sports/article-canadian-universities-sports-cuts-mcgill-sfu-usports/,No byline found,No article type found,"<a href=""https://www.theglobeandmail.com/sports/article-canadian-universities-sports-cuts-mcgill-sfu-usports/"">Why Canadian universities are cutting sports in a race to fix fragile funding models</a>"
8,Toronto General Hospital has been ranked second best in the world,https://www.theglobeandmail.com/canada/article-toronto-general-hospital-world-ranking/,No byline found,No article type found,"<a href=""https://www.theglobeandmail.com/canada/article-toronto-general-hospital-world-ranking/"">Toronto General Hospital has been ranked second best in the world</a>"
