Rank,Article title,url,Byline,Article type,title_with_link
1,Conspiracy to traffic Toronto Police uniforms alleged in Project South police corruption probe,https://www.theglobeandmail.com/canada/article-conspiracy-to-traffic-toronto-police-uniforms-alleged-in-project-south/,No byline found,No article type found,"<a href=""https://www.theglobeandmail.com/canada/article-conspiracy-to-traffic-toronto-police-uniforms-alleged-in-project-south/"">Conspiracy to traffic Toronto Police uniforms alleged in Project South police corruption probe</a>"
2,"Where’s Mark Carney? Sadly, not where he should be: the Olympics",https://www.theglobeandmail.com/sports/article-wheres-mark-carney-sadly-not-where-he-should-be-the-olympics/,Cathal Kelly,Opinion,"<a href=""https://www.theglobeandmail.com/sports/article-wheres-mark-carney-sadly-not-where-he-should-be-the-olympics/"">Where’s Mark Carney? Sadly, not where he should be: the Olympics</a>"
3,What happened at the Olympics today,https://www.theglobeandmail.com/sports/olympics/article-winter-olympics-2026-day-3-live-results-medals-canada/,No byline found,No article type found,"<a href=""https://www.theglobeandmail.com/sports/olympics/article-winter-olympics-2026-day-3-live-results-medals-canada/"">What happened at the Olympics today</a>"
4,This tiny B.C. city is one of the most livable in Canada – for those who can find it,https://www.theglobeandmail.com/business/article-canada-most-livable-small-city-pitt-meadows/,No byline found,No article type found,"<a href=""https://www.theglobeandmail.com/business/article-canada-most-livable-small-city-pitt-meadows/"">This tiny B.C. city is one of the most livable in Canada – for those who can find it</a>"
5,"Even with a vibe interpreter, ice dancing is difficult to decipher",https://www.theglobeandmail.com/sports/olympics/article-even-with-a-vibe-interpreter-figure-skating-remains-a-world-thats/,Cathal Kelly,Opinion,"<a href=""https://www.theglobeandmail.com/sports/olympics/article-even-with-a-vibe-interpreter-figure-skating-remains-a-world-thats/"">Even with a vibe interpreter, ice dancing is difficult to decipher</a>"
6,"Carney, Ford discussed idea of an early federal election to secure majority, sources say",https://www.theglobeandmail.com/politics/article-ford-advises-carney-securing-majority-would-bolster-economic-stability/,No byline found,No article type found,"<a href=""https://www.theglobeandmail.com/politics/article-ford-advises-carney-securing-majority-would-bolster-economic-stability/"">Carney, Ford discussed idea of an early federal election to secure majority, sources say</a>"
7,CPP payments slow in 2026 as retirees cope with high living costs,https://www.theglobeandmail.com/investing/personal-finance/retirement/article-cpp-payments-2026-retirement-cost-of-living-pension/,No byline found,No article type found,"<a href=""https://www.theglobeandmail.com/investing/personal-finance/retirement/article-cpp-payments-2026-retirement-cost-of-living-pension/"">CPP payments slow in 2026 as retirees cope with high living costs</a>"
8,Queer BDSM romcom Pillion is the Valentine’s Day movie you didn’t know you needed,https://www.theglobeandmail.com/culture/film-and-tv/film/article-pillion-review-queer-bdsm-romcom/,No byline found,No article type found,"<a href=""https://www.theglobeandmail.com/culture/film-and-tv/film/article-pillion-review-queer-bdsm-romcom/"">Queer BDSM romcom Pillion is the Valentine’s Day movie you didn’t know you needed</a>"
