Rank,Article title,url,Byline,Article type,title_with_link
1,What Trump’s pledge to get Venezuelan oil moving could mean for Canadian industry,https://www.theglobeandmail.com/business/article-trump-venezuela-oil-crude-canada-industry/,No byline found,No article type found,"<a href=""https://www.theglobeandmail.com/business/article-trump-venezuela-oil-crude-canada-industry/"">What Trump’s pledge to get Venezuelan oil moving could mean for Canadian industry</a>"
2,"How a self-employed accountant grew her TFSA from $190,000 to $575,000 in a year",https://www.theglobeandmail.com/investing/investment-ideas/article-accountants-sector-rotation-strategy-results-in-a-skyrocketing-tfsa/,No byline found,No article type found,"<a href=""https://www.theglobeandmail.com/investing/investment-ideas/article-accountants-sector-rotation-strategy-results-in-a-skyrocketing-tfsa/"">How a self-employed accountant grew her TFSA from $190,000 to $575,000 in a year</a>"
3,Is it illegal to stop before turning right at a green light?,https://www.theglobeandmail.com/drive/culture/article-is-it-illegal-to-stop-before-turning-right-at-a-green-light/,No byline found,No article type found,"<a href=""https://www.theglobeandmail.com/drive/culture/article-is-it-illegal-to-stop-before-turning-right-at-a-green-light/"">Is it illegal to stop before turning right at a green light?</a>"
4,"Canada, China plot course for more oil, gas and uranium exports",https://www.theglobeandmail.com/politics/article-carney-china-trade-trip/,No byline found,No article type found,"<a href=""https://www.theglobeandmail.com/politics/article-carney-china-trade-trip/"">Canada, China plot course for more oil, gas and uranium exports</a>"
5,What cost-of-living crisis? The data tell a different story,https://www.theglobeandmail.com/business/commentary/article-cost-of-living-crisis-data-perception/,Claude Lavoie,Opinion,"<a href=""https://www.theglobeandmail.com/business/commentary/article-cost-of-living-crisis-data-perception/"">What cost-of-living crisis? The data tell a different story</a>"
6,How Canada can use China to deliver a counterpunch to Trump,https://www.theglobeandmail.com/business/commentary/article-canada-china-carney-trump-beijing-trade-ev-xi-jinping/,Drew Fagan,Opinion,"<a href=""https://www.theglobeandmail.com/business/commentary/article-canada-china-carney-trump-beijing-trade-ev-xi-jinping/"">How Canada can use China to deliver a counterpunch to Trump</a>"
7,"Canada’s response to the Olympic skeleton ‘scandal’ should be, in a word: tough",https://www.theglobeandmail.com/sports/article-canada-skeleton-scandal-us-denmark-uhlaender-milan-olympics-2026/,Cathal Kelly,Opinion,"<a href=""https://www.theglobeandmail.com/sports/article-canada-skeleton-scandal-us-denmark-uhlaender-milan-olympics-2026/"">Canada’s response to the Olympic skeleton ‘scandal’ should be, in a word: tough</a>"
8,Rebuilding relations with China is a gamble Mark Carney has to take,https://www.theglobeandmail.com/opinion/article-rebuilding-relations-with-china-is-a-gamble-mark-carney-has-to-take/,Lawrence Martin,Opinion,"<a href=""https://www.theglobeandmail.com/opinion/article-rebuilding-relations-with-china-is-a-gamble-mark-carney-has-to-take/"">Rebuilding relations with China is a gamble Mark Carney has to take</a>"
