Rank,Article title,url,Byline,Article type,title_with_link
1,Kayaking the remote coast of Mexico’s Baja California Peninsula reveals hidden beaches and wild landscapes,https://www.theglobeandmail.com/life/travel/article-kayaking-the-remote-coast-of-mexicos-baja-california-peninsula-reveals/,No byline found,No article type found,"<a href=""https://www.theglobeandmail.com/life/travel/article-kayaking-the-remote-coast-of-mexicos-baja-california-peninsula-reveals/"">Kayaking the remote coast of Mexico’s Baja California Peninsula reveals hidden beaches and wild landscapes</a>"
2,Canada defeats Germany in women’s hockey to advance to semis; Dubreuil wins bronze in men’s 500m speed skating,https://www.theglobeandmail.com/sports/olympics/article-winter-olympics-2026-live-updates-canada-vs-germany-womens-hockey/,No byline found,No article type found,"<a href=""https://www.theglobeandmail.com/sports/olympics/article-winter-olympics-2026-live-updates-canada-vs-germany-womens-hockey/"">Canada defeats Germany in women’s hockey to advance to semis; Dubreuil wins bronze in men’s 500m speed skating</a>"
3,Collapse of Ontario real estate firm leaves investors looking for answers,https://www.theglobeandmail.com/canada/article-scott-reid-heritage-properties-ontario-real-estate-investors/,No byline found,No article type found,"<a href=""https://www.theglobeandmail.com/canada/article-scott-reid-heritage-properties-ontario-real-estate-investors/"">Collapse of Ontario real estate firm leaves investors looking for answers</a>"
4,"Medals or not, at this Olympics it’s good to be Canadian, say athletes",https://www.theglobeandmail.com/sports/olympics/article-olympics-canadian-athletes-milan-cortina-winter-games/,No byline found,No article type found,"<a href=""https://www.theglobeandmail.com/sports/olympics/article-olympics-canadian-athletes-milan-cortina-winter-games/"">Medals or not, at this Olympics it’s good to be Canadian, say athletes</a>"
5,"Curler Marc Kennedy regrets language in heated exchange with Sweden’s Eriksson, but will not apologize",https://www.theglobeandmail.com/world/article-winter-olympics-2026-curler-marc-kennedy-heated-exchange-swedens/,No byline found,No article type found,"<a href=""https://www.theglobeandmail.com/world/article-winter-olympics-2026-curler-marc-kennedy-heated-exchange-swedens/"">Curler Marc Kennedy regrets language in heated exchange with Sweden’s Eriksson, but will not apologize</a>"
6,"In Cuba, wellies shed light on the island’s hardships as Canada suspends flights",https://www.theglobeandmail.com/life/style/travel/article-cuba-wellies-boots-travel-oil-sanctions/,No byline found,No article type found,"<a href=""https://www.theglobeandmail.com/life/style/travel/article-cuba-wellies-boots-travel-oil-sanctions/"">In Cuba, wellies shed light on the island’s hardships as Canada suspends flights</a>"
7,Vancouver residents push back on plan they say will obscure rare mountain view,https://www.theglobeandmail.com/real-estate/vancouver/article-vancouver-residents-push-back-on-plan-they-say-will-obscure-rare/,No byline found,No article type found,"<a href=""https://www.theglobeandmail.com/real-estate/vancouver/article-vancouver-residents-push-back-on-plan-they-say-will-obscure-rare/"">Vancouver residents push back on plan they say will obscure rare mountain view</a>"
8,Canada’s men’s curling team says Sweden had plans to catch opponents out for infractions,https://www.theglobeandmail.com/sports/olympics/article-winter-olympics-2026-canada-mens-curling-controversy/,No byline found,No article type found,"<a href=""https://www.theglobeandmail.com/sports/olympics/article-winter-olympics-2026-canada-mens-curling-controversy/"">Canada’s men’s curling team says Sweden had plans to catch opponents out for infractions</a>"
