Rank,Article title,url,Byline,Article type,title_with_link
1,Tax break to help business owners sell to employees to be made permanent,https://www.theglobeandmail.com/business/article-tax-break-small-business-owners-sell-to-employees-permanent/,No byline found,No article type found,"<a href=""https://www.theglobeandmail.com/business/article-tax-break-small-business-owners-sell-to-employees-permanent/"">Tax break to help business owners sell to employees to be made permanent</a>"
2,Oil hits wartime high of $125 a barrel on reports U.S. considering new attacks on Iran,https://www.theglobeandmail.com/business/international-business/african-and-mideast-business/article-oil-hits-wartime-high-of-125-a-barrel-on-reports-us-considering-new/,No byline found,No article type found,"<a href=""https://www.theglobeandmail.com/business/international-business/african-and-mideast-business/article-oil-hits-wartime-high-of-125-a-barrel-on-reports-us-considering-new/"">Oil hits wartime high of $125 a barrel on reports U.S. considering new attacks on Iran</a>"
3,Morning Update: Playing ball with ticket regulations,https://www.theglobeandmail.com/canada/article-morning-update-playing-ball-with-ticket-regulations/,No byline found,No article type found,"<a href=""https://www.theglobeandmail.com/canada/article-morning-update-playing-ball-with-ticket-regulations/"">Morning Update: Playing ball with ticket regulations</a>"
4,Scorching new biography of Robert F. Kennedy Jr. exposes the man behind the caricature,https://www.theglobeandmail.com/culture/books/article-scorching-new-biography-of-robert-f-kennedy-jr-exposes-the-man-behind/,No byline found,No article type found,"<a href=""https://www.theglobeandmail.com/culture/books/article-scorching-new-biography-of-robert-f-kennedy-jr-exposes-the-man-behind/"">Scorching new biography of Robert F. Kennedy Jr. exposes the man behind the caricature</a>"
5,Psychiatry chairs at medical schools oppose expanding MAID for mental illness,https://www.theglobeandmail.com/canada/article-psychiatry-chairs-at-medical-schools-oppose-expanding-maid-for-mental/,No byline found,No article type found,"<a href=""https://www.theglobeandmail.com/canada/article-psychiatry-chairs-at-medical-schools-oppose-expanding-maid-for-mental/"">Psychiatry chairs at medical schools oppose expanding MAID for mental illness</a>"
6,Success rate for basic training in Canadian military drops,https://www.theglobeandmail.com/politics/article-success-rate-for-basic-training-in-canadian-military-drops-report-says/,No byline found,No article type found,"<a href=""https://www.theglobeandmail.com/politics/article-success-rate-for-basic-training-in-canadian-military-drops-report-says/"">Success rate for basic training in Canadian military drops</a>"
7,Donald Trump is not an aberration. He is America,https://www.theglobeandmail.com/opinion/article-donald-trump-aberration-america-us-imperialism/,George Elliott Clarke,Opinion,"<a href=""https://www.theglobeandmail.com/opinion/article-donald-trump-aberration-america-us-imperialism/"">Donald Trump is not an aberration. He is America</a>"
8,Head of agency behind failed federal ‘axe the fax’ medical prescription program dismissed from role,https://www.theglobeandmail.com/business/economy/article-prescribeit-axe-the-fax-executive-salary/,No byline found,No article type found,"<a href=""https://www.theglobeandmail.com/business/economy/article-prescribeit-axe-the-fax-executive-salary/"">Head of agency behind failed federal ‘axe the fax’ medical prescription program dismissed from role</a>"
