Rank,Article title,url,Byline,Article type,title_with_link
1,First Nations chiefs demand apology after Carney says he could ‘outlast’ demonstrator,https://www.theglobeandmail.com/canada/article-first-nations-chiefs-carney-apology-demonstrator/,No byline found,No article type found,"<a href=""https://www.theglobeandmail.com/canada/article-first-nations-chiefs-carney-apology-demonstrator/"">First Nations chiefs demand apology after Carney says he could ‘outlast’ demonstrator</a>"
2,Weston family-backed digital publication Be Giant set to launch,https://www.theglobeandmail.com/business/article-weston-family-media-startup-digital-publication/,No byline found,No article type found,"<a href=""https://www.theglobeandmail.com/business/article-weston-family-media-startup-digital-publication/"">Weston family-backed digital publication Be Giant set to launch</a>"
3,Airbus seeks to expand defence footprint in Canada,https://www.theglobeandmail.com/business/article-airbus-seeks-to-expand-defence-footprint-in-canada/,No byline found,No article type found,"<a href=""https://www.theglobeandmail.com/business/article-airbus-seeks-to-expand-defence-footprint-in-canada/"">Airbus seeks to expand defence footprint in Canada</a>"
4,The NDP has an antisemitism problem,https://www.theglobeandmail.com/opinion/article-the-ndp-has-an-antisemitism-problem/,Konrad Yakabuski,Opinion,"<a href=""https://www.theglobeandmail.com/opinion/article-the-ndp-has-an-antisemitism-problem/"">The NDP has an antisemitism problem</a>"
5,Polymarket is banned in Ontario. Flyers advertising it were handed out outside a Jays game anyway,https://www.theglobeandmail.com/investing/personal-finance/article-polymarket-blue-jays-rogers-centre-ban-ontario/,No byline found,No article type found,"<a href=""https://www.theglobeandmail.com/investing/personal-finance/article-polymarket-blue-jays-rogers-centre-ban-ontario/"">Polymarket is banned in Ontario. Flyers advertising it were handed out outside a Jays game anyway</a>"
6,More and more men are getting cosmetic procedures,https://www.theglobeandmail.com/life/style/fashion-and-beauty/article-men-plastic-surgery-hollywood-dicaprio-gosling/,No byline found,No article type found,"<a href=""https://www.theglobeandmail.com/life/style/fashion-and-beauty/article-men-plastic-surgery-hollywood-dicaprio-gosling/"">More and more men are getting cosmetic procedures</a>"
7,Artemis II is now in space. What happens next?,https://www.theglobeandmail.com/canada/article-artemis-ii-update-today-april-2/,No byline found,No article type found,"<a href=""https://www.theglobeandmail.com/canada/article-artemis-ii-update-today-april-2/"">Artemis II is now in space. What happens next?</a>"
8,"As caribou mysteriously vanish from the NWT, Dene researchers hunt for answers across the frozen tundra",https://www.theglobeandmail.com/canada/article-caribou-population-decline-dene-researchers-northwest-territories/,No byline found,No article type found,"<a href=""https://www.theglobeandmail.com/canada/article-caribou-population-decline-dene-researchers-northwest-territories/"">As caribou mysteriously vanish from the NWT, Dene researchers hunt for answers across the frozen tundra</a>"
