Rank,Article title,url,Byline,Article type,title_with_link
1,Beaten-down TSX stocks that could now be end-of-year buys,https://www.theglobeandmail.com/investing/investment-ideas/number-cruncher/article-beaten-down-tsx-stocks-markets-tax-loss-selling/,No byline found,No article type found,"<a href=""https://www.theglobeandmail.com/investing/investment-ideas/number-cruncher/article-beaten-down-tsx-stocks-markets-tax-loss-selling/"">Beaten-down TSX stocks that could now be end-of-year buys</a>"
2,Man who disarmed Bondi Beach gunman hailed as hero as donations pour in,https://www.theglobeandmail.com/world/article-sydney-bondi-shooting-hero-ahmed-disarmed-gunman/,No byline found,No article type found,"<a href=""https://www.theglobeandmail.com/world/article-sydney-bondi-shooting-hero-ahmed-disarmed-gunman/"">Man who disarmed Bondi Beach gunman hailed as hero as donations pour in</a>"
3,Canada’s inflation rate unchanged at 2.2% in November,https://www.theglobeandmail.com/business/article-statistics-canada-inflation-november-2025/,No byline found,No article type found,"<a href=""https://www.theglobeandmail.com/business/article-statistics-canada-inflation-november-2025/"">Canada’s inflation rate unchanged at 2.2% in November</a>"
4,Potential disaster looms over Pierre Poilievre’s leadership,https://www.theglobeandmail.com/politics/opinion/article-pierre-poilievre-leadership-potential-disaster/,Campbell Clark,Opinion,"<a href=""https://www.theglobeandmail.com/politics/opinion/article-pierre-poilievre-leadership-potential-disaster/"">Potential disaster looms over Pierre Poilievre’s leadership</a>"
5,"Rob Reiner’s son Nick arrested after filmmaker, wife found dead in L.A. home",https://www.theglobeandmail.com/arts/article-director-rob-reiner-and-wife-michele-found-dead-in-their-home-police/,No byline found,No article type found,"<a href=""https://www.theglobeandmail.com/arts/article-director-rob-reiner-and-wife-michele-found-dead-in-their-home-police/"">Rob Reiner’s son Nick arrested after filmmaker, wife found dead in L.A. home</a>"
6,The Sydney attack reminds us it is not yet safe for all people to wear their coats of many colours,https://www.theglobeandmail.com/opinion/article-bondi-beach-sydney-australia-attack-shooting-jewish-safety/,Dan Moskovitz,Opinion,"<a href=""https://www.theglobeandmail.com/opinion/article-bondi-beach-sydney-australia-attack-shooting-jewish-safety/"">The Sydney attack reminds us it is not yet safe for all people to wear their coats of many colours</a>"
7,Why does the heavy lifting of Christmas mostly fall on moms?,https://www.theglobeandmail.com/life/advice/parenting/article-why-does-the-heavy-lifting-of-christmas-mostly-fall-on-moms/,No byline found,No article type found,"<a href=""https://www.theglobeandmail.com/life/advice/parenting/article-why-does-the-heavy-lifting-of-christmas-mostly-fall-on-moms/"">Why does the heavy lifting of Christmas mostly fall on moms?</a>"
8,WSP Global to acquire TRC Companies in $4.5-billion all-cash deal,https://www.theglobeandmail.com/business/article-wsp-global-trc-companies-acquisition-power-energy/,No byline found,No article type found,"<a href=""https://www.theglobeandmail.com/business/article-wsp-global-trc-companies-acquisition-power-energy/"">WSP Global to acquire TRC Companies in $4.5-billion all-cash deal</a>"
