Rank,Article title,url,Byline,Article type,title_with_link
1,We rekindled our passion for hiking among the volcanic peaks of Portugal’s Azores,https://www.theglobeandmail.com/life/travel/article-hiking-sao-miguel-island-portugal-azores/,No byline found,No article type found,"<a href=""https://www.theglobeandmail.com/life/travel/article-hiking-sao-miguel-island-portugal-azores/"">We rekindled our passion for hiking among the volcanic peaks of Portugal’s Azores</a>"
2,Baking for Orthodox Easter is a sweet comfort for confectioners of Kyiv,https://www.theglobeandmail.com/world/article-ukraine-orthodox-easter-baking-bread/,No byline found,No article type found,"<a href=""https://www.theglobeandmail.com/world/article-ukraine-orthodox-easter-baking-bread/"">Baking for Orthodox Easter is a sweet comfort for confectioners of Kyiv</a>"
3,Blue Jays broadcaster Joe Siddall enters his first season as main analyst full of gratitude,https://www.theglobeandmail.com/sports/baseball/article-blue-jays-broadcaster-joe-siddall-enters-his-first-season-as-main/,No byline found,No article type found,"<a href=""https://www.theglobeandmail.com/sports/baseball/article-blue-jays-broadcaster-joe-siddall-enters-his-first-season-as-main/"">Blue Jays broadcaster Joe Siddall enters his first season as main analyst full of gratitude</a>"
4,"Can Clement and Uma, both in their mid-40s, afford to buy a $2-million cottage?",https://www.theglobeandmail.com/investing/personal-finance/financial-facelift/article-clement-uma-afford-buy-2-million-cottage/,No byline found,No article type found,"<a href=""https://www.theglobeandmail.com/investing/personal-finance/financial-facelift/article-clement-uma-afford-buy-2-million-cottage/"">Can Clement and Uma, both in their mid-40s, afford to buy a $2-million cottage?</a>"
5,"By deliberately targeting water, warring factions in the Persian Gulf have weaponized thirst",https://www.theglobeandmail.com/opinion/article-by-deliberately-targeting-water-warring-factions-in-the-persian-gulf/,Brahma Chellaney,Opinion,"<a href=""https://www.theglobeandmail.com/opinion/article-by-deliberately-targeting-water-warring-factions-in-the-persian-gulf/"">By deliberately targeting water, warring factions in the Persian Gulf have weaponized thirst</a>"
6,When do drivers legally have to signal?,https://www.theglobeandmail.com/drive/culture/article-when-do-drivers-legally-have-to-signal/,No byline found,No article type found,"<a href=""https://www.theglobeandmail.com/drive/culture/article-when-do-drivers-legally-have-to-signal/"">When do drivers legally have to signal?</a>"
7,A weak housing market spells trouble for downsizing decisions,https://www.theglobeandmail.com/investing/personal-finance/retirement/article-a-weak-housing-market-spells-trouble-for-downsizing-decisions/,No byline found,No article type found,"<a href=""https://www.theglobeandmail.com/investing/personal-finance/retirement/article-a-weak-housing-market-spells-trouble-for-downsizing-decisions/"">A weak housing market spells trouble for downsizing decisions</a>"
8,"We need to embrace the art of diplomacy, not the art of the deal",https://www.theglobeandmail.com/opinion/article-michael-ignatieff-diplomacy-or-art-of-the-deal/,Michael Ignatieff,Opinion,"<a href=""https://www.theglobeandmail.com/opinion/article-michael-ignatieff-diplomacy-or-art-of-the-deal/"">We need to embrace the art of diplomacy, not the art of the deal</a>"
