Rank,Article title,url,Byline,Article type,title_with_link
1,"Carney heads to China next week, seeking new markets and better relations",https://www.theglobeandmail.com/politics/article-carney-china-trip/,No byline found,No article type found,"<a href=""https://www.theglobeandmail.com/politics/article-carney-china-trip/"">Carney heads to China next week, seeking new markets and better relations</a>"
2,"Perfecting karpatka, a show-stopping dessert",https://www.theglobeandmail.com/life/style/food-and-drink/article-karpatka-dessert-recipe-lab/,No byline found,No article type found,"<a href=""https://www.theglobeandmail.com/life/style/food-and-drink/article-karpatka-dessert-recipe-lab/"">Perfecting karpatka, a show-stopping dessert</a>"
3,This week’s highest savings account and guaranteed investment certificate rates,https://www.theglobeandmail.com/investing/personal-finance/article-this-weeks-highest-savings-account-and-guaranteed-investment-4/,No byline found,No article type found,"<a href=""https://www.theglobeandmail.com/investing/personal-finance/article-this-weeks-highest-savings-account-and-guaranteed-investment-4/"">This week’s highest savings account and guaranteed investment certificate rates</a>"
4,I love my new small-town life,https://www.theglobeandmail.com/life/first-person/article-i-love-my-new-small-town-life/,No byline found,No article type found,"<a href=""https://www.theglobeandmail.com/life/first-person/article-i-love-my-new-small-town-life/"">I love my new small-town life</a>"
5,Minneapolis mayor calls on ICE to leave city after ‘reckless’ killing of woman,https://www.theglobeandmail.com/world/article-ice-shooting-minneapolis-crackdown/,No byline found,No article type found,"<a href=""https://www.theglobeandmail.com/world/article-ice-shooting-minneapolis-crackdown/"">Minneapolis mayor calls on ICE to leave city after ‘reckless’ killing of woman</a>"
6,How a retired accountant spent his frugal father’s inheritance meaningfully,https://www.theglobeandmail.com/investing/personal-finance/retirement/article-retired-accountant-wanted-to-spend-fathers-inheritance-meaningfully/,No byline found,No article type found,"<a href=""https://www.theglobeandmail.com/investing/personal-finance/retirement/article-retired-accountant-wanted-to-spend-fathers-inheritance-meaningfully/"">How a retired accountant spent his frugal father’s inheritance meaningfully</a>"
7,CPP payments slow in 2026 as retirees cope with high living costs,https://www.theglobeandmail.com/investing/personal-finance/retirement/article-cpp-payments-2026-retirement-cost-of-living-pension/,No byline found,No article type found,"<a href=""https://www.theglobeandmail.com/investing/personal-finance/retirement/article-cpp-payments-2026-retirement-cost-of-living-pension/"">CPP payments slow in 2026 as retirees cope with high living costs</a>"
8,Chrystia Freeland to resign as MP Friday after accepting Ukraine advisory role,https://www.theglobeandmail.com/politics/article-chrystia-freeland-resigns-mp-ukraine-advisory-role-volodymyr-zelensky/,No byline found,No article type found,"<a href=""https://www.theglobeandmail.com/politics/article-chrystia-freeland-resigns-mp-ukraine-advisory-role-volodymyr-zelensky/"">Chrystia Freeland to resign as MP Friday after accepting Ukraine advisory role</a>"
