Rank,Article title,url,Byline,Article type,title_with_link
1,Warsaw buzzes with final performances at Chopin contest,https://www.theglobeandmail.com/culture/music/article-international-fryderyk-chopin-competition-warsaw-finalists-kevin-chen/,No byline found,No article type found,"<a href=""https://www.theglobeandmail.com/culture/music/article-international-fryderyk-chopin-competition-warsaw-finalists-kevin-chen/"">Warsaw buzzes with final performances at Chopin contest</a>"
2,The rapid rise of sports gambling is dangerous to our financial well-being and our societal health,https://www.theglobeandmail.com/investing/personal-finance/article-the-rapid-rise-of-sports-gambling-is-dangerous-to-our-financial-well/,Preet Banerjee,Opinion,"<a href=""https://www.theglobeandmail.com/investing/personal-finance/article-the-rapid-rise-of-sports-gambling-is-dangerous-to-our-financial-well/"">The rapid rise of sports gambling is dangerous to our financial well-being and our societal health</a>"
3,Gentle parenting v. FAFO: Why I’m done with useless ‘styles’ entirely,https://www.theglobeandmail.com/life/advice/parenting/article-gentle-parenting-authoritarian-fafo-parent-labels-raising-children/,Amberly McAteer,Opinion,"<a href=""https://www.theglobeandmail.com/life/advice/parenting/article-gentle-parenting-authoritarian-fafo-parent-labels-raising-children/"">Gentle parenting v. FAFO: Why I’m done with useless ‘styles’ entirely</a>"
4,Canada’s costly EV scheme stalls out again,https://www.theglobeandmail.com/opinion/editorials/article-canada-ottawa-electric-vehicles-stellantis-us-trump-carney/,No byline found,No article type found,"<a href=""https://www.theglobeandmail.com/opinion/editorials/article-canada-ottawa-electric-vehicles-stellantis-us-trump-carney/"">Canada’s costly EV scheme stalls out again</a>"
5,Richmond warns property owners B.C. Supreme Court decision could ‘negatively affect title’,https://www.theglobeandmail.com/canada/british-columbia/article-richmond-bc-supreme-court-property-owners-aboriginal-title/,No byline found,No article type found,"<a href=""https://www.theglobeandmail.com/canada/british-columbia/article-richmond-bc-supreme-court-property-owners-aboriginal-title/"">Richmond warns property owners B.C. Supreme Court decision could ‘negatively affect title’</a>"
6,"From construction to M&A to white-collar crime, here are Canada’s best law firms",https://www.theglobeandmail.com/business/article-from-construction-to-ma-to-white-collar-crime-here-are-canadas-best/,No byline found,No article type found,"<a href=""https://www.theglobeandmail.com/business/article-from-construction-to-ma-to-white-collar-crime-here-are-canadas-best/"">From construction to M&A to white-collar crime, here are Canada’s best law firms</a>"
7,The Price Point: What kind of house does $1.4-million get you in Toronto?,https://www.theglobeandmail.com/real-estate/article-price-point-monthly-house-price-toronto-september-2025/,No byline found,No article type found,"<a href=""https://www.theglobeandmail.com/real-estate/article-price-point-monthly-house-price-toronto-september-2025/"">The Price Point: What kind of house does $1.4-million get you in Toronto?</a>"
8,Do you need to foam roll for the health of your fascia?,https://www.theglobeandmail.com/life/health-and-fitness/article-foam-rolling-fitness-tight-muscles-fascia/,No byline found,No article type found,"<a href=""https://www.theglobeandmail.com/life/health-and-fitness/article-foam-rolling-fitness-tight-muscles-fascia/"">Do you need to foam roll for the health of your fascia?</a>"
