Rank,Article title,url,Byline,Article type,title_with_link
1,What if we have already passed peak Trump?,https://www.theglobeandmail.com/business/commentary/article-trump-popularity-approval-rating-democracy/,Tony Keller,Opinion,"<a href=""https://www.theglobeandmail.com/business/commentary/article-trump-popularity-approval-rating-democracy/"">What if we have already passed peak Trump?</a>"
2,Why I’m abandoning my bullish view on the Canadian dollar and bracing for more BoC rate cuts,https://www.theglobeandmail.com/investing/markets/inside-the-market/article-david-rosenberg-why-im-abandoning-my-bullish-view-on-the-canadian/,No byline found,No article type found,"<a href=""https://www.theglobeandmail.com/investing/markets/inside-the-market/article-david-rosenberg-why-im-abandoning-my-bullish-view-on-the-canadian/"">Why I’m abandoning my bullish view on the Canadian dollar and bracing for more BoC rate cuts</a>"
3,CAAT CEO received $1.6-million vacation payment despite internal policy limits,https://www.theglobeandmail.com/business/article-caat-pension-plan-board-chair-removed-as-trustee-amid-upheaval-over/,No byline found,No article type found,"<a href=""https://www.theglobeandmail.com/business/article-caat-pension-plan-board-chair-removed-as-trustee-amid-upheaval-over/"">CAAT CEO received $1.6-million vacation payment despite internal policy limits</a>"
4,"Despite less ice time, McDavid still dominates in win over Swiss",https://www.theglobeandmail.com/sports/olympics/article-winter-olympics-2026-canada-vs-switzerland-mens-hockey-score-schedule/,No byline found,No article type found,"<a href=""https://www.theglobeandmail.com/sports/olympics/article-winter-olympics-2026-canada-vs-switzerland-mens-hockey-score-schedule/"">Despite less ice time, McDavid still dominates in win over Swiss</a>"
5,CPP payments slow in 2026 as retirees cope with high living costs,https://www.theglobeandmail.com/investing/personal-finance/retirement/article-cpp-payments-2026-retirement-cost-of-living-pension/,No byline found,No article type found,"<a href=""https://www.theglobeandmail.com/investing/personal-finance/retirement/article-cpp-payments-2026-retirement-cost-of-living-pension/"">CPP payments slow in 2026 as retirees cope with high living costs</a>"
6,Why gold prices took such a sudden dive on Thursday,https://www.theglobeandmail.com/investing/article-why-gold-prices-are-down-today/,No byline found,No article type found,"<a href=""https://www.theglobeandmail.com/investing/article-why-gold-prices-are-down-today/"">Why gold prices took such a sudden dive on Thursday</a>"
7,"The four types of wealth for a happy retirement, according to this senior",https://www.theglobeandmail.com/investing/globe-advisor/advisor-news/article-the-four-types-of-wealth-for-a-happy-retirement-according-to-this/,No byline found,No article type found,"<a href=""https://www.theglobeandmail.com/investing/globe-advisor/advisor-news/article-the-four-types-of-wealth-for-a-happy-retirement-according-to-this/"">The four types of wealth for a happy retirement, according to this senior</a>"
8,Dominic LeBlanc to lead giant Canadian trade delegation to Mexico,https://www.theglobeandmail.com/business/article-canada-trade-delegation-mexico-mission-economy/,No byline found,No article type found,"<a href=""https://www.theglobeandmail.com/business/article-canada-trade-delegation-mexico-mission-economy/"">Dominic LeBlanc to lead giant Canadian trade delegation to Mexico</a>"
