Rank,Article title,url,Byline,Article type,title_with_link
1,What to watch this weekend: An all-American Love Story and an Italian take on young-adult romance,https://www.theglobeandmail.com/culture/film-and-tv/television/article-what-to-watch-this-weekend-an-all-american-love-story-and-an-italian/,No byline found,No article type found,"<a href=""https://www.theglobeandmail.com/culture/film-and-tv/television/article-what-to-watch-this-weekend-an-all-american-love-story-and-an-italian/"">What to watch this weekend: An all-American Love Story and an Italian take on young-adult romance</a>"
2,What happened at the Olympics today,https://www.theglobeandmail.com/sports/olympics/article-canada-aims-for-more-short-track-medals-as-mens-and-womens-hockey/,No byline found,No article type found,"<a href=""https://www.theglobeandmail.com/sports/olympics/article-canada-aims-for-more-short-track-medals-as-mens-and-womens-hockey/"">What happened at the Olympics today</a>"
3,"Every medal tastes sweeter in these bitter times for Canada. Thank you, Olympians",https://www.theglobeandmail.com/sports/olympics/article-every-medal-tastes-sweeter-in-these-bitter-times-for-canada-thank-you/,Eric Reguly,Opinion,"<a href=""https://www.theglobeandmail.com/sports/olympics/article-every-medal-tastes-sweeter-in-these-bitter-times-for-canada-thank-you/"">Every medal tastes sweeter in these bitter times for Canada. Thank you, Olympians</a>"
4,"Almost a week into the Olympics, luck doesn’t seem to be on Canada’s side",https://www.theglobeandmail.com/sports/article-olympics-milan-cortina-winter-games-medals-luck/,Cathal Kelly,Opinion,"<a href=""https://www.theglobeandmail.com/sports/article-olympics-milan-cortina-winter-games-medals-luck/"">Almost a week into the Olympics, luck doesn’t seem to be on Canada’s side</a>"
5,"Telus names ex-CIBC chief Victor Dodig as CEO, replacing Darren Entwistle",https://www.theglobeandmail.com/business/article-telus-ceo-darren-entwistle-to-retire-in-june-victor-dodig-named/,No byline found,No article type found,"<a href=""https://www.theglobeandmail.com/business/article-telus-ceo-darren-entwistle-to-retire-in-june-victor-dodig-named/"">Telus names ex-CIBC chief Victor Dodig as CEO, replacing Darren Entwistle</a>"
6,How Telus’s unexpected CEO change came about,https://www.theglobeandmail.com/business/article-how-teluss-unexpected-ceo-change-came-about/,No byline found,No article type found,"<a href=""https://www.theglobeandmail.com/business/article-how-teluss-unexpected-ceo-change-came-about/"">How Telus’s unexpected CEO change came about</a>"
7,Why gold prices took such a sudden dive on Thursday,https://www.theglobeandmail.com/investing/article-why-gold-prices-are-down-today/,No byline found,No article type found,"<a href=""https://www.theglobeandmail.com/investing/article-why-gold-prices-are-down-today/"">Why gold prices took such a sudden dive on Thursday</a>"
8,Canada’s first Olympic hockey win was a chemistry test,https://www.theglobeandmail.com/sports/olympics/article-winter-olympics-2026-canada-mens-hockey-score-lineups-finland-win/,No byline found,No article type found,"<a href=""https://www.theglobeandmail.com/sports/olympics/article-winter-olympics-2026-canada-mens-hockey-score-lineups-finland-win/"">Canada’s first Olympic hockey win was a chemistry test</a>"
