Rank,Article title,url,Byline,Article type,title_with_link
1,"As an ER doc and a mom, here are five things I don’t let my kids do because the risks are too high",https://www.theglobeandmail.com/life/advice/article-as-an-er-doc-and-a-mom-here-are-five-things-i-dont-let-my-kids-do/,No byline found,No article type found,"<a href=""https://www.theglobeandmail.com/life/advice/article-as-an-er-doc-and-a-mom-here-are-five-things-i-dont-let-my-kids-do/"">As an ER doc and a mom, here are five things I don’t let my kids do because the risks are too high</a>"
2,The view from China: What does Beijing want from Carney’s visit?,https://www.theglobeandmail.com/world/article-the-view-from-china-what-does-beijing-want-from-carneys-visit/,No byline found,No article type found,"<a href=""https://www.theglobeandmail.com/world/article-the-view-from-china-what-does-beijing-want-from-carneys-visit/"">The view from China: What does Beijing want from Carney’s visit?</a>"
3,Is it illegal to stop before turning right at a green light?,https://www.theglobeandmail.com/drive/culture/article-is-it-illegal-to-stop-before-turning-right-at-a-green-light/,No byline found,No article type found,"<a href=""https://www.theglobeandmail.com/drive/culture/article-is-it-illegal-to-stop-before-turning-right-at-a-green-light/"">Is it illegal to stop before turning right at a green light?</a>"
4,Could this Toronto couple find a detached home with transit access on a $1-million budget?,https://www.theglobeandmail.com/investing/personal-finance/article-toronto-detached-home-transit-access-1-million-budget/,No byline found,No article type found,"<a href=""https://www.theglobeandmail.com/investing/personal-finance/article-toronto-detached-home-transit-access-1-million-budget/"">Could this Toronto couple find a detached home with transit access on a $1-million budget?</a>"
5,The independence of the U.S. Federal Reserve is at stake,https://www.theglobeandmail.com/opinion/article-the-independence-of-the-us-federal-reserve-is-at-stake/,Andrew Coyne,Opinion,"<a href=""https://www.theglobeandmail.com/opinion/article-the-independence-of-the-us-federal-reserve-is-at-stake/"">The independence of the U.S. Federal Reserve is at stake</a>"
6,Supreme Court Justice Sheilah Martin to retire in May,https://www.theglobeandmail.com/canada/article-supreme-court-justice-sheilah-martin-retire/,No byline found,No article type found,"<a href=""https://www.theglobeandmail.com/canada/article-supreme-court-justice-sheilah-martin-retire/"">Supreme Court Justice Sheilah Martin to retire in May</a>"
7,Donald Trump could create his own nightmare − soaring oil prices − by attacking Iran,https://www.theglobeandmail.com/business/commentary/article-donald-trump-oil-prices-iran/,Eric Reguly,Opinion,"<a href=""https://www.theglobeandmail.com/business/commentary/article-donald-trump-oil-prices-iran/"">Donald Trump could create his own nightmare − soaring oil prices − by attacking Iran</a>"
8,The ‘motherhood penalty’: An accountant (and mother) explains the hidden costs of parenting,https://www.theglobeandmail.com/life/advice/parenting/article-motherhood-penalty-hidden-costs-of-parenting/,No byline found,No article type found,"<a href=""https://www.theglobeandmail.com/life/advice/parenting/article-motherhood-penalty-hidden-costs-of-parenting/"">The ‘motherhood penalty’: An accountant (and mother) explains the hidden costs of parenting</a>"
