Rank,Article title,url,Byline,Article type,title_with_link
1,Hopper to run Avion travel rewards program for RBC,https://www.theglobeandmail.com/business/article-hopper-to-run-avion-travel-rewards-program-for-rbc/,No byline found,No article type found,"<a href=""https://www.theglobeandmail.com/business/article-hopper-to-run-avion-travel-rewards-program-for-rbc/"">Hopper to run Avion travel rewards program for RBC</a>"
2,A cramped Vancouver kitchen gets a functional overhaul with a pop of colour,https://www.theglobeandmail.com/life/style/style-magazine/article-a-cramped-vancouver-kitchen-gets-a-functional-overhaul-with-a-pop-of/,No byline found,No article type found,"<a href=""https://www.theglobeandmail.com/life/style/style-magazine/article-a-cramped-vancouver-kitchen-gets-a-functional-overhaul-with-a-pop-of/"">A cramped Vancouver kitchen gets a functional overhaul with a pop of colour</a>"
3,New NDP Leader Avi Lewis faces a complex political dynamic in rebuilding party,https://www.theglobeandmail.com/politics/article-avi-lewis-faces-a-complex-political-dynamic-in-rebuilding-the-ndp-as/,No byline found,No article type found,"<a href=""https://www.theglobeandmail.com/politics/article-avi-lewis-faces-a-complex-political-dynamic-in-rebuilding-the-ndp-as/"">New NDP Leader Avi Lewis faces a complex political dynamic in rebuilding party</a>"
4,Mark Carney’s strategy for the public service becomes clearer,https://www.theglobeandmail.com/politics/opinion/article-mark-carneys-strategy-for-the-public-service-becomes-clearer/,Shannon Proudfoot,Opinion,"<a href=""https://www.theglobeandmail.com/politics/opinion/article-mark-carneys-strategy-for-the-public-service-becomes-clearer/"">Mark Carney’s strategy for the public service becomes clearer</a>"
5,"Want to slow brain aging? Follow this diet, a new study suggests",https://www.theglobeandmail.com/life/health-and-fitness/article-mind-diet-brain-aging-health/,No byline found,No article type found,"<a href=""https://www.theglobeandmail.com/life/health-and-fitness/article-mind-diet-brain-aging-health/"">Want to slow brain aging? Follow this diet, a new study suggests</a>"
6,Canadians no longer need to worry about the federal underused housing tax. But provinces and cities still charge them,https://www.theglobeandmail.com/investing/personal-finance/article-canadians-no-longer-need-to-worry-about-the-federal-underused-housing/,No byline found,No article type found,"<a href=""https://www.theglobeandmail.com/investing/personal-finance/article-canadians-no-longer-need-to-worry-about-the-federal-underused-housing/"">Canadians no longer need to worry about the federal underused housing tax. But provinces and cities still charge them</a>"
7,"B.C.’s move away from self-regulation for health workers is imperfect, but overdue",https://www.theglobeandmail.com/opinion/article-bc-bill-36-self-regulation-health-care-workers-patients/,André Picard,Opinion,"<a href=""https://www.theglobeandmail.com/opinion/article-bc-bill-36-self-regulation-health-care-workers-patients/"">B.C.’s move away from self-regulation for health workers is imperfect, but overdue</a>"
8,Trump threatens destruction of Iran’s energy resources if a deal isn’t reached soon,https://www.theglobeandmail.com/business/article-trump-says-iran-will-allow-20-oil-tankers-through-strait-of-hormuz/,No byline found,No article type found,"<a href=""https://www.theglobeandmail.com/business/article-trump-says-iran-will-allow-20-oil-tankers-through-strait-of-hormuz/"">Trump threatens destruction of Iran’s energy resources if a deal isn’t reached soon</a>"
