Rank,Article title,url,Byline,Article type,title_with_link
1,Trump administration ordered to restore National Park changes at sites that ‘disparage’ Americans,https://www.theglobeandmail.com/world/us-politics/article-judge-orders-trump-restore-national-park-changes-that-disparage-us/,No byline found,No article type found,"<a href=""https://www.theglobeandmail.com/world/us-politics/article-judge-orders-trump-restore-national-park-changes-that-disparage-us/"">Trump administration ordered to restore National Park changes at sites that ‘disparage’ Americans</a>"
2,"Canada, Ireland agree to work together on AI, tech and food security",https://www.theglobeandmail.com/canada/article-canada-ireland-agree-to-work-together-on-ai-tech-and-food-security/,No byline found,No article type found,"<a href=""https://www.theglobeandmail.com/canada/article-canada-ireland-agree-to-work-together-on-ai-tech-and-food-security/"">Canada, Ireland agree to work together on AI, tech and food security</a>"
3,West Vancouver home with ocean view ties up sale after price drop,https://www.theglobeandmail.com/real-estate/vancouver/article-west-vancouver-home-with-ocean-view-ties-up-sale-after-price-drop/,No byline found,No article type found,"<a href=""https://www.theglobeandmail.com/real-estate/vancouver/article-west-vancouver-home-with-ocean-view-ties-up-sale-after-price-drop/"">West Vancouver home with ocean view ties up sale after price drop</a>"
4,"A decade after MAID became legal, life has become cheap in Canada",https://www.theglobeandmail.com/opinion/article-a-decade-after-maid-became-legal-life-has-become-cheap-in-canada/,No byline found,No article type found,"<a href=""https://www.theglobeandmail.com/opinion/article-a-decade-after-maid-became-legal-life-has-become-cheap-in-canada/"">A decade after MAID became legal, life has become cheap in Canada</a>"
5,Five things Canada can learn or change for World Cup clash with Qatar,https://www.theglobeandmail.com/sports/article-fifa-world-cup-canada-qatar-bosnia/,No byline found,No article type found,"<a href=""https://www.theglobeandmail.com/sports/article-fifa-world-cup-canada-qatar-bosnia/"">Five things Canada can learn or change for World Cup clash with Qatar</a>"
6,Fan favourite Sudarshan Yellamaraju climbs into contention at RBC Canadian Open,https://www.theglobeandmail.com/sports/golf/article-fan-favourite-sudarshan-yellamaraju-climbs-into-contention-at-rbc/,No byline found,No article type found,"<a href=""https://www.theglobeandmail.com/sports/golf/article-fan-favourite-sudarshan-yellamaraju-climbs-into-contention-at-rbc/"">Fan favourite Sudarshan Yellamaraju climbs into contention at RBC Canadian Open</a>"
7,"Five children killed, six people injured in two-vehicle crash near Guelph, Ont.",https://www.theglobeandmail.com/canada/toronto/article-five-children-killed-six-injured-in-two-vehicle-crash-near-guelph-ont/,No byline found,No article type found,"<a href=""https://www.theglobeandmail.com/canada/toronto/article-five-children-killed-six-injured-in-two-vehicle-crash-near-guelph-ont/"">Five children killed, six people injured in two-vehicle crash near Guelph, Ont.</a>"
8,"Inside the efforts to restore B.C.’s secret, ancient sea gardens",https://www.theglobeandmail.com/canada/article-inside-the-efforts-to-restore-bcs-secret-ancient-sea-gardens/,No byline found,No article type found,"<a href=""https://www.theglobeandmail.com/canada/article-inside-the-efforts-to-restore-bcs-secret-ancient-sea-gardens/"">Inside the efforts to restore B.C.’s secret, ancient sea gardens</a>"
