Rank,Article title,url,Byline,Article type,title_with_link
1,Friday’s analyst upgrades and downgrades,https://www.theglobeandmail.com/investing/markets/inside-the-market/article-fridays-analyst-upgrades-and-downgrades-289/,No byline found,No article type found,"<a href=""https://www.theglobeandmail.com/investing/markets/inside-the-market/article-fridays-analyst-upgrades-and-downgrades-289/"">Friday’s analyst upgrades and downgrades</a>"
2,How many House Republicans voted against Trump this week? Take our business and investing news quiz,https://www.theglobeandmail.com/business/article-trump-house-tariffs-japan-crypto/,No byline found,No article type found,"<a href=""https://www.theglobeandmail.com/business/article-trump-house-tariffs-japan-crypto/"">How many House Republicans voted against Trump this week? Take our business and investing news quiz</a>"
3,What if we have already passed peak Trump?,https://www.theglobeandmail.com/business/commentary/article-trump-popularity-approval-rating-democracy/,Tony Keller,Opinion,"<a href=""https://www.theglobeandmail.com/business/commentary/article-trump-popularity-approval-rating-democracy/"">What if we have already passed peak Trump?</a>"
4,Why I’m abandoning my bullish view on the Canadian dollar and bracing for more BoC rate cuts,https://www.theglobeandmail.com/investing/markets/inside-the-market/article-david-rosenberg-why-im-abandoning-my-bullish-view-on-the-canadian/,No byline found,No article type found,"<a href=""https://www.theglobeandmail.com/investing/markets/inside-the-market/article-david-rosenberg-why-im-abandoning-my-bullish-view-on-the-canadian/"">Why I’m abandoning my bullish view on the Canadian dollar and bracing for more BoC rate cuts</a>"
5,"Almost a week into the Olympics, luck doesn’t seem to be on Canada’s side",https://www.theglobeandmail.com/sports/article-olympics-milan-cortina-winter-games-medals-luck/,Cathal Kelly,Opinion,"<a href=""https://www.theglobeandmail.com/sports/article-olympics-milan-cortina-winter-games-medals-luck/"">Almost a week into the Olympics, luck doesn’t seem to be on Canada’s side</a>"
6,How Telus’s unexpected CEO change came about,https://www.theglobeandmail.com/business/article-how-teluss-unexpected-ceo-change-came-about/,No byline found,No article type found,"<a href=""https://www.theglobeandmail.com/business/article-how-teluss-unexpected-ceo-change-came-about/"">How Telus’s unexpected CEO change came about</a>"
7,CPP payments slow in 2026 as retirees cope with high living costs,https://www.theglobeandmail.com/investing/personal-finance/retirement/article-cpp-payments-2026-retirement-cost-of-living-pension/,No byline found,No article type found,"<a href=""https://www.theglobeandmail.com/investing/personal-finance/retirement/article-cpp-payments-2026-retirement-cost-of-living-pension/"">CPP payments slow in 2026 as retirees cope with high living costs</a>"
8,Why gold prices took such a sudden dive on Thursday,https://www.theglobeandmail.com/investing/article-why-gold-prices-are-down-today/,No byline found,No article type found,"<a href=""https://www.theglobeandmail.com/investing/article-why-gold-prices-are-down-today/"">Why gold prices took such a sudden dive on Thursday</a>"
