Rank,Article title,url,Byline,Article type,title_with_link
1,Stephanie Smyth once covered Doug Ford on the news. Now she faces him in the Ontario legislature,https://www.theglobeandmail.com/canada/article-stephanie-smyth-doug-ford-ontario-legislature/,No byline found,No article type found,"<a href=""https://www.theglobeandmail.com/canada/article-stephanie-smyth-doug-ford-ontario-legislature/"">Stephanie Smyth once covered Doug Ford on the news. Now she faces him in the Ontario legislature</a>"
2,"In Canada, householders must use ‘reasonable force’ against an intruder. That’s perfectly reasonable",https://www.theglobeandmail.com/opinion/article-in-canada-householders-must-use-reasonable-force-against-an-intruder/,No byline found,No article type found,"<a href=""https://www.theglobeandmail.com/opinion/article-in-canada-householders-must-use-reasonable-force-against-an-intruder/"">In Canada, householders must use ‘reasonable force’ against an intruder. That’s perfectly reasonable</a>"
3,Retirement planning isn’t one-size-fits-all for business owners and professionals,https://www.theglobeandmail.com/investing/personal-finance/taxes/article-retirement-planning-isnt-one-size-fits-all-for-business-owners-and/,Tim Cestnick,Opinion,"<a href=""https://www.theglobeandmail.com/investing/personal-finance/taxes/article-retirement-planning-isnt-one-size-fits-all-for-business-owners-and/"">Retirement planning isn’t one-size-fits-all for business owners and professionals</a>"
4,"CIBC third-quarter profit rises on strong retail banking, capital markets results",https://www.theglobeandmail.com/business/article-cibc-third-quarter-earnings-profit-rises/,No byline found,No article type found,"<a href=""https://www.theglobeandmail.com/business/article-cibc-third-quarter-earnings-profit-rises/"">CIBC third-quarter profit rises on strong retail banking, capital markets results</a>"
5,An ambitious plan for an iconic heritage site,https://www.theglobeandmail.com/real-estate/toronto/article-college-park-eatons-redevelopment-art-deco/,No byline found,No article type found,"<a href=""https://www.theglobeandmail.com/real-estate/toronto/article-college-park-eatons-redevelopment-art-deco/"">An ambitious plan for an iconic heritage site</a>"
6,An Ontario woman died of an infection after an abortion. Her sister says doctors failed her,https://www.theglobeandmail.com/canada/article-rheanna-laderoute-death-ontario-southlake-hospital-doctors-discipline/,No byline found,No article type found,"<a href=""https://www.theglobeandmail.com/canada/article-rheanna-laderoute-death-ontario-southlake-hospital-doctors-discipline/"">An Ontario woman died of an infection after an abortion. Her sister says doctors failed her</a>"
7,Thursday’s analyst upgrades and downgrades,https://www.theglobeandmail.com/investing/markets/inside-the-market/article-thursdays-analyst-upgrades-and-downgrades-273/,No byline found,No article type found,"<a href=""https://www.theglobeandmail.com/investing/markets/inside-the-market/article-thursdays-analyst-upgrades-and-downgrades-273/"">Thursday’s analyst upgrades and downgrades</a>"
8,"Russia launches mass overnight drone and missile attack on Kyiv, killing 15",https://www.theglobeandmail.com/world/article-russia-launches-mass-overnight-drone-and-missile-attack-on-kyiv/,No byline found,No article type found,"<a href=""https://www.theglobeandmail.com/world/article-russia-launches-mass-overnight-drone-and-missile-attack-on-kyiv/"">Russia launches mass overnight drone and missile attack on Kyiv, killing 15</a>"
