Rank,Article title,url,Byline,Article type,title_with_link
1,Books we’re reading and loving in March,https://www.theglobeandmail.com/culture/books/article-best-books-march-2026/,No byline found,No article type found,"<a href=""https://www.theglobeandmail.com/culture/books/article-best-books-march-2026/"">Books we’re reading and loving in March</a>"
2,Tips from two Facebook Marketplace super-users in an age of thrift-gouging,https://www.theglobeandmail.com/investing/personal-finance/article-tips-from-two-facebook-marketplace-super-users-in-an-age-of-thrift/,No byline found,No article type found,"<a href=""https://www.theglobeandmail.com/investing/personal-finance/article-tips-from-two-facebook-marketplace-super-users-in-an-age-of-thrift/"">Tips from two Facebook Marketplace super-users in an age of thrift-gouging</a>"
3,What kind of home does $1.1-million get you in and around Victoria?,https://www.theglobeandmail.com/real-estate/article-houses-11-million-victoria-bc-price-point/,No byline found,No article type found,"<a href=""https://www.theglobeandmail.com/real-estate/article-houses-11-million-victoria-bc-price-point/"">What kind of home does $1.1-million get you in and around Victoria?</a>"
4,Is there no peace and quiet in public spaces any more?,https://www.theglobeandmail.com/life/first-person/article-is-there-no-peace-and-quiet-in-public-spaces-anymore/,No byline found,No article type found,"<a href=""https://www.theglobeandmail.com/life/first-person/article-is-there-no-peace-and-quiet-in-public-spaces-anymore/"">Is there no peace and quiet in public spaces any more?</a>"
5,Ottawa says Musqueam deal unrelated to private property rights,https://www.theglobeandmail.com/politics/article-ottawa-says-musqueam-deal-unrelated-to-private-property-rights/,No byline found,No article type found,"<a href=""https://www.theglobeandmail.com/politics/article-ottawa-says-musqueam-deal-unrelated-to-private-property-rights/"">Ottawa says Musqueam deal unrelated to private property rights</a>"
6,"KPMG had most deficiencies in audit files reviewed last year of Big Four firms, regulator finds",https://www.theglobeandmail.com/business/article-audits-kpmg-pwc-deloitte-ey-big-four-accounting-firms-inspections/,No byline found,No article type found,"<a href=""https://www.theglobeandmail.com/business/article-audits-kpmg-pwc-deloitte-ey-big-four-accounting-firms-inspections/"">KPMG had most deficiencies in audit files reviewed last year of Big Four firms, regulator finds</a>"
7,Iran’s new Supreme Leader vows to keep Strait of Hormuz closed,https://www.theglobeandmail.com/business/article-iran-war-oil-tankers-energy-prices-trump/,No byline found,No article type found,"<a href=""https://www.theglobeandmail.com/business/article-iran-war-oil-tankers-energy-prices-trump/"">Iran’s new Supreme Leader vows to keep Strait of Hormuz closed</a>"
8,Telus investigating hack of its digital services arm,https://www.theglobeandmail.com/business/article-telus-investigating-hack-of-its-digital-services-arm/,No byline found,No article type found,"<a href=""https://www.theglobeandmail.com/business/article-telus-investigating-hack-of-its-digital-services-arm/"">Telus investigating hack of its digital services arm</a>"
