Rank,Article title,url,Byline,Article type,title_with_link
1,What are the best small vehicles for driving in the city?,https://www.theglobeandmail.com/drive/reviews/article-what-are-the-best-small-vehicles-for-driving-in-the-city/,No byline found,No article type found,"<a href=""https://www.theglobeandmail.com/drive/reviews/article-what-are-the-best-small-vehicles-for-driving-in-the-city/"">What are the best small vehicles for driving in the city?</a>"
2,Trump’s embrace of crypto is undermining American power,https://www.theglobeandmail.com/opinion/article-trumps-embrace-of-crypto-is-undermining-american-power/,Jayati Ghosh,Opinion,"<a href=""https://www.theglobeandmail.com/opinion/article-trumps-embrace-of-crypto-is-undermining-american-power/"">Trump’s embrace of crypto is undermining American power</a>"
3,B.C. Premier will outline plans for Indigenous rights law on Monday,https://www.theglobeandmail.com/canada/article-bc-premier-will-outline-plans-for-indigenous-rights-law-on-monday/,No byline found,No article type found,"<a href=""https://www.theglobeandmail.com/canada/article-bc-premier-will-outline-plans-for-indigenous-rights-law-on-monday/"">B.C. Premier will outline plans for Indigenous rights law on Monday</a>"
4,Dozens of homes and streets in Gatineau at risk as spring flood concerns grow,https://www.theglobeandmail.com/canada/article-quebec-ontario-spring-flood-risk/,No byline found,No article type found,"<a href=""https://www.theglobeandmail.com/canada/article-quebec-ontario-spring-flood-risk/"">Dozens of homes and streets in Gatineau at risk as spring flood concerns grow</a>"
5,Canada’s annual inflation rate climbs to 2.4% as Iran war fuels rise in gas prices,https://www.theglobeandmail.com/business/economy/article-canada-inflation-rate-march-oil-prices-iran-war/,No byline found,No article type found,"<a href=""https://www.theglobeandmail.com/business/economy/article-canada-inflation-rate-march-oil-prices-iran-war/"">Canada’s annual inflation rate climbs to 2.4% as Iran war fuels rise in gas prices</a>"
6,Auston Matthews is waving every relationship red flag that he can at the Leafs. It’s time to get out,https://www.theglobeandmail.com/sports/hockey/article-auston-matthews-trade-toronto-maple-leafs-nhl/,Cathal Kelly,Opinion,"<a href=""https://www.theglobeandmail.com/sports/hockey/article-auston-matthews-trade-toronto-maple-leafs-nhl/"">Auston Matthews is waving every relationship red flag that he can at the Leafs. It’s time to get out</a>"
7,Made in Canada: Quebec’s Rocket Man aims to launch domestic space capability,https://www.theglobeandmail.com/business/rob-magazine/article-made-in-canada-quebecs-rocket-man-aims-to-launch-domestic-space/,No byline found,No article type found,"<a href=""https://www.theglobeandmail.com/business/rob-magazine/article-made-in-canada-quebecs-rocket-man-aims-to-launch-domestic-space/"">Made in Canada: Quebec’s Rocket Man aims to launch domestic space capability</a>"
8,"Despite dropping of murder charges, Kenneth Law likely to face strict sentence, legal experts say",https://www.theglobeandmail.com/canada/article-legal-experts-predict-strict-sentence-for-kenneth-law-suicide-aiding/,No byline found,No article type found,"<a href=""https://www.theglobeandmail.com/canada/article-legal-experts-predict-strict-sentence-for-kenneth-law-suicide-aiding/"">Despite dropping of murder charges, Kenneth Law likely to face strict sentence, legal experts say</a>"
