Rank,Article title,url,Byline,Article type,title_with_link
1,Lululemon founder fined by Elections BC for sign saying NDP is ‘Communist’,https://www.theglobeandmail.com/canada/british-columbia/article-chip-wilson-lululemon-ndp-fine-sign-election/,No byline found,No article type found,"<a href=""https://www.theglobeandmail.com/canada/british-columbia/article-chip-wilson-lululemon-ndp-fine-sign-election/"">Lululemon founder fined by Elections BC for sign saying NDP is ‘Communist’</a>"
2,"No going back to former free trade system, Lutnick says",https://www.theglobeandmail.com/canada/article-auto-tariffs-cars-trade-trump-lutnick-carney-2/,No byline found,No article type found,"<a href=""https://www.theglobeandmail.com/canada/article-auto-tariffs-cars-trade-trump-lutnick-carney-2/"">No going back to former free trade system, Lutnick says</a>"
3,Morning Update: The numbers behind Alberta’s unprecedented teachers’ strike,https://www.theglobeandmail.com/canada/article-morning-update-the-numbers-behind-albertas-unprecedented-teachers/,No byline found,No article type found,"<a href=""https://www.theglobeandmail.com/canada/article-morning-update-the-numbers-behind-albertas-unprecedented-teachers/"">Morning Update: The numbers behind Alberta’s unprecedented teachers’ strike</a>"
4,Joly unveils three-point industrial strategy to counter Trump’s tariffs,https://www.theglobeandmail.com/politics/article-joly-unveils-three-point-industrial-strategy-to-counter-trumps-tariffs/,No byline found,No article type found,"<a href=""https://www.theglobeandmail.com/politics/article-joly-unveils-three-point-industrial-strategy-to-counter-trumps-tariffs/"">Joly unveils three-point industrial strategy to counter Trump’s tariffs</a>"
5,New-look Leafs open their season with a win over rival Canadiens,https://www.theglobeandmail.com/sports/hockey/article-new-look-leafs-open-their-season-with-a-win-over-rival-canadiens/,No byline found,No article type found,"<a href=""https://www.theglobeandmail.com/sports/hockey/article-new-look-leafs-open-their-season-with-a-win-over-rival-canadiens/"">New-look Leafs open their season with a win over rival Canadiens</a>"
6,Will Trump win the Nobel Peace Prize?,https://www.theglobeandmail.com/world/article-trump-nobel-peace-prize/,No byline found,No article type found,"<a href=""https://www.theglobeandmail.com/world/article-trump-nobel-peace-prize/"">Will Trump win the Nobel Peace Prize?</a>"
7,"Wait, did Taylor Swift use generative AI to market The Life of a Showgirl?",https://www.theglobeandmail.com/culture/music/article-taylor-swift-the-life-of-a-showgirl-artificial-intelligence-videos/,Aisling Murphy,Opinion,"<a href=""https://www.theglobeandmail.com/culture/music/article-taylor-swift-the-life-of-a-showgirl-artificial-intelligence-videos/"">Wait, did Taylor Swift use generative AI to market The Life of a Showgirl?</a>"
8,"Canada, U.S. will have bilateral trade deals alongside USMCA, Carney says",https://www.theglobeandmail.com/politics/article-carney-trump-tariffs-trade-poilievre/,No byline found,No article type found,"<a href=""https://www.theglobeandmail.com/politics/article-carney-trump-tariffs-trade-poilievre/"">Canada, U.S. will have bilateral trade deals alongside USMCA, Carney says</a>"
