Rank,Article title,url,Byline,Article type,title_with_link
1,Sam Mraiche was investigated by Elections Alberta over alleged illegal political donations,https://www.theglobeandmail.com/canada/article-sam-mraiche-investigated-by-elections-alberta-alleged-illegal/,No byline found,No article type found,"<a href=""https://www.theglobeandmail.com/canada/article-sam-mraiche-investigated-by-elections-alberta-alleged-illegal/"">Sam Mraiche was investigated by Elections Alberta over alleged illegal political donations</a>"
2,Documentary about Canadian stereo icon Clairtone is music to the ears,https://www.theglobeandmail.com/culture/film-and-tv/film/article-clairtone-documentary-canadian-stereo-company-peter-munk-ron-mann/,No byline found,No article type found,"<a href=""https://www.theglobeandmail.com/culture/film-and-tv/film/article-clairtone-documentary-canadian-stereo-company-peter-munk-ron-mann/"">Documentary about Canadian stereo icon Clairtone is music to the ears</a>"
3,Rio Tinto looks to sell its metal complex in Quebec after G7 investment announcement,https://www.theglobeandmail.com/business/article-rio-tinto-metal-complex-sorel-quebec-investment-assets/,No byline found,No article type found,"<a href=""https://www.theglobeandmail.com/business/article-rio-tinto-metal-complex-sorel-quebec-investment-assets/"">Rio Tinto looks to sell its metal complex in Quebec after G7 investment announcement</a>"
4,"In hearings on the future of the USMCA, business leaders call on Trump to drop tariffs",https://www.theglobeandmail.com/world/article-us-chamber-commerce-calls-for-tariff-drop-canada-mexico/,No byline found,No article type found,"<a href=""https://www.theglobeandmail.com/world/article-us-chamber-commerce-calls-for-tariff-drop-canada-mexico/"">In hearings on the future of the USMCA, business leaders call on Trump to drop tariffs</a>"
5,"Stellantis’s decision to shift production to Illinois breaches funding contract, Ottawa says",https://www.theglobeandmail.com/business/article-stellantiss-decision-to-shift-production-to-illinois-breaches-funding/,No byline found,No article type found,"<a href=""https://www.theglobeandmail.com/business/article-stellantiss-decision-to-shift-production-to-illinois-breaches-funding/"">Stellantis’s decision to shift production to Illinois breaches funding contract, Ottawa says</a>"
6,"Five offers for Markham bungaloft next to golf course after $190,000 price cut",https://www.theglobeandmail.com/real-estate/toronto/article-five-offers-for-markham-bungaloft-next-to-golf-course-after-price-cut/,No byline found,No article type found,"<a href=""https://www.theglobeandmail.com/real-estate/toronto/article-five-offers-for-markham-bungaloft-next-to-golf-course-after-price-cut/"">Five offers for Markham bungaloft next to golf course after $190,000 price cut</a>"
7,Alberta proposing sweeping changes to election and referendum laws,https://www.theglobeandmail.com/canada/alberta/article-alberta-changes-political-parties-election-referendum-laws/,No byline found,No article type found,"<a href=""https://www.theglobeandmail.com/canada/alberta/article-alberta-changes-political-parties-election-referendum-laws/"">Alberta proposing sweeping changes to election and referendum laws</a>"
8,"Telus halted dividend growth because of share price drop, CFO says",https://www.theglobeandmail.com/business/article-telus-halted-dividend-growth-share-price-drop/,No byline found,No article type found,"<a href=""https://www.theglobeandmail.com/business/article-telus-halted-dividend-growth-share-price-drop/"">Telus halted dividend growth because of share price drop, CFO says</a>"
