Rank,Article title,url,Byline,Article type,title_with_link
1,Mad King Trump would break the world to gain Greenland,https://www.theglobeandmail.com/politics/opinion/article-mad-king-trump-would-break-the-world-to-gain-greenland/,Campbell Clark,Opinion,"<a href=""https://www.theglobeandmail.com/politics/opinion/article-mad-king-trump-would-break-the-world-to-gain-greenland/"">Mad King Trump would break the world to gain Greenland</a>"
2,"Canada plans to send soldiers to Greenland as show of NATO solidarity with Denmark, officials say",https://www.theglobeandmail.com/politics/article-canada-soldiers-greenland-nato-training-denmark-tariffs-donald-trump/,No byline found,No article type found,"<a href=""https://www.theglobeandmail.com/politics/article-canada-soldiers-greenland-nato-training-denmark-tariffs-donald-trump/"">Canada plans to send soldiers to Greenland as show of NATO solidarity with Denmark, officials say</a>"
3,Is it illegal to stop before turning right at a green light?,https://www.theglobeandmail.com/drive/culture/article-is-it-illegal-to-stop-before-turning-right-at-a-green-light/,No byline found,No article type found,"<a href=""https://www.theglobeandmail.com/drive/culture/article-is-it-illegal-to-stop-before-turning-right-at-a-green-light/"">Is it illegal to stop before turning right at a green light?</a>"
4,Six portfolios for dividend investors to ponder,https://www.theglobeandmail.com/investing/markets/inside-the-market/article-six-portfolios-for-dividend-investors-to-ponder/,No byline found,No article type found,"<a href=""https://www.theglobeandmail.com/investing/markets/inside-the-market/article-six-portfolios-for-dividend-investors-to-ponder/"">Six portfolios for dividend investors to ponder</a>"
5,Greenland has become the epicentre of the growing rift between Europe and the U.S.,https://www.theglobeandmail.com/world/article-greenland-epicentre-growing-rift-between-europe-us/,No byline found,No article type found,"<a href=""https://www.theglobeandmail.com/world/article-greenland-epicentre-growing-rift-between-europe-us/"">Greenland has become the epicentre of the growing rift between Europe and the U.S.</a>"
6,"Dear birdwatchers, it’s ‘leave the owls alone’ season",https://www.theglobeandmail.com/life/article-dear-birdwatchers-its-leave-the-owls-alone-season/,No byline found,No article type found,"<a href=""https://www.theglobeandmail.com/life/article-dear-birdwatchers-its-leave-the-owls-alone-season/"">Dear birdwatchers, it’s ‘leave the owls alone’ season</a>"
7,Unsettled by current events? Take comfort in these stable dividends,https://www.theglobeandmail.com/investing/markets/inside-the-market/article-unsettled-by-current-events-take-comfort-in-these-stable-dividends/,No byline found,No article type found,"<a href=""https://www.theglobeandmail.com/investing/markets/inside-the-market/article-unsettled-by-current-events-take-comfort-in-these-stable-dividends/"">Unsettled by current events? Take comfort in these stable dividends</a>"
8,Supreme Court weighs road safety against racial profiling in ‘driving while Black’ case,https://www.theglobeandmail.com/canada/article-supreme-court-driving-while-black-racial-profiling/,No byline found,No article type found,"<a href=""https://www.theglobeandmail.com/canada/article-supreme-court-driving-while-black-racial-profiling/"">Supreme Court weighs road safety against racial profiling in ‘driving while Black’ case</a>"
