Rank,Article title,url,Byline,Article type,title_with_link
1,Iran war threatens to cut off another key economic flow from the Gulf: remittances,https://www.theglobeandmail.com/world/article-iran-war-threatens-to-cut-off-another-key-economic-flow-from-the-gulf/,No byline found,No article type found,"<a href=""https://www.theglobeandmail.com/world/article-iran-war-threatens-to-cut-off-another-key-economic-flow-from-the-gulf/"">Iran war threatens to cut off another key economic flow from the Gulf: remittances</a>"
2,"Invoking God, even in the middle of a war, is a tradition in American politics",https://www.theglobeandmail.com/world/us-politics/article-invoking-god-even-in-the-middle-of-a-war-is-a-tradition-in-american/,No byline found,Analysis,"<a href=""https://www.theglobeandmail.com/world/us-politics/article-invoking-god-even-in-the-middle-of-a-war-is-a-tradition-in-american/"">Invoking God, even in the middle of a war, is a tradition in American politics</a>"
3,Learning the ropes of track cycling at Canada’s national velodrome,https://www.theglobeandmail.com/life/article-canada-velodrome-track-cycling/,No byline found,No article type found,"<a href=""https://www.theglobeandmail.com/life/article-canada-velodrome-track-cycling/"">Learning the ropes of track cycling at Canada’s national velodrome</a>"
4,Public servant ‘scared’ to take government’s retirement offer due to issues with Phoenix pay system,https://www.theglobeandmail.com/canada/article-phoenix-pay-system/,No byline found,No article type found,"<a href=""https://www.theglobeandmail.com/canada/article-phoenix-pay-system/"">Public servant ‘scared’ to take government’s retirement offer due to issues with Phoenix pay system</a>"
5,"Young adults can’t afford homes to raise families, and city governments are at fault",https://www.theglobeandmail.com/business/commentary/article-young-adults-cant-afford-homes-to-raise-families-and-city-governments/,John Turley-Ewart,Opinion,"<a href=""https://www.theglobeandmail.com/business/commentary/article-young-adults-cant-afford-homes-to-raise-families-and-city-governments/"">Young adults can’t afford homes to raise families, and city governments are at fault</a>"
6,Afghans are addicted to a call-in TV show that lets them speak freely. It’s just not produced in Afghanistan,https://www.theglobeandmail.com/world/article-afghanistan-jan-e-gap-tv-show/,No byline found,No article type found,"<a href=""https://www.theglobeandmail.com/world/article-afghanistan-jan-e-gap-tv-show/"">Afghans are addicted to a call-in TV show that lets them speak freely. It’s just not produced in Afghanistan</a>"
7,Peptides are booming in the fitness world. Here’s what you should know about the risks,https://www.theglobeandmail.com/life/wellness/fitness/article-peptides-health-safety-influencers-fat-loss-muscle-growth/,No byline found,No article type found,"<a href=""https://www.theglobeandmail.com/life/wellness/fitness/article-peptides-health-safety-influencers-fat-loss-muscle-growth/"">Peptides are booming in the fitness world. Here’s what you should know about the risks</a>"
8,Canada’s Supreme Court is about to hear the case to end all cases,https://www.theglobeandmail.com/opinion/article-canadas-supreme-court-is-about-to-hear-the-case-to-end-all-cases/,Nader R. Hasan,Opinion,"<a href=""https://www.theglobeandmail.com/opinion/article-canadas-supreme-court-is-about-to-hear-the-case-to-end-all-cases/"">Canada’s Supreme Court is about to hear the case to end all cases</a>"
