Rank,Article title,url,Byline,Article type,title_with_link
1,"Trump has ‘won the argument’ on NATO defence spending, Carney says at summit",https://www.theglobeandmail.com/business/article-mark-carney-nato-summit-defence-spending-donald-trump/,No byline found,No article type found,"<a href=""https://www.theglobeandmail.com/business/article-mark-carney-nato-summit-defence-spending-donald-trump/"">Trump has ‘won the argument’ on NATO defence spending, Carney says at summit</a>"
2,Ranking Canada’s best bank loyalty programs – and No. 1 is in a league of its own,https://www.theglobeandmail.com/business/article-ranking-canadas-best-bank-loyalty-programs/,No byline found,No article type found,"<a href=""https://www.theglobeandmail.com/business/article-ranking-canadas-best-bank-loyalty-programs/"">Ranking Canada’s best bank loyalty programs – and No. 1 is in a league of its own</a>"
3,Messi taps into his seemingly endless supply of brilliance in Argentina win,https://www.theglobeandmail.com/sports/soccer/article-messi-seemingly-endless-supply-brilliance-argentina-win/,Cathal Kelly,Opinion,"<a href=""https://www.theglobeandmail.com/sports/soccer/article-messi-seemingly-endless-supply-brilliance-argentina-win/"">Messi taps into his seemingly endless supply of brilliance in Argentina win</a>"
4,Not all rising health care costs stem from an aging population. What else is driving the increase?,https://www.theglobeandmail.com/investing/personal-finance/retirement/article-rising-health-care-costs-aging-population/,No byline found,Analysis,"<a href=""https://www.theglobeandmail.com/investing/personal-finance/retirement/article-rising-health-care-costs-aging-population/"">Not all rising health care costs stem from an aging population. What else is driving the increase?</a>"
5,North American stocks fall as Trump says Iran deal is ‘over’,https://www.theglobeandmail.com/investing/markets/inside-the-market/market-news/article-premarket-us-stock-futures-tumble-as-trump-says-iran-deal-is-over/,No byline found,No article type found,"<a href=""https://www.theglobeandmail.com/investing/markets/inside-the-market/market-news/article-premarket-us-stock-futures-tumble-as-trump-says-iran-deal-is-over/"">North American stocks fall as Trump says Iran deal is ‘over’</a>"
6,"In Hamilton, a Mid-Century Modern marvel slowly decays",https://www.theglobeandmail.com/real-estate/toronto/article-in-hamilton-a-mid-century-modern-marvel-slowly-decays/,No byline found,No article type found,"<a href=""https://www.theglobeandmail.com/real-estate/toronto/article-in-hamilton-a-mid-century-modern-marvel-slowly-decays/"">In Hamilton, a Mid-Century Modern marvel slowly decays</a>"
7,First images of Shackleton shipwreck captured on ocean floor,https://www.theglobeandmail.com/politics/article-first-pictures-of-shackleton-shipwreck-captured-on-ocean-floor/,No byline found,No article type found,"<a href=""https://www.theglobeandmail.com/politics/article-first-pictures-of-shackleton-shipwreck-captured-on-ocean-floor/"">First images of Shackleton shipwreck captured on ocean floor</a>"
8,Canada’s World Cup games are over. What’s left behind?,https://www.theglobeandmail.com/canada/article-canadas-world-cup-games-are-over-whats-left-behind/,No byline found,No article type found,"<a href=""https://www.theglobeandmail.com/canada/article-canadas-world-cup-games-are-over-whats-left-behind/"">Canada’s World Cup games are over. What’s left behind?</a>"
