Rank,Article title,url,Byline,Article type,title_with_link
1,"After an unexpected release from prison, Belarus’s ‘First Couple’ tries to find a way to carry on",https://www.theglobeandmail.com/world/article-after-an-unexpected-release-from-prison-belaruss-first-couple-try-to/,No byline found,No article type found,"<a href=""https://www.theglobeandmail.com/world/article-after-an-unexpected-release-from-prison-belaruss-first-couple-try-to/"">After an unexpected release from prison, Belarus’s ‘First Couple’ tries to find a way to carry on</a>"
2,"Federal public service could lose nearly 60,000 jobs as Ottawa plans cost cuts: report",https://www.theglobeandmail.com/canada/article-federal-public-service-could-lose-nearly-60000-jobs-as-ottawa-plans/,No byline found,No article type found,"<a href=""https://www.theglobeandmail.com/canada/article-federal-public-service-could-lose-nearly-60000-jobs-as-ottawa-plans/"">Federal public service could lose nearly 60,000 jobs as Ottawa plans cost cuts: report</a>"
3,Rescue under way for three miners trapped behind pile of debris in B.C.’s Red Chris mine,https://www.theglobeandmail.com/canada/article-trapped-miners-bc-red-chris-newmont-mine/,No byline found,No article type found,"<a href=""https://www.theglobeandmail.com/canada/article-trapped-miners-bc-red-chris-newmont-mine/"">Rescue under way for three miners trapped behind pile of debris in B.C.’s Red Chris mine</a>"
4,"Number of federal public service jobs could drop by almost 60,000, report predicts",https://www.theglobeandmail.com/canada/article-federal-public-service-jobs-could-drop-by-60000/,No byline found,No article type found,"<a href=""https://www.theglobeandmail.com/canada/article-federal-public-service-jobs-could-drop-by-60000/"">Number of federal public service jobs could drop by almost 60,000, report predicts</a>"
5,"So, your friend says you can bring your dog to their cottage - should you?",https://www.theglobeandmail.com/opinion/article-dog-visiting-friends-cottage/,Dianne Rinehart,Opinion,"<a href=""https://www.theglobeandmail.com/opinion/article-dog-visiting-friends-cottage/"">So, your friend says you can bring your dog to their cottage - should you?</a>"
6,This retiree was shocked to find herself the beneficiary of an old friend’s will,https://www.theglobeandmail.com/investing/personal-finance/retirement/article-retiree-surprise-will-inheritance-money-beneficiary/,No byline found,No article type found,"<a href=""https://www.theglobeandmail.com/investing/personal-finance/retirement/article-retiree-surprise-will-inheritance-money-beneficiary/"">This retiree was shocked to find herself the beneficiary of an old friend’s will</a>"
7,The bitter truth is that cheaper housing means a retirement crisis for homeowners,https://www.theglobeandmail.com/business/commentary/article-housing-prices-retirement-plan-middle-class/,John Turley-Ewart,Opinion,"<a href=""https://www.theglobeandmail.com/business/commentary/article-housing-prices-retirement-plan-middle-class/"">The bitter truth is that cheaper housing means a retirement crisis for homeowners</a>"
8,"Plane crash in Russia’s Far East kills all 48 people on board, officials say",https://www.theglobeandmail.com/world/article-russia-plane-crash-kills-48/,No byline found,No article type found,"<a href=""https://www.theglobeandmail.com/world/article-russia-plane-crash-kills-48/"">Plane crash in Russia’s Far East kills all 48 people on board, officials say</a>"
