Rank,Article title,url,Byline,Article type,title_with_link
1,Steven Dubois wins gold in men’s 500m short track,https://www.theglobeandmail.com/sports/olympics/article-winter-olympics-2026-steven-dubois-medal-mens-500m-short-track/,No byline found,No article type found,"<a href=""https://www.theglobeandmail.com/sports/olympics/article-winter-olympics-2026-steven-dubois-medal-mens-500m-short-track/"">Steven Dubois wins gold in men’s 500m short track</a>"
2,Investor buys Barrie bungalow after conditional sale falls through,https://www.theglobeandmail.com/real-estate/toronto/article-investor-buys-barrie-bungalow-after-conditional-sale-falls-through/,No byline found,No article type found,"<a href=""https://www.theglobeandmail.com/real-estate/toronto/article-investor-buys-barrie-bungalow-after-conditional-sale-falls-through/"">Investor buys Barrie bungalow after conditional sale falls through</a>"
3,General Motors to invest $63-million for upgrade at Oshawa plant,https://www.theglobeandmail.com/business/article-general-motors-to-invest-63-million-for-upgrade-at-oshawa-plant/,No byline found,No article type found,"<a href=""https://www.theglobeandmail.com/business/article-general-motors-to-invest-63-million-for-upgrade-at-oshawa-plant/"">General Motors to invest $63-million for upgrade at Oshawa plant</a>"
4,Wednesday’s analyst upgrades and downgrades,https://www.theglobeandmail.com/investing/markets/inside-the-market/article-wednesdays-analyst-upgrades-and-downgrades-291/,No byline found,No article type found,"<a href=""https://www.theglobeandmail.com/investing/markets/inside-the-market/article-wednesdays-analyst-upgrades-and-downgrades-291/"">Wednesday’s analyst upgrades and downgrades</a>"
5,"Dubois wins gold in men’s 500m, Canadian women take relay bronze in big night for short track",https://www.theglobeandmail.com/sports/olympics/article-winter-olympics-2026-canada-vs-czechia-mens-hockey-quarterfinal-score/,No byline found,No article type found,"<a href=""https://www.theglobeandmail.com/sports/olympics/article-winter-olympics-2026-canada-vs-czechia-mens-hockey-quarterfinal-score/"">Dubois wins gold in men’s 500m, Canadian women take relay bronze in big night for short track</a>"
6,Seven fast-growing Canadian stocks with sustainably rising dividends,https://www.theglobeandmail.com/investing/investment-ideas/number-cruncher/article-canadian-stocks-sustainable-dividends-investing-advice/,No byline found,No article type found,"<a href=""https://www.theglobeandmail.com/investing/investment-ideas/number-cruncher/article-canadian-stocks-sustainable-dividends-investing-advice/"">Seven fast-growing Canadian stocks with sustainably rising dividends</a>"
7,Conservative MP Matt Jeneroux crosses floor to Liberals,https://www.theglobeandmail.com/politics/article-conservative-matt-jeneroux-joins-liberals/,No byline found,No article type found,"<a href=""https://www.theglobeandmail.com/politics/article-conservative-matt-jeneroux-joins-liberals/"">Conservative MP Matt Jeneroux crosses floor to Liberals</a>"
8,"Canada wins bronze in women’s 3,000m short-track relay",https://www.theglobeandmail.com/sports/olympics/article-winter-olympics-2026-canada-medal-short-track-womens-3000m-relay/,No byline found,No article type found,"<a href=""https://www.theglobeandmail.com/sports/olympics/article-winter-olympics-2026-canada-medal-short-track-womens-3000m-relay/"">Canada wins bronze in women’s 3,000m short-track relay</a>"
