Rank,Article title,url,Byline,Article type,title_with_link
1,Sam Mraiche was investigated by Elections Alberta over alleged illegal political donations,https://www.theglobeandmail.com/canada/article-sam-mraiche-investigated-by-elections-alberta-alleged-illegal/,No byline found,No article type found,"<a href=""https://www.theglobeandmail.com/canada/article-sam-mraiche-investigated-by-elections-alberta-alleged-illegal/"">Sam Mraiche was investigated by Elections Alberta over alleged illegal political donations</a>"
2,Bungalow outside Edmonton sells in one day to the first bidder,https://www.theglobeandmail.com/real-estate/calgary-and-edmonton/article-bungalow-outside-edmonton-sells-in-one-day-to-the-first-bidder/,No byline found,No article type found,"<a href=""https://www.theglobeandmail.com/real-estate/calgary-and-edmonton/article-bungalow-outside-edmonton-sells-in-one-day-to-the-first-bidder/"">Bungalow outside Edmonton sells in one day to the first bidder</a>"
3,Do you really understand the forms you’re signing with your financial adviser?,https://www.theglobeandmail.com/investing/personal-finance/retirement/article-do-you-really-understand-the-forms-youre-signing-with-your-financial/,No byline found,No article type found,"<a href=""https://www.theglobeandmail.com/investing/personal-finance/retirement/article-do-you-really-understand-the-forms-youre-signing-with-your-financial/"">Do you really understand the forms you’re signing with your financial adviser?</a>"
4,Rio Tinto looks to sell its metal complex in Quebec after G7 investment announcement,https://www.theglobeandmail.com/business/article-rio-tinto-metal-complex-sorel-quebec-investment-assets/,No byline found,No article type found,"<a href=""https://www.theglobeandmail.com/business/article-rio-tinto-metal-complex-sorel-quebec-investment-assets/"">Rio Tinto looks to sell its metal complex in Quebec after G7 investment announcement</a>"
5,"In hearings on the future of the USMCA, business leaders call on Trump to drop tariffs",https://www.theglobeandmail.com/world/article-us-chamber-commerce-calls-for-tariff-drop-canada-mexico/,No byline found,No article type found,"<a href=""https://www.theglobeandmail.com/world/article-us-chamber-commerce-calls-for-tariff-drop-canada-mexico/"">In hearings on the future of the USMCA, business leaders call on Trump to drop tariffs</a>"
6,The City of Ottawa’s Hail Mary plan for redevelopment,https://www.theglobeandmail.com/opinion/editorials/article-the-city-of-ottawas-hail-mary-plan-for-redevelopment/,No byline found,No article type found,"<a href=""https://www.theglobeandmail.com/opinion/editorials/article-the-city-of-ottawas-hail-mary-plan-for-redevelopment/"">The City of Ottawa’s Hail Mary plan for redevelopment</a>"
7,"Holiday movie advent calendar, Day 5: Holiday Touchdown: A Bills Love Story",https://www.theglobeandmail.com/culture/film-and-tv/film/article-holiday-movie-advent-calendar-day-3-oh-what-fun/,No byline found,No article type found,"<a href=""https://www.theglobeandmail.com/culture/film-and-tv/film/article-holiday-movie-advent-calendar-day-3-oh-what-fun/"">Holiday movie advent calendar, Day 5: Holiday Touchdown: A Bills Love Story</a>"
8,"Netflix to buy Warner Bros Discovery’s studios, streaming unit for US$72-billion",https://www.theglobeandmail.com/business/article-netflix-to-buy-warner-bros-discoverys-studios-streaming-unit-for-us72/,No byline found,No article type found,"<a href=""https://www.theglobeandmail.com/business/article-netflix-to-buy-warner-bros-discoverys-studios-streaming-unit-for-us72/"">Netflix to buy Warner Bros Discovery’s studios, streaming unit for US$72-billion</a>"
