Rank,Article title,url,Byline,Article type,title_with_link
1,Warsaw buzzes with final performances at Chopin contest,https://www.theglobeandmail.com/culture/music/article-international-fryderyk-chopin-competition-warsaw-finalists-kevin-chen/,No byline found,No article type found,"<a href=""https://www.theglobeandmail.com/culture/music/article-international-fryderyk-chopin-competition-warsaw-finalists-kevin-chen/"">Warsaw buzzes with final performances at Chopin contest</a>"
2,Why I’m done with all of the divisive (and useless) parenting labels,https://www.theglobeandmail.com/life/advice/parenting/article-gentle-parenting-authoritarian-fafo-parent-labels-raising-children/,Amberly McAteer,Opinion,"<a href=""https://www.theglobeandmail.com/life/advice/parenting/article-gentle-parenting-authoritarian-fafo-parent-labels-raising-children/"">Why I’m done with all of the divisive (and useless) parenting labels</a>"
3,Richmond warns property owners B.C. Supreme Court decision could ‘negatively affect title’,https://www.theglobeandmail.com/canada/british-columbia/article-richmond-bc-supreme-court-property-owners-aboriginal-title/,No byline found,No article type found,"<a href=""https://www.theglobeandmail.com/canada/british-columbia/article-richmond-bc-supreme-court-property-owners-aboriginal-title/"">Richmond warns property owners B.C. Supreme Court decision could ‘negatively affect title’</a>"
4,Canada’s costly EV scheme stalls out again,https://www.theglobeandmail.com/opinion/editorials/article-canada-ottawa-electric-vehicles-stellantis-us-trump-carney/,No byline found,No article type found,"<a href=""https://www.theglobeandmail.com/opinion/editorials/article-canada-ottawa-electric-vehicles-stellantis-us-trump-carney/"">Canada’s costly EV scheme stalls out again</a>"
5,"Ottawa to unveil anti-fraud, financial security measures today ahead of budget",https://www.theglobeandmail.com/business/article-francois-philippe-champagne-anti-fraud-financial-security-measures/,No byline found,No article type found,"<a href=""https://www.theglobeandmail.com/business/article-francois-philippe-champagne-anti-fraud-financial-security-measures/"">Ottawa to unveil anti-fraud, financial security measures today ahead of budget</a>"
6,The Price Point: What kind of house does $1.4-million get you in Toronto?,https://www.theglobeandmail.com/real-estate/article-price-point-monthly-house-price-toronto-september-2025/,No byline found,No article type found,"<a href=""https://www.theglobeandmail.com/real-estate/article-price-point-monthly-house-price-toronto-september-2025/"">The Price Point: What kind of house does $1.4-million get you in Toronto?</a>"
7,Morning Update: Renewed hostilities threaten ceasefire,https://www.theglobeandmail.com/canada/article-morning-update-renewed-hostilities-threaten-ceasefire/,No byline found,No article type found,"<a href=""https://www.theglobeandmail.com/canada/article-morning-update-renewed-hostilities-threaten-ceasefire/"">Morning Update: Renewed hostilities threaten ceasefire</a>"
8,Eat these 5 foods to boost your immunity,https://www.theglobeandmail.com/life/health-and-fitness/article-health-diet-immune-system-nutrients/,No byline found,No article type found,"<a href=""https://www.theglobeandmail.com/life/health-and-fitness/article-health-diet-immune-system-nutrients/"">Eat these 5 foods to boost your immunity</a>"
