Rank,Article title,url,Byline,Article type,title_with_link
1,"Bank of Canada, Fed expected to remain on hold as Trump’s tariffs, attacks on Powell muddy monetary policy",https://www.theglobeandmail.com/business/article-bank-of-canada-federal-reserve-rate-decision/,No byline found,No article type found,"<a href=""https://www.theglobeandmail.com/business/article-bank-of-canada-federal-reserve-rate-decision/"">Bank of Canada, Fed expected to remain on hold as Trump’s tariffs, attacks on Powell muddy monetary policy</a>"
2,England beats Spain 3-1 in penalties to win Euro 2025,https://www.theglobeandmail.com/sports/soccer/article-womens-euro-2025-england-beat-spain/,No byline found,No article type found,"<a href=""https://www.theglobeandmail.com/sports/soccer/article-womens-euro-2025-england-beat-spain/"">England beats Spain 3-1 in penalties to win Euro 2025</a>"
3,"At the bars lining London’s streets, the Hockey Canada verdict hits close to home",https://www.theglobeandmail.com/canada/article-london-ontario-reaction-hockey-canada-trial-jacks/,No byline found,No article type found,"<a href=""https://www.theglobeandmail.com/canada/article-london-ontario-reaction-hockey-canada-trial-jacks/"">At the bars lining London’s streets, the Hockey Canada verdict hits close to home</a>"
4,The bitter truth is that cheaper housing means a retirement crisis for homeowners,https://www.theglobeandmail.com/business/commentary/article-housing-prices-retirement-plan-middle-class/,John Turley-Ewart,Opinion,"<a href=""https://www.theglobeandmail.com/business/commentary/article-housing-prices-retirement-plan-middle-class/"">The bitter truth is that cheaper housing means a retirement crisis for homeowners</a>"
5,Two offers for Toronto condo ‘almost unheard of’ in current market,https://www.theglobeandmail.com/real-estate/toronto/article-toronto-bloor-condo-spring-market/,No byline found,No article type found,"<a href=""https://www.theglobeandmail.com/real-estate/toronto/article-toronto-bloor-condo-spring-market/"">Two offers for Toronto condo ‘almost unheard of’ in current market</a>"
6,My estranged father died in hospital after years of drug use. He was more than a statistic,https://www.theglobeandmail.com/opinion/article-my-estranged-father-died-in-hospital-after-years-of-drug-use-he-was/,No byline found,No article type found,"<a href=""https://www.theglobeandmail.com/opinion/article-my-estranged-father-died-in-hospital-after-years-of-drug-use-he-was/"">My estranged father died in hospital after years of drug use. He was more than a statistic</a>"
7,Mark Carney faces the politics of concession,https://www.theglobeandmail.com/politics/opinion/article-carney-trump-trade-deal-us-tariffs-concession/,Campbell Clark,Opinion,"<a href=""https://www.theglobeandmail.com/politics/opinion/article-carney-trump-trade-deal-us-tariffs-concession/"">Mark Carney faces the politics of concession</a>"
8,Social media is serving up big muscles and normalizing steroid use,https://www.theglobeandmail.com/life/health-and-fitness/article-social-media-shame-steroids-testosterone-mens-health/,No byline found,No article type found,"<a href=""https://www.theglobeandmail.com/life/health-and-fitness/article-social-media-shame-steroids-testosterone-mens-health/"">Social media is serving up big muscles and normalizing steroid use</a>"
