Rank,Article title,url,Byline,Article type,title_with_link
1,Three keys to cutting your risk of heart attack and stroke,https://www.theglobeandmail.com/life/wellness/article-small-changes-to-improve-heart-health-sleep-diet-exercise/,No byline found,No article type found,"<a href=""https://www.theglobeandmail.com/life/wellness/article-small-changes-to-improve-heart-health-sleep-diet-exercise/"">Three keys to cutting your risk of heart attack and stroke</a>"
2,"Ontario overhauls MAID oversight committee, critics say it’s to remove dissenters",https://www.theglobeandmail.com/canada/article-ontario-overhauls-maid-oversight-committee-critics-say-its-to-remove/,No byline found,No article type found,"<a href=""https://www.theglobeandmail.com/canada/article-ontario-overhauls-maid-oversight-committee-critics-say-its-to-remove/"">Ontario overhauls MAID oversight committee, critics say it’s to remove dissenters</a>"
3,Trump administration moves to erase seditious conspiracy convictions against Oath Keepers and Proud Boys,https://www.theglobeandmail.com/world/article-oath-keepers-proud-boys-us-justice-department/,No byline found,No article type found,"<a href=""https://www.theglobeandmail.com/world/article-oath-keepers-proud-boys-us-justice-department/"">Trump administration moves to erase seditious conspiracy convictions against Oath Keepers and Proud Boys</a>"
4,This is what a Donald Trump with few friends and fewer options looks like,https://www.theglobeandmail.com/world/us-politics/article-this-is-what-a-donald-trump-with-few-friends-and-fewer-options-looks/,No byline found,Analysis,"<a href=""https://www.theglobeandmail.com/world/us-politics/article-this-is-what-a-donald-trump-with-few-friends-and-fewer-options-looks/"">This is what a Donald Trump with few friends and fewer options looks like</a>"
5,Attendance to count for sizable portion of high school final grades in Ontario,https://www.theglobeandmail.com/canada/article-ontario-high-school-final-grades-attendance/,No byline found,No article type found,"<a href=""https://www.theglobeandmail.com/canada/article-ontario-high-school-final-grades-attendance/"">Attendance to count for sizable portion of high school final grades in Ontario</a>"
6,Iran trolls Trump on social media after he launches his own blockade of the Strait of Hormuz,https://www.theglobeandmail.com/world/us-politics/article-iran-trolls-trump-on-social-media-after-he-launches-his-own-blockade/,No byline found,No article type found,"<a href=""https://www.theglobeandmail.com/world/us-politics/article-iran-trolls-trump-on-social-media-after-he-launches-his-own-blockade/"">Iran trolls Trump on social media after he launches his own blockade of the Strait of Hormuz</a>"
7,Canadians aren’t spending as many years in retirement as they used to,https://www.theglobeandmail.com/investing/personal-finance/article-canadians-retirement-age-time-spent/,No byline found,No article type found,"<a href=""https://www.theglobeandmail.com/investing/personal-finance/article-canadians-retirement-age-time-spent/"">Canadians aren’t spending as many years in retirement as they used to</a>"
8,Why Pierre Poilievre might quietly welcome the new Liberal majority,https://www.theglobeandmail.com/opinion/article-why-pierre-poilievre-might-quietly-welcome-the-new-liberal-majority/,Robyn Urback,Opinion,"<a href=""https://www.theglobeandmail.com/opinion/article-why-pierre-poilievre-might-quietly-welcome-the-new-liberal-majority/"">Why Pierre Poilievre might quietly welcome the new Liberal majority</a>"
