Rank,Article title,url,Byline,Article type,title_with_link
1,Are we approaching the ‘Silent Spring’ of artificial intelligence?,https://www.theglobeandmail.com/opinion/article-artificial-intelligence-risks-anthropic-claude-mythos/,Peter W. Klein,Opinion,"<a href=""https://www.theglobeandmail.com/opinion/article-artificial-intelligence-risks-anthropic-claude-mythos/"">Are we approaching the ‘Silent Spring’ of artificial intelligence?</a>"
2,Are Einar and Jamila saving enough to retire and ensure their disabled child’s financial security?,https://www.theglobeandmail.com/investing/personal-finance/financial-facelift/article-einar-jamila-saving-enough-retire-disabled-child/,No byline found,No article type found,"<a href=""https://www.theglobeandmail.com/investing/personal-finance/financial-facelift/article-einar-jamila-saving-enough-retire-disabled-child/"">Are Einar and Jamila saving enough to retire and ensure their disabled child’s financial security?</a>"
3,Something Very Bad Is Going to Happen peels back the horrors of marriage,https://www.theglobeandmail.com/culture/film-and-tv/television/article-something-very-bad-is-going-to-happen-review/,No byline found,No article type found,"<a href=""https://www.theglobeandmail.com/culture/film-and-tv/television/article-something-very-bad-is-going-to-happen-review/"">Something Very Bad Is Going to Happen peels back the horrors of marriage</a>"
4,"War broke the Gulf states’ security umbrella. Now, the UAE fears stormy weather ahead",https://www.theglobeandmail.com/world/article-war-gulf-states-security-umbrella-uae/,No byline found,No article type found,"<a href=""https://www.theglobeandmail.com/world/article-war-gulf-states-security-umbrella-uae/"">War broke the Gulf states’ security umbrella. Now, the UAE fears stormy weather ahead</a>"
5,Joining the EU would be a ridiculous response to Canada’s real problems,https://www.theglobeandmail.com/opinion/article-joining-the-eu-would-be-a-ridiculous-response-to-canadas-problems/,Andrew Coyne,Opinion,"<a href=""https://www.theglobeandmail.com/opinion/article-joining-the-eu-would-be-a-ridiculous-response-to-canadas-problems/"">Joining the EU would be a ridiculous response to Canada’s real problems</a>"
6,Iran reopens Strait of Hormuz but says it could close again if U.S. blockade continues,https://www.theglobeandmail.com/world/article-iran-us-war-ceasefire-lebanon-israel/,No byline found,No article type found,"<a href=""https://www.theglobeandmail.com/world/article-iran-us-war-ceasefire-lebanon-israel/"">Iran reopens Strait of Hormuz but says it could close again if U.S. blockade continues</a>"
7,"U.S. negotiators would do well to read some Iranian poetry. It matters, greatly",https://www.theglobeandmail.com/world/article-us-negotiators-iranian-poetry-history/,No byline found,Analysis,"<a href=""https://www.theglobeandmail.com/world/article-us-negotiators-iranian-poetry-history/"">U.S. negotiators would do well to read some Iranian poetry. It matters, greatly</a>"
8,"Air Canada suspends flights to New York’s JFK airport, citing surging jet fuel costs",https://www.theglobeandmail.com/business/article-airline-flight-cancellations-fuel-air-canada-toronto-montreal-jfk/,No byline found,No article type found,"<a href=""https://www.theglobeandmail.com/business/article-airline-flight-cancellations-fuel-air-canada-toronto-montreal-jfk/"">Air Canada suspends flights to New York’s JFK airport, citing surging jet fuel costs</a>"
