Rank,Article title,url,Byline,Article type,title_with_link
1,"Aid the Cuban people, not their oppressors",https://www.theglobeandmail.com/opinion/editorials/article-aid-the-cuban-people-not-their-oppressors/,No byline found,No article type found,"<a href=""https://www.theglobeandmail.com/opinion/editorials/article-aid-the-cuban-people-not-their-oppressors/"">Aid the Cuban people, not their oppressors</a>"
2,"CBS lawyers pulled James Talarico interview over fears it would violate Trump’s regulations, Stephen Colbert says",https://www.theglobeandmail.com/arts/article-james-talarico-stephen-colbert-late-show-cbs/,No byline found,No article type found,"<a href=""https://www.theglobeandmail.com/arts/article-james-talarico-stephen-colbert-late-show-cbs/"">CBS lawyers pulled James Talarico interview over fears it would violate Trump’s regulations, Stephen Colbert says</a>"
3,Wednesday’s analyst upgrades and downgrades,https://www.theglobeandmail.com/investing/markets/inside-the-market/article-wednesdays-analyst-upgrades-and-downgrades-291/,No byline found,No article type found,"<a href=""https://www.theglobeandmail.com/investing/markets/inside-the-market/article-wednesdays-analyst-upgrades-and-downgrades-291/"">Wednesday’s analyst upgrades and downgrades</a>"
4,General Motors to invest $63-million for upgrade at Oshawa plant,https://www.theglobeandmail.com/business/article-general-motors-to-invest-63-million-for-upgrade-at-oshawa-plant/,No byline found,No article type found,"<a href=""https://www.theglobeandmail.com/business/article-general-motors-to-invest-63-million-for-upgrade-at-oshawa-plant/"">General Motors to invest $63-million for upgrade at Oshawa plant</a>"
5,Canada faces Czechia in men’s hockey quarters; ‘beat-up’ McMorris finishes 8th in slopestyle,https://www.theglobeandmail.com/sports/olympics/article-winter-olympics-2026-canada-vs-czechia-mens-hockey-quarterfinal-score/,No byline found,No article type found,"<a href=""https://www.theglobeandmail.com/sports/olympics/article-winter-olympics-2026-canada-vs-czechia-mens-hockey-quarterfinal-score/"">Canada faces Czechia in men’s hockey quarters; ‘beat-up’ McMorris finishes 8th in slopestyle</a>"
6,Seven fast-growing Canadian stocks with sustainably rising dividends,https://www.theglobeandmail.com/investing/investment-ideas/number-cruncher/article-canadian-stocks-sustainable-dividends-investing-advice/,No byline found,No article type found,"<a href=""https://www.theglobeandmail.com/investing/investment-ideas/number-cruncher/article-canadian-stocks-sustainable-dividends-investing-advice/"">Seven fast-growing Canadian stocks with sustainably rising dividends</a>"
7,Conservative MP Matt Jeneroux crosses floor to Liberals,https://www.theglobeandmail.com/politics/article-conservative-matt-jeneroux-joins-liberals/,No byline found,No article type found,"<a href=""https://www.theglobeandmail.com/politics/article-conservative-matt-jeneroux-joins-liberals/"">Conservative MP Matt Jeneroux crosses floor to Liberals</a>"
8,"Despite recent wins, Milan is failing Canada’s Olympic vibe test",https://www.theglobeandmail.com/sports/olympics/article-winter-olympics-2026-canada-medal-count-comparison-depth-problem/,Cathal Kelly,Opinion,"<a href=""https://www.theglobeandmail.com/sports/olympics/article-winter-olympics-2026-canada-medal-count-comparison-depth-problem/"">Despite recent wins, Milan is failing Canada’s Olympic vibe test</a>"
