Rank,Article title,url,Byline,Article type,title_with_link
1,How Trump plans to continue his trade war with Canada without IEEPA,https://www.theglobeandmail.com/business/article-how-trump-plans-to-continue-trade-war-supreme-court-ieepa/,No byline found,No article type found,"<a href=""https://www.theglobeandmail.com/business/article-how-trump-plans-to-continue-trade-war-supreme-court-ieepa/"">How Trump plans to continue his trade war with Canada without IEEPA</a>"
2,What to watch this weekend: Netflix’s German spy thriller Unfamiliar is uber entertaining,https://www.theglobeandmail.com/culture/film-and-tv/television/article-tv-unfamiliar-detectorists-bugonia-bravest-knight-judge-tyco/,No byline found,No article type found,"<a href=""https://www.theglobeandmail.com/culture/film-and-tv/television/article-tv-unfamiliar-detectorists-bugonia-bravest-knight-judge-tyco/"">What to watch this weekend: Netflix’s German spy thriller Unfamiliar is uber entertaining</a>"
3,How the West should handle the return of Russian flags to the Games,https://www.theglobeandmail.com/sports/olympics/article-if-the-world-doesnt-want-russian-flags-at-la-28-were-going-to-need/,Cathal Kelly,Opinion,"<a href=""https://www.theglobeandmail.com/sports/olympics/article-if-the-world-doesnt-want-russian-flags-at-la-28-were-going-to-need/"">How the West should handle the return of Russian flags to the Games</a>"
4,The Globe’s 20 best dividend-paying stocks of the year,https://www.theglobeandmail.com/investing/markets/inside-the-market/article-dividend-all-stars-20-best-performing-dividend-stocks-tsx/,No byline found,No article type found,"<a href=""https://www.theglobeandmail.com/investing/markets/inside-the-market/article-dividend-all-stars-20-best-performing-dividend-stocks-tsx/"">The Globe’s 20 best dividend-paying stocks of the year</a>"
5,Now is the time to invest like a coward,https://www.theglobeandmail.com/investing/markets/inside-the-market/article-time-to-invest-like-a-coward-markets/,No byline found,No article type found,"<a href=""https://www.theglobeandmail.com/investing/markets/inside-the-market/article-time-to-invest-like-a-coward-markets/"">Now is the time to invest like a coward</a>"
6,Retired constable charged in Project South corruption probe has first hearing,https://www.theglobeandmail.com/canada/article-retired-constable-charged-project-south-corruption-probe-first-hearing/,No byline found,No article type found,"<a href=""https://www.theglobeandmail.com/canada/article-retired-constable-charged-project-south-corruption-probe-first-hearing/"">Retired constable charged in Project South corruption probe has first hearing</a>"
7,The tragic war in Ukraine has become tragically normal,https://www.theglobeandmail.com/world/article-the-tragic-war-in-ukraine-has-become-tragically-normal/,No byline found,No article type found,"<a href=""https://www.theglobeandmail.com/world/article-the-tragic-war-in-ukraine-has-become-tragically-normal/"">The tragic war in Ukraine has become tragically normal</a>"
8,"A ruling against Trump’s tariffs changes nothing, and everything",https://www.theglobeandmail.com/business/commentary/article-ruling-against-donald-trump-trade-policies-tariffs-supreme-court/,Tony Keller,Opinion,"<a href=""https://www.theglobeandmail.com/business/commentary/article-ruling-against-donald-trump-trade-policies-tariffs-supreme-court/"">A ruling against Trump’s tariffs changes nothing, and everything</a>"
