Rank,Article title,url,title_with_link
1,Mexico’s Sheinbaum says ‘no need’ for bilateral trade deal with Canada,https://globalnews.ca/news/11321040/canada-mexico-trade-sheinbaum/,"<a href=""https://globalnews.ca/news/11321040/canada-mexico-trade-sheinbaum/"">Mexico’s Sheinbaum says ‘no need’ for bilateral trade deal with Canada</a>"
2,Air Canada flight attendants have voted to strike. What comes next?,https://globalnews.ca/news/11320440/air-canada-flight-attendants-vote-strike-timeline/,"<a href=""https://globalnews.ca/news/11320440/air-canada-flight-attendants-vote-strike-timeline/"">Air Canada flight attendants have voted to strike. What comes next?</a>"
3,This viral chocolate is part of a salmonella risk recall as 9 hospitalized,https://globalnews.ca/news/11320379/canada-food-recall-health-notice-salmonella-outbreak/,"<a href=""https://globalnews.ca/news/11320379/canada-food-recall-health-notice-salmonella-outbreak/"">This viral chocolate is part of a salmonella risk recall as 9 hospitalized</a>"
4,Police investigate mysterious death of fashion designer on New York yacht,https://globalnews.ca/news/11320784/martha-nolan-oslatarra-dead-yacht-montauk-yacht-club-new-york/,"<a href=""https://globalnews.ca/news/11320784/martha-nolan-oslatarra-dead-yacht-montauk-yacht-club-new-york/"">Police investigate mysterious death of fashion designer on New York yacht</a>"
5,"‘Not what you think they are’: Inside a teen facility facing years of red flags, mistreatment claims",https://globalnews.ca/news/11318922/venture-academy-emotional-harm-mistreatment/,"<a href=""https://globalnews.ca/news/11318922/venture-academy-emotional-harm-mistreatment/"">‘Not what you think they are’: Inside a teen facility facing years of red flags, mistreatment claims</a>"
