Rank,Article title,url,Byline,Article type,title_with_link
1,Investor behind Flair Airlines’ expansion charged with US$500-million fraud,https://www.theglobeandmail.com/business/article-investor-behind-flair-airlines-expansion-charged-with-us500-million/,No byline found,No article type found,"<a href=""https://www.theglobeandmail.com/business/article-investor-behind-flair-airlines-expansion-charged-with-us500-million/"">Investor behind Flair Airlines’ expansion charged with US$500-million fraud</a>"
2,Crispr gave humans the power to remake ourselves. What will we do with it?,https://www.theglobeandmail.com/opinion/article-crispr-gene-editing-technology-scientific-breakthrough/,Matt Ridley,Opinion,"<a href=""https://www.theglobeandmail.com/opinion/article-crispr-gene-editing-technology-scientific-breakthrough/"">Crispr gave humans the power to remake ourselves. What will we do with it?</a>"
3,Three reasons to be deeply skeptical about the current gold rally,https://www.theglobeandmail.com/investing/markets/inside-the-market/article-gold-rally-skepticism-market-watchers/,No byline found,No article type found,"<a href=""https://www.theglobeandmail.com/investing/markets/inside-the-market/article-gold-rally-skepticism-market-watchers/"">Three reasons to be deeply skeptical about the current gold rally</a>"
4,Seattle slugger Naylor remains Canadian to the core as he tries to eliminate Blue Jays,https://www.theglobeandmail.com/sports/baseball/article-seattle-mariners-josh-naylor-blue-jays-alcs-mlb-playoffs/,No byline found,No article type found,"<a href=""https://www.theglobeandmail.com/sports/baseball/article-seattle-mariners-josh-naylor-blue-jays-alcs-mlb-playoffs/"">Seattle slugger Naylor remains Canadian to the core as he tries to eliminate Blue Jays</a>"
5,Canada wants to detangle its data from U.S. tech giants. Can it be done?,https://www.theglobeandmail.com/business/technology/article-canada-data-centres-sovereignty-tech-companies-ai/,No byline found,No article type found,"<a href=""https://www.theglobeandmail.com/business/technology/article-canada-data-centres-sovereignty-tech-companies-ai/"">Canada wants to detangle its data from U.S. tech giants. Can it be done?</a>"
6,Neighbours told RCMP they heard car near trailer where Nova Scotia children disappeared,https://www.theglobeandmail.com/canada/article-jack-lilly-sullivan-missing-children-court-documents-nova-scotia/,No byline found,No article type found,"<a href=""https://www.theglobeandmail.com/canada/article-jack-lilly-sullivan-missing-children-court-documents-nova-scotia/"">Neighbours told RCMP they heard car near trailer where Nova Scotia children disappeared</a>"
7,"When it comes to Canadian culture in the U.S. trade war, history is repeating itself",https://www.theglobeandmail.com/culture/article-digital-regulations-trade-talks/,Kate Taylor,Opinion,"<a href=""https://www.theglobeandmail.com/culture/article-digital-regulations-trade-talks/"">When it comes to Canadian culture in the U.S. trade war, history is repeating itself</a>"
8,Louvre shuts to visitors after daylight jewel heist,https://www.theglobeandmail.com/arts/article-louvre-closed-jewel-heist-basket-lift/,No byline found,No article type found,"<a href=""https://www.theglobeandmail.com/arts/article-louvre-closed-jewel-heist-basket-lift/"">Louvre shuts to visitors after daylight jewel heist</a>"
