Rank,Article title,url,title_with_link
1,N.S. man gets ticket on purpose for walking in woods to fight fire-safety ban,https://globalnews.ca/news/11329752/nova-scotia-forest-ban-fine/,"<a href=""https://globalnews.ca/news/11329752/nova-scotia-forest-ban-fine/"">N.S. man gets ticket on purpose for walking in woods to fight fire-safety ban</a>"
2,Montreal father assaulted in front of his children leads to outrage from officials,https://globalnews.ca/news/11328411/montreal-father-assaulted/,"<a href=""https://globalnews.ca/news/11328411/montreal-father-assaulted/"">Montreal father assaulted in front of his children leads to outrage from officials</a>"
3,Malcolm-Jamal Warner’s mother breaks silence weeks after actor’s death,https://globalnews.ca/news/11329580/malcolm-jamal-warner-mother-pamela-warner-speaks-out/,"<a href=""https://globalnews.ca/news/11329580/malcolm-jamal-warner-mother-pamela-warner-speaks-out/"">Malcolm-Jamal Warner’s mother breaks silence weeks after actor’s death</a>"
4,Remains of Antarctic explorer found 66 years after he went missing,https://globalnews.ca/news/11329557/dennis-bell-antarctica-explorer-remains-found/,"<a href=""https://globalnews.ca/news/11329557/dennis-bell-antarctica-explorer-remains-found/"">Remains of Antarctic explorer found 66 years after he went missing</a>"
5,Got a scam text message? How to protect yourself from ‘smishing’,https://globalnews.ca/news/11331071/scam-text-messages-canada-smishing/,"<a href=""https://globalnews.ca/news/11331071/scam-text-messages-canada-smishing/"">Got a scam text message? How to protect yourself from ‘smishing’</a>"
