Rank,Article title,url,Byline,Article type,title_with_link
1,Trump withdraws Carney’s invitation to Board of Peace,https://www.theglobeandmail.com/world/us-politics/article-trump-withdrawing-carneys-invitation-to-board-of-peace/,No byline found,No article type found,"<a href=""https://www.theglobeandmail.com/world/us-politics/article-trump-withdrawing-carneys-invitation-to-board-of-peace/"">Trump withdraws Carney’s invitation to Board of Peace</a>"
2,Carney calls for national unity in face of economic challenges ahead,https://www.theglobeandmail.com/politics/article-carney-address-quebec-city/,No byline found,No article type found,"<a href=""https://www.theglobeandmail.com/politics/article-carney-address-quebec-city/"">Carney calls for national unity in face of economic challenges ahead</a>"
3,Canada’s Armed Forces must be freed to fight,https://www.theglobeandmail.com/opinion/editorials/article-canadas-armed-forces-must-be-freed-to-fight/,No byline found,No article type found,"<a href=""https://www.theglobeandmail.com/opinion/editorials/article-canadas-armed-forces-must-be-freed-to-fight/"">Canada’s Armed Forces must be freed to fight</a>"
4,The Conservative and Liberal responses to Venezuela reflect vastly different foreign-policy outlooks,https://www.theglobeandmail.com/opinion/article-venezuela-conservative-liberal-maduro-trump-foreign-policy-response/,John Ibbitson,Opinion,"<a href=""https://www.theglobeandmail.com/opinion/article-venezuela-conservative-liberal-maduro-trump-foreign-policy-response/"">The Conservative and Liberal responses to Venezuela reflect vastly different foreign-policy outlooks</a>"
5,Reliable dividend stocks with strong gains through cost-cutting,https://www.theglobeandmail.com/investing/investment-ideas/number-cruncher/article-reliable-dividend-stocks-canadian-companies-gains-cost-cutting/,No byline found,No article type found,"<a href=""https://www.theglobeandmail.com/investing/investment-ideas/number-cruncher/article-reliable-dividend-stocks-canadian-companies-gains-cost-cutting/"">Reliable dividend stocks with strong gains through cost-cutting</a>"
6,Chinese carmaker Chery eyes expansion into the Canadian EV market,https://www.theglobeandmail.com/business/article-chinese-carmaker-chery-eyes-expansion-into-the-canadian-ev-market/,No byline found,No article type found,"<a href=""https://www.theglobeandmail.com/business/article-chinese-carmaker-chery-eyes-expansion-into-the-canadian-ev-market/"">Chinese carmaker Chery eyes expansion into the Canadian EV market</a>"
7,U.S. trade policy toward Canada is far more restrictive than tariff rates suggest,https://www.theglobeandmail.com/business/article-us-trade-policy-canada-tariffs-usmca-restrictive/,No byline found,No article type found,"<a href=""https://www.theglobeandmail.com/business/article-us-trade-policy-canada-tariffs-usmca-restrictive/"">U.S. trade policy toward Canada is far more restrictive than tariff rates suggest</a>"
8,CPP payments slow in 2026 as retirees cope with high living costs,https://www.theglobeandmail.com/investing/personal-finance/retirement/article-cpp-payments-2026-retirement-cost-of-living-pension/,No byline found,No article type found,"<a href=""https://www.theglobeandmail.com/investing/personal-finance/retirement/article-cpp-payments-2026-retirement-cost-of-living-pension/"">CPP payments slow in 2026 as retirees cope with high living costs</a>"
