Rank,Article title,url,Byline,Article type,title_with_link
1,Ontario restricts new rental building in favour of Sanofi pharma plant,https://www.theglobeandmail.com/business/article-ontario-restricts-new-rental-building-in-favour-of-sanofi-pharma-plant/,No byline found,No article type found,"<a href=""https://www.theglobeandmail.com/business/article-ontario-restricts-new-rental-building-in-favour-of-sanofi-pharma-plant/"">Ontario restricts new rental building in favour of Sanofi pharma plant</a>"
2,A Facebook Marketplace survival guide for the age of overpriced resellers,https://www.theglobeandmail.com/investing/personal-finance/article-tips-from-two-facebook-marketplace-super-users-in-an-age-of-thrift/,No byline found,No article type found,"<a href=""https://www.theglobeandmail.com/investing/personal-finance/article-tips-from-two-facebook-marketplace-super-users-in-an-age-of-thrift/"">A Facebook Marketplace survival guide for the age of overpriced resellers</a>"
3,"Doug Ford stomps all over Toronto, again",https://www.theglobeandmail.com/canada/toronto/article-doug-ford-stomps-all-over-toronto-again/,Marcus Gee,Opinion,"<a href=""https://www.theglobeandmail.com/canada/toronto/article-doug-ford-stomps-all-over-toronto-again/"">Doug Ford stomps all over Toronto, again</a>"
4,Are wines sold by the glass at restaurants the best deal?,https://www.theglobeandmail.com/life/style/food-and-drink/article-are-wines-sold-by-the-glass-at-restaurants-the-best-deal/,No byline found,No article type found,"<a href=""https://www.theglobeandmail.com/life/style/food-and-drink/article-are-wines-sold-by-the-glass-at-restaurants-the-best-deal/"">Are wines sold by the glass at restaurants the best deal?</a>"
5,How the ‘Dahiya Doctrine’ rose from the ashes in Lebanon,https://www.theglobeandmail.com/world/article-lebanon-israel-beirut-dahiya-doctrine/,No byline found,No article type found,"<a href=""https://www.theglobeandmail.com/world/article-lebanon-israel-beirut-dahiya-doctrine/"">How the ‘Dahiya Doctrine’ rose from the ashes in Lebanon</a>"
6,He’s useful in a crisis – but is he any good at politics? A look at Mark Carney’s first year,https://www.theglobeandmail.com/politics/opinion/article-hes-useful-in-a-crisis-but-is-he-any-good-at-politics-a-look-at-mark/,Shannon Proudfoot,Opinion,"<a href=""https://www.theglobeandmail.com/politics/opinion/article-hes-useful-in-a-crisis-but-is-he-any-good-at-politics-a-look-at-mark/"">He’s useful in a crisis – but is he any good at politics? A look at Mark Carney’s first year</a>"
7,Prime Minister’s office declines to weigh in on Order of Canada petition for Don Cherry,https://www.theglobeandmail.com/canada/article-mark-carney-don-cherry-hockey-petition-conservatives-order-of-canada/,No byline found,No article type found,"<a href=""https://www.theglobeandmail.com/canada/article-mark-carney-don-cherry-hockey-petition-conservatives-order-of-canada/"">Prime Minister’s office declines to weigh in on Order of Canada petition for Don Cherry</a>"
8,Can Jeremiah and Kimmy afford to splurge on family vacations and pay for their daughter’s medical school?,https://www.theglobeandmail.com/investing/personal-finance/financial-facelift/article-jeremiah-kimmy-afford-splurge-family-vacations-daughter-medical-school/,No byline found,No article type found,"<a href=""https://www.theglobeandmail.com/investing/personal-finance/financial-facelift/article-jeremiah-kimmy-afford-splurge-family-vacations-daughter-medical-school/"">Can Jeremiah and Kimmy afford to splurge on family vacations and pay for their daughter’s medical school?</a>"
