Rank,Article title,url,title_with_link
1,Trump raises tariffs on Canada to 35% with no trade deal in sight,https://globalnews.ca/news/11314241/donald-trump-tariffs-canada-35-per-cent-order/,"<a href=""https://globalnews.ca/news/11314241/donald-trump-tariffs-canada-35-per-cent-order/"">Trump raises tariffs on Canada to 35% with no trade deal in sight</a>"
2,Australia announces YouTube account ban for children under 16,https://globalnews.ca/news/11310931/australia-youtube-accounts-age-limit/,"<a href=""https://globalnews.ca/news/11310931/australia-youtube-accounts-age-limit/"">Australia announces YouTube account ban for children under 16</a>"
3,Hulk Hogan’s daughter breaks silence about estranged father’s death,https://globalnews.ca/news/11311291/hulk-hogan-daughter-brooke-statement/,"<a href=""https://globalnews.ca/news/11311291/hulk-hogan-daughter-brooke-statement/"">Hulk Hogan’s daughter breaks silence about estranged father’s death</a>"
4,Tsunami watch upgraded to advisory for much of B.C. coast after M8.8 quake off Russian coast,https://globalnews.ca/news/11310506/tsunami-advisory-russia-earthquake/,"<a href=""https://globalnews.ca/news/11310506/tsunami-advisory-russia-earthquake/"">Tsunami watch upgraded to advisory for much of B.C. coast after M8.8 quake off Russian coast</a>"
5,Virginia councillor set on fire after attacker douses him in gasoline,https://globalnews.ca/news/11311867/virgina-council-member-lee-volger-set-on-fire-danville/,"<a href=""https://globalnews.ca/news/11311867/virgina-council-member-lee-volger-set-on-fire-danville/"">Virginia councillor set on fire after attacker douses him in gasoline</a>"
