Rank,Article title,url,Byline,Article type,title_with_link
1,Search intensifies for missing 14-year-old Toronto girl,https://www.theglobeandmail.com/canada/article-search-intensifies-for-missing-14-year-old-toronto-girl/,No byline found,No article type found,"<a href=""https://www.theglobeandmail.com/canada/article-search-intensifies-for-missing-14-year-old-toronto-girl/"">Search intensifies for missing 14-year-old Toronto girl</a>"
2,"Montreal Victoire win their first PWHL title, beating Ottawa 4-0 in Game 4",https://www.theglobeandmail.com/sports/hockey/article-montreal-victoire-win-their-first-phwl-title-beating-ottawa-4-0-in/,No byline found,No article type found,"<a href=""https://www.theglobeandmail.com/sports/hockey/article-montreal-victoire-win-their-first-phwl-title-beating-ottawa-4-0-in/"">Montreal Victoire win their first PWHL title, beating Ottawa 4-0 in Game 4</a>"
3,Former Huawei subsidiary planning talks with federal government to enter Canada,https://www.theglobeandmail.com/business/article-former-huawei-subsidiary-planning-talks-with-federal-government-to/,No byline found,No article type found,"<a href=""https://www.theglobeandmail.com/business/article-former-huawei-subsidiary-planning-talks-with-federal-government-to/"">Former Huawei subsidiary planning talks with federal government to enter Canada</a>"
4,"Doug Ford is right to expand Billy Bishop airport and bring it, and Toronto, to new heights",https://www.theglobeandmail.com/business/commentary/article-doug-ford-billy-bishop-airport-expansion/,Richard Florida,Opinion,"<a href=""https://www.theglobeandmail.com/business/commentary/article-doug-ford-billy-bishop-airport-expansion/"">Doug Ford is right to expand Billy Bishop airport and bring it, and Toronto, to new heights</a>"
5,UCP bid to add secession question to Alberta’s fall referendum stalls amid procedural dispute,https://www.theglobeandmail.com/canada/alberta/article-ucp-bid-to-add-secession-question-to-albertas-fall-referendum-stalls/,No byline found,No article type found,"<a href=""https://www.theglobeandmail.com/canada/alberta/article-ucp-bid-to-add-secession-question-to-albertas-fall-referendum-stalls/"">UCP bid to add secession question to Alberta’s fall referendum stalls amid procedural dispute</a>"
6,"Despite its age, the Stanley Cup still captivates Canadians and Canadiens alike",https://www.theglobeandmail.com/sports/hockey/article-despite-its-age-the-stanley-cup-still-captivates-canadians-and/,Roy MacGregor,Opinion,"<a href=""https://www.theglobeandmail.com/sports/hockey/article-despite-its-age-the-stanley-cup-still-captivates-canadians-and/"">Despite its age, the Stanley Cup still captivates Canadians and Canadiens alike</a>"
7,Newfoundland and Labrador rolls the dice with demands for major changes to Churchill Falls deal,https://www.theglobeandmail.com/opinion/article-newfoundland-churchill-falls-quebec-energy-wakeham/,Konrad Yakabuski,Opinion,"<a href=""https://www.theglobeandmail.com/opinion/article-newfoundland-churchill-falls-quebec-energy-wakeham/"">Newfoundland and Labrador rolls the dice with demands for major changes to Churchill Falls deal</a>"
8,From TACO to FOMO: How retail traders turned Trump-driven volatility into a playbook,https://www.theglobeandmail.com/investing/article-from-taco-to-fomo-how-retail-traders-turned-trump-driven-volatility/,No byline found,No article type found,"<a href=""https://www.theglobeandmail.com/investing/article-from-taco-to-fomo-how-retail-traders-turned-trump-driven-volatility/"">From TACO to FOMO: How retail traders turned Trump-driven volatility into a playbook</a>"
