Rank,Article title,url,Byline,Article type,title_with_link
1,Former Barrick CEO Mark Bristow paid more than $20-million in severance,https://www.theglobeandmail.com/business/article-former-barrick-ceo-mark-bristow-paid-more-than-us20-million-in/,No byline found,No article type found,"<a href=""https://www.theglobeandmail.com/business/article-former-barrick-ceo-mark-bristow-paid-more-than-us20-million-in/"">Former Barrick CEO Mark Bristow paid more than $20-million in severance</a>"
2,Iran won. Almost everyone else lost,https://www.theglobeandmail.com/business/commentary/article-iran-war-winners-losers-us-gulf-states-israel/,Tony Keller,Opinion,"<a href=""https://www.theglobeandmail.com/business/commentary/article-iran-war-winners-losers-us-gulf-states-israel/"">Iran won. Almost everyone else lost</a>"
3,The talks in Islamabad will determine far more than the direction of the war in Iran,https://www.theglobeandmail.com/world/us-politics/article-the-talks-in-islamabad-will-determine-far-more-than-the-direction-of/,No byline found,Analysis,"<a href=""https://www.theglobeandmail.com/world/us-politics/article-the-talks-in-islamabad-will-determine-far-more-than-the-direction-of/"">The talks in Islamabad will determine far more than the direction of the war in Iran</a>"
4,"Alberta has lost ‘moral authority’ on protecting treaty rights, lawyer argues in bid to block independence referendum",https://www.theglobeandmail.com/canada/alberta/article-alberta-has-lost-moral-authority-on-protecting-treaty-rights-lawyer/,No byline found,No article type found,"<a href=""https://www.theglobeandmail.com/canada/alberta/article-alberta-has-lost-moral-authority-on-protecting-treaty-rights-lawyer/"">Alberta has lost ‘moral authority’ on protecting treaty rights, lawyer argues in bid to block independence referendum</a>"
5,San Francisco – the most childless city in the U.S. – could be a glimpse into Canada’s future,https://www.theglobeandmail.com/life/article-san-francisco-childless-city-glimpse-into-canadas-future/,No byline found,No article type found,"<a href=""https://www.theglobeandmail.com/life/article-san-francisco-childless-city-glimpse-into-canadas-future/"">San Francisco – the most childless city in the U.S. – could be a glimpse into Canada’s future</a>"
6,Canadian dividend stocks that stand out when viewed through quantamental lens,https://www.theglobeandmail.com/investing/investment-ideas/number-cruncher/article-canadian-dividend-stocks-quantamental-cruncher/,No byline found,No article type found,"<a href=""https://www.theglobeandmail.com/investing/investment-ideas/number-cruncher/article-canadian-dividend-stocks-quantamental-cruncher/"">Canadian dividend stocks that stand out when viewed through quantamental lens</a>"
7,"Seller accepts fourth offer for North Toronto home despite it being $498,000 under asking",https://www.theglobeandmail.com/real-estate/toronto/article-seller-accepts-fourth-offer-custom-wanless-park-under-asking/,No byline found,No article type found,"<a href=""https://www.theglobeandmail.com/real-estate/toronto/article-seller-accepts-fourth-offer-custom-wanless-park-under-asking/"">Seller accepts fourth offer for North Toronto home despite it being $498,000 under asking</a>"
8,What to watch this weekend: Euphoria makes mysterious return and Hacks is back for final season,https://www.theglobeandmail.com/culture/film-and-tv/television/article-what-to-watch-this-weekend-euphoria-makes-mysterious-return-and-hacks/,No byline found,No article type found,"<a href=""https://www.theglobeandmail.com/culture/film-and-tv/television/article-what-to-watch-this-weekend-euphoria-makes-mysterious-return-and-hacks/"">What to watch this weekend: Euphoria makes mysterious return and Hacks is back for final season</a>"
