Rank,Article title,url,Byline,Article type,title_with_link
1,Markets today: Wall Street futures fall as Middle East conflict stokes inflation worries,https://www.theglobeandmail.com/investing/markets/inside-the-market/article-markets-today-wall-street-futures-fall-as-middle-east-conflict-stokes/,No byline found,No article type found,"<a href=""https://www.theglobeandmail.com/investing/markets/inside-the-market/article-markets-today-wall-street-futures-fall-as-middle-east-conflict-stokes/"">Markets today: Wall Street futures fall as Middle East conflict stokes inflation worries</a>"
2,Stepfather of missing Nova Scotia children makes first court appearance,https://www.theglobeandmail.com/canada/article-jack-lilly-sullivan-daniel-martell/,No byline found,No article type found,"<a href=""https://www.theglobeandmail.com/canada/article-jack-lilly-sullivan-daniel-martell/"">Stepfather of missing Nova Scotia children makes first court appearance</a>"
3,Alexandre Trudeau’s wilderness thriller Hair of the Bear can’t see the forest for the trees,https://www.theglobeandmail.com/culture/film-and-tv/film/article-alexandre-trudeau-wilderness-thriller-hair-of-the-bear/,No byline found,No article type found,"<a href=""https://www.theglobeandmail.com/culture/film-and-tv/film/article-alexandre-trudeau-wilderness-thriller-hair-of-the-bear/"">Alexandre Trudeau’s wilderness thriller Hair of the Bear can’t see the forest for the trees</a>"
4,"U.S., Israel launch new wave of attacks on Beirut, Tehran",https://www.theglobeandmail.com/world/article-us-israel-lebanon-hezbollah-trump-ayatollah-ali-khamenei-live-updates/,No byline found,No article type found,"<a href=""https://www.theglobeandmail.com/world/article-us-israel-lebanon-hezbollah-trump-ayatollah-ali-khamenei-live-updates/"">U.S., Israel launch new wave of attacks on Beirut, Tehran</a>"
5,"Ontario investigated 900 allegations of OSAP fraud last year, government says",https://www.theglobeandmail.com/canada/article-ontario-investigated-900-allegations-of-osap-fraud-last-year/,No byline found,No article type found,"<a href=""https://www.theglobeandmail.com/canada/article-ontario-investigated-900-allegations-of-osap-fraud-last-year/"">Ontario investigated 900 allegations of OSAP fraud last year, government says</a>"
6,Vancouver General diverts pregnant women with complex conditions because of OB-GYN shortage,https://www.theglobeandmail.com/canada/article-vancouver-general-diverting-pregnant-women-with-complex-conditions/,No byline found,No article type found,"<a href=""https://www.theglobeandmail.com/canada/article-vancouver-general-diverting-pregnant-women-with-complex-conditions/"">Vancouver General diverts pregnant women with complex conditions because of OB-GYN shortage</a>"
7,Lebanese resign themselves to another war as Israel deploys troops to southern Lebanon,https://www.theglobeandmail.com/world/article-iran-us-war-hezbollah-israel/,No byline found,No article type found,"<a href=""https://www.theglobeandmail.com/world/article-iran-us-war-hezbollah-israel/"">Lebanese resign themselves to another war as Israel deploys troops to southern Lebanon</a>"
8,"Most of B.C. to adopt daylight saving time permanently, Eby says",https://www.theglobeandmail.com/canada/article-most-of-bc-to-adopt-daylight-saving-time-permanently-eby-says/,No byline found,No article type found,"<a href=""https://www.theglobeandmail.com/canada/article-most-of-bc-to-adopt-daylight-saving-time-permanently-eby-says/"">Most of B.C. to adopt daylight saving time permanently, Eby says</a>"
