Rank,Article title,url,Byline,Article type,title_with_link
1,Alberta chiefs say AFN has no mandate to decide fate of infrastructure projects,https://www.theglobeandmail.com/canada/article-alberta-chiefs-say-afn-has-no-mandate-to-decide-fate-of-infrastructure/,No byline found,No article type found,"<a href=""https://www.theglobeandmail.com/canada/article-alberta-chiefs-say-afn-has-no-mandate-to-decide-fate-of-infrastructure/"">Alberta chiefs say AFN has no mandate to decide fate of infrastructure projects</a>"
2,"Canada will thank Trump in 20 years, former Quebec premier Jean Charest says",https://www.theglobeandmail.com/business/article-canada-will-thank-trump-in-20-years-former-quebec-premier-jean-charest/,No byline found,No article type found,"<a href=""https://www.theglobeandmail.com/business/article-canada-will-thank-trump-in-20-years-former-quebec-premier-jean-charest/"">Canada will thank Trump in 20 years, former Quebec premier Jean Charest says</a>"
3,How a sibling’s unexpected emergency put an equal inheritance to the test,https://www.theglobeandmail.com/investing/personal-finance/retirement/article-unexpected-emergency-equal-inheritance-siblings/,No byline found,No article type found,"<a href=""https://www.theglobeandmail.com/investing/personal-finance/retirement/article-unexpected-emergency-equal-inheritance-siblings/"">How a sibling’s unexpected emergency put an equal inheritance to the test</a>"
4,Thursday’s analyst upgrades and downgrades,https://www.theglobeandmail.com/investing/markets/inside-the-market/article-thursdays-analyst-upgrades-and-downgrades-274/,No byline found,No article type found,"<a href=""https://www.theglobeandmail.com/investing/markets/inside-the-market/article-thursdays-analyst-upgrades-and-downgrades-274/"">Thursday’s analyst upgrades and downgrades</a>"
5,Trump asks Supreme Court to quickly take up tariffs case and reverse ruling finding them illegal,https://www.theglobeandmail.com/business/international-business/article-trump-asks-supreme-court-to-quickly-take-up-tariffs-case-and-reverse/,No byline found,No article type found,"<a href=""https://www.theglobeandmail.com/business/international-business/article-trump-asks-supreme-court-to-quickly-take-up-tariffs-case-and-reverse/"">Trump asks Supreme Court to quickly take up tariffs case and reverse ruling finding them illegal</a>"
6,"Carney says to expect both an austerity and investment-focused budget, criticizes Trudeau-era spending",https://www.theglobeandmail.com/politics/article-carney-austerity-investment-focused-budget-spending/,No byline found,No article type found,"<a href=""https://www.theglobeandmail.com/politics/article-carney-austerity-investment-focused-budget-spending/"">Carney says to expect both an austerity and investment-focused budget, criticizes Trudeau-era spending</a>"
7,Italian fashion designer Giorgio Armani dies at 91,https://www.theglobeandmail.com/world/article-giorgio-armani-italian-fashion-designer-dies/,No byline found,No article type found,"<a href=""https://www.theglobeandmail.com/world/article-giorgio-armani-italian-fashion-designer-dies/"">Italian fashion designer Giorgio Armani dies at 91</a>"
8,"As provinces and industry push for new pipelines, regulator says expanded Trans Mountain still has capacity",https://www.theglobeandmail.com/business/article-trans-mountain-capacity-provinces-industry-push-new-pipelines/,No byline found,No article type found,"<a href=""https://www.theglobeandmail.com/business/article-trans-mountain-capacity-provinces-industry-push-new-pipelines/"">As provinces and industry push for new pipelines, regulator says expanded Trans Mountain still has capacity</a>"
