Rank,Article title,url,Byline,Article type,title_with_link
1,"Carney’s cabinet meeting to focus on infrastructure, trade and crime, ahead of Parliament resuming",https://www.theglobeandmail.com/politics/article-mark-carney-cabinet-meeting/,No byline found,No article type found,"<a href=""https://www.theglobeandmail.com/politics/article-mark-carney-cabinet-meeting/"">Carney’s cabinet meeting to focus on infrastructure, trade and crime, ahead of Parliament resuming</a>"
2,Alberta chiefs say AFN has no mandate to decide fate of infrastructure projects,https://www.theglobeandmail.com/canada/article-alberta-chiefs-say-afn-has-no-mandate-to-decide-fate-of-infrastructure/,No byline found,No article type found,"<a href=""https://www.theglobeandmail.com/canada/article-alberta-chiefs-say-afn-has-no-mandate-to-decide-fate-of-infrastructure/"">Alberta chiefs say AFN has no mandate to decide fate of infrastructure projects</a>"
3,"Canada will thank Trump in 20 years, former Quebec premier Jean Charest says",https://www.theglobeandmail.com/business/article-canada-will-thank-trump-in-20-years-former-quebec-premier-jean-charest/,No byline found,No article type found,"<a href=""https://www.theglobeandmail.com/business/article-canada-will-thank-trump-in-20-years-former-quebec-premier-jean-charest/"">Canada will thank Trump in 20 years, former Quebec premier Jean Charest says</a>"
4,Félix Auger-Aliassime books spot in U.S. Open semi-finals with comeback victory over Alex De Minaur,https://www.theglobeandmail.com/sports/tennis/article-felix-auger-aliassime-us-open-alex-de-minaur/,No byline found,No article type found,"<a href=""https://www.theglobeandmail.com/sports/tennis/article-felix-auger-aliassime-us-open-alex-de-minaur/"">Félix Auger-Aliassime books spot in U.S. Open semi-finals with comeback victory over Alex De Minaur</a>"
5,How a sibling’s unexpected emergency put an equal inheritance to the test,https://www.theglobeandmail.com/investing/personal-finance/retirement/article-unexpected-emergency-equal-inheritance-siblings/,No byline found,No article type found,"<a href=""https://www.theglobeandmail.com/investing/personal-finance/retirement/article-unexpected-emergency-equal-inheritance-siblings/"">How a sibling’s unexpected emergency put an equal inheritance to the test</a>"
6,Trump asks Supreme Court to quickly take up tariffs case and reverse ruling finding them illegal,https://www.theglobeandmail.com/business/international-business/article-trump-asks-supreme-court-to-quickly-take-up-tariffs-case-and-reverse/,No byline found,No article type found,"<a href=""https://www.theglobeandmail.com/business/international-business/article-trump-asks-supreme-court-to-quickly-take-up-tariffs-case-and-reverse/"">Trump asks Supreme Court to quickly take up tariffs case and reverse ruling finding them illegal</a>"
7,Canada making no promises on asylum for Russian dissidents being held in U.S. detention,https://www.theglobeandmail.com/politics/article-canada-asylum-russian-dissidents-us-detention/,No byline found,No article type found,"<a href=""https://www.theglobeandmail.com/politics/article-canada-asylum-russian-dissidents-us-detention/"">Canada making no promises on asylum for Russian dissidents being held in U.S. detention</a>"
8,"Carney says to expect both an austerity and investment-focused budget, criticizes Trudeau-era spending",https://www.theglobeandmail.com/politics/article-carney-austerity-investment-focused-budget-spending/,No byline found,No article type found,"<a href=""https://www.theglobeandmail.com/politics/article-carney-austerity-investment-focused-budget-spending/"">Carney says to expect both an austerity and investment-focused budget, criticizes Trudeau-era spending</a>"
