Rank,Article title,url,Byline,Article type,title_with_link
1,"What’s the most popular apple variety? Honeycrisp is voted the best, according to our readers",https://www.theglobeandmail.com/life/style/food-and-drink/article-best-apple-varieties-vote/,No byline found,No article type found,"<a href=""https://www.theglobeandmail.com/life/style/food-and-drink/article-best-apple-varieties-vote/"">What’s the most popular apple variety? Honeycrisp is voted the best, according to our readers</a>"
2,Investor behind Flair Airlines’ expansion charged with US$500-million fraud,https://www.theglobeandmail.com/business/article-investor-behind-flair-airlines-expansion-charged-with-us500-million/,No byline found,No article type found,"<a href=""https://www.theglobeandmail.com/business/article-investor-behind-flair-airlines-expansion-charged-with-us500-million/"">Investor behind Flair Airlines’ expansion charged with US$500-million fraud</a>"
3,Crispr gave humans the power to remake ourselves. What will we do with it?,https://www.theglobeandmail.com/opinion/article-crispr-gene-editing-technology-scientific-breakthrough/,Matt Ridley,Opinion,"<a href=""https://www.theglobeandmail.com/opinion/article-crispr-gene-editing-technology-scientific-breakthrough/"">Crispr gave humans the power to remake ourselves. What will we do with it?</a>"
4,Three reasons to be deeply skeptical about the current gold rally,https://www.theglobeandmail.com/investing/markets/inside-the-market/article-gold-rally-skepticism-market-watchers/,No byline found,No article type found,"<a href=""https://www.theglobeandmail.com/investing/markets/inside-the-market/article-gold-rally-skepticism-market-watchers/"">Three reasons to be deeply skeptical about the current gold rally</a>"
5,Is that photo real or fake? Digital ‘birth certificates’ are a new way to get answers,https://www.theglobeandmail.com/business/article-sony-photo-verification-technology-ai-generated-images/,No byline found,No article type found,"<a href=""https://www.theglobeandmail.com/business/article-sony-photo-verification-technology-ai-generated-images/"">Is that photo real or fake? Digital ‘birth certificates’ are a new way to get answers</a>"
6,Neighbours told RCMP they heard car near trailer where Nova Scotia children disappeared,https://www.theglobeandmail.com/canada/article-jack-lilly-sullivan-missing-children-court-documents-nova-scotia/,No byline found,No article type found,"<a href=""https://www.theglobeandmail.com/canada/article-jack-lilly-sullivan-missing-children-court-documents-nova-scotia/"">Neighbours told RCMP they heard car near trailer where Nova Scotia children disappeared</a>"
7,What a 50-year-old neighbourhood development can teach us about solving Canada’s housing crisis,https://www.theglobeandmail.com/opinion/article-st-lawrence-toronto-national-housing-crisis/,Frank Lewinberg,Opinion,"<a href=""https://www.theglobeandmail.com/opinion/article-st-lawrence-toronto-national-housing-crisis/"">What a 50-year-old neighbourhood development can teach us about solving Canada’s housing crisis</a>"
8,"Will Ellen, 62, need to downsize after retiring next spring?",https://www.theglobeandmail.com/investing/personal-finance/financial-facelift/article-ellen-roger-retirement-goals-mortgage-education/,No byline found,No article type found,"<a href=""https://www.theglobeandmail.com/investing/personal-finance/financial-facelift/article-ellen-roger-retirement-goals-mortgage-education/"">Will Ellen, 62, need to downsize after retiring next spring?</a>"
