Rank,Article title,url,title_with_link
1,"Taylor Swift, Travis Kelce engaged as pop star reveals 1st glimpse of ring",https://globalnews.ca/news/11350655/taylor-swift-travis-kelce-engagement/,"<a href=""https://globalnews.ca/news/11350655/taylor-swift-travis-kelce-engagement/"">Taylor Swift, Travis Kelce engaged as pop star reveals 1st glimpse of ring</a>"
2,"‘Put American spirits back’ on Canadian shelves, U.S. booze group urges",https://globalnews.ca/news/11348782/donald-trump-tariffs-canada-american-alcohol/,"<a href=""https://globalnews.ca/news/11348782/donald-trump-tariffs-canada-american-alcohol/"">‘Put American spirits back’ on Canadian shelves, U.S. booze group urges</a>"
3,Canada Post lost $407 million in ‘largest loss’ in a single quarter,https://globalnews.ca/news/11350437/canada-post-lost-millions-second-quarter/,"<a href=""https://globalnews.ca/news/11350437/canada-post-lost-millions-second-quarter/"">Canada Post lost $407 million in ‘largest loss’ in a single quarter</a>"
4,"Menendez brothers’ lawyer reacts to parole denials, says they were ‘rigged’",https://globalnews.ca/news/11348753/menendez-brothers-lawyer-parole-denials/,"<a href=""https://globalnews.ca/news/11348753/menendez-brothers-lawyer-parole-denials/"">Menendez brothers’ lawyer reacts to parole denials, says they were ‘rigged’</a>"
5,Moderna’s latest COVID-19 vaccine is both approved and ‘made in Canada’,https://globalnews.ca/news/11349082/new-covid-19-vaccine-made-in-canada/,"<a href=""https://globalnews.ca/news/11349082/new-covid-19-vaccine-made-in-canada/"">Moderna’s latest COVID-19 vaccine is both approved and ‘made in Canada’</a>"
