Rank,Article title,url,Byline,Article type,title_with_link
1,"Elections Canada to issue write-in ballot in Poilievre’s by-election, citing long candidate list",https://www.theglobeandmail.com/canada/article-pierre-poilievre-byelection-longest-ballot/,No byline found,No article type found,"<a href=""https://www.theglobeandmail.com/canada/article-pierre-poilievre-byelection-longest-ballot/"">Elections Canada to issue write-in ballot in Poilievre’s by-election, citing long candidate list</a>"
2,Why my crystal ball is so cloudy right now,https://www.theglobeandmail.com/investing/markets/inside-the-market/article-trump-tariffs-interest-rates-inflation-economy/,Gordon Pape,Opinion,"<a href=""https://www.theglobeandmail.com/investing/markets/inside-the-market/article-trump-tariffs-interest-rates-inflation-economy/"">Why my crystal ball is so cloudy right now</a>"
3,Global auto leaders say U.S. trade deals not good for industry,https://www.theglobeandmail.com/business/article-auto-leaders-europe-united-states-trade-deals/,No byline found,No article type found,"<a href=""https://www.theglobeandmail.com/business/article-auto-leaders-europe-united-states-trade-deals/"">Global auto leaders say U.S. trade deals not good for industry</a>"
4,"The Asian century is here, but Canada isn’t ready",https://www.theglobeandmail.com/business/commentary/article-asia-pacific-trade-canada-gdp-markets/,Gary Comerford,Opinion,"<a href=""https://www.theglobeandmail.com/business/commentary/article-asia-pacific-trade-canada-gdp-markets/"">The Asian century is here, but Canada isn’t ready</a>"
5,"More than 10,000 Air Canada flight attendants start voting on strike mandate",https://www.theglobeandmail.com/business/article-air-canada-flight-attendants-voting-strike-mandate/,No byline found,No article type found,"<a href=""https://www.theglobeandmail.com/business/article-air-canada-flight-attendants-voting-strike-mandate/"">More than 10,000 Air Canada flight attendants start voting on strike mandate</a>"
6,The bitter truth is that cheaper housing means a retirement crisis for homeowners,https://www.theglobeandmail.com/business/commentary/article-housing-prices-retirement-plan-middle-class/,John Turley-Ewart,Opinion,"<a href=""https://www.theglobeandmail.com/business/commentary/article-housing-prices-retirement-plan-middle-class/"">The bitter truth is that cheaper housing means a retirement crisis for homeowners</a>"
7,Harper says he advised Carney team to look outside the U.S. on trade,https://www.theglobeandmail.com/politics/article-harper-advised-carney-outside-us-on-trade/,No byline found,No article type found,"<a href=""https://www.theglobeandmail.com/politics/article-harper-advised-carney-outside-us-on-trade/"">Harper says he advised Carney team to look outside the U.S. on trade</a>"
8,My estranged father died in hospital after years of drug use. He was more than a statistic,https://www.theglobeandmail.com/opinion/article-my-estranged-father-died-in-hospital-after-years-of-drug-use-he-was/,No byline found,No article type found,"<a href=""https://www.theglobeandmail.com/opinion/article-my-estranged-father-died-in-hospital-after-years-of-drug-use-he-was/"">My estranged father died in hospital after years of drug use. He was more than a statistic</a>"
