Rank,Article title,url,Byline,Article type,title_with_link
1,U.S. and Iran prepare for ceasefire talks as Kuwait comes under attack,https://www.theglobeandmail.com/world/article-us-iran-ceasefire-talks/,No byline found,No article type found,"<a href=""https://www.theglobeandmail.com/world/article-us-iran-ceasefire-talks/"">U.S. and Iran prepare for ceasefire talks as Kuwait comes under attack</a>"
2,"Canada’s Cohere, Germany’s Aleph Alpha reportedly in merger talks",https://www.theglobeandmail.com/world/article-canadas-cohere-germanys-aleph-alpha-reportedly-in-merger-talks/,No byline found,No article type found,"<a href=""https://www.theglobeandmail.com/world/article-canadas-cohere-germanys-aleph-alpha-reportedly-in-merger-talks/"">Canada’s Cohere, Germany’s Aleph Alpha reportedly in merger talks</a>"
3,Iran won. Almost everyone else lost,https://www.theglobeandmail.com/business/commentary/article-iran-war-winners-losers-us-gulf-states-israel/,Tony Keller,Opinion,"<a href=""https://www.theglobeandmail.com/business/commentary/article-iran-war-winners-losers-us-gulf-states-israel/"">Iran won. Almost everyone else lost</a>"
4,The talks in Islamabad will determine far more than the direction of the war in Iran,https://www.theglobeandmail.com/world/us-politics/article-the-talks-in-islamabad-will-determine-far-more-than-the-direction-of/,No byline found,Analysis,"<a href=""https://www.theglobeandmail.com/world/us-politics/article-the-talks-in-islamabad-will-determine-far-more-than-the-direction-of/"">The talks in Islamabad will determine far more than the direction of the war in Iran</a>"
5,Canadian dividend stocks that stand out when viewed through quantamental lens,https://www.theglobeandmail.com/investing/investment-ideas/number-cruncher/article-canadian-dividend-stocks-quantamental-cruncher/,No byline found,No article type found,"<a href=""https://www.theglobeandmail.com/investing/investment-ideas/number-cruncher/article-canadian-dividend-stocks-quantamental-cruncher/"">Canadian dividend stocks that stand out when viewed through quantamental lens</a>"
6,San Francisco – the most childless city in the U.S. – could be a glimpse into Canada’s future,https://www.theglobeandmail.com/life/article-san-francisco-childless-city-glimpse-into-canadas-future/,No byline found,No article type found,"<a href=""https://www.theglobeandmail.com/life/article-san-francisco-childless-city-glimpse-into-canadas-future/"">San Francisco – the most childless city in the U.S. – could be a glimpse into Canada’s future</a>"
7,"Seller accepts fourth offer for North Toronto home despite it being $498,000 under asking",https://www.theglobeandmail.com/real-estate/toronto/article-seller-accepts-fourth-offer-custom-wanless-park-under-asking/,No byline found,No article type found,"<a href=""https://www.theglobeandmail.com/real-estate/toronto/article-seller-accepts-fourth-offer-custom-wanless-park-under-asking/"">Seller accepts fourth offer for North Toronto home despite it being $498,000 under asking</a>"
8,What to watch this weekend: Euphoria makes mysterious return and Hacks is back for final season,https://www.theglobeandmail.com/culture/film-and-tv/television/article-what-to-watch-this-weekend-euphoria-makes-mysterious-return-and-hacks/,No byline found,No article type found,"<a href=""https://www.theglobeandmail.com/culture/film-and-tv/television/article-what-to-watch-this-weekend-euphoria-makes-mysterious-return-and-hacks/"">What to watch this weekend: Euphoria makes mysterious return and Hacks is back for final season</a>"
