Rank,Article title,url,Byline,Article type,title_with_link
1,Canada’s public dental-care plan is rotten at the roots,https://www.theglobeandmail.com/opinion/article-canada-public-dental-care-plan-coverage-rotten/,Alison Motluk,Opinion,"<a href=""https://www.theglobeandmail.com/opinion/article-canada-public-dental-care-plan-coverage-rotten/"">Canada’s public dental-care plan is rotten at the roots</a>"
2,"BlackBerry stock soars after company delivers better-than-expected results, raises targets",https://www.theglobeandmail.com/business/article-blackberry-results-earnings-results-forecast-first-quarter-may-2026/,No byline found,No article type found,"<a href=""https://www.theglobeandmail.com/business/article-blackberry-results-earnings-results-forecast-first-quarter-may-2026/"">BlackBerry stock soars after company delivers better-than-expected results, raises targets</a>"
3,"Carney’s ridiculous, myopic plan to bail out condo developers",https://www.theglobeandmail.com/opinion/article-carneys-ridiculous-myopic-plan-to-bail-out-condo-developers/,No byline found,No article type found,"<a href=""https://www.theglobeandmail.com/opinion/article-carneys-ridiculous-myopic-plan-to-bail-out-condo-developers/"">Carney’s ridiculous, myopic plan to bail out condo developers</a>"
4,"Ottawa should choose German subs for linguistic reasons, TKMS executive says",https://www.theglobeandmail.com/politics/article-submarine-executive-says-german-bid-more-compatible-with-canada/,No byline found,No article type found,"<a href=""https://www.theglobeandmail.com/politics/article-submarine-executive-says-german-bid-more-compatible-with-canada/"">Ottawa should choose German subs for linguistic reasons, TKMS executive says</a>"
5,"Playter Estates townhouse sells in one day $101,000 over asking",https://www.theglobeandmail.com/real-estate/toronto/article-playter-estates-townhouse-don-valley-over-asking/,No byline found,No article type found,"<a href=""https://www.theglobeandmail.com/real-estate/toronto/article-playter-estates-townhouse-don-valley-over-asking/"">Playter Estates townhouse sells in one day $101,000 over asking</a>"
6,Emergency room wait times continue to climb as more medically complex patients seek care,https://www.theglobeandmail.com/canada/article-emergency-room-wait-times-climb-medically-complex-patients-seek-care/,No byline found,No article type found,"<a href=""https://www.theglobeandmail.com/canada/article-emergency-room-wait-times-climb-medically-complex-patients-seek-care/"">Emergency room wait times continue to climb as more medically complex patients seek care</a>"
7,Thursday’s analyst upgrades and downgrades,https://www.theglobeandmail.com/investing/markets/inside-the-market/article-thursdays-analyst-upgrades-and-downgrades-313/,No byline found,No article type found,"<a href=""https://www.theglobeandmail.com/investing/markets/inside-the-market/article-thursdays-analyst-upgrades-and-downgrades-313/"">Thursday’s analyst upgrades and downgrades</a>"
8,Civilian killed in Montreal shooting hailed as a hero who saved lives,https://www.theglobeandmail.com/canada/article-civilian-killed-in-montreal-shooting-hailed-as-a-hero-who-saved-lives/,No byline found,No article type found,"<a href=""https://www.theglobeandmail.com/canada/article-civilian-killed-in-montreal-shooting-hailed-as-a-hero-who-saved-lives/"">Civilian killed in Montreal shooting hailed as a hero who saved lives</a>"
