Rank,Article title,url,Byline,Article type,title_with_link
1,How Trump plans to continue his trade war with Canada without IEEPA,https://www.theglobeandmail.com/business/article-how-trump-plans-to-continue-trade-war-supreme-court-ieepa/,No byline found,No article type found,"<a href=""https://www.theglobeandmail.com/business/article-how-trump-plans-to-continue-trade-war-supreme-court-ieepa/"">How Trump plans to continue his trade war with Canada without IEEPA</a>"
2,Midwinter Break examines the fault lines of a long marriage,https://www.theglobeandmail.com/culture/film-and-tv/film/article-midwinter-break-examines-the-fault-lines-of-a-long-marriage/,No byline found,No article type found,"<a href=""https://www.theglobeandmail.com/culture/film-and-tv/film/article-midwinter-break-examines-the-fault-lines-of-a-long-marriage/"">Midwinter Break examines the fault lines of a long marriage</a>"
3,The Globe’s 20 best dividend-paying stocks of the year,https://www.theglobeandmail.com/investing/markets/inside-the-market/article-dividend-all-stars-20-best-performing-dividend-stocks-tsx/,No byline found,No article type found,"<a href=""https://www.theglobeandmail.com/investing/markets/inside-the-market/article-dividend-all-stars-20-best-performing-dividend-stocks-tsx/"">The Globe’s 20 best dividend-paying stocks of the year</a>"
4,Now is the time to invest like a coward,https://www.theglobeandmail.com/investing/markets/inside-the-market/article-time-to-invest-like-a-coward-markets/,No byline found,No article type found,"<a href=""https://www.theglobeandmail.com/investing/markets/inside-the-market/article-time-to-invest-like-a-coward-markets/"">Now is the time to invest like a coward</a>"
5,Retired constable charged in Project South corruption probe has first hearing,https://www.theglobeandmail.com/canada/article-retired-constable-charged-project-south-corruption-probe-first-hearing/,No byline found,No article type found,"<a href=""https://www.theglobeandmail.com/canada/article-retired-constable-charged-project-south-corruption-probe-first-hearing/"">Retired constable charged in Project South corruption probe has first hearing</a>"
6,CPP payment increases slow in 2026 as retirees cope with high living costs,https://www.theglobeandmail.com/investing/personal-finance/retirement/article-cpp-payments-2026-retirement-cost-of-living-pension/,No byline found,No article type found,"<a href=""https://www.theglobeandmail.com/investing/personal-finance/retirement/article-cpp-payments-2026-retirement-cost-of-living-pension/"">CPP payment increases slow in 2026 as retirees cope with high living costs</a>"
7,America’s Next Top Model docuseries shows the high personal cost of reality TV,https://www.theglobeandmail.com/culture/film-and-tv/television/article-americas-next-top-model-docuseries-shows-the-high-personal-cost-of/,Amber Dowling,Opinion,"<a href=""https://www.theglobeandmail.com/culture/film-and-tv/television/article-americas-next-top-model-docuseries-shows-the-high-personal-cost-of/"">America’s Next Top Model docuseries shows the high personal cost of reality TV</a>"
8,Bitcoin zero? Crypto evangelists have run out of stories to tell,https://www.theglobeandmail.com/investing/markets/inside-the-market/article-bitcoin-cryptocurrency-speculation-investing/,No byline found,No article type found,"<a href=""https://www.theglobeandmail.com/investing/markets/inside-the-market/article-bitcoin-cryptocurrency-speculation-investing/"">Bitcoin zero? Crypto evangelists have run out of stories to tell</a>"
