Rank,Article title,url,Byline,Article type,title_with_link
1,Ottawa to pull plug on Arctic naval facility,https://www.theglobeandmail.com/politics/article-ottawa-to-pull-plug-on-arctic-naval-facility/,No byline found,No article type found,"<a href=""https://www.theglobeandmail.com/politics/article-ottawa-to-pull-plug-on-arctic-naval-facility/"">Ottawa to pull plug on Arctic naval facility</a>"
2,B.C. rock climber Will Stanhope conquered the hardest alpine-crack ascent in the world,https://www.theglobeandmail.com/canada/article-bc-rock-climber-will-stanhope-conquered-the-hardest-alpine-crack/,No byline found,No article type found,"<a href=""https://www.theglobeandmail.com/canada/article-bc-rock-climber-will-stanhope-conquered-the-hardest-alpine-crack/"">B.C. rock climber Will Stanhope conquered the hardest alpine-crack ascent in the world</a>"
3,"U.S. trade court rules against Trump’s latest 10% global tariffs, but issues narrow block",https://www.theglobeandmail.com/business/article-trump-tariff-ruling-trade-court/,No byline found,No article type found,"<a href=""https://www.theglobeandmail.com/business/article-trump-tariff-ruling-trade-court/"">U.S. trade court rules against Trump’s latest 10% global tariffs, but issues narrow block</a>"
4,Christine Fréchette has scrambled Quebec politics,https://www.theglobeandmail.com/opinion/article-christine-frechette-has-scrambled-quebec-politics/,Konrad Yakabuski,Opinion,"<a href=""https://www.theglobeandmail.com/opinion/article-christine-frechette-has-scrambled-quebec-politics/"">Christine Fréchette has scrambled Quebec politics</a>"
5,"Haunted by tragedy, new condo at site of deadly Florida collapse finds no buyers",https://www.theglobeandmail.com/business/commentary/article-haunted-by-tragedy-new-condo-at-site-of-deadly-florida-collapse-finds/,Gus Carlson,Opinion,"<a href=""https://www.theglobeandmail.com/business/commentary/article-haunted-by-tragedy-new-condo-at-site-of-deadly-florida-collapse-finds/"">Haunted by tragedy, new condo at site of deadly Florida collapse finds no buyers</a>"
6,Vancouver chef pays homage to the Japanese masters who helped him earn his star,https://www.theglobeandmail.com/life/article-vancouver-chef-pays-homage-to-the-japanese-masters-who-helped-him-earn/,No byline found,No article type found,"<a href=""https://www.theglobeandmail.com/life/article-vancouver-chef-pays-homage-to-the-japanese-masters-who-helped-him-earn/"">Vancouver chef pays homage to the Japanese masters who helped him earn his star</a>"
7,"Take hantavirus precautions when opening cottages, sheds, PHAC expert advises",https://www.theglobeandmail.com/canada/article-hantavirus-explainer-precautions-cottages-phac/,No byline found,No article type found,"<a href=""https://www.theglobeandmail.com/canada/article-hantavirus-explainer-precautions-cottages-phac/"">Take hantavirus precautions when opening cottages, sheds, PHAC expert advises</a>"
8,Meta warns lawful access bill would make tech companies a surveillance arm of government,https://www.theglobeandmail.com/politics/article-meta-warns-lawful-access-bill-would-make-tech-companies-a-surveillance/,No byline found,No article type found,"<a href=""https://www.theglobeandmail.com/politics/article-meta-warns-lawful-access-bill-would-make-tech-companies-a-surveillance/"">Meta warns lawful access bill would make tech companies a surveillance arm of government</a>"
