Rank,Article title,url,title_with_link
1,Prime Minister Carney praises Trump as ministers jet to Sweden to talk defence deals,https://globalnews.ca/news/11337766/mark-carney-praises-trump-ministers-sweden-defence-deals/,"<a href=""https://globalnews.ca/news/11337766/mark-carney-praises-trump-ministers-sweden-defence-deals/"">Prime Minister Carney praises Trump as ministers jet to Sweden to talk defence deals</a>"
2,Skipping the U.S. and taking a vacation to East Coast this year? It will cost you,https://globalnews.ca/news/11337557/atl-tourism-costs/,"<a href=""https://globalnews.ca/news/11337557/atl-tourism-costs/"">Skipping the U.S. and taking a vacation to East Coast this year? It will cost you</a>"
3,Union representing Air Canada flight attendants says strike will continue,https://globalnews.ca/news/11338329/air-canada-strike-2/,"<a href=""https://globalnews.ca/news/11338329/air-canada-strike-2/"">Union representing Air Canada flight attendants says strike will continue</a>"
4,"Canada’s counter-tariffs ‘pulled the rug out from’ CUSMA, U.S. envoy says",https://globalnews.ca/news/11335614/pete-hoekstra-donald-trump-tariffs-canada-retaliation-cusma/,"<a href=""https://globalnews.ca/news/11335614/pete-hoekstra-donald-trump-tariffs-canada-retaliation-cusma/"">Canada’s counter-tariffs ‘pulled the rug out from’ CUSMA, U.S. envoy says</a>"
5,"Loose bull forces highway closure in Abbotsford, BC: police",https://globalnews.ca/news/11337933/loose-bull-forces-highway-closure-in-abbotsford-bc-police/,"<a href=""https://globalnews.ca/news/11337933/loose-bull-forces-highway-closure-in-abbotsford-bc-police/"">Loose bull forces highway closure in Abbotsford, BC: police</a>"
