Rank,Article title,url,Byline,Article type,title_with_link
1,Canada officially endorses leadership role in new defence bank,https://www.theglobeandmail.com/business/economy/article-canada-leadership-defence-bank-finance-minister-francois-philippe/,No byline found,No article type found,"<a href=""https://www.theglobeandmail.com/business/economy/article-canada-leadership-defence-bank-finance-minister-francois-philippe/"">Canada officially endorses leadership role in new defence bank</a>"
2,Ontario woman calls for reform after her son ‘shopped’ for MAID approval in B.C.,https://www.theglobeandmail.com/canada/article-maid-medical-assistance-in-dying/,No byline found,No article type found,"<a href=""https://www.theglobeandmail.com/canada/article-maid-medical-assistance-in-dying/"">Ontario woman calls for reform after her son ‘shopped’ for MAID approval in B.C.</a>"
3,Canada’s passenger rail lines are getting revived after decades of vanishing service,https://www.theglobeandmail.com/opinion/article-canada-passenger-line-revival-railway-cars-planes/,Taras Grescoe,Opinion,"<a href=""https://www.theglobeandmail.com/opinion/article-canada-passenger-line-revival-railway-cars-planes/"">Canada’s passenger rail lines are getting revived after decades of vanishing service</a>"
4,Arlene Dickinson and Amber Mac cut ties with Canadian social media startup Gander Social,https://www.theglobeandmail.com/business/article-arlene-dickinson-amber-mac-cut-ties-canadian-startup-gander-social/,No byline found,No article type found,"<a href=""https://www.theglobeandmail.com/business/article-arlene-dickinson-amber-mac-cut-ties-canadian-startup-gander-social/"">Arlene Dickinson and Amber Mac cut ties with Canadian social media startup Gander Social</a>"
5,Ontario police charge eight people in an alleged scheme at driver-licensing centres,https://www.theglobeandmail.com/canada/article-ontario-police-drivetest-charge-defendants-scheme/,No byline found,No article type found,"<a href=""https://www.theglobeandmail.com/canada/article-ontario-police-drivetest-charge-defendants-scheme/"">Ontario police charge eight people in an alleged scheme at driver-licensing centres</a>"
6,This tiny B.C. city is one of the most livable in Canada – for those who can find it,https://www.theglobeandmail.com/business/article-canada-most-livable-small-city-pitt-meadows/,No byline found,No article type found,"<a href=""https://www.theglobeandmail.com/business/article-canada-most-livable-small-city-pitt-meadows/"">This tiny B.C. city is one of the most livable in Canada – for those who can find it</a>"
7,Minnesotans are resisting ICE – and they’re more galvanized than ever,https://www.theglobeandmail.com/world/us-politics/article-minnesota-ice-resistance/,No byline found,No article type found,"<a href=""https://www.theglobeandmail.com/world/us-politics/article-minnesota-ice-resistance/"">Minnesotans are resisting ICE – and they’re more galvanized than ever</a>"
8,Who is Trump’s Federal Reserve chair nominee Kevin Warsh?,https://www.theglobeandmail.com/business/international-business/article-who-is-kevin-warsh-federal-reserve-chair-nominee-donald-trump/,No byline found,No article type found,"<a href=""https://www.theglobeandmail.com/business/international-business/article-who-is-kevin-warsh-federal-reserve-chair-nominee-donald-trump/"">Who is Trump’s Federal Reserve chair nominee Kevin Warsh?</a>"
