Rank,Article title,url,Byline,Article type,title_with_link
1,Fitness trends to watch in 2026,https://www.theglobeandmail.com/life/wellness/fitness/article-fitness-trends-to-watch-in-2026/,No byline found,No article type found,"<a href=""https://www.theglobeandmail.com/life/wellness/fitness/article-fitness-trends-to-watch-in-2026/"">Fitness trends to watch in 2026</a>"
2,"For Jewish communities, Chinese food is more than a Christmas tradition – they’re also walking the wok",https://www.theglobeandmail.com/opinion/article-chinese-food-christmas-tradition-wok-jewish-community/,Jason Wang,Opinion,"<a href=""https://www.theglobeandmail.com/opinion/article-chinese-food-christmas-tradition-wok-jewish-community/"">For Jewish communities, Chinese food is more than a Christmas tradition – they’re also walking the wok</a>"
3,"From Washington to Iqaluit, Carney’s travels reveal a lot about his priorities",https://www.theglobeandmail.com/canada/article-mark-carney-travels-trips-mapped/,No byline found,No article type found,"<a href=""https://www.theglobeandmail.com/canada/article-mark-carney-travels-trips-mapped/"">From Washington to Iqaluit, Carney’s travels reveal a lot about his priorities</a>"
4,"The Globe’s Christmas painting: Home on the Range, by William Kurelek",https://www.theglobeandmail.com/culture/article-globe-christmas-painting-home-on-the-range-by-william-kurelek/,No byline found,No article type found,"<a href=""https://www.theglobeandmail.com/culture/article-globe-christmas-painting-home-on-the-range-by-william-kurelek/"">The Globe’s Christmas painting: Home on the Range, by William Kurelek</a>"
5,Warren Buffett is about to retire. Do not despair,https://www.theglobeandmail.com/investing/personal-finance/article-warren-buffett-is-about-to-retire-do-not-despair/,No byline found,No article type found,"<a href=""https://www.theglobeandmail.com/investing/personal-finance/article-warren-buffett-is-about-to-retire-do-not-despair/"">Warren Buffett is about to retire. Do not despair</a>"
6,B.C. MP Aaron Gunn says he won’t run for provincial Conservative leadership,https://www.theglobeandmail.com/politics/article-mp-aaron-gunn-bc-conservative-leadership/,No byline found,No article type found,"<a href=""https://www.theglobeandmail.com/politics/article-mp-aaron-gunn-bc-conservative-leadership/"">B.C. MP Aaron Gunn says he won’t run for provincial Conservative leadership</a>"
7,Canada must acknowledge the implications of selling uranium to India,https://www.theglobeandmail.com/opinion/article-uranium-india-nuclear-canada-carney-npt-non-proliferation-cameco/,Gordon Edwards,Opinion,"<a href=""https://www.theglobeandmail.com/opinion/article-uranium-india-nuclear-canada-carney-npt-non-proliferation-cameco/"">Canada must acknowledge the implications of selling uranium to India</a>"
8,Trump’s new Presidential Walk of Fame plaques are another attempt at rewriting history,https://www.theglobeandmail.com/world/us-politics/article-trump-presidential-walk-of-fame-plaques-rewriting-history/,No byline found,Analysis,"<a href=""https://www.theglobeandmail.com/world/us-politics/article-trump-presidential-walk-of-fame-plaques-rewriting-history/"">Trump’s new Presidential Walk of Fame plaques are another attempt at rewriting history</a>"
