Rank,Article title,url,Byline,Article type,title_with_link
1,This is what the opening move of the U.S.’s attempted annexation of Canada could look like,https://www.theglobeandmail.com/opinion/article-trump-us-annex-canada-arctic-maritime-sovereignty/,Franklyn Griffiths,Opinion,"<a href=""https://www.theglobeandmail.com/opinion/article-trump-us-annex-canada-arctic-maritime-sovereignty/"">This is what the opening move of the U.S.’s attempted annexation of Canada could look like</a>"
2,Financial institutions facing insider threats from rogue employees accessing client data,https://www.theglobeandmail.com/business/economy/article-alleged-hack-of-carneys-banking-info-points-to-growing-threat-of/,No byline found,No article type found,"<a href=""https://www.theglobeandmail.com/business/economy/article-alleged-hack-of-carneys-banking-info-points-to-growing-threat-of/"">Financial institutions facing insider threats from rogue employees accessing client data</a>"
3,"Canadian electric-truck maker Edison Motors driven to the brink by tariffs, postal strike",https://www.theglobeandmail.com/investing/personal-finance/article-canadian-electric-truck-maker-edison-motors-driven-to-the-brink-by/,No byline found,No article type found,"<a href=""https://www.theglobeandmail.com/investing/personal-finance/article-canadian-electric-truck-maker-edison-motors-driven-to-the-brink-by/"">Canadian electric-truck maker Edison Motors driven to the brink by tariffs, postal strike</a>"
4,Pembina Pipeline a contender to buy minority stake in natural gas division from KKR,https://www.theglobeandmail.com/business/article-pembina-pipeline-kkr-natural-gas-division-buy-back/,No byline found,No article type found,"<a href=""https://www.theglobeandmail.com/business/article-pembina-pipeline-kkr-natural-gas-division-buy-back/"">Pembina Pipeline a contender to buy minority stake in natural gas division from KKR</a>"
5,Poll on U.S. political division points to irreconcilable differences,https://www.theglobeandmail.com/world/us-politics/article-us-political-division-irreconcilable-differences-poll/,No byline found,Analysis,"<a href=""https://www.theglobeandmail.com/world/us-politics/article-us-political-division-irreconcilable-differences-poll/"">Poll on U.S. political division points to irreconcilable differences</a>"
6,Confessions of a nail biter,https://www.theglobeandmail.com/opinion/article-nail-biting-skin-picking-confessions-body-focused-repetitive/,Matthew Pearson,Opinion,"<a href=""https://www.theglobeandmail.com/opinion/article-nail-biting-skin-picking-confessions-body-focused-repetitive/"">Confessions of a nail biter</a>"
7,"Fall culture preview 2025: All the film, television, exhibits, music and more to look forward to this season",https://www.theglobeandmail.com/culture/article-fall-culture-preview-2025-film-television-art-music-concerts-theatre/,No byline found,No article type found,"<a href=""https://www.theglobeandmail.com/culture/article-fall-culture-preview-2025-film-television-art-music-concerts-theatre/"">Fall culture preview 2025: All the film, television, exhibits, music and more to look forward to this season</a>"
8,Impaired driver arrested after two people struck by vehicle in Toronto,https://www.theglobeandmail.com/canada/article-impaired-driver-arrested-after-two-people-struck-by-vehicle-in-toronto/,No byline found,No article type found,"<a href=""https://www.theglobeandmail.com/canada/article-impaired-driver-arrested-after-two-people-struck-by-vehicle-in-toronto/"">Impaired driver arrested after two people struck by vehicle in Toronto</a>"
