Rank,Article title,url,Byline,Article type,title_with_link
1,"Tensions and uncertainty across Middle East after Iran’s Khamenei killed, while instability hits markets",https://www.theglobeandmail.com/world/article-iran-us-israel-uae-trump-ayatollah-ali-khamenei-live-updates/,No byline found,No article type found,"<a href=""https://www.theglobeandmail.com/world/article-iran-us-israel-uae-trump-ayatollah-ali-khamenei-live-updates/"">Tensions and uncertainty across Middle East after Iran’s Khamenei killed, while instability hits markets</a>"
2,"OpenAI has shown it cannot be trusted. Canada needs nationalized, public AI",https://www.theglobeandmail.com/business/commentary/article-openai-tumbler-ridge-chatgpt/,Nathan Sanders,Opinion,"<a href=""https://www.theglobeandmail.com/business/commentary/article-openai-tumbler-ridge-chatgpt/"">OpenAI has shown it cannot be trusted. Canada needs nationalized, public AI</a>"
3,"Hilary Knight delivers joke during ‘SNL’ appearance featuring U.S. men, women hockey gold medalists",https://www.theglobeandmail.com/sports/hockey/article-hilary-knight-delivers-joke-during-snl-appearance-featuring-us-men/,No byline found,No article type found,"<a href=""https://www.theglobeandmail.com/sports/hockey/article-hilary-knight-delivers-joke-during-snl-appearance-featuring-us-men/"">Hilary Knight delivers joke during ‘SNL’ appearance featuring U.S. men, women hockey gold medalists</a>"
4,It took years for my Indigenous husband to find his way home. That’s why pretendians only add insult to injury,https://www.theglobeandmail.com/opinion/article-it-took-years-for-my-indigenous-husband-to-find-his-way-home-thats-why/,Patricia Onysko,Opinion,"<a href=""https://www.theglobeandmail.com/opinion/article-it-took-years-for-my-indigenous-husband-to-find-his-way-home-thats-why/"">It took years for my Indigenous husband to find his way home. That’s why pretendians only add insult to injury</a>"
5,"Winnipeg aviation worker made $315,000 last year, but often works 12-hour shifts, eight days in row",https://www.theglobeandmail.com/investing/personal-finance/young-money/article-winnipeg-aviation-paycheque-project/,No byline found,No article type found,"<a href=""https://www.theglobeandmail.com/investing/personal-finance/young-money/article-winnipeg-aviation-paycheque-project/"">Winnipeg aviation worker made $315,000 last year, but often works 12-hour shifts, eight days in row</a>"
6,Mexicans and Canadians in Puerto Vallarta watch their step in a cartel war’s wreckage,https://www.theglobeandmail.com/world/article-mexicans-and-canadians-in-puerto-vallarta-watch-their-step-in-a-cartel/,No byline found,No article type found,"<a href=""https://www.theglobeandmail.com/world/article-mexicans-and-canadians-in-puerto-vallarta-watch-their-step-in-a-cartel/"">Mexicans and Canadians in Puerto Vallarta watch their step in a cartel war’s wreckage</a>"
7,A list of Iranian attacks on countries in the region,https://www.theglobeandmail.com/canada/article-a-list-of-iranian-attacks-on-countries-in-the-region/,No byline found,No article type found,"<a href=""https://www.theglobeandmail.com/canada/article-a-list-of-iranian-attacks-on-countries-in-the-region/"">A list of Iranian attacks on countries in the region</a>"
8,Which regime? What change? Iran’s complexity means there are no magic bullets,https://www.theglobeandmail.com/opinion/article-which-regime-what-change-irans-complexity-means-there-are-no-magic/,No byline found,Analysis,"<a href=""https://www.theglobeandmail.com/opinion/article-which-regime-what-change-irans-complexity-means-there-are-no-magic/"">Which regime? What change? Iran’s complexity means there are no magic bullets</a>"
