Rank,Article title,url,Byline,Article type,title_with_link
1,Five ways to boost the nutritional value from your vegetables,https://www.theglobeandmail.com/life/wellness/article-nutritional-value-vegetables-diet-food-advice/,No byline found,No article type found,"<a href=""https://www.theglobeandmail.com/life/wellness/article-nutritional-value-vegetables-diet-food-advice/"">Five ways to boost the nutritional value from your vegetables</a>"
2,"Ottawa to fast-track permanent residency for up to 33,000 temporary foreign workers",https://www.theglobeandmail.com/politics/article-permanent-residency-temporary-foreign-workers-tfw-ircc-citizenship/,No byline found,No article type found,"<a href=""https://www.theglobeandmail.com/politics/article-permanent-residency-temporary-foreign-workers-tfw-ircc-citizenship/"">Ottawa to fast-track permanent residency for up to 33,000 temporary foreign workers</a>"
3,Iconic manager Bruce Allen on confronting Bob Seger and taking care of Randy Bachman’s business,https://www.theglobeandmail.com/culture/article-bruce-allen-lifetime-achievement-award-seger-bachman-buble/,No byline found,No article type found,"<a href=""https://www.theglobeandmail.com/culture/article-bruce-allen-lifetime-achievement-award-seger-bachman-buble/"">Iconic manager Bruce Allen on confronting Bob Seger and taking care of Randy Bachman’s business</a>"
4,Danielle Smith should use Alberta’s data breach to put an end to secession talk,https://www.theglobeandmail.com/opinion/article-danielle-smith-alberta-data-breach-secession-independence/,Jen Gerson,Opinion,"<a href=""https://www.theglobeandmail.com/opinion/article-danielle-smith-alberta-data-breach-secession-independence/"">Danielle Smith should use Alberta’s data breach to put an end to secession talk</a>"
5,"Oil prices jump as Iran sets UAE oil port ablaze, strikes vessels in Strait of Hormuz",https://www.theglobeandmail.com/investing/article-oil-prices-jump-as-renewed-iran-tensions-threaten-supply/,No byline found,No article type found,"<a href=""https://www.theglobeandmail.com/investing/article-oil-prices-jump-as-renewed-iran-tensions-threaten-supply/"">Oil prices jump as Iran sets UAE oil port ablaze, strikes vessels in Strait of Hormuz</a>"
6,Can I legally make a U-turn at a traffic light?,https://www.theglobeandmail.com/drive/culture/article-can-i-legally-make-a-u-turn-at-a-traffic-light/,No byline found,No article type found,"<a href=""https://www.theglobeandmail.com/drive/culture/article-can-i-legally-make-a-u-turn-at-a-traffic-light/"">Can I legally make a U-turn at a traffic light?</a>"
7,Morning Update: One more step for Alberta separatists,https://www.theglobeandmail.com/canada/article-morning-update-one-more-step-for-alberta-separatists/,No byline found,No article type found,"<a href=""https://www.theglobeandmail.com/canada/article-morning-update-one-more-step-for-alberta-separatists/"">Morning Update: One more step for Alberta separatists</a>"
8,Brookfield picks startup The Nuclear Company for nuclear push in the U.S.,https://www.theglobeandmail.com/business/article-brookfield-the-nuclear-company-south-carolina-nuclear-project/,No byline found,No article type found,"<a href=""https://www.theglobeandmail.com/business/article-brookfield-the-nuclear-company-south-carolina-nuclear-project/"">Brookfield picks startup The Nuclear Company for nuclear push in the U.S.</a>"
