Rank,Article title,url,Byline,Article type,title_with_link
1,Bombardier wins Saudi contract for up to 60 business jets,https://www.theglobeandmail.com/business/article-bombardier-wins-saudi-contract-for-up-to-60-business-jets/,No byline found,No article type found,"<a href=""https://www.theglobeandmail.com/business/article-bombardier-wins-saudi-contract-for-up-to-60-business-jets/"">Bombardier wins Saudi contract for up to 60 business jets</a>"
2,A look at life in Dagestan,https://www.theglobeandmail.com/world/article-a-look-at-life-in-dagestan/,No byline found,No article type found,"<a href=""https://www.theglobeandmail.com/world/article-a-look-at-life-in-dagestan/"">A look at life in Dagestan</a>"
3,Workplace pension plans have failed most Canadians,https://www.theglobeandmail.com/investing/personal-finance/article-workplace-pension-plan-fail-retirement/,Frederick Vettese,Opinion,"<a href=""https://www.theglobeandmail.com/investing/personal-finance/article-workplace-pension-plan-fail-retirement/"">Workplace pension plans have failed most Canadians</a>"
4,Zelensky names replacement military chief after mass protests in Ukraine,https://www.theglobeandmail.com/world/article-mykhailo-drapatyi-ukraine-zelensky-commander/,No byline found,No article type found,"<a href=""https://www.theglobeandmail.com/world/article-mykhailo-drapatyi-ukraine-zelensky-commander/"">Zelensky names replacement military chief after mass protests in Ukraine</a>"
5,Yet another shipping route gets blocked. Welcome to the new reality,https://www.theglobeandmail.com/business/commentary/article-iran-us-war-houthis-strait-hormuz-blockade-shipping/,Thomas Juneau,Opinion,"<a href=""https://www.theglobeandmail.com/business/commentary/article-iran-us-war-houthis-strait-hormuz-blockade-shipping/"">Yet another shipping route gets blocked. Welcome to the new reality</a>"
6,Trump escalates trade war against Canada with threat to impose 50% tariffs,https://www.theglobeandmail.com/world/us-politics/article-trump-tariffs-canada-us-executive-order-section-338/,No byline found,No article type found,"<a href=""https://www.theglobeandmail.com/world/us-politics/article-trump-tariffs-canada-us-executive-order-section-338/"">Trump escalates trade war against Canada with threat to impose 50% tariffs</a>"
7,"SickKids doctor arrested, charged with possession of child sexual abuse material",https://www.theglobeandmail.com/canada/toronto/article-sickkids-doctor-arrest-csam-dilan-dissanayake/,No byline found,No article type found,"<a href=""https://www.theglobeandmail.com/canada/toronto/article-sickkids-doctor-arrest-csam-dilan-dissanayake/"">SickKids doctor arrested, charged with possession of child sexual abuse material</a>"
8,Premiers agree to lift interprovincial barriers on alcohol sales,https://www.theglobeandmail.com/canada/article-premiers-meeting-barriers-alcohol-sales-brewer-distiller/,No byline found,No article type found,"<a href=""https://www.theglobeandmail.com/canada/article-premiers-meeting-barriers-alcohol-sales-brewer-distiller/"">Premiers agree to lift interprovincial barriers on alcohol sales</a>"
