Rank,Article title,url,Byline,Article type,title_with_link
1,Canada’s passenger rail lines are getting revived after decades of vanishing service,https://www.theglobeandmail.com/opinion/article-canada-passenger-line-revival-railway-cars-planes/,Taras Grescoe,Opinion,"<a href=""https://www.theglobeandmail.com/opinion/article-canada-passenger-line-revival-railway-cars-planes/"">Canada’s passenger rail lines are getting revived after decades of vanishing service</a>"
2,"Carney to visit Mumbai, New Delhi but not Punjab in business-focused India trip",https://www.theglobeandmail.com/politics/article-carney-india-trip-mumbai-new-delhi-trade-business/,No byline found,No article type found,"<a href=""https://www.theglobeandmail.com/politics/article-carney-india-trip-mumbai-new-delhi-trade-business/"">Carney to visit Mumbai, New Delhi but not Punjab in business-focused India trip</a>"
3,"Buy, sell or hold? When it comes to these three Canadian tech stocks, here’s what I recommend",https://www.theglobeandmail.com/investing/markets/inside-the-market/article-canadian-tech-stocks-investing-ai/,Gordon Pape,Opinion,"<a href=""https://www.theglobeandmail.com/investing/markets/inside-the-market/article-canadian-tech-stocks-investing-ai/"">Buy, sell or hold? When it comes to these three Canadian tech stocks, here’s what I recommend</a>"
4,"This 42-year-old and her daughter had a $450,000 budget for a home in Winnipeg. Here’s what she found",https://www.theglobeandmail.com/investing/personal-finance/article-this-42-year-old-and-her-daughter-had-a-450000-budget-for-a-home-in/,No byline found,No article type found,"<a href=""https://www.theglobeandmail.com/investing/personal-finance/article-this-42-year-old-and-her-daughter-had-a-450000-budget-for-a-home-in/"">This 42-year-old and her daughter had a $450,000 budget for a home in Winnipeg. Here’s what she found</a>"
5,CPP payment increases slow in 2026 as retirees cope with high living costs,https://www.theglobeandmail.com/investing/personal-finance/retirement/article-cpp-payments-2026-retirement-cost-of-living-pension/,No byline found,No article type found,"<a href=""https://www.theglobeandmail.com/investing/personal-finance/retirement/article-cpp-payments-2026-retirement-cost-of-living-pension/"">CPP payment increases slow in 2026 as retirees cope with high living costs</a>"
6,What to know about Canada’s travel advisory in Mexico and flight cancellations amid violent unrest,https://www.theglobeandmail.com/canada/article-puerto-vallarta-mexico-canada-travel-advisory-flight-cancellations/,No byline found,No article type found,"<a href=""https://www.theglobeandmail.com/canada/article-puerto-vallarta-mexico-canada-travel-advisory-flight-cancellations/"">What to know about Canada’s travel advisory in Mexico and flight cancellations amid violent unrest</a>"
7,Tuesday’s analyst upgrades and downgrades,https://www.theglobeandmail.com/investing/markets/inside-the-market/article-tuesdays-analyst-upgrades-and-downgrades-283/,No byline found,No article type found,"<a href=""https://www.theglobeandmail.com/investing/markets/inside-the-market/article-tuesdays-analyst-upgrades-and-downgrades-283/"">Tuesday’s analyst upgrades and downgrades</a>"
8,Mexico the latest flashpoint in travel upheaval linked to U.S. policy,https://www.theglobeandmail.com/investing/personal-finance/article-mexico-travel-tourism-us-trump-policy/,No byline found,No article type found,"<a href=""https://www.theglobeandmail.com/investing/personal-finance/article-mexico-travel-tourism-us-trump-policy/"">Mexico the latest flashpoint in travel upheaval linked to U.S. policy</a>"
