Rank,Article title,url,Byline,Article type,title_with_link
1,World’s longest suspension bridge to connect Sicily to mainland Italy after decades of false starts,https://www.theglobeandmail.com/world/article-strait-messina-bridge-italy-sicily/,No byline found,No article type found,"<a href=""https://www.theglobeandmail.com/world/article-strait-messina-bridge-italy-sicily/"">World’s longest suspension bridge to connect Sicily to mainland Italy after decades of false starts</a>"
2,"Mboko advances to women’s singles final at National Bank Open, continuing remarkable streak",https://www.theglobeandmail.com/sports/article-victoria-mboko-elena-rybakina-semifinal/,No byline found,No article type found,"<a href=""https://www.theglobeandmail.com/sports/article-victoria-mboko-elena-rybakina-semifinal/"">Mboko advances to women’s singles final at National Bank Open, continuing remarkable streak</a>"
3,Canada can avoid the U.S. open-banking mess – but only if it moves now,https://www.theglobeandmail.com/business/commentary/article-open-banking-cfpb-finance-economy/,Steve Boms,Opinion,"<a href=""https://www.theglobeandmail.com/business/commentary/article-open-banking-cfpb-finance-economy/"">Canada can avoid the U.S. open-banking mess – but only if it moves now</a>"
4,Not your parent’s Caravan: Mercedes EV concept is a VIP lounge on wheels but don’t call it a van,https://www.theglobeandmail.com/drive/article-not-your-parents-caravan-mercedes-ev-concept-is-a-vip-lounge-on-wheels/,No byline found,No article type found,"<a href=""https://www.theglobeandmail.com/drive/article-not-your-parents-caravan-mercedes-ev-concept-is-a-vip-lounge-on-wheels/"">Not your parent’s Caravan: Mercedes EV concept is a VIP lounge on wheels but don’t call it a van</a>"
5,"Ford proposes three-level tunnel under Highway 401, feasibility study not started",https://www.theglobeandmail.com/canada/article-ford-tunnel-highway-401/,No byline found,No article type found,"<a href=""https://www.theglobeandmail.com/canada/article-ford-tunnel-highway-401/"">Ford proposes three-level tunnel under Highway 401, feasibility study not started</a>"
6,What to watch this weekend: Re-examine a harrowing Canadian crime,https://www.theglobeandmail.com/arts/article-christine-jessop-jenna-ortega-wednesday-plan-b-outlander-kennedys/,No byline found,No article type found,"<a href=""https://www.theglobeandmail.com/arts/article-christine-jessop-jenna-ortega-wednesday-plan-b-outlander-kennedys/"">What to watch this weekend: Re-examine a harrowing Canadian crime</a>"
7,Ottawa faces growing pressure to loosen foreign homebuying ban,https://www.theglobeandmail.com/business/article-foreign-homebuying-ban-ottawa-pressure/,No byline found,No article type found,"<a href=""https://www.theglobeandmail.com/business/article-foreign-homebuying-ban-ottawa-pressure/"">Ottawa faces growing pressure to loosen foreign homebuying ban</a>"
8,Morning Update: Italy pitches the world’s longest suspension bridge,https://www.theglobeandmail.com/canada/article-morning-update-italy-pitches-the-worlds-longest-suspension-bridge/,No byline found,No article type found,"<a href=""https://www.theglobeandmail.com/canada/article-morning-update-italy-pitches-the-worlds-longest-suspension-bridge/"">Morning Update: Italy pitches the world’s longest suspension bridge</a>"
