Rank,Article title,url,Byline,Article type,title_with_link
1,"Plane makes emergency landing on Manitoba highway, one passenger hospitalized",https://www.theglobeandmail.com/canada/article-plane-makes-emergency-landing-on-manitoba-highway-one-passenger/,No byline found,No article type found,"<a href=""https://www.theglobeandmail.com/canada/article-plane-makes-emergency-landing-on-manitoba-highway-one-passenger/"">Plane makes emergency landing on Manitoba highway, one passenger hospitalized</a>"
2,JPMorgan’s Jamie Dimon plays down U.S.-Canada trade tensions as ‘a bump in the road’,https://www.theglobeandmail.com/business/article-jamie-dimon-jpmorgan-donald-trump-canada-bank/,No byline found,No article type found,"<a href=""https://www.theglobeandmail.com/business/article-jamie-dimon-jpmorgan-donald-trump-canada-bank/"">JPMorgan’s Jamie Dimon plays down U.S.-Canada trade tensions as ‘a bump in the road’</a>"
3,What happens to my RRIF in a market crash?,https://www.theglobeandmail.com/investing/education/article-what-happens-to-my-rrif-in-a-market-crash/,Andrew Galbraith,Opinion,"<a href=""https://www.theglobeandmail.com/investing/education/article-what-happens-to-my-rrif-in-a-market-crash/"">What happens to my RRIF in a market crash?</a>"
4,Eurovision is a giant glittery mess – and CBC should absolutely jump into it,https://www.theglobeandmail.com/culture/film-and-tv/television/article-eurovision-is-a-giant-glittery-mess-and-cbc-should-absolutely-jump/,J. Kelly Nestruck,Opinion,"<a href=""https://www.theglobeandmail.com/culture/film-and-tv/television/article-eurovision-is-a-giant-glittery-mess-and-cbc-should-absolutely-jump/"">Eurovision is a giant glittery mess – and CBC should absolutely jump into it</a>"
5,Canada built the Gordie Howe bridge. Trump weaponized it,https://www.theglobeandmail.com/investing/markets/inside-the-market/article-gordie-howe-bridge-donald-trump-weaponized-infrastructure/,Tim Shufelt,Opinion,"<a href=""https://www.theglobeandmail.com/investing/markets/inside-the-market/article-gordie-howe-bridge-donald-trump-weaponized-infrastructure/"">Canada built the Gordie Howe bridge. Trump weaponized it</a>"
6,"Outgoing Telus CEO presents sunny view of his tenure, despite stock price challenges",https://www.theglobeandmail.com/business/article-telus-ceo-darren-entwistle-tenure-stock-price/,No byline found,No article type found,"<a href=""https://www.theglobeandmail.com/business/article-telus-ceo-darren-entwistle-tenure-stock-price/"">Outgoing Telus CEO presents sunny view of his tenure, despite stock price challenges</a>"
7,Small plane crashes into Beijing’s tallest building,https://www.theglobeandmail.com/world/article-small-plane-crashes-into-beijings-tallest-building/,No byline found,No article type found,"<a href=""https://www.theglobeandmail.com/world/article-small-plane-crashes-into-beijings-tallest-building/"">Small plane crashes into Beijing’s tallest building</a>"
8,"Coquitlam condo sells $120,000 below 2023 purchase price",https://www.theglobeandmail.com/real-estate/vancouver/article-coquitlam-condo-strata-dispute-sells-below-purchase-price/,No byline found,No article type found,"<a href=""https://www.theglobeandmail.com/real-estate/vancouver/article-coquitlam-condo-strata-dispute-sells-below-purchase-price/"">Coquitlam condo sells $120,000 below 2023 purchase price</a>"
