Rank,Article title,url,Byline,Article type,title_with_link
1,A mysterious illness has killed billions of sea stars. Now scientists say they’ve solved the case,https://www.theglobeandmail.com/canada/science/article-sea-star-wasting-disease-source-recovery-new-research-breakthrough/,No byline found,No article type found,"<a href=""https://www.theglobeandmail.com/canada/science/article-sea-star-wasting-disease-source-recovery-new-research-breakthrough/"">A mysterious illness has killed billions of sea stars. Now scientists say they’ve solved the case</a>"
2,"Canada’s trade deficit widened to $5.9-billion in June, second highest on record",https://www.theglobeandmail.com/business/article-national-trade-deficit-statistics-canada-us-tariffs/,No byline found,No article type found,"<a href=""https://www.theglobeandmail.com/business/article-national-trade-deficit-statistics-canada-us-tariffs/"">Canada’s trade deficit widened to $5.9-billion in June, second highest on record</a>"
3,How will Canadian consumers be affected by Trump’s de minimis changes?,https://www.theglobeandmail.com/investing/personal-finance/article-trump-de-minimis-changes-canadian-consumer-affect/,No byline found,No article type found,"<a href=""https://www.theglobeandmail.com/investing/personal-finance/article-trump-de-minimis-changes-canadian-consumer-affect/"">How will Canadian consumers be affected by Trump’s de minimis changes?</a>"
4,Montreal’s rat problem worsens despite city’s promise to tackle it,https://www.theglobeandmail.com/canada/article-montreals-rat-problem-worsens-despite-citys-promise-to-tackle-it/,No byline found,No article type found,"<a href=""https://www.theglobeandmail.com/canada/article-montreals-rat-problem-worsens-despite-citys-promise-to-tackle-it/"">Montreal’s rat problem worsens despite city’s promise to tackle it</a>"
5,These women entrepreneurs are solving real-world problems,https://www.theglobeandmail.com/business/article-these-women-entrepreneurs-are-solving-real-world-problems/,No byline found,No article type found,"<a href=""https://www.theglobeandmail.com/business/article-these-women-entrepreneurs-are-solving-real-world-problems/"">These women entrepreneurs are solving real-world problems</a>"
6,U.S. ITC investigating dairy protein dumping allegations about Canada’s supply management system,https://www.theglobeandmail.com/business/economy/article-us-itc-dairy-protein-dumping-canada-supply-management/,No byline found,No article type found,"<a href=""https://www.theglobeandmail.com/business/economy/article-us-itc-dairy-protein-dumping-canada-supply-management/"">U.S. ITC investigating dairy protein dumping allegations about Canada’s supply management system</a>"
7,"Caterpillar misses profit mark, warns of up to $1.5-billion U.S. tariff hit on weakened demand",https://www.theglobeandmail.com/business/article-caterpillar-inc-profit-weak-demand-us-tariff/,No byline found,No article type found,"<a href=""https://www.theglobeandmail.com/business/article-caterpillar-inc-profit-weak-demand-us-tariff/"">Caterpillar misses profit mark, warns of up to $1.5-billion U.S. tariff hit on weakened demand</a>"
8,"‘My spirits are lifted to feel that in Canada, I have a Prime Minister with something resembling a moral compass.’ Letters to the editor for Aug. 5",https://www.theglobeandmail.com/opinion/letters/article-a-prime-minister-with-something-resembling-a-moral-compass/,No byline found,No article type found,"<a href=""https://www.theglobeandmail.com/opinion/letters/article-a-prime-minister-with-something-resembling-a-moral-compass/"">‘My spirits are lifted to feel that in Canada, I have a Prime Minister with something resembling a moral compass.’ Letters to the editor for Aug. 5</a>"
