Rank,Article title,url,Byline,Article type,title_with_link
1,"As pipeline politics begin anew, Ottawa must fast-track the courts",https://www.theglobeandmail.com/business/commentary/article-pipeline-politics-ottawa-must-fast-track-the-courts/,Thomas Isaac,Opinion,"<a href=""https://www.theglobeandmail.com/business/commentary/article-pipeline-politics-ottawa-must-fast-track-the-courts/"">As pipeline politics begin anew, Ottawa must fast-track the courts</a>"
2,Is it illegal to stop before turning right at a green light?,https://www.theglobeandmail.com/drive/culture/article-is-it-illegal-to-stop-before-turning-right-at-a-green-light/,No byline found,No article type found,"<a href=""https://www.theglobeandmail.com/drive/culture/article-is-it-illegal-to-stop-before-turning-right-at-a-green-light/"">Is it illegal to stop before turning right at a green light?</a>"
3,An illustration in Robert Munsch’s beloved Love You Forever didn’t seem right. I set out to discover why,https://www.theglobeandmail.com/culture/books/article-robert-munsch-love-you-forever-illustration-mystery/,No byline found,No article type found,"<a href=""https://www.theglobeandmail.com/culture/books/article-robert-munsch-love-you-forever-illustration-mystery/"">An illustration in Robert Munsch’s beloved Love You Forever didn’t seem right. I set out to discover why</a>"
4,Monday’s analyst upgrades and downgrades,https://www.theglobeandmail.com/investing/markets/inside-the-market/article-mondays-analyst-upgrades-and-downgrades-249/,No byline found,No article type found,"<a href=""https://www.theglobeandmail.com/investing/markets/inside-the-market/article-mondays-analyst-upgrades-and-downgrades-249/"">Monday’s analyst upgrades and downgrades</a>"
5,"Zymeworks wanted to be Canada’s first Big Pharma. Despite two blockbusters-in-the-making, that’s no longer the plan",https://www.theglobeandmail.com/business/article-zymeworks-pharma-kenneth-galbraith-ceo-drugs-health-care/,No byline found,No article type found,"<a href=""https://www.theglobeandmail.com/business/article-zymeworks-pharma-kenneth-galbraith-ceo-drugs-health-care/"">Zymeworks wanted to be Canada’s first Big Pharma. Despite two blockbusters-in-the-making, that’s no longer the plan</a>"
6,Alberta’s (welcome) healthcare heresy,https://www.theglobeandmail.com/opinion/editorials/article-albertas-welcome-healthcare-heresy/,No byline found,No article type found,"<a href=""https://www.theglobeandmail.com/opinion/editorials/article-albertas-welcome-healthcare-heresy/"">Alberta’s (welcome) healthcare heresy</a>"
7,There was only one place that could soothe us: Sicily’s Cefalu,https://www.theglobeandmail.com/life/travel/article-italy-travel-sicily/,No byline found,No article type found,"<a href=""https://www.theglobeandmail.com/life/travel/article-italy-travel-sicily/"">There was only one place that could soothe us: Sicily’s Cefalu</a>"
8,Experts say ultra-processed foods are a ‘major public health threat.’ Here’s how to protect yourself,https://www.theglobeandmail.com/life/health-and-fitness/article-ultra-processed-foods-are-a-major-public-health-threat-experts-warn/,No byline found,No article type found,"<a href=""https://www.theglobeandmail.com/life/health-and-fitness/article-ultra-processed-foods-are-a-major-public-health-threat-experts-warn/"">Experts say ultra-processed foods are a ‘major public health threat.’ Here’s how to protect yourself</a>"
