Rank,Article title,url,Byline,Article type,title_with_link
1,Tribunal approves $8.5-billion deal for Ontario First Nations to lead their own child welfare,https://www.theglobeandmail.com/canada/article-human-rights-tribunal-child-welfare-agreement-ontario-first-nations/,No byline found,No article type found,"<a href=""https://www.theglobeandmail.com/canada/article-human-rights-tribunal-child-welfare-agreement-ontario-first-nations/"">Tribunal approves $8.5-billion deal for Ontario First Nations to lead their own child welfare</a>"
2,Canucks’ decision to revoke credential of reporter alarms colleagues,https://www.theglobeandmail.com/sports/hockey/article-vancouver-canucks-credential-reporter-nhl/,No byline found,No article type found,"<a href=""https://www.theglobeandmail.com/sports/hockey/article-vancouver-canucks-credential-reporter-nhl/"">Canucks’ decision to revoke credential of reporter alarms colleagues</a>"
3,Carney commits to not proroguing Parliament after April 13 by-elections,https://www.theglobeandmail.com/politics/article-carney-prorogue-parliament-april-13-byelections/,No byline found,No article type found,"<a href=""https://www.theglobeandmail.com/politics/article-carney-prorogue-parliament-april-13-byelections/"">Carney commits to not proroguing Parliament after April 13 by-elections</a>"
4,"Want to slow brain aging? Follow this diet, a new study suggests",https://www.theglobeandmail.com/life/health-and-fitness/article-mind-diet-brain-aging-health/,No byline found,No article type found,"<a href=""https://www.theglobeandmail.com/life/health-and-fitness/article-mind-diet-brain-aging-health/"">Want to slow brain aging? Follow this diet, a new study suggests</a>"
5,"Just For Laughs founder Gilbert Rozon ordered to pay $880,000 to eight of nine accusers",https://www.theglobeandmail.com/canada/article-just-for-laughs-founder-gilbert-rozon-ordered-to-pay-eight-accusers/,No byline found,No article type found,"<a href=""https://www.theglobeandmail.com/canada/article-just-for-laughs-founder-gilbert-rozon-ordered-to-pay-eight-accusers/"">Just For Laughs founder Gilbert Rozon ordered to pay $880,000 to eight of nine accusers</a>"
6,"What is B.C.’s new health care law, Bill 36?",https://www.theglobeandmail.com/canada/article-what-is-bcs-new-health-care-law-bill-36/,No byline found,No article type found,"<a href=""https://www.theglobeandmail.com/canada/article-what-is-bcs-new-health-care-law-bill-36/"">What is B.C.’s new health care law, Bill 36?</a>"
7,Robert Pattinson and Zendaya face death till they part in the awkward comedy The Drama,https://www.theglobeandmail.com/culture/film-and-tv/film/article-the-drama-review-robert-pattinson-zendaya-kristoffer-borgli/,No byline found,No article type found,"<a href=""https://www.theglobeandmail.com/culture/film-and-tv/film/article-the-drama-review-robert-pattinson-zendaya-kristoffer-borgli/"">Robert Pattinson and Zendaya face death till they part in the awkward comedy The Drama</a>"
8,Is Avi Lewis’s NDP doomed? Don’t write the obituary just yet,https://www.theglobeandmail.com/business/commentary/article-avi-lewis-federal-ndp-leader/,Tony Keller,Opinion,"<a href=""https://www.theglobeandmail.com/business/commentary/article-avi-lewis-federal-ndp-leader/"">Is Avi Lewis’s NDP doomed? Don’t write the obituary just yet</a>"
