Rank,Article title,url,Byline,Article type,title_with_link
1,Enbridge starts construction on B.C. pipeline expansion for natural gas,https://www.theglobeandmail.com/business/article-enbridge-expand-bc-pipeline-natural-gas/,No byline found,No article type found,"<a href=""https://www.theglobeandmail.com/business/article-enbridge-expand-bc-pipeline-natural-gas/"">Enbridge starts construction on B.C. pipeline expansion for natural gas</a>"
2,Canadian banks have entered bubble territory. It’s time to take some profits,https://www.theglobeandmail.com/investing/markets/inside-the-market/article-david-rosenberg-the-canadian-banks-have-entered-bubble-territory-its/,David Rosenberg,Opinion,"<a href=""https://www.theglobeandmail.com/investing/markets/inside-the-market/article-david-rosenberg-the-canadian-banks-have-entered-bubble-territory-its/"">Canadian banks have entered bubble territory. It’s time to take some profits</a>"
3,Gas-and-dash took place prior to Saskatchewan Roughriders’ Jayden Dalke’s fatal crash,https://www.theglobeandmail.com/sports/article-jayden-dalke-saskatchewan-roughriders-car-crash-cfl/,No byline found,No article type found,"<a href=""https://www.theglobeandmail.com/sports/article-jayden-dalke-saskatchewan-roughriders-car-crash-cfl/"">Gas-and-dash took place prior to Saskatchewan Roughriders’ Jayden Dalke’s fatal crash</a>"
4,Spain’s World Cup champions return home to crow of almost two million for parade through Madrid,https://www.theglobeandmail.com/sports/soccer/article-spain-world-cup-parade-2026/,No byline found,No article type found,"<a href=""https://www.theglobeandmail.com/sports/soccer/article-spain-world-cup-parade-2026/"">Spain’s World Cup champions return home to crow of almost two million for parade through Madrid</a>"
5,Monday’s analyst upgrades and downgrades,https://www.theglobeandmail.com/investing/markets/inside-the-market/article-mondays-analyst-upgrades-and-downgrades-280/,No byline found,No article type found,"<a href=""https://www.theglobeandmail.com/investing/markets/inside-the-market/article-mondays-analyst-upgrades-and-downgrades-280/"">Monday’s analyst upgrades and downgrades</a>"
6,Yemen’s Houthis expand Middle East conflict with Saudi naval blockade,https://www.theglobeandmail.com/world/article-us-and-iran-trade-fire/,No byline found,No article type found,"<a href=""https://www.theglobeandmail.com/world/article-us-and-iran-trade-fire/"">Yemen’s Houthis expand Middle East conflict with Saudi naval blockade</a>"
7,"Gen Z’s consumption of alcohol continues to grow, new industry report says",https://www.theglobeandmail.com/life/style/food-and-drink/article-gen-z-canada-alcohol-consumption-iwsr/,No byline found,No article type found,"<a href=""https://www.theglobeandmail.com/life/style/food-and-drink/article-gen-z-canada-alcohol-consumption-iwsr/"">Gen Z’s consumption of alcohol continues to grow, new industry report says</a>"
8,Scientists produce most extensive map yet of dark matter in northern skies,https://www.theglobeandmail.com/canada/science/article-scientists-produce-map-of-dark-matter-in-northern-skies/,No byline found,No article type found,"<a href=""https://www.theglobeandmail.com/canada/science/article-scientists-produce-map-of-dark-matter-in-northern-skies/"">Scientists produce most extensive map yet of dark matter in northern skies</a>"
