Rank,Article title,url,Byline,Article type,title_with_link
1,"Economic Outlook 2026: The good, the bad and the downright scary",https://www.theglobeandmail.com/business/rob-magazine/article-economic-outlook-2026-trade-housing-artificial-intelligence/,No byline found,No article type found,"<a href=""https://www.theglobeandmail.com/business/rob-magazine/article-economic-outlook-2026-trade-housing-artificial-intelligence/"">Economic Outlook 2026: The good, the bad and the downright scary</a>"
2,Molson Coors accuses former Canadian staff of ‘complex’ embezzlement scheme,https://www.theglobeandmail.com/business/article-molson-coors-embezzlement-scheme-firkin-hospitality-group-fraud/,No byline found,No article type found,"<a href=""https://www.theglobeandmail.com/business/article-molson-coors-embezzlement-scheme-firkin-hospitality-group-fraud/"">Molson Coors accuses former Canadian staff of ‘complex’ embezzlement scheme</a>"
3,Insider Report: Chairman invests nearly $2-million in this industrial stock,https://www.theglobeandmail.com/investing/markets/inside-the-market/article-insider-report-chairman-invests-nearly-2-million-in-this-industrial/,No byline found,No article type found,"<a href=""https://www.theglobeandmail.com/investing/markets/inside-the-market/article-insider-report-chairman-invests-nearly-2-million-in-this-industrial/"">Insider Report: Chairman invests nearly $2-million in this industrial stock</a>"
4,The backlash against the Canadian Museum for Human Rights’ Nakba exhibit is preposterous,https://www.theglobeandmail.com/opinion/article-canadian-museum-for-human-rights-palestine-israel-nakba-exhibit/,Marsha Lederman,Opinion,"<a href=""https://www.theglobeandmail.com/opinion/article-canadian-museum-for-human-rights-palestine-israel-nakba-exhibit/"">The backlash against the Canadian Museum for Human Rights’ Nakba exhibit is preposterous</a>"
5,Thomas King’s storytelling now feels like a betrayal,https://www.theglobeandmail.com/opinion/article-thomas-king-storytelling-feels-like-a-betrayal-cherokee/,Tanya Talaga,Opinion,"<a href=""https://www.theglobeandmail.com/opinion/article-thomas-king-storytelling-feels-like-a-betrayal-cherokee/"">Thomas King’s storytelling now feels like a betrayal</a>"
6,"Afghan national charged in Guard shooting worked with CIA before coming to U.S., officials say",https://www.theglobeandmail.com/world/article-national-guard-shooting-suspect-cia-afghanistan/,No byline found,No article type found,"<a href=""https://www.theglobeandmail.com/world/article-national-guard-shooting-suspect-cia-afghanistan/"">Afghan national charged in Guard shooting worked with CIA before coming to U.S., officials say</a>"
7,Halifax bouncer found guilty of manslaughter in 2022 death of bar patron,https://www.theglobeandmail.com/canada/article-halifax-bouncer-guilty-manslaughter-ryan-sawyer/,No byline found,No article type found,"<a href=""https://www.theglobeandmail.com/canada/article-halifax-bouncer-guilty-manslaughter-ryan-sawyer/"">Halifax bouncer found guilty of manslaughter in 2022 death of bar patron</a>"
8,Spain has become an economic leader by using Ottawa’s toolkit the right way,https://www.theglobeandmail.com/opinion/article-spain-has-become-an-economic-leader-by-using-ottawas-toolkit-the-right/,Doug Saunders,Opinion,"<a href=""https://www.theglobeandmail.com/opinion/article-spain-has-become-an-economic-leader-by-using-ottawas-toolkit-the-right/"">Spain has become an economic leader by using Ottawa’s toolkit the right way</a>"
