Rank,Article title,url,Byline,Article type,title_with_link
1,Drone attack causes fire outside a nuclear power plant in Abu Dhabi,https://www.theglobeandmail.com/world/article-drone-barakah-nuclear-power-plant-al-dhafra-abu-dhabi/,No byline found,No article type found,"<a href=""https://www.theglobeandmail.com/world/article-drone-barakah-nuclear-power-plant-al-dhafra-abu-dhabi/"">Drone attack causes fire outside a nuclear power plant in Abu Dhabi</a>"
2,"In a new electoral map, Black voters of Memphis see a fractured future",https://www.theglobeandmail.com/world/article-in-a-new-electoral-map-black-voters-of-memphis-see-a-fractured-future/,No byline found,No article type found,"<a href=""https://www.theglobeandmail.com/world/article-in-a-new-electoral-map-black-voters-of-memphis-see-a-fractured-future/"">In a new electoral map, Black voters of Memphis see a fractured future</a>"
3,"Canada has lost billions of trees, but we can still build the forests of the future",https://www.theglobeandmail.com/life/article-canada-tree-planting-shortfall/,No byline found,No article type found,"<a href=""https://www.theglobeandmail.com/life/article-canada-tree-planting-shortfall/"">Canada has lost billions of trees, but we can still build the forests of the future</a>"
4,End the sleight of hand of immigration consultants,https://www.theglobeandmail.com/opinion/editorials/article-end-the-sleight-of-hand-of-immigration-consultants/,No byline found,No article type found,"<a href=""https://www.theglobeandmail.com/opinion/editorials/article-end-the-sleight-of-hand-of-immigration-consultants/"">End the sleight of hand of immigration consultants</a>"
5,Air purifiers are must-haves for many. Experts share what to look for when you shop,https://www.theglobeandmail.com/life/style/design/article-best-air-purifiers/,No byline found,No article type found,"<a href=""https://www.theglobeandmail.com/life/style/design/article-best-air-purifiers/"">Air purifiers are must-haves for many. Experts share what to look for when you shop</a>"
6,B.C. hantavirus case confirmed in laboratory test,https://www.theglobeandmail.com/canada/article-canada-hantavirus-case-mv-hondius-who/,No byline found,No article type found,"<a href=""https://www.theglobeandmail.com/canada/article-canada-hantavirus-case-mv-hondius-who/"">B.C. hantavirus case confirmed in laboratory test</a>"
7,Woody’s afterlife: A Calgary broker who fell from grace tries to redeem himself,https://www.theglobeandmail.com/business/article-calgary-adam-woodward-stocks-finance-oil-business/,No byline found,No article type found,"<a href=""https://www.theglobeandmail.com/business/article-calgary-adam-woodward-stocks-finance-oil-business/"">Woody’s afterlife: A Calgary broker who fell from grace tries to redeem himself</a>"
8,Do we really expect young Canadians to wait until 2060 for affordable housing?,https://www.theglobeandmail.com/investing/personal-finance/young-money/article-do-we-really-expect-young-canadians-to-wait-until-2060-for-affordable/,No byline found,No article type found,"<a href=""https://www.theglobeandmail.com/investing/personal-finance/young-money/article-do-we-really-expect-young-canadians-to-wait-until-2060-for-affordable/"">Do we really expect young Canadians to wait until 2060 for affordable housing?</a>"
