Rank,Article title,url,Byline,Article type,title_with_link
1,Federal ‘axe the fax’ e-prescription service built with Telus Health to shutter after $250-million spent,https://www.theglobeandmail.com/business/economy/article-federal-axe-the-fax-e-prescribing-service-built-with-telus-health-to/,No byline found,No article type found,"<a href=""https://www.theglobeandmail.com/business/economy/article-federal-axe-the-fax-e-prescribing-service-built-with-telus-health-to/"">Federal ‘axe the fax’ e-prescription service built with Telus Health to shutter after $250-million spent</a>"
2,Morning Update: Cuba loses its Canadian tourists,https://www.theglobeandmail.com/canada/article-cuba-canada-tourists-flights-oil-crisis-miguel-diaz-canel-donald-trump/,No byline found,No article type found,"<a href=""https://www.theglobeandmail.com/canada/article-cuba-canada-tourists-flights-oil-crisis-miguel-diaz-canel-donald-trump/"">Morning Update: Cuba loses its Canadian tourists</a>"
3,"Pause on third-party sex-ed programs puts students at risk, Saskatchewan organizations say",https://www.theglobeandmail.com/canada/education/article-saskatchewan-third-party-sexual-education-schools-pause/,No byline found,No article type found,"<a href=""https://www.theglobeandmail.com/canada/education/article-saskatchewan-third-party-sexual-education-schools-pause/"">Pause on third-party sex-ed programs puts students at risk, Saskatchewan organizations say</a>"
4,Wednesday’s analyst upgrades and downgrades,https://www.theglobeandmail.com/investing/markets/inside-the-market/article-wednesdays-analyst-upgrades-and-downgrades-290/,No byline found,No article type found,"<a href=""https://www.theglobeandmail.com/investing/markets/inside-the-market/article-wednesdays-analyst-upgrades-and-downgrades-290/"">Wednesday’s analyst upgrades and downgrades</a>"
5,Before the Bell: What every Canadian investor needs to know today,https://www.theglobeandmail.com/investing/markets/inside-the-market/article-before-the-bell-what-every-canadian-investor-needs-to-know-today-1412/,No byline found,No article type found,"<a href=""https://www.theglobeandmail.com/investing/markets/inside-the-market/article-before-the-bell-what-every-canadian-investor-needs-to-know-today-1412/"">Before the Bell: What every Canadian investor needs to know today</a>"
6,"Maia Schwinghammer competes for medal in moguls, Crawford misses Super G podium",https://www.theglobeandmail.com/sports/olympics/article-winter-olympics-2026-live-updates-super-g-moguls-ice-dance-medals/,No byline found,No article type found,"<a href=""https://www.theglobeandmail.com/sports/olympics/article-winter-olympics-2026-live-updates-super-g-moguls-ice-dance-medals/"">Maia Schwinghammer competes for medal in moguls, Crawford misses Super G podium</a>"
7,This septuagenarian’s TFSA has gone off the rails,https://www.theglobeandmail.com/investing/investment-ideas/article-tfsa-trouncers-saving-investing-advice/,No byline found,No article type found,"<a href=""https://www.theglobeandmail.com/investing/investment-ideas/article-tfsa-trouncers-saving-investing-advice/"">This septuagenarian’s TFSA has gone off the rails</a>"
8,FAA head says Canada will certify Gulfstream jets after Trump threats,https://www.theglobeandmail.com/business/article-us-faa-head-says-canada-will-certify-gulfstream-jets/,No byline found,No article type found,"<a href=""https://www.theglobeandmail.com/business/article-us-faa-head-says-canada-will-certify-gulfstream-jets/"">FAA head says Canada will certify Gulfstream jets after Trump threats</a>"
