Rank,Article title,url,Byline,Article type,title_with_link
1,Carney’s cabinet is 100 days into its term. Here’s how it’s changed Canada,https://www.theglobeandmail.com/politics/article-mark-carney-first-100-days/,No byline found,No article type found,"<a href=""https://www.theglobeandmail.com/politics/article-mark-carney-first-100-days/"">Carney’s cabinet is 100 days into its term. Here’s how it’s changed Canada</a>"
2,Alberta chiefs say AFN has no mandate to decide fate of infrastructure projects,https://www.theglobeandmail.com/canada/article-alberta-chiefs-say-afn-has-no-mandate-to-decide-fate-of-infrastructure/,No byline found,No article type found,"<a href=""https://www.theglobeandmail.com/canada/article-alberta-chiefs-say-afn-has-no-mandate-to-decide-fate-of-infrastructure/"">Alberta chiefs say AFN has no mandate to decide fate of infrastructure projects</a>"
3,How a sibling’s unexpected emergency put an equal inheritance to the test,https://www.theglobeandmail.com/investing/personal-finance/retirement/article-unexpected-emergency-equal-inheritance-siblings/,No byline found,No article type found,"<a href=""https://www.theglobeandmail.com/investing/personal-finance/retirement/article-unexpected-emergency-equal-inheritance-siblings/"">How a sibling’s unexpected emergency put an equal inheritance to the test</a>"
4,"Canada will thank Trump in 20 years, former Quebec premier Jean Charest says",https://www.theglobeandmail.com/business/article-canada-will-thank-trump-in-20-years-former-quebec-premier-jean-charest/,No byline found,No article type found,"<a href=""https://www.theglobeandmail.com/business/article-canada-will-thank-trump-in-20-years-former-quebec-premier-jean-charest/"">Canada will thank Trump in 20 years, former Quebec premier Jean Charest says</a>"
5,Thursday’s analyst upgrades and downgrades,https://www.theglobeandmail.com/investing/markets/inside-the-market/article-thursdays-analyst-upgrades-and-downgrades-274/,No byline found,No article type found,"<a href=""https://www.theglobeandmail.com/investing/markets/inside-the-market/article-thursdays-analyst-upgrades-and-downgrades-274/"">Thursday’s analyst upgrades and downgrades</a>"
6,Trump asks Supreme Court to quickly take up tariffs case and reverse ruling finding them illegal,https://www.theglobeandmail.com/business/international-business/article-trump-asks-supreme-court-to-quickly-take-up-tariffs-case-and-reverse/,No byline found,No article type found,"<a href=""https://www.theglobeandmail.com/business/international-business/article-trump-asks-supreme-court-to-quickly-take-up-tariffs-case-and-reverse/"">Trump asks Supreme Court to quickly take up tariffs case and reverse ruling finding them illegal</a>"
7,"Carney says to expect both an austerity and investment-focused budget, criticizes Trudeau-era spending",https://www.theglobeandmail.com/politics/article-carney-austerity-investment-focused-budget-spending/,No byline found,No article type found,"<a href=""https://www.theglobeandmail.com/politics/article-carney-austerity-investment-focused-budget-spending/"">Carney says to expect both an austerity and investment-focused budget, criticizes Trudeau-era spending</a>"
8,Poilievre’s anything goes approach to self-defence is even more extreme than U.S. law,https://www.theglobeandmail.com/opinion/article-poilievres-self-defence-more-extreme-us-law/,Andrew Coyne,Opinion,"<a href=""https://www.theglobeandmail.com/opinion/article-poilievres-self-defence-more-extreme-us-law/"">Poilievre’s anything goes approach to self-defence is even more extreme than U.S. law</a>"
