Rank,Article title,url,Byline,Article type,title_with_link
1,Investor behind Flair Airlines’ expansion charged with US$500-million fraud,https://www.theglobeandmail.com/business/article-investor-behind-flair-airlines-expansion-charged-with-us500-million/,No byline found,No article type found,"<a href=""https://www.theglobeandmail.com/business/article-investor-behind-flair-airlines-expansion-charged-with-us500-million/"">Investor behind Flair Airlines’ expansion charged with US$500-million fraud</a>"
2,"Alberta health agency broke own rules in Turkey medication, private clinic contracts, report finds",https://www.theglobeandmail.com/canada/alberta/article-alberta-health-services-contracts-procurement-controversy-2/,No byline found,No article type found,"<a href=""https://www.theglobeandmail.com/canada/alberta/article-alberta-health-services-contracts-procurement-controversy-2/"">Alberta health agency broke own rules in Turkey medication, private clinic contracts, report finds</a>"
3,Crispr gave humans the power to remake ourselves. What will we do with it?,https://www.theglobeandmail.com/opinion/article-crispr-gene-editing-technology-scientific-breakthrough/,Matt Ridley,Opinion,"<a href=""https://www.theglobeandmail.com/opinion/article-crispr-gene-editing-technology-scientific-breakthrough/"">Crispr gave humans the power to remake ourselves. What will we do with it?</a>"
4,How the NHL and reality TV explain trade’s Team Canada implosion,https://www.theglobeandmail.com/politics/opinion/article-trade-team-canada-nhl-reality-tv-tariffs/,Shannon Proudfoot,Opinion,"<a href=""https://www.theglobeandmail.com/politics/opinion/article-trade-team-canada-nhl-reality-tv-tariffs/"">How the NHL and reality TV explain trade’s Team Canada implosion</a>"
5,Three reasons to be deeply skeptical about the current gold rally,https://www.theglobeandmail.com/investing/markets/inside-the-market/article-gold-rally-skepticism-market-watchers/,No byline found,No article type found,"<a href=""https://www.theglobeandmail.com/investing/markets/inside-the-market/article-gold-rally-skepticism-market-watchers/"">Three reasons to be deeply skeptical about the current gold rally</a>"
6,"Ford set to face questions on jobs, conflict-of-interest allegations as legislature resumes",https://www.theglobeandmail.com/canada/article-ontario-premier-doug-ford-legislature-returns-opposition-parties/,No byline found,No article type found,"<a href=""https://www.theglobeandmail.com/canada/article-ontario-premier-doug-ford-legislature-returns-opposition-parties/"">Ford set to face questions on jobs, conflict-of-interest allegations as legislature resumes</a>"
7,Neighbours told RCMP they heard car near trailer where Nova Scotia children disappeared,https://www.theglobeandmail.com/canada/article-jack-lilly-sullivan-missing-children-court-documents-nova-scotia/,No byline found,No article type found,"<a href=""https://www.theglobeandmail.com/canada/article-jack-lilly-sullivan-missing-children-court-documents-nova-scotia/"">Neighbours told RCMP they heard car near trailer where Nova Scotia children disappeared</a>"
8,What a 50-year-old neighbourhood development can teach us about solving Canada’s housing crisis,https://www.theglobeandmail.com/opinion/article-st-lawrence-toronto-national-housing-crisis/,Frank Lewinberg,Opinion,"<a href=""https://www.theglobeandmail.com/opinion/article-st-lawrence-toronto-national-housing-crisis/"">What a 50-year-old neighbourhood development can teach us about solving Canada’s housing crisis</a>"
