Rank,Article title,url,Byline,Article type,title_with_link
1,Betting the farm: How Canada’s agriculture sector is getting its global swagger back,https://www.theglobeandmail.com/business/rob-magazine/article-betting-the-farm-how-canadas-agriculture-sector-is-getting-its-global/,No byline found,No article type found,"<a href=""https://www.theglobeandmail.com/business/rob-magazine/article-betting-the-farm-how-canadas-agriculture-sector-is-getting-its-global/"">Betting the farm: How Canada’s agriculture sector is getting its global swagger back</a>"
2,"More Canadians will inherit their family home, entrenching inequality across generations",https://www.theglobeandmail.com/investing/personal-finance/article-housing-real-estate-family-home-generation-inequality/,Mike Moffatt,Opinion,"<a href=""https://www.theglobeandmail.com/investing/personal-finance/article-housing-real-estate-family-home-generation-inequality/"">More Canadians will inherit their family home, entrenching inequality across generations</a>"
3,Seven U.S. cash cows with strong balance sheets,https://www.theglobeandmail.com/investing/investment-ideas/number-cruncher/article-seven-us-cash-cows-strong-balance-sheets/,No byline found,No article type found,"<a href=""https://www.theglobeandmail.com/investing/investment-ideas/number-cruncher/article-seven-us-cash-cows-strong-balance-sheets/"">Seven U.S. cash cows with strong balance sheets</a>"
4,The flashing-red bond market is the thread that may unravel the entire world economy,https://www.theglobeandmail.com/business/commentary/article-bond-market-world-economy/,Christopher Collins,Opinion,"<a href=""https://www.theglobeandmail.com/business/commentary/article-bond-market-world-economy/"">The flashing-red bond market is the thread that may unravel the entire world economy</a>"
5,Ozempic maker cuts price as generic versions hit pharmacy shelves,https://www.theglobeandmail.com/business/economy/article-ozempic-price-brand-name-drug-generic-semaglutide-weight-loss/,No byline found,No article type found,"<a href=""https://www.theglobeandmail.com/business/economy/article-ozempic-price-brand-name-drug-generic-semaglutide-weight-loss/"">Ozempic maker cuts price as generic versions hit pharmacy shelves</a>"
6,David Sedaris is crankier than ever and wants to dress like he’s in a cult,https://www.theglobeandmail.com/life/style/fashion-and-beauty/article-david-sedaris-is-crankier-than-ever-and-wants-to-dress-like-hes-in-a/,No byline found,No article type found,"<a href=""https://www.theglobeandmail.com/life/style/fashion-and-beauty/article-david-sedaris-is-crankier-than-ever-and-wants-to-dress-like-hes-in-a/"">David Sedaris is crankier than ever and wants to dress like he’s in a cult</a>"
7,"Miles, Blue Jays win a wild one",https://www.theglobeandmail.com/sports/baseball/article-miles-andrews-take-unique-paths-to-blue-jays-mound/,No byline found,No article type found,"<a href=""https://www.theglobeandmail.com/sports/baseball/article-miles-andrews-take-unique-paths-to-blue-jays-mound/"">Miles, Blue Jays win a wild one</a>"
8,Canadiens’ Lane Hutson leads and learns in playoff run,https://www.theglobeandmail.com/sports/hockey/article-montreal-canadiens-lane-hutson-nhl-playoffs/,No byline found,No article type found,"<a href=""https://www.theglobeandmail.com/sports/hockey/article-montreal-canadiens-lane-hutson-nhl-playoffs/"">Canadiens’ Lane Hutson leads and learns in playoff run</a>"
