Rank,Article title,url,Byline,Article type,title_with_link
1,"Markets Tuesday: Stocks end off lows, oil settles up 4.7%, as investors fret over Middle East conflict",https://www.theglobeandmail.com/investing/markets/inside-the-market/article-markets-today-wall-street-futures-fall-as-middle-east-conflict-stokes/,No byline found,No article type found,"<a href=""https://www.theglobeandmail.com/investing/markets/inside-the-market/article-markets-today-wall-street-futures-fall-as-middle-east-conflict-stokes/"">Markets Tuesday: Stocks end off lows, oil settles up 4.7%, as investors fret over Middle East conflict</a>"
2,Telus aims to have prospective partner in place for health business by summer,https://www.theglobeandmail.com/business/article-telus-aims-to-have-prospective-partner-in-place-for-health-business-by/,No byline found,No article type found,"<a href=""https://www.theglobeandmail.com/business/article-telus-aims-to-have-prospective-partner-in-place-for-health-business-by/"">Telus aims to have prospective partner in place for health business by summer</a>"
3,"Carney says situation in Iran represents failure of world order; U.S., Israel launch new wave of attacks",https://www.theglobeandmail.com/world/article-us-israel-lebanon-hezbollah-trump-ayatollah-ali-khamenei-live-updates/,No byline found,No article type found,"<a href=""https://www.theglobeandmail.com/world/article-us-israel-lebanon-hezbollah-trump-ayatollah-ali-khamenei-live-updates/"">Carney says situation in Iran represents failure of world order; U.S., Israel launch new wave of attacks</a>"
4,"Ontario investigated 900 allegations of OSAP fraud last year, government says",https://www.theglobeandmail.com/canada/article-ontario-investigated-900-allegations-of-osap-fraud-last-year/,No byline found,No article type found,"<a href=""https://www.theglobeandmail.com/canada/article-ontario-investigated-900-allegations-of-osap-fraud-last-year/"">Ontario investigated 900 allegations of OSAP fraud last year, government says</a>"
5,A map of U.S. and Israeli attacks in the Middle East and Tehran’s retaliatory strikes so far,https://www.theglobeandmail.com/world/article-iran-israel-us-strikes-map/,No byline found,No article type found,"<a href=""https://www.theglobeandmail.com/world/article-iran-israel-us-strikes-map/"">A map of U.S. and Israeli attacks in the Middle East and Tehran’s retaliatory strikes so far</a>"
6,"Carney says Ottawa’s position supporting U.S., Israeli strikes on Iran was taken with regret",https://www.theglobeandmail.com/politics/article-carney-us-israeli-strikes-iran-position/,No byline found,No article type found,"<a href=""https://www.theglobeandmail.com/politics/article-carney-us-israeli-strikes-iran-position/"">Carney says Ottawa’s position supporting U.S., Israeli strikes on Iran was taken with regret</a>"
7,Iconic retailer Roots could be for sale as it launches strategic review,https://www.theglobeandmail.com/business/article-roots-strategic-review-clothing-brand/,No byline found,No article type found,"<a href=""https://www.theglobeandmail.com/business/article-roots-strategic-review-clothing-brand/"">Iconic retailer Roots could be for sale as it launches strategic review</a>"
8,The history of war suggests investors should do nothing,https://www.theglobeandmail.com/investing/personal-finance/article-the-history-of-war-suggests-investors-should-do-nothing/,No byline found,No article type found,"<a href=""https://www.theglobeandmail.com/investing/personal-finance/article-the-history-of-war-suggests-investors-should-do-nothing/"">The history of war suggests investors should do nothing</a>"
