Rank,Article title,url,Byline,Article type,title_with_link
1,"Congrats on the loss, Toronto. It was a masterpiece",https://www.theglobeandmail.com/sports/article-blue-jays-vs-dodgers-world-series-game-7-results-analysis-toronto/,Cathal Kelly,Opinion,"<a href=""https://www.theglobeandmail.com/sports/article-blue-jays-vs-dodgers-world-series-game-7-results-analysis-toronto/"">Congrats on the loss, Toronto. It was a masterpiece</a>"
2,Former prince Andrew to be stripped of last military position,https://www.theglobeandmail.com/world/article-prince-andrew-royals-king-charles-jeffrey-epstein/,No byline found,No article type found,"<a href=""https://www.theglobeandmail.com/world/article-prince-andrew-royals-king-charles-jeffrey-epstein/"">Former prince Andrew to be stripped of last military position</a>"
3,"Alex Tilley, designer of iconic Canadian hat, dies at 87",https://www.theglobeandmail.com/business/article-alex-tilley-dies-canadian-hat-company-endurables/,No byline found,No article type found,"<a href=""https://www.theglobeandmail.com/business/article-alex-tilley-dies-canadian-hat-company-endurables/"">Alex Tilley, designer of iconic Canadian hat, dies at 87</a>"
4,U.S. Ambassador’s outburst is one more punch in the face from the neighbourhood bully,https://www.theglobeandmail.com/politics/opinion/article-us-ambassador-pete-hoekstra-outburst-neighbourhood-bully/,Shannon Proudfoot,Opinion,"<a href=""https://www.theglobeandmail.com/politics/opinion/article-us-ambassador-pete-hoekstra-outburst-neighbourhood-bully/"">U.S. Ambassador’s outburst is one more punch in the face from the neighbourhood bully</a>"
5,"BoC’s rate cut, Wealthsimple’s $10-billion valuation and Champagne’s federal budget prep: Must-read business and investing stories",https://www.theglobeandmail.com/business/article-bank-of-canada-wealthsimple-champagne-federal-budget-november-2/,No byline found,No article type found,"<a href=""https://www.theglobeandmail.com/business/article-bank-of-canada-wealthsimple-champagne-federal-budget-november-2/"">BoC’s rate cut, Wealthsimple’s $10-billion valuation and Champagne’s federal budget prep: Must-read business and investing stories</a>"
6,The era of the shoebox condo is over. Here’s how Canada can build livable apartments,https://www.theglobeandmail.com/investing/personal-finance/household-finances/article-livable-apartments-condos-rentals-rulebook-housing/,No byline found,No article type found,"<a href=""https://www.theglobeandmail.com/investing/personal-finance/household-finances/article-livable-apartments-condos-rentals-rulebook-housing/"">The era of the shoebox condo is over. Here’s how Canada can build livable apartments</a>"
7,‘I just feel pain’: Blue Jays fans devastated by heartbreaking end to a magical World Series run,https://www.theglobeandmail.com/canada/article-blue-jays-vs-dodgers-world-series-game-7-fan-reactions-canada/,No byline found,No article type found,"<a href=""https://www.theglobeandmail.com/canada/article-blue-jays-vs-dodgers-world-series-game-7-fan-reactions-canada/"">‘I just feel pain’: Blue Jays fans devastated by heartbreaking end to a magical World Series run</a>"
8,Canada needs to rein in spending. How about we stop handing out billions to wealthy seniors?,https://www.theglobeandmail.com/opinion/article-canada-spending-budget-old-age-security-retirement-income/,No byline found,No article type found,"<a href=""https://www.theglobeandmail.com/opinion/article-canada-spending-budget-old-age-security-retirement-income/"">Canada needs to rein in spending. How about we stop handing out billions to wealthy seniors?</a>"
