Rank,Article title,url,Byline,Article type,title_with_link
1,Quebec City might be Canada’s most successful city,https://www.theglobeandmail.com/canada/article-quebec-city-might-be-canadas-most-successful-city/,No byline found,No article type found,"<a href=""https://www.theglobeandmail.com/canada/article-quebec-city-might-be-canadas-most-successful-city/"">Quebec City might be Canada’s most successful city</a>"
2,ICE arrests in Minneapolis increasingly look like kidnappings. Fearful locals are planning accordingly,https://www.theglobeandmail.com/world/us-politics/article-ice-arrests-in-minneapolis-increasingly-look-like-kidnappings-fearful/,No byline found,No article type found,"<a href=""https://www.theglobeandmail.com/world/us-politics/article-ice-arrests-in-minneapolis-increasingly-look-like-kidnappings-fearful/"">ICE arrests in Minneapolis increasingly look like kidnappings. Fearful locals are planning accordingly</a>"
3,Ontario is proposing a new class of mutual funds. Investor advocates warn the risk may not be worth the reward,https://www.theglobeandmail.com/business/article-ontario-osc-mutual-funds-doug-ford-investors/,No byline found,No article type found,"<a href=""https://www.theglobeandmail.com/business/article-ontario-osc-mutual-funds-doug-ford-investors/"">Ontario is proposing a new class of mutual funds. Investor advocates warn the risk may not be worth the reward</a>"
4,TD launches Super Bowl marketing campaign to refresh brand after money-laundering scandal,https://www.theglobeandmail.com/business/article-td-bank-ad-marketing-campaign-super-bowl/,No byline found,No article type found,"<a href=""https://www.theglobeandmail.com/business/article-td-bank-ad-marketing-campaign-super-bowl/"">TD launches Super Bowl marketing campaign to refresh brand after money-laundering scandal</a>"
5,This tiny B.C. city is one of the most livable in Canada – for those who can find it,https://www.theglobeandmail.com/business/article-canada-most-livable-small-city-pitt-meadows/,No byline found,No article type found,"<a href=""https://www.theglobeandmail.com/business/article-canada-most-livable-small-city-pitt-meadows/"">This tiny B.C. city is one of the most livable in Canada – for those who can find it</a>"
6,"Canadian figure skaters finish fifth in team event, U.S. wins gold",https://www.theglobeandmail.com/sports/olympics/article-milan-cortina-winter-olympics-2026-day-2-live-results-medals-canada/,No byline found,No article type found,"<a href=""https://www.theglobeandmail.com/sports/olympics/article-milan-cortina-winter-olympics-2026-day-2-live-results-medals-canada/"">Canadian figure skaters finish fifth in team event, U.S. wins gold</a>"
7,Austria’s Benjamin Karl ends remarkable career with gold in parallel giant slalom,https://www.theglobeandmail.com/sports/article-winter-olympics-2026-austria-benjamin-karl-snowboard/,No byline found,No article type found,"<a href=""https://www.theglobeandmail.com/sports/article-winter-olympics-2026-austria-benjamin-karl-snowboard/"">Austria’s Benjamin Karl ends remarkable career with gold in parallel giant slalom</a>"
8,"With threat of ICE looming over Denver, bartenders form unlikely resistance movement",https://www.theglobeandmail.com/world/article-immigration-ice-denver-colorado-service-workers-bartenders/,No byline found,No article type found,"<a href=""https://www.theglobeandmail.com/world/article-immigration-ice-denver-colorado-service-workers-bartenders/"">With threat of ICE looming over Denver, bartenders form unlikely resistance movement</a>"
