Rank,Article title,url,Byline,Article type,title_with_link
1,The invisible necessity of ransomware negotiations,https://www.theglobeandmail.com/business/article-ransomware-negotiations-industry-cybersecurity/,No byline found,No article type found,"<a href=""https://www.theglobeandmail.com/business/article-ransomware-negotiations-industry-cybersecurity/"">The invisible necessity of ransomware negotiations</a>"
2,Consumers brave the cold for Boxing Day sales across Canada,https://www.theglobeandmail.com/canada/article-boxing-day-sales-retail-revenue-growth-market-spending/,No byline found,No article type found,"<a href=""https://www.theglobeandmail.com/canada/article-boxing-day-sales-retail-revenue-growth-market-spending/"">Consumers brave the cold for Boxing Day sales across Canada</a>"
3,Warren Buffett is about to retire. Do not despair,https://www.theglobeandmail.com/investing/personal-finance/article-warren-buffett-is-about-to-retire-do-not-despair/,No byline found,No article type found,"<a href=""https://www.theglobeandmail.com/investing/personal-finance/article-warren-buffett-is-about-to-retire-do-not-despair/"">Warren Buffett is about to retire. Do not despair</a>"
4,Trump’s new Presidential Walk of Fame plaques are another attempt at rewriting history,https://www.theglobeandmail.com/world/us-politics/article-trump-presidential-walk-of-fame-plaques-rewriting-history/,No byline found,Analysis,"<a href=""https://www.theglobeandmail.com/world/us-politics/article-trump-presidential-walk-of-fame-plaques-rewriting-history/"">Trump’s new Presidential Walk of Fame plaques are another attempt at rewriting history</a>"
5,‘I am perfectly fine with the population decreasing. It means more jobs and affordable housing for Canadian youth.’ Letters to the editor for Dec. 26,https://www.theglobeandmail.com/opinion/letters/article-population-decreasing-more-jobs-affordable-housing-for-canadian-youth/,No byline found,No article type found,"<a href=""https://www.theglobeandmail.com/opinion/letters/article-population-decreasing-more-jobs-affordable-housing-for-canadian-youth/"">‘I am perfectly fine with the population decreasing. It means more jobs and affordable housing for Canadian youth.’ Letters to the editor for Dec. 26</a>"
6,What a lifetime of thrifting has taught me about the things we hold dear,https://www.theglobeandmail.com/opinion/article-thrifting-secondhand-shopping-lessons/,Liz Worth,Opinion,"<a href=""https://www.theglobeandmail.com/opinion/article-thrifting-secondhand-shopping-lessons/"">What a lifetime of thrifting has taught me about the things we hold dear</a>"
7,U.S. automakers urge Washington to uphold USMCA,https://www.theglobeandmail.com/business/article-automakers-cars-usmca-trump-michigan-washington-detroit-three/,No byline found,No article type found,"<a href=""https://www.theglobeandmail.com/business/article-automakers-cars-usmca-trump-michigan-washington-detroit-three/"">U.S. automakers urge Washington to uphold USMCA</a>"
8,In memoriam: Notable people we lost in 2025,https://www.theglobeandmail.com/canada/article-notable-people-we-lost-2025-memoriam/,No byline found,No article type found,"<a href=""https://www.theglobeandmail.com/canada/article-notable-people-we-lost-2025-memoriam/"">In memoriam: Notable people we lost in 2025</a>"
