Rank,Article title,url,Byline,Article type,title_with_link
1,How a B.C. drum teacher built the global online juggernaut Drumeo,https://www.theglobeandmail.com/business/article-how-a-bc-drum-teacher-built-global-online-juggernaut-drumeo/,No byline found,No article type found,"<a href=""https://www.theglobeandmail.com/business/article-how-a-bc-drum-teacher-built-global-online-juggernaut-drumeo/"">How a B.C. drum teacher built the global online juggernaut Drumeo</a>"
2,"Canadians go elbows up on U.S. travel, opting for these destinations instead",https://www.theglobeandmail.com/investing/personal-finance/article-avoiding-us-travel-canadians-vacation-mexico-japan-europe/,No byline found,No article type found,"<a href=""https://www.theglobeandmail.com/investing/personal-finance/article-avoiding-us-travel-canadians-vacation-mexico-japan-europe/"">Canadians go elbows up on U.S. travel, opting for these destinations instead</a>"
3,"Trump raises tariffs on Canadian goods, BoC keeps rate steady and Telus’ new network deal: Must-read business and investing stories",https://www.theglobeandmail.com/business/article-trump-tariffs-bank-of-canada-telus-august-3/,No byline found,No article type found,"<a href=""https://www.theglobeandmail.com/business/article-trump-tariffs-bank-of-canada-telus-august-3/"">Trump raises tariffs on Canadian goods, BoC keeps rate steady and Telus’ new network deal: Must-read business and investing stories</a>"
4,How the ‘discovery’ of fentanyl changed North America,https://www.theglobeandmail.com/opinion/article-how-the-discovery-of-fentanyl-changed-north-america/,Sam Quinones,Opinion,"<a href=""https://www.theglobeandmail.com/opinion/article-how-the-discovery-of-fentanyl-changed-north-america/"">How the ‘discovery’ of fentanyl changed North America</a>"
5,"Foreign Affairs Minister Anita Anand closes constituency office, citing safety concerns",https://www.theglobeandmail.com/canada/article-foreign-affairs-minister-anita-anand-closes-constituency-office-citing/,No byline found,No article type found,"<a href=""https://www.theglobeandmail.com/canada/article-foreign-affairs-minister-anita-anand-closes-constituency-office-citing/"">Foreign Affairs Minister Anita Anand closes constituency office, citing safety concerns</a>"
6,"Israeli fire kills at least 18 in Gaza, while seven Palestinians died of malnutrition-related causes in the past 24 hours",https://www.theglobeandmail.com/world/article-israeli-fire-kills-at-least-18-in-gaza-and-us-envoy-visits-hostage/,No byline found,No article type found,"<a href=""https://www.theglobeandmail.com/world/article-israeli-fire-kills-at-least-18-in-gaza-and-us-envoy-visits-hostage/"">Israeli fire kills at least 18 in Gaza, while seven Palestinians died of malnutrition-related causes in the past 24 hours</a>"
7,Fed up with online dating? Here are three strategies to meet people in person,https://www.theglobeandmail.com/life/article-fed-up-with-online-dating-here-are-three-strategies-to-meet-people-in/,No byline found,No article type found,"<a href=""https://www.theglobeandmail.com/life/article-fed-up-with-online-dating-here-are-three-strategies-to-meet-people-in/"">Fed up with online dating? Here are three strategies to meet people in person</a>"
8,These outdoor cooking tools can turn you into a grill master,https://www.theglobeandmail.com/life/home-and-design/article-barbecue-bbq-outdoor-cooking-tools/,No byline found,No article type found,"<a href=""https://www.theglobeandmail.com/life/home-and-design/article-barbecue-bbq-outdoor-cooking-tools/"">These outdoor cooking tools can turn you into a grill master</a>"
