Rank,Article title,url,Byline,Article type,title_with_link
1,These Canadians are embracing early holiday decor – and jingling their bells at the haters,https://www.theglobeandmail.com/life/style/article-canadians-christmas-early-holiday-decor-haters/,No byline found,No article type found,"<a href=""https://www.theglobeandmail.com/life/style/article-canadians-christmas-early-holiday-decor-haters/"">These Canadians are embracing early holiday decor – and jingling their bells at the haters</a>"
2,Top picks in bank stocks from a Scotiabank analyst as earnings reports imminent,https://www.theglobeandmail.com/investing/markets/inside-the-market/article-top-picks-in-bank-stocks-from-a-scotiabank-analyst-as-earnings-reports/,No byline found,No article type found,"<a href=""https://www.theglobeandmail.com/investing/markets/inside-the-market/article-top-picks-in-bank-stocks-from-a-scotiabank-analyst-as-earnings-reports/"">Top picks in bank stocks from a Scotiabank analyst as earnings reports imminent</a>"
3,"Should you exit the stock market, at least temporarily?",https://www.theglobeandmail.com/investing/personal-finance/retirement/article-should-you-exit-the-stock-market-at-least-temporarily/,No byline found,No article type found,"<a href=""https://www.theglobeandmail.com/investing/personal-finance/retirement/article-should-you-exit-the-stock-market-at-least-temporarily/"">Should you exit the stock market, at least temporarily?</a>"
4,Experts say ultraprocessed foods are a major public health threat. Here’s how to protect yourself,https://www.theglobeandmail.com/life/health-and-fitness/article-ultra-processed-foods-are-a-major-public-health-threat-experts-warn/,No byline found,No article type found,"<a href=""https://www.theglobeandmail.com/life/health-and-fitness/article-ultra-processed-foods-are-a-major-public-health-threat-experts-warn/"">Experts say ultraprocessed foods are a major public health threat. Here’s how to protect yourself</a>"
5,"Colleen Jones, world champion curler and legendary broadcaster, dies at 65",https://www.theglobeandmail.com/canada/article-colleen-jones-curling-cbc-broadcaster-nova-scotia/,No byline found,No article type found,"<a href=""https://www.theglobeandmail.com/canada/article-colleen-jones-curling-cbc-broadcaster-nova-scotia/"">Colleen Jones, world champion curler and legendary broadcaster, dies at 65</a>"
6,"With launch of Toothpod, U of T startup star shifts from winning awards to fighting plaque",https://www.theglobeandmail.com/business/article-vishar-yaghoubian-toothpod-dental-startup-entrepreneur-medical-tech/,No byline found,No article type found,"<a href=""https://www.theglobeandmail.com/business/article-vishar-yaghoubian-toothpod-dental-startup-entrepreneur-medical-tech/"">With launch of Toothpod, U of T startup star shifts from winning awards to fighting plaque</a>"
7,Four strategies to remove risk from your portfolio,https://www.theglobeandmail.com/investing/markets/inside-the-market/article-investing-stocks-risk-portfolio-etf-market-bear-bull/,No byline found,No article type found,"<a href=""https://www.theglobeandmail.com/investing/markets/inside-the-market/article-investing-stocks-risk-portfolio-etf-market-bear-bull/"">Four strategies to remove risk from your portfolio</a>"
8,A most inconvenient Indian,https://www.theglobeandmail.com/opinion/article-a-most-inconvenient-indian/,Thomas King,Opinion,"<a href=""https://www.theglobeandmail.com/opinion/article-a-most-inconvenient-indian/"">A most inconvenient Indian</a>"
