Rank,Article title,url,Byline,Article type,title_with_link
1,Bank of Montreal fined $4-million for overcharging customers on discounted plans,https://www.theglobeandmail.com/business/article-bank-of-montreal-bmo-fine/,No byline found,No article type found,"<a href=""https://www.theglobeandmail.com/business/article-bank-of-montreal-bmo-fine/"">Bank of Montreal fined $4-million for overcharging customers on discounted plans</a>"
2,Six dividend ETF picks for RRSP season,https://www.theglobeandmail.com/investing/globe-advisor/advisor-etfs/article-six-dividend-etf-picks-for-rrsp-season/,No byline found,No article type found,"<a href=""https://www.theglobeandmail.com/investing/globe-advisor/advisor-etfs/article-six-dividend-etf-picks-for-rrsp-season/"">Six dividend ETF picks for RRSP season</a>"
3,Invest Alberta CEO Rick Christiaanse abruptly leaves role,https://www.theglobeandmail.com/business/article-invest-alberta-ceo-rick-christiaanse-abruptly-leaves-role/,No byline found,No article type found,"<a href=""https://www.theglobeandmail.com/business/article-invest-alberta-ceo-rick-christiaanse-abruptly-leaves-role/"">Invest Alberta CEO Rick Christiaanse abruptly leaves role</a>"
4,"Three years retired and I wonder: Am I lost, depressed or quietly content?",https://www.theglobeandmail.com/life/first-person/article-retirement-depression-mood-goals/,No byline found,No article type found,"<a href=""https://www.theglobeandmail.com/life/first-person/article-retirement-depression-mood-goals/"">Three years retired and I wonder: Am I lost, depressed or quietly content?</a>"
5,"Eating more polyphenols can help you live a longer, healthier life – here’s why and what to eat",https://www.theglobeandmail.com/life/health-and-fitness/article-polyphenols-nuts-leafy-greens-berries-flavonoids/,No byline found,No article type found,"<a href=""https://www.theglobeandmail.com/life/health-and-fitness/article-polyphenols-nuts-leafy-greens-berries-flavonoids/"">Eating more polyphenols can help you live a longer, healthier life – here’s why and what to eat</a>"
6,"U.S. stocks end lower amid steep declines in software firms, but rally in precious metals keeps TSX positive",https://www.theglobeandmail.com/investing/markets/inside-the-market/market-news/article-premarket-global-stocks-rebound-as-gold-steadies/,No byline found,No article type found,"<a href=""https://www.theglobeandmail.com/investing/markets/inside-the-market/market-news/article-premarket-global-stocks-rebound-as-gold-steadies/"">U.S. stocks end lower amid steep declines in software firms, but rally in precious metals keeps TSX positive</a>"
7,Ski mountaineering’s debut at Milan Cortina puts the Olympic sports we know in reverse,https://www.theglobeandmail.com/sports/article-ski-mountaineerings-debut-at-milan-cortina-puts-the-olympic-sports-we/,No byline found,No article type found,"<a href=""https://www.theglobeandmail.com/sports/article-ski-mountaineerings-debut-at-milan-cortina-puts-the-olympic-sports-we/"">Ski mountaineering’s debut at Milan Cortina puts the Olympic sports we know in reverse</a>"
8,"In the Trump era, the F-35 is no longer the right plane for Canada",https://www.theglobeandmail.com/business/commentary/article-in-the-trump-era-the-f-35-is-no-longer-the-right-plane-for-canada/,Tony Keller,Opinion,"<a href=""https://www.theglobeandmail.com/business/commentary/article-in-the-trump-era-the-f-35-is-no-longer-the-right-plane-for-canada/"">In the Trump era, the F-35 is no longer the right plane for Canada</a>"
