Rank,Article title,url,Byline,Article type,title_with_link
1,Canada’s housing market has frayed our social fabric. How did this happen?,https://www.theglobeandmail.com/opinion/article-canadas-housing-market-frayed-our-social-fabric-how-did-this-happen/,Jessica Barrett,Opinion,"<a href=""https://www.theglobeandmail.com/opinion/article-canadas-housing-market-frayed-our-social-fabric-how-did-this-happen/"">Canada’s housing market has frayed our social fabric. How did this happen?</a>"
2,Judge to deliver sentence in Edmonton girl’s murder case that saw Crown and police at odds,https://www.theglobeandmail.com/canada/alberta/article-judge-to-deliver-sentence-in-edmonton-girls-murder-case-that-saw-crown/,No byline found,No article type found,"<a href=""https://www.theglobeandmail.com/canada/alberta/article-judge-to-deliver-sentence-in-edmonton-girls-murder-case-that-saw-crown/"">Judge to deliver sentence in Edmonton girl’s murder case that saw Crown and police at odds</a>"
3,Bridgerton’s new season is not just a Cinderella story,https://www.theglobeandmail.com/culture/article-bridgertons-luke-thompson-and-yerin-ha-on-why-this-season-is-not-just/,No byline found,No article type found,"<a href=""https://www.theglobeandmail.com/culture/article-bridgertons-luke-thompson-and-yerin-ha-on-why-this-season-is-not-just/"">Bridgerton’s new season is not just a Cinderella story</a>"
4,Fifty years of Rush’s 2112: The sound of a band that refused to bend,https://www.theglobeandmail.com/culture/article-rush-album-2112-fifty-years/,No byline found,No article type found,"<a href=""https://www.theglobeandmail.com/culture/article-rush-album-2112-fifty-years/"">Fifty years of Rush’s 2112: The sound of a band that refused to bend</a>"
5,What to know about tensions between Pakistan and Afghanistan,https://www.theglobeandmail.com/world/article-afghanistan-pakistan-war-what-to-know/,No byline found,No article type found,"<a href=""https://www.theglobeandmail.com/world/article-afghanistan-pakistan-war-what-to-know/"">What to know about tensions between Pakistan and Afghanistan</a>"
6,"China suspends some agricultural tariffs on Canada, maintains levy on canola seed",https://www.theglobeandmail.com/business/article-china-agricultural-tariffs-canada-canola-meal-and-seed-seafood/,No byline found,No article type found,"<a href=""https://www.theglobeandmail.com/business/article-china-agricultural-tariffs-canada-canola-meal-and-seed-seafood/"">China suspends some agricultural tariffs on Canada, maintains levy on canola seed</a>"
7,Senators captain Brady Tkachuk unhappy with White House AI video that insulted Canadians,https://www.theglobeandmail.com/sports/hockey/article-senators-captain-brady-tkachuk-unhappy-with-white-house-ai-video-that/,No byline found,No article type found,"<a href=""https://www.theglobeandmail.com/sports/hockey/article-senators-captain-brady-tkachuk-unhappy-with-white-house-ai-video-that/"">Senators captain Brady Tkachuk unhappy with White House AI video that insulted Canadians</a>"
8,Starmer’s party suffers crushing by-election defeat to Greens amid growing distrust,https://www.theglobeandmail.com/world/article-britain-election-labour-keir-starmer-green-party-hannah-spencer/,No byline found,No article type found,"<a href=""https://www.theglobeandmail.com/world/article-britain-election-labour-keir-starmer-green-party-hannah-spencer/"">Starmer’s party suffers crushing by-election defeat to Greens amid growing distrust</a>"
