Rank,Article title,url,title_with_link
1,‘Something is broken’: Ford slams assault charges against homeowner after break-in,https://globalnews.ca/news/11342405/ford-lindsay-man-charges/,"<a href=""https://globalnews.ca/news/11342405/ford-lindsay-man-charges/"">‘Something is broken’: Ford slams assault charges against homeowner after break-in</a>"
2,"Canada isn’t in a housing slump — Ontario is, RBC analysis shows",https://globalnews.ca/news/11342262/canada-housing-slump-ontario/,"<a href=""https://globalnews.ca/news/11342262/canada-housing-slump-ontario/"">Canada isn’t in a housing slump — Ontario is, RBC analysis shows</a>"
3,"Billionaire Elon Musk spotted in Bella Bella, B.C., over weekend",https://globalnews.ca/news/11342914/elon-musk-in-b-c/,"<a href=""https://globalnews.ca/news/11342914/elon-musk-in-b-c/"">Billionaire Elon Musk spotted in Bella Bella, B.C., over weekend</a>"
4,"Woman arrested after posting threats to kidnap, kill Trump on social media",https://globalnews.ca/news/11340726/woman-charged-death-threats-president-donald-trump-indiana/,"<a href=""https://globalnews.ca/news/11340726/woman-charged-death-threats-president-donald-trump-indiana/"">Woman arrested after posting threats to kidnap, kill Trump on social media</a>"
5,"Nearly 20% of Canadian small businesses may close from tariffs, CFIB says",https://globalnews.ca/news/11342307/canadian-small-businesses-closing-six-months/,"<a href=""https://globalnews.ca/news/11342307/canadian-small-businesses-closing-six-months/"">Nearly 20% of Canadian small businesses may close from tariffs, CFIB says</a>"
