Rank,Article title,url,Byline,Article type,title_with_link
1,"Melania Trump to chair meeting of UN Security Council, White House says",https://www.theglobeandmail.com/world/article-melania-trump-un-security-council/,No byline found,No article type found,"<a href=""https://www.theglobeandmail.com/world/article-melania-trump-un-security-council/"">Melania Trump to chair meeting of UN Security Council, White House says</a>"
2,Pediatric society recommends cholesterol screening for kids between two and 10 years,https://www.theglobeandmail.com/canada/article-children-cholesterol-screening-pediatric-society/,No byline found,No article type found,"<a href=""https://www.theglobeandmail.com/canada/article-children-cholesterol-screening-pediatric-society/"">Pediatric society recommends cholesterol screening for kids between two and 10 years</a>"
3,Ottawa-born adventurer Nicole Choo felt the pull of the outdoors,https://www.theglobeandmail.com/canada/article-nicole-choo-obituary/,No byline found,No article type found,"<a href=""https://www.theglobeandmail.com/canada/article-nicole-choo-obituary/"">Ottawa-born adventurer Nicole Choo felt the pull of the outdoors</a>"
4,Canada’s housing market has frayed our social fabric. How did this happen?,https://www.theglobeandmail.com/opinion/article-canadas-housing-market-frayed-our-social-fabric-how-did-this-happen/,Jessica Barrett,Opinion,"<a href=""https://www.theglobeandmail.com/opinion/article-canadas-housing-market-frayed-our-social-fabric-how-did-this-happen/"">Canada’s housing market has frayed our social fabric. How did this happen?</a>"
5,"Hamilton house sells $94,900 below initial asking price",https://www.theglobeandmail.com/real-estate/toronto/article-hamilton-house-sells-94900-below-initial-asking-price/,No byline found,No article type found,"<a href=""https://www.theglobeandmail.com/real-estate/toronto/article-hamilton-house-sells-94900-below-initial-asking-price/"">Hamilton house sells $94,900 below initial asking price</a>"
6,"China suspends some agricultural tariffs on Canada, maintains levy on canola seed",https://www.theglobeandmail.com/business/article-china-agricultural-tariffs-canada-canola-meal-and-seed-seafood/,No byline found,No article type found,"<a href=""https://www.theglobeandmail.com/business/article-china-agricultural-tariffs-canada-canola-meal-and-seed-seafood/"">China suspends some agricultural tariffs on Canada, maintains levy on canola seed</a>"
7,Favourite room: A dining room inspired by coastal charm,https://www.theglobeandmail.com/life/style/style-magazine/article-favourite-room-a-dining-room-inspired-by-coastal-charm/,No byline found,No article type found,"<a href=""https://www.theglobeandmail.com/life/style/style-magazine/article-favourite-room-a-dining-room-inspired-by-coastal-charm/"">Favourite room: A dining room inspired by coastal charm</a>"
8,Senators captain Brady Tkachuk unhappy with White House AI video that insulted Canadians,https://www.theglobeandmail.com/sports/hockey/article-senators-captain-brady-tkachuk-unhappy-with-white-house-ai-video-that/,No byline found,No article type found,"<a href=""https://www.theglobeandmail.com/sports/hockey/article-senators-captain-brady-tkachuk-unhappy-with-white-house-ai-video-that/"">Senators captain Brady Tkachuk unhappy with White House AI video that insulted Canadians</a>"
