Rank,Article title,url,Byline,Article type,title_with_link
1,Astronaut Jeremy Hansen announces he’s leaving Canadian Space Agency,https://www.theglobeandmail.com/canada/article-astronaut-jeremy-hansen-announces-hes-leaving-space-agency/,No byline found,No article type found,"<a href=""https://www.theglobeandmail.com/canada/article-astronaut-jeremy-hansen-announces-hes-leaving-space-agency/"">Astronaut Jeremy Hansen announces he’s leaving Canadian Space Agency</a>"
2,Canada picks Germany’s TKMS over South Korea’s Hanwha to build submarine fleet,https://www.theglobeandmail.com/politics/article-canada-submarine-contract-tkms-germany-mark-carney/,No byline found,No article type found,"<a href=""https://www.theglobeandmail.com/politics/article-canada-submarine-contract-tkms-germany-mark-carney/"">Canada picks Germany’s TKMS over South Korea’s Hanwha to build submarine fleet</a>"
3,"How to de-bug your outdoors this summer without harming yourself, your pets, or wildlife",https://www.theglobeandmail.com/life/advice/article-bugs-mosquitoes-ticks-wasps-summer-outdoors-protection/,No byline found,No article type found,"<a href=""https://www.theglobeandmail.com/life/advice/article-bugs-mosquitoes-ticks-wasps-summer-outdoors-protection/"">How to de-bug your outdoors this summer without harming yourself, your pets, or wildlife</a>"
4,Ontario dancer Ariel Hyatt goes viral for blending Canadian step-dancing with heavy metal hits,https://www.theglobeandmail.com/culture/article-ontario-dancer-ariel-hyatt-step-dancing-heavy-metal/,No byline found,No article type found,"<a href=""https://www.theglobeandmail.com/culture/article-ontario-dancer-ariel-hyatt-step-dancing-heavy-metal/"">Ontario dancer Ariel Hyatt goes viral for blending Canadian step-dancing with heavy metal hits</a>"
5,‘Fortress North America’ is a bad idea in service of a bad deal,https://www.theglobeandmail.com/opinion/article-usmca-fortress-north-america-canada-sovereignty/,Lawrence Herman,Opinion,"<a href=""https://www.theglobeandmail.com/opinion/article-usmca-fortress-north-america-canada-sovereignty/"">‘Fortress North America’ is a bad idea in service of a bad deal</a>"
6,"Alberta, Ontario propose new pipeline in bid to boost Canada’s energy independence",https://www.theglobeandmail.com/canada/article-alberta-ontario-propose-new-pipeline-to-sarnia-ontario/,No byline found,No article type found,"<a href=""https://www.theglobeandmail.com/canada/article-alberta-ontario-propose-new-pipeline-to-sarnia-ontario/"">Alberta, Ontario propose new pipeline in bid to boost Canada’s energy independence</a>"
7,What happened at Taylor Swift and Travis Kelce’s wedding? Here’s everything we know,https://www.theglobeandmail.com/culture/music/article-taylor-swift-travis-kelce-wedding-details-guest-list-officiant-venue/,No byline found,No article type found,"<a href=""https://www.theglobeandmail.com/culture/music/article-taylor-swift-travis-kelce-wedding-details-guest-list-officiant-venue/"">What happened at Taylor Swift and Travis Kelce’s wedding? Here’s everything we know</a>"
8,A NATO submarine partner: Why Canada chose Germany,https://www.theglobeandmail.com/business/commentary/article-a-nato-submarine-partner-why-canada-chose-germany/,Jarine Kim,Opinion,"<a href=""https://www.theglobeandmail.com/business/commentary/article-a-nato-submarine-partner-why-canada-chose-germany/"">A NATO submarine partner: Why Canada chose Germany</a>"
