Rank,Article title,url,title_with_link
1,Malcolm-Jamal Warner’s mother breaks silence weeks after actor’s death,https://globalnews.ca/news/11329580/malcolm-jamal-warner-mother-pamela-warner-speaks-out/,"<a href=""https://globalnews.ca/news/11329580/malcolm-jamal-warner-mother-pamela-warner-speaks-out/"">Malcolm-Jamal Warner’s mother breaks silence weeks after actor’s death</a>"
2,Montreal father assaulted in front of his children leads to outrage from officials,https://globalnews.ca/news/11328411/montreal-father-assaulted/,"<a href=""https://globalnews.ca/news/11328411/montreal-father-assaulted/"">Montreal father assaulted in front of his children leads to outrage from officials</a>"
3,B.C. government to appeal historic land claim ruling for 4 First Nations,https://globalnews.ca/news/11330337/bc-government-appeal-historic-land-claim-ruling-first-nations/,"<a href=""https://globalnews.ca/news/11330337/bc-government-appeal-historic-land-claim-ruling-first-nations/"">B.C. government to appeal historic land claim ruling for 4 First Nations</a>"
4,New Brunswick wildfires: Residents told to prepare for possible evacuation,https://globalnews.ca/news/11329505/new-brunswick-wildfires-out-of-control/,"<a href=""https://globalnews.ca/news/11329505/new-brunswick-wildfires-out-of-control/"">New Brunswick wildfires: Residents told to prepare for possible evacuation</a>"
5,Remains of Antarctic explorer found 66 years after he went missing,https://globalnews.ca/news/11329557/dennis-bell-antarctica-explorer-remains-found/,"<a href=""https://globalnews.ca/news/11329557/dennis-bell-antarctica-explorer-remains-found/"">Remains of Antarctic explorer found 66 years after he went missing</a>"
