Rank,Article title,url,Byline,Article type,title_with_link
1,How a speech about ‘small moments’ may impact Canada’s hockey fate at the Olympics,https://www.theglobeandmail.com/sports/olympics/article-winter-games-2026-milan-cortina-team-canada-speech-small-moments/,No byline found,No article type found,"<a href=""https://www.theglobeandmail.com/sports/olympics/article-winter-games-2026-milan-cortina-team-canada-speech-small-moments/"">How a speech about ‘small moments’ may impact Canada’s hockey fate at the Olympics</a>"
2,"James Van Der Beek, star of ‘Dawson’s Creek,’ dies at 48 after battle with cancer",https://www.theglobeandmail.com/world/article-james-van-der-beek-obituary-dawsons-creek/,No byline found,No article type found,"<a href=""https://www.theglobeandmail.com/world/article-james-van-der-beek-obituary-dawsons-creek/"">James Van Der Beek, star of ‘Dawson’s Creek,’ dies at 48 after battle with cancer</a>"
3,This butter chicken with garlic naan is all about the sauce,https://www.theglobeandmail.com/life/style/food-and-drink/article-butter-chicken-sauce-garlic-naan/,No byline found,No article type found,"<a href=""https://www.theglobeandmail.com/life/style/food-and-drink/article-butter-chicken-sauce-garlic-naan/"">This butter chicken with garlic naan is all about the sauce</a>"
4,Air Canada updating wide-body fleet with Airbus order,https://www.theglobeandmail.com/business/article-air-canada-updating-wide-body-fleet-with-airbus-order/,No byline found,No article type found,"<a href=""https://www.theglobeandmail.com/business/article-air-canada-updating-wide-body-fleet-with-airbus-order/"">Air Canada updating wide-body fleet with Airbus order</a>"
5,Morning Update: Cuba loses its Canadian tourists,https://www.theglobeandmail.com/canada/article-cuba-canada-tourists-flights-oil-crisis-miguel-diaz-canel-donald-trump/,No byline found,No article type found,"<a href=""https://www.theglobeandmail.com/canada/article-cuba-canada-tourists-flights-oil-crisis-miguel-diaz-canel-donald-trump/"">Morning Update: Cuba loses its Canadian tourists</a>"
6,What happened at the Olympics today,https://www.theglobeandmail.com/sports/olympics/article-winter-olympics-2026-live-updates-super-g-moguls-ice-dance-medals/,No byline found,No article type found,"<a href=""https://www.theglobeandmail.com/sports/olympics/article-winter-olympics-2026-live-updates-super-g-moguls-ice-dance-medals/"">What happened at the Olympics today</a>"
7,This septuagenarian’s TFSA has gone off the rails,https://www.theglobeandmail.com/investing/investment-ideas/article-tfsa-trouncers-saving-investing-advice/,No byline found,No article type found,"<a href=""https://www.theglobeandmail.com/investing/investment-ideas/article-tfsa-trouncers-saving-investing-advice/"">This septuagenarian’s TFSA has gone off the rails</a>"
8,King Charles among world leaders to offer sympathy after Tumbler Ridge shooting,https://www.theglobeandmail.com/canada/article-tumbler-ridge-bc-shooting-king-charles-world-leaders/,No byline found,No article type found,"<a href=""https://www.theglobeandmail.com/canada/article-tumbler-ridge-bc-shooting-king-charles-world-leaders/"">King Charles among world leaders to offer sympathy after Tumbler Ridge shooting</a>"
