Rank,Article title,url,Byline,Article type,title_with_link
1,The most oversold and overbought stocks on the TSX,https://www.theglobeandmail.com/investing/markets/inside-the-market/article-the-most-oversold-and-overbought-stocks-on-the-tsx-168/,No byline found,No article type found,"<a href=""https://www.theglobeandmail.com/investing/markets/inside-the-market/article-the-most-oversold-and-overbought-stocks-on-the-tsx-168/"">The most oversold and overbought stocks on the TSX</a>"
2,How much do you know about healthy eating? Take our nutrition quiz,https://www.theglobeandmail.com/life/article-healthy-eating-nutrition-quiz/,No byline found,No article type found,"<a href=""https://www.theglobeandmail.com/life/article-healthy-eating-nutrition-quiz/"">How much do you know about healthy eating? Take our nutrition quiz</a>"
3,"Boomers aren’t really hoarding wealth, but an aging population requires reforms",https://www.theglobeandmail.com/opinion/article-boomers-generational-wealth-aging-population-reforms/,Sasha van Katwyk,Opinion,"<a href=""https://www.theglobeandmail.com/opinion/article-boomers-generational-wealth-aging-population-reforms/"">Boomers aren’t really hoarding wealth, but an aging population requires reforms</a>"
4,Deportation hearing begins for alleged Iranian government official,https://www.theglobeandmail.com/canada/article-deportation-hearing-canada-border-services-agency-alleged-iranian/,No byline found,No article type found,"<a href=""https://www.theglobeandmail.com/canada/article-deportation-hearing-canada-border-services-agency-alleged-iranian/"">Deportation hearing begins for alleged Iranian government official</a>"
5,European leaders rebuff Trump’s calls for military help in Strait of Hormuz,https://www.theglobeandmail.com/world/article-starmer-carney-meeting-strait-of-hormuz-iran-war/,No byline found,No article type found,"<a href=""https://www.theglobeandmail.com/world/article-starmer-carney-meeting-strait-of-hormuz-iran-war/"">European leaders rebuff Trump’s calls for military help in Strait of Hormuz</a>"
6,One Battle After Another wins big as Canadians triumph in heated rivalry with Hollywood,https://www.theglobeandmail.com/culture/film-and-tv/film/article-oscars-2026-best-and-worst-moments/,No byline found,No article type found,"<a href=""https://www.theglobeandmail.com/culture/film-and-tv/film/article-oscars-2026-best-and-worst-moments/"">One Battle After Another wins big as Canadians triumph in heated rivalry with Hollywood</a>"
7,He’s useful in a crisis – but is he any good at politics? A look at Mark Carney’s first year,https://www.theglobeandmail.com/politics/opinion/article-hes-useful-in-a-crisis-but-is-he-any-good-at-politics-a-look-at-mark/,Shannon Proudfoot,Opinion,"<a href=""https://www.theglobeandmail.com/politics/opinion/article-hes-useful-in-a-crisis-but-is-he-any-good-at-politics-a-look-at-mark/"">He’s useful in a crisis – but is he any good at politics? A look at Mark Carney’s first year</a>"
8,Court ruling on cottage shows what can happen when wills don’t account for rise in property value,https://www.theglobeandmail.com/investing/globe-advisor/advisor-news/article-court-ruling-on-cottage-shows-what-can-happen-when-wills-dont-account/,No byline found,No article type found,"<a href=""https://www.theglobeandmail.com/investing/globe-advisor/advisor-news/article-court-ruling-on-cottage-shows-what-can-happen-when-wills-dont-account/"">Court ruling on cottage shows what can happen when wills don’t account for rise in property value</a>"
