Rank,Article title,url,Byline,Article type,title_with_link
1,"Meghan Markle gets refreshingly more real in Season 2 of With Love, Meghan",https://www.theglobeandmail.com/arts/article-netflix-with-love-meghan-markle-sussex-lifestyle-cooking-royal-family/,No byline found,No article type found,"<a href=""https://www.theglobeandmail.com/arts/article-netflix-with-love-meghan-markle-sussex-lifestyle-cooking-royal-family/"">Meghan Markle gets refreshingly more real in Season 2 of With Love, Meghan</a>"
2,The markets will burn as Trump fiddles with the Fed,https://www.theglobeandmail.com/business/commentary/article-markets-burn-trump-rages-the-fed/,John Rapley,Opinion,"<a href=""https://www.theglobeandmail.com/business/commentary/article-markets-burn-trump-rages-the-fed/"">The markets will burn as Trump fiddles with the Fed</a>"
3,The bitter truth is that cheaper housing means a retirement crisis for homeowners,https://www.theglobeandmail.com/business/commentary/article-housing-prices-retirement-plan-middle-class/,John Turley-Ewart,Opinion,"<a href=""https://www.theglobeandmail.com/business/commentary/article-housing-prices-retirement-plan-middle-class/"">The bitter truth is that cheaper housing means a retirement crisis for homeowners</a>"
4,"Can Luke, 56, afford to retire soon while paying for his kids’ education?",https://www.theglobeandmail.com/investing/personal-finance/financial-facelift/article-can-luke-56-afford-to-retire-soon-while-paying-for-his-kids-education/,No byline found,No article type found,"<a href=""https://www.theglobeandmail.com/investing/personal-finance/financial-facelift/article-can-luke-56-afford-to-retire-soon-while-paying-for-his-kids-education/"">Can Luke, 56, afford to retire soon while paying for his kids’ education?</a>"
5,"Quebec law firms that sued Big Tobacco to receive nearly $1-billion, a fee ‘unheard of in Canadian legal history’",https://www.theglobeandmail.com/business/article-quebec-law-firms-big-tobacco-lawsuit-legal-fees-payment/,No byline found,No article type found,"<a href=""https://www.theglobeandmail.com/business/article-quebec-law-firms-big-tobacco-lawsuit-legal-fees-payment/"">Quebec law firms that sued Big Tobacco to receive nearly $1-billion, a fee ‘unheard of in Canadian legal history’</a>"
6,A severe marine heat wave nicknamed ‘the Blob’ has finally been explained,https://www.theglobeandmail.com/canada/science/article-the-blob-marine-heat-wave-explained/,No byline found,No article type found,"<a href=""https://www.theglobeandmail.com/canada/science/article-the-blob-marine-heat-wave-explained/"">A severe marine heat wave nicknamed ‘the Blob’ has finally been explained</a>"
7,Blue Jays lose to Brewers despite Bieber’s solid home debut,https://www.theglobeandmail.com/sports/baseball/article-toronto-blue-jays-loss-milwaukee-brewers-shane-bieber-home-debut/,No byline found,No article type found,"<a href=""https://www.theglobeandmail.com/sports/baseball/article-toronto-blue-jays-loss-milwaukee-brewers-shane-bieber-home-debut/"">Blue Jays lose to Brewers despite Bieber’s solid home debut</a>"
8,Donald Trump is on the brink of becoming a dictator. Can he be stopped?,https://www.theglobeandmail.com/opinion/article-donald-trump-brink-of-dictatorship-can-he-be-stopped/,No byline found,No article type found,"<a href=""https://www.theglobeandmail.com/opinion/article-donald-trump-brink-of-dictatorship-can-he-be-stopped/"">Donald Trump is on the brink of becoming a dictator. Can he be stopped?</a>"
