Rank,Article title,url,Byline,Article type,title_with_link
1,Gulf carriers resume some flights even as Middle East conflict spreads,https://www.theglobeandmail.com/business/article-travel-flights-middle-east-conflict/,No byline found,No article type found,"<a href=""https://www.theglobeandmail.com/business/article-travel-flights-middle-east-conflict/"">Gulf carriers resume some flights even as Middle East conflict spreads</a>"
2,"OpenAI has shown it cannot be trusted. Canada needs nationalized, public AI",https://www.theglobeandmail.com/business/commentary/article-openai-tumbler-ridge-chatgpt/,Nathan Sanders,Opinion,"<a href=""https://www.theglobeandmail.com/business/commentary/article-openai-tumbler-ridge-chatgpt/"">OpenAI has shown it cannot be trusted. Canada needs nationalized, public AI</a>"
3,China warns of threat to ‘vital’ Hormuz shipping route,https://www.theglobeandmail.com/world/article-china-warns-of-threat-to-vital-hormuz-shipping-route/,No byline found,No article type found,"<a href=""https://www.theglobeandmail.com/world/article-china-warns-of-threat-to-vital-hormuz-shipping-route/"">China warns of threat to ‘vital’ Hormuz shipping route</a>"
4,Hezbollah and Israel open new front in regional war,https://www.theglobeandmail.com/world/article-iran-us-war-hezbollah-israel/,No byline found,No article type found,"<a href=""https://www.theglobeandmail.com/world/article-iran-us-war-hezbollah-israel/"">Hezbollah and Israel open new front in regional war</a>"
5,"Ottawa weighs splitting submarine contract between Europe and South Korea, sources say",https://www.theglobeandmail.com/politics/article-ottawa-submarine-contract-europe-south-korea/,No byline found,No article type found,"<a href=""https://www.theglobeandmail.com/politics/article-ottawa-submarine-contract-europe-south-korea/"">Ottawa weighs splitting submarine contract between Europe and South Korea, sources say</a>"
6,"Winnipeg aviation worker made $315,000 last year, but often works 12-hour shifts, eight days in row",https://www.theglobeandmail.com/investing/personal-finance/young-money/article-winnipeg-aviation-paycheque-project/,No byline found,No article type found,"<a href=""https://www.theglobeandmail.com/investing/personal-finance/young-money/article-winnipeg-aviation-paycheque-project/"">Winnipeg aviation worker made $315,000 last year, but often works 12-hour shifts, eight days in row</a>"
7,A list of Iranian attacks on countries in the region,https://www.theglobeandmail.com/canada/article-a-list-of-iranian-attacks-on-countries-in-the-region/,No byline found,No article type found,"<a href=""https://www.theglobeandmail.com/canada/article-a-list-of-iranian-attacks-on-countries-in-the-region/"">A list of Iranian attacks on countries in the region</a>"
8,Calgary’s Avenue Living plans IPOs for $9.8-billion apartment and self-storage businesses,https://www.theglobeandmail.com/business/article-calgarys-avenue-living-plans-ipos-for-98-billion-apartment-and-self/,No byline found,No article type found,"<a href=""https://www.theglobeandmail.com/business/article-calgarys-avenue-living-plans-ipos-for-98-billion-apartment-and-self/"">Calgary’s Avenue Living plans IPOs for $9.8-billion apartment and self-storage businesses</a>"
