Rank,Article title,url,Byline,Article type,title_with_link
1,"No, politics haven’t become polarized. Only one side has moved to the extremes",https://www.theglobeandmail.com/opinion/article-politics-united-states-right-left-wing-polarized-election/,No byline found,No article type found,"<a href=""https://www.theglobeandmail.com/opinion/article-politics-united-states-right-left-wing-polarized-election/"">No, politics haven’t become polarized. Only one side has moved to the extremes</a>"
2,Toronto’s Summer McIntosh wins first gold at worlds in flying start to her bid for five,https://www.theglobeandmail.com/sports/article-toronto-summer-mcintosh-wins-first-gold-medal-worlds/,No byline found,No article type found,"<a href=""https://www.theglobeandmail.com/sports/article-toronto-summer-mcintosh-wins-first-gold-medal-worlds/"">Toronto’s Summer McIntosh wins first gold at worlds in flying start to her bid for five</a>"
3,Israeli ambassador rejects Carney’s criticism of aid delivery in Gaza,https://www.theglobeandmail.com/canada/article-israeli-ambassador-rejects-carneys-criticism-of-aid-delivery-in-gaza/,No byline found,No article type found,"<a href=""https://www.theglobeandmail.com/canada/article-israeli-ambassador-rejects-carneys-criticism-of-aid-delivery-in-gaza/"">Israeli ambassador rejects Carney’s criticism of aid delivery in Gaza</a>"
4,"At the bars lining London’s streets, the Hockey Canada verdict hits close to home",https://www.theglobeandmail.com/canada/article-london-ontario-reaction-hockey-canada-trial-jacks/,No byline found,No article type found,"<a href=""https://www.theglobeandmail.com/canada/article-london-ontario-reaction-hockey-canada-trial-jacks/"">At the bars lining London’s streets, the Hockey Canada verdict hits close to home</a>"
5,My estranged father died in hospital after years of drug use. He was more than a statistic,https://www.theglobeandmail.com/opinion/article-my-estranged-father-died-in-hospital-after-years-of-drug-use-he-was/,No byline found,No article type found,"<a href=""https://www.theglobeandmail.com/opinion/article-my-estranged-father-died-in-hospital-after-years-of-drug-use-he-was/"">My estranged father died in hospital after years of drug use. He was more than a statistic</a>"
6,"After the Hockey Canada verdict, advocates fear survivors will fall silent",https://www.theglobeandmail.com/canada/article-hockey-canada-sexual-assault-trial-verdict-survivors/,No byline found,No article type found,"<a href=""https://www.theglobeandmail.com/canada/article-hockey-canada-sexual-assault-trial-verdict-survivors/"">After the Hockey Canada verdict, advocates fear survivors will fall silent</a>"
7,"Real estate is not a financial slam dunk, Canadians are learning the hard way",https://www.theglobeandmail.com/investing/markets/inside-the-market/article-real-estate-is-not-a-financial-slam-dunk-canadians-are-learning-the/,No byline found,No article type found,"<a href=""https://www.theglobeandmail.com/investing/markets/inside-the-market/article-real-estate-is-not-a-financial-slam-dunk-canadians-are-learning-the/"">Real estate is not a financial slam dunk, Canadians are learning the hard way</a>"
8,"Two people, including 3-year-old, die in separate Ontario drownings Saturday",https://www.theglobeandmail.com/canada/article-ontario-drownings-3-year-old-dies-saturday/,No byline found,No article type found,"<a href=""https://www.theglobeandmail.com/canada/article-ontario-drownings-3-year-old-dies-saturday/"">Two people, including 3-year-old, die in separate Ontario drownings Saturday</a>"
