Rank,Article title,url,Byline,Article type,title_with_link
1,Poilievre to appear on Joe Rogan’s podcast after turning it down during last election,https://www.theglobeandmail.com/politics/article-pierre-poilievre-joe-rogan-podcast-interview-conservative-leader/,No byline found,No article type found,"<a href=""https://www.theglobeandmail.com/politics/article-pierre-poilievre-joe-rogan-podcast-interview-conservative-leader/"">Poilievre to appear on Joe Rogan’s podcast after turning it down during last election</a>"
2,"Police arrest two teens in Nova Scotia, Manitoba accused of planning co-ordinated school attacks",https://www.theglobeandmail.com/canada/article-nova-scotia-manitoba-school-attacks-teens-arrested/,No byline found,No article type found,"<a href=""https://www.theglobeandmail.com/canada/article-nova-scotia-manitoba-school-attacks-teens-arrested/"">Police arrest two teens in Nova Scotia, Manitoba accused of planning co-ordinated school attacks</a>"
3,Stock markets Wednesday: Major indexes close near lows as oil prices rise and traders pare U.S. rate cut bets after Fed decision,https://www.theglobeandmail.com/investing/markets/inside-the-market/market-news/article-stock-market-today-live-updates-march-18/,No byline found,No article type found,"<a href=""https://www.theglobeandmail.com/investing/markets/inside-the-market/market-news/article-stock-market-today-live-updates-march-18/"">Stock markets Wednesday: Major indexes close near lows as oil prices rise and traders pare U.S. rate cut bets after Fed decision</a>"
4,Canada reports first annual population decline on record,https://www.theglobeandmail.com/business/article-canada-reports-first-annual-population-decline-on-record/,No byline found,No article type found,"<a href=""https://www.theglobeandmail.com/business/article-canada-reports-first-annual-population-decline-on-record/"">Canada reports first annual population decline on record</a>"
5,"What this 85-year-old, seven-time executor can teach you about carrying out wills",https://www.theglobeandmail.com/investing/personal-finance/retirement/article-executor-will-testament-inheritance/,No byline found,No article type found,"<a href=""https://www.theglobeandmail.com/investing/personal-finance/retirement/article-executor-will-testament-inheritance/"">What this 85-year-old, seven-time executor can teach you about carrying out wills</a>"
6,Iran attacks Gulf energy assets in latest escalation,https://www.theglobeandmail.com/world/article-iran-war-us-israel-strait-of-hormuz-oil/,No byline found,No article type found,"<a href=""https://www.theglobeandmail.com/world/article-iran-war-us-israel-strait-of-hormuz-oil/"">Iran attacks Gulf energy assets in latest escalation</a>"
7,Danielle Smith seeking national-security clearance from Canada’s spy service,https://www.theglobeandmail.com/canada/alberta/article-danielle-smith-national-security-clearance-from-csis-foreign/,No byline found,No article type found,"<a href=""https://www.theglobeandmail.com/canada/alberta/article-danielle-smith-national-security-clearance-from-csis-foreign/"">Danielle Smith seeking national-security clearance from Canada’s spy service</a>"
8,Collapse of fractional real estate investing firm shows risks of business model,https://www.theglobeandmail.com/real-estate/article-collapse-fractional-real-estate-investing-firm-business-model-risks/,No byline found,No article type found,"<a href=""https://www.theglobeandmail.com/real-estate/article-collapse-fractional-real-estate-investing-firm-business-model-risks/"">Collapse of fractional real estate investing firm shows risks of business model</a>"
