Rank,Article title,url,Byline,Article type,title_with_link
1,The Shaq of the bobsled track has made his Olympic debut for Canada,https://www.theglobeandmail.com/sports/article-the-shaq-of-the-bobsled-track-has-made-his-olympic-debut-for-canada/,No byline found,No article type found,"<a href=""https://www.theglobeandmail.com/sports/article-the-shaq-of-the-bobsled-track-has-made-his-olympic-debut-for-canada/"">The Shaq of the bobsled track has made his Olympic debut for Canada</a>"
2,"Olympic hockey demonstrates how good the NHL could be, but isn’t",https://www.theglobeandmail.com/sports/article-winter-olympics-2026-hockey-nhl/,Cathal Kelly,Opinion,"<a href=""https://www.theglobeandmail.com/sports/article-winter-olympics-2026-hockey-nhl/"">Olympic hockey demonstrates how good the NHL could be, but isn’t</a>"
3,Canada wins second consecutive gold in women’s long-track team pursuit,https://www.theglobeandmail.com/sports/olympics/article-winter-olympics-2026-live-updates-team-pursuit-medals-figure-skating/,No byline found,No article type found,"<a href=""https://www.theglobeandmail.com/sports/olympics/article-winter-olympics-2026-live-updates-team-pursuit-medals-figure-skating/"">Canada wins second consecutive gold in women’s long-track team pursuit</a>"
4,"Jesse Jackson, civil rights leader and U.S. presidential hopeful, dies at 84",https://www.theglobeandmail.com/world/article-jesse-jackson-civil-rights-leader-and-presidential-hopeful-dies-at-84/,No byline found,No article type found,"<a href=""https://www.theglobeandmail.com/world/article-jesse-jackson-civil-rights-leader-and-presidential-hopeful-dies-at-84/"">Jesse Jackson, civil rights leader and U.S. presidential hopeful, dies at 84</a>"
5,"Organized crime groups targeting police data across Canada, report says",https://www.theglobeandmail.com/canada/article-organized-crime-groups-targeting-police-data-across-canada-report-says/,No byline found,No article type found,"<a href=""https://www.theglobeandmail.com/canada/article-organized-crime-groups-targeting-police-data-across-canada-report-says/"">Organized crime groups targeting police data across Canada, report says</a>"
6,"They bought their condos in the pandemic. Now, they’re stuck ‘bleeding cash’",https://www.theglobeandmail.com/investing/personal-finance/article-gta-vancouver-condo-mortgages/,No byline found,No article type found,"<a href=""https://www.theglobeandmail.com/investing/personal-finance/article-gta-vancouver-condo-mortgages/"">They bought their condos in the pandemic. Now, they’re stuck ‘bleeding cash’</a>"
7,Canada’s reliance on the U.S. for our food is a recipe for disaster,https://www.theglobeandmail.com/opinion/article-canadas-reliance-on-the-us-for-our-food-is-a-recipe-for-disaster/,Sarah Elton,Opinion,"<a href=""https://www.theglobeandmail.com/opinion/article-canadas-reliance-on-the-us-for-our-food-is-a-recipe-for-disaster/"">Canada’s reliance on the U.S. for our food is a recipe for disaster</a>"
8,Immigration Minister defends proposed changes to asylum rules through border bill,https://www.theglobeandmail.com/politics/article-immigration-minister-bill-c-12-refugee-asylum-rules-senate-committee/,No byline found,No article type found,"<a href=""https://www.theglobeandmail.com/politics/article-immigration-minister-bill-c-12-refugee-asylum-rules-senate-committee/"">Immigration Minister defends proposed changes to asylum rules through border bill</a>"
