Rank,Article title,url,Byline,Article type,title_with_link
1,Giving trust beneficiary information to CRA when it isn’t required can lead to penalty trap,https://www.theglobeandmail.com/investing/globe-advisor/advisor-news/article-giving-trust-beneficiary-information-to-cra-when-it-isnt-required-can/,No byline found,No article type found,"<a href=""https://www.theglobeandmail.com/investing/globe-advisor/advisor-news/article-giving-trust-beneficiary-information-to-cra-when-it-isnt-required-can/"">Giving trust beneficiary information to CRA when it isn’t required can lead to penalty trap</a>"
2,Wednesday’s analyst upgrades and downgrades,https://www.theglobeandmail.com/investing/markets/inside-the-market/article-wednesdays-analyst-upgrades-and-downgrades-266/,No byline found,No article type found,"<a href=""https://www.theglobeandmail.com/investing/markets/inside-the-market/article-wednesdays-analyst-upgrades-and-downgrades-266/"">Wednesday’s analyst upgrades and downgrades</a>"
3,"What this retired teacher did with $500,000 and cabins inherited from her mother",https://www.theglobeandmail.com/investing/personal-finance/retirement/article-inheritance-retired-teacher-finances-family/,No byline found,No article type found,"<a href=""https://www.theglobeandmail.com/investing/personal-finance/retirement/article-inheritance-retired-teacher-finances-family/"">What this retired teacher did with $500,000 and cabins inherited from her mother</a>"
4,Three rewarding alternatives for American chardonnay,https://www.theglobeandmail.com/life/food-and-wine/wine-reviews/article-american-chardonnay-british-columbia-ontario-chile-winery/,No byline found,No article type found,"<a href=""https://www.theglobeandmail.com/life/food-and-wine/wine-reviews/article-american-chardonnay-british-columbia-ontario-chile-winery/"">Three rewarding alternatives for American chardonnay</a>"
5,"In defying the back-to-work order, CUPE took a calculated risk that paid off",https://www.theglobeandmail.com/business/article-air-canada-strike-cupe-back-to-work-order-defiance-risk-paid-off/,No byline found,No article type found,"<a href=""https://www.theglobeandmail.com/business/article-air-canada-strike-cupe-back-to-work-order-defiance-risk-paid-off/"">In defying the back-to-work order, CUPE took a calculated risk that paid off</a>"
6,Low asking price nets ten offers for Scarborough bungalow,https://www.theglobeandmail.com/real-estate/toronto/article-real-estate-toronto-scarborough-bungalow-chatsmere/,No byline found,No article type found,"<a href=""https://www.theglobeandmail.com/real-estate/toronto/article-real-estate-toronto-scarborough-bungalow-chatsmere/"">Low asking price nets ten offers for Scarborough bungalow</a>"
7,A big failure for Air Canada’s weak management. Are its days numbered?,https://www.theglobeandmail.com/business/commentary/article-air-canada-management-strike-cupe-flight-attendants/,Steven Tufts,Opinion,"<a href=""https://www.theglobeandmail.com/business/commentary/article-air-canada-management-strike-cupe-flight-attendants/"">A big failure for Air Canada’s weak management. Are its days numbered?</a>"
8,"Price cut of more than $200,000 helps uptown Toronto house compete in a crowded market",https://www.theglobeandmail.com/real-estate/toronto/article-lawrence-park-south-home-sale/,No byline found,No article type found,"<a href=""https://www.theglobeandmail.com/real-estate/toronto/article-lawrence-park-south-home-sale/"">Price cut of more than $200,000 helps uptown Toronto house compete in a crowded market</a>"
