Rank,Article title,url,Byline,Article type,title_with_link
1,Canada’s Mikaël Kingsbury wins silver in men’s Olympic moguls,https://www.theglobeandmail.com/sports/olympics/article-canada-aims-for-more-short-track-medals-as-mens-and-womens-hockey/,No byline found,No article type found,"<a href=""https://www.theglobeandmail.com/sports/olympics/article-canada-aims-for-more-short-track-medals-as-mens-and-womens-hockey/"">Canada’s Mikaël Kingsbury wins silver in men’s Olympic moguls</a>"
2,"James Van Der Beek, star of ‘Dawson’s Creek,’ dies at 48 after battle with cancer",https://www.theglobeandmail.com/world/article-james-van-der-beek-obituary-dawsons-creek/,No byline found,No article type found,"<a href=""https://www.theglobeandmail.com/world/article-james-van-der-beek-obituary-dawsons-creek/"">James Van Der Beek, star of ‘Dawson’s Creek,’ dies at 48 after battle with cancer</a>"
3,"Hockey players rule the Olympic roost, and where they can stay tells you that",https://www.theglobeandmail.com/sports/olympics/article-olympics-milan-cortina-winter-games-hockey-athletes-village/,Cathal Kelly,Opinion,"<a href=""https://www.theglobeandmail.com/sports/olympics/article-olympics-milan-cortina-winter-games-hockey-athletes-village/"">Hockey players rule the Olympic roost, and where they can stay tells you that</a>"
4,Air Canada updating wide-body fleet with Airbus order,https://www.theglobeandmail.com/business/article-air-canada-updating-wide-body-fleet-with-airbus-order/,No byline found,No article type found,"<a href=""https://www.theglobeandmail.com/business/article-air-canada-updating-wide-body-fleet-with-airbus-order/"">Air Canada updating wide-body fleet with Airbus order</a>"
5,CPP payments slow in 2026 as retirees cope with high living costs,https://www.theglobeandmail.com/investing/personal-finance/retirement/article-cpp-payments-2026-retirement-cost-of-living-pension/,No byline found,No article type found,"<a href=""https://www.theglobeandmail.com/investing/personal-finance/retirement/article-cpp-payments-2026-retirement-cost-of-living-pension/"">CPP payments slow in 2026 as retirees cope with high living costs</a>"
6,Morning Update: Devastation in Tumbler Ridge,https://www.theglobeandmail.com/canada/article-morning-update-devastation-in-tumbler-ridge/,No byline found,No article type found,"<a href=""https://www.theglobeandmail.com/canada/article-morning-update-devastation-in-tumbler-ridge/"">Morning Update: Devastation in Tumbler Ridge</a>"
7,"In the wake of the Tumbler Ridge shooting, false claims about trans people spread online",https://www.theglobeandmail.com/life/article-tumbler-ridge-shooting-false-claims-transgender-online/,No byline found,No article type found,"<a href=""https://www.theglobeandmail.com/life/article-tumbler-ridge-shooting-false-claims-transgender-online/"">In the wake of the Tumbler Ridge shooting, false claims about trans people spread online</a>"
8,Pierre Poilievre’s bespoke tax treatment proposal is a bad fit,https://www.theglobeandmail.com/opinion/editorials/article-pierre-poilievres-bespoke-tax-treatment-proposal-is-a-bad-fit/,No byline found,No article type found,"<a href=""https://www.theglobeandmail.com/opinion/editorials/article-pierre-poilievres-bespoke-tax-treatment-proposal-is-a-bad-fit/"">Pierre Poilievre’s bespoke tax treatment proposal is a bad fit</a>"
