Rank,Article title,url,title_with_link
1,"2 children dead, 17 people injured in Minnesota church, school shooting",https://globalnews.ca/news/11352067/mass-shooting-minnesota-annunciation-catholic-church-school/,"<a href=""https://globalnews.ca/news/11352067/mass-shooting-minnesota-annunciation-catholic-church-school/"">2 children dead, 17 people injured in Minnesota church, school shooting</a>"
2,Canada wants to sell LNG to Germany. Critics say it’s a race against time,https://globalnews.ca/news/11350934/lng-canada-europe-germany-outlook/,"<a href=""https://globalnews.ca/news/11350934/lng-canada-europe-germany-outlook/"">Canada wants to sell LNG to Germany. Critics say it’s a race against time</a>"
3,Duty-free shipping to U.S. ends Friday. Canadian businesses are ‘fearful’,https://globalnews.ca/news/11352453/de-minimis-exemption-canadian-businesses/,"<a href=""https://globalnews.ca/news/11352453/de-minimis-exemption-canadian-businesses/"">Duty-free shipping to U.S. ends Friday. Canadian businesses are ‘fearful’</a>"
4,"Airspace closed, businesses evacuated after explosive chemical found in Calgary",https://globalnews.ca/news/11352281/airspace-closed-businesses-evacuated-after-explosive-material-found-in-calgary/,"<a href=""https://globalnews.ca/news/11352281/airspace-closed-businesses-evacuated-after-explosive-material-found-in-calgary/"">Airspace closed, businesses evacuated after explosive chemical found in Calgary</a>"
5,Army vet burns American flag outside White House hours after Trump order,https://globalnews.ca/news/11352537/burning-american-flag-donald-trump-executive-order/,"<a href=""https://globalnews.ca/news/11352537/burning-american-flag-donald-trump-executive-order/"">Army vet burns American flag outside White House hours after Trump order</a>"
