Rank,Article title,url,Byline,Article type,title_with_link
1,Manufacturing meltdown: How Trump’s tariffs are squeezing Canadian factories,https://www.theglobeandmail.com/business/economy/article-manufacturing-donald-trump-tariffs-trade-war-one-year-later/,No byline found,No article type found,"<a href=""https://www.theglobeandmail.com/business/economy/article-manufacturing-donald-trump-tariffs-trade-war-one-year-later/"">Manufacturing meltdown: How Trump’s tariffs are squeezing Canadian factories</a>"
2,Violence in Canadian schools is reaching a tipping point. What needs to change?,https://www.theglobeandmail.com/opinion/article-violence-canadian-schools-students-teachers-solutions/,Naomi Buck,Opinion,"<a href=""https://www.theglobeandmail.com/opinion/article-violence-canadian-schools-students-teachers-solutions/"">Violence in Canadian schools is reaching a tipping point. What needs to change?</a>"
3,A game changer on and off the ice,https://www.theglobeandmail.com/opinion/editorials/article-pwhl-women-professional-hockey-vancouver-goldeneyes-toronto-tempo/,No byline found,No article type found,"<a href=""https://www.theglobeandmail.com/opinion/editorials/article-pwhl-women-professional-hockey-vancouver-goldeneyes-toronto-tempo/"">A game changer on and off the ice</a>"
4,"Explore The Globe 100 book archive, a complete collection of our annual list",https://www.theglobeandmail.com/culture/books/article-globe-100-archive-best-book-recommendations-lists/,No byline found,No article type found,"<a href=""https://www.theglobeandmail.com/culture/books/article-globe-100-archive-best-book-recommendations-lists/"">Explore The Globe 100 book archive, a complete collection of our annual list</a>"
5,"Bitcoin is now the barometer for the buckwild U.S. economy, and it looks bad",https://www.theglobeandmail.com/business/commentary/article-bitcoin-is-now-the-barometer-for-the-us-economy-and-it-doesnt-look/,John Rapley,Opinion,"<a href=""https://www.theglobeandmail.com/business/commentary/article-bitcoin-is-now-the-barometer-for-the-us-economy-and-it-doesnt-look/"">Bitcoin is now the barometer for the buckwild U.S. economy, and it looks bad</a>"
6,Vancouver must go wild – for the good of us all,https://www.theglobeandmail.com/opinion/article-vancouver-forest-canopy-strategy-wildlife-nature/,Margaret Munro,Opinion,"<a href=""https://www.theglobeandmail.com/opinion/article-vancouver-forest-canopy-strategy-wildlife-nature/"">Vancouver must go wild – for the good of us all</a>"
7,Team Jacobs punches Olympic ticket with 6-5 win over Winnipeg’s Dunstone,https://www.theglobeandmail.com/sports/article-jacobs-vs-dunstone-olympic-curling-trials-results-milano-cortina/,No byline found,No article type found,"<a href=""https://www.theglobeandmail.com/sports/article-jacobs-vs-dunstone-olympic-curling-trials-results-milano-cortina/"">Team Jacobs punches Olympic ticket with 6-5 win over Winnipeg’s Dunstone</a>"
8,Ukraine’s drones keep enemy soldiers and civilians weary,https://www.theglobeandmail.com/world/article-drone-combat-russia-ukraine-war-photo-essay/,No byline found,No article type found,"<a href=""https://www.theglobeandmail.com/world/article-drone-combat-russia-ukraine-war-photo-essay/"">Ukraine’s drones keep enemy soldiers and civilians weary</a>"
