Rank,Article title,url,Byline,Article type,title_with_link
1,Donald Trump’s State of the Union address comes at an unusually provocative moment,https://www.theglobeandmail.com/world/us-politics/article-donald-trumps-state-of-the-union-address-comes-at-an-unusually/,No byline found,Analysis,"<a href=""https://www.theglobeandmail.com/world/us-politics/article-donald-trumps-state-of-the-union-address-comes-at-an-unusually/"">Donald Trump’s State of the Union address comes at an unusually provocative moment</a>"
2,Alberta cannot just up and leave Canada,https://www.theglobeandmail.com/opinion/article-alberta-cannot-just-up-and-leave-canada/,Kent McNeil,Opinion,"<a href=""https://www.theglobeandmail.com/opinion/article-alberta-cannot-just-up-and-leave-canada/"">Alberta cannot just up and leave Canada</a>"
3,Before the Bell: What every Canadian investor needs to know today,https://www.theglobeandmail.com/investing/markets/inside-the-market/article-before-the-bell-what-every-canadian-investor-needs-to-know-today-1419/,No byline found,No article type found,"<a href=""https://www.theglobeandmail.com/investing/markets/inside-the-market/article-before-the-bell-what-every-canadian-investor-needs-to-know-today-1419/"">Before the Bell: What every Canadian investor needs to know today</a>"
4,"This 42-year-old and her daughter had a $450,000 budget for a home in Winnipeg. Here’s what she found",https://www.theglobeandmail.com/investing/personal-finance/article-this-42-year-old-and-her-daughter-had-a-450000-budget-for-a-home-in/,No byline found,No article type found,"<a href=""https://www.theglobeandmail.com/investing/personal-finance/article-this-42-year-old-and-her-daughter-had-a-450000-budget-for-a-home-in/"">This 42-year-old and her daughter had a $450,000 budget for a home in Winnipeg. Here’s what she found</a>"
5,CPP payment increases slow in 2026 as retirees cope with high living costs,https://www.theglobeandmail.com/investing/personal-finance/retirement/article-cpp-payments-2026-retirement-cost-of-living-pension/,No byline found,No article type found,"<a href=""https://www.theglobeandmail.com/investing/personal-finance/retirement/article-cpp-payments-2026-retirement-cost-of-living-pension/"">CPP payment increases slow in 2026 as retirees cope with high living costs</a>"
6,"Six months after a tariff exemption expired, small businesses scramble to cope with a labyrinth of rules",https://www.theglobeandmail.com/business/article-de-minimis-exemption-expired-small-businesses-cope-rules/,No byline found,No article type found,"<a href=""https://www.theglobeandmail.com/business/article-de-minimis-exemption-expired-small-businesses-cope-rules/"">Six months after a tariff exemption expired, small businesses scramble to cope with a labyrinth of rules</a>"
7,"Mark Carney to visit India, Australia and Japan",https://www.theglobeandmail.com/politics/article-mark-carney-trips-india-australia-japan/,No byline found,No article type found,"<a href=""https://www.theglobeandmail.com/politics/article-mark-carney-trips-india-australia-japan/"">Mark Carney to visit India, Australia and Japan</a>"
8,"Canada’s great American breakup: Most now see U.S. as a risk, not an ally, poll finds",https://www.theglobeandmail.com/politics/article-canada-us-risk-not-ally-poll-finds/,No byline found,No article type found,"<a href=""https://www.theglobeandmail.com/politics/article-canada-us-risk-not-ally-poll-finds/"">Canada’s great American breakup: Most now see U.S. as a risk, not an ally, poll finds</a>"
