Rank,Article title,url,Byline,Article type,title_with_link
1,How to prepare for an even greater selloff? Start with a wider lens,https://www.theglobeandmail.com/investing/investment-ideas/article-stock-market-investing-covid-hantavirus-pandemic/,Kevin Foley,Opinion,"<a href=""https://www.theglobeandmail.com/investing/investment-ideas/article-stock-market-investing-covid-hantavirus-pandemic/"">How to prepare for an even greater selloff? Start with a wider lens</a>"
2,Canadiens beat Sabres 6-3 as Buffalo unravels in Game 5,https://www.theglobeandmail.com/sports/article-canadiens-beat-sabres-6-3-as-buffalo-unravels-in-game-5/,Cathal Kelly,Opinion,"<a href=""https://www.theglobeandmail.com/sports/article-canadiens-beat-sabres-6-3-as-buffalo-unravels-in-game-5/"">Canadiens beat Sabres 6-3 as Buffalo unravels in Game 5</a>"
3,"West Coast pipeline is conditional on carbon-capture project, Carney says",https://www.theglobeandmail.com/business/article-carney-smith-alberta-west-coast-pipeline-carbon-capture/,No byline found,No article type found,"<a href=""https://www.theglobeandmail.com/business/article-carney-smith-alberta-west-coast-pipeline-carbon-capture/"">West Coast pipeline is conditional on carbon-capture project, Carney says</a>"
4,"Bonds battered across the world, including in Canada, as flaring inflation spooks investors",https://www.theglobeandmail.com/investing/article-global-bonds-battered-as-flaring-inflation-spooks-investors/,No byline found,No article type found,"<a href=""https://www.theglobeandmail.com/investing/article-global-bonds-battered-as-flaring-inflation-spooks-investors/"">Bonds battered across the world, including in Canada, as flaring inflation spooks investors</a>"
5,"Ottawa, Alberta agree on carbon pricing to advance plan for new oil pipeline",https://www.theglobeandmail.com/business/article-mark-carney-danielle-smith-new-pipeline-carbon-pricing-agreement/,No byline found,No article type found,"<a href=""https://www.theglobeandmail.com/business/article-mark-carney-danielle-smith-new-pipeline-carbon-pricing-agreement/"">Ottawa, Alberta agree on carbon pricing to advance plan for new oil pipeline</a>"
6,"Canada is one of history’s most successful countries. Here’s a look at who’s trying to destroy it, and how",https://www.theglobeandmail.com/opinion/article-canada-is-one-of-historys-most-successful-countries-heres-a-look-at/,Andrew Coyne,Opinion,"<a href=""https://www.theglobeandmail.com/opinion/article-canada-is-one-of-historys-most-successful-countries-heres-a-look-at/"">Canada is one of history’s most successful countries. Here’s a look at who’s trying to destroy it, and how</a>"
7,"Shania Twain revisits her teen years in new album, Little Miss Twain",https://www.theglobeandmail.com/culture/music/article-shania-twain-new-album-little-miss-twain/,No byline found,No article type found,"<a href=""https://www.theglobeandmail.com/culture/music/article-shania-twain-new-album-little-miss-twain/"">Shania Twain revisits her teen years in new album, Little Miss Twain</a>"
8,Legal experts weigh in on what’s next for Alberta’s proposed separation referendum,https://www.theglobeandmail.com/canada/article-legal-experts-weigh-in-on-whats-next-for-albertas-proposed-separation/,No byline found,No article type found,"<a href=""https://www.theglobeandmail.com/canada/article-legal-experts-weigh-in-on-whats-next-for-albertas-proposed-separation/"">Legal experts weigh in on what’s next for Alberta’s proposed separation referendum</a>"
