Rank,Article title,url,Byline,Article type,title_with_link
1,"How to avert summertime hair damage, frizz and oily roots",https://www.theglobeandmail.com/life/style/article-summer-hair-products-to-protect-hair/,No byline found,No article type found,"<a href=""https://www.theglobeandmail.com/life/style/article-summer-hair-products-to-protect-hair/"">How to avert summertime hair damage, frizz and oily roots</a>"
2,I asked ChatGPT to predict my retirement and it helped calm my financial anxiety,https://www.theglobeandmail.com/investing/personal-finance/retirement/article-chatgpt-ai-retirement-financial-anxiety/,No byline found,No article type found,"<a href=""https://www.theglobeandmail.com/investing/personal-finance/retirement/article-chatgpt-ai-retirement-financial-anxiety/"">I asked ChatGPT to predict my retirement and it helped calm my financial anxiety</a>"
3,"With Poilievre on the ballot, voters in an overlooked corner of Alberta look for a brighter future",https://www.theglobeandmail.com/canada/alberta/article-pierre-poilievre-battle-river-crowfoot-alberta-election/,No byline found,No article type found,"<a href=""https://www.theglobeandmail.com/canada/alberta/article-pierre-poilievre-battle-river-crowfoot-alberta-election/"">With Poilievre on the ballot, voters in an overlooked corner of Alberta look for a brighter future</a>"
4,"Vancouver’s land development plan could help pay for city budget, chief of staff says",https://www.theglobeandmail.com/canada/article-vancouver-land-development-plan-city-budget/,No byline found,No article type found,"<a href=""https://www.theglobeandmail.com/canada/article-vancouver-land-development-plan-city-budget/"">Vancouver’s land development plan could help pay for city budget, chief of staff says</a>"
5,The mystery of BC’s darkening debt outlook,https://www.theglobeandmail.com/opinion/editorials/article-david-eby-debt-bc-british-columbia-finance/,No byline found,No article type found,"<a href=""https://www.theglobeandmail.com/opinion/editorials/article-david-eby-debt-bc-british-columbia-finance/"">The mystery of BC’s darkening debt outlook</a>"
6,Why I’m buying more of these three dividend growth stocks,https://www.theglobeandmail.com/investing/education/article-td-bank-manulife-rbi-dividend-growth-stocks/,No byline found,No article type found,"<a href=""https://www.theglobeandmail.com/investing/education/article-td-bank-manulife-rbi-dividend-growth-stocks/"">Why I’m buying more of these three dividend growth stocks</a>"
7,Update for mortgage shoppers: Variable rates are now cheaper than fixed,https://www.theglobeandmail.com/investing/personal-finance/article-mortgage-variable-fixed-rates-penelope-graham/,No byline found,No article type found,"<a href=""https://www.theglobeandmail.com/investing/personal-finance/article-mortgage-variable-fixed-rates-penelope-graham/"">Update for mortgage shoppers: Variable rates are now cheaper than fixed</a>"
8,"Dear ChatGPT, what’s your best personal finance advice? Here’s how AI’s answers stack up against what experts say",https://www.theglobeandmail.com/investing/personal-finance/retirement/article-chatgpt-personal-finance-advice-human-advisers/,No byline found,No article type found,"<a href=""https://www.theglobeandmail.com/investing/personal-finance/retirement/article-chatgpt-personal-finance-advice-human-advisers/"">Dear ChatGPT, what’s your best personal finance advice? Here’s how AI’s answers stack up against what experts say</a>"
