Rank,Article title,url,Byline,Article type,title_with_link
1,Violence in Canadian schools is reaching a tipping point. What needs to change?,https://www.theglobeandmail.com/opinion/article-violence-canadian-schools-students-teachers-solutions/,Naomi Buck,Opinion,"<a href=""https://www.theglobeandmail.com/opinion/article-violence-canadian-schools-students-teachers-solutions/"">Violence in Canadian schools is reaching a tipping point. What needs to change?</a>"
2,"Economic Outlook 2026: The good, the bad and the downright scary",https://www.theglobeandmail.com/business/rob-magazine/article-economic-outlook-2026-trade-housing-artificial-intelligence/,No byline found,No article type found,"<a href=""https://www.theglobeandmail.com/business/rob-magazine/article-economic-outlook-2026-trade-housing-artificial-intelligence/"">Economic Outlook 2026: The good, the bad and the downright scary</a>"
3,A blockbuster not-yet-agreement with the devil in the politics,https://www.theglobeandmail.com/politics/opinion/article-alberta-bc-pipeline-carney-smith-oil-energy-eby-first-nations/,Campbell Clark,Opinion,"<a href=""https://www.theglobeandmail.com/politics/opinion/article-alberta-bc-pipeline-carney-smith-oil-energy-eby-first-nations/"">A blockbuster not-yet-agreement with the devil in the politics</a>"
4,"Carney’s new bargain: An end to Trudeau-era climate policies, and a big bet on industrial carbon pricing",https://www.theglobeandmail.com/business/article-carneys-new-bargain-an-end-to-trudeau-era-climate-policies-and-a-big/,No byline found,No article type found,"<a href=""https://www.theglobeandmail.com/business/article-carneys-new-bargain-an-end-to-trudeau-era-climate-policies-and-a-big/"">Carney’s new bargain: An end to Trudeau-era climate policies, and a big bet on industrial carbon pricing</a>"
5,Live-work loft in Queen West finds a buyer after two price cuts and a long wait,https://www.theglobeandmail.com/real-estate/toronto/article-live-work-loft-in-queen-west-finds-a-buyer-after-two-price-cuts/,No byline found,No article type found,"<a href=""https://www.theglobeandmail.com/real-estate/toronto/article-live-work-loft-in-queen-west-finds-a-buyer-after-two-price-cuts/"">Live-work loft in Queen West finds a buyer after two price cuts and a long wait</a>"
6,11 Canadian stocks for value-focused investors,https://www.theglobeandmail.com/investing/investment-ideas/number-cruncher/article-11-stocks-value-focused-investors-trading-central/,No byline found,No article type found,"<a href=""https://www.theglobeandmail.com/investing/investment-ideas/number-cruncher/article-11-stocks-value-focused-investors-trading-central/"">11 Canadian stocks for value-focused investors</a>"
7,"Immigrants from China struggling to obtain security clearances for government jobs, senator says",https://www.theglobeandmail.com/politics/article-china-immigrants-security-clearance-government-jobs-public-sector/,No byline found,No article type found,"<a href=""https://www.theglobeandmail.com/politics/article-china-immigrants-security-clearance-government-jobs-public-sector/"">Immigrants from China struggling to obtain security clearances for government jobs, senator says</a>"
8,Steven Guilbeault resigns from cabinet in protest against Carney’s Alberta energy deal,https://www.theglobeandmail.com/politics/article-steven-guilbeault-resigns-from-cabinet/,No byline found,No article type found,"<a href=""https://www.theglobeandmail.com/politics/article-steven-guilbeault-resigns-from-cabinet/"">Steven Guilbeault resigns from cabinet in protest against Carney’s Alberta energy deal</a>"
