Rank,Article title,url,Byline,Article type,title_with_link
1,Canadian comedian and actor Veronika Slowikowska joins SNL cast,https://www.theglobeandmail.com/arts/television/article-canadian-comedian-and-actor-veronika-slowikowska-joins-snl-cast/,No byline found,No article type found,"<a href=""https://www.theglobeandmail.com/arts/television/article-canadian-comedian-and-actor-veronika-slowikowska-joins-snl-cast/"">Canadian comedian and actor Veronika Slowikowska joins SNL cast</a>"
2,Finance Minister announces 100-day plan to fix CRA service delays,https://www.theglobeandmail.com/investing/personal-finance/article-cra-service-delays-champagne/,No byline found,No article type found,"<a href=""https://www.theglobeandmail.com/investing/personal-finance/article-cra-service-delays-champagne/"">Finance Minister announces 100-day plan to fix CRA service delays</a>"
3,Why GM is making the best cars right now,https://www.theglobeandmail.com/drive/culture/article-why-gm-is-making-the-best-cars-right-now/,Kunal D’souza,Opinion,"<a href=""https://www.theglobeandmail.com/drive/culture/article-why-gm-is-making-the-best-cars-right-now/"">Why GM is making the best cars right now</a>"
4,"Ten years after Alan Kurdi’s photo prompted an outpouring, experts fear a loss of empathy for refugees",https://www.theglobeandmail.com/politics/article-drowned-toddler-alan-kurdi-canada-refugees/,No byline found,No article type found,"<a href=""https://www.theglobeandmail.com/politics/article-drowned-toddler-alan-kurdi-canada-refugees/"">Ten years after Alan Kurdi’s photo prompted an outpouring, experts fear a loss of empathy for refugees</a>"
5,Belichick’s star firmly on the wane after disastrous NCAA debut,https://www.theglobeandmail.com/sports/football/article-belichicks-star-firmly-on-the-wane-after-disastrous-ncaa-debut/,Cathal Kelly,Opinion,"<a href=""https://www.theglobeandmail.com/sports/football/article-belichicks-star-firmly-on-the-wane-after-disastrous-ncaa-debut/"">Belichick’s star firmly on the wane after disastrous NCAA debut</a>"
6,"Newfoundland town declares emergency, closes businesses as water runs out",https://www.theglobeandmail.com/canada/article-newfoundland-town-declares-emergency-closes-businesses-as-water-runs/,No byline found,No article type found,"<a href=""https://www.theglobeandmail.com/canada/article-newfoundland-town-declares-emergency-closes-businesses-as-water-runs/"">Newfoundland town declares emergency, closes businesses as water runs out</a>"
7,"B.C.’s civil service union launches strike, with about 2,600 workers joining picket lines",https://www.theglobeandmail.com/canada/british-columbia/article-bcgeu-strike-2025/,No byline found,No article type found,"<a href=""https://www.theglobeandmail.com/canada/british-columbia/article-bcgeu-strike-2025/"">B.C.’s civil service union launches strike, with about 2,600 workers joining picket lines</a>"
8,Trump vows to take fight for tariffs to U.S. Supreme Court,https://www.theglobeandmail.com/world/article-trump-tariffs-fight-supreme-court-appeal/,No byline found,No article type found,"<a href=""https://www.theglobeandmail.com/world/article-trump-tariffs-fight-supreme-court-appeal/"">Trump vows to take fight for tariffs to U.S. Supreme Court</a>"
