Rank,Article title,url,Byline,Article type,title_with_link
1,Is it illegal to stop before turning right at a green light?,https://www.theglobeandmail.com/drive/culture/article-is-it-illegal-to-stop-before-turning-right-at-a-green-light/,No byline found,No article type found,"<a href=""https://www.theglobeandmail.com/drive/culture/article-is-it-illegal-to-stop-before-turning-right-at-a-green-light/"">Is it illegal to stop before turning right at a green light?</a>"
2,"OPP arrest 20 people, recover more than 300 vehicles in auto theft network bust",https://www.theglobeandmail.com/canada/article-ontario-provincial-police-auto-theft-network-bust/,No byline found,No article type found,"<a href=""https://www.theglobeandmail.com/canada/article-ontario-provincial-police-auto-theft-network-bust/"">OPP arrest 20 people, recover more than 300 vehicles in auto theft network bust</a>"
3,"Telus offers buyouts to about 700 employees, union says",https://www.theglobeandmail.com/business/article-telus-buyouts-severance-employees-union-cuts/,No byline found,No article type found,"<a href=""https://www.theglobeandmail.com/business/article-telus-buyouts-severance-employees-union-cuts/"">Telus offers buyouts to about 700 employees, union says</a>"
4,‘I am perfectly fine with the population decreasing. It means more jobs and affordable housing for Canadian youth.’ Letters to the editor for Dec. 26,https://www.theglobeandmail.com/opinion/letters/article-population-decreasing-more-jobs-affordable-housing-for-canadian-youth/,No byline found,No article type found,"<a href=""https://www.theglobeandmail.com/opinion/letters/article-population-decreasing-more-jobs-affordable-housing-for-canadian-youth/"">‘I am perfectly fine with the population decreasing. It means more jobs and affordable housing for Canadian youth.’ Letters to the editor for Dec. 26</a>"
5,"Venezuela’s oil is coming back. So, stick with Suncor",https://www.theglobeandmail.com/investing/markets/inside-the-market/article-venezuelas-oil-is-coming-back-so-stick-with-suncor/,David Berman,Opinion,"<a href=""https://www.theglobeandmail.com/investing/markets/inside-the-market/article-venezuelas-oil-is-coming-back-so-stick-with-suncor/"">Venezuela’s oil is coming back. So, stick with Suncor</a>"
6,"No, Indigenous people are not coming to take Canadians’ homes",https://www.theglobeandmail.com/opinion/article-indigenous-property-bc-supreme-court-david-frum/,Tanya Talaga,Opinion,"<a href=""https://www.theglobeandmail.com/opinion/article-indigenous-property-bc-supreme-court-david-frum/"">No, Indigenous people are not coming to take Canadians’ homes</a>"
7,New video released of ICE shooting as protests continue in Minneapolis,https://www.theglobeandmail.com/world/article-ice-shooting-renee-good-minneapolis-immigration-portland/,No byline found,No article type found,"<a href=""https://www.theglobeandmail.com/world/article-ice-shooting-renee-good-minneapolis-immigration-portland/"">New video released of ICE shooting as protests continue in Minneapolis</a>"
8,"Winnipeg police arrest man after swastikas painted on synagogue, mosque and high school",https://www.theglobeandmail.com/canada/article-winnipeg-police-arrest-mosque-synagogue-swastika-high-school/,No byline found,No article type found,"<a href=""https://www.theglobeandmail.com/canada/article-winnipeg-police-arrest-mosque-synagogue-swastika-high-school/"">Winnipeg police arrest man after swastikas painted on synagogue, mosque and high school</a>"
