Rank,Article title,url,Byline,Article type,title_with_link
1,U.S. lumber group expands list of complaints against Canadian softwood producers,https://www.theglobeandmail.com/business/article-us-lumber-group-complaints-canadian-softwood-producers/,No byline found,No article type found,"<a href=""https://www.theglobeandmail.com/business/article-us-lumber-group-complaints-canadian-softwood-producers/"">U.S. lumber group expands list of complaints against Canadian softwood producers</a>"
2,The Globe’s 20 best dividend-paying stocks of the year,https://www.theglobeandmail.com/investing/markets/inside-the-market/article-dividend-all-stars-20-best-performing-dividend-stocks-tsx/,No byline found,No article type found,"<a href=""https://www.theglobeandmail.com/investing/markets/inside-the-market/article-dividend-all-stars-20-best-performing-dividend-stocks-tsx/"">The Globe’s 20 best dividend-paying stocks of the year</a>"
3,Ottawa places a sensible limit on the right to claim asylum,https://www.theglobeandmail.com/opinion/editorials/article-ottawa-asylum-bill-c-12-immigration-refugees/,No byline found,No article type found,"<a href=""https://www.theglobeandmail.com/opinion/editorials/article-ottawa-asylum-bill-c-12-immigration-refugees/"">Ottawa places a sensible limit on the right to claim asylum</a>"
4,Ottawa updates advice for First Nations people crossing U.S. border,https://www.theglobeandmail.com/canada/article-ottawa-updates-advice-for-first-nations-people-crossing-us-border/,No byline found,No article type found,"<a href=""https://www.theglobeandmail.com/canada/article-ottawa-updates-advice-for-first-nations-people-crossing-us-border/"">Ottawa updates advice for First Nations people crossing U.S. border</a>"
5,"Around the world, Donald Trump is destroying Brand America",https://www.theglobeandmail.com/opinion/article-donald-trump-brand-america-us-reputation/,Gary Mason,Opinion,"<a href=""https://www.theglobeandmail.com/opinion/article-donald-trump-brand-america-us-reputation/"">Around the world, Donald Trump is destroying Brand America</a>"
6,CPP payments slow in 2026 as retirees cope with high living costs,https://www.theglobeandmail.com/investing/personal-finance/retirement/article-cpp-payments-2026-retirement-cost-of-living-pension/,No byline found,No article type found,"<a href=""https://www.theglobeandmail.com/investing/personal-finance/retirement/article-cpp-payments-2026-retirement-cost-of-living-pension/"">CPP payments slow in 2026 as retirees cope with high living costs</a>"
7,Bitcoin zero? Crypto evangelists have run out of stories to tell,https://www.theglobeandmail.com/investing/markets/inside-the-market/article-bitcoin-cryptocurrency-speculation-investing/,No byline found,No article type found,"<a href=""https://www.theglobeandmail.com/investing/markets/inside-the-market/article-bitcoin-cryptocurrency-speculation-investing/"">Bitcoin zero? Crypto evangelists have run out of stories to tell</a>"
8,"What to know about the Canadian Armed Forces, its part-time reserves and its increase in applications",https://www.theglobeandmail.com/canada/article-canada-armed-forces-reserves-defence-strategy/,No byline found,No article type found,"<a href=""https://www.theglobeandmail.com/canada/article-canada-armed-forces-reserves-defence-strategy/"">What to know about the Canadian Armed Forces, its part-time reserves and its increase in applications</a>"
