Rank,Article title,url,Byline,Article type,title_with_link
1,Northland Power shares plunge after cutting dividend in ‘abrupt shift’,https://www.theglobeandmail.com/business/article-northland-power-producer-third-quarter-earnings-dividend-cut/,No byline found,No article type found,"<a href=""https://www.theglobeandmail.com/business/article-northland-power-producer-third-quarter-earnings-dividend-cut/"">Northland Power shares plunge after cutting dividend in ‘abrupt shift’</a>"
2,"Manulife’s shares hit record after insurer unveils new expansion strategy, India focus",https://www.theglobeandmail.com/investing/article-manulifes-shares-surge-after-insurer-unveils-new-expansion-strategy/,No byline found,No article type found,"<a href=""https://www.theglobeandmail.com/investing/article-manulifes-shares-surge-after-insurer-unveils-new-expansion-strategy/"">Manulife’s shares hit record after insurer unveils new expansion strategy, India focus</a>"
3,Sonder’s abrupt shutdown leaves travellers stranded and neighbours relieved,https://www.theglobeandmail.com/investing/personal-finance/article-sonder-shutdown-travellers-rental-company-marriott-hotel-stranded/,No byline found,No article type found,"<a href=""https://www.theglobeandmail.com/investing/personal-finance/article-sonder-shutdown-travellers-rental-company-marriott-hotel-stranded/"">Sonder’s abrupt shutdown leaves travellers stranded and neighbours relieved</a>"
4,Health Canada lost $20-million worth of pharmaceuticals this year from national stockpile,https://www.theglobeandmail.com/canada/article-health-canada-pharmaceuticals-lost-from-national-stockpile/,No byline found,No article type found,"<a href=""https://www.theglobeandmail.com/canada/article-health-canada-pharmaceuticals-lost-from-national-stockpile/"">Health Canada lost $20-million worth of pharmaceuticals this year from national stockpile</a>"
5,What this 58-year-old decided to do with his father’s Florida timeshare,https://www.theglobeandmail.com/investing/personal-finance/retirement/article-what-this-58-year-old-decided-to-do-with-his-fathers-florida-timeshare/,No byline found,No article type found,"<a href=""https://www.theglobeandmail.com/investing/personal-finance/retirement/article-what-this-58-year-old-decided-to-do-with-his-fathers-florida-timeshare/"">What this 58-year-old decided to do with his father’s Florida timeshare</a>"
6,The false feminism of political lesbianism,https://www.theglobeandmail.com/opinion/article-false-feminism-of-new-political-lesbianism/,Phoebe Maltz Bovy,Opinion,"<a href=""https://www.theglobeandmail.com/opinion/article-false-feminism-of-new-political-lesbianism/"">The false feminism of political lesbianism</a>"
7,What makes for a renter-friendly city? Our experts answered your questions,https://www.theglobeandmail.com/investing/personal-finance/article-renter-friendly-cities-edmonton-questions/,No byline found,No article type found,"<a href=""https://www.theglobeandmail.com/investing/personal-finance/article-renter-friendly-cities-edmonton-questions/"">What makes for a renter-friendly city? Our experts answered your questions</a>"
8,Ontario sends audit of company that received millions from Skills Development Fund to police,https://www.theglobeandmail.com/canada/article-ontario-audit-skills-development-fund-doug-ford-david-piccini/,No byline found,No article type found,"<a href=""https://www.theglobeandmail.com/canada/article-ontario-audit-skills-development-fund-doug-ford-david-piccini/"">Ontario sends audit of company that received millions from Skills Development Fund to police</a>"
