Rank,Article title,url,title_with_link
1,Leslie Roberts: A CBC without guardrails,https://nationalpost.com/opinion/cbc-without-guardrails?itm_source=trending,"<a href=""https://nationalpost.com/opinion/cbc-without-guardrails?itm_source=trending"">Leslie Roberts: A CBC without guardrails</a>"
2,Amy Hamm: Father of 'evidence-based medicine' turns his back on science,https://nationalpost.com/opinion/father-of-evidence-based-medicine-turns-his-back-on-science?itm_source=trending,"<a href=""https://nationalpost.com/opinion/father-of-evidence-based-medicine-turns-his-back-on-science?itm_source=trending"">Amy Hamm: Father of 'evidence-based medicine' turns his back on science</a>"
3,Subscriber only.Conrad Black: B.C. Aboriginal title case underlines what's wrong with reconciliation,https://nationalpost.com/opinion/conrad-black-b-c-aboriginal-title-case-underlines-whats-wrong-with-reconciliation?itm_source=trending,"<a href=""https://nationalpost.com/opinion/conrad-black-b-c-aboriginal-title-case-underlines-whats-wrong-with-reconciliation?itm_source=trending"">Subscriber only.Conrad Black: B.C. Aboriginal title case underlines what's wrong with reconciliation</a>"
4,"Canada could send troops to Ukraine, Mark Carney says on surprise Kyiv visit",https://nationalpost.com/news/canada/carney-kyiv-canadian-troops-to-ukraine?itm_source=trending,"<a href=""https://nationalpost.com/news/canada/carney-kyiv-canadian-troops-to-ukraine?itm_source=trending"">Canada could send troops to Ukraine, Mark Carney says on surprise Kyiv visit</a>"
5,Letters: Why can't we defend our homes and families?,https://nationalpost.com/opinion/letters-why-cant-we-defend-our-homes-and-families?itm_source=trending,"<a href=""https://nationalpost.com/opinion/letters-why-cant-we-defend-our-homes-and-families?itm_source=trending"">Letters: Why can't we defend our homes and families?</a>"
