Rank,Article title,url,title_with_link
1,"Avi Lewis vows to unify NDP but stands by attacks on Mulcair, former Alberta minister",https://nationalpost.com/news/canada/avi-lewis-vows-to-unify-ndp-but-stands-by-attacks-on-mulcair-former-alberta-minister,"<a href=""https://nationalpost.com/news/canada/avi-lewis-vows-to-unify-ndp-but-stands-by-attacks-on-mulcair-former-alberta-minister"">Avi Lewis vows to unify NDP but stands by attacks on Mulcair, former Alberta minister</a>"
2,New 2% tax hike on alcohol takes effect Wednesday,https://nationalpost.com/news/canada/new-2-tax-hike-on-alcohol-takes-effect-wednesday,"<a href=""https://nationalpost.com/news/canada/new-2-tax-hike-on-alcohol-takes-effect-wednesday"">New 2% tax hike on alcohol takes effect Wednesday</a>"
3,"Subscriber only.Conrad Black: With Iran war, Trump boxes China in",https://nationalpost.com/opinion/conrad-black-with-iran-war-trump-boxes-china-in,"<a href=""https://nationalpost.com/opinion/conrad-black-with-iran-war-trump-boxes-china-in"">Subscriber only.Conrad Black: With Iran war, Trump boxes China in</a>"
4,UN watchdog bashes Mark Carney's 'procedural theatre' on Iran war,https://nationalpost.com/news/mark-carney-iran-war,"<a href=""https://nationalpost.com/news/mark-carney-iran-war"">UN watchdog bashes Mark Carney's 'procedural theatre' on Iran war</a>"
5,Jesse Kline: Tell me again why Air Canada must be officially bilingual,https://nationalpost.com/opinion/tell-me-again-why-air-canada-must-be-officially-bilingual,"<a href=""https://nationalpost.com/opinion/tell-me-again-why-air-canada-must-be-officially-bilingual"">Jesse Kline: Tell me again why Air Canada must be officially bilingual</a>"
