Rank,Article title,url,title_with_link
1,Kevin Klein: Human rights museum can no longer avoid questions over Nakba exhibit,https://nationalpost.com/opinion/human-rights-museum-can-no-longer-avoid-questions-over-nakba-exhibit,"<a href=""https://nationalpost.com/opinion/human-rights-museum-can-no-longer-avoid-questions-over-nakba-exhibit"">Kevin Klein: Human rights museum can no longer avoid questions over Nakba exhibit</a>"
2,Maya Gebala has started communicating using a tablet in what her mom calls 'incredible strides',https://nationalpost.com/news/canada/maya-gebala-tumbler-ridge-communicating,"<a href=""https://nationalpost.com/news/canada/maya-gebala-tumbler-ridge-communicating"">Maya Gebala has started communicating using a tablet in what her mom calls 'incredible strides'</a>"
3,Jamie Sarkonak: Yet another major project derailed over Indigenous spat,https://nationalpost.com/opinion/jamie-sarkonak-yet-another-major-project-derailed-by-an-indigenous-spat,"<a href=""https://nationalpost.com/opinion/jamie-sarkonak-yet-another-major-project-derailed-by-an-indigenous-spat"">Jamie Sarkonak: Yet another major project derailed over Indigenous spat</a>"
4,Small rodents may be to blame for the changes in Canada’s pesticide laws. Here's why,https://nationalpost.com/news/small-rodents-are-to-blame-for-the-changes-in-canadas-pesticide-laws-heres-why,"<a href=""https://nationalpost.com/news/small-rodents-are-to-blame-for-the-changes-in-canadas-pesticide-laws-heres-why"">Small rodents may be to blame for the changes in Canada’s pesticide laws. Here's why</a>"
5,Italy cancels U.S. trip after Meloni denies Trump's claim she 'begged for a photo',https://nationalpost.com/news/world/trump-meloni-photo-foreign-minister,"<a href=""https://nationalpost.com/news/world/trump-meloni-photo-foreign-minister"">Italy cancels U.S. trip after Meloni denies Trump's claim she 'begged for a photo'</a>"
