Rank,Article title,url,title_with_link
1,Bryan Brulotte: America is quietly and softly defaulting on its debt,https://nationalpost.com/opinion/bryan-brulotte-america-is-quietly-and-softly-defaulting-on-its-debt,"<a href=""https://nationalpost.com/opinion/bryan-brulotte-america-is-quietly-and-softly-defaulting-on-its-debt"">Bryan Brulotte: America is quietly and softly defaulting on its debt</a>"
2,The Tumbler Ridge shooter was a trans female. How rare is that?,https://nationalpost.com/news/canada/the-tumbler-ridge-shooter-was-a-trans-female-how-rare-is-that,"<a href=""https://nationalpost.com/news/canada/the-tumbler-ridge-shooter-was-a-trans-female-how-rare-is-that"">The Tumbler Ridge shooter was a trans female. How rare is that?</a>"
3,FIRST READING: University of Alberta to become first to abandon race-centric hiring,https://nationalpost.com/opinion/university-of-alberta-to-become-first-to-abandon-race-centric-hiring,"<a href=""https://nationalpost.com/opinion/university-of-alberta-to-become-first-to-abandon-race-centric-hiring"">FIRST READING: University of Alberta to become first to abandon race-centric hiring</a>"
4,Terry Newman: The isolation that triggered the Tumbler Ridge tragedy,https://nationalpost.com/opinion/canadas-troubling-history-of-school-shootings,"<a href=""https://nationalpost.com/opinion/canadas-troubling-history-of-school-shootings"">Terry Newman: The isolation that triggered the Tumbler Ridge tragedy</a>"
5,FIRST READING: The little-noticed Carney plan to ignore most of the laws,https://nationalpost.com/opinion/little-noticed-carney-plan-to-ignore-most-of-the-laws,"<a href=""https://nationalpost.com/opinion/little-noticed-carney-plan-to-ignore-most-of-the-laws"">FIRST READING: The little-noticed Carney plan to ignore most of the laws</a>"
