Rank,Article title,url,title_with_link
1,"Lockdown lifted after civilian, police officer and suspect killed in Montreal shootings",https://nationalpost.com/montreal-news/update-civilian-police-officer-and-suspect-dead-after-cote-des-neiges-shooting/wcm/2c33eddb-a9b5-407f-9e29-086e6893c3ea,"<a href=""https://nationalpost.com/montreal-news/update-civilian-police-officer-and-suspect-dead-after-cote-des-neiges-shooting/wcm/2c33eddb-a9b5-407f-9e29-086e6893c3ea"">Lockdown lifted after civilian, police officer and suspect killed in Montreal shootings</a>"
2,Jewish board member resigns over Nakba exhibit at Canadian human rights museum,https://nationalpost.com/news/canada/jewish-board-member-resigns-over-nakba-exhibit-at-canadian-human-rights-museum,"<a href=""https://nationalpost.com/news/canada/jewish-board-member-resigns-over-nakba-exhibit-at-canadian-human-rights-museum"">Jewish board member resigns over Nakba exhibit at Canadian human rights museum</a>"
3,Trump administration growing impatient with Canada’s delayed F-35 choice,https://nationalpost.com/news/trump-administration-growing-impatient-with-canadas-delayed-f-35-choice,"<a href=""https://nationalpost.com/news/trump-administration-growing-impatient-with-canadas-delayed-f-35-choice"">Trump administration growing impatient with Canada’s delayed F-35 choice</a>"
4,Ben Woodfinden: Finally — new Supreme Court justice doesn't think he's above Parliament,https://nationalpost.com/opinion/ben-woodfinden-finally-new-supreme-court-justice-doesnt-think-he-is-above-parliament,"<a href=""https://nationalpost.com/opinion/ben-woodfinden-finally-new-supreme-court-justice-doesnt-think-he-is-above-parliament"">Ben Woodfinden: Finally — new Supreme Court justice doesn't think he's above Parliament</a>"
5,Michael Murphy: Keir Starmer offered Britain nothing,https://nationalpost.com/opinion/keir-starmer-offered-britain-nothing,"<a href=""https://nationalpost.com/opinion/keir-starmer-offered-britain-nothing"">Michael Murphy: Keir Starmer offered Britain nothing</a>"
