Rank,Article title,url,title_with_link
1,"Second U.S. plane crashes in Gulf after F-15 downed, NYT says",https://nationalpost.com/news/world/israel-middle-east/u-s-mounts-rescue-operation-for-f-15-fighter-jet-downed-in-iran,"<a href=""https://nationalpost.com/news/world/israel-middle-east/u-s-mounts-rescue-operation-for-f-15-fighter-jet-downed-in-iran"">Second U.S. plane crashes in Gulf after F-15 downed, NYT says</a>"
2,Collin May: The Canadian Bar Association just disgracefully attacked freedom of the press,https://nationalpost.com/opinion/collin-may-the-canadian-bar-association-just-disgracefully-attacked-freedom-of-the-press,"<a href=""https://nationalpost.com/opinion/collin-may-the-canadian-bar-association-just-disgracefully-attacked-freedom-of-the-press"">Collin May: The Canadian Bar Association just disgracefully attacked freedom of the press</a>"
3,Sabrina Maddeaux: Liberals won't admit that immigration system has been corrupted,https://nationalpost.com/opinion/sabrina-maddeaux,"<a href=""https://nationalpost.com/opinion/sabrina-maddeaux"">Sabrina Maddeaux: Liberals won't admit that immigration system has been corrupted</a>"
4,Toronto Shen Yun shows cancelled over 'non-credible' threats organizers blame on China Communist Party,https://nationalpost.com/news/canada/toronto-shen-yun-shows-cancelled-over-non-credible-threats-organizers-blame-on-china-communist-party,"<a href=""https://nationalpost.com/news/canada/toronto-shen-yun-shows-cancelled-over-non-credible-threats-organizers-blame-on-china-communist-party"">Toronto Shen Yun shows cancelled over 'non-credible' threats organizers blame on China Communist Party</a>"
5,"Canada should expect 'hostility' with U.S. trade talks less than three months away, trade analysts say",https://nationalpost.com/news/canada-should-expect-hostility-with-u-s-trade-talks-less-than-three-months-away-trade-analysts-say,"<a href=""https://nationalpost.com/news/canada-should-expect-hostility-with-u-s-trade-talks-less-than-three-months-away-trade-analysts-say"">Canada should expect 'hostility' with U.S. trade talks less than three months away, trade analysts say</a>"
