Rank,Article title,url,title_with_link
1,Opinion: Canada wasn't 'stolen' from Indigenous people,https://nationalpost.com/opinion/opinion-canada-wasnt-stolen-from-indigenous-people,"<a href=""https://nationalpost.com/opinion/opinion-canada-wasnt-stolen-from-indigenous-people"">Opinion: Canada wasn't 'stolen' from Indigenous people</a>"
2,'The worst is behind us': Canada's economy is defying some of the grim forecasts about Trump's tariffs,https://nationalpost.com/news/the-worst-is-behind-us-canadas-economy-is-defying-some-of-the-grim-forecasts-about-trumps-tariffs,"<a href=""https://nationalpost.com/news/the-worst-is-behind-us-canadas-economy-is-defying-some-of-the-grim-forecasts-about-trumps-tariffs"">'The worst is behind us': Canada's economy is defying some of the grim forecasts about Trump's tariffs</a>"
3,"Carney declares end to Canada's 'feminist foreign policy,' breaking from Trudeau era doctrine",https://nationalpost.com/news/canada/mark-carney-canada-feminist-foreign-policy,"<a href=""https://nationalpost.com/news/canada/mark-carney-canada-feminist-foreign-policy"">Carney declares end to Canada's 'feminist foreign policy,' breaking from Trudeau era doctrine</a>"
4,Chris Selley: Toronto's nightmare is apparently neighbourhood shops and cafés,https://nationalpost.com/opinion/chris-selley-torontos-nightmare-is-apparently-neighbourhood-shops-and-cafes,"<a href=""https://nationalpost.com/opinion/chris-selley-torontos-nightmare-is-apparently-neighbourhood-shops-and-cafes"">Chris Selley: Toronto's nightmare is apparently neighbourhood shops and cafés</a>"
5,Geoff Russ: Liberal nationalism is a cringey failure. The new right can step up,https://nationalpost.com/opinion/geoff-russ-5,"<a href=""https://nationalpost.com/opinion/geoff-russ-5"">Geoff Russ: Liberal nationalism is a cringey failure. The new right can step up</a>"
