Rank,Article title,url,title_with_link
1,"Woman, 77, who went overboard on cruise not located after eight-hour search",https://nationalpost.com/news/world/woman-overboard-cruise-not-located,"<a href=""https://nationalpost.com/news/world/woman-overboard-cruise-not-located"">Woman, 77, who went overboard on cruise not located after eight-hour search</a>"
2,"Somaliland denies that Israeli recognition was based on accepting Gazans, IDF base",https://nationalpost.com/news/world/israel-middle-east/somaliland-israeli-recognition,"<a href=""https://nationalpost.com/news/world/israel-middle-east/somaliland-israeli-recognition"">Somaliland denies that Israeli recognition was based on accepting Gazans, IDF base</a>"
3,Nearly five million visas were set to expire in 2025. Where are the visa holders now?,https://nationalpost.com/opinion/where-are-expired-visa-holders-now,"<a href=""https://nationalpost.com/opinion/where-are-expired-visa-holders-now"">Nearly five million visas were set to expire in 2025. Where are the visa holders now?</a>"
4,Ontario judge reluctantly accedes to 'very lenient' sentence for drug dealer who terrorized two women,https://nationalpost.com/news/canada/ontario-judge-accedes-to-very-lenient-sentence-for-drug-dealer-who-terrorized-two-women,"<a href=""https://nationalpost.com/news/canada/ontario-judge-accedes-to-very-lenient-sentence-for-drug-dealer-who-terrorized-two-women"">Ontario judge reluctantly accedes to 'very lenient' sentence for drug dealer who terrorized two women</a>"
5,'Hot girls on SSRIs': Antidepressants are trending on TikTok. Not everyone is happy about that,https://nationalpost.com/news/antidepressants-trending-tiktok,"<a href=""https://nationalpost.com/news/antidepressants-trending-tiktok"">'Hot girls on SSRIs': Antidepressants are trending on TikTok. Not everyone is happy about that</a>"
