Rank,Article title,url,title_with_link
1,Amy Hamm: The American right succumbs to cancel culture,https://nationalpost.com/opinion/the-american-right-succumbs-to-cancel-culture?itm_source=trending,"<a href=""https://nationalpost.com/opinion/the-american-right-succumbs-to-cancel-culture?itm_source=trending"">Amy Hamm: The American right succumbs to cancel culture</a>"
2,Vegas-bound woman on American Airlines flight restrained with duct tape after alleged attack on attendant,https://nationalpost.com/news/world/vegas-bound-woman-on-american-airlines-flight-restrained-with-duct-tape-after-alleged-attack-on-attendant?itm_source=trending,"<a href=""https://nationalpost.com/news/world/vegas-bound-woman-on-american-airlines-flight-restrained-with-duct-tape-after-alleged-attack-on-attendant?itm_source=trending"">Vegas-bound woman on American Airlines flight restrained with duct tape after alleged attack on attendant</a>"
3,'Gut punch': Canadians diagnosed with cancer in emergency don't know when they will be treated,https://nationalpost.com/news/gut-punch-canadians-diagnosed-with-cancer-in-emergency-sent-home-without-treatment-study-finds?itm_source=trending,"<a href=""https://nationalpost.com/news/gut-punch-canadians-diagnosed-with-cancer-in-emergency-sent-home-without-treatment-study-finds?itm_source=trending"">'Gut punch': Canadians diagnosed with cancer in emergency don't know when they will be treated</a>"
4,"FIRST READING: Diversity mandates killing Canadian science, famed academic tells Commons committee",https://nationalpost.com/opinion/diversity-mandates-killing-canadian-science-famed-academic-tells-commons-committee?itm_source=trending,"<a href=""https://nationalpost.com/opinion/diversity-mandates-killing-canadian-science-famed-academic-tells-commons-committee?itm_source=trending"">FIRST READING: Diversity mandates killing Canadian science, famed academic tells Commons committee</a>"
5,Kerry Sun: Carney invites the Supreme Court to rewrite the Constitution — at democracy's peril,https://nationalpost.com/opinion/kerry-sun-carney-invites-the-supreme-court-to-rewrite-the-constitution-at-democracys-peril?itm_source=trending,"<a href=""https://nationalpost.com/opinion/kerry-sun-carney-invites-the-supreme-court-to-rewrite-the-constitution-at-democracys-peril?itm_source=trending"">Kerry Sun: Carney invites the Supreme Court to rewrite the Constitution — at democracy's peril</a>"
