Rank,Article title,url,title_with_link
1,Government plans to boost Canadian Forces with foreign recruits,https://nationalpost.com/news/canada/government-plans-to-boost-canadian-forces-with-foreign-recruits,"<a href=""https://nationalpost.com/news/canada/government-plans-to-boost-canadian-forces-with-foreign-recruits"">Government plans to boost Canadian Forces with foreign recruits</a>"
2,"Terry Newman: Apparently, everything is discrimination now",https://nationalpost.com/opinion/terry-newman-apparently-everything-is-discrimination-now,"<a href=""https://nationalpost.com/opinion/terry-newman-apparently-everything-is-discrimination-now"">Terry Newman: Apparently, everything is discrimination now</a>"
3,"John Robson: In Mark Carney's Canada, nothing matters",https://nationalpost.com/opinion/john-robson-in-mark-carneys-canada-nothing-matters,"<a href=""https://nationalpost.com/opinion/john-robson-in-mark-carneys-canada-nothing-matters"">John Robson: In Mark Carney's Canada, nothing matters</a>"
4,Beyond the spin: Why the job boom in the U.S. and Canada is a mirage,https://nationalpost.com/news/beyond-the-spin-why-the-job-boom-in-the-u-s-and-canada-is-a-mirage,"<a href=""https://nationalpost.com/news/beyond-the-spin-why-the-job-boom-in-the-u-s-and-canada-is-a-mirage"">Beyond the spin: Why the job boom in the U.S. and Canada is a mirage</a>"
5,Photos show former prince Andrew leaving police station after being questioned for almost 12 hours,https://nationalpost.com/news/world/ex-prince-andrew-arrested-on-suspicion-of-misconduct,"<a href=""https://nationalpost.com/news/world/ex-prince-andrew-arrested-on-suspicion-of-misconduct"">Photos show former prince Andrew leaving police station after being questioned for almost 12 hours</a>"
