Rank,Article title,url,title_with_link
1,The failure of elbows up Carney,https://nationalpost.com/opinion/the-failure-of-elbows-up-carney,"<a href=""https://nationalpost.com/opinion/the-failure-of-elbows-up-carney"">The failure of elbows up Carney</a>"
2,Michael Higgins: It's not reconciliation when law societies exaggerate anomalies as 'graves',https://nationalpost.com/opinion/michael-higgins-its-not-reconciliation-when-law-societies-exaggerate-anomalies-as-graves,"<a href=""https://nationalpost.com/opinion/michael-higgins-its-not-reconciliation-when-law-societies-exaggerate-anomalies-as-graves"">Michael Higgins: It's not reconciliation when law societies exaggerate anomalies as 'graves'</a>"
3,An RCMP legend and why it took decades to solve the mystery of the missing Mountie,https://nationalpost.com/feature/mystery-of-the-buried-mountie,"<a href=""https://nationalpost.com/feature/mystery-of-the-buried-mountie"">An RCMP legend and why it took decades to solve the mystery of the missing Mountie</a>"
4,'Death by organ donation': Doctors raise possibility of retrieving organs from MAID patients while they are still alive,https://nationalpost.com/news/death-by-organ-donation-for-maid-patients,"<a href=""https://nationalpost.com/news/death-by-organ-donation-for-maid-patients"">'Death by organ donation': Doctors raise possibility of retrieving organs from MAID patients while they are still alive</a>"
5,"Josh Dehaas: Aboriginal title claims should be proven in courts, not signed away by governments",https://nationalpost.com/opinion/josh-dehaas-aboriginal-title-claims-should-be-proven-in-courts-not-signed-away-by-governments,"<a href=""https://nationalpost.com/opinion/josh-dehaas-aboriginal-title-claims-should-be-proven-in-courts-not-signed-away-by-governments"">Josh Dehaas: Aboriginal title claims should be proven in courts, not signed away by governments</a>"
