Rank,Article title,url,title_with_link
1,"Joël Lightbound, Carney's new pick as Quebec lieutenant, has a long history of being unpredictable",https://nationalpost.com/news/joel-lightbound-carneys-new-pick-as-quebec-lieutenant-has-a-long-history-of-being-unpredictable,"<a href=""https://nationalpost.com/news/joel-lightbound-carneys-new-pick-as-quebec-lieutenant-has-a-long-history-of-being-unpredictable"">Joël Lightbound, Carney's new pick as Quebec lieutenant, has a long history of being unpredictable</a>"
2,"Canadian with an American spouse could raise a red flag at the U.S.-Canada border, lawyer says",https://nationalpost.com/news/canada/canadian-american-travel-red-flags-lawyer,"<a href=""https://nationalpost.com/news/canada/canadian-american-travel-red-flags-lawyer"">Canadian with an American spouse could raise a red flag at the U.S.-Canada border, lawyer says</a>"
3,FIRST READING: How an Albertan anti-separatist may have accidentally triggered a separation referendum,https://nationalpost.com/opinion/how-an-albertan-anti-separatist-may-have-accidentally-triggered-a-separation-referendum,"<a href=""https://nationalpost.com/opinion/how-an-albertan-anti-separatist-may-have-accidentally-triggered-a-separation-referendum"">FIRST READING: How an Albertan anti-separatist may have accidentally triggered a separation referendum</a>"
4,"Service Canada offers limited apology, 'no accountability' for telling Jewish Montrealer she couldn't name Israel as birth country",https://nationalpost.com/news/canada/service-canada-offers-limited-apology-no-accountability-for-telling-jewish-montrealer-she-couldnt-name-israel-as-birth-country,"<a href=""https://nationalpost.com/news/canada/service-canada-offers-limited-apology-no-accountability-for-telling-jewish-montrealer-she-couldnt-name-israel-as-birth-country"">Service Canada offers limited apology, 'no accountability' for telling Jewish Montrealer she couldn't name Israel as birth country</a>"
5,Adam Pankratz: UNDRIP is strangling Canada's economy,https://nationalpost.com/opinion/undrip-is-strangling-canadas-economy,"<a href=""https://nationalpost.com/opinion/undrip-is-strangling-canadas-economy"">Adam Pankratz: UNDRIP is strangling Canada's economy</a>"
