Rank,Article title,url,title_with_link
1,"Canadians need an income of $155,850 to be happy, researchers say. Map shows cost per city",https://nationalpost.com/news/money-can-buy-happiness-researchers-say-they-even-put-a-price-on-it-for-canadians,"<a href=""https://nationalpost.com/news/money-can-buy-happiness-researchers-say-they-even-put-a-price-on-it-for-canadians"">Canadians need an income of $155,850 to be happy, researchers say. Map shows cost per city</a>"
2,Amy Hamm: Boomers drunk on CBC are the source of Carney's power,https://nationalpost.com/opinion/amy-hamm-boomers-drunk-on-cbc-is-the-source-of-carneys-power,"<a href=""https://nationalpost.com/opinion/amy-hamm-boomers-drunk-on-cbc-is-the-source-of-carneys-power"">Amy Hamm: Boomers drunk on CBC are the source of Carney's power</a>"
3,Colby Cosh: Why Mark Carney felt comfortable spreading misinformation,https://nationalpost.com/opinion/colby-cosh-why-mark-carney-felt-comfortable-spreading-misinformation,"<a href=""https://nationalpost.com/opinion/colby-cosh-why-mark-carney-felt-comfortable-spreading-misinformation"">Colby Cosh: Why Mark Carney felt comfortable spreading misinformation</a>"
4,Terry Glavin: Carney's global quest for photo ops comes with crippling compromises,https://nationalpost.com/opinion/terry-glavin-carneys-global-quest-for-photo-ops-comes-with-crippling-compromises,"<a href=""https://nationalpost.com/opinion/terry-glavin-carneys-global-quest-for-photo-ops-comes-with-crippling-compromises"">Terry Glavin: Carney's global quest for photo ops comes with crippling compromises</a>"
5,Canada's only operational submarine just sank a U.S. warship,https://nationalpost.com/news/canadian-submarine-sinks-u-s-warship-hawaii,"<a href=""https://nationalpost.com/news/canadian-submarine-sinks-u-s-warship-hawaii"">Canada's only operational submarine just sank a U.S. warship</a>"
