Rank,Article title,url,title_with_link
1,Scott Stinson: Trump threatens to tariff Canada over 'filthy air' after Ford blasts U.S. for wildfire 'chirping',https://nationalpost.com/opinion/doug-ford-united-states-ontario-wildfires,"<a href=""https://nationalpost.com/opinion/doug-ford-united-states-ontario-wildfires"">Scott Stinson: Trump threatens to tariff Canada over 'filthy air' after Ford blasts U.S. for wildfire 'chirping'</a>"
2,Mistrial declared for Frank Stronach's sex assault conviction after complainant's lawyer makes 'bizarre' request for money,https://nationalpost.com/news/canada/frank-stronach-seeks-mistrial,"<a href=""https://nationalpost.com/news/canada/frank-stronach-seeks-mistrial"">Mistrial declared for Frank Stronach's sex assault conviction after complainant's lawyer makes 'bizarre' request for money</a>"
3,Michael Higgins: There's no justice in jailing people for residential school 'denialism',https://nationalpost.com/opinion/michael-higgins-theres-no-justice-in-jailing-people-for-residential-school-denialism,"<a href=""https://nationalpost.com/opinion/michael-higgins-theres-no-justice-in-jailing-people-for-residential-school-denialism"">Michael Higgins: There's no justice in jailing people for residential school 'denialism'</a>"
4,"Alberta ranches may count for land-conservation targets, federal minister signals amid impasse with province",https://nationalpost.com/news/canada/alberta-ranches-federal-land-conservation,"<a href=""https://nationalpost.com/news/canada/alberta-ranches-federal-land-conservation"">Alberta ranches may count for land-conservation targets, federal minister signals amid impasse with province</a>"
5,Marco Rubio: The greatest terror threat facing the world now comes from the far left,https://nationalpost.com/opinion/the-greatest-terror-threat-facing-the-world-now-comes-from-the-far-left,"<a href=""https://nationalpost.com/opinion/the-greatest-terror-threat-facing-the-world-now-comes-from-the-far-left"">Marco Rubio: The greatest terror threat facing the world now comes from the far left</a>"
