Rank,Article title,url,title_with_link
1,"Carney's in-flight menu includes fine wine, braised beef and 'luxury' butter: Canadian Taxpayers Federation",https://nationalpost.com/news/canada/carneys-in-flight-menu-includes-fine-wine-braised-beef-and-luxury-butter-canadian-taxpayers-federation,"<a href=""https://nationalpost.com/news/canada/carneys-in-flight-menu-includes-fine-wine-braised-beef-and-luxury-butter-canadian-taxpayers-federation"">Carney's in-flight menu includes fine wine, braised beef and 'luxury' butter: Canadian Taxpayers Federation</a>"
2,Sunwing pilot fired over fried chicken and watermelon order sent to Black supervisor,https://nationalpost.com/news/canada/sunwing-pilot-fired,"<a href=""https://nationalpost.com/news/canada/sunwing-pilot-fired"">Sunwing pilot fired over fried chicken and watermelon order sent to Black supervisor</a>"
3,Canada is ‘on notice’: Ottawa turns to Saab as U.S. defence pressure builds,https://nationalpost.com/news/canada-is-on-notice-ottawa-turns-to-saab-as-u-s-defense-pressure-builds,"<a href=""https://nationalpost.com/news/canada-is-on-notice-ottawa-turns-to-saab-as-u-s-defense-pressure-builds"">Canada is ‘on notice’: Ottawa turns to Saab as U.S. defence pressure builds</a>"
4,Michael Higgins: CBC couldn't imagine antisemitism was behind torn posters of missing girl,https://nationalpost.com/opinion/michael-higgins-cbc-cant-imagine-antisemitism-was-behind-torn-posters-of-missing-girl,"<a href=""https://nationalpost.com/opinion/michael-higgins-cbc-cant-imagine-antisemitism-was-behind-torn-posters-of-missing-girl"">Michael Higgins: CBC couldn't imagine antisemitism was behind torn posters of missing girl</a>"
5,"Avi Lewis calls Alberta separatists 'MAGA-aligned,' 'disruptive,' despite NDP endorsing Quebec independence option",https://nationalpost.com/news/alberta-and-quebec-separatist-movements-not-the-same-lewis,"<a href=""https://nationalpost.com/news/alberta-and-quebec-separatist-movements-not-the-same-lewis"">Avi Lewis calls Alberta separatists 'MAGA-aligned,' 'disruptive,' despite NDP endorsing Quebec independence option</a>"
