Rank,Article title,url,title_with_link
1,Opinion: Canada wasn't 'stolen' from Indigenous people,https://nationalpost.com/opinion/opinion-canada-wasnt-stolen-from-indigenous-people,"<a href=""https://nationalpost.com/opinion/opinion-canada-wasnt-stolen-from-indigenous-people"">Opinion: Canada wasn't 'stolen' from Indigenous people</a>"
2,'The worst is behind us': Canada's economy is defying some of the grim forecasts about Trump's tariffs,https://nationalpost.com/news/the-worst-is-behind-us-canadas-economy-is-defying-some-of-the-grim-forecasts-about-trumps-tariffs,"<a href=""https://nationalpost.com/news/the-worst-is-behind-us-canadas-economy-is-defying-some-of-the-grim-forecasts-about-trumps-tariffs"">'The worst is behind us': Canada's economy is defying some of the grim forecasts about Trump's tariffs</a>"
3,"Carney declares end to Canada's 'feminist foreign policy,' breaking from Trudeau era doctrine",https://nationalpost.com/news/canada/mark-carney-canada-feminist-foreign-policy,"<a href=""https://nationalpost.com/news/canada/mark-carney-canada-feminist-foreign-policy"">Carney declares end to Canada's 'feminist foreign policy,' breaking from Trudeau era doctrine</a>"
4,Subscriber only.FIRST READING: The pieces of Canada that could be declared Aboriginal land next,https://nationalpost.com/opinion/first-reading-the-pieces-of-canada-that-could-be-declared-aboriginal-land-next,"<a href=""https://nationalpost.com/opinion/first-reading-the-pieces-of-canada-that-could-be-declared-aboriginal-land-next"">Subscriber only.FIRST READING: The pieces of Canada that could be declared Aboriginal land next</a>"
5,Beloved Bollywood star Dharmendra dies at 89,https://nationalpost.com/news/world/dharmendra-dies-at-89,"<a href=""https://nationalpost.com/news/world/dharmendra-dies-at-89"">Beloved Bollywood star Dharmendra dies at 89</a>"
