Rank,Article title,url,title_with_link
1,David Eby says Alberta separatists are committing 'treason.' Is he right?,https://nationalpost.com/news/politics/david-eby-says-alberta-separatists-are-committing-treason-is-he-right,"<a href=""https://nationalpost.com/news/politics/david-eby-says-alberta-separatists-are-committing-treason-is-he-right"">David Eby says Alberta separatists are committing 'treason.' Is he right?</a>"
2,"Yuan Yi Zhu: Face it, Carney just doesn't know much about Canada",https://nationalpost.com/opinion/yuan-yi-zhu-face-it-carney-just-doesnt-know-much-about-canada,"<a href=""https://nationalpost.com/opinion/yuan-yi-zhu-face-it-carney-just-doesnt-know-much-about-canada"">Yuan Yi Zhu: Face it, Carney just doesn't know much about Canada</a>"
3,"'Brilliant, fearless, deeply original, and so full of humanity' Catherine O'Hara dead at 71",https://nationalpost.com/news/canada/catherine-ohara-dies-at-71,"<a href=""https://nationalpost.com/news/canada/catherine-ohara-dies-at-71"">'Brilliant, fearless, deeply original, and so full of humanity' Catherine O'Hara dead at 71</a>"
4,"Big revenue, trade leverage, and industrial perks: Why Trump’s $264B tariff haul will be hard to give up",https://nationalpost.com/news/big-revenue-trade-leverage-and-industrial-perks-why-trumps-264b-tariff-haul-will-be-hard-to-give-up,"<a href=""https://nationalpost.com/news/big-revenue-trade-leverage-and-industrial-perks-why-trumps-264b-tariff-haul-will-be-hard-to-give-up"">Big revenue, trade leverage, and industrial perks: Why Trump’s $264B tariff haul will be hard to give up</a>"
5,"Chris Selley: Ontario minister gobsmacked by admired British public school, but we won't imitate it here",https://nationalpost.com/opinion/chris-selley-ontario-minister-gobsmacked-by-admired-british-public-school-but-we-wont-imitate-it-here,"<a href=""https://nationalpost.com/opinion/chris-selley-ontario-minister-gobsmacked-by-admired-british-public-school-but-we-wont-imitate-it-here"">Chris Selley: Ontario minister gobsmacked by admired British public school, but we won't imitate it here</a>"
