Rank,Article title,url,title_with_link
1,CRA ordered to pay nearly $10K in court costs after tax decision ruled 'unreasonable' by judge,https://nationalpost.com/news/canada/cra-phone-call-toronto-firm,"<a href=""https://nationalpost.com/news/canada/cra-phone-call-toronto-firm"">CRA ordered to pay nearly $10K in court costs after tax decision ruled 'unreasonable' by judge</a>"
2,"Older, 70% white, plunging fertility and lost faith: Who Canada is now",https://nationalpost.com/feature/canadas-demographics-problem-immigration,"<a href=""https://nationalpost.com/feature/canadas-demographics-problem-immigration"">Older, 70% white, plunging fertility and lost faith: Who Canada is now</a>"
3,FIRST READING: The unprecedented expansion of federal Indigenous spending,https://nationalpost.com/opinion/unprecedented-expansion-of-federal-indigenous-spending,"<a href=""https://nationalpost.com/opinion/unprecedented-expansion-of-federal-indigenous-spending"">FIRST READING: The unprecedented expansion of federal Indigenous spending</a>"
4,Stuart Thomson: The looming tech backlash may have just started on a farm in Ireland,https://nationalpost.com/opinion/stuart-thomson-the-looming-tech-backlash-may-have-just-started-on-a-farm-in-ireland,"<a href=""https://nationalpost.com/opinion/stuart-thomson-the-looming-tech-backlash-may-have-just-started-on-a-farm-in-ireland"">Stuart Thomson: The looming tech backlash may have just started on a farm in Ireland</a>"
5,"Alberta boy, 9, sues 11-year-old for injuring his finger with a toy dinosaur at daycare",https://nationalpost.com/news/canada/child-lawsuit-alberta,"<a href=""https://nationalpost.com/news/canada/child-lawsuit-alberta"">Alberta boy, 9, sues 11-year-old for injuring his finger with a toy dinosaur at daycare</a>"
