Rank,Article title,url,title_with_link
1,Conservative MP Matt Jeneroux resigns from Parliament after floor-crossing rumours,https://nationalpost.com/news/politics/conservative-mp-matt-jeneroux-resigns-from-parliament,"<a href=""https://nationalpost.com/news/politics/conservative-mp-matt-jeneroux-resigns-from-parliament"">Conservative MP Matt Jeneroux resigns from Parliament after floor-crossing rumours</a>"
2,'Goodwill policy': What Canadian airlines are telling travellers after 40 U.S. airports face flight reductions,https://nationalpost.com/news/canada/flights-us-airports-canadian-travellers,"<a href=""https://nationalpost.com/news/canada/flights-us-airports-canadian-travellers"">'Goodwill policy': What Canadian airlines are telling travellers after 40 U.S. airports face flight reductions</a>"
3,'Manufactured crisis': Fentanyl seized at Canadian border by U.S. authorities plummets,https://nationalpost.com/news/canada/united-states-canada-border-fentanyl,"<a href=""https://nationalpost.com/news/canada/united-states-canada-border-fentanyl"">'Manufactured crisis': Fentanyl seized at Canadian border by U.S. authorities plummets</a>"
4,"How Carney's budget could affect your wallet, from a $150 cheque to a $1.5-million yacht",https://nationalpost.com/news/canada/how-carneys-budget-affects-your-wallets-from-a-150-cheque-to-a-1-5-million-yacht,"<a href=""https://nationalpost.com/news/canada/how-carneys-budget-affects-your-wallets-from-a-150-cheque-to-a-1-5-million-yacht"">How Carney's budget could affect your wallet, from a $150 cheque to a $1.5-million yacht</a>"
5,"Bloc, NDP vote with Liberals in first of three confidence budget votes",https://nationalpost.com/news/bloc-ndp-to-vote-with-liberals-in-first-of-three-confidence-budget-votes,"<a href=""https://nationalpost.com/news/bloc-ndp-to-vote-with-liberals-in-first-of-three-confidence-budget-votes"">Bloc, NDP vote with Liberals in first of three confidence budget votes</a>"
