Rank,Article title,url,title_with_link
1,Trump demands ‘at least’ half U.S. ownership of Gordie Howe bridge that Canada is fully paying for,https://nationalpost.com/news/canada/donald-trump-canada-gordie-howe-bridge,"<a href=""https://nationalpost.com/news/canada/donald-trump-canada-gordie-howe-bridge"">Trump demands ‘at least’ half U.S. ownership of Gordie Howe bridge that Canada is fully paying for</a>"
2,Why is Trump angry about the Gordie Howe International Bridge that Canada paid for?,https://nationalpost.com/news/canada/trump-gordie-howe-bridge-canada,"<a href=""https://nationalpost.com/news/canada/trump-gordie-howe-bridge-canada"">Why is Trump angry about the Gordie Howe International Bridge that Canada paid for?</a>"
3,Most Canadians agree that Alberta separatists asking U.S. for help is treasonous: poll,https://nationalpost.com/news/canada/most-canadians-agree-that-alberta-separatists-asking-for-u-s-help-is-treasonous,"<a href=""https://nationalpost.com/news/canada/most-canadians-agree-that-alberta-separatists-asking-for-u-s-help-is-treasonous"">Most Canadians agree that Alberta separatists asking U.S. for help is treasonous: poll</a>"
4,Carney says he looks forward to Gordie Howe bridge opening after Trump threatened to block it,https://nationalpost.com/news/canada/carney-gordie-howe-bridge-trump-threat,"<a href=""https://nationalpost.com/news/canada/carney-gordie-howe-bridge-trump-threat"">Carney says he looks forward to Gordie Howe bridge opening after Trump threatened to block it</a>"
5,Judge knocks year off Métis-Cree woman’s sentence for sexually assaulting 15-year-old,https://nationalpost.com/news/canada/judge-knocks-year-off-metis-cree-womans-sentence-for-sexually-assaulting-15-year-old,"<a href=""https://nationalpost.com/news/canada/judge-knocks-year-off-metis-cree-womans-sentence-for-sexually-assaulting-15-year-old"">Judge knocks year off Métis-Cree woman’s sentence for sexually assaulting 15-year-old</a>"
