Rank,Article title,url,title_with_link
1,"Welland police say a man broke into a home at night, choked and sexually assaulted a young child",https://nationalpost.com/news/canada/welland-police-say-a-man-broke-into-a-home-and-choked-and-sexually-assault-a-young-child-and-left?itm_source=trending,"<a href=""https://nationalpost.com/news/canada/welland-police-say-a-man-broke-into-a-home-and-choked-and-sexually-assault-a-young-child-and-left?itm_source=trending"">Welland police say a man broke into a home at night, choked and sexually assaulted a young child</a>"
2,Subscriber only.FIRST READING: The wacky Charter rights Canadian courts keep finding (like a right to bike lanes),https://nationalpost.com/opinion/he-wacky-charter-rights-canadian-courts-keep-finding-like-a-right-to-bike-lanes?itm_source=trending,"<a href=""https://nationalpost.com/opinion/he-wacky-charter-rights-canadian-courts-keep-finding-like-a-right-to-bike-lanes?itm_source=trending"">Subscriber only.FIRST READING: The wacky Charter rights Canadian courts keep finding (like a right to bike lanes)</a>"
3,What is 'carbon tax 2.0' and how will axing it boost Canadians' income? Here's what we know,https://nationalpost.com/news/canada/what-is-carbon-tax-2-0?itm_source=trending,"<a href=""https://nationalpost.com/news/canada/what-is-carbon-tax-2-0?itm_source=trending"">What is 'carbon tax 2.0' and how will axing it boost Canadians' income? Here's what we know</a>"
4,Colby Cosh: The pure genius of Bob Odenkirk,https://nationalpost.com/opinion/colby-cosh-the-pure-genius-of-bob-odenkirk?itm_source=trending,"<a href=""https://nationalpost.com/opinion/colby-cosh-the-pure-genius-of-bob-odenkirk?itm_source=trending"">Colby Cosh: The pure genius of Bob Odenkirk</a>"
5,Jesse Kline: Ending the war in Gaza not as simple as it may seem,https://nationalpost.com/opinion/ending-the-war-in-gaza-not-as-simple-as-it-may-seem?itm_source=trending,"<a href=""https://nationalpost.com/opinion/ending-the-war-in-gaza-not-as-simple-as-it-may-seem?itm_source=trending"">Jesse Kline: Ending the war in Gaza not as simple as it may seem</a>"
