Rank,Article title,url,title_with_link
1,Air Canada cockpit voice recorder reveals what happened in lead up to LaGuardia crash,https://nationalpost.com/news/canada/air-canada-cockpit-voice-recorder-laguardia-crash,"<a href=""https://nationalpost.com/news/canada/air-canada-cockpit-voice-recorder-laguardia-crash"">Air Canada cockpit voice recorder reveals what happened in lead up to LaGuardia crash</a>"
2,Who's to blame for Air Canada crash at LaGuardia Airport? Here's what we know so far,https://nationalpost.com/news/canada/whos-to-blame-for-air-canada-crash-laguardia-airport,"<a href=""https://nationalpost.com/news/canada/whos-to-blame-for-air-canada-crash-laguardia-airport"">Who's to blame for Air Canada crash at LaGuardia Airport? Here's what we know so far</a>"
3,Gold heist ringleader pleads guilty to theft of $22M in gold and cash from Toronto's Pearson airport,https://nationalpost.com/news/canada/torontos-pearson-airport-gold-heist-guilty-plea,"<a href=""https://nationalpost.com/news/canada/torontos-pearson-airport-gold-heist-guilty-plea"">Gold heist ringleader pleads guilty to theft of $22M in gold and cash from Toronto's Pearson airport</a>"
4,"Air Canada flight attendant ejected from plane and found strapped in jump seat, survives crash: daughter confirms",https://nationalpost.com/news/canada/air-canada-crash-flight-attendant-ejected-jump-seat,"<a href=""https://nationalpost.com/news/canada/air-canada-crash-flight-attendant-ejected-jump-seat"">Air Canada flight attendant ejected from plane and found strapped in jump seat, survives crash: daughter confirms</a>"
5,Chris Selley: The notwithstanding clause is the bulwark against a Canadian 'Trump moment',https://nationalpost.com/opinion/chris-selley-the-notwithstanding-clause-is-the-bulwark-against-a-canadian-trump-moment,"<a href=""https://nationalpost.com/opinion/chris-selley-the-notwithstanding-clause-is-the-bulwark-against-a-canadian-trump-moment"">Chris Selley: The notwithstanding clause is the bulwark against a Canadian 'Trump moment'</a>"
