Rank,Article title,url,title_with_link
1,Tasha Kheiriddin: The Conservatives who could replace Pierre Poilievre,https://nationalpost.com/opinion/the-conservatives-who-could-replace-pierre-poilievre,"<a href=""https://nationalpost.com/opinion/the-conservatives-who-could-replace-pierre-poilievre"">Tasha Kheiriddin: The Conservatives who could replace Pierre Poilievre</a>"
2,Terry Barnes: Anthony Albanese's deadly political calculation,https://nationalpost.com/opinion/terry-barnes-australias-labor-party-abandoned-jews-to-hate-and-violence,"<a href=""https://nationalpost.com/opinion/terry-barnes-australias-labor-party-abandoned-jews-to-hate-and-violence"">Terry Barnes: Anthony Albanese's deadly political calculation</a>"
3,Chris Selley: Toronto's latest transit triumph is $3.7B for a train slower than a bus,https://nationalpost.com/opinion/torontos-latest-transit-triumph-is-3-7b-for-a-train-slower-than-a-bus,"<a href=""https://nationalpost.com/opinion/torontos-latest-transit-triumph-is-3-7b-for-a-train-slower-than-a-bus"">Chris Selley: Toronto's latest transit triumph is $3.7B for a train slower than a bus</a>"
4,FIRST READING: These are not normal floor crossings,https://nationalpost.com/opinion/these-are-not-normal-floor-crossings,"<a href=""https://nationalpost.com/opinion/these-are-not-normal-floor-crossings"">FIRST READING: These are not normal floor crossings</a>"
5,Ron DeSantis mocks Doug Ford's Florida is 'hurting' due to Canadian boycott remark,https://nationalpost.com/news/canada/florida-governor-ron-desantis-tourism-ontario,"<a href=""https://nationalpost.com/news/canada/florida-governor-ron-desantis-tourism-ontario"">Ron DeSantis mocks Doug Ford's Florida is 'hurting' due to Canadian boycott remark</a>"
