Rank,Article title,url,title_with_link
1,What Ontario's anti-tariff ad says vs. what Ronald Reagan said in his speech,https://nationalpost.com/news/canada/ontario-tariff-ad-ronald-reagan,"<a href=""https://nationalpost.com/news/canada/ontario-tariff-ad-ronald-reagan"">What Ontario's anti-tariff ad says vs. what Ronald Reagan said in his speech</a>"
2,Ontario will pull anti-tariff Reagan ads in U.S. after running during two World Series games,https://nationalpost.com/news/politics/trump-says-trade-talks-with-canada-terminated-claiming-ontario-used-fake-anti-tariff-reagan-ad,"<a href=""https://nationalpost.com/news/politics/trump-says-trade-talks-with-canada-terminated-claiming-ontario-used-fake-anti-tariff-reagan-ad"">Ontario will pull anti-tariff Reagan ads in U.S. after running during two World Series games</a>"
3,'Here are the words Trump doesn't want you to see': Politicians react to Ontario's anti-tariff ad,https://nationalpost.com/news/canada/ontario-anti-tariff-ad-politicians-react,"<a href=""https://nationalpost.com/news/canada/ontario-anti-tariff-ad-politicians-react"">'Here are the words Trump doesn't want you to see': Politicians react to Ontario's anti-tariff ad</a>"
4,Vivian Bercovici: Carney undermined U.S. trade negotiations with his anti-Israel policy,https://nationalpost.com/opinion/carney-undermined-u-s-trade-negotiations-with-his-anti-israel-policy,"<a href=""https://nationalpost.com/opinion/carney-undermined-u-s-trade-negotiations-with-his-anti-israel-policy"">Vivian Bercovici: Carney undermined U.S. trade negotiations with his anti-Israel policy</a>"
5,"Joe Rogan, comedian Andrew Schulz puzzled by Canada’s land acknowledgements: ‘Feels like I’m bragging’",https://nationalpost.com/news/canada/andrew-schulz-joe-rogan-land-acknowledgement,"<a href=""https://nationalpost.com/news/canada/andrew-schulz-joe-rogan-land-acknowledgement"">Joe Rogan, comedian Andrew Schulz puzzled by Canada’s land acknowledgements: ‘Feels like I’m bragging’</a>"
