Rank,Article title,url,title_with_link
1,Trump demands ‘at least’ half U.S. ownership of Gordie Howe bridge that Canada is fully paying for,https://nationalpost.com/news/canada/donald-trump-canada-gordie-howe-bridge,"<a href=""https://nationalpost.com/news/canada/donald-trump-canada-gordie-howe-bridge"">Trump demands ‘at least’ half U.S. ownership of Gordie Howe bridge that Canada is fully paying for</a>"
2,Michael Higgins: Jimmy Lai shows the cost of Carney's devil's bargain with China,https://nationalpost.com/opinion/michael-higgins-jimmy-lai-shows-the-cost-of-carneys-devils-bargain-with-china,"<a href=""https://nationalpost.com/opinion/michael-higgins-jimmy-lai-shows-the-cost-of-carneys-devils-bargain-with-china"">Michael Higgins: Jimmy Lai shows the cost of Carney's devil's bargain with China</a>"
3,Most Canadians agree that Alberta separatists asking U.S. for help is treasonous: poll,https://nationalpost.com/news/canada/most-canadians-agree-that-alberta-separatists-asking-for-u-s-help-is-treasonous,"<a href=""https://nationalpost.com/news/canada/most-canadians-agree-that-alberta-separatists-asking-for-u-s-help-is-treasonous"">Most Canadians agree that Alberta separatists asking U.S. for help is treasonous: poll</a>"
4,"Inside the circus that saw Jutta Leerdam, Jake Paul’s fiancée, win gold",https://nationalpost.com/sports/olympics/inside-circus-saw-jutta-leerdam-jake-paul-fiancee-win-gold,"<a href=""https://nationalpost.com/sports/olympics/inside-circus-saw-jutta-leerdam-jake-paul-fiancee-win-gold"">Inside the circus that saw Jutta Leerdam, Jake Paul’s fiancée, win gold</a>"
5,Judge knocks year off Métis-Cree woman’s sentence for sexually assaulting 15-year-old,https://nationalpost.com/news/canada/judge-knocks-year-off-metis-cree-womans-sentence-for-sexually-assaulting-15-year-old,"<a href=""https://nationalpost.com/news/canada/judge-knocks-year-off-metis-cree-womans-sentence-for-sexually-assaulting-15-year-old"">Judge knocks year off Métis-Cree woman’s sentence for sexually assaulting 15-year-old</a>"
