Rank,Article title,url,title_with_link
1,'Never come to the U.S. again!' Video shows alleged border officer yelling at Canadian driver,https://nationalpost.com/news/canada/u-s-customs-and-border-protection-canadian-driver?itm_source=trending,"<a href=""https://nationalpost.com/news/canada/u-s-customs-and-border-protection-canadian-driver?itm_source=trending"">'Never come to the U.S. again!' Video shows alleged border officer yelling at Canadian driver</a>"
2,Caroline Mulroney announces hiring freeze for Ontario's 143 government agencies,https://nationalpost.com/news/canada/caroline-mulroney-hiring-freeze-ontario-143-government-agencies?itm_source=trending,"<a href=""https://nationalpost.com/news/canada/caroline-mulroney-hiring-freeze-ontario-143-government-agencies?itm_source=trending"">Caroline Mulroney announces hiring freeze for Ontario's 143 government agencies</a>"
3,U.S. ambassador says he takes 'great offense at Canadians saying Trump is uninformed',https://nationalpost.com/news/canada/pete-hoekstra-trump-preclearance?itm_source=trending,"<a href=""https://nationalpost.com/news/canada/pete-hoekstra-trump-preclearance?itm_source=trending"">U.S. ambassador says he takes 'great offense at Canadians saying Trump is uninformed'</a>"
4,Freedom Convoy organizer Chris Barber fighting to stop Crown seizing his 'Big Red' truck,https://nationalpost.com/news/canada/freedom-convoy-trucker-chris-barber-big-red?itm_source=trending,"<a href=""https://nationalpost.com/news/canada/freedom-convoy-trucker-chris-barber-big-red?itm_source=trending"">Freedom Convoy organizer Chris Barber fighting to stop Crown seizing his 'Big Red' truck</a>"
5,Subscriber only.Conrad Black: Trump exposes the 'Palestine' charade at UN,https://nationalpost.com/opinion/trump-exposes-the-palestine-charade-at-un?itm_source=trending,"<a href=""https://nationalpost.com/opinion/trump-exposes-the-palestine-charade-at-un?itm_source=trending"">Subscriber only.Conrad Black: Trump exposes the 'Palestine' charade at UN</a>"
