Rank,Article title,url,title_with_link
1,Sophie Grégoire Trudeau opens up about coping with Justin's public romance with Katy Perry,https://nationalpost.com/news/canada/sophie-gregoire-trudeau-coping-with-justins-public-romance,"<a href=""https://nationalpost.com/news/canada/sophie-gregoire-trudeau-coping-with-justins-public-romance"">Sophie Grégoire Trudeau opens up about coping with Justin's public romance with Katy Perry</a>"
2,Subscriber only.John Ivison: Another round of major projects from Carney that don’t live up to the billing,https://nationalpost.com/opinion/ivison-another-round-of-major-projects-from-carney-that-dont-live-up-to-billing,"<a href=""https://nationalpost.com/opinion/ivison-another-round-of-major-projects-from-carney-that-dont-live-up-to-billing"">Subscriber only.John Ivison: Another round of major projects from Carney that don’t live up to the billing</a>"
3,"Carney bets on more critical minerals mining, electricity and liquefied natural gas in latest batch of major projects",https://nationalpost.com/news/politics/carney-bets-on-more-critical-minerals-mining-electricity-and-liquified-natural-gas-in-latest-batch-of-major-projects,"<a href=""https://nationalpost.com/news/politics/carney-bets-on-more-critical-minerals-mining-electricity-and-liquified-natural-gas-in-latest-batch-of-major-projects"">Carney bets on more critical minerals mining, electricity and liquefied natural gas in latest batch of major projects</a>"
4,Jewish group calls raising Palestinian flag at Toronto City Hall 'reckless' as other events planned in Canada,https://nationalpost.com/news/canada/palestinian-flag-raising-canada,"<a href=""https://nationalpost.com/news/canada/palestinian-flag-raising-canada"">Jewish group calls raising Palestinian flag at Toronto City Hall 'reckless' as other events planned in Canada</a>"
5,FIRST READING: The push to have Canadians hear a 'slavery' acknowledgement at public events,https://nationalpost.com/opinion/push-to-have-canadians-hear-slavery-acknowledgement-at-public-events,"<a href=""https://nationalpost.com/opinion/push-to-have-canadians-hear-slavery-acknowledgement-at-public-events"">FIRST READING: The push to have Canadians hear a 'slavery' acknowledgement at public events</a>"
