Rank,Article title,url,title_with_link
1,'We have a lot to lose': Will Trump's visit to China threaten Carney’s diversification?,https://nationalpost.com/news/we-have-a-lot-to-lose-will-trumps-visit-to-china-threaten-carneys-diversification,"<a href=""https://nationalpost.com/news/we-have-a-lot-to-lose-will-trumps-visit-to-china-threaten-carneys-diversification"">'We have a lot to lose': Will Trump's visit to China threaten Carney’s diversification?</a>"
2,Margaret Trudeau makes rare appearance alongside Sophie Grégoire,https://nationalpost.com/news/canada/margaret-trudeau-makes-rare-appearance-alongside-sophie-gregoire,"<a href=""https://nationalpost.com/news/canada/margaret-trudeau-makes-rare-appearance-alongside-sophie-gregoire"">Margaret Trudeau makes rare appearance alongside Sophie Grégoire</a>"
3,Alberta court strikes down independence petition over First Nations complaints,https://nationalpost.com/news/canada/alberta-court-independence-referendum-petition,"<a href=""https://nationalpost.com/news/canada/alberta-court-independence-referendum-petition"">Alberta court strikes down independence petition over First Nations complaints</a>"
4,Amy Hamm: CBC's latest propaganda — pranking Kamloops graves skeptics,https://nationalpost.com/opinion/amy-hamm-cbcs-latest-propaganda-pranking-kamloops-graves-skeptics,"<a href=""https://nationalpost.com/opinion/amy-hamm-cbcs-latest-propaganda-pranking-kamloops-graves-skeptics"">Amy Hamm: CBC's latest propaganda — pranking Kamloops graves skeptics</a>"
5,Canadian schools ditch Mother's and Father's Day celebrations in the name of diversity,https://nationalpost.com/news/canada/canadian-schools-ditch-mothers-and-fathers-day-celebrations-in-the-name-of-diversity,"<a href=""https://nationalpost.com/news/canada/canadian-schools-ditch-mothers-and-fathers-day-celebrations-in-the-name-of-diversity"">Canadian schools ditch Mother's and Father's Day celebrations in the name of diversity</a>"
