Rank,Article title,url,title_with_link
1,FIRST READING: Canada is losing control of a major city to gangsters,https://nationalpost.com/opinion/canada-is-losing-control-of-a-major-city-to-gangsters,"<a href=""https://nationalpost.com/opinion/canada-is-losing-control-of-a-major-city-to-gangsters"">FIRST READING: Canada is losing control of a major city to gangsters</a>"
2,Billionaire former Russian oligarch seeks $350 million from Canada at international tribunal,https://nationalpost.com/news/canada/igor-makarov-sanctions,"<a href=""https://nationalpost.com/news/canada/igor-makarov-sanctions"">Billionaire former Russian oligarch seeks $350 million from Canada at international tribunal</a>"
3,"Truck driver behind Humboldt Broncos bus crash to be deported to India after refugee request denied, lawyer says",https://nationalpost.com/news/canada/truck-driver-humboldt-broncos-bus-crash-deportation,"<a href=""https://nationalpost.com/news/canada/truck-driver-humboldt-broncos-bus-crash-deportation"">Truck driver behind Humboldt Broncos bus crash to be deported to India after refugee request denied, lawyer says</a>"
4,Richard Shimooka: A mixed F-35/Gripen fleet will fail us in every way,https://nationalpost.com/opinion/richard-shimooka-all-the-ways-the-f-35-is-superior-to-the-gripen,"<a href=""https://nationalpost.com/opinion/richard-shimooka-all-the-ways-the-f-35-is-superior-to-the-gripen"">Richard Shimooka: A mixed F-35/Gripen fleet will fail us in every way</a>"
5,"Rivalry or not, Team USA (and Snoop Dogg) strike first against Canada in Olympic mixed doubles showdown",https://nationalpost.com/sports/olympics/team-usa-snoop-dogg-canada-olympic-curling-mixed-doubles-loss,"<a href=""https://nationalpost.com/sports/olympics/team-usa-snoop-dogg-canada-olympic-curling-mixed-doubles-loss"">Rivalry or not, Team USA (and Snoop Dogg) strike first against Canada in Olympic mixed doubles showdown</a>"
