Rank,Article title,url,title_with_link
1,"Suspect in D.C. gala shooting was 'strongly anti-Christian,' wrote angry manifesto: Trump",https://nationalpost.com/news/world/d-c-press-gala-shooting-suspect-anti-christian-angry-manifestor-trump,"<a href=""https://nationalpost.com/news/world/d-c-press-gala-shooting-suspect-anti-christian-angry-manifestor-trump"">Suspect in D.C. gala shooting was 'strongly anti-Christian,' wrote angry manifesto: Trump</a>"
2,"J.D. Tuccille: U.S. getting richer while Britain, Europe and Canada are falling behind",https://nationalpost.com/opinion/j-d-tuccille-u-s-getting-richer-while-britain-europe-and-canada-are-falling-behind,"<a href=""https://nationalpost.com/opinion/j-d-tuccille-u-s-getting-richer-while-britain-europe-and-canada-are-falling-behind"">J.D. Tuccille: U.S. getting richer while Britain, Europe and Canada are falling behind</a>"
3,Amy Hamm: Woke academics claim J.K. Rowling guilty of being Voldemort,https://nationalpost.com/opinion/amy-hamm-woke-academics-claim-j-k-rowling-guilty-of-being-voldemort,"<a href=""https://nationalpost.com/opinion/amy-hamm-woke-academics-claim-j-k-rowling-guilty-of-being-voldemort"">Amy Hamm: Woke academics claim J.K. Rowling guilty of being Voldemort</a>"
4,"Nenshi's strategy: embrace patriotism, keep Avi Lewis faaaar away",https://nationalpost.com/news/nenshis-strategy-embrace-patriotism-keep-avi-lewis-faaaar-away,"<a href=""https://nationalpost.com/news/nenshis-strategy-embrace-patriotism-keep-avi-lewis-faaaar-away"">Nenshi's strategy: embrace patriotism, keep Avi Lewis faaaar away</a>"
5,Geoff Russ: Reconciliation politics driving B.C. Conservative race without apology,https://nationalpost.com/opinion/geoff-russ-reconciliation-politics-driving-b-c-conservative-leadership-race-without-apology,"<a href=""https://nationalpost.com/opinion/geoff-russ-reconciliation-politics-driving-b-c-conservative-leadership-race-without-apology"">Geoff Russ: Reconciliation politics driving B.C. Conservative race without apology</a>"
