Rank,Article title,url,title_with_link
1,Katy Perry and Justin Trudeau spotted kissing on yacht: report,https://nationalpost.com/news/katy-perry-and-justin-trudeau-spotted-kissing-on-yacht-report?itm_source=trending,"<a href=""https://nationalpost.com/news/katy-perry-and-justin-trudeau-spotted-kissing-on-yacht-report?itm_source=trending"">Katy Perry and Justin Trudeau spotted kissing on yacht: report</a>"
2,Michael Higgins: The West shrugs as Christians are slaughtered and persecuted worldwide,https://nationalpost.com/opinion/the-west-shrugs-as-christians-are-slaughtered-and-persecuted-worldwide?itm_source=trending,"<a href=""https://nationalpost.com/opinion/the-west-shrugs-as-christians-are-slaughtered-and-persecuted-worldwide?itm_source=trending"">Michael Higgins: The West shrugs as Christians are slaughtered and persecuted worldwide</a>"
3,Ontario DEI law firm sues one of its former lawyers for defamation over racism claim,https://nationalpost.com/news/canada/ontario-dei-law-firm-sues-lawyer-for-defamation-over-racism-claim?itm_source=trending,"<a href=""https://nationalpost.com/news/canada/ontario-dei-law-firm-sues-lawyer-for-defamation-over-racism-claim?itm_source=trending"">Ontario DEI law firm sues one of its former lawyers for defamation over racism claim</a>"
4,Michael Murphy: British multiculturalism has failed,https://nationalpost.com/opinion/british-multiculturalism-has-failed?itm_source=trending,"<a href=""https://nationalpost.com/opinion/british-multiculturalism-has-failed?itm_source=trending"">Michael Murphy: British multiculturalism has failed</a>"
5,Anthony Koch: Trump's Mideast 'peace' deal will only lead to more bloodshed,https://nationalpost.com/opinion/trumps-mideast-peace-deal-will-only-lead-to-more-bloodshed?itm_source=trending,"<a href=""https://nationalpost.com/opinion/trumps-mideast-peace-deal-will-only-lead-to-more-bloodshed?itm_source=trending"">Anthony Koch: Trump's Mideast 'peace' deal will only lead to more bloodshed</a>"
