Rank,Article title,url,title_with_link
1,"What a comfortable income looks like in Canada, according to a new survey",https://nationalpost.com/news/canada/what-a-comfortable-income-looks-like-in-canada-according-to-a-new-survey?itm_source=trending,"<a href=""https://nationalpost.com/news/canada/what-a-comfortable-income-looks-like-in-canada-according-to-a-new-survey?itm_source=trending"">What a comfortable income looks like in Canada, according to a new survey</a>"
2,Colby Cosh: Malcolm Gladwell awakens from the transgender fog,https://nationalpost.com/opinion/colby-cosh-malcolm-gladwell-awakens-from-the-transgender-fog?itm_source=trending,"<a href=""https://nationalpost.com/opinion/colby-cosh-malcolm-gladwell-awakens-from-the-transgender-fog?itm_source=trending"">Colby Cosh: Malcolm Gladwell awakens from the transgender fog</a>"
3,"Woman 'kidnapped,' family member shot during yet another Ontario home invasion",https://nationalpost.com/news/canada/markham-home-invasion-kidnapping?itm_source=trending,"<a href=""https://nationalpost.com/news/canada/markham-home-invasion-kidnapping?itm_source=trending"">Woman 'kidnapped,' family member shot during yet another Ontario home invasion</a>"
4,"Canada confirms work underway on review of tariffs on Chinese EVs, steel and aluminum",https://nationalpost.com/news/politics/canada-reviewing-tariffs-on-chinese-evs-steel-and-aluminum?itm_source=trending,"<a href=""https://nationalpost.com/news/politics/canada-reviewing-tariffs-on-chinese-evs-steel-and-aluminum?itm_source=trending"">Canada confirms work underway on review of tariffs on Chinese EVs, steel and aluminum</a>"
5,Chris Selley: Who's against Canadian jobs for Canadian kids instead of for foreign workers?,https://nationalpost.com/opinion/selley-whos-against-canadian-jobs-for-canadian-kids-instead-of-for-foreign-workers?itm_source=trending,"<a href=""https://nationalpost.com/opinion/selley-whos-against-canadian-jobs-for-canadian-kids-instead-of-for-foreign-workers?itm_source=trending"">Chris Selley: Who's against Canadian jobs for Canadian kids instead of for foreign workers?</a>"
