Rank,Article title,url,title_with_link
1,Subscriber only.FIRST READING: Mark Carney is pleasing old people and basically nobody else,https://nationalpost.com/opinion/first-reading-mark-carney-is-pleasing-old-people-and-basically-nobody-else?itm_source=trending,"<a href=""https://nationalpost.com/opinion/first-reading-mark-carney-is-pleasing-old-people-and-basically-nobody-else?itm_source=trending"">Subscriber only.FIRST READING: Mark Carney is pleasing old people and basically nobody else</a>"
2,Adam Zivo: Montreal Pride reverses shameful decision to ban Jewish groups,https://nationalpost.com/opinion/adam-zivo-montreal-pride-reverses-shameful-decision-to-ban-jewish-groups?itm_source=trending,"<a href=""https://nationalpost.com/opinion/adam-zivo-montreal-pride-reverses-shameful-decision-to-ban-jewish-groups?itm_source=trending"">Adam Zivo: Montreal Pride reverses shameful decision to ban Jewish groups</a>"
3,Police continue search for suspect after three found dead in Ontario's prime cottage country,https://nationalpost.com/news/canada/police-continue-search-for-suspect-after-three-found-dead-in-ontarios-prime-cottage-country?itm_source=trending,"<a href=""https://nationalpost.com/news/canada/police-continue-search-for-suspect-after-three-found-dead-in-ontarios-prime-cottage-country?itm_source=trending"">Police continue search for suspect after three found dead in Ontario's prime cottage country</a>"
4,The inside story of how Gaza aid is diverted from the people who need it most,https://nationalpost.com/opinion/the-inside-story-of-how-gaza-aid-is-diverted-from-the-people-who-need-it-most?itm_source=trending,"<a href=""https://nationalpost.com/opinion/the-inside-story-of-how-gaza-aid-is-diverted-from-the-people-who-need-it-most?itm_source=trending"">The inside story of how Gaza aid is diverted from the people who need it most</a>"
5,Flight attendant sues Delta for US$75M over upside-down plane crash in Toronto,https://nationalpost.com/news/flight-attendant-sues-delta-for-us75m-over-upside-down-plane-crash-in-toronto?itm_source=trending,"<a href=""https://nationalpost.com/news/flight-attendant-sues-delta-for-us75m-over-upside-down-plane-crash-in-toronto?itm_source=trending"">Flight attendant sues Delta for US$75M over upside-down plane crash in Toronto</a>"
