Rank,Article title,url,title_with_link
1,"Leslie Roberts: A Jewish man is attacked in front of his daughter, his kippah thrown in a puddle",https://nationalpost.com/opinion/leslie-roberts-a-jewish-man-is-attacked-in-front-of-his-daughter-his-kippah-thrown-in-a-puddle?itm_source=trending,"<a href=""https://nationalpost.com/opinion/leslie-roberts-a-jewish-man-is-attacked-in-front-of-his-daughter-his-kippah-thrown-in-a-puddle?itm_source=trending"">Leslie Roberts: A Jewish man is attacked in front of his daughter, his kippah thrown in a puddle</a>"
2,"Housing crisis may get worse, new forecasts show",https://nationalpost.com/news/canada/housing-crisis-may-get-worse-new-forecasts-show?itm_source=trending,"<a href=""https://nationalpost.com/news/canada/housing-crisis-may-get-worse-new-forecasts-show?itm_source=trending"">Housing crisis may get worse, new forecasts show</a>"
3,"'Outside is a privilege, not a right': The imagined thoughts of the Nova Scotia wilderness ban",https://nationalpost.com/opinion/satire-dear-diary-nova-scotia-wilderness-ban?itm_source=trending,"<a href=""https://nationalpost.com/opinion/satire-dear-diary-nova-scotia-wilderness-ban?itm_source=trending"">'Outside is a privilege, not a right': The imagined thoughts of the Nova Scotia wilderness ban</a>"
4,Toronto woman at heart of lipstick Ponzi scheme gets four years in prison and $610K fine,https://nationalpost.com/news/canada/lipstick-ponzi-scheme?itm_source=trending,"<a href=""https://nationalpost.com/news/canada/lipstick-ponzi-scheme?itm_source=trending"">Toronto woman at heart of lipstick Ponzi scheme gets four years in prison and $610K fine</a>"
5,Leslie Roberts: Naomi Osaka's missed moment in Montreal,https://nationalpost.com/opinion/leslie-roberts-naomi-osakas-missed-moment-in-montreal?itm_source=trending,"<a href=""https://nationalpost.com/opinion/leslie-roberts-naomi-osakas-missed-moment-in-montreal?itm_source=trending"">Leslie Roberts: Naomi Osaka's missed moment in Montreal</a>"
