Rank,Article title,url,title_with_link
1,Mistrial declared for Frank Stronach's sex assault conviction after complainant's lawyer makes 'bizarre' request for money,https://nationalpost.com/news/canada/frank-stronach-seeks-mistrial,"<a href=""https://nationalpost.com/news/canada/frank-stronach-seeks-mistrial"">Mistrial declared for Frank Stronach's sex assault conviction after complainant's lawyer makes 'bizarre' request for money</a>"
2,Michael Higgins: There's no justice in jailing people for residential school 'denialism',https://nationalpost.com/opinion/michael-higgins-theres-no-justice-in-jailing-people-for-residential-school-denialism,"<a href=""https://nationalpost.com/opinion/michael-higgins-theres-no-justice-in-jailing-people-for-residential-school-denialism"">Michael Higgins: There's no justice in jailing people for residential school 'denialism'</a>"
3,"Canadians are fed up of 'paying more to receive less,' majority think the government spends too much: poll",https://nationalpost.com/news/canada/70-of-canadians-say-high-taxes-reduce-living-standards-poll,"<a href=""https://nationalpost.com/news/canada/70-of-canadians-say-high-taxes-reduce-living-standards-poll"">Canadians are fed up of 'paying more to receive less,' majority think the government spends too much: poll</a>"
4,Marco Rubio: The greatest terror threat facing the world now comes from the far left,https://nationalpost.com/opinion/the-greatest-terror-threat-facing-the-world-now-comes-from-the-far-left,"<a href=""https://nationalpost.com/opinion/the-greatest-terror-threat-facing-the-world-now-comes-from-the-far-left"">Marco Rubio: The greatest terror threat facing the world now comes from the far left</a>"
5,Scott Stinson: Doug Ford blasts 'insulting' wildfire 'chirping' from U.S. politicians complaining about smoke,https://nationalpost.com/opinion/doug-ford-united-states-ontario-wildfires,"<a href=""https://nationalpost.com/opinion/doug-ford-united-states-ontario-wildfires"">Scott Stinson: Doug Ford blasts 'insulting' wildfire 'chirping' from U.S. politicians complaining about smoke</a>"
