Rank,Article title,url,title_with_link
1,'Never come to the U.S. again!' Video shows alleged border officer yelling at Canadian driver,https://nationalpost.com/news/canada/u-s-customs-and-border-protection-canadian-driver?itm_source=trending,"<a href=""https://nationalpost.com/news/canada/u-s-customs-and-border-protection-canadian-driver?itm_source=trending"">'Never come to the U.S. again!' Video shows alleged border officer yelling at Canadian driver</a>"
2,Subscriber only.Conrad Black: Trump exposes the 'Palestine' charade at UN,https://nationalpost.com/opinion/trump-exposes-the-palestine-charade-at-un?itm_source=trending,"<a href=""https://nationalpost.com/opinion/trump-exposes-the-palestine-charade-at-un?itm_source=trending"">Subscriber only.Conrad Black: Trump exposes the 'Palestine' charade at UN</a>"
3,"'Gut wrenching': Century-old Alberta church burns in crime spree arson, RCMP seeking suspect",https://nationalpost.com/news/crime/gut-wrenching-century-old-alberta-church-burns-in-crime-spree-arson-rcmp-seek-suspect/wcm/5cade46c-96bf-4064-824f-68e1393194e2?itm_source=trending,"<a href=""https://nationalpost.com/news/crime/gut-wrenching-century-old-alberta-church-burns-in-crime-spree-arson-rcmp-seek-suspect/wcm/5cade46c-96bf-4064-824f-68e1393194e2?itm_source=trending"">'Gut wrenching': Century-old Alberta church burns in crime spree arson, RCMP seeking suspect</a>"
4,Colby Cosh: Why the courts aren't likely to save the B.C. ostriches,https://nationalpost.com/opinion/colby-cosh-why-the-courts-arent-likely-to-save-the-b-c-ostriches?itm_source=trending,"<a href=""https://nationalpost.com/opinion/colby-cosh-why-the-courts-arent-likely-to-save-the-b-c-ostriches?itm_source=trending"">Colby Cosh: Why the courts aren't likely to save the B.C. ostriches</a>"
5,"NP View: Finally, a Liberal tells the truth about gun confiscations",https://nationalpost.com/opinion/finally-a-liberal-tells-the-truth-about-gun-confiscations?itm_source=trending,"<a href=""https://nationalpost.com/opinion/finally-a-liberal-tells-the-truth-about-gun-confiscations?itm_source=trending"">NP View: Finally, a Liberal tells the truth about gun confiscations</a>"
