Rank,Article title,url,title_with_link
1,British Conservatives find their new Margaret Thatcher,https://nationalpost.com/news/world/british-conservatives-find-their-new-margaret-thatcher,"<a href=""https://nationalpost.com/news/world/british-conservatives-find-their-new-margaret-thatcher"">British Conservatives find their new Margaret Thatcher</a>"
2,Scott Stinson: Trump threatens to tariff Canada over 'filthy air' after Ford blasts U.S. for wildfire 'chirping',https://nationalpost.com/opinion/doug-ford-united-states-ontario-wildfires,"<a href=""https://nationalpost.com/opinion/doug-ford-united-states-ontario-wildfires"">Scott Stinson: Trump threatens to tariff Canada over 'filthy air' after Ford blasts U.S. for wildfire 'chirping'</a>"
3,Subscriber only.Conrad Black: Carney's failed diversification gambit,https://nationalpost.com/opinion/carneys-failed-diversification-gambit,"<a href=""https://nationalpost.com/opinion/carneys-failed-diversification-gambit"">Subscriber only.Conrad Black: Carney's failed diversification gambit</a>"
4,How Ontario First Nation escaped raging wildfire that burned down their community,https://nationalpost.com/news/ontario-wildfire-namaygoosisagagun-first-nation,"<a href=""https://nationalpost.com/news/ontario-wildfire-namaygoosisagagun-first-nation"">How Ontario First Nation escaped raging wildfire that burned down their community</a>"
5,'Unacceptable for hate to creep' into Calgary Stampede says Israel's ambassador in rebuke of Nenshi,https://nationalpost.com/news/canada/unacceptable-for-hate-to-creep-into-calgary-stampede-says-israels-ambassador-in-rebuke-of-nenshi,"<a href=""https://nationalpost.com/news/canada/unacceptable-for-hate-to-creep-into-calgary-stampede-says-israels-ambassador-in-rebuke-of-nenshi"">'Unacceptable for hate to creep' into Calgary Stampede says Israel's ambassador in rebuke of Nenshi</a>"
