Rank,Article title,url,title_with_link
1,UN watchdog bashes Mark Carney's 'procedural theatre' on Iran war,https://nationalpost.com/news/mark-carney-iran-war,"<a href=""https://nationalpost.com/news/mark-carney-iran-war"">UN watchdog bashes Mark Carney's 'procedural theatre' on Iran war</a>"
2,This B.C. woman was offered MAID before other treatments. She said no to death and went on to climb a volcano,https://nationalpost.com/news/canada/i-did-not-want-to-die-miriam-lancaster-medical-assistance-in-dying,"<a href=""https://nationalpost.com/news/canada/i-did-not-want-to-die-miriam-lancaster-medical-assistance-in-dying"">This B.C. woman was offered MAID before other treatments. She said no to death and went on to climb a volcano</a>"
3,Jesse Kline: Tell me again why Air Canada must be officially bilingual,https://nationalpost.com/opinion/tell-me-again-why-air-canada-must-be-officially-bilingual,"<a href=""https://nationalpost.com/opinion/tell-me-again-why-air-canada-must-be-officially-bilingual"">Jesse Kline: Tell me again why Air Canada must be officially bilingual</a>"
4,"Subscriber only.Conrad Black: With Iran war, Trump boxes China in",https://nationalpost.com/opinion/conrad-black-with-iran-war-trump-boxes-china-in,"<a href=""https://nationalpost.com/opinion/conrad-black-with-iran-war-trump-boxes-china-in"">Subscriber only.Conrad Black: With Iran war, Trump boxes China in</a>"
5,"Adam Pankratz: After being gaslit for years, suddenly, we're told there's a business case for LNG",https://nationalpost.com/opinion/adam-pankratz-after-being-gaslit-for-years-suddenly-were-told-theres-a-business-case-for-lng,"<a href=""https://nationalpost.com/opinion/adam-pankratz-after-being-gaslit-for-years-suddenly-were-told-theres-a-business-case-for-lng"">Adam Pankratz: After being gaslit for years, suddenly, we're told there's a business case for LNG</a>"
