Rank,Article title,url,title_with_link
1,B.C. teen Piper James bitten by dingoes before she likely drowned in Australia: autopsy,https://nationalpost.com/news/canada/autopsy-report-sheds-light-on-death-of-b-c-teen-whose-body-was-found-surrounded-by-dingoes,"<a href=""https://nationalpost.com/news/canada/autopsy-report-sheds-light-on-death-of-b-c-teen-whose-body-was-found-surrounded-by-dingoes"">B.C. teen Piper James bitten by dingoes before she likely drowned in Australia: autopsy</a>"
2,"Ryan Wedding, Canadian Olympian turned FBI fugitive, surrendered at U.S. embassy in Mexico",https://nationalpost.com/news/world/canadian-former-olympic-snowboarder-ryan-wedding-arrest-drug-and-murder-charges,"<a href=""https://nationalpost.com/news/world/canadian-former-olympic-snowboarder-ryan-wedding-arrest-drug-and-murder-charges"">Ryan Wedding, Canadian Olympian turned FBI fugitive, surrendered at U.S. embassy in Mexico</a>"
3,"Bluster, tariffs and a quiet retreat: Why Trump made a U-turn on Greenland",https://nationalpost.com/news/bluster-tariffs-and-a-quiet-retreat-why-trump-made-a-u-turn-on-greenland,"<a href=""https://nationalpost.com/news/bluster-tariffs-and-a-quiet-retreat-why-trump-made-a-u-turn-on-greenland"">Bluster, tariffs and a quiet retreat: Why Trump made a U-turn on Greenland</a>"
4,Pierre Poilievre: Carney's Davos speech highlights that it is Liberal rhetoric that doesn't match reality,https://nationalpost.com/opinion/pierre-poilievre-carneys-davos-speech-highlights-that-it-is-liberal-rhetoric-that-doesnt-match-reality,"<a href=""https://nationalpost.com/opinion/pierre-poilievre-carneys-davos-speech-highlights-that-it-is-liberal-rhetoric-that-doesnt-match-reality"">Pierre Poilievre: Carney's Davos speech highlights that it is Liberal rhetoric that doesn't match reality</a>"
5,Vegas casino owner offers to accept Canadian dollars on par with U.S. currency,https://nationalpost.com/news/vegas-casino-owner-offers-to-accept-canadian-dollars-on-par-with-u-s-currency,"<a href=""https://nationalpost.com/news/vegas-casino-owner-offers-to-accept-canadian-dollars-on-par-with-u-s-currency"">Vegas casino owner offers to accept Canadian dollars on par with U.S. currency</a>"
