Rank,Article title,url,title_with_link
1,FIRST READING: B.C. human rights chief declares that it's colonialist to stigmatize drug use,https://nationalpost.com/opinion/b-c-human-rights-chief-declares-that-its-colonialist-to-stigmatize-drug-use,"<a href=""https://nationalpost.com/opinion/b-c-human-rights-chief-declares-that-its-colonialist-to-stigmatize-drug-use"">FIRST READING: B.C. human rights chief declares that it's colonialist to stigmatize drug use</a>"
2,Adam Zivo: CBC launders 'safer supply' propaganda on the Fifth Estate,https://nationalpost.com/opinion/adam-zivo-cbc-launders-safer-supply-propaganda-on-the-fifth-estate,"<a href=""https://nationalpost.com/opinion/adam-zivo-cbc-launders-safer-supply-propaganda-on-the-fifth-estate"">Adam Zivo: CBC launders 'safer supply' propaganda on the Fifth Estate</a>"
3,'Fury from Alberta and Saskatchewan': Western patience wearing thin over lack of Alberta pipeline plan,https://nationalpost.com/news/western-patience-wearing-thin-over-lack-of-alberta-pipeline-plan,"<a href=""https://nationalpost.com/news/western-patience-wearing-thin-over-lack-of-alberta-pipeline-plan"">'Fury from Alberta and Saskatchewan': Western patience wearing thin over lack of Alberta pipeline plan</a>"
4,Liberals narrowly avoid snap federal election on budget vote,https://nationalpost.com/news/liberal-government-budget-confidence-vote,"<a href=""https://nationalpost.com/news/liberal-government-budget-confidence-vote"">Liberals narrowly avoid snap federal election on budget vote</a>"
5,"Canadians distrust refugees more than other new arrivals, poll shows",https://nationalpost.com/news/canadians-distrust-refugees-more-than-other-new-arrivals-poll,"<a href=""https://nationalpost.com/news/canadians-distrust-refugees-more-than-other-new-arrivals-poll"">Canadians distrust refugees more than other new arrivals, poll shows</a>"
