Rank,Article title,url,title_with_link
1,"Maya Gebala's mother shares bad news in latest update: 'In a second, he was gone'",https://nationalpost.com/news/canada/maya-gebala-mother-bad-news-dog,"<a href=""https://nationalpost.com/news/canada/maya-gebala-mother-bad-news-dog"">Maya Gebala's mother shares bad news in latest update: 'In a second, he was gone'</a>"
2,John Robson: Conservatives need to tell Canadians the truth — there's no free lunch,https://nationalpost.com/opinion/john-robson-conservatives-need-to-tell-canadians-the-truth-theres-no-free-lunch,"<a href=""https://nationalpost.com/opinion/john-robson-conservatives-need-to-tell-canadians-the-truth-theres-no-free-lunch"">John Robson: Conservatives need to tell Canadians the truth — there's no free lunch</a>"
3,Amy Hamm: Brits take on progressive bullies. Why don't we?,https://nationalpost.com/opinion/brits-take-on-progressive-bullies-why-dont-we,"<a href=""https://nationalpost.com/opinion/brits-take-on-progressive-bullies-why-dont-we"">Amy Hamm: Brits take on progressive bullies. Why don't we?</a>"
4,"Trump announces new 50% tariff on Canadian goods citing alcohol, dairy disputes",https://nationalpost.com/news/donald-trump-new-tariff-canadian-goods-including-cusma-compliant-products,"<a href=""https://nationalpost.com/news/donald-trump-new-tariff-canadian-goods-including-cusma-compliant-products"">Trump announces new 50% tariff on Canadian goods citing alcohol, dairy disputes</a>"
5,Matthew Lau: Government-funded wildfire ‘facts’ contradict reality,https://nationalpost.com/opinion/matthew-lau-government-funded-wildfire-facts-contradict-reality,"<a href=""https://nationalpost.com/opinion/matthew-lau-government-funded-wildfire-facts-contradict-reality"">Matthew Lau: Government-funded wildfire ‘facts’ contradict reality</a>"
