Rank,Article title,url,title_with_link
1,"'A doctor took my son': This 26-year-old was denied assisted death in Ontario, but died by MAID in B.C.",https://nationalpost.com/news/canada/kiano-vafaeian-medical-assistance-in-dying,"<a href=""https://nationalpost.com/news/canada/kiano-vafaeian-medical-assistance-in-dying"">'A doctor took my son': This 26-year-old was denied assisted death in Ontario, but died by MAID in B.C.</a>"
2,Carney jokingly takes credit for Heated Rivalry's success: 'I greenlit this thing. I stood up to the Americans',https://nationalpost.com/news/canada/mark-carney-heated-rivalry,"<a href=""https://nationalpost.com/news/canada/mark-carney-heated-rivalry"">Carney jokingly takes credit for Heated Rivalry's success: 'I greenlit this thing. I stood up to the Americans'</a>"
3,"FIRST READING: Carney definition of 'capital' recognized by nobody else on earth, says budget watchdog",https://nationalpost.com/opinion/carney-definition-capital-budget-watchdog,"<a href=""https://nationalpost.com/opinion/carney-definition-capital-budget-watchdog"">FIRST READING: Carney definition of 'capital' recognized by nobody else on earth, says budget watchdog</a>"
4,"Yuan Yi Zhu: Face it, Carney just doesn't know much about Canada",https://nationalpost.com/opinion/yuan-yi-zhu-face-it-carney-just-doesnt-know-much-about-canada,"<a href=""https://nationalpost.com/opinion/yuan-yi-zhu-face-it-carney-just-doesnt-know-much-about-canada"">Yuan Yi Zhu: Face it, Carney just doesn't know much about Canada</a>"
5,Amy Hamm: The Conservative convention should have been held in a woke city,https://nationalpost.com/opinion/amy-hamm-the-conservative-convention-should-have-been-held-in-a-woke-city,"<a href=""https://nationalpost.com/opinion/amy-hamm-the-conservative-convention-should-have-been-held-in-a-woke-city"">Amy Hamm: The Conservative convention should have been held in a woke city</a>"
