Rank,Article title,url,title_with_link
1,Danielle Smith opens door to amending Constitution to alter treaty rights,https://nationalpost.com/news/canada/danielle-smith-opens-door-to-amending-constitution-to-alter-treaty-rights,"<a href=""https://nationalpost.com/news/canada/danielle-smith-opens-door-to-amending-constitution-to-alter-treaty-rights"">Danielle Smith opens door to amending Constitution to alter treaty rights</a>"
2,How Canadian flyers can stop their luggage from turning into a drug shipment due to airport bag tag swaps,https://nationalpost.com/news/canadians-bag-tag-airport-switching-scheme,"<a href=""https://nationalpost.com/news/canadians-bag-tag-airport-switching-scheme"">How Canadian flyers can stop their luggage from turning into a drug shipment due to airport bag tag swaps</a>"
3,Floor-crosser Marilyn Gladu reveals her conversation with Carney and the 'toxic environment' among Conservatives,https://nationalpost.com/news/politics/floor-crosser-marilyn-gladu-reveals-her-conversation-with-carney-and-the-toxic-environment-among-conservatives,"<a href=""https://nationalpost.com/news/politics/floor-crosser-marilyn-gladu-reveals-her-conversation-with-carney-and-the-toxic-environment-among-conservatives"">Floor-crosser Marilyn Gladu reveals her conversation with Carney and the 'toxic environment' among Conservatives</a>"
4,Tim Hortons customer dies after pulling a chunk of hair from employee's head over order disagreement,https://nationalpost.com/news/disturbing-video-shows-tim-hortons-customer-fighting-employee-shortly-before-her-death,"<a href=""https://nationalpost.com/news/disturbing-video-shows-tim-hortons-customer-fighting-employee-shortly-before-her-death"">Tim Hortons customer dies after pulling a chunk of hair from employee's head over order disagreement</a>"
5,"Chris Selley: 'Don't watch hockey,' says the NHL",https://nationalpost.com/opinion/chris-selley-dont-watch-hockey-says-the-nhl,"<a href=""https://nationalpost.com/opinion/chris-selley-dont-watch-hockey-says-the-nhl"">Chris Selley: 'Don't watch hockey,' says the NHL</a>"
