Rank,Article title,url,title_with_link
1,Tasha Kheiriddin: Avi Lewis could spoil the Liberals' chances next election,https://nationalpost.com/opinion/tasha-kheiriddin-avi-lewis-could-spoil-the-liberals-chances-next-election,"<a href=""https://nationalpost.com/opinion/tasha-kheiriddin-avi-lewis-could-spoil-the-liberals-chances-next-election"">Tasha Kheiriddin: Avi Lewis could spoil the Liberals' chances next election</a>"
2,The Charter was a huge mistake: Canada Did What? podcast,https://nationalpost.com/news/canada/the-charter-was-a-huge-mistake-canada-did-what-podcast,"<a href=""https://nationalpost.com/news/canada/the-charter-was-a-huge-mistake-canada-did-what-podcast"">The Charter was a huge mistake: Canada Did What? podcast</a>"
3,"Stephen Lewis, former politician and social activist, dies at 88",https://nationalpost.com/news/canada/stephen-lewis-former-politician-and-social-activist-dies-at-88,"<a href=""https://nationalpost.com/news/canada/stephen-lewis-former-politician-and-social-activist-dies-at-88"">Stephen Lewis, former politician and social activist, dies at 88</a>"
4,Montreal court rejects McGill student’s injunction to stop law association from implementing anti-Israel boycott,https://nationalpost.com/news/montreal-court-rejects-mcgill-students-injunction-israel-boycott,"<a href=""https://nationalpost.com/news/montreal-court-rejects-mcgill-students-injunction-israel-boycott"">Montreal court rejects McGill student’s injunction to stop law association from implementing anti-Israel boycott</a>"
5,"Michael Higgins: What have the Liberals, and the CBC, got against women?",https://nationalpost.com/opinion/michael-higgins-what-have-the-liberals-and-the-cbc-got-against-women,"<a href=""https://nationalpost.com/opinion/michael-higgins-what-have-the-liberals-and-the-cbc-got-against-women"">Michael Higgins: What have the Liberals, and the CBC, got against women?</a>"
