Rank,Article title,url,title_with_link
1,"Adam Zivo: Iran death toll reaches a reported 12,000. It's time Trump sent the bombers",https://nationalpost.com/opinion/zivo-trump-must-bomb-irans-islamic-regime-immediately,"<a href=""https://nationalpost.com/opinion/zivo-trump-must-bomb-irans-islamic-regime-immediately"">Adam Zivo: Iran death toll reaches a reported 12,000. It's time Trump sent the bombers</a>"
2,Que. lottery winner chose $1K/week for life over $1M payout and even Canada's richest man had thoughts,https://nationalpost.com/news/canada/canadian-lottery-winner-chose-1k-week-for-life-over-1m-right-away-what-would-you-do,"<a href=""https://nationalpost.com/news/canada/canadian-lottery-winner-chose-1k-week-for-life-over-1m-right-away-what-would-you-do"">Que. lottery winner chose $1K/week for life over $1M payout and even Canada's richest man had thoughts</a>"
3,Transgender teen killer loses bid to stay in Ontario women's prison after threatening inmates and staff,https://nationalpost.com/news/canada/transgender-teen-killer-loses-bid-to-stay-in-ontario-womens-prison-after-threatening-inmates-and-staff,"<a href=""https://nationalpost.com/news/canada/transgender-teen-killer-loses-bid-to-stay-in-ontario-womens-prison-after-threatening-inmates-and-staff"">Transgender teen killer loses bid to stay in Ontario women's prison after threatening inmates and staff</a>"
4,"CUSMA mainly benefits Canada but Americans ‘don’t need’ their products, Trump says",https://nationalpost.com/news/canada/cusma-mainly-benefits-canada-trump-says,"<a href=""https://nationalpost.com/news/canada/cusma-mainly-benefits-canada-trump-says"">CUSMA mainly benefits Canada but Americans ‘don’t need’ their products, Trump says</a>"
5,B.C. restaurant owner fights online abuse after catering event for Poilievre and local Conservatives,https://nationalpost.com/news/canada/b-c-restaurant-owner-fights-online-abuse-after-catering-event-for-poilievre-and-local-conservatives,"<a href=""https://nationalpost.com/news/canada/b-c-restaurant-owner-fights-online-abuse-after-catering-event-for-poilievre-and-local-conservatives"">B.C. restaurant owner fights online abuse after catering event for Poilievre and local Conservatives</a>"
