Rank,Article title,url,title_with_link
1,"What Mark Carney is missing, according to this eminence grise insider",https://nationalpost.com/news/what-mark-carney-is-missing-according-to-this-eminence-grise-insider?itm_source=trending,"<a href=""https://nationalpost.com/news/what-mark-carney-is-missing-according-to-this-eminence-grise-insider?itm_source=trending"">What Mark Carney is missing, according to this eminence grise insider</a>"
2,Canada Post is on strike (again). Here's what it means for your mail,https://nationalpost.com/news/canada-post-strike-explainer?itm_source=trending,"<a href=""https://nationalpost.com/news/canada-post-strike-explainer?itm_source=trending"">Canada Post is on strike (again). Here's what it means for your mail</a>"
3,Letters: Our children are pondering where to live — outside Canada,https://nationalpost.com/opinion/letters-our-children-are-pondering-where-to-live-outside-canada?itm_source=trending,"<a href=""https://nationalpost.com/opinion/letters-our-children-are-pondering-where-to-live-outside-canada?itm_source=trending"">Letters: Our children are pondering where to live — outside Canada</a>"
4,Michael Taube: The Liberals just can't leave duck hunters alone,https://nationalpost.com/opinion/michael-taube-the-liberals-just-cant-leave-duck-hunters-alone?itm_source=trending,"<a href=""https://nationalpost.com/opinion/michael-taube-the-liberals-just-cant-leave-duck-hunters-alone?itm_source=trending"">Michael Taube: The Liberals just can't leave duck hunters alone</a>"
5,Gunman drove truck into Michigan Mormon church and opened fire: police,https://nationalpost.com/news/michigan-mormon-church-shooting?itm_source=trending,"<a href=""https://nationalpost.com/news/michigan-mormon-church-shooting?itm_source=trending"">Gunman drove truck into Michigan Mormon church and opened fire: police</a>"
