Rank,Article title,url,title_with_link
1,"Air Canada flight attendant ejected from plane and found strapped in jump seat, survives crash: daughter confirms",https://nationalpost.com/news/canada/air-canada-crash-flight-attendant-ejected-jump-seat,"<a href=""https://nationalpost.com/news/canada/air-canada-crash-flight-attendant-ejected-jump-seat"">Air Canada flight attendant ejected from plane and found strapped in jump seat, survives crash: daughter confirms</a>"
2,Quebec man identified as pilot who died in Air Canada plane crash in New York,https://nationalpost.com/news/canada/antoine-forest-pilot-laguardia-plane-crash-air-canada,"<a href=""https://nationalpost.com/news/canada/antoine-forest-pilot-laguardia-plane-crash-air-canada"">Quebec man identified as pilot who died in Air Canada plane crash in New York</a>"
3,Ted Morton: Carney demands Supreme Court strip provinces of right to pass their own laws,https://nationalpost.com/opinion/ted-morton-carney-demands-supreme-court-strip-provinces-of-right-to-pass-their-own-laws,"<a href=""https://nationalpost.com/opinion/ted-morton-carney-demands-supreme-court-strip-provinces-of-right-to-pass-their-own-laws"">Ted Morton: Carney demands Supreme Court strip provinces of right to pass their own laws</a>"
4,'Everybody was flying everywhere': Passengers describe Air Canada Express plane crash in New York,https://nationalpost.com/news/canada/laguardia-airport-crash-air-canada-express-jazz-aviation,"<a href=""https://nationalpost.com/news/canada/laguardia-airport-crash-air-canada-express-jazz-aviation"">'Everybody was flying everywhere': Passengers describe Air Canada Express plane crash in New York</a>"
5,"Only a fraction of 153,000 flagged international students were investigated: AG",https://nationalpost.com/news/only-a-fraction-of-153000-flagged-international-students-were-investigated-ag,"<a href=""https://nationalpost.com/news/only-a-fraction-of-153000-flagged-international-students-were-investigated-ag"">Only a fraction of 153,000 flagged international students were investigated: AG</a>"
