Rank,Article title,url,title_with_link
1,Trump interrupts Carney to talk 'merger of Canada and the United States',https://nationalpost.com/news/trump-interrupts-carney-to-talk-merger-of-canada-and-the-united-states?itm_source=trending,"<a href=""https://nationalpost.com/news/trump-interrupts-carney-to-talk-merger-of-canada-and-the-united-states?itm_source=trending"">Trump interrupts Carney to talk 'merger of Canada and the United States'</a>"
2,Freedom Convoy organizers Tamara Lich and Chris Barber sentenced to 12 months house arrest,https://nationalpost.com/news/canada/freedom-convoy-organizer-chris-barber-sentenced-to-12-months-house-arrest?itm_source=trending,"<a href=""https://nationalpost.com/news/canada/freedom-convoy-organizer-chris-barber-sentenced-to-12-months-house-arrest?itm_source=trending"">Freedom Convoy organizers Tamara Lich and Chris Barber sentenced to 12 months house arrest</a>"
3,Trump says Canada will be ‘very happy’ after tariff talks with Carney,https://nationalpost.com/news/politics/mark-carney-donald-trump-meeting-washington?itm_source=trending,"<a href=""https://nationalpost.com/news/politics/mark-carney-donald-trump-meeting-washington?itm_source=trending"">Trump says Canada will be ‘very happy’ after tariff talks with Carney</a>"
4,"'You're from Canada, eh?': Meeting with 'off-duty ICE officer' at a pet store leads to Toronto man's self-deportation",https://nationalpost.com/news/canadian-self-deports-ice?itm_source=trending,"<a href=""https://nationalpost.com/news/canadian-self-deports-ice?itm_source=trending"">'You're from Canada, eh?': Meeting with 'off-duty ICE officer' at a pet store leads to Toronto man's self-deportation</a>"
5,"Concordia 'forced' to close campus after 2 arrests, 'threat of extreme disruption' due to Oct. 7 protests",https://nationalpost.com/news/canada/concordia-university-closes-protest-disruption?itm_source=trending,"<a href=""https://nationalpost.com/news/canada/concordia-university-closes-protest-disruption?itm_source=trending"">Concordia 'forced' to close campus after 2 arrests, 'threat of extreme disruption' due to Oct. 7 protests</a>"
