Rank,Article title,url,title_with_link
1,'I was lynched': Why astronaut Julie Payette flamed out as governor general,https://nationalpost.com/feature/astronaut-julie-payette-flamed-out-as-governor-general,"<a href=""https://nationalpost.com/feature/astronaut-julie-payette-flamed-out-as-governor-general"">'I was lynched': Why astronaut Julie Payette flamed out as governor general</a>"
2,Michael Higgins: Leftist media says moon mission is a colonial attack on Indigenous beliefs,https://nationalpost.com/opinion/michael-higgins-leftist-media-says-moon-mission-is-a-colonial-attack-on-indigenous-beliefs,"<a href=""https://nationalpost.com/opinion/michael-higgins-leftist-media-says-moon-mission-is-a-colonial-attack-on-indigenous-beliefs"">Michael Higgins: Leftist media says moon mission is a colonial attack on Indigenous beliefs</a>"
3,"Jamie Sarkonak: Serving Starbucks in English might be 'racism,' Saskatchewan court says",https://nationalpost.com/opinion/jamie-sarkonak-serving-starbucks-in-english-might-be-racism-saskatchewan-court-says,"<a href=""https://nationalpost.com/opinion/jamie-sarkonak-serving-starbucks-in-english-might-be-racism-saskatchewan-court-says"">Jamie Sarkonak: Serving Starbucks in English might be 'racism,' Saskatchewan court says</a>"
4,How Trump-inspired CUSMA compliance levels could become a trap,https://nationalpost.com/news/how-trump-inspired-cusma-compliance-levels-could-become-a-trap,"<a href=""https://nationalpost.com/news/how-trump-inspired-cusma-compliance-levels-could-become-a-trap"">How Trump-inspired CUSMA compliance levels could become a trap</a>"
5,FIRST READING: What Canada could do with the $90B it's blowing on high-speed rail,https://nationalpost.com/opinion/what-canada-could-do-with-the-90b-its-blowing-on-high-speed-rail,"<a href=""https://nationalpost.com/opinion/what-canada-could-do-with-the-90b-its-blowing-on-high-speed-rail"">FIRST READING: What Canada could do with the $90B it's blowing on high-speed rail</a>"
