Rank,Article title,url,title_with_link
1,"Liberals assure Trump: 'no pursuit' of free trade with China, after 100% tariff threat",https://nationalpost.com/news/canada/there-is-no-pursuit-of-a-free-trade-deal-with-china-says-leblanc-in-response-to-trump,"<a href=""https://nationalpost.com/news/canada/there-is-no-pursuit-of-a-free-trade-deal-with-china-says-leblanc-in-response-to-trump"">Liberals assure Trump: 'no pursuit' of free trade with China, after 100% tariff threat</a>"
2,"Adam Zivo: Carney put Liberals first, even though Trump tariff threat was predictable",https://nationalpost.com/opinion/adam-zivo-carney-put-liberals-first-even-though-trump-tariff-threat-was-predictable,"<a href=""https://nationalpost.com/opinion/adam-zivo-carney-put-liberals-first-even-though-trump-tariff-threat-was-predictable"">Adam Zivo: Carney put Liberals first, even though Trump tariff threat was predictable</a>"
3,"Jamie Sarkonak: Toddler's bathtub drowning partly the fault of racism, says Ontario judge",https://nationalpost.com/opinion/jamie-sarkonak-toddlers-bathtub-drowning-partly-the-fault-of-racism-says-ontario-judge,"<a href=""https://nationalpost.com/opinion/jamie-sarkonak-toddlers-bathtub-drowning-partly-the-fault-of-racism-says-ontario-judge"">Jamie Sarkonak: Toddler's bathtub drowning partly the fault of racism, says Ontario judge</a>"
4,Book Excerpt: How Trudeau Liberals' DEI obsession helped kill Canadian culture,https://nationalpost.com/opinion/how-trudeau-liberals-dei-obsession-helped-kill-canadian-culture,"<a href=""https://nationalpost.com/opinion/how-trudeau-liberals-dei-obsession-helped-kill-canadian-culture"">Book Excerpt: How Trudeau Liberals' DEI obsession helped kill Canadian culture</a>"
5,Subscriber only.Conrad Black: Carney's middle powers plan a complete fantasy,https://nationalpost.com/opinion/conrad-black-20,"<a href=""https://nationalpost.com/opinion/conrad-black-20"">Subscriber only.Conrad Black: Carney's middle powers plan a complete fantasy</a>"
