Rank,Article title,url,title_with_link
1,'Reality has changed': Federal government announces end to door-to-door delivery for Canada Post,https://nationalpost.com/news/politics/federal-government-announces-end-to-door-to-door-delivery-for-canada-post?itm_source=trending,"<a href=""https://nationalpost.com/news/politics/federal-government-announces-end-to-door-to-door-delivery-for-canada-post?itm_source=trending"">'Reality has changed': Federal government announces end to door-to-door delivery for Canada Post</a>"
2,N.B. volleyball coach fired after he told veterans they would have to try out again wins wrongful dismissal suit,https://nationalpost.com/news/canada/university-of-new-brunswick-volleyball?itm_source=trending,"<a href=""https://nationalpost.com/news/canada/university-of-new-brunswick-volleyball?itm_source=trending"">N.B. volleyball coach fired after he told veterans they would have to try out again wins wrongful dismissal suit</a>"
3,Former Canadian hockey player shot dead in the U.S. during a golf trip: reports,https://nationalpost.com/news/canada/canadian-dead-us-golf-trip?itm_source=trending,"<a href=""https://nationalpost.com/news/canada/canadian-dead-us-golf-trip?itm_source=trending"">Former Canadian hockey player shot dead in the U.S. during a golf trip: reports</a>"
4,"Donald Trump should apologize to Canada for 51st state comments, Louisiana Lt.-Gov. says",https://nationalpost.com/news/donald-trump-should-apologize-to-canada-for-51st-state-comments-louisiana-lt-gov-says?itm_source=trending,"<a href=""https://nationalpost.com/news/donald-trump-should-apologize-to-canada-for-51st-state-comments-louisiana-lt-gov-says?itm_source=trending"">Donald Trump should apologize to Canada for 51st state comments, Louisiana Lt.-Gov. says</a>"
5,A grieving brother wants to change MAID laws. An expert says it's not so easy,https://nationalpost.com/news/a-grieving-brother-wants-to-change-maid-laws-an-expert-says-its-not-so-easy?itm_source=trending,"<a href=""https://nationalpost.com/news/a-grieving-brother-wants-to-change-maid-laws-an-expert-says-its-not-so-easy?itm_source=trending"">A grieving brother wants to change MAID laws. An expert says it's not so easy</a>"
