Rank,Article title,url,title_with_link
1,'He came at me and started stabbing.' Canada has a serious knife problem,https://nationalpost.com/feature/stabbings-in-canada,"<a href=""https://nationalpost.com/feature/stabbings-in-canada"">'He came at me and started stabbing.' Canada has a serious knife problem</a>"
2,Liberals reach 49% voter support and the party's biggest lead in 10 years: Leger poll,https://nationalpost.com/news/liberals-reach-49-voter-support-and-the-partys-biggest-lead-in-10-years-leger-poll,"<a href=""https://nationalpost.com/news/liberals-reach-49-voter-support-and-the-partys-biggest-lead-in-10-years-leger-poll"">Liberals reach 49% voter support and the party's biggest lead in 10 years: Leger poll</a>"
3,Canadian tourist in the U.S. accused of kidnapping and torturing a flamingo at a hotel,https://nationalpost.com/news/canada/canadian-man-accused-of-torturing-flamingo-in-hotel,"<a href=""https://nationalpost.com/news/canada/canadian-man-accused-of-torturing-flamingo-in-hotel"">Canadian tourist in the U.S. accused of kidnapping and torturing a flamingo at a hotel</a>"
4,Subscriber only.John Ivison: Carney’s global deals are paper-thin until we see real results,https://nationalpost.com/opinion/ivison-carneys-global-deals-are-paper-thin-until-we-see-real-results,"<a href=""https://nationalpost.com/opinion/ivison-carneys-global-deals-are-paper-thin-until-we-see-real-results"">Subscriber only.John Ivison: Carney’s global deals are paper-thin until we see real results</a>"
5,FIRST READING: Mark Carney’s most breathtaking u-turns,https://nationalpost.com/opinion/mark-carney-most-breathtaking-u-turns,"<a href=""https://nationalpost.com/opinion/mark-carney-most-breathtaking-u-turns"">FIRST READING: Mark Carney’s most breathtaking u-turns</a>"
