Rank,Article title,url,title_with_link
1,Trump under fire for profane Easter morning threat to Iran over Strait of Hormuz,https://nationalpost.com/news/world/trump-profane-easter-threat-iran-strait-hormuz,"<a href=""https://nationalpost.com/news/world/trump-profane-easter-threat-iran-strait-hormuz"">Trump under fire for profane Easter morning threat to Iran over Strait of Hormuz</a>"
2,Passport applications will be processed with '30 days or free' guarantee,https://nationalpost.com/news/canada/passport-applications-will-be-processed-with-30-days-or-free-guarantee,"<a href=""https://nationalpost.com/news/canada/passport-applications-will-be-processed-with-30-days-or-free-guarantee"">Passport applications will be processed with '30 days or free' guarantee</a>"
3,Amy Hamm: How the NDP's equity cards turned the convention into a circus,https://nationalpost.com/opinion/amy-hamm-how-ndps-equity-cards-turned-the-convention-into-a-circus,"<a href=""https://nationalpost.com/opinion/amy-hamm-how-ndps-equity-cards-turned-the-convention-into-a-circus"">Amy Hamm: How the NDP's equity cards turned the convention into a circus</a>"
4,News flash: Canada's restless problem children are conspiring,https://nationalpost.com/news/news-flash-canadas-restless-problem-children-are-conspiring,"<a href=""https://nationalpost.com/news/news-flash-canadas-restless-problem-children-are-conspiring"">News flash: Canada's restless problem children are conspiring</a>"
5,"Canadians to pay extra $50 on select Air Canada flights starting April 6, travel agents say",https://nationalpost.com/news/canada/canadians-to-pay-extra-50-on-select-air-canada-flights-starting-april-6-travel-agents-say,"<a href=""https://nationalpost.com/news/canada/canadians-to-pay-extra-50-on-select-air-canada-flights-starting-april-6-travel-agents-say"">Canadians to pay extra $50 on select Air Canada flights starting April 6, travel agents say</a>"
