Rank,Article title,url,title_with_link
1,Subscriber only.FIRST READING: Mark Carney’s 'literal Potemkin Village',https://nationalpost.com/opinion/mark-carney-literal-potemkin-village?itm_source=trending,"<a href=""https://nationalpost.com/opinion/mark-carney-literal-potemkin-village?itm_source=trending"">Subscriber only.FIRST READING: Mark Carney’s 'literal Potemkin Village'</a>"
2,How Canada's short-term thinking sparked a national housing crisis,https://nationalpost.com/news/canada/how-canadas-short-term-thinking-sparked-a-national-housing-crisis?itm_source=trending,"<a href=""https://nationalpost.com/news/canada/how-canadas-short-term-thinking-sparked-a-national-housing-crisis?itm_source=trending"">How Canada's short-term thinking sparked a national housing crisis</a>"
3,Canada Post is on strike (again). Here's what it means for your mail,https://nationalpost.com/news/canada-post-strike-explainer?itm_source=trending,"<a href=""https://nationalpost.com/news/canada-post-strike-explainer?itm_source=trending"">Canada Post is on strike (again). Here's what it means for your mail</a>"
4,'Are you watching Donald Trump?': Team Europe taunts U.S. president after Ryder Cup win,https://nationalpost.com/news/world/ryder-cup-rory-mcilroy-donald-trump?itm_source=trending,"<a href=""https://nationalpost.com/news/world/ryder-cup-rory-mcilroy-donald-trump?itm_source=trending"">'Are you watching Donald Trump?': Team Europe taunts U.S. president after Ryder Cup win</a>"
5,Hamas's plan to infiltrate media and campuses worked: former FBI agent,https://nationalpost.com/opinion/hamass-plan-to-infiltrate-media-and-campuses-worked-former-fbi-agent?itm_source=trending,"<a href=""https://nationalpost.com/opinion/hamass-plan-to-infiltrate-media-and-campuses-worked-former-fbi-agent?itm_source=trending"">Hamas's plan to infiltrate media and campuses worked: former FBI agent</a>"
