Rank,Article title,url,title_with_link
1,Canadian icon Robert Munsch has chosen to die by MAID,https://nationalpost.com/news/canada/robert-munsch-maid-dementia?itm_source=trending,"<a href=""https://nationalpost.com/news/canada/robert-munsch-maid-dementia?itm_source=trending"">Canadian icon Robert Munsch has chosen to die by MAID</a>"
2,Derek Burney: World order unravelling as Trump pulls at the strings,https://nationalpost.com/opinion/world-order-unravelling-as-trump-pulls-at-the-strings?itm_source=trending,"<a href=""https://nationalpost.com/opinion/world-order-unravelling-as-trump-pulls-at-the-strings?itm_source=trending"">Derek Burney: World order unravelling as Trump pulls at the strings</a>"
3,Subscriber only.John Ivison: Politics have become too serious for Chrystia Freeland,https://nationalpost.com/opinion/ivison-politics-have-become-too-serious-for-chrystia-freeland?itm_source=trending,"<a href=""https://nationalpost.com/opinion/ivison-politics-have-become-too-serious-for-chrystia-freeland?itm_source=trending"">Subscriber only.John Ivison: Politics have become too serious for Chrystia Freeland</a>"
4,"Layoffs at Google, X helped spur 'avalanche' of online terrorist content since Oct. 7: government documents",https://nationalpost.com/news/canada/layoffs-at-google-x-helped-spur-avalanche-of-online-terrorist-content-since-oct-7-government-documents?itm_source=trending,"<a href=""https://nationalpost.com/news/canada/layoffs-at-google-x-helped-spur-avalanche-of-online-terrorist-content-since-oct-7-government-documents?itm_source=trending"">Layoffs at Google, X helped spur 'avalanche' of online terrorist content since Oct. 7: government documents</a>"
5,"What Tyler Robinson texted his roommate after Charlie Kirk assassination, according to court documents",https://nationalpost.com/news/world/what-tyler-robinson-texted-his-roommate-after-charlie-kirk-assassination-according-to-court-documents?itm_source=trending,"<a href=""https://nationalpost.com/news/world/what-tyler-robinson-texted-his-roommate-after-charlie-kirk-assassination-according-to-court-documents?itm_source=trending"">What Tyler Robinson texted his roommate after Charlie Kirk assassination, according to court documents</a>"
