Rank,Article title,url,title_with_link
1,How Canadian flyers can stop their luggage from turning into a drug shipment due to airport bag tag swaps,https://nationalpost.com/news/canadians-bag-tag-airport-switching-scheme,"<a href=""https://nationalpost.com/news/canadians-bag-tag-airport-switching-scheme"">How Canadian flyers can stop their luggage from turning into a drug shipment due to airport bag tag swaps</a>"
2,Pierre Poilievre needs a historic comeback — here's how he can do it,https://nationalpost.com/news/canada/pierre-poilievre-needs-a-historic-comeback-heres-how-he-can-do-it,"<a href=""https://nationalpost.com/news/canada/pierre-poilievre-needs-a-historic-comeback-heres-how-he-can-do-it"">Pierre Poilievre needs a historic comeback — here's how he can do it</a>"
3,Alberta First Nation councillor alleges chief sent her a $421K invoice to prevent her from running again,https://nationalpost.com/news/canada/alberta-first-nation-councillor-alleges-chief-sent-her-a-421k-invoice-to-prevent-her-from-running-again,"<a href=""https://nationalpost.com/news/canada/alberta-first-nation-councillor-alleges-chief-sent-her-a-421k-invoice-to-prevent-her-from-running-again"">Alberta First Nation councillor alleges chief sent her a $421K invoice to prevent her from running again</a>"
4,'Disgust': Head of RCMP union seeking answers for how CBC-related prank was greenlit,https://nationalpost.com/news/politics/head-of-rcmp-union-seeking-answers-for-how-cbc-related-prank-targeting-retired-mounties-was-okd,"<a href=""https://nationalpost.com/news/politics/head-of-rcmp-union-seeking-answers-for-how-cbc-related-prank-targeting-retired-mounties-was-okd"">'Disgust': Head of RCMP union seeking answers for how CBC-related prank was greenlit</a>"
5,Joel Kotkin: Socialism once again rears its ugly head,https://nationalpost.com/opinion/socialism-once-again-rears-its-ugly-head,"<a href=""https://nationalpost.com/opinion/socialism-once-again-rears-its-ugly-head"">Joel Kotkin: Socialism once again rears its ugly head</a>"
