Rank,Article title,url,title_with_link
1,Why Quebec won't make a bilateral trade deal with Ontario,https://nationalpost.com/news/why-quebec-wont-make-a-bilateral-trade-deal-with-ontario,"<a href=""https://nationalpost.com/news/why-quebec-wont-make-a-bilateral-trade-deal-with-ontario"">Why Quebec won't make a bilateral trade deal with Ontario</a>"
2,"What to know about Justice Maria Carroccia, the judge who acquitted the five Team Canada players",https://nationalpost.com/news/canada/what-to-know-about-justice-maria-carroccia-the-judge-who-acquitted-the-five-team-canada-players,"<a href=""https://nationalpost.com/news/canada/what-to-know-about-justice-maria-carroccia-the-judge-who-acquitted-the-five-team-canada-players"">What to know about Justice Maria Carroccia, the judge who acquitted the five Team Canada players</a>"
3,Trump's Golden Dome missile-defence push on Canada leaves Ottawa with few good options,https://nationalpost.com/news/canada/trumps-golden-dome-push-canada-few-good-options,"<a href=""https://nationalpost.com/news/canada/trumps-golden-dome-push-canada-few-good-options"">Trump's Golden Dome missile-defence push on Canada leaves Ottawa with few good options</a>"
4,'A wake-up call': Stephen Harper says he advised Carney team to look outside U.S. for trade growth,https://nationalpost.com/news/canada/stephen-harper-trade-advice-carney,"<a href=""https://nationalpost.com/news/canada/stephen-harper-trade-advice-carney"">'A wake-up call': Stephen Harper says he advised Carney team to look outside U.S. for trade growth</a>"
5,"What the final offer from Canada Post includes, and why the union wants workers to vote no",https://nationalpost.com/news/canada/canada-post-cupw-final-contract-offer,"<a href=""https://nationalpost.com/news/canada/canada-post-cupw-final-contract-offer"">What the final offer from Canada Post includes, and why the union wants workers to vote no</a>"
