Rank,Article title,url,title_with_link
1,"What we know about Seth Hatfield, the suspect in Montreal shootings that killed a cop and a civilian",https://nationalpost.com/news/canada/what-we-know-about-seth-hatfield-the-suspect-in-montreal-shootings-that-killed-a-cop-and-a-civilian,"<a href=""https://nationalpost.com/news/canada/what-we-know-about-seth-hatfield-the-suspect-in-montreal-shootings-that-killed-a-cop-and-a-civilian"">What we know about Seth Hatfield, the suspect in Montreal shootings that killed a cop and a civilian</a>"
2,FIRST READING: Canada intervenes (again) to stop housing prices going down,https://nationalpost.com/opinion/canada-intervenes-again-to-stop-housing-prices-going-down,"<a href=""https://nationalpost.com/opinion/canada-intervenes-again-to-stop-housing-prices-going-down"">FIRST READING: Canada intervenes (again) to stop housing prices going down</a>"
3,"Canadians could get up to $1,826 over the next year from a new government benefit. Here's who qualifies",https://nationalpost.com/news/canada/groceries-and-essentials-benefit-canada,"<a href=""https://nationalpost.com/news/canada/groceries-and-essentials-benefit-canada"">Canadians could get up to $1,826 over the next year from a new government benefit. Here's who qualifies</a>"
4,Montreal mayor calls for stricter gun control in wake of deadly shootings,https://nationalpost.com/news/canada/montreal-mayor-calls-for-stricter-gun-control-in-wake-of-deadly-shootings,"<a href=""https://nationalpost.com/news/canada/montreal-mayor-calls-for-stricter-gun-control-in-wake-of-deadly-shootings"">Montreal mayor calls for stricter gun control in wake of deadly shootings</a>"
5,The Western Surrender: English liberty has been sacrificed to silence critics of immigration,https://nationalpost.com/opinion/the-western-surrender-in-the-u-k-the-indigenous-people-are-white-its-getting-decolonized-anyway,"<a href=""https://nationalpost.com/opinion/the-western-surrender-in-the-u-k-the-indigenous-people-are-white-its-getting-decolonized-anyway"">The Western Surrender: English liberty has been sacrificed to silence critics of immigration</a>"
