Rank,Article title,url,title_with_link
1,University of Alberta law professor put on leave amid review of online comments made after Charlie Kirk's death,https://nationalpost.com/news/canada/university-of-alberta-law-professor-put-on-leave-amid-review-of-online-comments-made-after-charlie-kirks-death?itm_source=trending,"<a href=""https://nationalpost.com/news/canada/university-of-alberta-law-professor-put-on-leave-amid-review-of-online-comments-made-after-charlie-kirks-death?itm_source=trending"">University of Alberta law professor put on leave amid review of online comments made after Charlie Kirk's death</a>"
2,"He sent CRA a paper tax filing for his inactive company. CRA sent back a $1,000 fine",https://nationalpost.com/news/politics/he-sent-cra-a-paper-tax-filing-for-his-inactive-company-cra-sent-back-a-1000-fine?itm_source=trending,"<a href=""https://nationalpost.com/news/politics/he-sent-cra-a-paper-tax-filing-for-his-inactive-company-cra-sent-back-a-1000-fine?itm_source=trending"">He sent CRA a paper tax filing for his inactive company. CRA sent back a $1,000 fine</a>"
3,"Here's everything Jimmy Kimmel said about Donald Trump, Charlie Kirk before his show was suspended",https://nationalpost.com/news/world/what-jimmy-kimmel-said-trump-kirk?itm_source=trending,"<a href=""https://nationalpost.com/news/world/what-jimmy-kimmel-said-trump-kirk?itm_source=trending"">Here's everything Jimmy Kimmel said about Donald Trump, Charlie Kirk before his show was suspended</a>"
4,Jewish law prof loses bid to quash TMU's decision not to discipline students who signed 'antisemitic' letter,https://nationalpost.com/news/toronto/toronto-metropolitan-university-october-7-letter-law-students?itm_source=trending,"<a href=""https://nationalpost.com/news/toronto/toronto-metropolitan-university-october-7-letter-law-students?itm_source=trending"">Jewish law prof loses bid to quash TMU's decision not to discipline students who signed 'antisemitic' letter</a>"
5,B.C. Premier Eby urges Carney to 'look west' but won't budge on tanker ban,https://nationalpost.com/news/canada/b-c-premier-eby-urges-carney-to-look-west-but-wont-budge-on-tanker-ban?itm_source=trending,"<a href=""https://nationalpost.com/news/canada/b-c-premier-eby-urges-carney-to-look-west-but-wont-budge-on-tanker-ban?itm_source=trending"">B.C. Premier Eby urges Carney to 'look west' but won't budge on tanker ban</a>"
