Rank,Article title,url,title_with_link
1,Defence minister 'didn't know' about Iranian strike on base housing Canadians until after media report,https://nationalpost.com/news/canada/defence-minister-didnt-know-about-iranian-strike-on-kuwait-air-base-where-canadian-forces-were-stationed-until-after-media-report,"<a href=""https://nationalpost.com/news/canada/defence-minister-didnt-know-about-iranian-strike-on-kuwait-air-base-where-canadian-forces-were-stationed-until-after-media-report"">Defence minister 'didn't know' about Iranian strike on base housing Canadians until after media report</a>"
2,Sylvain Charlebois: A plan to slowly wean Canada off supply management,https://nationalpost.com/opinion/a-plan-to-slowly-wean-canada-off-supply-management,"<a href=""https://nationalpost.com/opinion/a-plan-to-slowly-wean-canada-off-supply-management"">Sylvain Charlebois: A plan to slowly wean Canada off supply management</a>"
3,"Joe Rogan podcast the 'best place to sell Americans' on the tariff-free trade pitch, Pierre Poilievre says",https://nationalpost.com/news/canada/pierre-poilievre-joe-rogan-podcast,"<a href=""https://nationalpost.com/news/canada/pierre-poilievre-joe-rogan-podcast"">Joe Rogan podcast the 'best place to sell Americans' on the tariff-free trade pitch, Pierre Poilievre says</a>"
4,"Increasingly desperate Iran raises risk of 'last gasp' terror attacks in Canada, U.S.",https://nationalpost.com/news/increasingly-desperate-iran-raises-risk-of-last-gasp-terror-attacks-in-canada-u-s,"<a href=""https://nationalpost.com/news/increasingly-desperate-iran-raises-risk-of-last-gasp-terror-attacks-in-canada-u-s"">Increasingly desperate Iran raises risk of 'last gasp' terror attacks in Canada, U.S.</a>"
5,"Government awards $307M contract to Colt Canada to manufacture over 65,000 rifles for the Canadian Armed Forces",https://nationalpost.com/news/politics/government-awards-307m-contract-to-colt-canada-to-manufacture-over-65000-rifles-for-the-canadian-armed-forces,"<a href=""https://nationalpost.com/news/politics/government-awards-307m-contract-to-colt-canada-to-manufacture-over-65000-rifles-for-the-canadian-armed-forces"">Government awards $307M contract to Colt Canada to manufacture over 65,000 rifles for the Canadian Armed Forces</a>"
