Rank,Article title,url,title_with_link
1,"'I'm the boss', Trump tells G7 counterparts",https://nationalpost.com/news/world/im-the-boss-trump-tells-g7-counterparts,"<a href=""https://nationalpost.com/news/world/im-the-boss-trump-tells-g7-counterparts"">'I'm the boss', Trump tells G7 counterparts</a>"
2,Jamie Sarkonak: Unilingual Canadians are inferior in the Supreme Court's eyes,https://nationalpost.com/opinion/jamie-sarkonak-unilingual-canadians-are-inferior-in-the-supreme-courts-eyes,"<a href=""https://nationalpost.com/opinion/jamie-sarkonak-unilingual-canadians-are-inferior-in-the-supreme-courts-eyes"">Jamie Sarkonak: Unilingual Canadians are inferior in the Supreme Court's eyes</a>"
3,Maya Gebala 'gets to experience life again' as family shares hopeful updates,https://nationalpost.com/news/canada/maya-gebala-gets-to-experience-life-again-as-family-share-hopeful-updates,"<a href=""https://nationalpost.com/news/canada/maya-gebala-gets-to-experience-life-again-as-family-share-hopeful-updates"">Maya Gebala 'gets to experience life again' as family shares hopeful updates</a>"
4,CBC will no longer air Hockey Night in Canada as 12-year partnership comes to an end,https://nationalpost.com/news/canada/cbc-will-no-longer-air-hockey-night-in-canada-as-12-year-partnership-comes-to-an-end,"<a href=""https://nationalpost.com/news/canada/cbc-will-no-longer-air-hockey-night-in-canada-as-12-year-partnership-comes-to-an-end"">CBC will no longer air Hockey Night in Canada as 12-year partnership comes to an end</a>"
5,Mark Carney calls Trump's Iran peace deal a 'game changer' in CNN interview,https://nationalpost.com/news/canada/carney-calls-trumps-iran-peace-deal-a-gamechanger-in-cnn-interview,"<a href=""https://nationalpost.com/news/canada/carney-calls-trumps-iran-peace-deal-a-gamechanger-in-cnn-interview"">Mark Carney calls Trump's Iran peace deal a 'game changer' in CNN interview</a>"
