Rank,Article title,url,title_with_link
1,Two dead in 'targeted' shooting at Toronto salsa street festival that injured four others; public not at risk: police,https://nationalpost.com/news/canada/shooting-toronto-salsa-festival-st-clair,"<a href=""https://nationalpost.com/news/canada/shooting-toronto-salsa-festival-st-clair"">Two dead in 'targeted' shooting at Toronto salsa street festival that injured four others; public not at risk: police</a>"
2,"Foreign migrant living illegally in Canada eligible for Ontario welfare, tribunal rules",https://nationalpost.com/news/foreign-migrant-living-illegally-in-canada-eligible-for-ontario-welfare-tribunal-rules,"<a href=""https://nationalpost.com/news/foreign-migrant-living-illegally-in-canada-eligible-for-ontario-welfare-tribunal-rules"">Foreign migrant living illegally in Canada eligible for Ontario welfare, tribunal rules</a>"
3,"Top 20% of Canadian earners pay more than half of all taxes, says study warning against increasing rates",https://nationalpost.com/news/canada/top-20-of-canadian-earners-pay-more-than-half-of-all-taxes-says-study-warning-against-increasing-rates,"<a href=""https://nationalpost.com/news/canada/top-20-of-canadian-earners-pay-more-than-half-of-all-taxes-says-study-warning-against-increasing-rates"">Top 20% of Canadian earners pay more than half of all taxes, says study warning against increasing rates</a>"
4,‘It was 100 per cent co-ordinated’: Montreal restaurateur warns others after dine-and-dash,https://nationalpost.com/montreal-news/it-was-100-per-cent-co-ordinated-montreal-restaurateur-warns-others-after-dine-and-dash/wcm/3a6905b4-cbdb-4121-8d3b-003a44a36ece,"<a href=""https://nationalpost.com/montreal-news/it-was-100-per-cent-co-ordinated-montreal-restaurateur-warns-others-after-dine-and-dash/wcm/3a6905b4-cbdb-4121-8d3b-003a44a36ece"">‘It was 100 per cent co-ordinated’: Montreal restaurateur warns others after dine-and-dash</a>"
5,Bryan Brulotte: Canada can't afford another unbuilt pipeline,https://nationalpost.com/opinion/bryan-brulotte-canada-cant-afford-another-unbuilt-pipeline,"<a href=""https://nationalpost.com/opinion/bryan-brulotte-canada-cant-afford-another-unbuilt-pipeline"">Bryan Brulotte: Canada can't afford another unbuilt pipeline</a>"
