Rank,Article title,url,title_with_link
1,"Woman, 77, who went overboard on cruise not located after eight-hour search",https://nationalpost.com/news/world/woman-overboard-cruise-not-located,"<a href=""https://nationalpost.com/news/world/woman-overboard-cruise-not-located"">Woman, 77, who went overboard on cruise not located after eight-hour search</a>"
2,Ontario judge reluctantly accedes to 'very lenient' sentence for drug dealer who terrorized two women,https://nationalpost.com/news/canada/ontario-judge-accedes-to-very-lenient-sentence-for-drug-dealer-who-terrorized-two-women,"<a href=""https://nationalpost.com/news/canada/ontario-judge-accedes-to-very-lenient-sentence-for-drug-dealer-who-terrorized-two-women"">Ontario judge reluctantly accedes to 'very lenient' sentence for drug dealer who terrorized two women</a>"
3,Nearly five million visas were set to expire in 2025. Where are the visa holders now?,https://nationalpost.com/opinion/where-are-expired-visa-holders-now,"<a href=""https://nationalpost.com/opinion/where-are-expired-visa-holders-now"">Nearly five million visas were set to expire in 2025. Where are the visa holders now?</a>"
4,Ontario judge sets aside pharmacist's Canadian citizenship revocation over alleged fraud,https://nationalpost.com/news/canada/ontario-judge-sets-aside-pharmacists-canadian-citizenship-revocation-over-alleged-fraud,"<a href=""https://nationalpost.com/news/canada/ontario-judge-sets-aside-pharmacists-canadian-citizenship-revocation-over-alleged-fraud"">Ontario judge sets aside pharmacist's Canadian citizenship revocation over alleged fraud</a>"
5,How Canada can get more leverage on Trump in 2026,https://nationalpost.com/news/canada-more-leverage-trump-2026,"<a href=""https://nationalpost.com/news/canada-more-leverage-trump-2026"">How Canada can get more leverage on Trump in 2026</a>"
