Rank,Article title,url,title_with_link
1,Sophie Grégoire Trudeau opens up about coping with Justin's public romance with Katy Perry,https://nationalpost.com/news/canada/sophie-gregoire-trudeau-coping-with-justins-public-romance,"<a href=""https://nationalpost.com/news/canada/sophie-gregoire-trudeau-coping-with-justins-public-romance"">Sophie Grégoire Trudeau opens up about coping with Justin's public romance with Katy Perry</a>"
2,Palestinians living in Gaza lose lawsuits that would force Canada to process crisis travel visas,https://nationalpost.com/news/canada/palestinians-gaza-lawsuits-canada-travel-visas,"<a href=""https://nationalpost.com/news/canada/palestinians-gaza-lawsuits-canada-travel-visas"">Palestinians living in Gaza lose lawsuits that would force Canada to process crisis travel visas</a>"
3,Chris Selley: Who will stop our kids from getting dumber?,https://nationalpost.com/opinion/chris-selley-who-will-stop-our-kids-from-getting-dumber,"<a href=""https://nationalpost.com/opinion/chris-selley-who-will-stop-our-kids-from-getting-dumber"">Chris Selley: Who will stop our kids from getting dumber?</a>"
4,Subscriber only.John Ivison: Another round of major projects from Carney that don’t live up to the billing,https://nationalpost.com/opinion/ivison-another-round-of-major-projects-from-carney-that-dont-live-up-to-billing,"<a href=""https://nationalpost.com/opinion/ivison-another-round-of-major-projects-from-carney-that-dont-live-up-to-billing"">Subscriber only.John Ivison: Another round of major projects from Carney that don’t live up to the billing</a>"
5,Canada's spy chief warns of increasing violent radicalization of Canadian children,https://nationalpost.com/news/politics/canadas-spy-chief-warns-of-increasing-violent-radicalization-of-canadian-children,"<a href=""https://nationalpost.com/news/politics/canadas-spy-chief-warns-of-increasing-violent-radicalization-of-canadian-children"">Canada's spy chief warns of increasing violent radicalization of Canadian children</a>"
