Rank,Article title,url,title_with_link
1,Liberals urged to cut Old Age Security spending in upcoming budget,https://nationalpost.com/news/canada/liberals-urged-to-cut-old-age-security-spending-in-upcoming-budget?itm_source=trending,"<a href=""https://nationalpost.com/news/canada/liberals-urged-to-cut-old-age-security-spending-in-upcoming-budget?itm_source=trending"">Liberals urged to cut Old Age Security spending in upcoming budget</a>"
2,Jamie Sarkonak: Alberta's licence plate redo threatens to swap heritage for tackiness,https://nationalpost.com/opinion/jamie-sarkonak-albertas-licence-plate-redo-threatens-to-swap-heritage-for-tackiness?itm_source=trending,"<a href=""https://nationalpost.com/opinion/jamie-sarkonak-albertas-licence-plate-redo-threatens-to-swap-heritage-for-tackiness?itm_source=trending"">Jamie Sarkonak: Alberta's licence plate redo threatens to swap heritage for tackiness</a>"
3,"Aboriginal title decision 'may compromise' ownership status of Richmond, B.C., properties, says mayor",https://nationalpost.com/news/canada/aboriginal-title-decision-may-compromise-ownership-status-of-richmond-b-c-properties-says-mayor?itm_source=trending,"<a href=""https://nationalpost.com/news/canada/aboriginal-title-decision-may-compromise-ownership-status-of-richmond-b-c-properties-says-mayor?itm_source=trending"">Aboriginal title decision 'may compromise' ownership status of Richmond, B.C., properties, says mayor</a>"
4,Feds 'covered up' toxic chemicals in the water in this Ontario city for 5 years,https://nationalpost.com/feature/north-bay-ontario-department-of-national-defence-toxic-water?itm_source=trending,"<a href=""https://nationalpost.com/feature/north-bay-ontario-department-of-national-defence-toxic-water?itm_source=trending"">Feds 'covered up' toxic chemicals in the water in this Ontario city for 5 years</a>"
5,Blue Jays are World Series-bound after knocking off Mariners in Game 7,https://nationalpost.com/news/canada/jays-guerrero-jr-born-ready-game-seven?itm_source=trending,"<a href=""https://nationalpost.com/news/canada/jays-guerrero-jr-born-ready-game-seven?itm_source=trending"">Blue Jays are World Series-bound after knocking off Mariners in Game 7</a>"
