Rank,Article title,url,title_with_link
1,"Kentucky Derby’s $400,000 suites sell out in bigger luxury bet",https://nationalpost.com/news/kentucky-derbys-400000-suites-sell-out-in-bigger-luxury-bet,"<a href=""https://nationalpost.com/news/kentucky-derbys-400000-suites-sell-out-in-bigger-luxury-bet"">Kentucky Derby’s $400,000 suites sell out in bigger luxury bet</a>"
2,CRA refunding $647 million collected from repealed digital service tax,https://nationalpost.com/news/canada/cra-refunding-647-million-collected-from-repealed-digital-service-tax,"<a href=""https://nationalpost.com/news/canada/cra-refunding-647-million-collected-from-repealed-digital-service-tax"">CRA refunding $647 million collected from repealed digital service tax</a>"
3,Subscriber only.Conrad Black: Canada's path back to prosperity,https://nationalpost.com/opinion/canadas-path-back-to-prosperity,"<a href=""https://nationalpost.com/opinion/canadas-path-back-to-prosperity"">Subscriber only.Conrad Black: Canada's path back to prosperity</a>"
4,"Ironically, this Canadian city has been voted the best place for Gen Z to live in Canada",https://nationalpost.com/news/ironically-this-canadian-city-has-been-voted-the-best-place-for-gen-z-to-live-in-canada,"<a href=""https://nationalpost.com/news/ironically-this-canadian-city-has-been-voted-the-best-place-for-gen-z-to-live-in-canada"">Ironically, this Canadian city has been voted the best place for Gen Z to live in Canada</a>"
5,"Failed refugee claimant, MS-13 gang informant, identity thief and forger can stay in Canada",https://nationalpost.com/news/canada/failed-refugee-claimant-ms-13-gang-informant-identity-thief-and-forger-can-stay-in-canada,"<a href=""https://nationalpost.com/news/canada/failed-refugee-claimant-ms-13-gang-informant-identity-thief-and-forger-can-stay-in-canada"">Failed refugee claimant, MS-13 gang informant, identity thief and forger can stay in Canada</a>"
