Rank,Article title,url,title_with_link
1,"Ex-RBC employee charged with fraud, identity theft for accessing Mark Carney’s personal data",https://nationalpost.com/news/politics/mark-carney-identity-theft-rbc?itm_source=trending,"<a href=""https://nationalpost.com/news/politics/mark-carney-identity-theft-rbc?itm_source=trending"">Ex-RBC employee charged with fraud, identity theft for accessing Mark Carney’s personal data</a>"
2,Terry Newman: You have no idea how crazy Concordia's student handbook is,https://nationalpost.com/opinion/terry-newman-3?itm_source=trending,"<a href=""https://nationalpost.com/opinion/terry-newman-3?itm_source=trending"">Terry Newman: You have no idea how crazy Concordia's student handbook is</a>"
3,N.B. volleyball coach fired after he told veterans they would have to try out again wins wrongful dismissal suit,https://nationalpost.com/news/canada/university-of-new-brunswick-volleyball?itm_source=trending,"<a href=""https://nationalpost.com/news/canada/university-of-new-brunswick-volleyball?itm_source=trending"">N.B. volleyball coach fired after he told veterans they would have to try out again wins wrongful dismissal suit</a>"
4,Woman 'literally stuck' inside clear cruise ship water slide over the ocean,https://nationalpost.com/news/waterslide-cruise-ship-canadian-coast?itm_source=trending,"<a href=""https://nationalpost.com/news/waterslide-cruise-ship-canadian-coast?itm_source=trending"">Woman 'literally stuck' inside clear cruise ship water slide over the ocean</a>"
5,Peter MacKinnon: Canadians should thank Steven Pinker for denouncing DEI in Parliament,https://nationalpost.com/opinion/canadians-should-thank-steven-pinker-for-denouncing-dei-in-parliament?itm_source=trending,"<a href=""https://nationalpost.com/opinion/canadians-should-thank-steven-pinker-for-denouncing-dei-in-parliament?itm_source=trending"">Peter MacKinnon: Canadians should thank Steven Pinker for denouncing DEI in Parliament</a>"
