Rank,Article title,url,title_with_link
1,Terry Newman: Freeland to lead Ukraine's economic recovery? Don't make me laugh,https://nationalpost.com/opinion/terry-newman-freeland-to-lead-ukraines-economic-recovery-dont-make-me-laugh,"<a href=""https://nationalpost.com/opinion/terry-newman-freeland-to-lead-ukraines-economic-recovery-dont-make-me-laugh"">Terry Newman: Freeland to lead Ukraine's economic recovery? Don't make me laugh</a>"
2,"Kingston woman’s distracted driving charge being dropped 'a warning to police,' lawyer says",https://nationalpost.com/news/kingston-womans-distracted-driving-charge-being-dropped-a-warning-to-police-lawyer-says/wcm/bb5238a7-f4ec-4669-a66a-2aa23e678f0b,"<a href=""https://nationalpost.com/news/kingston-womans-distracted-driving-charge-being-dropped-a-warning-to-police-lawyer-says/wcm/bb5238a7-f4ec-4669-a66a-2aa23e678f0b"">Kingston woman’s distracted driving charge being dropped 'a warning to police,' lawyer says</a>"
3,FIRST READING: There's not actually anything to stop Canadian MPs working for foreign governments,https://nationalpost.com/opinion/theres-not-actually-anything-to-stop-canadian-mps-working-for-foreign-governments,"<a href=""https://nationalpost.com/opinion/theres-not-actually-anything-to-stop-canadian-mps-working-for-foreign-governments"">FIRST READING: There's not actually anything to stop Canadian MPs working for foreign governments</a>"
4,Subscriber only.John Ivison: Starkly different reactions by Carney and Poilievre to Venezuela are revealing,https://nationalpost.com/opinion/ivison-carney-poilievre-reactions-to-venezuela-revealing,"<a href=""https://nationalpost.com/opinion/ivison-carney-poilievre-reactions-to-venezuela-revealing"">Subscriber only.John Ivison: Starkly different reactions by Carney and Poilievre to Venezuela are revealing</a>"
5,J.D. Tuccille: Venezuela offers a lesson in how socialism ruins countries,https://nationalpost.com/opinion/j-d-tuccille-venezuela-offers-a-lesson-in-the-horrors-of-socialism,"<a href=""https://nationalpost.com/opinion/j-d-tuccille-venezuela-offers-a-lesson-in-the-horrors-of-socialism"">J.D. Tuccille: Venezuela offers a lesson in how socialism ruins countries</a>"
