Rank,Article title,url,title_with_link
1,N.B. volleyball coach fired after he told veterans they would have to try out again wins wrongful dismissal suit,https://nationalpost.com/news/canada/university-of-new-brunswick-volleyball?itm_source=trending,"<a href=""https://nationalpost.com/news/canada/university-of-new-brunswick-volleyball?itm_source=trending"">N.B. volleyball coach fired after he told veterans they would have to try out again wins wrongful dismissal suit</a>"
2,"Former RBC employee charged with fraud, identity theft for accessing Mark Carney’s personal data",https://nationalpost.com/news/politics/mark-carney-identity-theft-rbc?itm_source=trending,"<a href=""https://nationalpost.com/news/politics/mark-carney-identity-theft-rbc?itm_source=trending"">Former RBC employee charged with fraud, identity theft for accessing Mark Carney’s personal data</a>"
3,Terry Newman: You have no idea how crazy Concordia's student handbook is,https://nationalpost.com/opinion/terry-newman-3?itm_source=trending,"<a href=""https://nationalpost.com/opinion/terry-newman-3?itm_source=trending"">Terry Newman: You have no idea how crazy Concordia's student handbook is</a>"
4,Joe Rogan says it's 'crazy' for 'people on the right' to support Jimmy Kimmel's suspension,https://nationalpost.com/news/world/joe-rogan-jimmy-kimmel-suspension?itm_source=trending,"<a href=""https://nationalpost.com/news/world/joe-rogan-jimmy-kimmel-suspension?itm_source=trending"">Joe Rogan says it's 'crazy' for 'people on the right' to support Jimmy Kimmel's suspension</a>"
5,Woman 'literally stuck' inside clear cruise ship water slide over the ocean,https://nationalpost.com/news/waterslide-cruise-ship-canadian-coast?itm_source=trending,"<a href=""https://nationalpost.com/news/waterslide-cruise-ship-canadian-coast?itm_source=trending"">Woman 'literally stuck' inside clear cruise ship water slide over the ocean</a>"
