Rank,Article title,url,title_with_link
1,Jamie Sarkonak: Chief justice says existence of Canada's border is discrimination,https://nationalpost.com/opinion/jamie-sarkonak-chief-justice-says-existence-of-canadas-border-is-discrimination,"<a href=""https://nationalpost.com/opinion/jamie-sarkonak-chief-justice-says-existence-of-canadas-border-is-discrimination"">Jamie Sarkonak: Chief justice says existence of Canada's border is discrimination</a>"
2,Chris Selley: Carney sows the seeds of his eventual defeat,https://nationalpost.com/opinion/selley-carney-sows-seeds-of-his-eventual-defeat,"<a href=""https://nationalpost.com/opinion/selley-carney-sows-seeds-of-his-eventual-defeat"">Chris Selley: Carney sows the seeds of his eventual defeat</a>"
3,"'Canada's got a great team, too': U.S. Republican senator says Olympic men's hockey game was 'well played'",https://nationalpost.com/news/canada/canadas-olympic-mens-hockey-team-senator-john-neely-kennedy,"<a href=""https://nationalpost.com/news/canada/canadas-olympic-mens-hockey-team-senator-john-neely-kennedy"">'Canada's got a great team, too': U.S. Republican senator says Olympic men's hockey game was 'well played'</a>"
4,This hockey team has lost every single one of its 48 games this season. Its last shot at a win is this weekend,https://nationalpost.com/news/sarnia-legionnaires-last-shot-at-a-hockey-win,"<a href=""https://nationalpost.com/news/sarnia-legionnaires-last-shot-at-a-hockey-win"">This hockey team has lost every single one of its 48 games this season. Its last shot at a win is this weekend</a>"
5,The surprise fight for the trademark of a notorious outlaw biker club with a deadly history,https://nationalpost.com/news/rock-machine-motorcycle-club-patch-trademark,"<a href=""https://nationalpost.com/news/rock-machine-motorcycle-club-patch-trademark"">The surprise fight for the trademark of a notorious outlaw biker club with a deadly history</a>"
