Rank,Article title,url,title_with_link
1,EXCLUSIVE: Leaked audio of CBC disciplinary meeting with former TV host Travis Dhanraj,https://nationalpost.com/news/canada/cbc-travis-dhanraj-disciplinary-meeting,"<a href=""https://nationalpost.com/news/canada/cbc-travis-dhanraj-disciplinary-meeting"">EXCLUSIVE: Leaked audio of CBC disciplinary meeting with former TV host Travis Dhanraj</a>"
2,Michael Higgins: Locking Tamara Lich up for 7 years would be shameful retribution,https://nationalpost.com/opinion/michael-higgins-locking-tamara-lich-up-for-7-years-would-be-shameful-retribution,"<a href=""https://nationalpost.com/opinion/michael-higgins-locking-tamara-lich-up-for-7-years-would-be-shameful-retribution"">Michael Higgins: Locking Tamara Lich up for 7 years would be shameful retribution</a>"
3,'Legalized election interference': Poilievre byelection challengers blast long-ballot protest group,https://nationalpost.com/news/politics/poilievre-byelection-challengers-long-ballot-protest-legalized-interference,"<a href=""https://nationalpost.com/news/politics/poilievre-byelection-challengers-long-ballot-protest-legalized-interference"">'Legalized election interference': Poilievre byelection challengers blast long-ballot protest group</a>"
4,"U.S. senators meet with Carney, push to ‘reinvigorate’ CUSMA ahead of Trump deadline",https://nationalpost.com/news/us-senators-mark-carney-cusma-trump-tariffs,"<a href=""https://nationalpost.com/news/us-senators-mark-carney-cusma-trump-tariffs"">U.S. senators meet with Carney, push to ‘reinvigorate’ CUSMA ahead of Trump deadline</a>"
5,How Canadian fentanyl smuggling to the U.S. really works and who’s behind it: Full Comment podcast,https://nationalpost.com/opinion/how-canadian-fentanyl-smuggling-to-the-u-s-really-works-and-whos-behind-it-full-comment-podcast,"<a href=""https://nationalpost.com/opinion/how-canadian-fentanyl-smuggling-to-the-u-s-really-works-and-whos-behind-it-full-comment-podcast"">How Canadian fentanyl smuggling to the U.S. really works and who’s behind it: Full Comment podcast</a>"
