Rank,Article title,url,title_with_link
1,"Alberta, Ontario announce proposal for new west-east oil pipeline and minerals corridor",https://nationalpost.com/news/canada/alberta-ontario-announce-proposal-for-new-west-east-oil-pipeline-and-minerals-corridor,"<a href=""https://nationalpost.com/news/canada/alberta-ontario-announce-proposal-for-new-west-east-oil-pipeline-and-minerals-corridor"">Alberta, Ontario announce proposal for new west-east oil pipeline and minerals corridor</a>"
2,Judge says it would be 'cruel and unusual' to send Ontario man who sexually assaulted 12-year-old sister to jail,https://nationalpost.com/news/canada/ontario-man-incest,"<a href=""https://nationalpost.com/news/canada/ontario-man-incest"">Judge says it would be 'cruel and unusual' to send Ontario man who sexually assaulted 12-year-old sister to jail</a>"
3,Canada picks Germany’s TKMS to build ‘up to’ 12 submarines in largest Canadian defence purchase ever,https://nationalpost.com/news/politics/canada-picks-germanys-tkms-to-build-up-to-12-submarines-in-largest-canadian-defence-purchase-ever,"<a href=""https://nationalpost.com/news/politics/canada-picks-germanys-tkms-to-build-up-to-12-submarines-in-largest-canadian-defence-purchase-ever"">Canada picks Germany’s TKMS to build ‘up to’ 12 submarines in largest Canadian defence purchase ever</a>"
4,'This might be the tensest summit yet': Carney to meet NATO allies amid Trump threats,https://nationalpost.com/news/mark-carney-to-meet-nato-allies-amid-trump-threats,"<a href=""https://nationalpost.com/news/mark-carney-to-meet-nato-allies-amid-trump-threats"">'This might be the tensest summit yet': Carney to meet NATO allies amid Trump threats</a>"
5,"A 'quarter to a third' of Smith's caucus against pipeline deal with Ottawa, says former MLA",https://nationalpost.com/news/canada/a-quarter-to-a-third-of-smiths-caucus-against-pipeline-deal-with-ottawa-says-former-mla,"<a href=""https://nationalpost.com/news/canada/a-quarter-to-a-third-of-smiths-caucus-against-pipeline-deal-with-ottawa-says-former-mla"">A 'quarter to a third' of Smith's caucus against pipeline deal with Ottawa, says former MLA</a>"
