Rank,Article title,url,title_with_link
1,An American sent to Canada was shocked by how furious Canadians are at the U.S.,https://nationalpost.com/news/canada/an-american-sent-to-canada-was-shocked-by-how-furious-canadians-are-at-the-u-s,"<a href=""https://nationalpost.com/news/canada/an-american-sent-to-canada-was-shocked-by-how-furious-canadians-are-at-the-u-s"">An American sent to Canada was shocked by how furious Canadians are at the U.S.</a>"
2,"Don Cherry, one of the greatest Canadians in the nation's history — for a time",https://nationalpost.com/feature/don-cherry-one-of-the-greatest-canadians-in-the-nations-history,"<a href=""https://nationalpost.com/feature/don-cherry-one-of-the-greatest-canadians-in-the-nations-history"">Don Cherry, one of the greatest Canadians in the nation's history — for a time</a>"
3,"Defence seeks absolute discharge as sentencing hearing continues for Freedom Convoy leaders Lich, Barber",https://nationalpost.com/news/canada/tamara-lich-chris-barber-sentencing-hearing,"<a href=""https://nationalpost.com/news/canada/tamara-lich-chris-barber-sentencing-hearing"">Defence seeks absolute discharge as sentencing hearing continues for Freedom Convoy leaders Lich, Barber</a>"
4,Gasps in court as all five players acquitted in Hockey Canada sexual assault trial,https://nationalpost.com/news/local-news/all-five-players-acquitted-in-hockey-canada-sexual-assault-trial/wcm/ca56ed98-de4b-44a1-8397-2147443b2466,"<a href=""https://nationalpost.com/news/local-news/all-five-players-acquitted-in-hockey-canada-sexual-assault-trial/wcm/ca56ed98-de4b-44a1-8397-2147443b2466"">Gasps in court as all five players acquitted in Hockey Canada sexual assault trial</a>"
5,All six Canadian venues cancel Christian musician Sean Feucht’s shows,https://nationalpost.com/news/canada/sean-feucht-canadian-tour,"<a href=""https://nationalpost.com/news/canada/sean-feucht-canadian-tour"">All six Canadian venues cancel Christian musician Sean Feucht’s shows</a>"
