Rank,Article title,url,title_with_link
1,Opinion: Canada wasn't 'stolen' from Indigenous people,https://nationalpost.com/opinion/opinion-canada-wasnt-stolen-from-indigenous-people,"<a href=""https://nationalpost.com/opinion/opinion-canada-wasnt-stolen-from-indigenous-people"">Opinion: Canada wasn't 'stolen' from Indigenous people</a>"
2,Pro-Israel foundation makes case for reversal of Palestinian state recognition in letter to Canada's prime minister,https://nationalpost.com/news/pro-israel-foundation-lays-out-case-for-reversal-of-palestinian-state-recognition-in-letter-to-prime-minister,"<a href=""https://nationalpost.com/news/pro-israel-foundation-lays-out-case-for-reversal-of-palestinian-state-recognition-in-letter-to-prime-minister"">Pro-Israel foundation makes case for reversal of Palestinian state recognition in letter to Canada's prime minister</a>"
3,Canadians mistaking 'best before' and expiry dates are discarding hundreds of dollars in food: study,https://nationalpost.com/news/canada/canadians-mistaking-best-before-and-expiry-date-are-discarding-hundreds-of-dollars-in-food-study,"<a href=""https://nationalpost.com/news/canada/canadians-mistaking-best-before-and-expiry-date-are-discarding-hundreds-of-dollars-in-food-study"">Canadians mistaking 'best before' and expiry dates are discarding hundreds of dollars in food: study</a>"
4,Late-term abortions are being performed in Canada without a serious medical reason,https://nationalpost.com/news/canada/late-term-abortions-canada,"<a href=""https://nationalpost.com/news/canada/late-term-abortions-canada"">Late-term abortions are being performed in Canada without a serious medical reason</a>"
5,Chris Selley: Toronto's nightmare is apparently neighbourhood shops and cafés,https://nationalpost.com/opinion/chris-selley-torontos-nightmare-is-apparently-neighbourhood-shops-and-cafes,"<a href=""https://nationalpost.com/opinion/chris-selley-torontos-nightmare-is-apparently-neighbourhood-shops-and-cafes"">Chris Selley: Toronto's nightmare is apparently neighbourhood shops and cafés</a>"
