Rank,Article title,url,title_with_link
1,Trump interrupts Carney to talk 'merger of Canada and the United States',https://nationalpost.com/news/trump-interrupts-carney-to-talk-merger-of-canada-and-the-united-states?itm_source=trending,"<a href=""https://nationalpost.com/news/trump-interrupts-carney-to-talk-merger-of-canada-and-the-united-states?itm_source=trending"">Trump interrupts Carney to talk 'merger of Canada and the United States'</a>"
2,"'You're from Canada, eh?': Meeting with 'off-duty ICE officer' at a pet store leads to Toronto man's self-deportation",https://nationalpost.com/news/canadian-self-deports-ice?itm_source=trending,"<a href=""https://nationalpost.com/news/canadian-self-deports-ice?itm_source=trending"">'You're from Canada, eh?': Meeting with 'off-duty ICE officer' at a pet store leads to Toronto man's self-deportation</a>"
3,Canadian Snowbirds will replace U.S. Navy as top draw in San Francisco airshow,https://nationalpost.com/news/canadian-snowbirds-navy-blue-angels?itm_source=trending,"<a href=""https://nationalpost.com/news/canadian-snowbirds-navy-blue-angels?itm_source=trending"">Canadian Snowbirds will replace U.S. Navy as top draw in San Francisco airshow</a>"
4,Danielle Smith says she's giving Carney until Grey Cup to fix nine 'bad laws',https://nationalpost.com/news/canada/danielle-smith-says-shes-giving-carney-until-grey-cup-to-fix-nine-bad-laws?itm_source=trending,"<a href=""https://nationalpost.com/news/canada/danielle-smith-says-shes-giving-carney-until-grey-cup-to-fix-nine-bad-laws?itm_source=trending"">Danielle Smith says she's giving Carney until Grey Cup to fix nine 'bad laws'</a>"
5,Subscriber only.John Ivison: Carney plays sidekick on the Trump Show better than he plays adversary,https://nationalpost.com/opinion/ivison-mark-carney-plays-sidekick-donald-trump?itm_source=trending,"<a href=""https://nationalpost.com/opinion/ivison-mark-carney-plays-sidekick-donald-trump?itm_source=trending"">Subscriber only.John Ivison: Carney plays sidekick on the Trump Show better than he plays adversary</a>"
