Rank,Article title,url,title_with_link
1,Two Montreal police officers shot in Côte-des-Neiges,https://nationalpost.com/montreal-news/update-civilian-police-officer-and-suspect-dead-after-cote-des-neiges-shooting/wcm/2c33eddb-a9b5-407f-9e29-086e6893c3ea,"<a href=""https://nationalpost.com/montreal-news/update-civilian-police-officer-and-suspect-dead-after-cote-des-neiges-shooting/wcm/2c33eddb-a9b5-407f-9e29-086e6893c3ea"">Two Montreal police officers shot in Côte-des-Neiges</a>"
2,Trump administration growing impatient with Canada’s delayed F-35 choice,https://nationalpost.com/news/trump-administration-growing-impatient-with-canadas-delayed-f-35-choice,"<a href=""https://nationalpost.com/news/trump-administration-growing-impatient-with-canadas-delayed-f-35-choice"">Trump administration growing impatient with Canada’s delayed F-35 choice</a>"
3,Michael Murphy: Keir Starmer offered Britain nothing,https://nationalpost.com/opinion/keir-starmer-offered-britain-nothing,"<a href=""https://nationalpost.com/opinion/keir-starmer-offered-britain-nothing"">Michael Murphy: Keir Starmer offered Britain nothing</a>"
4,"Carney nominates Glenn Joyal, King's Court of Manitoba Chief Justice, to Supreme Court",https://nationalpost.com/news/politics/carney-appoints-glenn-joyal-kings-court-of-manitoba-chief-justice-to-supreme-court,"<a href=""https://nationalpost.com/news/politics/carney-appoints-glenn-joyal-kings-court-of-manitoba-chief-justice-to-supreme-court"">Carney nominates Glenn Joyal, King's Court of Manitoba Chief Justice, to Supreme Court</a>"
5,Subscriber only.John Ivison: Cannabis producers give up trying to get Ottawa to stop smothering their business,https://nationalpost.com/opinion/ivison-cannabis-producers-give-up-lobbying,"<a href=""https://nationalpost.com/opinion/ivison-cannabis-producers-give-up-lobbying"">Subscriber only.John Ivison: Cannabis producers give up trying to get Ottawa to stop smothering their business</a>"
