Rank,Article title,url,title_with_link
1,Alberta and Quebec are going in very different directions on MAID,https://nationalpost.com/news/canada/alberta-and-quebec-are-going-in-very-different-directions-on-maid,"<a href=""https://nationalpost.com/news/canada/alberta-and-quebec-are-going-in-very-different-directions-on-maid"">Alberta and Quebec are going in very different directions on MAID</a>"
2,Mayhem after killing of cartel leader unlikely to end at Mexico's borders,https://nationalpost.com/news/world/mexican-mayhem-spread-outside-mexico-borders,"<a href=""https://nationalpost.com/news/world/mexican-mayhem-spread-outside-mexico-borders"">Mayhem after killing of cartel leader unlikely to end at Mexico's borders</a>"
3,Royce Koop: Pierre Poilievre outshines a flailing Carney,https://nationalpost.com/opinion/royce-koop-pierre-poilievre-outshines-a-flailing-carney,"<a href=""https://nationalpost.com/opinion/royce-koop-pierre-poilievre-outshines-a-flailing-carney"">Royce Koop: Pierre Poilievre outshines a flailing Carney</a>"
4,FIRST READING: The most successful anti-woke party in Canada,https://nationalpost.com/opinion/most-successful-anti-woke-party-in-canada,"<a href=""https://nationalpost.com/opinion/most-successful-anti-woke-party-in-canada"">FIRST READING: The most successful anti-woke party in Canada</a>"
5,Amy Hamm: The zealotry of the B.C. Human Rights Tribunal must be exposed,https://nationalpost.com/opinion/amy-hamm-the-zealotry-of-the-b-c-human-rights-tribunal-must-be-exposed,"<a href=""https://nationalpost.com/opinion/amy-hamm-the-zealotry-of-the-b-c-human-rights-tribunal-must-be-exposed"">Amy Hamm: The zealotry of the B.C. Human Rights Tribunal must be exposed</a>"
