Rank,Article title,url,title_with_link
1,"'Work, then go home forever': Inside the thoughts of the temporary foreign worker program",https://nationalpost.com/opinion/satire-dear-diary-temporary-foreign-worker-program?itm_source=trending,"<a href=""https://nationalpost.com/opinion/satire-dear-diary-temporary-foreign-worker-program?itm_source=trending"">'Work, then go home forever': Inside the thoughts of the temporary foreign worker program</a>"
2,Close to 900 hundred arrested at London protest in support of proscribed terrorist group,https://nationalpost.com/news/world/london-protest-supporting-terrorist-group-arrests?itm_source=trending,"<a href=""https://nationalpost.com/news/world/london-protest-supporting-terrorist-group-arrests?itm_source=trending"">Close to 900 hundred arrested at London protest in support of proscribed terrorist group</a>"
3,Chris Selley: Getting tough on violent offenders is no crime,https://nationalpost.com/opinion/chris-selley-getting-tough-on-violent-offenders-is-no-crime?itm_source=trending,"<a href=""https://nationalpost.com/opinion/chris-selley-getting-tough-on-violent-offenders-is-no-crime?itm_source=trending"">Chris Selley: Getting tough on violent offenders is no crime</a>"
4,J.D. Tuccille: What Trump risks by using National Guard to embarrass Democrats,https://nationalpost.com/opinion/the-high-price-americans-will-pay-for-trumps-abuse-of-the-national-guard?itm_source=trending,"<a href=""https://nationalpost.com/opinion/the-high-price-americans-will-pay-for-trumps-abuse-of-the-national-guard?itm_source=trending"">J.D. Tuccille: What Trump risks by using National Guard to embarrass Democrats</a>"
5,Subscriber only.Conrad Black: The derangement over Trump marches on,https://nationalpost.com/opinion/conrad-black-the-derangement-over-trump-marches-on?itm_source=trending,"<a href=""https://nationalpost.com/opinion/conrad-black-the-derangement-over-trump-marches-on?itm_source=trending"">Subscriber only.Conrad Black: The derangement over Trump marches on</a>"
