Rank,Article title,url,title_with_link
1,Que. lottery winner chose $1K/week for life over $1M payout and even Canada's richest man had thoughts,https://nationalpost.com/news/canada/canadian-lottery-winner-chose-1k-week-for-life-over-1m-right-away-what-would-you-do,"<a href=""https://nationalpost.com/news/canada/canadian-lottery-winner-chose-1k-week-for-life-over-1m-right-away-what-would-you-do"">Que. lottery winner chose $1K/week for life over $1M payout and even Canada's richest man had thoughts</a>"
2,Air Canada crew member trapped in cargo hold of flight as passengers heard cries for help,https://nationalpost.com/news/canada/air-canada-crew-trapped-cargo-hold,"<a href=""https://nationalpost.com/news/canada/air-canada-crew-trapped-cargo-hold"">Air Canada crew member trapped in cargo hold of flight as passengers heard cries for help</a>"
3,"Trump’s Greenland threats will only make Canada’s sovereignty claims in the Arctic more vulnerable, defence analysts say",https://nationalpost.com/news/trumps-greenland-threats-will-only-make-canadas-sovereignty-claims-in-the-arctic-more-vulnerable-defence-analysts-say,"<a href=""https://nationalpost.com/news/trumps-greenland-threats-will-only-make-canadas-sovereignty-claims-in-the-arctic-more-vulnerable-defence-analysts-say"">Trump’s Greenland threats will only make Canada’s sovereignty claims in the Arctic more vulnerable, defence analysts say</a>"
4,Tasha Kheiriddin: The Liberals are well aware gun-grab is all for show — that's the point,https://nationalpost.com/opinion/tasha-kheiriddin-the-liberals-are-well-aware-gun-grab-is-all-for-show-thats-the-point,"<a href=""https://nationalpost.com/opinion/tasha-kheiriddin-the-liberals-are-well-aware-gun-grab-is-all-for-show-thats-the-point"">Tasha Kheiriddin: The Liberals are well aware gun-grab is all for show — that's the point</a>"
5,Trudeau books speaking engagement at 'soft power' event in Switzerland,https://nationalpost.com/news/canada/trudeau-speaking-event-switzerland,"<a href=""https://nationalpost.com/news/canada/trudeau-speaking-event-switzerland"">Trudeau books speaking engagement at 'soft power' event in Switzerland</a>"
