Rank,Article title,url,title_with_link
1,Top federal department blasted as 'hypocritical' for refusing to share layoff numbers,https://nationalpost.com/news/politics/privy-council-office-publice-service-layoff-unions,"<a href=""https://nationalpost.com/news/politics/privy-council-office-publice-service-layoff-unions"">Top federal department blasted as 'hypocritical' for refusing to share layoff numbers</a>"
2,"After U.S. outreach, Alberta separatists will head to Latin America to rustle up support for their cause",https://nationalpost.com/news/after-u-s-outreach-alberta-separatists-will-head-to-latin-america-to-rustle-up-support-for-their-cause,"<a href=""https://nationalpost.com/news/after-u-s-outreach-alberta-separatists-will-head-to-latin-america-to-rustle-up-support-for-their-cause"">After U.S. outreach, Alberta separatists will head to Latin America to rustle up support for their cause</a>"
3,Grieving Edmonton woman seeking 'justice' for husband who died after waiting hours in the ER,https://nationalpost.com/news/local-news/edmonton-man-dies-in-grey-nuns-hospital-er/wcm/21c5c490-9266-43d8-a537-45d7d560a5f9,"<a href=""https://nationalpost.com/news/local-news/edmonton-man-dies-in-grey-nuns-hospital-er/wcm/21c5c490-9266-43d8-a537-45d7d560a5f9"">Grieving Edmonton woman seeking 'justice' for husband who died after waiting hours in the ER</a>"
4,"Canada has a 'disturbing undercurrent of Jew hatred,' advocate Aviva Klompas says",https://nationalpost.com/news/canada/aviva-klompas-antisemitism-in-canada,"<a href=""https://nationalpost.com/news/canada/aviva-klompas-antisemitism-in-canada"">Canada has a 'disturbing undercurrent of Jew hatred,' advocate Aviva Klompas says</a>"
5,"Daily Horoscope - Saturday, December 27, 2025",https://nationalpost.com/life/daily-horoscope-saturday-december-27-2025,"<a href=""https://nationalpost.com/life/daily-horoscope-saturday-december-27-2025"">Daily Horoscope - Saturday, December 27, 2025</a>"
