Rank,Article title,url,title_with_link
1,"After a tense, Trump-disrupted NATO summit, it may be the last one for a while",https://nationalpost.com/news/donald-trump-nato-summit,"<a href=""https://nationalpost.com/news/donald-trump-nato-summit"">After a tense, Trump-disrupted NATO summit, it may be the last one for a while</a>"
2,Why Canada and the U.S. can't agree on opening the Gordie Howe Bridge,https://nationalpost.com/news/canada/why-canada-and-the-u-s-cant-agree-on-opening-the-gordie-howe-bridge,"<a href=""https://nationalpost.com/news/canada/why-canada-and-the-u-s-cant-agree-on-opening-the-gordie-howe-bridge"">Why Canada and the U.S. can't agree on opening the Gordie Howe Bridge</a>"
3,"Carney's Davos speech written at 4 a.m., Trump's volatile call with Trudeau, and other things we learned from a WSJ article",https://nationalpost.com/news/canada/carneys-davos-speech-written-at-4-a-m-trumps-volatile-call-with-trudeau-and-other-things-we-learned-from-a-wall-street-journal-article,"<a href=""https://nationalpost.com/news/canada/carneys-davos-speech-written-at-4-a-m-trumps-volatile-call-with-trudeau-and-other-things-we-learned-from-a-wall-street-journal-article"">Carney's Davos speech written at 4 a.m., Trump's volatile call with Trudeau, and other things we learned from a WSJ article</a>"
4,"Jamie Sarkonak: Man free to sexually assault children, rules Alberta's top court",https://nationalpost.com/opinion/jamie-sarkonak-man-free-to-sexually-assault-children-rules-albertas-top-court,"<a href=""https://nationalpost.com/opinion/jamie-sarkonak-man-free-to-sexually-assault-children-rules-albertas-top-court"">Jamie Sarkonak: Man free to sexually assault children, rules Alberta's top court</a>"
5,The murderous rise of the Indian gang using Canada's lax immigration laws to expand its network,https://nationalpost.com/news/canada/india-bishnoi-gang-canada,"<a href=""https://nationalpost.com/news/canada/india-bishnoi-gang-canada"">The murderous rise of the Indian gang using Canada's lax immigration laws to expand its network</a>"
