Rank,Article title,url,title_with_link
1,Canada to end remote border crossing program used largely by Americans,https://nationalpost.com/news/canada/remote-area-border-crossing-ending-canada-u-s,"<a href=""https://nationalpost.com/news/canada/remote-area-border-crossing-ending-canada-u-s"">Canada to end remote border crossing program used largely by Americans</a>"
2,Judge reduces sex criminal's jail time because of his race,https://nationalpost.com/news/canada/judge-reduces-sex-criminals-jail-time-because-of-his-race,"<a href=""https://nationalpost.com/news/canada/judge-reduces-sex-criminals-jail-time-because-of-his-race"">Judge reduces sex criminal's jail time because of his race</a>"
3,NP View: Globalizing the 'intifada' means war on Canada,https://nationalpost.com/opinion/np-view-globalizing-the-intifada-means-war-on-canada,"<a href=""https://nationalpost.com/opinion/np-view-globalizing-the-intifada-means-war-on-canada"">NP View: Globalizing the 'intifada' means war on Canada</a>"
4,"Chris Selley: Do women deserve to feel safe on our streets, or don't they?",https://nationalpost.com/opinion/selley-do-women-deserve-to-feel-safe-on-our-streets-or-not,"<a href=""https://nationalpost.com/opinion/selley-do-women-deserve-to-feel-safe-on-our-streets-or-not"">Chris Selley: Do women deserve to feel safe on our streets, or don't they?</a>"
5,Jamie Sarkonak: Electric buses are a disaster for every Canadian city that tries them,https://nationalpost.com/opinion/jamie-sarkonak-electric-buses-are-a-disaster-for-every-canadian-city-that-tries-them,"<a href=""https://nationalpost.com/opinion/jamie-sarkonak-electric-buses-are-a-disaster-for-every-canadian-city-that-tries-them"">Jamie Sarkonak: Electric buses are a disaster for every Canadian city that tries them</a>"
