Rank,Article title,url,title_with_link
1,"Ford calling again to block oil, potash exports to U.S. in trade war gets cold response",https://nationalpost.com/news/canada/doug-ford-us-tariff-embargo-oil,"<a href=""https://nationalpost.com/news/canada/doug-ford-us-tariff-embargo-oil"">Ford calling again to block oil, potash exports to U.S. in trade war gets cold response</a>"
2,"Trump's new tariffs are dubious tactics that put Carney in a tight spot, trade watchers say",https://nationalpost.com/news/trumps-tariffs-tactics-carney-trade,"<a href=""https://nationalpost.com/news/trumps-tariffs-tactics-carney-trade"">Trump's new tariffs are dubious tactics that put Carney in a tight spot, trade watchers say</a>"
3,A Sikh man with a kirpan was asked to leave a GoodLife gym. Here's what to know,https://nationalpost.com/news/sikh-kirpan-goodlife-gym,"<a href=""https://nationalpost.com/news/sikh-kirpan-goodlife-gym"">A Sikh man with a kirpan was asked to leave a GoodLife gym. Here's what to know</a>"
4,Scott Stinson: Of course we should not put U.S. alcohol back on our shelves,https://nationalpost.com/opinion/scott-stinson-of-course-we-should-not-put-u-s-alcohol-back-on-our-shelves,"<a href=""https://nationalpost.com/opinion/scott-stinson-of-course-we-should-not-put-u-s-alcohol-back-on-our-shelves"">Scott Stinson: Of course we should not put U.S. alcohol back on our shelves</a>"
5,Premiers call on Ottawa to return to paying 50% of health-care costs,https://nationalpost.com/news/canada/premiers-call-on-ottawa-to-return-to-paying-50-of-health-care-costs,"<a href=""https://nationalpost.com/news/canada/premiers-call-on-ottawa-to-return-to-paying-50-of-health-care-costs"">Premiers call on Ottawa to return to paying 50% of health-care costs</a>"
