Rank,Article title,url,title_with_link
1,Doug Ford disappointed with Ontario court's denial of injunction to shut down Al-Quds rally in Toronto,https://nationalpost.com/news/canada/al-quds-rally-can-go-forward-rules-ontario-judge-after-denying-ontario-request-for-injunction,"<a href=""https://nationalpost.com/news/canada/al-quds-rally-can-go-forward-rules-ontario-judge-after-denying-ontario-request-for-injunction"">Doug Ford disappointed with Ontario court's denial of injunction to shut down Al-Quds rally in Toronto</a>"
2,What we know about Mark Carney shows how little we know our Canadian PM,https://nationalpost.com/news/canada/what-we-know-about-mark-carney-shows-how-little-we-know-our-canadian-pm,"<a href=""https://nationalpost.com/news/canada/what-we-know-about-mark-carney-shows-how-little-we-know-our-canadian-pm"">What we know about Mark Carney shows how little we know our Canadian PM</a>"
3,Subscriber only.Conrad Black: The West is winning again,https://nationalpost.com/opinion/the-west-is-winning-again,"<a href=""https://nationalpost.com/opinion/the-west-is-winning-again"">Subscriber only.Conrad Black: The West is winning again</a>"
4,Michael Higgins: Mark Carney's 7 biggest rookie mistakes,https://nationalpost.com/opinion/michael-higgins-mark-carneys-7-biggest-rookie-mistakes,"<a href=""https://nationalpost.com/opinion/michael-higgins-mark-carneys-7-biggest-rookie-mistakes"">Michael Higgins: Mark Carney's 7 biggest rookie mistakes</a>"
5,What we've lost (10): A normal life,https://nationalpost.com/opinion/what-weve-lost-10-a-normal-life,"<a href=""https://nationalpost.com/opinion/what-weve-lost-10-a-normal-life"">What we've lost (10): A normal life</a>"
