Rank,Article title,url,title_with_link
1,FIRST READING: Canada is losing control of a major city to gangsters,https://nationalpost.com/opinion/canada-is-losing-control-of-a-major-city-to-gangsters,"<a href=""https://nationalpost.com/opinion/canada-is-losing-control-of-a-major-city-to-gangsters"">FIRST READING: Canada is losing control of a major city to gangsters</a>"
2,"Trump post depicting Obamas as monkeys 'taken down,' White House official says",https://nationalpost.com/news/world/trump-video-election-conspiracy-obamas-as-monkeys,"<a href=""https://nationalpost.com/news/world/trump-video-election-conspiracy-obamas-as-monkeys"">Trump post depicting Obamas as monkeys 'taken down,' White House official says</a>"
3,Billionaire former Russian oligarch seeks $350 million from Canada at international tribunal,https://nationalpost.com/news/canada/igor-makarov-sanctions,"<a href=""https://nationalpost.com/news/canada/igor-makarov-sanctions"">Billionaire former Russian oligarch seeks $350 million from Canada at international tribunal</a>"
4,Richard Shimooka: A mixed F-35/Gripen fleet will fail us in every way,https://nationalpost.com/opinion/richard-shimooka-all-the-ways-the-f-35-is-superior-to-the-gripen,"<a href=""https://nationalpost.com/opinion/richard-shimooka-all-the-ways-the-f-35-is-superior-to-the-gripen"">Richard Shimooka: A mixed F-35/Gripen fleet will fail us in every way</a>"
5,Brad Bradford: Rob Ford was right — Toronto needs underground transit,https://nationalpost.com/opinion/rob-ford-was-right-toronto-needs-underground-transit,"<a href=""https://nationalpost.com/opinion/rob-ford-was-right-toronto-needs-underground-transit"">Brad Bradford: Rob Ford was right — Toronto needs underground transit</a>"
