Rank,Article title,url,title_with_link
1,"U.S. border agents searching electronic devices is way up. Smartwatches, SIM cards and flash drives added to the list",https://nationalpost.com/news/canada/u-s-border-agents-electronic-searches,"<a href=""https://nationalpost.com/news/canada/u-s-border-agents-electronic-searches"">U.S. border agents searching electronic devices is way up. Smartwatches, SIM cards and flash drives added to the list</a>"
2,Faltering Canadian billionaire puts Halifax mansion up for sale for $14.9 million,https://nationalpost.com/news/canada/john-risley-halifax-mansion-sale,"<a href=""https://nationalpost.com/news/canada/john-risley-halifax-mansion-sale"">Faltering Canadian billionaire puts Halifax mansion up for sale for $14.9 million</a>"
3,Kerry Sun: The Supreme Court may have just derailed the entire welfare system,https://nationalpost.com/opinion/kerry-sun-the-supreme-court-may-have-just-derailed-the-entire-welfare-system,"<a href=""https://nationalpost.com/opinion/kerry-sun-the-supreme-court-may-have-just-derailed-the-entire-welfare-system"">Kerry Sun: The Supreme Court may have just derailed the entire welfare system</a>"
4,"'National security incident': Shots fired at U.S. Consulate in Toronto, suspect vehicle image released",https://nationalpost.com/news/canada/shots-fired-u-s-consulate-toronto,"<a href=""https://nationalpost.com/news/canada/shots-fired-u-s-consulate-toronto"">'National security incident': Shots fired at U.S. Consulate in Toronto, suspect vehicle image released</a>"
5,Nobody wants to say the M-word ahead of this crucial Quebec byelection next month,https://nationalpost.com/news/politics/nobody-wants-to-say-the-m-word-ahead-of-this-crucial-quebec-byelection-next-month,"<a href=""https://nationalpost.com/news/politics/nobody-wants-to-say-the-m-word-ahead-of-this-crucial-quebec-byelection-next-month"">Nobody wants to say the M-word ahead of this crucial Quebec byelection next month</a>"
