Rank,Article title,url,title_with_link
1,Carney says time is up for 'elbows up' as Canada drops many retaliatory tariffs on U.S.,https://nationalpost.com/news/carney-says-canada-will-drop-most-retaliatory-tariffs-on-u-s?itm_source=trending,"<a href=""https://nationalpost.com/news/carney-says-canada-will-drop-most-retaliatory-tariffs-on-u-s?itm_source=trending"">Carney says time is up for 'elbows up' as Canada drops many retaliatory tariffs on U.S.</a>"
2,Canadian father and son named as major 'copyright pirates' jailed 5 years unless they give up their secrets,https://nationalpost.com/news/canada/canadian-father-and-son-named-as-major-copyright-pirates-jailed-5-years-unless-they-give-up-their-secrets?itm_source=trending,"<a href=""https://nationalpost.com/news/canada/canadian-father-and-son-named-as-major-copyright-pirates-jailed-5-years-unless-they-give-up-their-secrets?itm_source=trending"">Canadian father and son named as major 'copyright pirates' jailed 5 years unless they give up their secrets</a>"
3,A man died when a pedestrian fell on his car from bridge over Toronto highway. The city says it's not to blame,https://nationalpost.com/news/toronto/a-man-died-when-a-pedestrian-fell-on-his-car-from-bridge-over-toronto-highway-the-city-says-its-not-to-blame?itm_source=trending,"<a href=""https://nationalpost.com/news/toronto/a-man-died-when-a-pedestrian-fell-on-his-car-from-bridge-over-toronto-highway-the-city-says-its-not-to-blame?itm_source=trending"">A man died when a pedestrian fell on his car from bridge over Toronto highway. The city says it's not to blame</a>"
4,'It's pretty straightforward': Danielle Smith objects after Ontario man charged with assaulting home intruder,https://nationalpost.com/news/canada/its-pretty-straightforward-danielle-smith-objects-after-ontario-man-charged-with-assaulting-home-intruder?itm_source=trending,"<a href=""https://nationalpost.com/news/canada/its-pretty-straightforward-danielle-smith-objects-after-ontario-man-charged-with-assaulting-home-intruder?itm_source=trending"">'It's pretty straightforward': Danielle Smith objects after Ontario man charged with assaulting home intruder</a>"
5,An Ontario couple's teenage son died after waiting 8 hours in the ER. Now they're asking for change,https://nationalpost.com/news/canada/an-ontario-couples-teenage-son-died-after-waiting-8-hours-in-the-er-now-theyre-asking-for-change?itm_source=trending,"<a href=""https://nationalpost.com/news/canada/an-ontario-couples-teenage-son-died-after-waiting-8-hours-in-the-er-now-theyre-asking-for-change?itm_source=trending"">An Ontario couple's teenage son died after waiting 8 hours in the ER. Now they're asking for change</a>"
