Rank,Article title,url,title_with_link
1,Doug Ford says ‘something is broken’ after Ontario man charged with assaulting armed home intruder,https://nationalpost.com/news/canada/ontario-home-invasion-homeowner-charged?itm_source=trending,"<a href=""https://nationalpost.com/news/canada/ontario-home-invasion-homeowner-charged?itm_source=trending"">Doug Ford says ‘something is broken’ after Ontario man charged with assaulting armed home intruder</a>"
2,Carson Jerema: I want Canada to become a part of Alberta,https://nationalpost.com/opinion/carson-jerema-i-want-canada-to-become-a-part-of-alberta?itm_source=trending,"<a href=""https://nationalpost.com/opinion/carson-jerema-i-want-canada-to-become-a-part-of-alberta?itm_source=trending"">Carson Jerema: I want Canada to become a part of Alberta</a>"
3,"Michael Higgins: Fining nurse Amy Hamm $93,000 a grotesque attack on free speech",https://nationalpost.com/opinion/michael-higgins-fining-nurse-amy-hamm-93000-a-grotesque-attack-on-free-speech?itm_source=trending,"<a href=""https://nationalpost.com/opinion/michael-higgins-fining-nurse-amy-hamm-93000-a-grotesque-attack-on-free-speech?itm_source=trending"">Michael Higgins: Fining nurse Amy Hamm $93,000 a grotesque attack on free speech</a>"
4,Alberta minister wants 'illegal immigrants' to be counted in federal targets,https://nationalpost.com/news/canada/alberta-minister-wants-illegal-immigrants-to-be-counted-in-federal-targets?itm_source=trending,"<a href=""https://nationalpost.com/news/canada/alberta-minister-wants-illegal-immigrants-to-be-counted-in-federal-targets?itm_source=trending"">Alberta minister wants 'illegal immigrants' to be counted in federal targets</a>"
5,Terry Newman: Poilievre's win means Carney's cakewalk is over,https://nationalpost.com/opinion/terry-newman-poilievres-win-means-carneys-cakewalk-is-over?itm_source=trending,"<a href=""https://nationalpost.com/opinion/terry-newman-poilievres-win-means-carneys-cakewalk-is-over?itm_source=trending"">Terry Newman: Poilievre's win means Carney's cakewalk is over</a>"
