Rank,Article title,url,title_with_link
1,Raymond J. de Souza: Trump is a gangster dressed up like a president,https://nationalpost.com/opinion/raymond-j-de-souza-trump-is-a-gangster-dressed-up-like-a-president,"<a href=""https://nationalpost.com/opinion/raymond-j-de-souza-trump-is-a-gangster-dressed-up-like-a-president"">Raymond J. de Souza: Trump is a gangster dressed up like a president</a>"
2,British Conservatives find their new Margaret Thatcher,https://nationalpost.com/news/world/british-conservatives-find-their-new-margaret-thatcher,"<a href=""https://nationalpost.com/news/world/british-conservatives-find-their-new-margaret-thatcher"">British Conservatives find their new Margaret Thatcher</a>"
3,Subscriber only.Conrad Black: Carney's failed diversification gambit,https://nationalpost.com/opinion/carneys-failed-diversification-gambit,"<a href=""https://nationalpost.com/opinion/carneys-failed-diversification-gambit"">Subscriber only.Conrad Black: Carney's failed diversification gambit</a>"
4,"Daily Horoscope - Sunday, July 19, 2026",https://nationalpost.com/life/daily-horoscope-sunday-july-19-2026,"<a href=""https://nationalpost.com/life/daily-horoscope-sunday-july-19-2026"">Daily Horoscope - Sunday, July 19, 2026</a>"
5,Letters: How should we pay for new pipelines?,https://nationalpost.com/opinion/how-should-we-pay-for-new-pipelines,"<a href=""https://nationalpost.com/opinion/how-should-we-pay-for-new-pipelines"">Letters: How should we pay for new pipelines?</a>"
