Rank,Article title,url,title_with_link
1,B.C. premier calls for blocking critical mineral exports to U.S. over lumber tariffs,https://nationalpost.com/news/canada/b-c-premier-calls-for-blocking-critical-mineral-exports-to-u-s-over-lumber-tariffs,"<a href=""https://nationalpost.com/news/canada/b-c-premier-calls-for-blocking-critical-mineral-exports-to-u-s-over-lumber-tariffs"">B.C. premier calls for blocking critical mineral exports to U.S. over lumber tariffs</a>"
2,'Death by organ donation': Doctors raise possibility of retrieving organs from MAID patients while they are still alive,https://nationalpost.com/news/death-by-organ-donation-for-maid-patients,"<a href=""https://nationalpost.com/news/death-by-organ-donation-for-maid-patients"">'Death by organ donation': Doctors raise possibility of retrieving organs from MAID patients while they are still alive</a>"
3,Michael Higgins: It's not reconciliation when law societies exaggerate anomalies as 'graves',https://nationalpost.com/opinion/michael-higgins-its-not-reconciliation-when-law-societies-exaggerate-anomalies-as-graves,"<a href=""https://nationalpost.com/opinion/michael-higgins-its-not-reconciliation-when-law-societies-exaggerate-anomalies-as-graves"">Michael Higgins: It's not reconciliation when law societies exaggerate anomalies as 'graves'</a>"
4,Heather Exner-Pirot: Cutting off oil exports to spite Trump would cripple Canada,https://nationalpost.com/opinion/heather-exner-pirot-cutting-off-oil-exports-to-spite-trump-would-cripple-canada,"<a href=""https://nationalpost.com/opinion/heather-exner-pirot-cutting-off-oil-exports-to-spite-trump-would-cripple-canada"">Heather Exner-Pirot: Cutting off oil exports to spite Trump would cripple Canada</a>"
5,"Canada need not 'respond in advance' to planned U.S. tariffs, Carney says",https://nationalpost.com/news/canada/carney-says-canada-in-stronger-position-in-trade-war-as-premiers-back-call-for-unity,"<a href=""https://nationalpost.com/news/canada/carney-says-canada-in-stronger-position-in-trade-war-as-premiers-back-call-for-unity"">Canada need not 'respond in advance' to planned U.S. tariffs, Carney says</a>"
