Rank,Article title,url,title_with_link
1,"Father of Tumbler Ridge shooter releases statement, addresses 'unforgivable act of violence'",https://nationalpost.com/news/canada/father-tumbler-ridge-shooter-statement,"<a href=""https://nationalpost.com/news/canada/father-tumbler-ridge-shooter-statement"">Father of Tumbler Ridge shooter releases statement, addresses 'unforgivable act of violence'</a>"
2,NP View: Tumbler Ridge murderer was given a pass again and again,https://nationalpost.com/opinion/np-view-tumbler-ridge-murderer-was-given-a-pass-again-and-again,"<a href=""https://nationalpost.com/opinion/np-view-tumbler-ridge-murderer-was-given-a-pass-again-and-again"">NP View: Tumbler Ridge murderer was given a pass again and again</a>"
3,FIRST READING: Liberals overlooked the one gun control measure that could have prevented Tumbler Ridge,https://nationalpost.com/opinion/liberals-overlooked-the-one-gun-control-measure-that-could-have-prevented-tumbler-ridge,"<a href=""https://nationalpost.com/opinion/liberals-overlooked-the-one-gun-control-measure-that-could-have-prevented-tumbler-ridge"">FIRST READING: Liberals overlooked the one gun control measure that could have prevented Tumbler Ridge</a>"
4,"Why were seized firearms returned to home of Tumbler Ridge mass shooter? Canada's 'Red Flag' law, explained",https://nationalpost.com/news/canada/tumbler-ridge-mass-shooter-jesse-van-rootselaar-guns,"<a href=""https://nationalpost.com/news/canada/tumbler-ridge-mass-shooter-jesse-van-rootselaar-guns"">Why were seized firearms returned to home of Tumbler Ridge mass shooter? Canada's 'Red Flag' law, explained</a>"
5,Liberals lose seat as Supreme Court of Canada annuls single-vote win in Terrebonne riding,https://nationalpost.com/news/canada_news/canadian_politics/supreme-court-of-canada-annuls-single-vote-win-in-terrebonne-riding-vacating-seat/wcm/a72019e6-cddb-430d-9b79-c0f0643e9a3f,"<a href=""https://nationalpost.com/news/canada_news/canadian_politics/supreme-court-of-canada-annuls-single-vote-win-in-terrebonne-riding-vacating-seat/wcm/a72019e6-cddb-430d-9b79-c0f0643e9a3f"">Liberals lose seat as Supreme Court of Canada annuls single-vote win in Terrebonne riding</a>"
