Rank,Article title,url,title_with_link
1,Amy Hamm: Father of 'evidence-based medicine' turns his back on science,https://nationalpost.com/opinion/father-of-evidence-based-medicine-turns-his-back-on-science?itm_source=trending,"<a href=""https://nationalpost.com/opinion/father-of-evidence-based-medicine-turns-his-back-on-science?itm_source=trending"">Amy Hamm: Father of 'evidence-based medicine' turns his back on science</a>"
2,Subscriber only.Conrad Black: B.C. Aboriginal title case underlines what's wrong with reconciliation,https://nationalpost.com/opinion/conrad-black-b-c-aboriginal-title-case-underlines-whats-wrong-with-reconciliation?itm_source=trending,"<a href=""https://nationalpost.com/opinion/conrad-black-b-c-aboriginal-title-case-underlines-whats-wrong-with-reconciliation?itm_source=trending"">Subscriber only.Conrad Black: B.C. Aboriginal title case underlines what's wrong with reconciliation</a>"
3,Letters: Why can't we defend our homes and families?,https://nationalpost.com/opinion/letters-why-cant-we-defend-our-homes-and-families?itm_source=trending,"<a href=""https://nationalpost.com/opinion/letters-why-cant-we-defend-our-homes-and-families?itm_source=trending"">Letters: Why can't we defend our homes and families?</a>"
4,Raymond J. de Souza: A Finnish factor enters the Russia-Ukraine war,https://nationalpost.com/opinion/why-finland-could-be-key-to-ending-the-russia-ukraine-war?itm_source=trending,"<a href=""https://nationalpost.com/opinion/why-finland-could-be-key-to-ending-the-russia-ukraine-war?itm_source=trending"">Raymond J. de Souza: A Finnish factor enters the Russia-Ukraine war</a>"
5,Dwight Newman: Aboriginal title's conflict with private property must be resolved,https://nationalpost.com/opinion/dwight-newman-aboriginal-titles-conflict-with-private-property-must-be-resolved?itm_source=trending,"<a href=""https://nationalpost.com/opinion/dwight-newman-aboriginal-titles-conflict-with-private-property-must-be-resolved?itm_source=trending"">Dwight Newman: Aboriginal title's conflict with private property must be resolved</a>"
