Rank,Article title,url,title_with_link
1,MP outraged after man who raped an Ontario girl given time to consider how guilty plea would affect immigration status,https://nationalpost.com/news/canada/mp-outraged-non-citizen-immigration-sentencing,"<a href=""https://nationalpost.com/news/canada/mp-outraged-non-citizen-immigration-sentencing"">MP outraged after man who raped an Ontario girl given time to consider how guilty plea would affect immigration status</a>"
2,"Conservatives blast removal of religious exemption in hate-speech laws as ""assault"" on freedom of speech",https://nationalpost.com/news/politics/conservatives-say-removal-of-religious-exemption-in-hate-speech-laws-an-assault-on-freedom-of-speech,"<a href=""https://nationalpost.com/news/politics/conservatives-say-removal-of-religious-exemption-in-hate-speech-laws-an-assault-on-freedom-of-speech"">Conservatives blast removal of religious exemption in hate-speech laws as ""assault"" on freedom of speech</a>"
3,Liberal deal with Bloc means hate-speech laws will lose exemption for 'sincerely held' religious belief,https://nationalpost.com/news/politics/liberals-bloc-hate-speech-laws-religious-exemptions,"<a href=""https://nationalpost.com/news/politics/liberals-bloc-hate-speech-laws-religious-exemptions"">Liberal deal with Bloc means hate-speech laws will lose exemption for 'sincerely held' religious belief</a>"
4,Why Canada risks Trump's ire if it chooses Gripen gamesmanship over F-35 stealth,https://nationalpost.com/news/canada/canada-trump-ire-gripen-f-thirty-five,"<a href=""https://nationalpost.com/news/canada/canada-trump-ire-gripen-f-thirty-five"">Why Canada risks Trump's ire if it chooses Gripen gamesmanship over F-35 stealth</a>"
5,Preston Manning: Canada needs an alternative to Carney's one-man show,https://nationalpost.com/opinion/preston-manning-canada-needs-an-alternative-to-carneys-one-man-show,"<a href=""https://nationalpost.com/opinion/preston-manning-canada-needs-an-alternative-to-carneys-one-man-show"">Preston Manning: Canada needs an alternative to Carney's one-man show</a>"
