Rank,Article title,url,title_with_link
1,"Carney's Davos speech did a 'service' by describing the world in 'stark' terms, ex-CIA director says",https://nationalpost.com/news/carneys-davos-speech-did-a-service-by-describing-the-world-in-stark-terms-ex-cia-director-says,"<a href=""https://nationalpost.com/news/carneys-davos-speech-did-a-service-by-describing-the-world-in-stark-terms-ex-cia-director-says"">Carney's Davos speech did a 'service' by describing the world in 'stark' terms, ex-CIA director says</a>"
2,Trump's hockey gold medal celebration caps a politically charged Olympics in Milano-Cortina,https://nationalpost.com/sports/olympics/donald-trump-hockey-u-s-gold-poltical-games,"<a href=""https://nationalpost.com/sports/olympics/donald-trump-hockey-u-s-gold-poltical-games"">Trump's hockey gold medal celebration caps a politically charged Olympics in Milano-Cortina</a>"
3,Kelly McParland: Poilievre Conservatives remain a house divided,https://nationalpost.com/opinion/kelly-mcparland-poilievre-conservatives-remain-a-house-divided,"<a href=""https://nationalpost.com/opinion/kelly-mcparland-poilievre-conservatives-remain-a-house-divided"">Kelly McParland: Poilievre Conservatives remain a house divided</a>"
4,Jamie Sarkonak: Matt Jeneroux is trolling you,https://nationalpost.com/opinion/jamie-sarkonak-matt-jeneroux-is-trolling-you,"<a href=""https://nationalpost.com/opinion/jamie-sarkonak-matt-jeneroux-is-trolling-you"">Jamie Sarkonak: Matt Jeneroux is trolling you</a>"
5,Video shows Nathan MacKinnon's priceless expression when handed Olympic stuffed animal,https://nationalpost.com/sports/olympics/nathan-mackinnon-canada-usa-hockey-game-stuffed-animal,"<a href=""https://nationalpost.com/sports/olympics/nathan-mackinnon-canada-usa-hockey-game-stuffed-animal"">Video shows Nathan MacKinnon's priceless expression when handed Olympic stuffed animal</a>"
