Rank,Article title,url,title_with_link
1,Feds consider declaring new Alberta oil pipeline to be in 'national interest' this fall,https://nationalpost.com/news/politics/feds-eye-giving-alberta-pipeline-national-interest-designation-this-fall,"<a href=""https://nationalpost.com/news/politics/feds-eye-giving-alberta-pipeline-national-interest-designation-this-fall"">Feds consider declaring new Alberta oil pipeline to be in 'national interest' this fall</a>"
2,"He committed a violent home invasion. Now, he's running for town council",https://nationalpost.com/news/canada/he-committed-a-violent-home-invasion-now-hes-running-for-town-council,"<a href=""https://nationalpost.com/news/canada/he-committed-a-violent-home-invasion-now-hes-running-for-town-council"">He committed a violent home invasion. Now, he's running for town council</a>"
3,Jamie Sarkonak: B.C. human rights tribunal rules conservatism not a real political view,https://nationalpost.com/opinion/jamie-sarkonak-b-c-human-rights-tribunal-rules-conservatism-not-a-real-political-view,"<a href=""https://nationalpost.com/opinion/jamie-sarkonak-b-c-human-rights-tribunal-rules-conservatism-not-a-real-political-view"">Jamie Sarkonak: B.C. human rights tribunal rules conservatism not a real political view</a>"
4,Canadian schools ditch Mother's and Father's Day celebrations in the name of diversity,https://nationalpost.com/news/canada/canadian-schools-ditch-mothers-and-fathers-day-celebrations-in-the-name-of-diversity,"<a href=""https://nationalpost.com/news/canada/canadian-schools-ditch-mothers-and-fathers-day-celebrations-in-the-name-of-diversity"">Canadian schools ditch Mother's and Father's Day celebrations in the name of diversity</a>"
5,'We have a lot to lose': Will Trump's visit to China threaten Carney’s diversification?,https://nationalpost.com/news/we-have-a-lot-to-lose-will-trumps-visit-to-china-threaten-carneys-diversification,"<a href=""https://nationalpost.com/news/we-have-a-lot-to-lose-will-trumps-visit-to-china-threaten-carneys-diversification"">'We have a lot to lose': Will Trump's visit to China threaten Carney’s diversification?</a>"
