Rank,Article title,url,title_with_link
1,Terry Newman: Concordia tight-lipped on 'kill them all' post about 'Zionists',https://nationalpost.com/opinion/terry-newman-concordia-decries-calls-to-violence-after-kill-them-all-post-about-zionists?itm_source=trending,"<a href=""https://nationalpost.com/opinion/terry-newman-concordia-decries-calls-to-violence-after-kill-them-all-post-about-zionists?itm_source=trending"">Terry Newman: Concordia tight-lipped on 'kill them all' post about 'Zionists'</a>"
2,FIRST READING: How postal workers lost Canadians,https://nationalpost.com/opinion/how-postal-workers-lost-canadians?itm_source=trending,"<a href=""https://nationalpost.com/opinion/how-postal-workers-lost-canadians?itm_source=trending"">FIRST READING: How postal workers lost Canadians</a>"
3,Jamie Sarkonak: Danielle Smith's pipeline is Carney's to kill,https://nationalpost.com/opinion/jamie-sarkonak-danielle-smiths-pipeline-is-carneys-to-kill?itm_source=trending,"<a href=""https://nationalpost.com/opinion/jamie-sarkonak-danielle-smiths-pipeline-is-carneys-to-kill?itm_source=trending"">Jamie Sarkonak: Danielle Smith's pipeline is Carney's to kill</a>"
4,Paul W. Bennett: The erosion of liberal education is a civic emergency in-the-making,https://nationalpost.com/opinion/the-erosion-of-liberal-education-is-a-civic-emergency-in-the-making?itm_source=trending,"<a href=""https://nationalpost.com/opinion/the-erosion-of-liberal-education-is-a-civic-emergency-in-the-making?itm_source=trending"">Paul W. Bennett: The erosion of liberal education is a civic emergency in-the-making</a>"
5,"Two-thirds of Canadians say new U.S. trade deal crucial for jobs, economy",https://nationalpost.com/news/canada/two-thirds-of-canadians-say-new-u-s-trade-deal-crucial-for-jobs-economy?itm_source=trending,"<a href=""https://nationalpost.com/news/canada/two-thirds-of-canadians-say-new-u-s-trade-deal-crucial-for-jobs-economy?itm_source=trending"">Two-thirds of Canadians say new U.S. trade deal crucial for jobs, economy</a>"
