Rank,Article title,url,title_with_link
1,Polish Olympic speed skater gives update after taking blade to face in horrific crash,https://nationalpost.com/sports/olympics/polish-speedskater-kamila-sellier-update-horrific-crash,"<a href=""https://nationalpost.com/sports/olympics/polish-speedskater-kamila-sellier-update-horrific-crash"">Polish Olympic speed skater gives update after taking blade to face in horrific crash</a>"
2,"Tessa Virtue visited Milan. We asked her about skating, hockey and, obviously, Scott Moir",https://nationalpost.com/sports/olympics/tessa-virtue-visited-milan-we-asked-her-about-skating-hockey-and-obviously-scott-moir,"<a href=""https://nationalpost.com/sports/olympics/tessa-virtue-visited-milan-we-asked-her-about-skating-hockey-and-obviously-scott-moir"">Tessa Virtue visited Milan. We asked her about skating, hockey and, obviously, Scott Moir</a>"
3,Subscriber only.Barbara Kay: Liberal MP's divorce bill would keep kids isolated from parents,https://nationalpost.com/opinion/barbara-kay-liberal-mps-divorce-bill-would-keep-kids-isolated-from-parents,"<a href=""https://nationalpost.com/opinion/barbara-kay-liberal-mps-divorce-bill-would-keep-kids-isolated-from-parents"">Subscriber only.Barbara Kay: Liberal MP's divorce bill would keep kids isolated from parents</a>"
4,Tumbler Ridge survivor's major update: 'Maya has opened her right eye and is responding',https://nationalpost.com/news/canada/tumbler-ridge-maya-gebala-major-update,"<a href=""https://nationalpost.com/news/canada/tumbler-ridge-maya-gebala-major-update"">Tumbler Ridge survivor's major update: 'Maya has opened her right eye and is responding'</a>"
5,J.D. Tuccille: The American youth marinating in 'assassination culture',https://nationalpost.com/opinion/j-d-tuccille-the-american-youth-marinating-in-assassination-culture,"<a href=""https://nationalpost.com/opinion/j-d-tuccille-the-american-youth-marinating-in-assassination-culture"">J.D. Tuccille: The American youth marinating in 'assassination culture'</a>"
