Rank,Article title,url,title_with_link
1,Chris Selley: Quebec declares de facto independence. Will Ottawa care?,https://nationalpost.com/opinion/quebec-independence-will-ottawa-care?itm_source=trending,"<a href=""https://nationalpost.com/opinion/quebec-independence-will-ottawa-care?itm_source=trending"">Chris Selley: Quebec declares de facto independence. Will Ottawa care?</a>"
2,Anthony Koch: Trump's Mideast 'peace' deal will only lead to more bloodshed,https://nationalpost.com/opinion/trumps-mideast-peace-deal-will-only-lead-to-more-bloodshed?itm_source=trending,"<a href=""https://nationalpost.com/opinion/trumps-mideast-peace-deal-will-only-lead-to-more-bloodshed?itm_source=trending"">Anthony Koch: Trump's Mideast 'peace' deal will only lead to more bloodshed</a>"
3,Toronto principal apologizes after high school played O Canada in Arabic on October 7 anniversary,https://nationalpost.com/news/canada/principal-toronto-apologizes-arabic-o-canada?itm_source=trending,"<a href=""https://nationalpost.com/news/canada/principal-toronto-apologizes-arabic-o-canada?itm_source=trending"">Toronto principal apologizes after high school played O Canada in Arabic on October 7 anniversary</a>"
4,'You Zionist piece of s—': Montreal airport shuttle driver fired after antisemitic outburst,https://nationalpost.com/news/montreal-airport-shuttle-driver-fired-after-antisemitic-outburst/wcm/6ca96021-fe0f-4d3c-ae0f-6ed562966ff5?itm_source=trending,"<a href=""https://nationalpost.com/news/montreal-airport-shuttle-driver-fired-after-antisemitic-outburst/wcm/6ca96021-fe0f-4d3c-ae0f-6ed562966ff5?itm_source=trending"">'You Zionist piece of s—': Montreal airport shuttle driver fired after antisemitic outburst</a>"
5,J.K. Rowling criticizes Vancouver Parks over its 'disavowal' of her views,https://nationalpost.com/news/canada/j-k-rowling-vancouver-parks-harry-potter?itm_source=trending,"<a href=""https://nationalpost.com/news/canada/j-k-rowling-vancouver-parks-harry-potter?itm_source=trending"">J.K. Rowling criticizes Vancouver Parks over its 'disavowal' of her views</a>"
