Rank,Article title,url,title_with_link
1,'The fix is in': Trump's latest tariff tactic shocks Washington trade watchers,https://nationalpost.com/news/egregious-trumps-latest-tariff-tactic-shocks-washington-trade-watchers,"<a href=""https://nationalpost.com/news/egregious-trumps-latest-tariff-tactic-shocks-washington-trade-watchers"">'The fix is in': Trump's latest tariff tactic shocks Washington trade watchers</a>"
2,Canadians open to negotiating with Western separatists as data show underrepresentation in Parliament: report,https://nationalpost.com/news/canadians-open-to-negotiating-with-western-separatists-as-data-show-underrepresentation-in-parliament-report,"<a href=""https://nationalpost.com/news/canadians-open-to-negotiating-with-western-separatists-as-data-show-underrepresentation-in-parliament-report"">Canadians open to negotiating with Western separatists as data show underrepresentation in Parliament: report</a>"
3,Liberal government appeals ruling against use of Emergencies Act to Supreme Court,https://nationalpost.com/news/politics/liberal-government-appeals-emergencies-act-decisions-to-the-supreme-court,"<a href=""https://nationalpost.com/news/politics/liberal-government-appeals-emergencies-act-decisions-to-the-supreme-court"">Liberal government appeals ruling against use of Emergencies Act to Supreme Court</a>"
4,Jason Kenney: Edmonton's mayor epitomizes the left's moral stupor,https://nationalpost.com/opinion/edmontons-mayor-epitomizes-the-lefts-moral-stupor,"<a href=""https://nationalpost.com/opinion/edmontons-mayor-epitomizes-the-lefts-moral-stupor"">Jason Kenney: Edmonton's mayor epitomizes the left's moral stupor</a>"
5,Liberals are almost guaranteed a majority — but 172 seats would be a 'poison pill',https://nationalpost.com/news/liberals-are-almost-guaranteed-a-majority-but-172-seats-would-be-a-poison-pill,"<a href=""https://nationalpost.com/news/liberals-are-almost-guaranteed-a-majority-but-172-seats-would-be-a-poison-pill"">Liberals are almost guaranteed a majority — but 172 seats would be a 'poison pill'</a>"
