Rank,Article title,url,title_with_link
1,Subscriber only.FIRST READING: How Canadian universities became cheering sections for political violence,https://nationalpost.com/opinion/how-canadian-universities-became-cheering-sections-for-political-violence?itm_source=trending,"<a href=""https://nationalpost.com/opinion/how-canadian-universities-became-cheering-sections-for-political-violence?itm_source=trending"">Subscriber only.FIRST READING: How Canadian universities became cheering sections for political violence</a>"
2,Conrad Black: I was with Trump when Charlie Kirk died. He grieved like a leader,https://nationalpost.com/opinion/conrad-black-i-was-with-trump-when-charlie-kirk-died-he-grieved-like-a-leader?itm_source=trending,"<a href=""https://nationalpost.com/opinion/conrad-black-i-was-with-trump-when-charlie-kirk-died-he-grieved-like-a-leader?itm_source=trending"">Conrad Black: I was with Trump when Charlie Kirk died. He grieved like a leader</a>"
3,Jamie Sarkonak: Common-law parenthood is coming to Canada,https://nationalpost.com/opinion/jamie-sarkonak-common-law-parenthood-is-coming-to-canada?itm_source=trending,"<a href=""https://nationalpost.com/opinion/jamie-sarkonak-common-law-parenthood-is-coming-to-canada?itm_source=trending"">Jamie Sarkonak: Common-law parenthood is coming to Canada</a>"
4,Carney launches Build Canada Homes with billions for affordable housing,https://nationalpost.com/news/carney-launches-build-canada-homes-with-billions-for-affordable-housing?itm_source=trending,"<a href=""https://nationalpost.com/news/carney-launches-build-canada-homes-with-billions-for-affordable-housing?itm_source=trending"">Carney launches Build Canada Homes with billions for affordable housing</a>"
5,"Younger Canadians reject peacekeeping role in Ukraine, Gaza: survey",https://nationalpost.com/news/canada/canadians-peacekeeping-ukraine-gaza-survey?itm_source=trending,"<a href=""https://nationalpost.com/news/canada/canadians-peacekeeping-ukraine-gaza-survey?itm_source=trending"">Younger Canadians reject peacekeeping role in Ukraine, Gaza: survey</a>"
