Rank,Article title,url,title_with_link
1,RCMP commissioner 'deeply concerned' after CBC-backed prank show targets Mounties,https://nationalpost.com/news/canada/rcmp-commissioner-deeply-concerned-after-cbc-backed-prank-show-targets-mounties,"<a href=""https://nationalpost.com/news/canada/rcmp-commissioner-deeply-concerned-after-cbc-backed-prank-show-targets-mounties"">RCMP commissioner 'deeply concerned' after CBC-backed prank show targets Mounties</a>"
2,Ballooning seniors' benefits are another example of Canada's east-west divide,https://nationalpost.com/news/canada/ballooning-seniors-benefits-are-another-example-of-canadas-east-west-divide,"<a href=""https://nationalpost.com/news/canada/ballooning-seniors-benefits-are-another-example-of-canadas-east-west-divide"">Ballooning seniors' benefits are another example of Canada's east-west divide</a>"
3,"Tim Hortons says Temporary Foreign Worker program 'no longer necessary', turns to hiring locally",https://nationalpost.com/news/tim-hortons-says-temporary-foreign-worker-program-no-longer-necessary-turns-to-hiring-locally,"<a href=""https://nationalpost.com/news/tim-hortons-says-temporary-foreign-worker-program-no-longer-necessary-turns-to-hiring-locally"">Tim Hortons says Temporary Foreign Worker program 'no longer necessary', turns to hiring locally</a>"
4,Ben Woodfinden: A judge just hallucinated that homelessness is the same as race or sex,https://nationalpost.com/opinion/ben-woodfinden-a-judge-just-hallucinated-that-homelessness-is-the-same-as-race-or-sex,"<a href=""https://nationalpost.com/opinion/ben-woodfinden-a-judge-just-hallucinated-that-homelessness-is-the-same-as-race-or-sex"">Ben Woodfinden: A judge just hallucinated that homelessness is the same as race or sex</a>"
5,Carney warns that push for Alberta separatism referendum could be 'dangerous bluff',https://nationalpost.com/news/politics/carney-warns-that-alberta-separatism-referendum-question-a-very-dangerous-bluff,"<a href=""https://nationalpost.com/news/politics/carney-warns-that-alberta-separatism-referendum-question-a-very-dangerous-bluff"">Carney warns that push for Alberta separatism referendum could be 'dangerous bluff'</a>"
