Rank,Article title,url,title_with_link
1,Text of Gordie Howe Bridge deal with U.S. contradicts Carney's initial description,https://nationalpost.com/news/text-of-gordie-howe-bridge-deal-with-u-s-contradicts-carneys-initial-description,"<a href=""https://nationalpost.com/news/text-of-gordie-howe-bridge-deal-with-u-s-contradicts-carneys-initial-description"">Text of Gordie Howe Bridge deal with U.S. contradicts Carney's initial description</a>"
2,Read the full text of the Gordie Howe Bridge deal: 'Proposed agreement in principle',https://nationalpost.com/news/gordie-howe-bridge-deal-full-text,"<a href=""https://nationalpost.com/news/gordie-howe-bridge-deal-full-text"">Read the full text of the Gordie Howe Bridge deal: 'Proposed agreement in principle'</a>"
3,Peter Navarro: Canada wants free trade — only on its terms,https://nationalpost.com/opinion/peter-navarro-canada-wants-free-trade-only-on-its-terms,"<a href=""https://nationalpost.com/opinion/peter-navarro-canada-wants-free-trade-only-on-its-terms"">Peter Navarro: Canada wants free trade — only on its terms</a>"
4,Michael Barutciski: Gruesome beheading attempt in Belfast a warning against fast-track asylum processes,https://nationalpost.com/opinion/michael-barutciski-gruesome-beheading-attempt-in-belfast-a-warning-against-fast-track-asylum-processes,"<a href=""https://nationalpost.com/opinion/michael-barutciski-gruesome-beheading-attempt-in-belfast-a-warning-against-fast-track-asylum-processes"">Michael Barutciski: Gruesome beheading attempt in Belfast a warning against fast-track asylum processes</a>"
5,A Sikh man with a kirpan was asked to leave a GoodLife gym. Here's what to know,https://nationalpost.com/news/sikh-kirpan-goodlife-gym,"<a href=""https://nationalpost.com/news/sikh-kirpan-goodlife-gym"">A Sikh man with a kirpan was asked to leave a GoodLife gym. Here's what to know</a>"
