Rank,Article title,url,title_with_link
1,Jamie Sarkonak: Charlie Kirk was reviled by the left because he was effective,https://nationalpost.com/opinion/jamie-sarkonak-charlie-kirk-was-reviled-by-the-left-because-he-was-effective?itm_source=trending,"<a href=""https://nationalpost.com/opinion/jamie-sarkonak-charlie-kirk-was-reviled-by-the-left-because-he-was-effective?itm_source=trending"">Jamie Sarkonak: Charlie Kirk was reviled by the left because he was effective</a>"
2,Trump announces conservative activist Charlie Kirk has died after being shot at Utah college event,https://nationalpost.com/news/world/u-s-conservative-activist-charlie-kirk-shot-while-speaking-at-utah-college-event?itm_source=trending,"<a href=""https://nationalpost.com/news/world/u-s-conservative-activist-charlie-kirk-shot-while-speaking-at-utah-college-event?itm_source=trending"">Trump announces conservative activist Charlie Kirk has died after being shot at Utah college event</a>"
3,"Phillies fan who took baseball from a kid offered $5,000 if ball autographed 'I'm sorry'",https://nationalpost.com/news/world/phillies-fan-baseball-autograph-sorry?itm_source=trending,"<a href=""https://nationalpost.com/news/world/phillies-fan-baseball-autograph-sorry?itm_source=trending"">Phillies fan who took baseball from a kid offered $5,000 if ball autographed 'I'm sorry'</a>"
4,'Allah will burn them': What pro-Palestinian students and allies say when they think no one is watching,https://nationalpost.com/longreads/western-university-pro-palestinian-students?itm_source=trending,"<a href=""https://nationalpost.com/longreads/western-university-pro-palestinian-students?itm_source=trending"">'Allah will burn them': What pro-Palestinian students and allies say when they think no one is watching</a>"
5,Carney says he understands 'frustrations' of pro-independence Albertans,https://nationalpost.com/news/canada/carney-says-he-understands-frustrations-of-pro-independence-albertans?itm_source=trending,"<a href=""https://nationalpost.com/news/canada/carney-says-he-understands-frustrations-of-pro-independence-albertans?itm_source=trending"">Carney says he understands 'frustrations' of pro-independence Albertans</a>"
