Rank,Article title,url,title_with_link
1,'They were just hell-bent': Mayor battling Ottawa over 'really left' housing mandate,https://nationalpost.com/news/canada/mayor-ottawa-housing-mandate,"<a href=""https://nationalpost.com/news/canada/mayor-ottawa-housing-mandate"">'They were just hell-bent': Mayor battling Ottawa over 'really left' housing mandate</a>"
2,"Montreal church fined $2,500 for hosting U.S. Christian singer without permit",https://nationalpost.com/news/canada/montreal-church-sean-feucht-fined,"<a href=""https://nationalpost.com/news/canada/montreal-church-sean-feucht-fined"">Montreal church fined $2,500 for hosting U.S. Christian singer without permit</a>"
3,"Letters: Law and disorder in Hockey Canada verdicts, Freedom Convoy sentencing",https://nationalpost.com/opinion/letters-law-and-disorder-in-hockey-canada-verdicts-freedom-convoy-sentencing,"<a href=""https://nationalpost.com/opinion/letters-law-and-disorder-in-hockey-canada-verdicts-freedom-convoy-sentencing"">Letters: Law and disorder in Hockey Canada verdicts, Freedom Convoy sentencing</a>"
4,"Michael Taube: No, Globe and Mail, Mark Carney isn't the second coming of Brian Mulroney",https://nationalpost.com/opinion/michael-taube-no-globe-and-mail-mark-carney-isnt-the-second-coming-of-brian-mulroney,"<a href=""https://nationalpost.com/opinion/michael-taube-no-globe-and-mail-mark-carney-isnt-the-second-coming-of-brian-mulroney"">Michael Taube: No, Globe and Mail, Mark Carney isn't the second coming of Brian Mulroney</a>"
5,Andrew Richter: Keeping supply management is economic suicide,https://nationalpost.com/opinion/andrew-richter-keeping-supply-management-is-economic-suicide,"<a href=""https://nationalpost.com/opinion/andrew-richter-keeping-supply-management-is-economic-suicide"">Andrew Richter: Keeping supply management is economic suicide</a>"
