Rank,Article title,url,title_with_link
1,Canadian tourist in the U.S. accused of kidnapping and torturing a flamingo at a hotel,https://nationalpost.com/news/canada/canadian-man-accused-of-torturing-flamingo-in-hotel,"<a href=""https://nationalpost.com/news/canada/canadian-man-accused-of-torturing-flamingo-in-hotel"">Canadian tourist in the U.S. accused of kidnapping and torturing a flamingo at a hotel</a>"
2,Colby Cosh: The Canadian pediatric medicine researchers who 'made it up',https://nationalpost.com/opinion/colby-cosh-the-canadian-pediatric-medicine-researchers-who-made-it-up,"<a href=""https://nationalpost.com/opinion/colby-cosh-the-canadian-pediatric-medicine-researchers-who-made-it-up"">Colby Cosh: The Canadian pediatric medicine researchers who 'made it up'</a>"
3,The surprise fight for the trademark of a notorious outlaw biker club with a deadly history,https://nationalpost.com/news/rock-machine-motorcycle-club-patch-trademark,"<a href=""https://nationalpost.com/news/rock-machine-motorcycle-club-patch-trademark"">The surprise fight for the trademark of a notorious outlaw biker club with a deadly history</a>"
4,Toronto lawyer linked to mortgage fraud that led to double murder-suicide fails to get suspension lifted,https://nationalpost.com/news/canada/toronto-lawyer-linked-to-mortgage-fraud-that-led-to-double-murder-suicide-fails-to-get-suspension-lifted,"<a href=""https://nationalpost.com/news/canada/toronto-lawyer-linked-to-mortgage-fraud-that-led-to-double-murder-suicide-fails-to-get-suspension-lifted"">Toronto lawyer linked to mortgage fraud that led to double murder-suicide fails to get suspension lifted</a>"
5,Canada's top general weighing military options to support Gulf states in Iran conflict,https://nationalpost.com/news/canadas-top-general-weighing-military-options-to-support-gulf-states-in-iran-conflict,"<a href=""https://nationalpost.com/news/canadas-top-general-weighing-military-options-to-support-gulf-states-in-iran-conflict"">Canada's top general weighing military options to support Gulf states in Iran conflict</a>"
