Rank,Article title,url,title_with_link
1,"Joly won't comment on forced labour allegations in China, says Canada will 'always follow' UN findings",https://nationalpost.com/news/politics/joly-wont-comment-on-forced-labour-allegations-in-china-says-canada-will-always-follow-un,"<a href=""https://nationalpost.com/news/politics/joly-wont-comment-on-forced-labour-allegations-in-china-says-canada-will-always-follow-un"">Joly won't comment on forced labour allegations in China, says Canada will 'always follow' UN findings</a>"
2,Alberta separatists submit 300K signatures as petition deadline hits,https://nationalpost.com/news/canada/alberta-separatists-submit-300k-signatures-as-petition-deadline-hits,"<a href=""https://nationalpost.com/news/canada/alberta-separatists-submit-300k-signatures-as-petition-deadline-hits"">Alberta separatists submit 300K signatures as petition deadline hits</a>"
3,It's Canada census time. Can you be jailed for not filling it out?,https://nationalpost.com/news/canada/its-canada-census-time-can-you-be-jailed-for-not-filling-it-out,"<a href=""https://nationalpost.com/news/canada/its-canada-census-time-can-you-be-jailed-for-not-filling-it-out"">It's Canada census time. Can you be jailed for not filling it out?</a>"
4,Subscriber only.John Ivison: There's blood in the water around the Liberals' immigration minister,https://nationalpost.com/opinion/john-ivison-theres-blood-in-the-water-around-the-liberals-immigration-minister,"<a href=""https://nationalpost.com/opinion/john-ivison-theres-blood-in-the-water-around-the-liberals-immigration-minister"">Subscriber only.John Ivison: There's blood in the water around the Liberals' immigration minister</a>"
5,"Immigrant who pointed loaded gun in Calgary road rage incident won't face deportation, judge says",https://nationalpost.com/news/canada/crime-immigration-canada-ethiopia,"<a href=""https://nationalpost.com/news/canada/crime-immigration-canada-ethiopia"">Immigrant who pointed loaded gun in Calgary road rage incident won't face deportation, judge says</a>"
