Rank,Article title,url,title_with_link
1,Anthony Koch: Trump's Mideast 'peace' deal will only lead to more bloodshed,https://nationalpost.com/opinion/trumps-mideast-peace-deal-will-only-lead-to-more-bloodshed?itm_source=trending,"<a href=""https://nationalpost.com/opinion/trumps-mideast-peace-deal-will-only-lead-to-more-bloodshed?itm_source=trending"">Anthony Koch: Trump's Mideast 'peace' deal will only lead to more bloodshed</a>"
2,Chris Selley: Quebec declares de facto independence. Will Ottawa care?,https://nationalpost.com/opinion/quebec-independence-will-ottawa-care?itm_source=trending,"<a href=""https://nationalpost.com/opinion/quebec-independence-will-ottawa-care?itm_source=trending"">Chris Selley: Quebec declares de facto independence. Will Ottawa care?</a>"
3,Carney defends $700K salaries for CEOs of new federal agencies,https://nationalpost.com/news/politics/carney-defends-700k-salaries-of-ceos-of-new-federal-agencies?itm_source=trending,"<a href=""https://nationalpost.com/news/politics/carney-defends-700k-salaries-of-ceos-of-new-federal-agencies?itm_source=trending"">Carney defends $700K salaries for CEOs of new federal agencies</a>"
4,Ontario DEI law firm sues one of its former lawyers for defamation over racism claim,https://nationalpost.com/news/canada/ontario-dei-law-firm-sues-lawyer-for-defamation-over-racism-claim?itm_source=trending,"<a href=""https://nationalpost.com/news/canada/ontario-dei-law-firm-sues-lawyer-for-defamation-over-racism-claim?itm_source=trending"">Ontario DEI law firm sues one of its former lawyers for defamation over racism claim</a>"
5,Canada Post workers move to rotating strikes. What does this mean for deliveries?,https://nationalpost.com/news/canada/canada-post-rotating-strikes-explainer?itm_source=trending,"<a href=""https://nationalpost.com/news/canada/canada-post-rotating-strikes-explainer?itm_source=trending"">Canada Post workers move to rotating strikes. What does this mean for deliveries?</a>"
