Rank,Article title,url,title_with_link
1,Ontario property owner and contractor fined $157K for damaging threatened bird habitat,https://nationalpost.com/news/canada/ontario-157k-fine-damaged-bird-habitat,"<a href=""https://nationalpost.com/news/canada/ontario-157k-fine-damaged-bird-habitat"">Ontario property owner and contractor fined $157K for damaging threatened bird habitat</a>"
2,Trump is running out of tariff cards to play ahead of CUSMA review,https://nationalpost.com/news/canada/trump-is-running-out-of-tariff-cards-to-play-ahead-of-cusma-review,"<a href=""https://nationalpost.com/news/canada/trump-is-running-out-of-tariff-cards-to-play-ahead-of-cusma-review"">Trump is running out of tariff cards to play ahead of CUSMA review</a>"
3,Why millions of New Englanders may now be eligible for 'proof' they are Canadian citizens,https://nationalpost.com/news/canada/why-millions-of-new-englanders-may-now-be-eligible-for-proof-they-are-canadian-citizens,"<a href=""https://nationalpost.com/news/canada/why-millions-of-new-englanders-may-now-be-eligible-for-proof-they-are-canadian-citizens"">Why millions of New Englanders may now be eligible for 'proof' they are Canadian citizens</a>"
4,John Cleese says he's now avoiding B.C. because of crackdown on gender ideology criticism,https://nationalpost.com/opinion/john-cleese-bc-gender-ideology,"<a href=""https://nationalpost.com/opinion/john-cleese-bc-gender-ideology"">John Cleese says he's now avoiding B.C. because of crackdown on gender ideology criticism</a>"
5,U.S. country star cancels Canadian tour after being denied entry twice at the border,https://nationalpost.com/news/canada/us-charley-crockett-denied-entry-in-canada,"<a href=""https://nationalpost.com/news/canada/us-charley-crockett-denied-entry-in-canada"">U.S. country star cancels Canadian tour after being denied entry twice at the border</a>"
