Rank,Article title,url,title_with_link
1,Amy Hamm: Woke academics claim J.K. Rowling guilty of being Voldemort,https://nationalpost.com/opinion/amy-hamm-woke-academics-claim-j-k-rowling-guilty-of-being-voldemort,"<a href=""https://nationalpost.com/opinion/amy-hamm-woke-academics-claim-j-k-rowling-guilty-of-being-voldemort"">Amy Hamm: Woke academics claim J.K. Rowling guilty of being Voldemort</a>"
2,"J.D. Tuccille: U.S. getting richer while Britain, Europe and Canada are falling behind",https://nationalpost.com/opinion/j-d-tuccille-u-s-getting-richer-while-britain-europe-and-canada-are-falling-behind,"<a href=""https://nationalpost.com/opinion/j-d-tuccille-u-s-getting-richer-while-britain-europe-and-canada-are-falling-behind"">J.D. Tuccille: U.S. getting richer while Britain, Europe and Canada are falling behind</a>"
3,"Toronto police seize 'SMS blasters,' a cybercrime weapon never before seen in Canada",https://nationalpost.com/news/canada/toronto-police-seize-sms-blasters-cybercrime-canada,"<a href=""https://nationalpost.com/news/canada/toronto-police-seize-sms-blasters-cybercrime-canada"">Toronto police seize 'SMS blasters,' a cybercrime weapon never before seen in Canada</a>"
4,Gunman at White House Correspondents' Dinner was targeting top Trump officials: attorney general,https://nationalpost.com/news/world/gunman-white-house-correspondents-dinner-trump-officials-target,"<a href=""https://nationalpost.com/news/world/gunman-white-house-correspondents-dinner-trump-officials-target"">Gunman at White House Correspondents' Dinner was targeting top Trump officials: attorney general</a>"
5,"Nenshi's strategy: embrace patriotism, keep Avi Lewis faaaar away",https://nationalpost.com/news/nenshis-strategy-embrace-patriotism-keep-avi-lewis-faaaar-away,"<a href=""https://nationalpost.com/news/nenshis-strategy-embrace-patriotism-keep-avi-lewis-faaaar-away"">Nenshi's strategy: embrace patriotism, keep Avi Lewis faaaar away</a>"
