Rank,Article title,url,title_with_link
1,"Canadian buyers are fleeing U.S. hotspots, leaving Sunbelt realtors reeling",https://nationalpost.com/news/canada/canadian-buyers-are-fleeing-u-s-hotspots-leaving-sunbelt-realtors-reeling?itm_source=trending,"<a href=""https://nationalpost.com/news/canada/canadian-buyers-are-fleeing-u-s-hotspots-leaving-sunbelt-realtors-reeling?itm_source=trending"">Canadian buyers are fleeing U.S. hotspots, leaving Sunbelt realtors reeling</a>"
2,Canadian grave of general who torched White House in 1814 draws interest amid trade war,https://nationalpost.com/news/canada/halifax-grave-of-british-general-who-torched-white-house-in-1814-draws-visitors?itm_source=trending,"<a href=""https://nationalpost.com/news/canada/halifax-grave-of-british-general-who-torched-white-house-in-1814-draws-visitors?itm_source=trending"">Canadian grave of general who torched White House in 1814 draws interest amid trade war</a>"
3,Air Canada flight attendants vote on a new contract this week. Here's what's next,https://nationalpost.com/news/air-canada-flight-attendants-vote-new-contract-this-week-heres-whats-next?itm_source=trending,"<a href=""https://nationalpost.com/news/air-canada-flight-attendants-vote-new-contract-this-week-heres-whats-next?itm_source=trending"">Air Canada flight attendants vote on a new contract this week. Here's what's next</a>"
4,Leslie Roberts: Pride can either stand up to pro-Palestinian hijackers or lose funding,https://nationalpost.com/opinion/leslie-roberts-pride-can-either-stand-up-to-pro-palestinian-hijackers-or-lose-funding?itm_source=trending,"<a href=""https://nationalpost.com/opinion/leslie-roberts-pride-can-either-stand-up-to-pro-palestinian-hijackers-or-lose-funding?itm_source=trending"">Leslie Roberts: Pride can either stand up to pro-Palestinian hijackers or lose funding</a>"
5,"FIRST READING: You can legally shoot, stab and bludgeon home invaders in Canada",https://nationalpost.com/opinion/first-reading-home-invaders-canada?itm_source=trending,"<a href=""https://nationalpost.com/opinion/first-reading-home-invaders-canada?itm_source=trending"">FIRST READING: You can legally shoot, stab and bludgeon home invaders in Canada</a>"
