Rank,Article title,url,title_with_link
1,Gunman drove truck into Michigan Mormon church and opened fire: police,https://nationalpost.com/news/michigan-mormon-church-shooting?itm_source=trending,"<a href=""https://nationalpost.com/news/michigan-mormon-church-shooting?itm_source=trending"">Gunman drove truck into Michigan Mormon church and opened fire: police</a>"
2,"Daily Horoscope - Sunday, September 28, 2025",https://nationalpost.com/life/daily-horoscope-sunday-september-28-2025?itm_source=trending,"<a href=""https://nationalpost.com/life/daily-horoscope-sunday-september-28-2025?itm_source=trending"">Daily Horoscope - Sunday, September 28, 2025</a>"
3,"What Mark Carney is missing, according to this eminence grise insider",https://nationalpost.com/news/what-mark-carney-is-missing-according-to-this-eminence-grise-insider?itm_source=trending,"<a href=""https://nationalpost.com/news/what-mark-carney-is-missing-according-to-this-eminence-grise-insider?itm_source=trending"">What Mark Carney is missing, according to this eminence grise insider</a>"
4,Chris Selley: Ostrich politics are a worrying sign of where our political heads are situated,https://nationalpost.com/opinion/selley-ostrich-politics-a-worrying-sign-of-where-our-political-heads-are?itm_source=trending,"<a href=""https://nationalpost.com/opinion/selley-ostrich-politics-a-worrying-sign-of-where-our-political-heads-are?itm_source=trending"">Chris Selley: Ostrich politics are a worrying sign of where our political heads are situated</a>"
5,Letters: Our children are pondering where to live — outside Canada,https://nationalpost.com/opinion/letters-our-children-are-pondering-where-to-live-outside-canada?itm_source=trending,"<a href=""https://nationalpost.com/opinion/letters-our-children-are-pondering-where-to-live-outside-canada?itm_source=trending"">Letters: Our children are pondering where to live — outside Canada</a>"
