Rank,Article title,url,title_with_link
1,Ben Woodfinden: A judge just hallucinated that homelessness is the same as race or sex,https://nationalpost.com/opinion/ben-woodfinden-a-judge-just-hallucinated-that-homelessness-is-the-same-as-race-or-sex,"<a href=""https://nationalpost.com/opinion/ben-woodfinden-a-judge-just-hallucinated-that-homelessness-is-the-same-as-race-or-sex"">Ben Woodfinden: A judge just hallucinated that homelessness is the same as race or sex</a>"
2,Fine surcharge removed for B.C. man who jammed feces into teen's mouth because he is unemployed,https://nationalpost.com/news/canada/vancouver-man-facing-227-days-in-jail-after-assaulting-teen-with-feces,"<a href=""https://nationalpost.com/news/canada/vancouver-man-facing-227-days-in-jail-after-assaulting-teen-with-feces"">Fine surcharge removed for B.C. man who jammed feces into teen's mouth because he is unemployed</a>"
3,Amy Hamm: Public servants can't ride the work-from-home gravy train forever,https://nationalpost.com/opinion/amy-hamm-public-servants-cant-ride-the-work-from-home-gravy-train-forever,"<a href=""https://nationalpost.com/opinion/amy-hamm-public-servants-cant-ride-the-work-from-home-gravy-train-forever"">Amy Hamm: Public servants can't ride the work-from-home gravy train forever</a>"
4,Tom Flanagan: Still no bodies 5 years after Kamloops 'mass burial site' was announced,https://nationalpost.com/opinion/tom-flanagan-still-no-bodies-5-years-after-kamloops-mass-burial-site-was-announced,"<a href=""https://nationalpost.com/opinion/tom-flanagan-still-no-bodies-5-years-after-kamloops-mass-burial-site-was-announced"">Tom Flanagan: Still no bodies 5 years after Kamloops 'mass burial site' was announced</a>"
5,Investor interest in Alberta going ‘nuclear’ over Carney’s messaging: Full Comment podcast,https://nationalpost.com/opinion/investor-interest-in-alberta-going-nuclear-over-carneys-messaging,"<a href=""https://nationalpost.com/opinion/investor-interest-in-alberta-going-nuclear-over-carneys-messaging"">Investor interest in Alberta going ‘nuclear’ over Carney’s messaging: Full Comment podcast</a>"
