Rank,Article title,url,title_with_link
1,"Wild pigs, giant goldfish and bugs that won't die: Invaders 'absolutely everywhere' in Canada",https://nationalpost.com/feature/wild-pigs-giant-goldfish-invasives,"<a href=""https://nationalpost.com/feature/wild-pigs-giant-goldfish-invasives"">Wild pigs, giant goldfish and bugs that won't die: Invaders 'absolutely everywhere' in Canada</a>"
2,Government plans to boost Canadian Forces with foreign recruits,https://nationalpost.com/news/canada/government-plans-to-boost-canadian-forces-with-foreign-recruits,"<a href=""https://nationalpost.com/news/canada/government-plans-to-boost-canadian-forces-with-foreign-recruits"">Government plans to boost Canadian Forces with foreign recruits</a>"
3,"Canadians vacationing at popular Cancun resort hit hard by vomiting, cramps and diarrhea",https://nationalpost.com/news/canada/canadians-vacationing-at-popular-cancun-resort-hit-hard-by-vomiting-cramps-and-diarrhea,"<a href=""https://nationalpost.com/news/canada/canadians-vacationing-at-popular-cancun-resort-hit-hard-by-vomiting-cramps-and-diarrhea"">Canadians vacationing at popular Cancun resort hit hard by vomiting, cramps and diarrhea</a>"
4,Why Trump’s threatened strikes to compel an Iran nuclear deal could backfire,https://nationalpost.com/news/world/why-trump-threats-for-iran-deal-could-backfire,"<a href=""https://nationalpost.com/news/world/why-trump-threats-for-iran-deal-could-backfire"">Why Trump’s threatened strikes to compel an Iran nuclear deal could backfire</a>"
5,U.S. senators introduce a bill in Congress to bring Canadians back to boost sagging tourism,https://nationalpost.com/news/canada/u-s-congress-aims-to-boost-sagging-tourism-by-strengthening-ties-via-cusma,"<a href=""https://nationalpost.com/news/canada/u-s-congress-aims-to-boost-sagging-tourism-by-strengthening-ties-via-cusma"">U.S. senators introduce a bill in Congress to bring Canadians back to boost sagging tourism</a>"
