Rank,Article title,url,title_with_link
1,Judge grants leniency for Toronto crack dealer because of his nine children and his race,https://nationalpost.com/news/canada/judge-grants-leniency-for-toronto-crack-dealer-because-of-his-nine-children-and-his-race,"<a href=""https://nationalpost.com/news/canada/judge-grants-leniency-for-toronto-crack-dealer-because-of-his-nine-children-and-his-race"">Judge grants leniency for Toronto crack dealer because of his nine children and his race</a>"
2,Terry Newman: Concordia's become a wretched hive of antisemitic scum and villainy,https://nationalpost.com/opinion/terry-newman-concordias-become-a-wretched-hive-of-antisemitic-scum-and-villainy,"<a href=""https://nationalpost.com/opinion/terry-newman-concordias-become-a-wretched-hive-of-antisemitic-scum-and-villainy"">Terry Newman: Concordia's become a wretched hive of antisemitic scum and villainy</a>"
3,NDP leadership hopefuls say workers shouldn't be fooled by Poilievre's blue-collar message,https://nationalpost.com/news/canada/ndp-leadership-hopefuls-say-workers-shouldnt-be-fooled-by-poilievres-blue-collar-message,"<a href=""https://nationalpost.com/news/canada/ndp-leadership-hopefuls-say-workers-shouldnt-be-fooled-by-poilievres-blue-collar-message"">NDP leadership hopefuls say workers shouldn't be fooled by Poilievre's blue-collar message</a>"
4,"Boy, 13, swims four hours to save family lost at sea off Australia: 'I was really scared'",https://nationalpost.com/news/world/teen-swims-for-four-hours-to-save-family-in-australia,"<a href=""https://nationalpost.com/news/world/teen-swims-for-four-hours-to-save-family-in-australia"">Boy, 13, swims four hours to save family lost at sea off Australia: 'I was really scared'</a>"
5,"FIRST READING: Group alleges Kingston, Ont., broke law by removing Sir John A. Macdonald statue",https://nationalpost.com/opinion/first-reading-kingston-john-a-macdonald-statue,"<a href=""https://nationalpost.com/opinion/first-reading-kingston-john-a-macdonald-statue"">FIRST READING: Group alleges Kingston, Ont., broke law by removing Sir John A. Macdonald statue</a>"
