Rank,Article title,url,title_with_link
1,How Canadian flyers can stop their luggage from turning into a drug shipment due to airport bag tag swaps,https://nationalpost.com/news/canadians-bag-tag-airport-switching-scheme,"<a href=""https://nationalpost.com/news/canadians-bag-tag-airport-switching-scheme"">How Canadian flyers can stop their luggage from turning into a drug shipment due to airport bag tag swaps</a>"
2,Michael Higgins: Put the Kamloops narrative to rest,https://nationalpost.com/opinion/put-the-kamloops-narrative-to-rest,"<a href=""https://nationalpost.com/opinion/put-the-kamloops-narrative-to-rest"">Michael Higgins: Put the Kamloops narrative to rest</a>"
3,Tim Hortons customer dies after pulling a chunk of hair from employee's head over order disagreement,https://nationalpost.com/news/disturbing-video-shows-tim-hortons-customer-fighting-employee-shortly-before-her-death,"<a href=""https://nationalpost.com/news/disturbing-video-shows-tim-hortons-customer-fighting-employee-shortly-before-her-death"">Tim Hortons customer dies after pulling a chunk of hair from employee's head over order disagreement</a>"
4,Job one for this high-tech farmer: Squeezing out the Americans,https://nationalpost.com/news/big-marble-farms-ryan-cramer-high-tech-farmer,"<a href=""https://nationalpost.com/news/big-marble-farms-ryan-cramer-high-tech-farmer"">Job one for this high-tech farmer: Squeezing out the Americans</a>"
5,"Five years after Kamloops graves announcement, not a single confirmed burial site has been found. Here's what we know",https://nationalpost.com/news/canada/five-years-after-kamloops-graves-announcement-not-a-single-confirmed-burial-site-has-been-found-heres-what-we-know,"<a href=""https://nationalpost.com/news/canada/five-years-after-kamloops-graves-announcement-not-a-single-confirmed-burial-site-has-been-found-heres-what-we-know"">Five years after Kamloops graves announcement, not a single confirmed burial site has been found. Here's what we know</a>"
