Rank,Article title,url,title_with_link
1,Canadian passport fees will go up on March 31,https://nationalpost.com/news/canada/canadian-passport-fee-hike,"<a href=""https://nationalpost.com/news/canada/canadian-passport-fee-hike"">Canadian passport fees will go up on March 31</a>"
2,What we know about Ottawa's land rights deal with the Musqueam First Nation,https://nationalpost.com/news/musqueam-first-nation-deal,"<a href=""https://nationalpost.com/news/musqueam-first-nation-deal"">What we know about Ottawa's land rights deal with the Musqueam First Nation</a>"
3,John Manley: Man responsible for Humboldt Broncos crash paid his debt to society and should not be deported,https://nationalpost.com/opinion/man-responsible-for-humboldt-broncos-crash-paid-his-debt-to-society-and-should-not-be-deported,"<a href=""https://nationalpost.com/opinion/man-responsible-for-humboldt-broncos-crash-paid-his-debt-to-society-and-should-not-be-deported"">John Manley: Man responsible for Humboldt Broncos crash paid his debt to society and should not be deported</a>"
4,Alberta and Quebec are going in very different directions on MAID,https://nationalpost.com/news/canada/alberta-and-quebec-are-going-in-very-different-directions-on-maid,"<a href=""https://nationalpost.com/news/canada/alberta-and-quebec-are-going-in-very-different-directions-on-maid"">Alberta and Quebec are going in very different directions on MAID</a>"
5,Mayhem after killing of cartel leader unlikely to end at Mexico's borders,https://nationalpost.com/news/world/mexican-mayhem-spread-outside-mexico-borders,"<a href=""https://nationalpost.com/news/world/mexican-mayhem-spread-outside-mexico-borders"">Mayhem after killing of cartel leader unlikely to end at Mexico's borders</a>"
