Rank,Article title,url,title_with_link
1,'My baby is in there': Mom gives update on 12-year-old Tumbler Ridge victim fighting for her life,https://nationalpost.com/news/canada/my-baby-is-in-there-mom-gives-update-on-12-year-old-tumbler-ridge-victim-fighting-for-her-life,"<a href=""https://nationalpost.com/news/canada/my-baby-is-in-there-mom-gives-update-on-12-year-old-tumbler-ridge-victim-fighting-for-her-life"">'My baby is in there': Mom gives update on 12-year-old Tumbler Ridge victim fighting for her life</a>"
2,Poilievre distances himself from MP's comments about anti-U.S. 'hissy fit',https://nationalpost.com/news/politics/poilievre-distances-himself-from-jivanis-comments-on-anti-american-hissy-fit-says-canadians-are-understandably-upset-by-tariffs,"<a href=""https://nationalpost.com/news/politics/poilievre-distances-himself-from-jivanis-comments-on-anti-american-hissy-fit-says-canadians-are-understandably-upset-by-tariffs"">Poilievre distances himself from MP's comments about anti-U.S. 'hissy fit'</a>"
3,"FIRST READING: All the neat stuff Quebec can do, but Alberta can’t",https://nationalpost.com/opinion/all-the-neat-stuff-quebec-can-do-but-alberta-cant,"<a href=""https://nationalpost.com/opinion/all-the-neat-stuff-quebec-can-do-but-alberta-cant"">FIRST READING: All the neat stuff Quebec can do, but Alberta can’t</a>"
4,Marco Rubio: America is not interested in polite managed decline of the West,https://nationalpost.com/opinion/marco-rubio-america-is-not-interested-in-polite-managed-decline-of-the-west,"<a href=""https://nationalpost.com/opinion/marco-rubio-america-is-not-interested-in-polite-managed-decline-of-the-west"">Marco Rubio: America is not interested in polite managed decline of the West</a>"
5,Subscriber only.John Ivison: Let the turf war over Carney’s defence-spending bonanza begin,https://nationalpost.com/opinion/ivison-mark-carneys-defence-spending-bonanza-begin,"<a href=""https://nationalpost.com/opinion/ivison-mark-carneys-defence-spending-bonanza-begin"">Subscriber only.John Ivison: Let the turf war over Carney’s defence-spending bonanza begin</a>"
