Rank,Article title,url,title_with_link
1,'Don't go downtown!' Inside Canada's small-town homeless catastrophe,https://nationalpost.com/feature/canadas-small-town-homeless-crisis,"<a href=""https://nationalpost.com/feature/canadas-small-town-homeless-crisis"">'Don't go downtown!' Inside Canada's small-town homeless catastrophe</a>"
2,"As the floor-crossing dust settles, Conservatives are bracing for more defections",https://nationalpost.com/news/politics/as-the-floor-crossing-dust-settles-conservatives-are-bracing-for-more-defections,"<a href=""https://nationalpost.com/news/politics/as-the-floor-crossing-dust-settles-conservatives-are-bracing-for-more-defections"">As the floor-crossing dust settles, Conservatives are bracing for more defections</a>"
3,"Carson Jerema: Holy cow, Michael Ma is shameless",https://nationalpost.com/opinion/holy-cow-michael-ma-is-shameless,"<a href=""https://nationalpost.com/opinion/holy-cow-michael-ma-is-shameless"">Carson Jerema: Holy cow, Michael Ma is shameless</a>"
4,"Despite quibbles with Conservative pipeline motion, Danielle Smith endorses Poilievre ahead of leadership review",https://nationalpost.com/news/canada/despite-quibbles-with-conservative-pipeline-motion-danielle-smith-endorses-poilievre-ahead-of-leadership-review,"<a href=""https://nationalpost.com/news/canada/despite-quibbles-with-conservative-pipeline-motion-danielle-smith-endorses-poilievre-ahead-of-leadership-review"">Despite quibbles with Conservative pipeline motion, Danielle Smith endorses Poilievre ahead of leadership review</a>"
5,Toronto woman says Uber driver refused to take her home after she spoke Hebrew,https://nationalpost.com/news/canada/toronto-uber-refused-hebrew,"<a href=""https://nationalpost.com/news/canada/toronto-uber-refused-hebrew"">Toronto woman says Uber driver refused to take her home after she spoke Hebrew</a>"
