Rank,Article title,url,title_with_link
1,Canadian Dental Care Plan coverage requires renewal by June 1. Here's what you should know,https://nationalpost.com/news/canada/canadian-dental-care-plan-coverage-requires-renewal-by-june-1-heres-what-you-should-know,"<a href=""https://nationalpost.com/news/canada/canadian-dental-care-plan-coverage-requires-renewal-by-june-1-heres-what-you-should-know"">Canadian Dental Care Plan coverage requires renewal by June 1. Here's what you should know</a>"
2,Map reveals the postcodes losing Canada Post door-to-door delivery this year,https://nationalpost.com/news/canada/map-reveals-the-postcodes-losing-canada-post-door-to-door-delivery-this-year,"<a href=""https://nationalpost.com/news/canada/map-reveals-the-postcodes-losing-canada-post-door-to-door-delivery-this-year"">Map reveals the postcodes losing Canada Post door-to-door delivery this year</a>"
3,Carson Jerema: How Justin Trudeau cost Canada $1 trillion,https://nationalpost.com/opinion/carson-jerema-how-justin-trudeau-cost-canada-1-trillion,"<a href=""https://nationalpost.com/opinion/carson-jerema-how-justin-trudeau-cost-canada-1-trillion"">Carson Jerema: How Justin Trudeau cost Canada $1 trillion</a>"
4,'We need to reassess': The evolution of one gender care doctor,https://nationalpost.com/news/canada/evolution-transgender-care-doctor,"<a href=""https://nationalpost.com/news/canada/evolution-transgender-care-doctor"">'We need to reassess': The evolution of one gender care doctor</a>"
5,FIRST READING: Skyrocketing provincial and federal debt set to hit 100 per cent of GDP,https://nationalpost.com/opinion/skyrocketing-provincial-federal-debt-set-to-hit-100-per-cent-of-gdp,"<a href=""https://nationalpost.com/opinion/skyrocketing-provincial-federal-debt-set-to-hit-100-per-cent-of-gdp"">FIRST READING: Skyrocketing provincial and federal debt set to hit 100 per cent of GDP</a>"
