Rank,Article title,url,title_with_link
1,Ford wants changes after man living illegally in Canada found eligible for Ontario welfare,https://nationalpost.com/news/canada/ford-wants-changes-after-man-living-illegally-in-canada-found-eligible-for-ontario-welfare,"<a href=""https://nationalpost.com/news/canada/ford-wants-changes-after-man-living-illegally-in-canada-found-eligible-for-ontario-welfare"">Ford wants changes after man living illegally in Canada found eligible for Ontario welfare</a>"
2,Did Carney sign an 'awful' Gordie Howe Bridge deal? PM insists new agreement a good one,https://nationalpost.com/news/carney-calls-gordie-howe-bridge-agreement-a-good-deal-for-canada-not-much-profits-to-split-with-the-u-s,"<a href=""https://nationalpost.com/news/carney-calls-gordie-howe-bridge-agreement-a-good-deal-for-canada-not-much-profits-to-split-with-the-u-s"">Did Carney sign an 'awful' Gordie Howe Bridge deal? PM insists new agreement a good one</a>"
3,Carney’s deputy chief of staff quits to seek Liberal nomination in B.C.,https://nationalpost.com/news/carneys-deputy-chief-of-staff-quits-to-seek-liberal-nomination-in-b-c,"<a href=""https://nationalpost.com/news/carneys-deputy-chief-of-staff-quits-to-seek-liberal-nomination-in-b-c"">Carney’s deputy chief of staff quits to seek Liberal nomination in B.C.</a>"
4,Subscriber only.John Ivison: Trump’s Gordie Howe victory lap is the model for making deals with him,https://nationalpost.com/opinion/john-ivison-trumps-gordie-howe-victory-lap-is-the-model-for-making-deals-with-him,"<a href=""https://nationalpost.com/opinion/john-ivison-trumps-gordie-howe-victory-lap-is-the-model-for-making-deals-with-him"">Subscriber only.John Ivison: Trump’s Gordie Howe victory lap is the model for making deals with him</a>"
5,Canada's going to need to use its aging secondhand British subs for another decade,https://nationalpost.com/news/canada/royal-canadian-navy-victoria-class-submarines,"<a href=""https://nationalpost.com/news/canada/royal-canadian-navy-victoria-class-submarines"">Canada's going to need to use its aging secondhand British subs for another decade</a>"
