Rank,Article title,url,title_with_link
1,Syrian refugee found not criminally responsible for failing to stop after deadly Ontario crash gets absolute discharge,https://nationalpost.com/news/canada/syrian-refugee-ncr-hamilton-crash-absolute-discharge,"<a href=""https://nationalpost.com/news/canada/syrian-refugee-ncr-hamilton-crash-absolute-discharge"">Syrian refugee found not criminally responsible for failing to stop after deadly Ontario crash gets absolute discharge</a>"
2,Iran official urges young people to form human shields around power plants ahead of Trump's 8 p.m. ET deadline,https://nationalpost.com/news/world/israel-middle-east/iran-donald-trump-deadline,"<a href=""https://nationalpost.com/news/world/israel-middle-east/iran-donald-trump-deadline"">Iran official urges young people to form human shields around power plants ahead of Trump's 8 p.m. ET deadline</a>"
3,Chris Selley: The Liberals' high-speed rail fantasy just gets greasier,https://nationalpost.com/opinion/chris-selley-the-liberals-high-speed-rail-fantasy-just-gets-greasier,"<a href=""https://nationalpost.com/opinion/chris-selley-the-liberals-high-speed-rail-fantasy-just-gets-greasier"">Chris Selley: The Liberals' high-speed rail fantasy just gets greasier</a>"
4,Alberta rebukes $3.8 billion federal nature strategy,https://nationalpost.com/news/canada/alberta-rebukes-federal-nature-strategy,"<a href=""https://nationalpost.com/news/canada/alberta-rebukes-federal-nature-strategy"">Alberta rebukes $3.8 billion federal nature strategy</a>"
5,Carney defends minister's connection to rail project as Tories call for investigation,https://nationalpost.com/news/politics/carney-defends-ministers-connection-to-rail-project-as-tories-call-for-investigation,"<a href=""https://nationalpost.com/news/politics/carney-defends-ministers-connection-to-rail-project-as-tories-call-for-investigation"">Carney defends minister's connection to rail project as Tories call for investigation</a>"
