Rank,Article title,url,title_with_link
1,Teen working at Tim Hortons allegedly offered $20K marriage proposal by manager for permanent residency,https://nationalpost.com/news/canada/picton-tim-hortons-marriage-fraud?itm_source=trending,"<a href=""https://nationalpost.com/news/canada/picton-tim-hortons-marriage-fraud?itm_source=trending"">Teen working at Tim Hortons allegedly offered $20K marriage proposal by manager for permanent residency</a>"
2,NDP leadership candidate McPherson stands by 'purity test' remarks after criticism from fellow MP,https://nationalpost.com/news/canada/ndp-leadership-candidate-mcpherson-stands-by-purity-test-remarks-after-criticism-fellow-mp?itm_source=trending,"<a href=""https://nationalpost.com/news/canada/ndp-leadership-candidate-mcpherson-stands-by-purity-test-remarks-after-criticism-fellow-mp?itm_source=trending"">NDP leadership candidate McPherson stands by 'purity test' remarks after criticism from fellow MP</a>"
3,Alberta separatists boast cabinet-level meeting with Trump administration,https://nationalpost.com/news/alberta-separatists-boast-cabinet-level-meeting-with-trump-administration?itm_source=trending,"<a href=""https://nationalpost.com/news/alberta-separatists-boast-cabinet-level-meeting-with-trump-administration?itm_source=trending"">Alberta separatists boast cabinet-level meeting with Trump administration</a>"
4,"U.S. government shutdown: Canadians should expect delays and long wait times at airports, experts warn",https://nationalpost.com/news/canada/u-s-government-shutdown-canadians?itm_source=trending,"<a href=""https://nationalpost.com/news/canada/u-s-government-shutdown-canadians?itm_source=trending"">U.S. government shutdown: Canadians should expect delays and long wait times at airports, experts warn</a>"
5,FIRST READING: Canadian bill would strip internet access from 'specified persons',https://nationalpost.com/opinion/canadian-bill-would-strip-internet-access-from-specified-persons?itm_source=trending,"<a href=""https://nationalpost.com/opinion/canadian-bill-would-strip-internet-access-from-specified-persons?itm_source=trending"">FIRST READING: Canadian bill would strip internet access from 'specified persons'</a>"
