Rank,Article title,url,title_with_link
1,Canadian snowbirds turning their backs on U.S. as a winter destination: poll,https://nationalpost.com/news/canada/canadian-snowbirds-turning-their-backs-on-u-s-as-a-winter-destination-poll,"<a href=""https://nationalpost.com/news/canada/canadian-snowbirds-turning-their-backs-on-u-s-as-a-winter-destination-poll"">Canadian snowbirds turning their backs on U.S. as a winter destination: poll</a>"
2,FIRST READING: A brief history of Carney’s unfulfilled trade promises,https://nationalpost.com/opinion/brief-history-of-carneys-unfulfilled-trade-promises,"<a href=""https://nationalpost.com/opinion/brief-history-of-carneys-unfulfilled-trade-promises"">FIRST READING: A brief history of Carney’s unfulfilled trade promises</a>"
3,Bruce Pardy: Eby bringing B.C. to its knees with Aboriginal land deals,https://nationalpost.com/opinion/eby-bringing-b-c-to-its-knees-with-aboriginal-land-deals,"<a href=""https://nationalpost.com/opinion/eby-bringing-b-c-to-its-knees-with-aboriginal-land-deals"">Bruce Pardy: Eby bringing B.C. to its knees with Aboriginal land deals</a>"
4,Jesse Kline: Avi Lewis tries to silence Zionist groups with 'CIJA Report',https://nationalpost.com/opinion/avi-lewis-tries-to-silence-zionist-groups-with-cija-report,"<a href=""https://nationalpost.com/opinion/avi-lewis-tries-to-silence-zionist-groups-with-cija-report"">Jesse Kline: Avi Lewis tries to silence Zionist groups with 'CIJA Report'</a>"
5,"Climate policies, AI demand and tariffs collide as U.S. electric bills soar",https://nationalpost.com/news/climate-policies-ai-demand-and-tariffs-collide-as-u-s-electric-bills-soar,"<a href=""https://nationalpost.com/news/climate-policies-ai-demand-and-tariffs-collide-as-u-s-electric-bills-soar"">Climate policies, AI demand and tariffs collide as U.S. electric bills soar</a>"
