Rank,Article title,url,title_with_link
1,"BREAKING: Ozzy Osbourne dies at 76, just weeks after his farewell show",https://nationalpost.com/news/world/singer-ozzy-osbourne-dies,"<a href=""https://nationalpost.com/news/world/singer-ozzy-osbourne-dies"">BREAKING: Ozzy Osbourne dies at 76, just weeks after his farewell show</a>"
2,Kelly McParland: Epstein scandal is the essence of Trump,https://nationalpost.com/opinion/kelly-mcparland-epstein-scandal-is-the-essence-of-trump,"<a href=""https://nationalpost.com/opinion/kelly-mcparland-epstein-scandal-is-the-essence-of-trump"">Kelly McParland: Epstein scandal is the essence of Trump</a>"
3,Carney says he'll only take 'best deal' from U.S. as premiers disagree over retaliation,https://nationalpost.com/news/mark-carney-premiers-meeting-us-trade,"<a href=""https://nationalpost.com/news/mark-carney-premiers-meeting-us-trade"">Carney says he'll only take 'best deal' from U.S. as premiers disagree over retaliation</a>"
4,"Who is Luciano Frattolin, the Montreal father accused of murdering his daughter?",https://nationalpost.com/news/canada/who-is-luciano-frattolin-the-montreal-father-accused-of-murdering-his-daughter,"<a href=""https://nationalpost.com/news/canada/who-is-luciano-frattolin-the-montreal-father-accused-of-murdering-his-daughter"">Who is Luciano Frattolin, the Montreal father accused of murdering his daughter?</a>"
5,Tourist visiting Canada stuck in CN Tower elevator for 40 mins: 'What if it falls?',https://nationalpost.com/news/canada/cn-tower-elevator-stuck-toronto,"<a href=""https://nationalpost.com/news/canada/cn-tower-elevator-stuck-toronto"">Tourist visiting Canada stuck in CN Tower elevator for 40 mins: 'What if it falls?'</a>"
