Rank,Article title,url,title_with_link
1,"Canadian with an American spouse could raise a red flag at the U.S.-Canada border, lawyer says",https://nationalpost.com/news/canada/canadian-american-travel-red-flags-lawyer,"<a href=""https://nationalpost.com/news/canada/canadian-american-travel-red-flags-lawyer"">Canadian with an American spouse could raise a red flag at the U.S.-Canada border, lawyer says</a>"
2,"Service Canada offers limited apology, 'no accountability' for telling Jewish Montrealer she couldn't name Israel as birth country",https://nationalpost.com/news/canada/service-canada-offers-limited-apology-no-accountability-for-telling-jewish-montrealer-she-couldnt-name-israel-as-birth-country,"<a href=""https://nationalpost.com/news/canada/service-canada-offers-limited-apology-no-accountability-for-telling-jewish-montrealer-she-couldnt-name-israel-as-birth-country"">Service Canada offers limited apology, 'no accountability' for telling Jewish Montrealer she couldn't name Israel as birth country</a>"
3,"Chris Selley: Marc Miller, renegade heritage minister",https://nationalpost.com/opinion/selley-marc-miller-renegade-heritage-minister,"<a href=""https://nationalpost.com/opinion/selley-marc-miller-renegade-heritage-minister"">Chris Selley: Marc Miller, renegade heritage minister</a>"
4,"Judges sue federal government over decision to refuse $28,000 raise",https://nationalpost.com/news/politics/judges-sue-government-over-decision-to-refuse-28000-raise,"<a href=""https://nationalpost.com/news/politics/judges-sue-government-over-decision-to-refuse-28000-raise"">Judges sue federal government over decision to refuse $28,000 raise</a>"
5,MP outraged after man who raped an Ontario girl given time to consider how guilty plea would affect immigration status,https://nationalpost.com/news/canada/mp-outraged-non-citizen-immigration-sentencing,"<a href=""https://nationalpost.com/news/canada/mp-outraged-non-citizen-immigration-sentencing"">MP outraged after man who raped an Ontario girl given time to consider how guilty plea would affect immigration status</a>"
