Rank,Article title,url,title_with_link
1,"J.D. Tuccille: Trump's auto tariffs are soaking American buyers, and it is getting worse",https://nationalpost.com/opinion/j-d-tuccille-trumps-auto-tariffs-are-soaking-american-buyers-and-it-is-getting-worse,"<a href=""https://nationalpost.com/opinion/j-d-tuccille-trumps-auto-tariffs-are-soaking-american-buyers-and-it-is-getting-worse"">J.D. Tuccille: Trump's auto tariffs are soaking American buyers, and it is getting worse</a>"
2,The Anti-Eby: Caroline Elliott's pitch to B.C. Conservatives,https://nationalpost.com/news/anti-david-eby-caroline-elliot-b-c-conservatives,"<a href=""https://nationalpost.com/news/anti-david-eby-caroline-elliot-b-c-conservatives"">The Anti-Eby: Caroline Elliott's pitch to B.C. Conservatives</a>"
3,Government to pay $8.7M to Canadians affected by CRA data breach. Here’s how to check if you qualify,https://nationalpost.com/news/canada/government-to-pay-8-7m-to-canadians-affected-by-cra-data-breach-heres-how-to-check-if-you-qualify,"<a href=""https://nationalpost.com/news/canada/government-to-pay-8-7m-to-canadians-affected-by-cra-data-breach-heres-how-to-check-if-you-qualify"">Government to pay $8.7M to Canadians affected by CRA data breach. Here’s how to check if you qualify</a>"
4,"Trump goes and a Democrat occupies the White House? Carney still leads, poll says",https://nationalpost.com/news/trump-goes-and-a-democrat-occupies-the-white-house-carney-still-leads-poll-says,"<a href=""https://nationalpost.com/news/trump-goes-and-a-democrat-occupies-the-white-house-carney-still-leads-poll-says"">Trump goes and a Democrat occupies the White House? Carney still leads, poll says</a>"
5,It's Canada census time. Can you be jailed for not filling it out?,https://nationalpost.com/news/canada/its-canada-census-time-can-you-be-jailed-for-not-filling-it-out,"<a href=""https://nationalpost.com/news/canada/its-canada-census-time-can-you-be-jailed-for-not-filling-it-out"">It's Canada census time. Can you be jailed for not filling it out?</a>"
