Rank,Article title,url,title_with_link
1,U of T prof who made shooting comment after Charlie Kirk assassination now on leave,https://nationalpost.com/news/toronto/university-toronto-ruth-marshall-social-media-charlie-kirk-assassination?itm_source=trending,"<a href=""https://nationalpost.com/news/toronto/university-toronto-ruth-marshall-social-media-charlie-kirk-assassination?itm_source=trending"">U of T prof who made shooting comment after Charlie Kirk assassination now on leave</a>"
2,"'We got him': Tyler Robinson, 22, 'confessed' to family that he killed Charlie Kirk, officials say",https://nationalpost.com/news/world/charlie-kirk-gunman?itm_source=trending,"<a href=""https://nationalpost.com/news/world/charlie-kirk-gunman?itm_source=trending"">'We got him': Tyler Robinson, 22, 'confessed' to family that he killed Charlie Kirk, officials say</a>"
3,Judge goes easy on woman who attacked Ottawa senior couple so she can keep job with kids,https://nationalpost.com/news/canada/educational-assistant-who-injured-seniors-granted-conditional-discharge?itm_source=trending,"<a href=""https://nationalpost.com/news/canada/educational-assistant-who-injured-seniors-granted-conditional-discharge?itm_source=trending"">Judge goes easy on woman who attacked Ottawa senior couple so she can keep job with kids</a>"
4,Charlie Kirk's final post online was about Iryna Zarutska's 'senseless murder',https://nationalpost.com/news/world/charlie-kirk-assassination-suspect?itm_source=trending,"<a href=""https://nationalpost.com/news/world/charlie-kirk-assassination-suspect?itm_source=trending"">Charlie Kirk's final post online was about Iryna Zarutska's 'senseless murder'</a>"
5,Michael Higgins: Mark Carney's Major Projects Office is a fraud,https://nationalpost.com/opinion/michael-higgins-mark-carneys-major-projects-office-is-a-fraud?itm_source=trending,"<a href=""https://nationalpost.com/opinion/michael-higgins-mark-carneys-major-projects-office-is-a-fraud?itm_source=trending"">Michael Higgins: Mark Carney's Major Projects Office is a fraud</a>"
