Rank,Article title,url,title_with_link
1,"Hoekstra warns about meddling in U.S. politics, doesn't understand why Canadians are mad about the '51st state'",https://nationalpost.com/news/canada/hoekstra-warns-about-meddling-in-u-s-politics-doesnt-understand-why-canadians-are-mad-about-the-51st-state,"<a href=""https://nationalpost.com/news/canada/hoekstra-warns-about-meddling-in-u-s-politics-doesnt-understand-why-canadians-are-mad-about-the-51st-state"">Hoekstra warns about meddling in U.S. politics, doesn't understand why Canadians are mad about the '51st state'</a>"
2,Carney's chief of staff draws rebuke for comparing prime minister's ethics screen to Nigel Wright,https://nationalpost.com/news/carneys-chief-of-staff-draws-rebuke-for-comparing-prime-ministers-ethics-screen-to-nigel-wright,"<a href=""https://nationalpost.com/news/carneys-chief-of-staff-draws-rebuke-for-comparing-prime-ministers-ethics-screen-to-nigel-wright"">Carney's chief of staff draws rebuke for comparing prime minister's ethics screen to Nigel Wright</a>"
3,Amy Hamm: Sydney Sweeney won't apologize to the woke mob,https://nationalpost.com/opinion/amy-hamm-sydney-sweeney-wont-apologize-to-the-woke-mob,"<a href=""https://nationalpost.com/opinion/amy-hamm-sydney-sweeney-wont-apologize-to-the-woke-mob"">Amy Hamm: Sydney Sweeney won't apologize to the woke mob</a>"
4,Canadian Museum for Human Rights has become 'tool' of one side of the Arab-Israeli story: David Asper,https://nationalpost.com/news/canada/canadian-museum-for-human-rights-has-become-tool-of-one-side-of-the-arab-israeli-story-david-asper,"<a href=""https://nationalpost.com/news/canada/canadian-museum-for-human-rights-has-become-tool-of-one-side-of-the-arab-israeli-story-david-asper"">Canadian Museum for Human Rights has become 'tool' of one side of the Arab-Israeli story: David Asper</a>"
5,Chrystia Freeland will be moving to U.K. after being named CEO of Rhodes Trust,https://nationalpost.com/news/canada/chrystia-freeland-rhodes-warden-ceo,"<a href=""https://nationalpost.com/news/canada/chrystia-freeland-rhodes-warden-ceo"">Chrystia Freeland will be moving to U.K. after being named CEO of Rhodes Trust</a>"
