Rank,Article title,url,title_with_link
1,"Burner phones, security warnings and no 'megaphones': How Carney's trip to Beijing struck a surprising new tone with China",https://nationalpost.com/news/politics/burner-phones-security-warnings-and-no-megaphones-how-carneys-trip-to-beijing-struck-a-surprising-new-tone-with-china,"<a href=""https://nationalpost.com/news/politics/burner-phones-security-warnings-and-no-megaphones-how-carneys-trip-to-beijing-struck-a-surprising-new-tone-with-china"">Burner phones, security warnings and no 'megaphones': How Carney's trip to Beijing struck a surprising new tone with China</a>"
2,The bizarre reason Greenland was colonized by Denmark,https://nationalpost.com/opinion/greenland-denmark-vikings-reformation,"<a href=""https://nationalpost.com/opinion/greenland-denmark-vikings-reformation"">The bizarre reason Greenland was colonized by Denmark</a>"
3,Amy Hamm: Ozempic is the end of fat activism,https://nationalpost.com/opinion/amy-hamm-ozempic-is-the-end-of-fat-activism,"<a href=""https://nationalpost.com/opinion/amy-hamm-ozempic-is-the-end-of-fat-activism"">Amy Hamm: Ozempic is the end of fat activism</a>"
4,'The deadlines are real': Feds launch firearms 'buyback' with March deadline for compensation,https://nationalpost.com/news/canada/the-deadlines-are-real-feds-launch-firearms-buyback-with-march-deadline-for-compensation,"<a href=""https://nationalpost.com/news/canada/the-deadlines-are-real-feds-launch-firearms-buyback-with-march-deadline-for-compensation"">'The deadlines are real': Feds launch firearms 'buyback' with March deadline for compensation</a>"
5,André Pratte: Why Quebec separatists are embracing the Trump factor,https://nationalpost.com/opinion/andre-pratte-why-quebec-separatists-are-embracing-the-trump-factor,"<a href=""https://nationalpost.com/opinion/andre-pratte-why-quebec-separatists-are-embracing-the-trump-factor"">André Pratte: Why Quebec separatists are embracing the Trump factor</a>"
