Rank,Article title,url,title_with_link
1,"Canada Post carrier fired for hoarding 6,000 pieces of mail gets his job back",https://nationalpost.com/news/canada/canada-post-carrier-fired-for-hoarding-6000-pieces-of-mail-gets-his-job-back,"<a href=""https://nationalpost.com/news/canada/canada-post-carrier-fired-for-hoarding-6000-pieces-of-mail-gets-his-job-back"">Canada Post carrier fired for hoarding 6,000 pieces of mail gets his job back</a>"
2,"MP's petition to investigate Canadians who served in IDF is 'antisemitic witch hunt,' Jewish group says",https://nationalpost.com/news/canada/jewish-groups-condemn-petition-canadians-idf,"<a href=""https://nationalpost.com/news/canada/jewish-groups-condemn-petition-canadians-idf"">MP's petition to investigate Canadians who served in IDF is 'antisemitic witch hunt,' Jewish group says</a>"
3,Former Canadian politician emerges as key cheerleader for new Iranian revolution,https://nationalpost.com/news/world/former-canadian-politician-emerges-as-key-cheerleader-for-new-iranian-revolution,"<a href=""https://nationalpost.com/news/world/former-canadian-politician-emerges-as-key-cheerleader-for-new-iranian-revolution"">Former Canadian politician emerges as key cheerleader for new Iranian revolution</a>"
4,Colby Cosh: The 'right to bike lanes' mocks the Charter,https://nationalpost.com/opinion/colby-cosh-the-right-to-bike-lanes-mocks-the-charter,"<a href=""https://nationalpost.com/opinion/colby-cosh-the-right-to-bike-lanes-mocks-the-charter"">Colby Cosh: The 'right to bike lanes' mocks the Charter</a>"
5,Michael Taube: Don Cherry's tough love for Canada,https://nationalpost.com/opinion/michael-taube-don-cherrys-tough-love-for-canada,"<a href=""https://nationalpost.com/opinion/michael-taube-don-cherrys-tough-love-for-canada"">Michael Taube: Don Cherry's tough love for Canada</a>"
