Rank,Article title,url,title_with_link
1,"FIRST READING: U.S. youth identifying as non binary is in freefall, says Canadian researcher",https://nationalpost.com/opinion/youth-identifying-as-non-binary-is-in-freefall-says-canadian-researcher?itm_source=trending,"<a href=""https://nationalpost.com/opinion/youth-identifying-as-non-binary-is-in-freefall-says-canadian-researcher?itm_source=trending"">FIRST READING: U.S. youth identifying as non binary is in freefall, says Canadian researcher</a>"
2,Terry Newman: Concordia tight-lipped on 'kill them all' post about 'Zionists',https://nationalpost.com/opinion/terry-newman-concordia-decries-calls-to-violence-after-kill-them-all-post-about-zionists?itm_source=trending,"<a href=""https://nationalpost.com/opinion/terry-newman-concordia-decries-calls-to-violence-after-kill-them-all-post-about-zionists?itm_source=trending"">Terry Newman: Concordia tight-lipped on 'kill them all' post about 'Zionists'</a>"
3,"Public grocery stores unlikely to bring down food prices, say economists and analysts",https://nationalpost.com/news/canada/public-grocery-stores-unlikely-to-bring-down-food-prices-say-economists-and-analysts?itm_source=trending,"<a href=""https://nationalpost.com/news/canada/public-grocery-stores-unlikely-to-bring-down-food-prices-say-economists-and-analysts?itm_source=trending"">Public grocery stores unlikely to bring down food prices, say economists and analysts</a>"
4,Jamie Sarkonak: Danielle Smith's pipeline is Carney's to kill,https://nationalpost.com/opinion/jamie-sarkonak-danielle-smiths-pipeline-is-carneys-to-kill?itm_source=trending,"<a href=""https://nationalpost.com/opinion/jamie-sarkonak-danielle-smiths-pipeline-is-carneys-to-kill?itm_source=trending"">Jamie Sarkonak: Danielle Smith's pipeline is Carney's to kill</a>"
5,FIRST READING: How postal workers lost Canadians,https://nationalpost.com/opinion/how-postal-workers-lost-canadians?itm_source=trending,"<a href=""https://nationalpost.com/opinion/how-postal-workers-lost-canadians?itm_source=trending"">FIRST READING: How postal workers lost Canadians</a>"
