Rank,Article title,url,title_with_link
1,Separation speed bump: Negotiating with First Nations,https://nationalpost.com/news/indigenous-peoples-secession,"<a href=""https://nationalpost.com/news/indigenous-peoples-secession"">Separation speed bump: Negotiating with First Nations</a>"
2,Jerry Amernic: Canada's two-tier historical memory: Egerton Ryerson and Joseph Brant,https://nationalpost.com/opinion/jerry-amernic-canadas-two-tier-historical-memory-egerton-ryerson-and-joseph-brant,"<a href=""https://nationalpost.com/opinion/jerry-amernic-canadas-two-tier-historical-memory-egerton-ryerson-and-joseph-brant"">Jerry Amernic: Canada's two-tier historical memory: Egerton Ryerson and Joseph Brant</a>"
3,"'The risk is real': Two tigers must be removed from residential property, says mayor of Ontario town",https://nationalpost.com/news/canada/tigers-wainfleet-ontario,"<a href=""https://nationalpost.com/news/canada/tigers-wainfleet-ontario"">'The risk is real': Two tigers must be removed from residential property, says mayor of Ontario town</a>"
4,Poilievre makes 'dollar-for-dollar' tariff policy pitch to U.S. automakers,https://nationalpost.com/news/canada/pierre-poilievre-tariff-pitch-u-s-automakers,"<a href=""https://nationalpost.com/news/canada/pierre-poilievre-tariff-pitch-u-s-automakers"">Poilievre makes 'dollar-for-dollar' tariff policy pitch to U.S. automakers</a>"
5,‘Her body was not there’: Mother describes finding daughter's charred remains in Halifax Walmart oven,https://nationalpost.com/news/halifax-walmart-oven-charred-remains-daughter-mother,"<a href=""https://nationalpost.com/news/halifax-walmart-oven-charred-remains-daughter-mother"">‘Her body was not there’: Mother describes finding daughter's charred remains in Halifax Walmart oven</a>"
