Rank,Article title,url,title_with_link
1,Three men accused of hunting women and Jews on Toronto streets as part of hate plot,https://nationalpost.com/news/canada/toronto-jewish-community-hate-motivated-crimes-terrorism,"<a href=""https://nationalpost.com/news/canada/toronto-jewish-community-hate-motivated-crimes-terrorism"">Three men accused of hunting women and Jews on Toronto streets as part of hate plot</a>"
2,Canadians to get two federal payments early this month. Here's what to know about your CPP and OAS benefits,https://nationalpost.com/news/cpp-oas-payments-canada-early,"<a href=""https://nationalpost.com/news/cpp-oas-payments-canada-early"">Canadians to get two federal payments early this month. Here's what to know about your CPP and OAS benefits</a>"
3,Counterpoint: Canada has a duty to make up for the historical dispossession of Indigenous people,https://nationalpost.com/opinion/canada-has-a-duty-to-make-up-for-the-historical-dispossession-of-indigenous-people,"<a href=""https://nationalpost.com/opinion/canada-has-a-duty-to-make-up-for-the-historical-dispossession-of-indigenous-people"">Counterpoint: Canada has a duty to make up for the historical dispossession of Indigenous people</a>"
4,FIRST READING: The Liberal scandal that may have just guaranteed a third Quebec referendum,https://nationalpost.com/opinion/the-liberal-scandal-that-may-have-just-guaranteed-a-third-quebec-referendum,"<a href=""https://nationalpost.com/opinion/the-liberal-scandal-that-may-have-just-guaranteed-a-third-quebec-referendum"">FIRST READING: The Liberal scandal that may have just guaranteed a third Quebec referendum</a>"
5,New CRA tax changes could mean more money for Canadians. Here's what to know,https://nationalpost.com/news/canada/canadian-taxes-in-2026,"<a href=""https://nationalpost.com/news/canada/canadian-taxes-in-2026"">New CRA tax changes could mean more money for Canadians. Here's what to know</a>"
