Rank,Article title,url,title_with_link
1,Top government official says she was promoting 'diversity and inclusion' when she broke hiring rules,https://nationalpost.com/news/canada/top-government-official-says-she-was-promoting-diversity-and-inclusion-when-she-broke-hiring-rules,"<a href=""https://nationalpost.com/news/canada/top-government-official-says-she-was-promoting-diversity-and-inclusion-when-she-broke-hiring-rules"">Top government official says she was promoting 'diversity and inclusion' when she broke hiring rules</a>"
2,Canadians travelling to Europe to submit biometric data as new border checks come into effect today,https://nationalpost.com/news/canadians-travelling-to-europe-face-new-rules-and-delays,"<a href=""https://nationalpost.com/news/canadians-travelling-to-europe-face-new-rules-and-delays"">Canadians travelling to Europe to submit biometric data as new border checks come into effect today</a>"
3,Here's how much the Artemis II astronauts are likely getting paid,https://nationalpost.com/news/space/artemis-ii-astronauts-salaries,"<a href=""https://nationalpost.com/news/space/artemis-ii-astronauts-salaries"">Here's how much the Artemis II astronauts are likely getting paid</a>"
4,Former law school dean wanted on Canada-wide arrest warrant now disbarred in U.K.,https://nationalpost.com/news/canada/former-law-school-dean-wanted-on-canada-wide-arrest-warrant-now-disbarred-in-u-k,"<a href=""https://nationalpost.com/news/canada/former-law-school-dean-wanted-on-canada-wide-arrest-warrant-now-disbarred-in-u-k"">Former law school dean wanted on Canada-wide arrest warrant now disbarred in U.K.</a>"
5,FIRST READING: Iranian-Canadian activist threatened with criminal charges for posts,https://nationalpost.com/opinion/iranian-canadian-activist-threatened-with-criminal-charges-for-posts,"<a href=""https://nationalpost.com/opinion/iranian-canadian-activist-threatened-with-criminal-charges-for-posts"">FIRST READING: Iranian-Canadian activist threatened with criminal charges for posts</a>"
