Rank,Article title,url,title_with_link
1,"Canadians hate being called the 51st state. But they don't mind moving south of the border, study says",https://nationalpost.com/news/canadians-hate-being-called-the-51st-state-but-they-dont-mind-moving-south-of-the-border-study-says,"<a href=""https://nationalpost.com/news/canadians-hate-being-called-the-51st-state-but-they-dont-mind-moving-south-of-the-border-study-says"">Canadians hate being called the 51st state. But they don't mind moving south of the border, study says</a>"
2,Kate Marland: Anti-family propaganda has devastated a generation of women,https://nationalpost.com/opinion/kate-marland-no-having-children-is-not-for-losers,"<a href=""https://nationalpost.com/opinion/kate-marland-no-having-children-is-not-for-losers"">Kate Marland: Anti-family propaganda has devastated a generation of women</a>"
3,Judge gives repeat LCBO thief a harsher sentence because he doubts CBSA will deport him,https://nationalpost.com/news/canada/judge-gives-repeat-lcbo-thief-a-harsher-sentence-because-he-doubts-cbsa-will-deport-him,"<a href=""https://nationalpost.com/news/canada/judge-gives-repeat-lcbo-thief-a-harsher-sentence-because-he-doubts-cbsa-will-deport-him"">Judge gives repeat LCBO thief a harsher sentence because he doubts CBSA will deport him</a>"
4,'Bloodbath for sellers': Tales from the frontlines of Toronto's condopocalypse,https://nationalpost.com/feature/toronto-condo-correction-fortunes-lost/wcm/1e6075e9-8373-4228-a854-d634ab5f6288,"<a href=""https://nationalpost.com/feature/toronto-condo-correction-fortunes-lost/wcm/1e6075e9-8373-4228-a854-d634ab5f6288"">'Bloodbath for sellers': Tales from the frontlines of Toronto's condopocalypse</a>"
5,What we know (and don't) about Canada's 'tightly guarded secret' gift for America's 250th birthday,https://nationalpost.com/news/what-we-know-about-canadas-secret-gift-for-americas-250th-birthday,"<a href=""https://nationalpost.com/news/what-we-know-about-canadas-secret-gift-for-americas-250th-birthday"">What we know (and don't) about Canada's 'tightly guarded secret' gift for America's 250th birthday</a>"
