Rank,Article title,url,title_with_link
1,Damien Kurek: The Liberal plan to silence the House of Commons,https://nationalpost.com/opinion/damien-kurek-the-liberal-plan-to-silence-the-house-of-commons,"<a href=""https://nationalpost.com/opinion/damien-kurek-the-liberal-plan-to-silence-the-house-of-commons"">Damien Kurek: The Liberal plan to silence the House of Commons</a>"
2,Trade war thirst? Banning U.S. alcohol sales has reshaped Canadian palates,https://nationalpost.com/news/trade-war-thirst-banning-u-s-alcohol-sales-has-reshaped-canadian-palates,"<a href=""https://nationalpost.com/news/trade-war-thirst-banning-u-s-alcohol-sales-has-reshaped-canadian-palates"">Trade war thirst? Banning U.S. alcohol sales has reshaped Canadian palates</a>"
3,Subscriber only.FIRST READING: Floor-crossings are technically allowed? Here's what else is technically allowed,https://nationalpost.com/opinion/floor-crossings-are-technically-allowed-heres-what-else-is-technically-allowed,"<a href=""https://nationalpost.com/opinion/floor-crossings-are-technically-allowed-heres-what-else-is-technically-allowed"">Subscriber only.FIRST READING: Floor-crossings are technically allowed? Here's what else is technically allowed</a>"
4,Jordan Peterson in 'hellish' battle against 'old neurological injury': daughter,https://nationalpost.com/news/canada/jordan-peterson-in-hellish-battle-against-old-neurological-injury-daughter,"<a href=""https://nationalpost.com/news/canada/jordan-peterson-in-hellish-battle-against-old-neurological-injury-daughter"">Jordan Peterson in 'hellish' battle against 'old neurological injury': daughter</a>"
5,"Flights within Canada are getting more expensive in 2026, except for one destination",https://nationalpost.com/news/canada/how-much-airfares-cost-canada-2026,"<a href=""https://nationalpost.com/news/canada/how-much-airfares-cost-canada-2026"">Flights within Canada are getting more expensive in 2026, except for one destination</a>"
